{"run":120,"commit":"2100051","metric":1520,"metrics":{"readiness_gate_failures":0,"target_constants_remaining":0,"helpers_missing":0,"fixed_wait_predicates":0,"autoload_static_failures":0,"asset_chain_failures":0,"dll_patch_failures":0,"native_continue_failures":0,"field58_gate_failures":0,"direct_shortcut_failures":0,"input_path_failures":0,"runtime_proof_failures":1,"runtime_mode_failures":0,"eula_popup_failures":0,"save_data_popup_failures":0,"messagebox_dialog_failures":0,"server_status_failures":0,"title_cover_failures":0,"title_cover_penalty":0,"native_trace_blockers":0,"native_trace_hits_total":74,"native_trace_unique_breakpoints":11,"false_positives":0,"runtime_timeout_failures":0,"runtime_title_visual_suppressed_builds":0,"runtime_custom_cover_builds":0,"runtime_simulated_button_presses_total":0},"status":"discard","description":"corrected ContinueWrapper dump/deobf address mix-up and restored real callback semantics","timestamp":1782403314947,"segment":0,"confidence":null,"asi":{"hypothesis":"The save-error classification of 0x14082bac0 may be a dump/deobf address mix-up; verifying the shift should recover the real Continue callback semantics before choosing the next hook/path.","rollback_reason":"Primary metric 1520 matched but did not exceed the persisted best; iteration only recorded static RE correction/guidance.","next_action_hint":"Decode FUN_14067b840 versus FUN_14067b750 to confirm the native Continue-load wrapper/result path, and require dump-deobf-shift verification before classifying or patching 0x14082b* callbacks."}}
{"run":121,"commit":"2100051","metric":1520,"metrics":{"readiness_gate_failures":0,"target_constants_remaining":0,"helpers_missing":0,"fixed_wait_predicates":0,"autoload_static_failures":0,"asset_chain_failures":0,"dll_patch_failures":0,"native_continue_failures":0,"field58_gate_failures":0,"direct_shortcut_failures":0,"input_path_failures":0,"runtime_proof_failures":1,"runtime_mode_failures":0,"eula_popup_failures":0,"save_data_popup_failures":0,"messagebox_dialog_failures":0,"server_status_failures":0,"title_cover_failures":0,"title_cover_penalty":0,"native_trace_blockers":0,"native_trace_hits_total":74,"native_trace_unique_breakpoints":11,"false_positives":0,"runtime_timeout_failures":0,"runtime_title_visual_suppressed_builds":0,"runtime_custom_cover_builds":0,"runtime_simulated_button_presses_total":0},"status":"discard","description":"recorded corrected continue_load_67b750 semantics as native current-state snapshot/resource path","timestamp":1782403444702,"segment":0,"confidence":null,"asi":{"hypothesis":"Decoding FUN_14067b840 versus live/deobf continue_load_67b750 should confirm the corrected Continue callback's native target and whether it loads a real slot or snapshots current GameMan state.","rollback_reason":"Primary metric 1520 matched but did not exceed the persisted best; iteration only recorded static RE guidance.","next_action_hint":"Identify the upstream native state that makes GLOBAL_GameMan->saveSlot/current PGD/profile summary represent the real Continue target before FUN_14067b840. Do not force slot/ac0 or call LoadJobContext/ProfileLoad deserializer shortcuts."}}
{"run":122,"commit":"2100051","metric":1520,"metrics":{"readiness_gate_failures":0,"target_constants_remaining":0,"helpers_missing":0,"fixed_wait_predicates":0,"autoload_static_failures":0,"asset_chain_failures":0,"dll_patch_failures":0,"native_continue_failures":0,"field58_gate_failures":0,"direct_shortcut_failures":0,"input_path_failures":0,"runtime_proof_failures":1,"runtime_mode_failures":0,"eula_popup_failures":0,"save_data_popup_failures":0,"messagebox_dialog_failures":0,"server_status_failures":0,"title_cover_failures":0,"title_cover_penalty":0,"native_trace_blockers":0,"native_trace_hits_total":74,"native_trace_unique_breakpoints":11,"false_positives":0,"runtime_timeout_failures":0,"runtime_title_visual_suppressed_builds":0,"runtime_custom_cover_builds":0,"runtime_simulated_button_presses_total":0},"status":"discard","description":"recorded real SetSaveSlot and current-PGD/profile snapshot semantics for continue_load","timestamp":1782403572593,"segment":0,"confidence":null,"asi":{"hypothesis":"Identifying the upstream slot/profile state consumed by corrected continue_load_67b750 should reveal whether the selected Continue target is established by saveSlot, profile-summary initialization, or current MainPlayerGameData before the native callback runs.","rollback_reason":"Primary metric 1520 matched but did not exceed the persisted best; iteration only recorded static RE guidance.","next_action_hint":"Find callers/writers of CS::GameMan::SetSaveSlot at dump 0x14067a900 and the native initializer that makes current MainPlayerGameData/profile summary represent the real Continue target. Do not use 0x14067a810 as a slot setter or force saveSlot manually."}}
{"run":123,"commit":"2100051","metric":1520,"metrics":{"readiness_gate_failures":0,"target_constants_remaining":0,"helpers_missing":0,"fixed_wait_predicates":0,"autoload_static_failures":0,"asset_chain_failures":0,"dll_patch_failures":0,"native_continue_failures":0,"field58_gate_failures":0,"direct_shortcut_failures":0,"input_path_failures":0,"runtime_proof_failures":1,"runtime_mode_failures":0,"eula_popup_failures":0,"save_data_popup_failures":0,"messagebox_dialog_failures":0,"server_status_failures":0,"title_cover_failures":0,"title_cover_penalty":0,"native_trace_blockers":0,"native_trace_hits_total":74,"native_trace_unique_breakpoints":11,"false_positives":0,"runtime_timeout_failures":0,"runtime_title_visual_suppressed_builds":0,"runtime_custom_cover_builds":0,"runtime_simulated_button_presses_total":0},"status":"discard","description":"recorded SetSaveSlot callers and identified FUN_1407891c0 as promising normal/title upstream path","timestamp":1782403705812,"segment":0,"confidence":null,"asi":{"hypothesis":"Finding callers of CS::GameMan::SetSaveSlot should separate normal title/Continue setup from LoadGame/ProfileLoad shortcuts and identify the upstream native state that prepares saveSlot/current PGD/profile before continue_load.","rollback_reason":"Primary metric 1520 matched but did not exceed the persisted best; iteration only recorded static RE guidance.","next_action_hint":"Decode FUN_1407891c0 / nearby 0x1407890f0 as the promising normal/title upstream SetSaveSlot path. Treat FUN_14082c330 as ProfileLoadDialog shortcut and do not manually force SetSaveSlot."}}
{"run":124,"commit":"2100051","metric":1520,"metrics":{"readiness_gate_failures":0,"target_constants_remaining":0,"helpers_missing":0,"fixed_wait_predicates":0,"autoload_static_failures":0,"asset_chain_failures":0,"dll_patch_failures":0,"native_continue_failures":0,"field58_gate_failures":0,"direct_shortcut_failures":0,"input_path_failures":0,"runtime_proof_failures":1,"runtime_mode_failures":0,"eula_popup_failures":0,"save_data_popup_failures":0,"messagebox_dialog_failures":0,"server_status_failures":0,"title_cover_failures":0,"title_cover_penalty":0,"native_trace_blockers":0,"native_trace_hits_total":74,"native_trace_unique_breakpoints":11,"false_positives":0,"runtime_timeout_failures":0,"runtime_title_visual_suppressed_builds":0,"runtime_custom_cover_builds":0,"runtime_simulated_button_presses_total":0},"status":"discard","description":"used Beads memories to stop chasing SetSaveSlot and refocus on native LoadGame job builder chain","timestamp":1782404058378,"segment":0,"confidence":null,"asi":{"hypothesis":"Checking Beads memories before continuing the SetSaveSlot spike may reveal prior definitive work and prevent re-deriving/refuting already-known dead ends.","rollback_reason":"Primary metric 1520 matched but did not exceed the persisted best; iteration only recorded static RE guidance and memory-informed course correction.","next_action_hint":"Stop chasing SetSaveSlot as normal Continue setup. Decode/use the prior-memory native chain FUN_1409a7070 -> FUN_1409a9110 -> 0x1409ac760 -> FUN_140826510 and title_owner+0x138 readiness, while preserving native title flow for Part A render-only suppression."}}
{"run":125,"commit":"2100051","metric":1520,"metrics":{"readiness_gate_failures":0,"target_constants_remaining":0,"helpers_missing":0,"fixed_wait_predicates":0,"autoload_static_failures":0,"asset_chain_failures":0,"dll_patch_failures":0,"native_continue_failures":0,"field58_gate_failures":0,"direct_shortcut_failures":0,"input_path_failures":0,"runtime_proof_failures":1,"runtime_mode_failures":0,"eula_popup_failures":0,"save_data_popup_failures":0,"messagebox_dialog_failures":0,"server_status_failures":0,"title_cover_failures":0,"title_cover_penalty":0,"native_trace_blockers":0,"native_trace_hits_total":74,"native_trace_unique_breakpoints":11,"false_positives":0,"runtime_timeout_failures":0,"runtime_title_visual_suppressed_builds":0,"runtime_custom_cover_builds":0,"runtime_simulated_button_presses_total":0},"status":"discard","description":"used Beads memories and shift mapping to ground native LoadGame builder chain and owner-context caveat","timestamp":1782404310432,"segment":0,"confidence":null,"asi":{"hypothesis":"Beads memories and dump-deobf mapping should ground the native LoadGame builder chain and avoid stale owner-context or SetSaveSlot dead ends before the next product path change.","rollback_reason":"Primary metric 1520 matched but did not exceed the persisted best; iteration only recorded static RE guidance and memory synthesis.","next_action_hint":"Recall/decode `loadgame-owner-ctx-is-DIALOG-a38-not-mss-CORRECTION-2026-06-22`, then identify the TitleFlowContext field/value that selects the Continue/LoadGame branch before any runtime hook. Preserve golden trace as evidence but reconcile its owner_ctx framing with the correction."}}
{"run":126,"commit":"2100051","metric":1520,"metrics":{"readiness_gate_failures":0,"target_constants_remaining":0,"helpers_missing":0,"fixed_wait_predicates":0,"autoload_static_failures":0,"asset_chain_failures":0,"dll_patch_failures":0,"native_continue_failures":0,"field58_gate_failures":0,"direct_shortcut_failures":0,"input_path_failures":0,"runtime_proof_failures":1,"runtime_mode_failures":0,"eula_popup_failures":0,"save_data_popup_failures":0,"messagebox_dialog_failures":0,"server_status_failures":0,"title_cover_failures":0,"title_cover_penalty":0,"native_trace_blockers":0,"native_trace_hits_total":74,"native_trace_unique_breakpoints":11,"false_positives":0,"runtime_timeout_failures":0,"runtime_title_visual_suppressed_builds":0,"runtime_custom_cover_builds":0,"runtime_simulated_button_presses_total":0},"status":"discard","description":"recorded TitleFlowContext+0x14c selector semantics and cold-field-arm dead end from Beads memories","timestamp":1782404509768,"segment":0,"confidence":null,"asi":{"hypothesis":"Recalling the owner_ctx correction and trigger memories should identify the TitleFlowContext field/value selecting Continue/LoadGame and avoid stale mss+0xa38 or cold-field-arm dead ends.","rollback_reason":"Primary metric 1520 matched but did not exceed the persisted best; iteration only recorded static RE guidance and memory synthesis.","next_action_hint":"Find how to get the native Continue selector job active/enqueued without input and without replacing the title out-slot. Do not merely set TitleFlowContext+0x14c=1 cold; Beads memory says that is dormant unless the selector job is active."}}
{"run":127,"commit":"2100051","metric":1520,"metrics":{"readiness_gate_failures":0,"target_constants_remaining":0,"helpers_missing":0,"fixed_wait_predicates":0,"autoload_static_failures":0,"asset_chain_failures":0,"dll_patch_failures":0,"native_continue_failures":0,"field58_gate_failures":0,"direct_shortcut_failures":0,"input_path_failures":0,"runtime_proof_failures":1,"runtime_mode_failures":0,"eula_popup_failures":0,"save_data_popup_failures":0,"messagebox_dialog_failures":0,"server_status_failures":0,"title_cover_failures":0,"title_cover_penalty":0,"native_trace_blockers":0,"native_trace_hits_total":74,"native_trace_unique_breakpoints":11,"false_positives":0,"runtime_timeout_failures":0,"runtime_title_visual_suppressed_builds":0,"runtime_custom_cover_builds":0,"runtime_simulated_button_presses_total":0},"status":"discard","description":"recorded selector wrapper and TitleTopDialog result-gate path for native Continue job activation","timestamp":1782404771645,"segment":0,"confidence":null,"asi":{"hypothesis":"Static decode of selector wrapper callers should reveal how the native Continue selector job is activated/enqueued without cold-setting TitleFlowContext+0x14c or injecting input.","rollback_reason":"Primary metric 1520 matched but did not exceed the persisted best; iteration only recorded static RE guidance and no runtime proof improvement.","next_action_hint":"Identify writers of TitleTopDialog.super_MenuWindow.field254_0x1e8 and verify whether preserving the native 05_000_Title MenuWindowJob result path activates FUN_1409a92a0/selector. Part A should suppress render inside the native job rather than replacing/clearing the out-slot."}}
{"run":128,"commit":"2100051","metric":1520,"metrics":{"readiness_gate_failures":0,"target_constants_remaining":0,"helpers_missing":0,"fixed_wait_predicates":0,"autoload_static_failures":0,"asset_chain_failures":0,"dll_patch_failures":0,"native_continue_failures":0,"field58_gate_failures":0,"direct_shortcut_failures":0,"input_path_failures":0,"runtime_proof_failures":1,"runtime_mode_failures":0,"eula_popup_failures":0,"save_data_popup_failures":0,"messagebox_dialog_failures":0,"server_status_failures":0,"title_cover_failures":0,"title_cover_penalty":0,"native_trace_blockers":0,"native_trace_hits_total":74,"native_trace_unique_breakpoints":11,"false_positives":0,"runtime_timeout_failures":0,"runtime_title_visual_suppressed_builds":0,"runtime_custom_cover_builds":0,"runtime_simulated_button_presses_total":0},"status":"discard","description":"pinned concrete field1e8 writer 0x1409a4ee0 and remaining title-result writers","timestamp":1782405023499,"segment":0,"confidence":null,"asi":{"hypothesis":"Identifying concrete writers of TitleTopDialog.super_MenuWindow.field254_0x1e8 should reveal the native result propagation path needed to activate the Continue selector without input or cold-setting TFC+0x14c.","rollback_reason":"Primary metric 1520 matched but did not exceed the persisted best; iteration only recorded static RE guidance and no runtime proof improvement.","next_action_hint":"Decode FUN_1409ad9b0 and FUN_1409be730 to classify remaining title-range 0x1e8 writers, and map data refs 0x144902120/0x142b22b10 for FUN_1409a4ee0 to the owning job/vtable before runtime hooks."}}
{"run":129,"commit":"2100051","metric":1520,"metrics":{"readiness_gate_failures":0,"target_constants_remaining":0,"helpers_missing":0,"fixed_wait_predicates":0,"autoload_static_failures":0,"asset_chain_failures":0,"dll_patch_failures":0,"native_continue_failures":0,"field58_gate_failures":0,"direct_shortcut_failures":0,"input_path_failures":0,"runtime_proof_failures":1,"runtime_mode_failures":0,"eula_popup_failures":0,"save_data_popup_failures":0,"messagebox_dialog_failures":0,"server_status_failures":0,"title_cover_failures":0,"title_cover_penalty":0,"native_trace_blockers":0,"native_trace_hits_total":74,"native_trace_unique_breakpoints":11,"false_positives":0,"runtime_timeout_failures":0,"runtime_title_visual_suppressed_builds":0,"runtime_custom_cover_builds":0,"runtime_simulated_button_presses_total":0},"status":"discard","description":"corrected remaining field1e8 writers as stack-local temporaries, not TitleTopDialog result writes","timestamp":1782405442229,"segment":0,"confidence":null,"asi":{"hypothesis":"Decoding FUN_1409ad9b0 and FUN_1409be730 should classify whether the remaining 0x1e8 write sites are real TitleTopDialog result propagation or local job-builder temporaries.","rollback_reason":"Primary metric 1520 matched but did not exceed the persisted best; iteration only recorded a static RE correction and no runtime proof improvement.","next_action_hint":"Stop chasing FUN_1409ad9b0/FUN_1409be730 as field254 writers. Map the job/vtable/data-table ownership of FUN_1409a4ee0 and separately identify the Continue arm handler that writes TitleFlowContext+0x14c=1.","guard_event":"A Bash inline extraction with semicolon/temp assignment was correctly blocked by cupcake; pivoted to ctx_execute and direct er_disasm for read-only extraction."}}
{"run":130,"commit":"2100051","metric":1520,"metrics":{"readiness_gate_failures":0,"target_constants_remaining":0,"helpers_missing":0,"fixed_wait_predicates":0,"autoload_static_failures":0,"asset_chain_failures":0,"dll_patch_failures":0,"native_continue_failures":0,"field58_gate_failures":0,"direct_shortcut_failures":0,"input_path_failures":0,"runtime_proof_failures":1,"runtime_mode_failures":0,"eula_popup_failures":0,"save_data_popup_failures":0,"messagebox_dialog_failures":0,"server_status_failures":0,"title_cover_failures":0,"title_cover_penalty":0,"native_trace_blockers":0,"native_trace_hits_total":74,"native_trace_unique_breakpoints":11,"false_positives":0,"runtime_timeout_failures":0,"runtime_title_visual_suppressed_builds":0,"runtime_custom_cover_builds":0,"runtime_simulated_button_presses_total":0},"status":"discard","description":"separated 9a4ee0 alternate-success path from real 9a9250 Continue arm handler","timestamp":1782405702368,"segment":0,"confidence":null,"asi":{"hypothesis":"Mapping FUN_1409a4ee0 ownership and disassembling the +0x14c=1 handler family should separate alternate title-success paths from the real Continue arm, reducing the risk of patching the wrong table callback.","rollback_reason":"Primary metric 1520 matched but did not exceed the persisted best; iteration only recorded static RE guidance and no runtime proof improvement.","next_action_hint":"Decode 0x1409b10a0 and data table object 0x14490266c/nearby to find how the native menu row invokes 0x1409a9250 without input. Do not chase 0x1409a4ee0 as load trigger.","tooling_gap":"scripts/dump-deobf-data.py does not exist; use er_disasm kind=data or an existing Ghidra data script for data windows instead."}}
{"run":131,"commit":"2100051","metric":1520,"metrics":{"readiness_gate_failures":0,"target_constants_remaining":0,"helpers_missing":0,"fixed_wait_predicates":0,"autoload_static_failures":0,"asset_chain_failures":0,"dll_patch_failures":0,"native_continue_failures":0,"field58_gate_failures":0,"direct_shortcut_failures":0,"input_path_failures":0,"runtime_proof_failures":1,"runtime_mode_failures":0,"eula_popup_failures":0,"save_data_popup_failures":0,"messagebox_dialog_failures":0,"server_status_failures":0,"title_cover_failures":0,"title_cover_penalty":0,"native_trace_blockers":0,"native_trace_hits_total":74,"native_trace_unique_breakpoints":11,"false_positives":0,"runtime_timeout_failures":0,"runtime_title_visual_suppressed_builds":0,"runtime_custom_cover_builds":0,"runtime_simulated_button_presses_total":0},"status":"discard","description":"decoded 9b10a0 as direct wrapper into real 9a93a0 Continue arm handler","timestamp":1782405988716,"segment":0,"confidence":null,"asi":{"hypothesis":"Decoding 0x1409b10a0 and the nearby handler table should show how the native row path reaches the real 0x1409a9250/0x1409a93a0 Continue arm without cold-setting TitleFlowContext+0x14c.","rollback_reason":"Primary metric 1520 matched but did not exceed the persisted best; iteration only recorded static RE guidance and no runtime proof improvement.","next_action_hint":"Map data-table slot 0x14490266c back to the owning row/action object and determine whether preserved 05_000_Title already makes that row active. Product hook should preserve the native wrapper and suppress render only, not invoke 0x1409a93a0 cold."}}
{"run":132,"commit":"2100051","metric":1520,"metrics":{"readiness_gate_failures":0,"target_constants_remaining":0,"helpers_missing":0,"fixed_wait_predicates":0,"autoload_static_failures":0,"asset_chain_failures":0,"dll_patch_failures":0,"native_continue_failures":0,"field58_gate_failures":0,"direct_shortcut_failures":0,"input_path_failures":0,"runtime_proof_failures":1,"runtime_mode_failures":0,"eula_popup_failures":0,"save_data_popup_failures":0,"messagebox_dialog_failures":0,"server_status_failures":0,"title_cover_failures":0,"title_cover_penalty":0,"native_trace_blockers":0,"native_trace_hits_total":74,"native_trace_unique_breakpoints":11,"false_positives":0,"runtime_timeout_failures":0,"runtime_title_visual_suppressed_builds":0,"runtime_custom_cover_builds":0,"runtime_simulated_button_presses_total":0},"status":"discard","description":"mapped 14490266c as function half of dense title dispatch table entry","timestamp":1782406360592,"segment":0,"confidence":null,"asi":{"hypothesis":"Mapping data-table slot 0x14490266c should reveal the owning row/action object for the native Continue arm, or prove it is part of a generic title dispatch table consumed elsewhere.","rollback_reason":"Primary metric 1520 matched but did not exceed the persisted best; iteration only recorded static RE guidance and no runtime proof improvement.","next_action_hint":"Identify the generic dispatcher/iterator that consumes the 0x1449025xx/0x1449026xx title dispatch table and what selects key 0x14369a730 / function 0x1409a93a0 under preserved native title. Do not treat 0x14490266c as an object vtable slot.","tooling_note":"Temporary scripts/ghidra/DumpRefsInRange.java was created for bounded data ref dumping; discard should revert it, but it can be recreated if needed."}}
