{"run":203,"commit":"2100051","metric":0,"metrics":{"readiness_gate_failures":0,"target_constants_remaining":0,"helpers_missing":0,"fixed_wait_predicates":0,"autoload_static_failures":0,"asset_chain_failures":0,"dll_patch_failures":0,"native_continue_failures":0,"field58_gate_failures":0,"direct_shortcut_failures":0,"input_path_failures":0,"runtime_proof_failures":1,"runtime_mode_failures":0,"eula_popup_failures":0,"save_data_popup_failures":0,"messagebox_dialog_failures":0,"server_status_failures":0,"title_cover_failures":0,"title_cover_penalty":0,"native_trace_blockers":0,"native_trace_hits_total":74,"native_trace_unique_breakpoints":11,"false_positives":0,"runtime_timeout_failures":1,"runtime_title_visual_suppressed_builds":1,"runtime_custom_cover_builds":1,"runtime_simulated_button_presses_total":0},"status":"crash","description":"runtime proved installed BeginTitle composed job ticks","timestamp":1782424890031,"segment":0,"confidence":null,"asi":{"hypothesis":"Combining the corrected live/deobf b0e530 installer hook with ExecuteMenuJob matching against title_begin_job_install_last_owner_after will distinguish installed-but-not-ticked from installed-and-ticked composed title job.","rollback_reason":"run_experiment timed out before METRIC lines, so primary metric is 0/crash. Product proof still failed: native_submit_hits=0, continue_phase=0, title_native_ready flags=0, zero input, zero MessageBox.","next_action_hint":"The composed BeginTitle job is installed and ticked, with vtable 0x142aa2958 (MENUJOB_IFELSE_VTABLE_DUMP_VA). Next decode/instrument that IfElse/child sequence and its branches to see whether the native title MenuWindowJob child was replaced by ProfileSelect or a child predicate fails. Do not keep debugging generic ExecuteMenuJob or installer presence.","artifact":"/home/banon/projects/er-effects-rs/target/runtime-probe/product-continue-direct-20260625-145834","finding_key":"autoload-installed-composed-title-job-ticked-2026-06-25","validation":"`cargo xwin build --release --target x86_64-pc-windows-msvc` succeeded before the armed `.auto/measure.sh` runtime attempt.","evidence":"Telemetry: title_begin_job_install_hits=2, installed job=0x7ffe9e5f0ea0, installed vtable=0x142aa2958, ExecuteMenuJob hits=25072, installed_title_job_ticks=637, title_native_ready_last_flags=0."}}
{"run":204,"commit":"2100051","metric":0,"metrics":{"readiness_gate_failures":0,"target_constants_remaining":0,"helpers_missing":0,"fixed_wait_predicates":0,"autoload_static_failures":0,"asset_chain_failures":0,"dll_patch_failures":0,"native_continue_failures":0,"field58_gate_failures":0,"direct_shortcut_failures":0,"input_path_failures":0,"runtime_proof_failures":1,"runtime_mode_failures":0,"eula_popup_failures":0,"save_data_popup_failures":0,"messagebox_dialog_failures":0,"server_status_failures":0,"title_cover_failures":0,"title_cover_penalty":0,"native_trace_blockers":0,"native_trace_hits_total":74,"native_trace_unique_breakpoints":11,"false_positives":0,"runtime_timeout_failures":1,"runtime_title_visual_suppressed_builds":1,"runtime_custom_cover_builds":1,"runtime_simulated_button_presses_total":0},"status":"crash","description":"runtime instrumented installed sequence child state","timestamp":1782425450365,"segment":0,"confidence":null,"asi":{"hypothesis":"Instrumenting the installed composed BeginTitle sequence via the existing 0x1407aa1f0 sequence Run hook will reveal which child is active and whether the outer sequence is stuck before native title rows become valid.","rollback_reason":"run_experiment timed out before METRIC lines, so primary metric is 0/crash. Product proof still failed: native_submit_hits=0, continue_phase=0, title_native_ready flags=0, zero input, zero MessageBox.","next_action_hint":"Outer installed sequence is stuck at child index 0: child vtable 0x142aa2938, Run dump 0x140792550 -> deobf 0x140792460. Next instrument/decode that child object fields +0x10 inner job and +0x18 success flag pointer to determine whether the inner job is the ProfileSelect replacement or native title MenuWindowJob branch.","artifact":"/home/banon/projects/er-effects-rs/target/runtime-probe/product-continue-direct-20260625-150743","finding_key":"autoload-installed-sequence-stuck-child0-2026-06-25","validation":"Ghidra vtable/decompile used for 0x142aa2958 and 0x142aa2938; `cargo xwin build --release --target x86_64-pc-windows-msvc` succeeded before the armed `.auto/measure.sh` runtime attempt.","evidence":"Telemetry: installed seq hits=612, count=2, index_before=0, index_after=0, child=0x7ffe9e500920, child_vtable=0x142aa2938; vtable 0x142aa2938 slot2 Run=0x140792550 dump / 0x140792460 deobf."}}
{"run":205,"commit":"2100051","metric":0,"metrics":{"readiness_gate_failures":0,"target_constants_remaining":0,"helpers_missing":0,"fixed_wait_predicates":0,"autoload_static_failures":0,"asset_chain_failures":0,"dll_patch_failures":0,"native_continue_failures":0,"field58_gate_failures":0,"direct_shortcut_failures":0,"input_path_failures":0,"runtime_proof_failures":1,"runtime_mode_failures":0,"eula_popup_failures":0,"save_data_popup_failures":0,"messagebox_dialog_failures":0,"server_status_failures":0,"title_cover_failures":0,"title_cover_penalty":0,"native_trace_blockers":0,"native_trace_hits_total":74,"native_trace_unique_breakpoints":11,"false_positives":0,"runtime_timeout_failures":1,"runtime_title_visual_suppressed_builds":1,"runtime_custom_cover_builds":1,"runtime_simulated_button_presses_total":0},"status":"crash","description":"runtime proved installed sequence child0 is ProfileSelect replacement","timestamp":1782425871635,"segment":0,"confidence":null,"asi":{"hypothesis":"Instrumenting child0 wrapper fields +0x10 inner job and +0x18 success flag will identify whether the stuck child is the ProfileSelect replacement or the native title MenuWindowJob branch.","rollback_reason":"run_experiment timed out before METRIC lines, so primary metric is 0/crash. Product proof still failed: native_submit_hits=0, continue_phase=0, title_native_ready flags=0, zero input, zero MessageBox.","next_action_hint":"Child0 inner job is the 05_010_ProfileSelect replacement, not native 05_000_Title. Next change PartA away from returning ProfileSelect in the BeginTitle out-slot: preserve native 05_000_Title in the sequence and suppress render later, or map child1 before product code changes.","artifact":"/home/banon/projects/er-effects-rs/target/runtime-probe/product-continue-direct-20260625-151532","finding_key":"autoload-child0-is-profileselect-replacement-2026-06-25","validation":"`cargo xwin build --release --target x86_64-pc-windows-msvc` succeeded before the armed `.auto/measure.sh` runtime attempt.","evidence":"Telemetry: child0=0x7ffe9e500920 vtable=0x142aa2938; child0+0x10 inner_job=0x7ffe9e52c280, inner_vtable=0x142aa97e8; custom_cover_profile_select_last_job=0x7ffe9e52c280; success_value=1; outer index remains 0."}}
{"run":206,"commit":"2100051","metric":0,"metrics":{"readiness_gate_failures":0,"target_constants_remaining":0,"helpers_missing":0,"fixed_wait_predicates":0,"autoload_static_failures":0,"asset_chain_failures":0,"dll_patch_failures":0,"native_continue_failures":0,"field58_gate_failures":0,"direct_shortcut_failures":0,"input_path_failures":0,"runtime_proof_failures":1,"runtime_mode_failures":0,"eula_popup_failures":0,"save_data_popup_failures":0,"messagebox_dialog_failures":0,"server_status_failures":0,"title_cover_failures":1,"title_cover_penalty":0,"native_trace_blockers":0,"native_trace_hits_total":74,"native_trace_unique_breakpoints":11,"false_positives":0,"runtime_timeout_failures":1,"runtime_title_visual_suppressed_builds":1,"runtime_custom_cover_builds":0,"runtime_simulated_button_presses_total":0},"status":"crash","description":"runtime preserved native BeginTitle out-slot instead of ProfileSelect","timestamp":1782426172125,"segment":0,"confidence":null,"asi":{"hypothesis":"Preserving/calling the native BeginTitle 05_000_Title wrapper instead of returning ProfileSelect in the out-slot should restore native sequence semantics and potentially make title rows/SceneObjProxy valid.","rollback_reason":"run_experiment timed out before METRIC lines, so primary metric is 0/crash. Native title ready remained false and product proof failed; also custom cover builds dropped to 0 because this was a native-preservation diagnostic without PartB rendering.","next_action_hint":"Preserving native BeginTitle out-slot alone is not sufficient. Next combine this native-preserving shape with the installed-sequence child-field observer to confirm child0 now points at native 05_000_Title, then decode why SceneObjProxy flags remain zero. Do not reintroduce ProfileSelect into the BeginTitle out-slot.","artifact":"/home/banon/projects/er-effects-rs/target/runtime-probe/product-continue-direct-20260625-152042","finding_key":"autoload-native-begintitle-preserved-still-native-ready-false-2026-06-25","validation":"`cargo xwin build --release --target x86_64-pc-windows-msvc` succeeded before the armed `.auto/measure.sh` runtime attempt.","evidence":"Debug log: PRESERVED native 05_000_Title, native_ret=0x10fbc0, native_job=0x7ffe9e52c280. Telemetry: ProfileSelect builds=0, title_native_ready_last_flags=0, native_submit_hits=0, continue_phase=0, zero input/messagebox."}}
{"run":207,"commit":"2100051","metric":0,"metrics":{"readiness_gate_failures":0,"target_constants_remaining":0,"helpers_missing":0,"fixed_wait_predicates":0,"autoload_static_failures":0,"asset_chain_failures":0,"dll_patch_failures":0,"native_continue_failures":0,"field58_gate_failures":0,"direct_shortcut_failures":0,"input_path_failures":0,"runtime_proof_failures":1,"runtime_mode_failures":0,"eula_popup_failures":0,"save_data_popup_failures":0,"messagebox_dialog_failures":0,"server_status_failures":0,"title_cover_failures":1,"title_cover_penalty":0,"native_trace_blockers":0,"native_trace_hits_total":74,"native_trace_unique_breakpoints":11,"false_positives":0,"runtime_timeout_failures":1,"runtime_title_visual_suppressed_builds":1,"runtime_custom_cover_builds":0,"runtime_simulated_button_presses_total":0},"status":"crash","description":"runtime combined native-preserving BeginTitle with child observer","timestamp":1782426643536,"segment":0,"confidence":null,"asi":{"hypothesis":"Combining native-preserving BeginTitle with the installed-sequence child-field observer will confirm whether child0 is now the native 05_000_Title MenuWindowJob and show whether the sequence advances.","rollback_reason":"run_experiment timed out before METRIC lines, so primary metric is 0/crash. Product proof still failed: native_submit_hits=0, continue_phase=0, title_native_ready flags=0, zero input, zero MessageBox; PartB cover remained absent.","next_action_hint":"Native preservation restores child0 identity but the outer sequence remains stuck at index 0. Next instrument native MenuWindowJob 0x142aa97e8 state/window/result around Run/update to find why preserved 05_000_Title does not complete or produce valid SceneObjProxy rows.","artifact":"/home/banon/projects/er-effects-rs/target/runtime-probe/product-continue-direct-20260625-152830","finding_key":"autoload-native-child0-preserved-but-sequence-stuck-2026-06-25","validation":"`cargo xwin build --release --target x86_64-pc-windows-msvc` succeeded before the armed `.auto/measure.sh` runtime attempt.","evidence":"Telemetry: ProfileSelect builds=0; preserved native job=0x7fff7192c280; child0+0x10 inner_job=0x7fff7192c280, inner_vtable=0x142aa97e8, success_value=1; outer index_before=0,index_after=0,count=2; title_native_ready_last_flags=0."}}
{"run":208,"commit":"2100051","metric":0,"metrics":{"readiness_gate_failures":0,"target_constants_remaining":0,"helpers_missing":0,"fixed_wait_predicates":0,"autoload_static_failures":0,"asset_chain_failures":0,"dll_patch_failures":0,"native_continue_failures":0,"field58_gate_failures":0,"direct_shortcut_failures":0,"input_path_failures":0,"runtime_proof_failures":1,"runtime_mode_failures":0,"eula_popup_failures":0,"save_data_popup_failures":0,"messagebox_dialog_failures":0,"server_status_failures":0,"title_cover_failures":1,"title_cover_penalty":0,"native_trace_blockers":0,"native_trace_hits_total":74,"native_trace_unique_breakpoints":11,"false_positives":0,"runtime_timeout_failures":1,"runtime_title_visual_suppressed_builds":1,"runtime_custom_cover_builds":0,"runtime_simulated_button_presses_total":0},"status":"crash","description":"runtime instrumented preserved native MenuWindowJob Run state","timestamp":1782427168763,"segment":0,"confidence":null,"asi":{"hypothesis":"Instrumenting preserved native 05_000_Title MenuWindowJob::Run fields will show whether the native job actually runs, has an owning window, and whether its window/load fields remain unset.","rollback_reason":"run_experiment timed out before METRIC lines, so primary metric is 0/crash. Product proof still failed: native_submit_hits=0, continue_phase=0, title_native_ready flags=0, zero input, zero MessageBox; PartB cover remained absent.","next_action_hint":"Native MenuWindowJob runs and owns a window, but SceneObjProxy readiness remains false. Next decode/instrument owning window vtable 0x142b26468 functions 0x1409aa3a0/0x1409aad60 or field+0x70 callback 0x142ac3e38 to find why the window exists but readiness flags stay zero.","artifact":"/home/banon/projects/er-effects-rs/target/runtime-probe/product-continue-direct-20260625-153639","finding_key":"autoload-native-menuwindow-runs-window-exists-ready-false-2026-06-25","validation":"Ghidra vtable/deobf mapping used for MenuWindowJob vtable 0x142aa97e8; `cargo xwin build --release --target x86_64-pc-windows-msvc` succeeded before the armed `.auto/measure.sh` runtime attempt.","evidence":"Telemetry: native MenuWindowJob run_hits=531, item=0x7ffe9e52c280, vtable=0x142aa97e8, +0x68=0x7ffe9e5dce10, +0x70=0x142ac3e38, +0x130 window=0x7ffe969d3b20, window_vtable=0x142b26468; title_native_ready_last_flags=0."}}
{"run":209,"commit":"2100051","metric":0,"metrics":{"readiness_gate_failures":0,"target_constants_remaining":0,"helpers_missing":0,"fixed_wait_predicates":0,"autoload_static_failures":0,"asset_chain_failures":0,"dll_patch_failures":0,"native_continue_failures":0,"field58_gate_failures":0,"direct_shortcut_failures":0,"input_path_failures":0,"runtime_proof_failures":1,"runtime_mode_failures":0,"eula_popup_failures":0,"save_data_popup_failures":0,"messagebox_dialog_failures":0,"server_status_failures":0,"title_cover_failures":1,"title_cover_penalty":0,"native_trace_blockers":0,"native_trace_hits_total":74,"native_trace_unique_breakpoints":11,"false_positives":0,"runtime_timeout_failures":1,"runtime_title_visual_suppressed_builds":1,"runtime_custom_cover_builds":0,"runtime_simulated_button_presses_total":0},"status":"crash","description":"runtime hooked native title owning-window update fields","timestamp":1782427671716,"segment":0,"confidence":null,"asi":{"hypothesis":"Hooking the preserved native title owning-window update at deobf 0x1409aac10 will reveal whether the window update runs and which state fields remain blocking SceneObjProxy/native row readiness.","rollback_reason":"run_experiment timed out before METRIC lines, so primary metric is 0/crash. Product proof still failed: native_submit_hits=0, continue_phase=0, title_native_ready flags=0, zero input, zero MessageBox; PartB cover remained absent.","next_action_hint":"Title window update runs with a40=1 but readiness stays false. Next decode/instrument field_0xaa8 vtable 0x142b23160 / function 0x1409a6380 and field10_0xa48+0x18 state string (FadeIn/TextFadeOut/default).","artifact":"/home/banon/projects/er-effects-rs/target/runtime-probe/product-continue-direct-20260625-154525","finding_key":"autoload-title-window-update-runs-a40-one-ready-false-2026-06-25","validation":"Ghidra mapping confirmed dump 0x1409aad60 -> deobf 0x1409aac10; `cargo xwin build --release --target x86_64-pc-windows-msvc` succeeded before the armed `.auto/measure.sh` runtime attempt.","evidence":"Telemetry: title_native_window_update_hits=554, this=0x7ffe969d3d40, a40=1, a60=0x7ffe969d4788, a68=0x7ffe9e52c290, aa8=0x142b23160, title_native_ready_last_flags=0."}}
{"run":210,"commit":"2100051","metric":0,"metrics":{"readiness_gate_failures":0,"target_constants_remaining":0,"helpers_missing":0,"fixed_wait_predicates":0,"autoload_static_failures":0,"asset_chain_failures":0,"dll_patch_failures":0,"native_continue_failures":0,"field58_gate_failures":0,"direct_shortcut_failures":0,"input_path_failures":0,"runtime_proof_failures":1,"runtime_mode_failures":0,"eula_popup_failures":0,"save_data_popup_failures":0,"messagebox_dialog_failures":0,"server_status_failures":0,"title_cover_failures":1,"title_cover_penalty":0,"native_trace_blockers":0,"native_trace_hits_total":74,"native_trace_unique_breakpoints":11,"false_positives":0,"runtime_timeout_failures":1,"runtime_title_visual_suppressed_builds":1,"runtime_custom_cover_builds":0,"runtime_simulated_button_presses_total":0},"status":"crash","description":"runtime logged native title window raw state fields","timestamp":1782428208065,"segment":0,"confidence":null,"asi":{"hypothesis":"Bounded debug logging of native title window state block a48 and TitleBackViewParts aa8 fields will reveal whether FadeIn/TextFadeOut/default state or proxy fields evolve before readiness stays false.","rollback_reason":"run_experiment timed out before METRIC lines, so primary metric is 0/crash. Product proof still failed: native_submit_hits=0, continue_phase=0, title_native_ready flags=0, zero input, zero MessageBox; PartB cover remained absent.","next_action_hint":"The sampled a48/aa8 fields are stable from hit 0 through 512, so stop resampling them. Next decode vtable 0x142a94a70 functions 0x14074bbe0/0x14074bbd0 and the stable object graph around a48/aa8+0x88/0x90 to identify the stuck state/proxy.","artifact":"/home/banon/projects/er-effects-rs/target/runtime-probe/product-continue-direct-20260625-155313","finding_key":"autoload-title-window-raw-state-stable-ready-false-2026-06-25","validation":"Ghidra static decode of TitleBackViewParts vtable/function preceded the hook; `cargo xwin build --release --target x86_64-pc-windows-msvc` succeeded before the armed `.auto/measure.sh` runtime attempt.","evidence":"Debug log: title-window-update samples hit=0,1,2,3,64,256,512 all stable; a40=1; a48=[0x142a94a70,0x7fff69dd4568,0x7fff69dd4568,0x7fff69dd4568,0x7fff7192c290]; aa8_vt=0x142b23160; aa8_88=0x7fff69dd4638; aa8_90=0x7fff69dd45d8; aa8_98=0x142a94a58."}}
{"run":211,"commit":"2100051","metric":1520,"metrics":{"readiness_gate_failures":0,"target_constants_remaining":0,"helpers_missing":0,"fixed_wait_predicates":0,"autoload_static_failures":0,"asset_chain_failures":0,"dll_patch_failures":0,"native_continue_failures":0,"field58_gate_failures":0,"direct_shortcut_failures":0,"input_path_failures":0,"runtime_proof_failures":1,"runtime_mode_failures":0,"eula_popup_failures":0,"save_data_popup_failures":0,"messagebox_dialog_failures":0,"server_status_failures":0,"title_cover_failures":0,"title_cover_penalty":0,"native_trace_blockers":0,"native_trace_hits_total":74,"native_trace_unique_breakpoints":11,"false_positives":0,"runtime_timeout_failures":0,"runtime_title_visual_suppressed_builds":0,"runtime_custom_cover_builds":0,"runtime_simulated_button_presses_total":0},"status":"discard","description":"static decoded title a48 vtable as Scaleform proxy source","timestamp":1782428654746,"segment":0,"confidence":null,"asi":{"hypothesis":"Decoding stable title-window a48 vtable 0x142a94a70 functions 0x14074bbe0/0x14074bbd0 would explain whether the native-ready SceneObjProxy flags are still a relevant gate or just stale telemetry.","rollback_reason":"Primary metric remained 1520, equal to the persisted best, and runtime_proof_failures remains 1. This iteration produced static RE only; no runtime proof or product improvement was added.","next_action_hint":"Decode or instrument FUN_140d82880 / the param_1+0x28 source for the a48 object to identify which GFx/Scaleform value/member lookup remains invalid. Do not resample the same stable title-window a48/aa8 fields or treat flags/masked/ret as independent product gates.","finding_key":"autoload-title-a48-vtable-scaleform-source-2026-06-25","validation":"Beads memory search for 0x142a94a70/0x14074bbe0/0x14074bbd0 found no prior matching memory. Ghidra dump/deobf grounding: live 0x14074bbe0 -> dump 0x14074bcd0, shift +0xf0. .auto/measure.sh passed with autoload_re_score=1520 and false_positives=0.","evidence":"Ghidra decompile of FUN_14074bc40: calls FUN_140d82880(param_1+0x28,&ScaleformValue,...), tests `(ScaleformValue.dataType & 0x8f)`, constructs/copies CS::SceneObjProxy when nonzero, otherwise uses fallback/assert FUN_1407388c0."}}
