{"run":71,"commit":"2100051","metric":0,"metrics":{"readiness_gate_failures":1,"target_constants_remaining":0,"helpers_missing":0,"fixed_wait_predicates":0,"autoload_static_failures":1,"asset_chain_failures":0,"dll_patch_failures":0,"native_continue_failures":0,"field58_gate_failures":0,"direct_shortcut_failures":0,"input_path_failures":0,"runtime_proof_failures":1,"runtime_mode_failures":0,"eula_popup_failures":0,"save_data_popup_failures":0,"messagebox_dialog_failures":0,"server_status_failures":0,"title_cover_failures":0,"title_cover_penalty":0,"native_trace_blockers":0,"native_trace_hits_total":74,"native_trace_unique_breakpoints":11,"false_positives":0,"runtime_timeout_failures":1,"runtime_title_visual_suppressed_builds":0,"runtime_custom_cover_builds":0,"runtime_simulated_button_presses_total":0},"status":"crash","description":"embedded TitleTopDialog+0xa48 scan still found no Continue MenuMemberFuncJob nodes","timestamp":1782369193232,"segment":0,"confidence":4.833333333333333,"asi":{"hypothesis":"The previous registry scan accidentally treated TitleTopDialog+0xa48 as a pointer, but runtime showed it is an embedded object whose first qword is vtable 0x142a94a70. Scan the embedded object at dialog+0xa48, plus dialog fields, for MenuMemberFuncJob nodes whose member_fn chains to 0x14082bac0 in the preserved TitleTopDialog ready state.","rollback_reason":"Runtime timed out. The corrected embedded-object scan ran repeatedly with dialog=0x7ffe969d3b20, registry_obj=0x7ffe969d4568, registry_vt=0x142a94a70, latch=1, continue=0x14082bac0, memberjob_vt=0x142b265d0, but still found member_hits=0 and continue_hits=0. The embedded object contained self-pointers, menu/context pointers, vtables, and metadata, but no heap MenuMemberFuncJob node for Continue. No native submit or continue_load fired.","next_action_hint":"Static RE next: decompile/analyze the embedded registry/proxy vtable methods 0x14074baf0/0x14074bae0 and the open-menu function 0x1409b2630 call sites around FUN_1409b3050/FUN_1409a6dc0. The real Continue callback likely is encoded as a std::function/callback object or state-machine event, not a MenuMemberFuncJob node at +0xa48. Search static xrefs to 0x14082bac0/0x14082bbf0 and nearby builder funcs; do not runtime-scan for member nodes again until static layout is known.","artifact_dir":"/home/banon/projects/er-effects-rs/target/runtime-probe/product-continue-direct-20260624-233100","observed_runtime_oracles":{"autoload_method":"direct_menu_load","title_hook":"preserved native 05_000_Title, no ProfileSelect replacement","product_core_ready_blocker":"ready","product_core_last_title_dialog_vt":"0x142b26468/TitleTopDialog","product_core_last_menu_opened_latch":1,"profile_slot_active_bytes_qword":"0x1","scanner_dialog":"0x7ffe969d3b20","scanner_registry_obj":"0x7ffe969d4568","scanner_registry_vt":"0x142a94a70","scanner_latch":1,"scanner_continue_abs":"0x14082bac0","scanner_memberjob_vt":"0x142b265d0","scanner_member_hits":0,"scanner_continue_hits":0,"continue_member_node":null,"idle_candidate_item":"0x7ffe9e52c000","idle_candidate_hits":"present","native_submit_hits":0,"continue_load_fired":false,"simulated_button_presses_total":0,"messagebox_postload_builds":0,"processes_remaining":0},"build":"cargo xwin build --release --target x86_64-pc-windows-msvc succeeded.","cleanup":"No eldenring.exe or start_protected_game.exe processes remained."}}
{"run":72,"commit":"2100051","metric":0,"metrics":{"readiness_gate_failures":1,"target_constants_remaining":0,"helpers_missing":0,"fixed_wait_predicates":0,"autoload_static_failures":1,"asset_chain_failures":0,"dll_patch_failures":0,"native_continue_failures":0,"field58_gate_failures":0,"direct_shortcut_failures":0,"input_path_failures":0,"runtime_proof_failures":1,"runtime_mode_failures":0,"eula_popup_failures":0,"save_data_popup_failures":0,"messagebox_dialog_failures":0,"server_status_failures":0,"title_cover_failures":0,"title_cover_penalty":0,"native_trace_blockers":0,"native_trace_hits_total":74,"native_trace_unique_breakpoints":11,"false_positives":0,"runtime_timeout_failures":1,"runtime_title_visual_suppressed_builds":0,"runtime_custom_cover_builds":0,"runtime_simulated_button_presses_total":0},"status":"crash","description":"correct Continue builder hook was not exercised because continue trace did not install in product probe","timestamp":1782369717191,"segment":0,"confidence":4.833333333333333,"asi":{"hypothesis":"Static RE corrected the Continue wrapper xref target: deobf 0x14082bac0 maps to dump 0x14082bbb0, and its builder is dump 0x140825590 -> deobf 0x1408254a0. Hook that correct builder while preserving native TitleTopDialog to see whether the real Continue callback/result object is ever constructed in the product self-open state.","rollback_reason":"Runtime timed out and the new diagnostic was not exercised: er-effects-continue-trace.log was absent, there were zero `continue_trace_applied` logs, zero `title_continue_result_builder_8254a0` install/hit logs, zero TITLE-CONTINUE-RESULT-BUILDER hits, and zero menu_continue_wrapper hits. The product state itself still reached ready TitleTopDialog/menu_latch/profile-active and only ticked the idle candidate; native submit/continue_load stayed zero. Because the hook did not install, this run does not falsify the corrected builder address.","next_action_hint":"Find why ER_EFFECTS_TRACE_CONTINUE=1 is not propagating/installing in the .auto/measure.sh product probe, or install this specific 0x1408254a0 diagnostic hook from the always-on title suppression/product startup path instead of the continue-trace gate. Then rerun preserved TitleTopDialog with the correct builder hook. Static finding to keep: dump 0x140825590/deobf 0x1408254a0 is the builder that embeds wrapper dump 0x14082bbb0/deobf 0x14082bac0.","artifact_dir":"/home/banon/projects/er-effects-rs/target/runtime-probe/product-continue-direct-20260624-233938","observed_runtime_oracles":{"autoload_method":"direct_menu_load","product_autoload_armed":true,"title_hook":"preserved native 05_000_Title, no ProfileSelect replacement","product_core_ready_blocker":"ready","product_core_ready_successes":547,"product_core_last_title_dialog_vt":"0x142b26468/TitleTopDialog","product_core_last_menu_opened_latch":1,"profile_slot_active_bytes_qword":"0x1","continue_trace_log_present":false,"continue_trace_applied_logs":0,"title_continue_result_builder_install_or_hit_logs":0,"menu_continue_wrapper_hits":0,"idle_candidate_item":"0x7ffed192c000","idle_candidate_hits":1137,"native_submit_hits":0,"continue_load_fired":false,"simulated_button_presses_total":0,"messagebox_postload_builds":0,"processes_remaining":0},"static_re":{"deobf_0x14082bac0_to_dump":"0x14082bbb0","dump_builder":"0x140825590","deobf_builder":"0x1408254a0","wrong_prior_xref_target":"0x14082bc10 was mid/wrong-region estimate for the wrapper query"},"build":"cargo xwin build --release --target x86_64-pc-windows-msvc succeeded.","cleanup":"No eldenring.exe or start_protected_game.exe processes remained."}}
{"run":73,"commit":"2100051","metric":0,"metrics":{"readiness_gate_failures":1,"target_constants_remaining":0,"helpers_missing":0,"fixed_wait_predicates":0,"autoload_static_failures":1,"asset_chain_failures":0,"dll_patch_failures":0,"native_continue_failures":0,"field58_gate_failures":0,"direct_shortcut_failures":0,"input_path_failures":0,"runtime_proof_failures":1,"runtime_mode_failures":0,"eula_popup_failures":0,"save_data_popup_failures":0,"messagebox_dialog_failures":0,"server_status_failures":0,"title_cover_failures":0,"title_cover_penalty":0,"native_trace_blockers":0,"native_trace_hits_total":74,"native_trace_unique_breakpoints":11,"false_positives":0,"runtime_timeout_failures":1,"runtime_title_visual_suppressed_builds":0,"runtime_custom_cover_builds":0,"runtime_simulated_button_presses_total":0},"status":"crash","description":"always-on correct Continue builder hook installed but never fired in product self-open state","timestamp":1782370344053,"segment":0,"confidence":4.833333333333333,"asi":{"hypothesis":"Install the corrected Continue result builder hook (deobf 0x1408254a0, dump 0x140825590) from the always-on title suppression startup path instead of the ER_EFFECTS_TRACE_CONTINUE gate, while preserving the native 05_000_Title/TitleTopDialog job. If the real Continue callback is constructed in the product self-open state, the hook should fire without relying on trace env propagation.","rollback_reason":"Runtime timed out. The always-on hook installed successfully at +58ms (`queued always-on Continue result builder hook 0x1408254a0`), but it never fired (`ALWAYS TITLE-CONTINUE-RESULT-BUILDER` count 0). Product core still reached ready TitleTopDialog/menu_latch/profile-active and only saw/rejected the idle MenuWindowJob candidate; native submit/continue_load remained zero. This falsifies the idea that the product self-open path constructs the real Continue builder at 0x1408254a0.","next_action_hint":"Static RE should determine what action `FUN_1409b3050` actually wires when self-opening the menu: it calls FUN_1409a6410 and FUN_1409b3750 after setting the embedded registry, while the 0x1408254a0 Continue builder never executes. Next experiment should hook/log FUN_1409a6410/FUN_1409b3750 or decompile their exact dump/deobf mappings, not add more Continue-builder hooks. Preserve the finding that 0x1408254a0 is correct for a different/manual/native construction path but not reached by product self-open.","artifact_dir":"/home/banon/projects/er-effects-rs/target/runtime-probe/product-continue-direct-20260624-235016","observed_runtime_oracles":{"always_on_builder_hook_installed":true,"builder_hook_address":"0x1408254a0","builder_hook_hits":0,"autoload_method":"direct_menu_load","title_hook":"preserved native 05_000_Title","product_core_ready_blocker":"ready","product_core_ready_successes":547,"product_core_last_title_dialog_vt":"0x142b26468/TitleTopDialog","product_core_last_menu_opened_latch":1,"profile_slot_active_bytes_qword":"0x1","idle_candidate_item":"0x7ffe9e52c000","idle_candidate_hits":1135,"native_submit_hits":0,"continue_load_fired":false,"simulated_button_presses_total":0,"messagebox_postload_builds":0,"processes_remaining":0},"build":"cargo xwin build --release --target x86_64-pc-windows-msvc succeeded after fixing a bad import insertion during patching.","cleanup":"No eldenring.exe or start_protected_game.exe processes remained."}}
{"run":74,"commit":"2100051","metric":0,"metrics":{"readiness_gate_failures":1,"target_constants_remaining":0,"helpers_missing":0,"fixed_wait_predicates":0,"autoload_static_failures":1,"asset_chain_failures":0,"dll_patch_failures":0,"native_continue_failures":0,"field58_gate_failures":0,"direct_shortcut_failures":0,"input_path_failures":0,"runtime_proof_failures":1,"runtime_mode_failures":0,"eula_popup_failures":0,"save_data_popup_failures":0,"messagebox_dialog_failures":0,"server_status_failures":0,"title_cover_failures":0,"title_cover_penalty":0,"native_trace_blockers":0,"native_trace_hits_total":74,"native_trace_unique_breakpoints":11,"false_positives":0,"runtime_timeout_failures":1,"runtime_title_visual_suppressed_builds":0,"runtime_custom_cover_builds":0,"runtime_simulated_button_presses_total":0},"status":"crash","description":"self-open target diagnostic hooks destabilized title readiness before firing","timestamp":1782370620884,"segment":0,"confidence":4.833333333333333,"asi":{"hypothesis":"Static RE showed self-open FUN_1409b3050 calls deobf 0x1409a6410, 0x1409b3750, and 0x14082d1c0 rather than constructing the 0x1408254a0 Continue builder. Add pass-through diagnostic hooks for those self-open targets while preserving native 05_000_Title to capture the actual runtime args and confirm which path is executed.","rollback_reason":"Runtime failed before product readiness. The hooks for a6410 and 82d1c0 queued, but no SELF-OPEN-HOOK fired. Product core never reached ready: title_dialog vtable became bogus/text-like 0x6f007200680054, menu_latch stayed 0, profile_slot_active_bytes_qword stayed 0, title_handoff_complete=false, and the run exited early. The diagnostic hook set is too invasive or incompletely installed for this path, so it produced no useful function-entry evidence.","next_action_hint":"Do not hook multiple self-open functions at once. Static RE first: map/decompile 0x1409b35a0 and validate exact prototypes for 0x1409a6410/0x1409b3750/0x14082d1c0. If runtime hook is still needed, hook only one target per run and use the exact prototype/return type. Also investigate why b3750 did not log a queued hook while a6410 and 82d1c0 did.","artifact_dir":"/home/banon/projects/er-effects-rs/target/runtime-probe/product-continue-direct-20260624-235528","observed_runtime_oracles":{"queued_self_open_hooks":["a6410","82d1c0"],"self_open_hook_hits":0,"autoload_method":"direct_menu_load","product_autoload_armed":true,"product_core_ready_blocker":"title_dialog","product_core_ready_successes":0,"product_core_last_title_dialog_vt":"0x6f007200680054","product_core_last_menu_opened_latch":0,"profile_slot_active_bytes_qword":"0x0","title_handoff_complete":false,"native_continue_chain_stage":"pre_submit","native_submit_hits":0,"continue_load_fired":false,"simulated_button_presses_total":0,"processes_remaining":0},"static_re":{"FUN_1409b3050_calls":["FUN_140733440(param_1+0xa48,1)","FUN_1409a6410(param_1+0xaa8,1)","FUN_1409b35a0(param_1)","FUN_14082d1c0(*(param_1+0xa38), stack_byte0, &saveSlot)","FUN_1409b3750(param_1,0)","FUN_140749ae0(param_1+0xa60, TextFadeOut)"],"correct_continue_builder":"deobf 0x1408254a0 did not fire in self-open state"},"build":"cargo xwin build --release --target x86_64-pc-windows-msvc succeeded.","cleanup":"No eldenring.exe or start_protected_game.exe processes remained."}}
{"run":75,"commit":"2100051","metric":0,"metrics":{"readiness_gate_failures":1,"target_constants_remaining":0,"helpers_missing":0,"fixed_wait_predicates":0,"autoload_static_failures":1,"asset_chain_failures":0,"dll_patch_failures":0,"native_continue_failures":0,"field58_gate_failures":0,"direct_shortcut_failures":0,"input_path_failures":0,"runtime_proof_failures":1,"runtime_mode_failures":0,"eula_popup_failures":0,"save_data_popup_failures":0,"messagebox_dialog_failures":0,"server_status_failures":0,"title_cover_failures":0,"title_cover_penalty":0,"native_trace_blockers":0,"native_trace_hits_total":74,"native_trace_unique_breakpoints":11,"false_positives":0,"runtime_timeout_failures":1,"runtime_title_visual_suppressed_builds":0,"runtime_custom_cover_builds":0,"runtime_simulated_button_presses_total":0},"status":"crash","description":"single exact b35a0 self-open hook installed but never fired while TitleTopDialog stayed ready","timestamp":1782370943160,"segment":0,"confidence":4.833333333333333,"asi":{"hypothesis":"Hook only the content-unique self-open helper deobf 0x1409b35a0 with its exact void(dialog,char,...) ABI, while preserving native 05_000_Title/TitleTopDialog, to avoid the multi-hook destabilization and learn whether FUN_1409b3050's self-open path reaches this helper at runtime.","rollback_reason":"Runtime timed out. The b35a0 hook queued successfully at 0x1409b35a0 and did not destabilize readiness: product_core reached ready TitleTopDialog/menu_latch/profile-active. However SELF-OPEN-HOOK b35a0 never fired, native submit/continue_load stayed zero, and the only candidate remained the idle MenuWindowJob. This indicates the runtime product path did not execute FUN_1409b35a0 during the observed self-open/ready window, despite static decomp showing it in FUN_1409b3050.","next_action_hint":"The product path reaching ready may not be running FUN_1409b3050 at all, or the function address/call path differs in deobf/live. Next static target should identify the exact live path that sets menu_opened_latch=1 and product_core ready: hook/log the proven state transition side effects instead (writes to TitleTopDialog+0xa40 latch and state machine TextFadeOut), or statically xref/write-scan those offsets. Avoid more hooks on presumed helpers until the callsite is proven live.","artifact_dir":"/home/banon/projects/er-effects-rs/target/runtime-probe/product-continue-direct-20260624-235958","observed_runtime_oracles":{"queued_b35a0_hook":true,"b35a0_hook_hits":0,"autoload_method":"direct_menu_load","title_hook":"preserved native 05_000_Title","product_core_ready_blocker":"ready","product_core_ready_successes":555,"product_core_last_title_dialog_vt":"0x142b26468/TitleTopDialog","product_core_last_menu_opened_latch":1,"profile_slot_active_bytes_qword":"0x1","title_handoff_complete":true,"idle_candidate_item":"0x7ffe9e52c000","idle_candidate_hits":1152,"native_submit_hits":0,"continue_load_fired":false,"simulated_button_presses_total":0,"messagebox_postload_builds":0,"processes_remaining":0},"static_re":{"b35a0_mapping":"deobf 0x1409b35a0 -> dump 0x1409b36f0 content-unique","b35a0_decomp":"playgo/progress visibility helper; writes SceneObjProxy at dialog+0xc98, not Continue action"},"build":"cargo xwin build --release --target x86_64-pc-windows-msvc succeeded.","cleanup":"No eldenring.exe or start_protected_game.exe processes remained."}}
{"run":76,"commit":"2100051","metric":0,"metrics":{"readiness_gate_failures":1,"target_constants_remaining":0,"helpers_missing":0,"fixed_wait_predicates":0,"autoload_static_failures":1,"asset_chain_failures":0,"dll_patch_failures":0,"native_continue_failures":0,"field58_gate_failures":0,"direct_shortcut_failures":0,"input_path_failures":0,"runtime_proof_failures":1,"runtime_mode_failures":0,"eula_popup_failures":0,"save_data_popup_failures":0,"messagebox_dialog_failures":0,"server_status_failures":0,"title_cover_failures":0,"title_cover_penalty":0,"native_trace_blockers":0,"native_trace_hits_total":74,"native_trace_unique_breakpoints":11,"false_positives":0,"runtime_timeout_failures":1,"runtime_title_visual_suppressed_builds":0,"runtime_custom_cover_builds":0,"runtime_simulated_button_presses_total":0},"status":"crash","description":"FD4 SetState trace identified live TextFadeOut transition caller but no Continue load","timestamp":1782371282411,"segment":0,"confidence":4.833333333333333,"asi":{"hypothesis":"Instead of guessing which helper FUN_1409b3050 calls, hook the proven FD4 SetState function deobf 0x1407499e0 and log state descriptor transitions. This should identify the live caller that sets TitleTopDialog into TextFadeOut/menu-open readiness while preserving native 05_000_Title.","rollback_reason":"Runtime timed out before native Continue/load proof. The SetState trace hook was non-destructive and product_core still reached ready TitleTopDialog/menu_latch/profile-active, but no native Continue submit or continue_load fired. This was diagnostic-only and weakens title-cover scoring because the native title job was preserved.","next_action_hint":"Static RE/decompile the live TextFadeOut caller at caller_rva=0x9b253f (deobf) and nearby function containing it, because this is the actual path that sets the TitleTopDialog state to TextFadeOut (desc_rva=0x2b264f0) in the product run. Also inspect Loop callers 0x732faa/0x73925b and FadeIn callers 0x744e2b/0x9a831f. The next runtime hook should target the live TextFadeOut caller/function, not presumed self-open helpers that never fired.","artifact_dir":"/home/banon/projects/er-effects-rs/target/runtime-probe/product-continue-direct-20260625-000545","observed_runtime_oracles":{"fd4_setstate_hook_installed":true,"product_core_ready_blocker":"ready","product_core_ready_successes":563,"product_core_last_title_dialog_vt":"0x142b26468/TitleTopDialog","product_core_last_menu_opened_latch":1,"profile_slot_active_bytes_qword":"0x1","title_handoff_complete":true,"textfadeout_transition":{"sm":"0x7ffe969d47a0","desc_rva":"0x2b264f0","caller_rva":"0x9b253f","time_ms":15256},"loop_transition_callers":["0x732faa","0x73925b"],"fadein_transition_callers":["0x744e2b","0x9a831f"],"idle_candidate_item":"0x7ffe9e52c000","idle_candidate_hits":1168,"native_submit_hits":0,"continue_load_fired":false,"simulated_button_presses_total":0,"messagebox_postload_builds":0,"processes_remaining":0},"build":"cargo xwin build --release --target x86_64-pc-windows-msvc succeeded.","cleanup":"No eldenring.exe or start_protected_game.exe processes remained."}}
