{"run":95,"commit":"2100051","metric":0,"metrics":{"readiness_gate_failures":0,"target_constants_remaining":0,"helpers_missing":0,"fixed_wait_predicates":0,"autoload_static_failures":0,"asset_chain_failures":0,"dll_patch_failures":0,"native_continue_failures":0,"field58_gate_failures":0,"direct_shortcut_failures":0,"input_path_failures":0,"runtime_proof_failures":1,"runtime_mode_failures":0,"eula_popup_failures":0,"save_data_popup_failures":0,"messagebox_dialog_failures":0,"server_status_failures":0,"title_cover_failures":0,"title_cover_penalty":0,"native_trace_blockers":0,"native_trace_hits_total":0,"native_trace_unique_breakpoints":0,"false_positives":0,"runtime_timeout_failures":1,"runtime_title_visual_suppressed_builds":0,"runtime_custom_cover_builds":0,"runtime_simulated_button_presses_total":0},"status":"crash","description":"runtime-tested PressStart readiness relaxation with rebuilt DLL and direct_menu_load sentinel","timestamp":1782398706640,"segment":0,"confidence":4.833333333333333,"asi":{"hypothesis":"With a rebuilt DLL, relaxing the PressStart SceneObjProxy/context gate would let product_core call TitleTopDialog::open_menu in the blocked state and produce new runtime readiness/load evidence.","rollback_reason":"run_experiment timed out while the bounded runtime probe was still in launch/probe output; no readiness/result-chain metrics were emitted, so the mutation is untrusted.","next_action_hint":"Inspect the product-continue-direct-20260625-074350 artifact logs for whether product_core reached open_menu after the PressStart relaxation; use that evidence before another runtime, and avoid harness-level timeouts by reducing runtime cap or improving stop conditions."}}
{"run":96,"commit":"2100051","metric":0,"metrics":{"readiness_gate_failures":0,"target_constants_remaining":0,"helpers_missing":0,"fixed_wait_predicates":0,"autoload_static_failures":0,"asset_chain_failures":0,"dll_patch_failures":0,"native_continue_failures":0,"field58_gate_failures":0,"direct_shortcut_failures":0,"input_path_failures":0,"runtime_proof_failures":1,"runtime_mode_failures":0,"eula_popup_failures":0,"save_data_popup_failures":0,"messagebox_dialog_failures":0,"server_status_failures":0,"title_cover_failures":1,"title_cover_penalty":1,"native_trace_blockers":0,"native_trace_hits_total":0,"native_trace_unique_breakpoints":0,"false_positives":0,"runtime_timeout_failures":1,"runtime_title_visual_suppressed_builds":0,"runtime_custom_cover_builds":0,"runtime_simulated_button_presses_total":0},"status":"crash","description":"runtime-tested diagnostic preservation of native 05_000_Title wrapper instead of replacing it with cover job","timestamp":1782398866844,"segment":0,"confidence":4.833333333333333,"asi":{"hypothesis":"Current Part-A replacement cover causes product_core to see ProfileLoadDialog; preserving the native 05_000_Title wrapper should restore TitleTopDialog/native menu chain so downstream Continue evidence can be observed, even though visual suppression is temporarily diagnostic-only.","rollback_reason":"run_experiment timed out at the runtime harness level before metric output, so the mutation is untrusted and not keepable; it also intentionally sacrifices title-cover suppression.","next_action_hint":"Inspect product-continue-direct-20260625-074636 artifact for TitleTopDialog vs ProfileLoadDialog and whether the diagnostic preserve hook fired; if it restored TitleTopDialog, the next real path is suppressing render inside the preserved native job rather than replacing the out-slot."}}
{"run":97,"commit":"2100051","metric":0,"metrics":{"readiness_gate_failures":0,"target_constants_remaining":0,"helpers_missing":0,"fixed_wait_predicates":0,"autoload_static_failures":0,"asset_chain_failures":0,"dll_patch_failures":0,"native_continue_failures":0,"field58_gate_failures":0,"direct_shortcut_failures":0,"input_path_failures":0,"runtime_proof_failures":1,"runtime_mode_failures":0,"eula_popup_failures":0,"save_data_popup_failures":0,"messagebox_dialog_failures":0,"server_status_failures":0,"title_cover_failures":1,"title_cover_penalty":1,"native_trace_blockers":0,"native_trace_hits_total":0,"native_trace_unique_breakpoints":0,"false_positives":0,"runtime_timeout_failures":1,"runtime_title_visual_suppressed_builds":0,"runtime_custom_cover_builds":0,"runtime_simulated_button_presses_total":0},"status":"crash","description":"runtime-tested native BeginTitle side-effect preservation followed by clearing the 05_000_Title out-slot","timestamp":1782399052623,"segment":0,"confidence":4.833333333333333,"asi":{"hypothesis":"Replacing BeginTitle with ProfileSelect causes ProfileLoadDialog; calling the native 05_000_Title wrapper first then clearing its out-slot might preserve TitleTopDialog side effects while suppressing the visual job.","rollback_reason":"run_experiment timed out at the runtime harness level before metric output; the run did not produce a scored product proof and the mutation may suppress required native job execution.","next_action_hint":"Inspect product-continue-direct-20260625-074940 artifact for whether clearing out-slot preserves TitleTopDialog or regresses to ProfileLoadDialog; compare against preserved-native artifact 20260625-074636 before another runtime."}}
{"run":98,"commit":"2100051","metric":0,"metrics":{"readiness_gate_failures":0,"target_constants_remaining":0,"helpers_missing":0,"fixed_wait_predicates":0,"autoload_static_failures":0,"asset_chain_failures":0,"dll_patch_failures":0,"native_continue_failures":0,"field58_gate_failures":0,"direct_shortcut_failures":0,"input_path_failures":0,"runtime_proof_failures":1,"runtime_mode_failures":0,"eula_popup_failures":0,"save_data_popup_failures":0,"messagebox_dialog_failures":0,"server_status_failures":0,"title_cover_failures":1,"title_cover_penalty":1,"native_trace_blockers":0,"native_trace_hits_total":0,"native_trace_unique_breakpoints":0,"false_positives":0,"runtime_timeout_failures":1,"runtime_title_visual_suppressed_builds":0,"runtime_custom_cover_builds":0,"runtime_simulated_button_presses_total":0},"status":"crash","description":"short-cap runtime test of native BeginTitle preservation as stable base for later render-only suppression","timestamp":1782399177612,"segment":0,"confidence":4.833333333333333,"asi":{"hypothesis":"Preserving the native 05_000_Title wrapper should restore TitleTopDialog/native title-menu state; using an 18s runtime cap should avoid harness-level timeout and produce a clean scored failure artifact for comparison.","rollback_reason":"Runtime probe exited nonzero before measure metrics, so no product proof or primary-score improvement; native-wrapper preservation remains diagnostic-only and weakens title-cover behavior.","next_action_hint":"Inspect product-continue-direct-20260625-075215 for whether the shorter run reproduced TitleTopDialog readiness and idle-only rejection; if yes, pivot to static RE of the actual Continue action object/chain under preserved native title, not more wrapper replacement."}}
{"run":99,"commit":"2100051","metric":0,"metrics":{"readiness_gate_failures":0,"target_constants_remaining":0,"helpers_missing":0,"fixed_wait_predicates":0,"autoload_static_failures":0,"asset_chain_failures":0,"dll_patch_failures":0,"native_continue_failures":0,"field58_gate_failures":0,"direct_shortcut_failures":0,"input_path_failures":0,"runtime_proof_failures":1,"runtime_mode_failures":0,"eula_popup_failures":0,"save_data_popup_failures":0,"messagebox_dialog_failures":0,"server_status_failures":0,"title_cover_failures":1,"title_cover_penalty":1,"native_trace_blockers":0,"native_trace_hits_total":0,"native_trace_unique_breakpoints":0,"false_positives":0,"runtime_timeout_failures":1,"runtime_title_visual_suppressed_builds":0,"runtime_custom_cover_builds":0,"runtime_simulated_button_presses_total":0},"status":"crash","description":"combined preserved native BeginTitle with semantic SetState(BeginLogo) press-start transition","timestamp":1782399412829,"segment":0,"confidence":4.833333333333333,"asi":{"hypothesis":"With native BeginTitle preserved so product_core reaches the real TitleTopDialog, replacing the bare open_menu self-fire with the native press-start SetState(BeginLogo=2) transition may let the native pump build the full main menu/Continue action without input or direct load.","rollback_reason":"Runtime probe exited nonzero before measure emitted scored metrics, so no product proof or primary-score improvement; the mutation is diagnostic and also weakens title-cover behavior by preserving native visuals.","next_action_hint":"Inspect product-continue-direct-20260625-075557 for whether SetState(BeginLogo) produced semantic Continue latches or regressed state; if it still only produces idle d180, stop runtime probing and statically decode the title menu action construction path under the preserved native job."}}
{"run":100,"commit":"2100051","metric":0,"metrics":{"readiness_gate_failures":0,"target_constants_remaining":0,"helpers_missing":0,"fixed_wait_predicates":0,"autoload_static_failures":0,"asset_chain_failures":0,"dll_patch_failures":0,"native_continue_failures":0,"field58_gate_failures":0,"direct_shortcut_failures":0,"input_path_failures":0,"runtime_proof_failures":1,"runtime_mode_failures":0,"eula_popup_failures":0,"save_data_popup_failures":0,"messagebox_dialog_failures":0,"server_status_failures":0,"title_cover_failures":1,"title_cover_penalty":1,"native_trace_blockers":0,"native_trace_hits_total":0,"native_trace_unique_breakpoints":0,"false_positives":0,"runtime_timeout_failures":1,"runtime_title_visual_suppressed_builds":0,"runtime_custom_cover_builds":0,"runtime_simulated_button_presses_total":0},"status":"crash","description":"passive native-accept MenuWindowJob constructor diagnostics under preserved native title wrapper","timestamp":1782399668545,"segment":0,"confidence":4.833333333333333,"asi":{"hypothesis":"Under preserved native title state, the real Continue action may be among native-accept MenuWindowJob constructor B items rather than the idle d180 candidate; logging first-N native-accept constructors should identify candidate docalls/callers without submitting or weakening product path.","rollback_reason":"Runtime probe exited nonzero before measure emitted scored metrics; diagnostic logging does not improve primary score and the preserved-title mutation intentionally weakens title-cover behavior.","next_action_hint":"Inspect product-continue-direct-20260625-080019 for native-ctor-b-diagnostic samples; use their caller/docall/vtable data for static RE before any further runtime submit attempt."}}
{"run":101,"commit":"2100051","metric":1520,"metrics":{"readiness_gate_failures":0,"target_constants_remaining":0,"helpers_missing":0,"fixed_wait_predicates":0,"autoload_static_failures":0,"asset_chain_failures":0,"dll_patch_failures":0,"native_continue_failures":0,"field58_gate_failures":0,"direct_shortcut_failures":0,"input_path_failures":0,"runtime_proof_failures":1,"runtime_mode_failures":0,"eula_popup_failures":0,"save_data_popup_failures":0,"messagebox_dialog_failures":0,"server_status_failures":0,"title_cover_failures":0,"title_cover_penalty":0,"native_trace_blockers":0,"native_trace_hits_total":74,"native_trace_unique_breakpoints":11,"false_positives":0,"runtime_timeout_failures":0,"runtime_title_visual_suppressed_builds":0,"runtime_custom_cover_builds":0,"runtime_simulated_button_presses_total":0},"status":"discard","description":"updated static oracle to require idle-row rejection/native-accept promotion after runtime falsified idle submission","timestamp":1782399823643,"segment":0,"confidence":5.523809523809524,"asi":{"hypothesis":"Runtime evidence repeatedly falsified accepting the idle d180 MenuWindowJob, so the static oracle should require product code to reject the constant-false idle predicate and promote only native-accept Continue candidates.","rollback_reason":"Primary metric 1520 only matched the persisted best and did not improve it; per loop policy unchanged primary score is discarded.","next_action_hint":"Static RE the native-accept ctor-B docalls/callers from artifact product-continue-direct-20260625-080019, especially caller 0x78d9f1/docall 0x14078ee60 and caller 0x81fa90/docall 0x140820b30, before another runtime submit attempt."}}
{"run":102,"commit":"2100051","metric":1520,"metrics":{"readiness_gate_failures":0,"target_constants_remaining":0,"helpers_missing":0,"fixed_wait_predicates":0,"autoload_static_failures":0,"asset_chain_failures":0,"dll_patch_failures":0,"native_continue_failures":0,"field58_gate_failures":0,"direct_shortcut_failures":0,"input_path_failures":0,"runtime_proof_failures":1,"runtime_mode_failures":0,"eula_popup_failures":0,"save_data_popup_failures":0,"messagebox_dialog_failures":0,"server_status_failures":0,"title_cover_failures":0,"title_cover_penalty":0,"native_trace_blockers":0,"native_trace_hits_total":74,"native_trace_unique_breakpoints":11,"false_positives":0,"runtime_timeout_failures":0,"runtime_title_visual_suppressed_builds":0,"runtime_custom_cover_builds":0,"runtime_simulated_button_presses_total":0},"status":"discard","description":"static decoded native-accept ctor-B samples and revalidated current oracle without product mutation","timestamp":1782399956905,"segment":0,"confidence":6.444444444444445,"asi":{"hypothesis":"Static decode of run #100 native-accept ctor-B samples would identify whether they are plausible Continue actions before another runtime submit attempt.","rollback_reason":"Primary metric 1520 matched but did not exceed the persisted best, so unchanged score is discarded.","next_action_hint":"Do not chase ctor-B samples from run #100 as Continue: sample 1 is BeginTitle/05_000_Title wrapper path (caller 0x81fa90, docall 0x140820b30), samples 2/4/5 are generic/title jobs from caller 0x78d9f1 with docall 0x14078ee60. Next promising path is static RE of the native title menu row/action construction upstream of the idle insert caller 0x764338, not submitting these ctor-B jobs."}}
{"run":103,"commit":"2100051","metric":1520,"metrics":{"readiness_gate_failures":0,"target_constants_remaining":0,"helpers_missing":0,"fixed_wait_predicates":0,"autoload_static_failures":0,"asset_chain_failures":0,"dll_patch_failures":0,"native_continue_failures":0,"field58_gate_failures":0,"direct_shortcut_failures":0,"input_path_failures":0,"runtime_proof_failures":1,"runtime_mode_failures":0,"eula_popup_failures":0,"save_data_popup_failures":0,"messagebox_dialog_failures":0,"server_status_failures":0,"title_cover_failures":0,"title_cover_penalty":0,"native_trace_blockers":0,"native_trace_hits_total":74,"native_trace_unique_breakpoints":11,"false_positives":0,"runtime_timeout_failures":0,"runtime_title_visual_suppressed_builds":0,"runtime_custom_cover_builds":0,"runtime_simulated_button_presses_total":0},"status":"discard","description":"recorded static RE lead for idle insert/MenuWindowJob::Run result propagation and remeasured","timestamp":1782400087265,"segment":0,"confidence":7.733333333333333,"asi":{"hypothesis":"Static RE of idle insert caller 0x140764338 suggests the next real path is native MenuWindowJob::Run job-result propagation from the preserved 05_000_Title job, not ctor-B submission or idle d180 direct submit.","rollback_reason":"Primary metric 1520 matched but did not exceed the persisted best; no product mutation or runtime proof improvement was produced.","next_action_hint":"Trace or statically consume the job-result propagation from MenuWindowJob::Run (0x1407ad1c0: FUN_140744ed0/FUN_140733ff0, jobResult=Continue) under preserved native 05_000_Title, rather than submitting ctor-B samples or the idle candidate."}}
{"run":104,"commit":"2100051","metric":0,"metrics":{"readiness_gate_failures":0,"target_constants_remaining":0,"helpers_missing":0,"fixed_wait_predicates":0,"autoload_static_failures":0,"asset_chain_failures":0,"dll_patch_failures":0,"native_continue_failures":0,"field58_gate_failures":0,"direct_shortcut_failures":0,"input_path_failures":0,"runtime_proof_failures":1,"runtime_mode_failures":0,"eula_popup_failures":0,"save_data_popup_failures":0,"messagebox_dialog_failures":0,"server_status_failures":0,"title_cover_failures":1,"title_cover_penalty":1,"native_trace_blockers":0,"native_trace_hits_total":0,"native_trace_unique_breakpoints":0,"false_positives":0,"runtime_timeout_failures":1,"runtime_title_visual_suppressed_builds":0,"runtime_custom_cover_builds":0,"runtime_simulated_button_presses_total":0},"status":"crash","description":"passive MenuJobResult::ShouldContinue observer under preserved native title wrapper","timestamp":1782400408678,"segment":0,"confidence":7.733333333333333,"asi":{"hypothesis":"Under preserved native 05_000_Title, passive observation of MenuJobResult::ShouldContinue should reveal whether MenuWindowJob::Run propagates Continue job results that product_core can consume instead of submitting idle/ctor-B jobs.","rollback_reason":"Runtime probe exited nonzero before measure emitted scored metrics; passive hook plus native-title preservation is diagnostic only and not product proof.","next_action_hint":"Inspect product-continue-direct-20260625-081238 for menu-job-result-diagnostic lines. If Continue states appear, statically identify the owner/result consumer before changing product behavior; if absent, the result propagation hypothesis is falsified for this path."}}
{"run":105,"commit":"2100051","metric":1520,"metrics":{"readiness_gate_failures":0,"target_constants_remaining":0,"helpers_missing":0,"fixed_wait_predicates":0,"autoload_static_failures":0,"asset_chain_failures":0,"dll_patch_failures":0,"native_continue_failures":0,"field58_gate_failures":0,"direct_shortcut_failures":0,"input_path_failures":0,"runtime_proof_failures":1,"runtime_mode_failures":0,"eula_popup_failures":0,"save_data_popup_failures":0,"messagebox_dialog_failures":0,"server_status_failures":0,"title_cover_failures":0,"title_cover_penalty":0,"native_trace_blockers":0,"native_trace_hits_total":74,"native_trace_unique_breakpoints":11,"false_positives":0,"runtime_timeout_failures":0,"runtime_title_visual_suppressed_builds":0,"runtime_custom_cover_builds":0,"runtime_simulated_button_presses_total":0},"status":"discard","description":"recorded static xref finding that ShouldContinue/result propagation is generic, not title-Continue-specific","timestamp":1782400507098,"segment":0,"confidence":9.666666666666666,"asi":{"hypothesis":"Xrefs to MenuJobResult::ShouldContinue and related result propagation could reveal a title-specific Continue consumer upstream of the idle insert path.","rollback_reason":"Primary metric 1520 matched but did not exceed the persisted best; the iteration added only a deferred static RE note, not product proof.","next_action_hint":"Do not chase ShouldContinue alone: xrefs are generic sequence/dialog runners and runtime hook saw no samples under product timing. Next path is static RE of the title-specific row/action builder before idle insert caller 0x764338 or the consumer that maps 05_000_Title job results into title actions."}}
{"run":106,"commit":"2100051","metric":1520,"metrics":{"readiness_gate_failures":0,"target_constants_remaining":0,"helpers_missing":0,"fixed_wait_predicates":0,"autoload_static_failures":0,"asset_chain_failures":0,"dll_patch_failures":0,"native_continue_failures":0,"field58_gate_failures":0,"direct_shortcut_failures":0,"input_path_failures":0,"runtime_proof_failures":1,"runtime_mode_failures":0,"eula_popup_failures":0,"save_data_popup_failures":0,"messagebox_dialog_failures":0,"server_status_failures":0,"title_cover_failures":0,"title_cover_penalty":0,"native_trace_blockers":0,"native_trace_hits_total":74,"native_trace_unique_breakpoints":11,"false_positives":0,"runtime_timeout_failures":0,"runtime_title_visual_suppressed_builds":0,"runtime_custom_cover_builds":0,"runtime_simulated_button_presses_total":0},"status":"discard","description":"recorded static RE lead that idle insert lambda body has no direct title-Continue action xrefs","timestamp":1782400628321,"segment":0,"confidence":9.666666666666666,"asi":{"hypothesis":"Static xrefs around idle insert factory FUN_140764380 and Continue docall 0x140764b80 might reveal a title-specific Continue action before runtime submission.","rollback_reason":"Primary metric 1520 matched but did not exceed the persisted best; iteration produced only a deferred static RE note.","next_action_hint":"FUN_140764380/lambda_606 is just the MenuWindowJob creation wrapper selected by title setup; no direct Continue action xref was found. Static RE TitleTopDialog/open-menu row construction state before this lambda is chosen, rather than the lambda body or ctor-B samples."}}
