{"run":279,"commit":"bd8fff0","metric":1520,"metrics":{"readiness_gate_failures":0,"target_constants_remaining":0,"helpers_missing":0,"fixed_wait_predicates":0,"autoload_static_failures":0,"asset_chain_failures":0,"dll_patch_failures":0,"native_continue_failures":0,"field58_gate_failures":0,"direct_shortcut_failures":0,"input_path_failures":0,"runtime_proof_failures":1,"runtime_mode_failures":0,"eula_popup_failures":0,"save_data_popup_failures":0,"messagebox_dialog_failures":0,"server_status_failures":0,"title_cover_failures":0,"title_cover_penalty":0,"native_trace_blockers":0,"native_trace_hits_total":74,"native_trace_unique_breakpoints":11,"false_positives":0,"runtime_timeout_failures":0,"runtime_title_visual_suppressed_builds":0,"runtime_custom_cover_builds":0,"runtime_simulated_button_presses_total":0},"status":"keep","description":"gate ProfileSelect canvas until after native accept byte","timestamp":1782451169668,"segment":0,"confidence":null,"asi":{"hypothesis":"The ProfileSelect canvas MenuWindowJob may block or interfere with Press Any Button / title advance if pumped before the native accept byte. Gate the custom canvas Run so it is built/latches normally but does not run until TITLE_ACCEPT_BYTE_GATE_FIRED is true.","evidence":"User suspected the canvas; persisted bd memory profileselect-canvas-suspected-pab-blocker-2026-06-25. Code change: title_custom_cover_menu_window_run_hook now returns after the native job if TITLE_ACCEPT_BYTE_GATE_FIRED is false, and only pumps ProfileSelect cover post-accept. cargo fmt/cargo xwin build and .auto/measure.sh passed at 1520.","next_action_hint":"Run on-screen probe. If title advance/load is cleaner, keep ProfileSelect canvas out of pre-accept phase permanently. If canvas still blocks after accept, disable it entirely and replace with a non-MenuWindow/root-reachable cover or live renderer binding."}}
{"run":280,"commit":"ef78ff1","metric":1280,"metrics":{"readiness_gate_failures":0,"target_constants_remaining":0,"helpers_missing":0,"fixed_wait_predicates":0,"autoload_static_failures":0,"asset_chain_failures":0,"dll_patch_failures":0,"native_continue_failures":0,"field58_gate_failures":0,"direct_shortcut_failures":0,"input_path_failures":0,"runtime_proof_failures":1,"runtime_mode_failures":0,"eula_popup_failures":0,"save_data_popup_failures":0,"messagebox_dialog_failures":0,"server_status_failures":0,"title_cover_failures":0,"title_cover_penalty":0,"native_trace_blockers":0,"native_trace_hits_total":74,"native_trace_unique_breakpoints":11,"false_positives":0,"runtime_timeout_failures":0,"runtime_title_visual_suppressed_builds":0,"runtime_custom_cover_builds":0,"runtime_simulated_button_presses_total":0},"status":"keep","description":"revert ProfileSelect canvas and penalize missing character-load proof","timestamp":1782451494498,"segment":0,"confidence":null,"asi":{"hypothesis":"The ProfileSelect canvas was a false-positive custom-cover path: it can display a blank Load Game/ProfileSelect frame and interfere with PAB/title advance, but it is not the desired clean cover and should not count toward score. Missing actual character/world load proof should carry a major penalty.","evidence":"Removed ProfileSelect canvas side effects from the product path: no build_profile_select_cover_job calls from PAB/BeginTitle wrappers and no START_TITLE_CUSTOM_COVER_RUN install. .auto/measure.sh no longer counts ProfileSelect/MenuWindowJob canvas as Part B success and increases runtime missing-proof penalty to 320. cargo fmt passed; cargo xwin build returned 0; corrected measure passed with autoload_re_score=1280 and runtime_proof_failures=1.","guard_event":"A semicolon-chained Bash verification command was correctly blocked by cupcake; switched to ctx_execute for build summary instead of working around the guard.","rollback_reason":"Intentional metric drop: this is a false-positive correction and user-directed revert, not a performance regression to discard.","next_action_hint":"Do not restore the ProfileSelect canvas. Next find a non-MenuWindow cover or native renderer binding that does not steal focus/block title advance, while preserving logo/PAB hide and proving actual Banon character/world load in runtime telemetry."}}
{"run":281,"commit":"44cf543","metric":1280,"metrics":{"readiness_gate_failures":0,"target_constants_remaining":0,"helpers_missing":0,"fixed_wait_predicates":0,"autoload_static_failures":0,"asset_chain_failures":0,"dll_patch_failures":0,"native_continue_failures":0,"field58_gate_failures":0,"direct_shortcut_failures":0,"input_path_failures":0,"runtime_proof_failures":1,"runtime_mode_failures":0,"eula_popup_failures":0,"save_data_popup_failures":0,"messagebox_dialog_failures":0,"server_status_failures":0,"title_cover_failures":0,"title_cover_penalty":0,"native_trace_blockers":0,"native_trace_hits_total":74,"native_trace_unique_breakpoints":11,"false_positives":0,"runtime_timeout_failures":0,"runtime_title_visual_suppressed_builds":0,"runtime_custom_cover_builds":0,"runtime_simulated_button_presses_total":0},"status":"keep","description":"runtime validates ProfileSelect canvas removal restores Banon load","timestamp":1782451572857,"segment":0,"confidence":null,"asi":{"hypothesis":"If the ProfileSelect canvas was blocking title advance, removing it entirely should preserve logo/PAB hide while restoring the actual Banon character/world load path.","evidence":"Marker-gated runtime artifact target/runtime-probe/product-continue-direct-20260625-222505: oracle_title_press_start_bind_any_hidden=true, oracle_title_logo_gfx_any_hidden=true, oracle_title_custom_cover_profile_select_builds=0, oracle_title_custom_cover_run_calls=0, oracle_char_name=Banon, oracle_player_present=true, oracle_saved_map_c30=0xe000000, simulated_button_presses_total=0, oracle_msgbox_total_builds=0. User said this is much better.","metric_note":"Corrected scorer remains 1280 because runtime_proof_failures=1; current measure parsing is still not crediting the er-effects telemetry/runtime artifact's actual Banon/world evidence into required_runtime proof.","next_action_hint":"Fix the runtime proof scorer to consume er-effects-telemetry.json/readiness evidence for Banon/world/zero-input/no-popup correctly, without restoring the ProfileSelect canvas. Then pursue a non-MenuWindow cover/live renderer binding."}}
{"run":282,"commit":"9c2b0a1","metric":1420,"metrics":{"readiness_gate_failures":0,"target_constants_remaining":0,"helpers_missing":0,"fixed_wait_predicates":0,"autoload_static_failures":0,"asset_chain_failures":0,"dll_patch_failures":0,"native_continue_failures":0,"field58_gate_failures":0,"direct_shortcut_failures":0,"input_path_failures":0,"runtime_proof_failures":1,"runtime_mode_failures":0,"eula_popup_failures":0,"save_data_popup_failures":0,"messagebox_dialog_failures":0,"server_status_failures":0,"title_cover_failures":2,"title_cover_penalty":100,"native_trace_blockers":0,"native_trace_hits_total":74,"native_trace_unique_breakpoints":11,"false_positives":0,"runtime_timeout_failures":0,"runtime_title_visual_suppressed_builds":0,"runtime_custom_cover_builds":0,"runtime_simulated_button_presses_total":0},"status":"keep","description":"score restored Banon load but penalize missing real cover binding","timestamp":1782451697692,"segment":0,"confidence":null,"asi":{"hypothesis":"The scorer should distinguish restored Banon/world runtime proof from the remaining missing-cover problem, instead of treating both the blank canvas and the fixed no-canvas run the same.","evidence":"Updated .auto/measure.sh to read er-effects-telemetry.json, credit native_continue_chain_stage=world_loaded plus player/name/saved-map RAM evidence for world/continue/deser/confirm proof, use a severe runtime penalty only when core runtime facts are absent, and add runtime title-cover failures/penalty when oracle_title_profile_cover_bound_to_logo_surface=false. Corrected measure: autoload_re_score=1420, runtime_proof_failures=1, title_cover_failures=2, title_cover_penalty=100.","next_action_hint":"Next real optimization is not scorer work: implement or identify a non-MenuWindow cover/live renderer binding that sets oracle_title_profile_cover_bound_to_logo_surface=true while keeping ProfileSelect canvas removed and Banon load intact."}}
{"run":283,"commit":"2a2550c","metric":1420,"metrics":{"readiness_gate_failures":0,"target_constants_remaining":0,"helpers_missing":0,"fixed_wait_predicates":0,"autoload_static_failures":0,"asset_chain_failures":0,"dll_patch_failures":0,"native_continue_failures":0,"field58_gate_failures":0,"direct_shortcut_failures":0,"input_path_failures":0,"runtime_proof_failures":1,"runtime_mode_failures":0,"eula_popup_failures":0,"save_data_popup_failures":0,"messagebox_dialog_failures":0,"server_status_failures":0,"title_cover_failures":2,"title_cover_penalty":100,"native_trace_blockers":0,"native_trace_hits_total":74,"native_trace_unique_breakpoints":11,"false_positives":0,"runtime_timeout_failures":0,"runtime_title_visual_suppressed_builds":0,"runtime_custom_cover_builds":0,"runtime_simulated_button_presses_total":0},"status":"keep","description":"add SYSTEX profile remap onto title logo surface","timestamp":1782452412402,"segment":0,"confidence":null,"asi":{"hypothesis":"Because the native Load/Profile menu maps dummy GFx image symbols to SYSTEX_Menu_ProfileNN through FUN_1407452c0, the root-reachable title image symbol can be remapped to SYSTEX_Menu_Profile00 without constructing the blocking ProfileSelect MenuWindow canvas.","evidence":"Ghidra fixed/reconnected. Static RE: profile refresh live 0x1409aa680 -> dump 0x1409aa7d0 fills CSMenuProfModelRend array; ProfileSelect constructor FUN_1409a5310 maps MENU_DummyProfileFace_NN to SYSTEX_Menu_ProfileNN via FUN_1407452c0; dump 0x1407452c0 -> live 0x1407451c0. Implemented stack NativeStaticDlStringPair binding MENU_Title_EldenRing_01 -> SYSTEX_Menu_Profile00 at TitleTopDialog+0x3b8 after profile refresh, marks TITLE_CUSTOM_COVER_LOGO_REMAP_CALLS and stops forcing logo hidden after remap. cargo fmt/cargo xwin build green; measure unchanged at 1420 because runtime artifact predates new remap.","next_action_hint":"Run marker-gated runtime. Success: oracle_title_custom_cover_logo_remap_calls>0, oracle_title_profile_cover_bound_to_logo_surface=true, Banon/world/zero-input/no-popup remain true, and user-visible cover is not the old logo/PAB/blank canvas."}}
{"run":284,"commit":"2a2550c","metric":0,"metrics":{"readiness_gate_failures":0,"target_constants_remaining":0,"helpers_missing":0,"fixed_wait_predicates":0,"autoload_static_failures":0,"asset_chain_failures":0,"dll_patch_failures":0,"native_continue_failures":0,"field58_gate_failures":0,"direct_shortcut_failures":0,"input_path_failures":0,"runtime_proof_failures":1,"runtime_mode_failures":0,"eula_popup_failures":0,"save_data_popup_failures":0,"messagebox_dialog_failures":0,"server_status_failures":0,"title_cover_failures":2,"title_cover_penalty":100,"native_trace_blockers":0,"native_trace_hits_total":74,"native_trace_unique_breakpoints":11,"false_positives":0,"runtime_timeout_failures":0,"runtime_title_visual_suppressed_builds":0,"runtime_custom_cover_builds":0,"runtime_simulated_button_presses_total":0},"status":"crash","description":"SYSTEX title-logo remap probe exited before readiness","timestamp":1782452475485,"segment":0,"confidence":null,"asi":{"hypothesis":"Bind MENU_Title_EldenRing_01 to SYSTEX_Menu_Profile00 through native helper 0x1407451c0 after profile refresh, so the title logo surface becomes the profile cover without using the blocking ProfileSelect MenuWindow canvas.","error_details":"Runtime artifact target/runtime-probe/product-continue-direct-20260625-224021 failed with readiness reason process_exited_before_ready. Telemetry: oracle_title_custom_cover_logo_remap_calls=0, oracle_title_profile_cover_bound_to_logo_surface=false, oracle_char_name empty, oracle_player_present=false, simulated_button_presses_total=0, oracle_msgbox_total_builds=0. The remap did not fire before exit, so this run does not validate or falsify the bind helper ABI; it shows the mutation regressed early boot/readiness before profile-ready remap.","rollback_reason":"Crash/early process exit before readiness; revert unproven SYSTEX title-logo remap implementation to restore the validated no-canvas Banon load path.","next_action_hint":"After revert, inspect diff/static changes for why profile-ready point was not reached. Keep the Ghidra finding that SYSTEX is native load/profile menu texture path, but reintroduce any remap as a more passive hook or separate diagnostic after confirming it cannot affect pre-profile boot."}}
{"run":285,"commit":"fd24559","metric":1320,"metrics":{"readiness_gate_failures":0,"target_constants_remaining":0,"helpers_missing":0,"fixed_wait_predicates":0,"autoload_static_failures":0,"asset_chain_failures":0,"dll_patch_failures":0,"native_continue_failures":0,"field58_gate_failures":0,"direct_shortcut_failures":0,"input_path_failures":0,"runtime_proof_failures":1,"runtime_mode_failures":0,"eula_popup_failures":0,"save_data_popup_failures":0,"messagebox_dialog_failures":0,"server_status_failures":0,"title_cover_failures":4,"title_cover_penalty":200,"native_trace_blockers":0,"native_trace_hits_total":74,"native_trace_unique_breakpoints":11,"false_positives":0,"runtime_timeout_failures":0,"runtime_title_visual_suppressed_builds":0,"runtime_custom_cover_builds":0,"runtime_simulated_button_presses_total":0},"status":"keep","description":"generate profile renderer scene before SYSTEX refresh/bind","timestamp":1782452641640,"segment":0,"confidence":null,"asi":{"hypothesis":"SYSTEX_Menu_Profile00 needs its native CSMenuProfModelRend scene generated from real save/profile data before refresh/bind. Calling the renderer scene generator (live 0x1409af3a0) after ProfileSummary readiness and before refresh (0x1409aa680) should prevent refreshing an uninitialized renderer array and produce a populated SYSTEX target for the title-logo remap.","evidence":"Added TITLE_CUSTOM_COVER_PROFILE_SCENE_GENERATE_RVA=0x9af3a0, generator telemetry, active-screen slot counting, and maybe_generate_title_profile_cover_scene before maybe_refresh_title_profile_cover/maybe_bind_title_logo_to_systex_cover. Build green. Static measure is 1320 only because latest runtime evidence is the prior crash/no-cover artifact; runtime validation is required next.","metric_note":"Intentional keep despite lower static score: this implements a user-corrected precondition for the SYSTEX path; the score should be judged after the marker runtime artifact.","next_action_hint":"Run marker-gated runtime. Success: profile_scene_generate_nonnull_after>0, refresh_calls>0, logo_remap_calls>0, profile_cover_bound_to_logo_surface=true, Banon/world/zero-input/no-popup intact."}}
{"run":286,"commit":"fd24559","metric":0,"metrics":{"readiness_gate_failures":0,"target_constants_remaining":0,"helpers_missing":0,"fixed_wait_predicates":0,"autoload_static_failures":0,"asset_chain_failures":0,"dll_patch_failures":0,"native_continue_failures":0,"field58_gate_failures":0,"direct_shortcut_failures":0,"input_path_failures":0,"runtime_proof_failures":1,"runtime_mode_failures":0,"eula_popup_failures":0,"save_data_popup_failures":0,"messagebox_dialog_failures":0,"server_status_failures":0,"title_cover_failures":4,"title_cover_penalty":200,"native_trace_blockers":0,"native_trace_hits_total":74,"native_trace_unique_breakpoints":11,"false_positives":0,"runtime_timeout_failures":0,"runtime_title_visual_suppressed_builds":0,"runtime_custom_cover_builds":0,"runtime_simulated_button_presses_total":0},"status":"crash","description":"generated SYSTEX scene path still exits before readiness","timestamp":1782452712026,"segment":0,"confidence":null,"asi":{"hypothesis":"Generating/validating the CSMenuProfModelRend scene before refresh/bind after ProfileSummary readiness should make SYSTEX_Menu_Profile00 populated safely enough to bind to the title-logo surface.","error_details":"Runtime artifact target/runtime-probe/product-continue-direct-20260625-224416 failed with readiness reason process_exited_before_ready. Telemetry/search evidence: oracle_title_logo_profile_summary_ready=true, oracle_title_custom_cover_profile_scene_generate_calls=0, refresh debug line fired at +15905ms for SYSTEX_Menu_Profile00, remap_calls=0, oracle_char_name empty, player_present=false, simulated input=0, msgboxes=0. The profile refresh point was reached, but no valid product/world readiness followed; this did not prove the cover path and may have destabilized boot.","rollback_reason":"Crash/early exit before readiness; unproven SYSTEX scene/remap line should be reverted to the previously validated no-canvas Banon-load state.","next_action_hint":"Static RE before another runtime: identify the valid native owner/context for the SYSTEX scene and the actual visible insertion point. Do not call refresh/bind from the early title product tick until static evidence shows it is side-effect safe."}}
{"run":287,"commit":"c16849f","metric":1320,"metrics":{"readiness_gate_failures":0,"target_constants_remaining":0,"helpers_missing":0,"fixed_wait_predicates":0,"autoload_static_failures":0,"asset_chain_failures":0,"dll_patch_failures":0,"native_continue_failures":0,"field58_gate_failures":0,"direct_shortcut_failures":0,"input_path_failures":0,"runtime_proof_failures":1,"runtime_mode_failures":0,"eula_popup_failures":0,"save_data_popup_failures":0,"messagebox_dialog_failures":0,"server_status_failures":0,"title_cover_failures":4,"title_cover_penalty":200,"native_trace_blockers":0,"native_trace_hits_total":74,"native_trace_unique_breakpoints":11,"false_positives":0,"runtime_timeout_failures":0,"runtime_title_visual_suppressed_builds":0,"runtime_custom_cover_builds":0,"runtime_simulated_button_presses_total":0},"status":"keep","description":"restore validated no-canvas Banon-load source after failed SYSTEX remap","timestamp":1782452787964,"segment":0,"confidence":null,"asi":{"hypothesis":"The committed SYSTEX remap/generator experiment remained in source after crash logging; restoring the last validated no-canvas Banon-load source is required before continuing static RE.","evidence":"Checked out src/constants.rs, src/experiments/title.rs, src/telemetry.rs, and src/experiments/startup_hooks.rs from validated commit 44cf543. cargo fmt and cargo xwin build succeeded. Static measure is 1320 because latest runtime artifacts are still crash/no-cover artifacts, not because source still contains the remap/generator line.","next_action_hint":"Continue static Ghidra RE for a valid SYSTEX owner/context or custom Scaleform surface from this restored baseline. Do not reintroduce remap/generator calls in product_core_autoload_tick without static proof of side-effect safety."}}
{"run":288,"commit":"2c76d2f","metric":1320,"metrics":{"readiness_gate_failures":0,"target_constants_remaining":0,"helpers_missing":0,"fixed_wait_predicates":0,"autoload_static_failures":0,"asset_chain_failures":0,"dll_patch_failures":0,"native_continue_failures":0,"field58_gate_failures":0,"direct_shortcut_failures":0,"input_path_failures":0,"runtime_proof_failures":1,"runtime_mode_failures":0,"eula_popup_failures":0,"save_data_popup_failures":0,"messagebox_dialog_failures":0,"server_status_failures":0,"title_cover_failures":4,"title_cover_penalty":200,"native_trace_blockers":0,"native_trace_hits_total":74,"native_trace_unique_breakpoints":11,"false_positives":0,"runtime_timeout_failures":0,"runtime_title_visual_suppressed_builds":0,"runtime_custom_cover_builds":0,"runtime_simulated_button_presses_total":0},"status":"keep","description":"bind SYSTEX through TitleBackViewParts MenuResource instead of parent dialog","timestamp":1782453054717,"segment":0,"confidence":null,"asi":{"hypothesis":"The previous SYSTEX remap used the wrong owner field. Static RE shows TitleBackViewParts ctor creates MenuResource at logo+0x8 and SceneObjProxy at logo+0x70; FUN_1407452c0 should bind on logo+0x8 so its +0x60 mapping vector belongs to the visible 05_001_Title_Logo asset.","evidence":"Ghidra: live 0x1409a6180 -> dump 0x1409a62d0; decompile shows TitleBackViewParts vtable, MenuResource ctor at object+0x8, and FUN_140749290(object+0x8, object+0x70). Implemented maybe_bind_title_logo_resource_to_systex_cover using bind helper live 0x1407451c0 on logo+0x8 after profile refresh and renderer0 nonnull; stops hiding logo after remap; dead ProfileSelect builder removed. cargo fmt/cargo xwin build green; static measure remains 1320 due latest crash artifacts.","next_action_hint":"Run marker-gated runtime. Success requires logo_remap_calls>0, profile_cover_bound_to_logo_surface=true, renderer_nonnull nonzero, Banon/world/zero-input/no-popup intact; if it exits early again, revert and inspect TitleBackViewParts resource mapping lifecycle before another runtime."}}
