{"run":58,"commit":"2100051","metric":0,"metrics":{"readiness_gate_failures":1,"target_constants_remaining":0,"helpers_missing":0,"fixed_wait_predicates":0,"autoload_static_failures":1,"asset_chain_failures":0,"dll_patch_failures":0,"native_continue_failures":0,"field58_gate_failures":0,"direct_shortcut_failures":0,"input_path_failures":0,"runtime_proof_failures":1,"runtime_mode_failures":0,"eula_popup_failures":0,"save_data_popup_failures":0,"messagebox_dialog_failures":0,"server_status_failures":0,"title_cover_failures":0,"title_cover_penalty":0,"native_trace_blockers":0,"native_trace_hits_total":74,"native_trace_unique_breakpoints":11,"false_positives":0,"runtime_timeout_failures":1,"runtime_title_visual_suppressed_builds":0,"runtime_custom_cover_builds":0,"runtime_simulated_button_presses_total":0},"status":"crash","description":"pre-action gate diagnostic proved selected-candidate submit is blocked by empty profile fingerprint","timestamp":1782365864193,"segment":0,"confidence":4.64,"asi":{"hypothesis":"Add an explicit pre-action gate diagnostic in product_continue_autoload_tick to identify which pre-submit gate prevents product_continue_item_action/native submit.","rollback_reason":"Diagnostic-only timeout. The new submit precheck logs fired repeatedly and identified the exact gate: phase=0/SUBMIT, action_ready=true via selected-candidate override, b80=0 idle, but profile_real=false with profile_map=0xffffffff, level=0, name_len=0. Therefore product_continue_item_action is not reached because product_continue_autoload_tick fails closed on the empty native profile fingerprint before submit.","next_action_hint":"Reapply the early profile-summary cache repair from staged ER0000.sl2 (the earlier experiment set active_qword=0x1 and slot0_name=Banon around +10s) together with selected-candidate readiness/action overrides. Ensure the repair runs before the submit precheck and then rerun direct_menu_load. Alternatively change profile_slot_fingerprint to accept the repaired requested-slot identity source, but keep fail-closed semantics against empty/placeholder profiles.","artifact_dir":"/home/banon/projects/er-effects-rs/target/runtime-probe/product-continue-direct-20260624-223606","observed_runtime_oracles":{"autoload_method":"direct_menu_load","product_autoload_armed":true,"product_core_autoload_ticks":682,"candidate_override_logs":"present","submit_precheck_logs":"present","submit_precheck":"phase=0 action_ready=true b80=0 profile_real=false profile_map=0xffffffff profile_level=0 profile_name_len=0 candidate=0x7fff7192c000 menu_latch=0 dialog_vt=0x142b229f8","menu_continue_candidate_hits":624,"menu_continue_candidate_item":"0x7fff7192c000","menu_continue_candidate_idle_accept_hits":624,"native_submit_hits":0,"selected_idle_candidate_accepted_logs":0,"native_continue_chain_stage":"pre_submit","simulated_button_presses_total":0,"messagebox_total_builds":0,"policy_window_total_builds":0,"processes_remaining":0},"build":"cargo xwin build --release --target x86_64-pc-windows-msvc succeeded before runtime.","cleanup":"No eldenring.exe or start_protected_game.exe processes remained."}}
{"run":59,"commit":"2100051","metric":0,"metrics":{"readiness_gate_failures":1,"target_constants_remaining":0,"helpers_missing":0,"fixed_wait_predicates":0,"autoload_static_failures":1,"asset_chain_failures":0,"dll_patch_failures":0,"native_continue_failures":0,"field58_gate_failures":0,"direct_shortcut_failures":0,"input_path_failures":0,"runtime_proof_failures":1,"runtime_mode_failures":0,"eula_popup_failures":0,"save_data_popup_failures":0,"messagebox_dialog_failures":0,"server_status_failures":0,"title_cover_failures":0,"title_cover_penalty":0,"native_trace_blockers":0,"native_trace_hits_total":74,"native_trace_unique_breakpoints":11,"false_positives":0,"runtime_timeout_failures":1,"runtime_title_visual_suppressed_builds":0,"runtime_custom_cover_builds":0,"runtime_simulated_button_presses_total":0},"status":"crash","description":"diagnostic empty-profile bypass proved selected candidate ABI but 7ac890 submit does not fire Continue load","timestamp":1782366097773,"segment":0,"confidence":4.64,"asi":{"hypothesis":"Temporarily bypass the empty profile fingerprint only for diagnostics to prove whether the selected idle-tick candidate can submit via the current native_submit_7ac890 result ABI.","rollback_reason":"Diagnostic-only timeout. The selected candidate was accepted and `native Continue submit ABI proven` fired with item=0x7ffe9e52c000, result=0x7ffe94cd5d60, result_vt=0x142aa0080, event_handler=0x140746e80, native_submit=0x1407ac890, diagnostic_mode=0, zero input. However `continue_load_67b750` did not fire, b80 remained 0, and the guard waited on placeholder PGD (level 9, empty name). Thus 0x1407ac890(result) is not the correct MenuWindowJob accept pipeline for this selected item, even though it is a valid result ABI call.","next_action_hint":"Use static disassembly of MenuWindowJob::Update at 0x1407ad1c0: the real accept pipeline for a non-null result calls `0x140744dd0(result)` and then `0x140733ef0([item+0x50], result)`. Patch submit_native_continue_item_action to use this native item-accept pipeline (with action.item+0x50 context) instead of 0x1407ac890(result), still no direct load/deserializer/input. Re-run direct_menu_load. If it reaches continue_load, then reintroduce a real profile-summary repair rather than the diagnostic empty-profile bypass.","artifact_dir":"/home/banon/projects/er-effects-rs/target/runtime-probe/product-continue-direct-20260624-223908","observed_runtime_oracles":{"autoload_method":"direct_menu_load","product_autoload_armed":true,"menu_continue_candidate_item":"0x7ffe9e52c000","selected_idle_candidate_accepted_logs":1,"native_submit_hits":1,"native_submit_last_result":"0x7ffe94cd5d60","continue_load_fired":false,"native_continue_chain_stage":"pre_submit/guard wait after diagnostic submit","b80":0,"ac0":0,"c30":"0xa010000","char_level":9,"char_name_len":0,"slot_identity":false,"profile_map":"0xffffffff","profile_level":0,"profile_name_len":0,"simulated_button_presses_total":0,"messagebox_total_builds":0,"policy_window_total_builds":0,"processes_remaining":0},"static_re":{"menu_window_update":"0x1407ad1c0; accept path creates/uses item+0x130 result, calls vtable+0x18, 0x140744dd0(result), then 0x140733ef0([item+0x50], result).","candidate_docall":"0x140764b80 is a thunk to 0x140763fc0 and not itself sufficient to fire Continue."},"build":"cargo xwin build --release --target x86_64-pc-windows-msvc succeeded before runtime.","cleanup":"No eldenring.exe or start_protected_game.exe processes remained."}}
{"run":60,"commit":"2100051","metric":0,"metrics":{"readiness_gate_failures":1,"target_constants_remaining":0,"helpers_missing":0,"fixed_wait_predicates":0,"autoload_static_failures":1,"asset_chain_failures":0,"dll_patch_failures":0,"native_continue_failures":0,"field58_gate_failures":0,"direct_shortcut_failures":0,"input_path_failures":0,"runtime_proof_failures":1,"runtime_mode_failures":0,"eula_popup_failures":0,"save_data_popup_failures":0,"messagebox_dialog_failures":0,"server_status_failures":0,"title_cover_failures":0,"title_cover_penalty":0,"native_trace_blockers":0,"native_trace_hits_total":74,"native_trace_unique_breakpoints":11,"false_positives":0,"runtime_timeout_failures":1,"runtime_title_visual_suppressed_builds":0,"runtime_custom_cover_builds":0,"runtime_simulated_button_presses_total":0},"status":"crash","description":"native MenuWindowJob accept pipeline mirrors Update but still cannot load while profile cache is empty","timestamp":1782366281592,"segment":0,"confidence":4.64,"asi":{"hypothesis":"Patch submit_native_continue_item_action to use the native MenuWindowJob::Update accept pipeline (`0x140744dd0(result)` then `0x140733ef0([item+0x50], result)`) instead of the earlier 0x1407ac890(result) call, while temporarily bypassing the empty-profile gate for diagnostics.","rollback_reason":"Diagnostic-only timeout. The native item-accept pipeline was invoked exactly once with item_context, result, result_vt, event_handler, finalize, and dispatch addresses, zero input, and no MessageBox/policy popup. It still did not fire continue_load_67b750 (`oracle_own_load_continue_fired=false`, `continue_load` log count 0), and the post-click guard remained on placeholder/empty identity (profile_map=-1/profile_level=0/profile_name_len=0, pgd level 9 empty name, c30 later 0xa010000). This suggests the selected row/accept pipeline cannot produce a valid Continue load while the title profile cache is empty/placeholder.","next_action_hint":"Combine selected-candidate readiness/action overrides and native MenuWindowJob accept pipeline with the earlier early profile-summary cache repair from the staged Banon save (set active byte and slot0 record name/level/map before submit). Rerun direct_menu_load. If continue_load fires with repaired profile summary, replace the hardcoded/diagnostic repair with a proper parser of the staged ER0000.sl2 UD10 profile summary before keeping anything.","artifact_dir":"/home/banon/projects/er-effects-rs/target/runtime-probe/product-continue-direct-20260624-224239","observed_runtime_oracles":{"autoload_method":"direct_menu_load","product_autoload_armed":true,"selected_idle_candidate_accepted_logs":1,"native_item_accept_pipeline_logs":1,"native_submit_hits":0,"continue_load_fired":false,"own_load_continue_fired":false,"native_continue_chain_stage":"guard/pre_submit diagnostic","c30":"0xa010000","ac0":0,"b80":0,"char_level":9,"char_name_len":0,"profile_map":"0xffffffff","profile_level":0,"profile_name_len":0,"simulated_button_presses_total":0,"messagebox_total_builds":0,"policy_window_total_builds":0,"processes_remaining":0},"static_re":"MenuWindowJob::Update accept path was mirrored at finalize 0x140744dd0 and dispatch 0x140733ef0, but runtime shows profile identity remains the limiting semantic gate.","build":"cargo xwin build --release --target x86_64-pc-windows-msvc succeeded before runtime.","cleanup":"No eldenring.exe or start_protected_game.exe processes remained."}}
{"run":61,"commit":"2100051","metric":0,"metrics":{"readiness_gate_failures":1,"target_constants_remaining":0,"helpers_missing":0,"fixed_wait_predicates":0,"autoload_static_failures":1,"asset_chain_failures":0,"dll_patch_failures":0,"native_continue_failures":0,"field58_gate_failures":0,"direct_shortcut_failures":0,"input_path_failures":0,"runtime_proof_failures":1,"runtime_mode_failures":0,"eula_popup_failures":0,"save_data_popup_failures":0,"messagebox_dialog_failures":0,"server_status_failures":0,"title_cover_failures":0,"title_cover_penalty":0,"native_trace_blockers":0,"native_trace_hits_total":74,"native_trace_unique_breakpoints":11,"false_positives":0,"runtime_timeout_failures":1,"runtime_title_visual_suppressed_builds":0,"runtime_custom_cover_builds":0,"runtime_simulated_button_presses_total":0},"status":"crash","description":"profile cache repair plus native item accept fires action event but still no continue_load","timestamp":1782366448193,"segment":0,"confidence":4.64,"asi":{"hypothesis":"Combine selected-candidate readiness/action overrides and native MenuWindowJob accept pipeline with an early profile-summary cache repair so the selected item can submit with a non-empty Continue profile fingerprint.","rollback_reason":"Diagnostic-only failure. The hardcoded Banon profile-summary repair ran and profile gate no longer logged empty; selected idle candidate and native item-accept pipeline fired. It still did not fire continue_load_67b750 or own_load_continue, and process exited before readiness. Runtime logged T_native_continue_action with b80=0 and then no native load. Therefore the selected idle-tick MenuWindowJob/result is not sufficient to invoke the real Continue callback path; the next target is the real Continue callback object/row or MenuWindowJob tail state, not more result-submit variants.","next_action_hint":"Static/runtime locate the real Continue callback object: inspect/log selected item fields +0x128/+0x130/+0xe8/+0xa8/+0x50 after profile repair, sequence children, and any action object carrying callback 0x14082bac0. Prefer a manual main-menu trace with profile valid and hooks for the 0x14082bac0 callback entry, or hook 0x1408257dd construction to capture the receiver/functor. Avoid treating the idle d180 candidate as proven Continue until continue_load fires.","artifact_dir":"/home/banon/projects/er-effects-rs/target/runtime-probe/product-continue-direct-20260624-224603","observed_runtime_oracles":{"profile_repair_log":"profile=0x7fffa0b56c80 slot0 rec=0x7fffa0b56c98 Banon level150 map=0x0e000000","selected_idle_candidate_accepted_logs":1,"native_item_accept_pipeline_logs":1,"continue_load_fired":false,"own_load_continue_fired":false,"native_submit_hits":0,"game_requested_save_slot_load_index":0,"process_exited_before_ready":true,"char_level":0,"char_name_len":0,"simulated_button_presses_total":0,"messagebox_total_builds":0,"policy_window_total_builds":0,"processes_remaining":0},"static_re":"Profile repair plus accept pipeline falsifies the hypothesis that the idle selected MenuWindowJob result alone is the Continue callback. Need capture 0x14082bac0 construction/call path.","build":"cargo xwin build --release --target x86_64-pc-windows-msvc succeeded before runtime.","cleanup":"No eldenring.exe or start_protected_game.exe processes remained."}}
{"run":62,"commit":"2100051","metric":0,"metrics":{"readiness_gate_failures":1,"target_constants_remaining":0,"helpers_missing":0,"fixed_wait_predicates":0,"autoload_static_failures":1,"asset_chain_failures":0,"dll_patch_failures":0,"native_continue_failures":0,"field58_gate_failures":0,"direct_shortcut_failures":0,"input_path_failures":0,"runtime_proof_failures":1,"runtime_mode_failures":0,"eula_popup_failures":0,"save_data_popup_failures":0,"messagebox_dialog_failures":0,"server_status_failures":0,"title_cover_failures":0,"title_cover_penalty":0,"native_trace_blockers":0,"native_trace_hits_total":74,"native_trace_unique_breakpoints":11,"false_positives":0,"runtime_timeout_failures":1,"runtime_title_visual_suppressed_builds":0,"runtime_custom_cover_builds":0,"runtime_simulated_button_presses_total":0},"status":"crash","description":"passive title row/action-builder hooks were built but not installed because continue tracing was disabled","timestamp":1782366666065,"segment":0,"confidence":4.64,"asi":{"hypothesis":"Add passive hooks at title row builder 0x1408252b0 and Continue action builder 0x1408257dd, then run the product direct probe to see whether the real Continue callback object is constructed.","rollback_reason":"Diagnostic-only timeout and misconfigured trace. The added hooks compiled, but the runtime artifact had no er-effects-continue-trace.log and no TITLE-ROW-BUILD / TITLE-CONTINUE-ACTION-BUILD logs, so the continue-trace hook set was not installed in this run. Product runtime remained blocked at strict title_dialog with only the idle candidate telemetry.","next_action_hint":"Rerun the same passive hook build with ER_EFFECTS_TRACE_CONTINUE=1 (and direct_menu_load request) so title_row_build_8252b0 and title_continue_action_build_8257dd actually install. If hooks still do not fire under product, use visible manual main-menu stop with the same env and golden save.","artifact_dir":"/home/banon/projects/er-effects-rs/target/runtime-probe/product-continue-direct-20260624-224929","observed_runtime_oracles":{"continue_trace_log_present":false,"title_row_build_logs":0,"title_continue_action_build_logs":0,"product_core_ready_blocker":"title_dialog","product_core_ready_successes":0,"menu_continue_candidate_hits":633,"menu_continue_candidate_item":"0x7ffe9e52c000","profile_slot_active_bytes_qword":"0x0","native_submit_hits":0,"simulated_button_presses_total":0,"processes_remaining":0},"build":"cargo xwin build --release --target x86_64-pc-windows-msvc succeeded after fixing pointer mutability in diagnostics.","cleanup":"No eldenring.exe or start_protected_game.exe processes remained."}}
{"run":63,"commit":"2100051","metric":0,"metrics":{"readiness_gate_failures":1,"target_constants_remaining":0,"helpers_missing":0,"fixed_wait_predicates":0,"autoload_static_failures":1,"asset_chain_failures":0,"dll_patch_failures":0,"native_continue_failures":0,"field58_gate_failures":0,"direct_shortcut_failures":0,"input_path_failures":0,"runtime_proof_failures":1,"runtime_mode_failures":0,"eula_popup_failures":0,"save_data_popup_failures":0,"messagebox_dialog_failures":0,"server_status_failures":0,"title_cover_failures":0,"title_cover_penalty":0,"native_trace_blockers":0,"native_trace_hits_total":74,"native_trace_unique_breakpoints":11,"false_positives":0,"runtime_timeout_failures":1,"runtime_title_visual_suppressed_builds":0,"runtime_custom_cover_builds":0,"runtime_simulated_button_presses_total":0},"status":"crash","description":"trace-enabled passive title row/action hooks proved product path never builds real title rows","timestamp":1782366881226,"segment":0,"confidence":4.64,"asi":{"hypothesis":"Rerun passive title row/action-builder hooks with ER_EFFECTS_TRACE_CONTINUE=1 so hooks at 0x1408252b0 and 0x1408257dd actually install and capture the real Continue callback construction if product flow builds it.","rollback_reason":"Diagnostic-only timeout. Continue trace did install (bootstrap had continue_trace_applied, live trace shows hooks for title_row_build_8252b0 and title_continue_action_build_8257dd), but neither hook fired: TITLE-ROW-BUILD count 0 and TITLE-CONTINUE-ACTION-BUILD count 0. The product path continued to show only the disabled idle Continue insert edge through 0x140764338/0x1407a7b60. Therefore product flow never opens/builds the real title rows/callback object under current self-drive; submitting the idle node cannot reach Continue load.","next_action_hint":"Find and trigger the native title open-menu transition that calls title row build (likely TitleTopDialog::open_menu 0x1409b24e0 or a preceding state/PressStart side effect), while preserving native title job/render suppression. Static RE first: decompile/disassemble 0x1409b24e0 and its caller/state preconditions; then add a guarded call/hook that performs open-menu side effects so TITLE-ROW-BUILD/8257dd hooks fire. Do not keep trying idle-node submit variants.","artifact_dir":"/home/banon/projects/er-effects-rs/target/runtime-probe/product-continue-direct-20260624-225158","observed_runtime_oracles":{"continue_trace_applied":true,"title_row_build_hooks_installed":true,"title_continue_action_build_hooks_installed":true,"title_row_build_calls":0,"title_continue_action_build_calls":0,"menu_continue_idle_insert_calls":"present, caller_rva=0x764338","product_core_ready_blocker":"title_dialog","product_core_ready_successes":0,"profile_slot_active_bytes_qword":"0x0","simulated_button_presses_total":0,"processes_remaining":0},"live_trace_path":"/home/banon/.local/share/Steam/steamapps/common/ELDEN RING/Game/er-effects-continue-trace.log","build":"cargo xwin build --release --target x86_64-pc-windows-msvc succeeded.","cleanup":"No eldenring.exe or start_protected_game.exe processes remained."}}
{"run":64,"commit":"2100051","metric":0,"metrics":{"readiness_gate_failures":1,"target_constants_remaining":0,"helpers_missing":0,"fixed_wait_predicates":0,"autoload_static_failures":1,"asset_chain_failures":0,"dll_patch_failures":0,"native_continue_failures":0,"field58_gate_failures":0,"direct_shortcut_failures":0,"input_path_failures":0,"runtime_proof_failures":1,"runtime_mode_failures":0,"eula_popup_failures":0,"save_data_popup_failures":0,"messagebox_dialog_failures":0,"server_status_failures":0,"title_cover_failures":0,"title_cover_penalty":0,"native_trace_blockers":0,"native_trace_hits_total":74,"native_trace_unique_breakpoints":11,"false_positives":0,"runtime_timeout_failures":1,"runtime_title_visual_suppressed_builds":0,"runtime_custom_cover_builds":0,"runtime_simulated_button_presses_total":0},"status":"crash","description":"product-wait menu container walk confirmed no real title menu rows exist in direct_menu_load state","timestamp":1782367120740,"segment":0,"confidence":4.64,"asi":{"hypothesis":"Call diagnostic_menu_walk from the product_core readiness wait path to inspect owner+0x138 menu item container and determine whether real title menu rows exist while product is blocked on title_dialog/ProfileLoadDialog.","rollback_reason":"Diagnostic-only timeout. menu-walk product-wait repeatedly reported owner state=10, container owner+0x138 with count=0 (out of sane range), holder=0x7fff36a45120 whose vtable is ProfileLoadDialog in telemetry, and no menu items. This confirms the direct_menu_load product state has no real title menu rows to submit; the idle candidate is a disabled insert edge, not a functional Continue row. No product metric improvement.","next_action_hint":"Stop pursuing idle MenuWindowJob submission in direct_menu_load state. Static RE the transition that should produce TitleTopDialog/menu rows before ProfileLoadDialog replaces holder, or pivot to a user-authorized/visible main-title state trace where TitleTopDialog is actually active. For product, use native title open-menu side effects before entering ProfileLoadDialog; do not call Load Game/ProfileLoad as product proof.","artifact_dir":"/home/banon/projects/er-effects-rs/target/runtime-probe/product-continue-direct-20260624-225703","observed_runtime_oracles":{"menu_walk_product_wait_count":0,"menu_walk_holder":"0x7fff36a45120","holder_vtable":"0x142b229f8/ProfileLoadDialog","owner_state":10,"menu_continue_candidate_hits":615,"product_core_ready_blocker":"title_dialog","profile_slot_active_bytes_qword":"0x0","native_submit_hits":0,"simulated_button_presses_total":0,"processes_remaining":0},"build":"cargo xwin build --release --target x86_64-pc-windows-msvc succeeded.","cleanup":"No eldenring.exe or start_protected_game.exe processes remained."}}
