{"run":41,"commit":"2100051","metric":0,"metrics":{"readiness_gate_failures":0,"target_constants_remaining":0,"helpers_missing":0,"fixed_wait_predicates":0,"autoload_static_failures":0,"asset_chain_failures":0,"dll_patch_failures":0,"native_continue_failures":0,"field58_gate_failures":0,"direct_shortcut_failures":0,"input_path_failures":0,"runtime_proof_failures":1,"runtime_mode_failures":0,"eula_popup_failures":0,"save_data_popup_failures":0,"messagebox_dialog_failures":0,"server_status_failures":0,"title_cover_failures":2,"title_cover_penalty":150,"native_trace_blockers":0,"native_trace_hits_total":74,"native_trace_unique_breakpoints":11,"false_positives":0,"runtime_timeout_failures":1,"runtime_title_visual_suppressed_builds":1,"runtime_custom_cover_builds":0,"runtime_simulated_button_presses_total":0},"status":"crash","description":"forced continue-trace with preserved native title job and corrected render-bit suppression, but semantic Continue item/member node still never materialized","timestamp":1782361983570,"segment":0,"confidence":4.64,"asi":{"hypothesis":"Keep the preserved native title MenuWindowJob path, correct the render-bit suppression callsite to the observed live caller_rva=0x7ad530, force continue-trace hooks in the product direct_menu_load probe so constructor/update hooks can capture a semantic native Continue MenuWindowJob/member-node, and repair the profile summary early from the staged Banon save.","rollback_reason":"Runtime timed out before native Continue submit. The corrected render-bit hook worked (oracle_title_native_menu_visual_render_suppressed_windows=1, menu_id=5, flags 0x03->0x01, caller_rva=0x7ad530) while preserving valid product_core readiness (ready_successes=538, profile_slot_active_bytes_qword=0x1, no MessageBox/policy/input). However continue-trace still did not capture a semantic native Continue item/task/member node: oracle_menu_continue_item/task_node/member_node were null/absent, native ctor/update semantic hits were 0, oracle_native_submit_hits stayed 0, and native_continue_chain_stage stayed pre_submit. Static metric read 1370 because the persisted measure guard still expected the prior 0x7ad52b render callsite and marked PartA missing despite runtime evidence; that guard needs correction to 0x7ad530 after this logged crash.","next_action_hint":"Do not return to null out-slot or ProfileSelect out-slot. Preserve native title job and keep the corrected draw-bit callsite. Next static RE should focus upstream of item/update hooks: TitleTopDialog::open_menu may not be building the selectable Continue rows under product_core self-fire, or the row vector/router is not reachable. Instrument or statically trace the actual open_menu/register path: call/read dump_titletop_menu_entries during product_core ready state, verify router_this/vector population, and if rows exist invoke the registered Continue row callback/result path through the captured row rather than scanning MenuWindowJob idle candidates. Also fix .auto/measure.sh PartA render-callsite literal from 0x7ad52b to 0x7ad530 based on this evidence.","artifact_dir":"/home/banon/projects/er-effects-rs/target/runtime-probe/product-continue-direct-20260624-213055","observed_runtime_oracles":{"ready":false,"reason":"timeout_seconds_budget_exhausted","product_autoload_armed":true,"product_core_autoload_ticks":665,"product_core_ready_blocker":"ready","product_core_ready_successes":538,"product_core_ready_blocks":127,"profile_slot_active_bytes_qword":"0x1","oracle_title_native_menu_visual_suppressed_builds":1,"oracle_title_native_menu_visual_render_suppress_installed":true,"oracle_title_native_menu_visual_render_suppressed_windows":1,"oracle_title_native_menu_visual_render_last_menu_id":5,"oracle_title_native_menu_visual_render_last_flags_before":3,"oracle_title_native_menu_visual_render_last_flags_after":1,"oracle_title_native_menu_visual_render_last_caller_rva":"0x7ad530","oracle_title_custom_cover_profile_select_builds":0,"oracle_native_submit_hits":0,"native_submit_entered":false,"native_result_chain_ready":false,"oracle_continue_load_hits":null,"oracle_player_present":false,"oracle_char_name":"","expected_save_match":true,"expected_animation_match":false,"oracle_msgbox_total_builds":0,"oracle_policy_window_total_builds":0,"simulated_button_presses_total":0,"semantic_continue_capture_hits":0},"build":"bash -n .auto/measure.sh scripts/run-product-continue-direct-probe.sh scripts/er-readiness-watch.py and cargo xwin build --release --target x86_64-pc-windows-msvc succeeded before runtime.","cleanup":"Probe cleanup left no eldenring.exe or start_protected_game.exe process running."}}
{"run":42,"commit":"2100051","metric":0,"metrics":{"readiness_gate_failures":0,"target_constants_remaining":0,"helpers_missing":0,"fixed_wait_predicates":0,"autoload_static_failures":0,"asset_chain_failures":0,"dll_patch_failures":0,"native_continue_failures":0,"field58_gate_failures":0,"direct_shortcut_failures":0,"input_path_failures":0,"runtime_proof_failures":1,"runtime_mode_failures":0,"eula_popup_failures":0,"save_data_popup_failures":0,"messagebox_dialog_failures":0,"server_status_failures":0,"title_cover_failures":1,"title_cover_penalty":50,"native_trace_blockers":0,"native_trace_hits_total":74,"native_trace_unique_breakpoints":11,"false_positives":0,"runtime_timeout_failures":1,"runtime_title_visual_suppressed_builds":1,"runtime_custom_cover_builds":0,"runtime_simulated_button_presses_total":0},"status":"crash","description":"row-vector Continue fallback with preserved render-suppressed title job found router/vector missing under product_core self-open","timestamp":1782362476631,"segment":0,"confidence":4.64,"asi":{"hypothesis":"Continue rows may exist in the TitleTopDialog router vector even when the MenuWindowJob candidate is only the idle constant-false item. Preserve the native title job, keep corrected render-bit suppression, repair the profile summary early, force continue-trace hooks, and add a selected-row-vector fallback that only submits native row result if dump_titletop_menu_entries proves the registered Continue row is selected/default.","rollback_reason":"Runtime timed out before native Continue submit. The render-only title suppression still worked (render_suppressed_windows=1, menu_id=5, flags 0x03->0x01, caller_rva=0x7ad530) and product_core was ready with profile_slot_active_bytes_qword=0x1. The row-vector fallback did not find a usable Continue row: dump_titletop_menu_entries ran 543 times but reported router_this (CSMenu vt=0x142afa070) NOT found in dialog fields each time, cursor=0, rows unreachable. The only Continue-looking MenuWindowJob remained the idle constant-false accept_predicate=0x1407add70 candidate; oracle_native_submit_hits stayed 0, native_continue_chain_stage stayed pre_submit, no MessageBox/policy/input occurred.","next_action_hint":"Do not keep scanning dialog fields for router_this; runtime proves the router is not field-linked from TitleTopDialog in this path. Next static/runtime edge should capture CSMenu router_this at construction (cap_csmenu_ctor_hook exists but did not latch in this product path) or hook the actual row-registration/open_menu call path to obtain router/vector directly. Candidate: instrument 0x1409b24e0/open_menu and row append/rebuild functions 0x14078d2c0/0x14078eea0 under preserved-title-job product_core to see whether self-fire skips the native CSMenu constructor/row population side effect; if skipped, call the native transition/open path that performs those side effects, not just TitleTopDialog::open_menu. Also keep .auto/measure.sh PartA render callsite at 0x7ad530 based on observed evidence.","artifact_dir":"/home/banon/projects/er-effects-rs/target/runtime-probe/product-continue-direct-20260624-213903","observed_runtime_oracles":{"ready":false,"reason":"timeout_seconds_budget_exhausted","product_autoload_armed":true,"product_core_autoload_ticks":666,"product_core_ready_blocker":"ready","product_core_ready_successes":539,"product_core_ready_blocks":127,"profile_slot_active_bytes_qword":"0x1","oracle_title_native_menu_visual_suppressed_builds":1,"oracle_title_native_menu_visual_render_suppressed_windows":1,"oracle_title_native_menu_visual_render_last_menu_id":5,"oracle_title_native_menu_visual_render_last_flags_before":3,"oracle_title_native_menu_visual_render_last_flags_after":1,"oracle_title_native_menu_visual_render_last_caller_rva":"0x7ad530","oracle_title_custom_cover_profile_select_builds":0,"oracle_native_submit_hits":0,"native_submit_entered":false,"native_result_chain_ready":false,"oracle_continue_load_hits":null,"oracle_player_present":false,"oracle_char_name":"","expected_save_match":true,"expected_animation_match":false,"oracle_msgbox_total_builds":0,"oracle_policy_window_total_builds":0,"simulated_button_presses_total":0,"titletop_entries_scans":543,"router_this_found":false,"idle_continue_rejections":560},"build":"bash -n .auto/measure.sh scripts/run-product-continue-direct-probe.sh scripts/er-readiness-watch.py and cargo xwin build --release --target x86_64-pc-windows-msvc succeeded before runtime.","cleanup":"Probe cleanup left no eldenring.exe or start_protected_game.exe process running."}}
{"run":43,"commit":"2100051","metric":0,"metrics":{"readiness_gate_failures":0,"target_constants_remaining":0,"helpers_missing":0,"fixed_wait_predicates":0,"autoload_static_failures":0,"asset_chain_failures":0,"dll_patch_failures":0,"native_continue_failures":0,"field58_gate_failures":0,"direct_shortcut_failures":0,"input_path_failures":0,"runtime_proof_failures":1,"runtime_mode_failures":0,"eula_popup_failures":0,"save_data_popup_failures":0,"messagebox_dialog_failures":0,"server_status_failures":0,"title_cover_failures":0,"title_cover_penalty":0,"native_trace_blockers":0,"native_trace_hits_total":74,"native_trace_unique_breakpoints":11,"false_positives":0,"runtime_timeout_failures":1,"runtime_title_visual_suppressed_builds":0,"runtime_custom_cover_builds":0,"runtime_simulated_button_presses_total":0},"status":"crash","description":"attempted custom manual telemetry command but autoresearch harness requires .auto/measure.sh","timestamp":1782362621254,"segment":0,"confidence":4.64,"asi":{"hypothesis":"Use the user's offer to run a visible manual diagnostic trace directly with the existing product probe script, autoload disabled and continue tracing enabled, to capture the normal Load Game row/router path.","rollback_reason":"run_experiment refused the custom command because .auto/measure.sh exists and autoresearch policy requires measure.sh as the benchmark entrypoint. No Elden Ring launch occurred.","next_action_hint":"Implement a .auto/measure.sh-compliant manual diagnostic sentinel path (e.g. .auto/run_manual_profile_trace_once) so run_experiment can still execute .auto/measure.sh while launching the visible telemetry-only user-driven probe.","guard_block":"run_experiment rejected command: .auto/measure.sh exists — you must run it instead of a custom command","cleanup":"No runtime launched; no Elden Ring teardown needed."}}
{"run":44,"commit":"2100051","metric":0,"metrics":{"readiness_gate_failures":0,"target_constants_remaining":0,"helpers_missing":0,"fixed_wait_predicates":0,"autoload_static_failures":0,"asset_chain_failures":0,"dll_patch_failures":0,"native_continue_failures":0,"field58_gate_failures":0,"direct_shortcut_failures":0,"input_path_failures":0,"runtime_proof_failures":1,"runtime_mode_failures":0,"eula_popup_failures":0,"save_data_popup_failures":0,"messagebox_dialog_failures":0,"server_status_failures":0,"title_cover_failures":0,"title_cover_penalty":0,"native_trace_blockers":0,"native_trace_hits_total":74,"native_trace_unique_breakpoints":11,"false_positives":0,"runtime_timeout_failures":1,"runtime_title_visual_suppressed_builds":0,"runtime_custom_cover_builds":0,"runtime_simulated_button_presses_total":0},"status":"crash","description":"manual visible profile trace sentinel failed before launch because runtime_probe rejects profile-list expected mode","timestamp":1782362820331,"segment":0,"confidence":4.64,"asi":{"hypothesis":"Use a .auto/measure.sh-compliant visible manual telemetry sentinel so the user can drive to Load Game while continue-trace hooks collect normal row/router construction telemetry.","rollback_reason":"The probe exited before a usable runtime because .auto/runtime_probe.sh rejected RUNTIME_EXPECTED_MODE=profile-list; allowed modes are vanilla, seamless, or any. Proton emitted only 'ntsync: up and running', no ER window appeared, and teardown found no steam_app_1245620 window. No telemetry about rows/router was collected.","next_action_hint":"Retry the manual visible diagnostic through .auto/measure.sh with RUNTIME_EXPECTED_MODE=any (or vanilla) instead of profile-list. Keep ER_EFFECTS_NO_AUTOLOAD=1, RUNTIME_TELEMETRY_ONLY=1, RUNTIME_ONSCREEN=1, and ER_EFFECTS_TRACE_CONTINUE=1 so the user can drive normally while hooks collect TitleTopDialog/router/row data.","artifact_dir":"/home/banon/projects/er-effects-rs/target/runtime-probe/product-continue-direct-20260624-214549","guard_block":"runtime_probe.err: RUNTIME_EXPECTED_MODE must be vanilla, seamless, or any","cleanup":"No eldenring.exe or start_protected_game.exe processes remained after the failed launch."}}
{"run":45,"commit":"2100051","metric":0,"metrics":{"readiness_gate_failures":0,"target_constants_remaining":0,"helpers_missing":0,"fixed_wait_predicates":0,"autoload_static_failures":0,"asset_chain_failures":0,"dll_patch_failures":0,"native_continue_failures":0,"field58_gate_failures":0,"direct_shortcut_failures":0,"input_path_failures":0,"runtime_proof_failures":1,"runtime_mode_failures":0,"eula_popup_failures":0,"save_data_popup_failures":0,"messagebox_dialog_failures":0,"server_status_failures":0,"title_cover_failures":0,"title_cover_penalty":0,"native_trace_blockers":0,"native_trace_hits_total":74,"native_trace_unique_breakpoints":11,"false_positives":0,"runtime_timeout_failures":1,"runtime_title_visual_suppressed_builds":0,"runtime_custom_cover_builds":0,"runtime_simulated_button_presses_total":0},"status":"crash","description":"visible manual telemetry run used telemetry-only path without staging golden save, so user could not reach Load Game rows","timestamp":1782362983156,"segment":0,"confidence":4.64,"asi":{"hypothesis":"Visible manual telemetry-only run with autoload disabled and continue trace enabled would let the user drive to the Load Game screen and collect row/router telemetry without product autoload contamination.","rollback_reason":"The run used RUNTIME_TELEMETRY_ONLY=1, which intentionally did not stage the gold save. User correction: the run needs the golden save copied/staged so Load Game has the expected rows. No readiness-result.json was produced; debug log only reached boot ProfileSummary save-progress pass-through lines; no useful row/router telemetry was collected.","next_action_hint":"Retry immediately through .auto/measure.sh with a new manual sentinel that stages ER_EFFECTS_GOLD_SAVE=/home/banon/projects/er-effects-rs/save-files/150-Banon/ER0000.sl2 and ER_EFFECTS_GOLD_SLOT=0, uses RUNTIME_ONSCREEN=1, ER_EFFECTS_NO_AUTOLOAD=1, ER_EFFECTS_TRACE_CONTINUE=1, and does NOT set RUNTIME_TELEMETRY_ONLY=1. This preserves vanilla/manual flow while providing a valid golden save for the Load Game screen.","artifact_dir":"/home/banon/projects/er-effects-rs/target/runtime-probe/product-continue-direct-20260624-214720","user_correction":"Need to copy/stage the golden save for manual user-driven Load Game telemetry; telemetry-only/no-save is not acceptable for this diagnostic.","cleanup":"No eldenring.exe or start_protected_game.exe processes remained."}}
{"run":46,"commit":"2100051","metric":0,"metrics":{"readiness_gate_failures":0,"target_constants_remaining":0,"helpers_missing":0,"fixed_wait_predicates":0,"autoload_static_failures":0,"asset_chain_failures":0,"dll_patch_failures":0,"native_continue_failures":0,"field58_gate_failures":0,"direct_shortcut_failures":0,"input_path_failures":0,"runtime_proof_failures":1,"runtime_mode_failures":0,"eula_popup_failures":0,"save_data_popup_failures":0,"messagebox_dialog_failures":0,"server_status_failures":0,"title_cover_failures":0,"title_cover_penalty":0,"native_trace_blockers":0,"native_trace_hits_total":74,"native_trace_unique_breakpoints":11,"false_positives":0,"runtime_timeout_failures":1,"runtime_title_visual_suppressed_builds":0,"runtime_custom_cover_builds":0,"runtime_simulated_button_presses_total":0},"status":"crash","description":"clean user-driven visible golden-save Load Game diagnostic ran, but telemetry did not capture router/row construction before timeout","timestamp":1782363142418,"segment":0,"confidence":4.64,"asi":{"hypothesis":"With the golden Banon save staged, a clean user-driven visible run to the normal Load Game screen should collect native TitleTopDialog/CSMenu router and Continue row telemetry under a real manual flow, revealing the row/vector path product_core self-open was missing.","rollback_reason":"The user confirmed the visible run was clean, and the golden save was staged, but the run_experiment hit the 45s timeout before .auto/measure.sh produced runtime metrics/readiness-result. Artifact has telemetry/debug logs but no readiness-result.json. Debug shows boot ProfileSummary save progress and many reads/writes against the staged ER0000.sl2, but the current instrumentation did not log titletop-entry/router/csmenu/loadgame/profile-list row events during the captured window. No MessageBox/policy popup or runtime process leak was observed. This is diagnostic evidence only, not product proof, so primary metric is 0/crash.","next_action_hint":"Manual clean run suggests the visible user flow is viable, but instrumentation is insufficient or stopped too early. Next iteration should extend the manual sentinel timeout within the allowed cap only if possible, or better add a positive manual-trace watcher target that stops on row/router telemetry instead of waiting for product readiness. Also add explicit hooks/logs for CSMenu ctor/row append/rebuild/open_menu paths independent of product_autoload_enabled so ER_EFFECTS_NO_AUTOLOAD manual runs still capture them; current constructor/update hooks are likely gated by product_autoload_enabled and therefore did not emit the needed row data in the manual flow.","artifact_dir":"/home/banon/projects/er-effects-rs/target/runtime-probe/product-continue-direct-20260624-215021","user_feedback":"User reported: 'That was a good and clean run' after driving the visible golden-save diagnostic.","observed_runtime_oracles":{"readiness_result_present":false,"telemetry_present":true,"autoload_debug_lines":106,"golden_save_staged":true,"show_progress_profile_summary_reads":6,"staged_save_path_reads_seen":true,"titletop_entries_logged":0,"csmenu_logs":0,"loadgame_logs":0,"menu_window_native_ctor_b_continue_hits":0,"menu_item_update_semantic_hits":0,"menu_continue_idle_insert_last_arg1":"0x10fc48","menu_continue_idle_insert_last_arg1_update_rva":"0x7ad1c0","oracle_msgbox_total_builds":0,"oracle_policy_window_total_builds":0,"processes_remaining":0},"build":"cargo xwin build --release --target x86_64-pc-windows-msvc succeeded before the run; .auto/measure.sh manual sentinel staged the golden save and launched on-screen with ER_EFFECTS_NO_AUTOLOAD=1 and ER_EFFECTS_TRACE_CONTINUE=1.","cleanup":"No eldenring.exe or start_protected_game.exe processes remained after timeout/cleanup."}}
