{"run":194,"commit":"2100051","metric":0,"metrics":{"readiness_gate_failures":0,"target_constants_remaining":0,"helpers_missing":0,"fixed_wait_predicates":0,"autoload_static_failures":0,"asset_chain_failures":0,"dll_patch_failures":0,"native_continue_failures":0,"field58_gate_failures":0,"direct_shortcut_failures":0,"input_path_failures":0,"runtime_proof_failures":1,"runtime_mode_failures":0,"eula_popup_failures":0,"save_data_popup_failures":0,"messagebox_dialog_failures":0,"server_status_failures":0,"title_cover_failures":0,"title_cover_penalty":0,"native_trace_blockers":0,"native_trace_hits_total":74,"native_trace_unique_breakpoints":11,"false_positives":0,"runtime_timeout_failures":1,"runtime_title_visual_suppressed_builds":1,"runtime_custom_cover_builds":1,"runtime_simulated_button_presses_total":0},"status":"crash","description":"runtime live-window render gating saw native title job built but never rendered","timestamp":1782422123976,"segment":0,"confidence":null,"asi":{"hypothesis":"Resolving native_window from `native_job+0x130` inside the render hook at Run time should let the hook target the native title window once it is assigned.","rollback_reason":"run_experiment timed out before metrics; primary metric is 0/crash. The native 05_000_Title job was built and latched, but the render hook never saw it run (`render_suppressed_windows=0`), title_native_ready flags stayed 0, and native_submit_hits stayed 0.","next_action_hint":"Instrument or statically decode why the preserved native 05_000_Title MenuWindowJob (latched native_job=0x7fffd0d3c280 in artifact) is not being run/ticked after BeginTitle. Hook/observe MenuWindowJob::Run at 0x1407ad2b0 for this native_job or the Sequence/FixOrder parent, rather than further tweaking render suppression.","artifact":"/home/banon/projects/er-effects-rs/target/runtime-probe/product-continue-direct-20260625-141327","evidence":"Debug: `PRESERVED native ... native_ret=0x10fbc0 native_job=0x7fffd0d3c280`; telemetry: oracle_title_native_menu_visual_render_suppressed_windows=0, title_native_ready_hits=1862 flags=0, native_submit_hits=0."}}
{"run":195,"commit":"2100051","metric":1520,"metrics":{"readiness_gate_failures":0,"target_constants_remaining":0,"helpers_missing":0,"fixed_wait_predicates":0,"autoload_static_failures":0,"asset_chain_failures":0,"dll_patch_failures":0,"native_continue_failures":0,"field58_gate_failures":0,"direct_shortcut_failures":0,"input_path_failures":0,"runtime_proof_failures":1,"runtime_mode_failures":0,"eula_popup_failures":0,"save_data_popup_failures":0,"messagebox_dialog_failures":0,"server_status_failures":0,"title_cover_failures":0,"title_cover_penalty":0,"native_trace_blockers":0,"native_trace_hits_total":74,"native_trace_unique_breakpoints":11,"false_positives":0,"runtime_timeout_failures":0,"runtime_title_visual_suppressed_builds":1,"runtime_custom_cover_builds":1,"runtime_simulated_button_presses_total":0},"status":"discard","description":"static classified native title job built-not-run after render-gated runtime","timestamp":1782422200984,"segment":0,"confidence":null,"asi":{"hypothesis":"Post-runtime source/static inspection should classify the next target after the native-preserving render-gated attempts failed: whether the latched 05_000_Title job was scheduled or merely built.","rollback_reason":"Primary metric stayed 1520 with runtime_proof_failures=1. This was a persisted analysis finding only; no product proof improved.","next_action_hint":"Add or statically decode a passive full `CS::MenuWindowJob::Run` hook at 0x1407ad2b0 / Sequence parent for the latched native_job, because existing cap_menu_item_update_hook at 0x1407ad1c0 is not proof that the 05_000_Title job reaches Run/render.","finding_key":"autoload-native-title-job-built-not-run-2026-06-25","evidence":"Artifacts product-continue-direct-20260625-140724 and 141327 latched native 05_000_Title job pointers but render hook never fired, title_native_ready flags stayed 0, and native_submit_hits stayed 0."}}
{"run":196,"commit":"2100051","metric":0,"metrics":{"readiness_gate_failures":0,"target_constants_remaining":0,"helpers_missing":0,"fixed_wait_predicates":0,"autoload_static_failures":0,"asset_chain_failures":0,"dll_patch_failures":0,"native_continue_failures":0,"field58_gate_failures":0,"direct_shortcut_failures":0,"input_path_failures":0,"runtime_proof_failures":1,"runtime_mode_failures":0,"eula_popup_failures":0,"save_data_popup_failures":0,"messagebox_dialog_failures":0,"server_status_failures":0,"title_cover_failures":1,"title_cover_penalty":50,"native_trace_blockers":0,"native_trace_hits_total":74,"native_trace_unique_breakpoints":11,"false_positives":0,"runtime_timeout_failures":1,"runtime_title_visual_suppressed_builds":1,"runtime_custom_cover_builds":0,"runtime_simulated_button_presses_total":0},"status":"crash","description":"runtime no-scratch native title job still not ticked","timestamp":1782422629064,"segment":0,"confidence":null,"asi":{"hypothesis":"If scratch ProfileSelect construction was perturbing the native title sequence, removing it while preserving native BeginTitle should let the 05_000_Title job run and possibly load behind the native title visual/render hook.","rollback_reason":"run_experiment timed out before metrics; primary metric is 0/crash. Removing scratch ProfileSelect did not help: the native job was still built but render hook never saw it run, title_native_ready stayed flags=0, and native_submit_hits=0.","next_action_hint":"Stop blaming scratch ProfileSelect for the scheduling failure. Next target is the sequence/consumer after caller 0x140b0c710: decode or instrument how 0x140b0c180 / 0x14078e0e0 / 0x1407927d0 / 0x140b0e530 compose and schedule the wrapper return. The native 05_000_Title job pointer alone is not reaching Run.","artifact":"/home/banon/projects/er-effects-rs/target/runtime-probe/product-continue-direct-20260625-142206","evidence":"Debug: `PRESERVED native ... native_job=0x7ffe9e52c280; no scratch ProfileSelect build`; telemetry: custom_cover_builds=0, render_suppressed_windows=0, title_native_ready_hits=1765 flags=0, native_submit_hits=0."}}
{"run":197,"commit":"2100051","metric":1520,"metrics":{"readiness_gate_failures":0,"target_constants_remaining":0,"helpers_missing":0,"fixed_wait_predicates":0,"autoload_static_failures":0,"asset_chain_failures":0,"dll_patch_failures":0,"native_continue_failures":0,"field58_gate_failures":0,"direct_shortcut_failures":0,"input_path_failures":0,"runtime_proof_failures":1,"runtime_mode_failures":0,"eula_popup_failures":0,"save_data_popup_failures":0,"messagebox_dialog_failures":0,"server_status_failures":0,"title_cover_failures":0,"title_cover_penalty":0,"native_trace_blockers":0,"native_trace_hits_total":74,"native_trace_unique_breakpoints":11,"false_positives":0,"runtime_timeout_failures":0,"runtime_title_visual_suppressed_builds":1,"runtime_custom_cover_builds":1,"runtime_simulated_button_presses_total":0},"status":"discard","description":"static decoded BeginTitle wrapper return consumer chain","timestamp":1782422692934,"segment":0,"confidence":null,"asi":{"hypothesis":"Static decoding of the caller after 0x14081f9f0 should reveal whether preserving the out slot/return is enough or whether a later composition helper is blocking the native 05_000_Title job from running.","rollback_reason":"Primary metric remained 1520 and runtime_proof_failures=1; static decompile/disasm only, no product proof.","next_action_hint":"The caller at deobf 0x140b0c70b passes `rcx=rbp+0x90` out slot, `rdx=title+0xe0`, `r8=title+0x138` to 0x14081f9f0, then clones the returned DLReference pointer via 0x1407a7b60 and composes it through 0x140b0c180, 0x14078e0e0, 0x1407927d0, and 0x140b0e530/0x140b0e520. Next static target should decode the composed job/lambda_b2c2 path and/or hook the full MenuWindowJob::Run entry for the latched job.","evidence":"Deobf disasm 0x140b0c6f6..0x140b0c767 shows the exact return consumer chain. Ghidra says 0x14078e0e0 invokes a std::function at object+0x390 or fails via vtable+0x60, and 0x140b0e520 constructs lambda_b2c2f... capturing param_1+8."}}
{"run":198,"commit":"2100051","metric":1520,"metrics":{"readiness_gate_failures":0,"target_constants_remaining":0,"helpers_missing":0,"fixed_wait_predicates":0,"autoload_static_failures":0,"asset_chain_failures":0,"dll_patch_failures":0,"native_continue_failures":0,"field58_gate_failures":0,"direct_shortcut_failures":0,"input_path_failures":0,"runtime_proof_failures":1,"runtime_mode_failures":0,"eula_popup_failures":0,"save_data_popup_failures":0,"messagebox_dialog_failures":0,"server_status_failures":0,"title_cover_failures":0,"title_cover_penalty":0,"native_trace_blockers":0,"native_trace_hits_total":74,"native_trace_unique_breakpoints":11,"false_positives":0,"runtime_timeout_failures":0,"runtime_title_visual_suppressed_builds":1,"runtime_custom_cover_builds":1,"runtime_simulated_button_presses_total":0},"status":"discard","description":"static decoded BeginTitle job install and MenuJobWait tick path","timestamp":1782422908380,"segment":0,"confidence":null,"asi":{"hypothesis":"Static decode of the BeginTitle return consumer and MenuJobWait path should identify where the built native 05_000_Title MenuWindowJob is supposed to be installed/ticked, explaining why render/Run never fired in the native-preserving runtime attempts.","rollback_reason":"Primary metric stayed 1520 with runtime_proof_failures=1; static RE finding only, no product/runtime proof improvement.","next_action_hint":"Add a passive runtime diagnostic hook at FUN_140b0e620 and/or ExecuteMenuJob to log param_2 job, owner+0x130 before/after, current vtable, and whether it equals the latched BeginTitle 05_000_Title job. This should distinguish install-missed, overwritten-before-MenuJobWait, and ExecuteMenuJob-ticking-different-occupant. Do not cold-call or assign manually.","finding_key":"autoload-begintitle-job-install-path-2026-06-25","evidence":"Ghidra/deobf: FUN_140b0e620 assigns *param_2 into TitleStep+0x130 via CS::MenuJob::Assign and sets state 10; STEP_MenuJobWait ticks TitleStep+0xe0, sets CSMenuMan+0x18=1, then ExecuteMenuJob(&TitleStep+0x130)."}}
{"run":199,"commit":"2100051","metric":1520,"metrics":{"readiness_gate_failures":0,"target_constants_remaining":0,"helpers_missing":0,"fixed_wait_predicates":0,"autoload_static_failures":0,"asset_chain_failures":0,"dll_patch_failures":0,"native_continue_failures":0,"field58_gate_failures":0,"direct_shortcut_failures":0,"input_path_failures":0,"runtime_proof_failures":1,"runtime_mode_failures":0,"eula_popup_failures":0,"save_data_popup_failures":0,"messagebox_dialog_failures":0,"server_status_failures":0,"title_cover_failures":0,"title_cover_penalty":0,"native_trace_blockers":0,"native_trace_hits_total":74,"native_trace_unique_breakpoints":11,"false_positives":0,"runtime_timeout_failures":0,"runtime_title_visual_suppressed_builds":1,"runtime_custom_cover_builds":1,"runtime_simulated_button_presses_total":0},"status":"discard","description":"added passive b0e620 title job install diagnostic hook","timestamp":1782423216091,"segment":0,"confidence":null,"asi":{"hypothesis":"A passive hook at FUN_140b0e620 can distinguish whether the BeginTitle-composed native title job is installed into TitleStep+0x130, overwritten before MenuJobWait, or replaced by a different occupant, without cold-calling or manually assigning anything.","rollback_reason":"Primary metric remained 1520, equal to the persisted best, and runtime_proof_failures remained 1. The hook compiled but was diagnostic-only and not exercised by the static benchmark, so it was discarded under the primary-metric rule.","next_action_hint":"If runtime evidence is needed, reapply the passive `title_begin_job_install_hook` shape and run a bounded runtime probe; inspect `TITLE-BEGIN-JOB-INSTALL ENTER/LEAVE` lines for param_job, owner130_before/after, and installed_matches_title. Pair with an ExecuteMenuJob hook only if b0e620 proves install succeeded but Run still does not fire.","validation":"`cargo xwin build --release --target x86_64-pc-windows-msvc` completed successfully before measure; `.auto/measure.sh` passed with autoload_re_score=1520.","deferred_idea":"Appended the passive installer diagnostic to .auto/ideas.md for later runtime use."}}
{"run":200,"commit":"2100051","metric":0,"metrics":{"readiness_gate_failures":0,"target_constants_remaining":0,"helpers_missing":0,"fixed_wait_predicates":0,"autoload_static_failures":0,"asset_chain_failures":0,"dll_patch_failures":0,"native_continue_failures":0,"field58_gate_failures":0,"direct_shortcut_failures":0,"input_path_failures":0,"runtime_proof_failures":1,"runtime_mode_failures":0,"eula_popup_failures":0,"save_data_popup_failures":0,"messagebox_dialog_failures":0,"server_status_failures":0,"title_cover_failures":0,"title_cover_penalty":0,"native_trace_blockers":0,"native_trace_hits_total":74,"native_trace_unique_breakpoints":11,"false_positives":0,"runtime_timeout_failures":1,"runtime_title_visual_suppressed_builds":1,"runtime_custom_cover_builds":1,"runtime_simulated_button_presses_total":0},"status":"crash","description":"runtime exercised passive b0e620 title job install diagnostic","timestamp":1782423576292,"segment":0,"confidence":null,"asi":{"hypothesis":"A passive FUN_140b0e620 hook would reveal whether the BeginTitle-composed native title job is installed into TitleStep+0x130 before MenuJobWait, distinguishing install-missed from overwritten/ticked-different-occupant without cold-calling or assigning manually.","rollback_reason":"run_experiment timed out before METRIC lines, so primary metric is 0/crash. Exact process scan found no eldenring.exe/start_protected_game.exe afterward. Artifact timed out with native_submit_hits=0, continue_phase=0, title_native_ready flags=0, zero input, and zero MessageBox.","next_action_hint":"Do not assume b0e620 evidence exists from this run: bootstrap said continue_trace_applied but no TITLE-BEGIN-JOB-INSTALL lines appeared in the artifact. Next either hook ExecuteMenuJob/owner+0x130 directly with telemetry fields copied into er-effects-telemetry.json, or first make continue-trace-game.log copying reliable for product-continue-direct artifacts.","artifact":"/home/banon/projects/er-effects-rs/target/runtime-probe/product-continue-direct-20260625-143625","finding_key":"autoload-b0e620-runtime-no-hit-or-no-log-2026-06-25","validation":"`cargo xwin build --release --target x86_64-pc-windows-msvc` succeeded before the armed `.auto/measure.sh` runtime attempt.","evidence":"Artifact: bootstrap continue_trace_applied; er-effects-autoload-debug.log shows kept path replaced 05_000_Title with 05_010_ProfileSelect at +16405ms; readiness-result timeout_seconds_budget_exhausted, title_native_ready_last_flags=0, oracle_native_submit_hits=0, simulated_button_presses_total=0."}}
{"run":201,"commit":"2100051","metric":0,"metrics":{"readiness_gate_failures":0,"target_constants_remaining":0,"helpers_missing":0,"fixed_wait_predicates":0,"autoload_static_failures":0,"asset_chain_failures":0,"dll_patch_failures":0,"native_continue_failures":0,"field58_gate_failures":0,"direct_shortcut_failures":0,"input_path_failures":0,"runtime_proof_failures":1,"runtime_mode_failures":0,"eula_popup_failures":0,"save_data_popup_failures":0,"messagebox_dialog_failures":0,"server_status_failures":0,"title_cover_failures":0,"title_cover_penalty":0,"native_trace_blockers":0,"native_trace_hits_total":74,"native_trace_unique_breakpoints":11,"false_positives":0,"runtime_timeout_failures":1,"runtime_title_visual_suppressed_builds":1,"runtime_custom_cover_builds":1,"runtime_simulated_button_presses_total":0},"status":"crash","description":"runtime added telemetry-backed ExecuteMenuJob observer","timestamp":1782424021969,"segment":0,"confidence":null,"asi":{"hypothesis":"Telemetry-backed observe-only ExecuteMenuJob hook at 0x1407a9600 will distinguish whether the BeginTitle out-slot/custom-cover job is actually being ticked, avoiding reliance on missing continue-trace logs.","rollback_reason":"run_experiment timed out before METRIC lines, so primary metric is 0/crash. Exact artifact evidence shows ExecuteMenuJob was observed 23832 times but never on the BeginTitle out-slot/custom-cover job; native_submit_hits=0, continue_phase=0, title_native_ready flags=0, zero input, zero MessageBox.","next_action_hint":"Generic ExecuteMenuJob is confirmed active but not ticking the title/custom-cover job. Next decode/instrument the composition/install path after caller 0x140b0c710 (0x140b0c180/0x14078e0e0/0x1407927d0/0x140b0e530/0x140b0e520) or slot-install primitive rather than adding more generic ExecuteMenuJob hooks.","artifact":"/home/banon/projects/er-effects-rs/target/runtime-probe/product-continue-direct-20260625-144410","finding_key":"autoload-executemenujob-observer-no-title-job-ticks-2026-06-25","validation":"`cargo xwin build --release --target x86_64-pc-windows-msvc` succeeded before the armed `.auto/measure.sh` runtime attempt.","evidence":"Telemetry: oracle_execute_menu_job_observe_hits=23832, title_out_ticks=0, custom_cover_ticks=0, last_job_before=0, oracle_title_custom_cover_profile_select_last_job=0x7ffe9e53c280, timeout_seconds_budget_exhausted."}}
{"run":202,"commit":"2100051","metric":0,"metrics":{"readiness_gate_failures":0,"target_constants_remaining":0,"helpers_missing":0,"fixed_wait_predicates":0,"autoload_static_failures":0,"asset_chain_failures":0,"dll_patch_failures":0,"native_continue_failures":0,"field58_gate_failures":0,"direct_shortcut_failures":0,"input_path_failures":0,"runtime_proof_failures":1,"runtime_mode_failures":0,"eula_popup_failures":0,"save_data_popup_failures":0,"messagebox_dialog_failures":0,"server_status_failures":0,"title_cover_failures":0,"title_cover_penalty":0,"native_trace_blockers":0,"native_trace_hits_total":74,"native_trace_unique_breakpoints":11,"false_positives":0,"runtime_timeout_failures":1,"runtime_title_visual_suppressed_builds":1,"runtime_custom_cover_builds":1,"runtime_simulated_button_presses_total":0},"status":"crash","description":"runtime corrected BeginTitle installer hook to live b0e530","timestamp":1782424478150,"segment":0,"confidence":null,"asi":{"hypothesis":"The previous b0e620 hook used a dump VA as a live/deobf target. Correcting it to live/deobf 0x140b0e530 and exposing telemetry will prove whether STEP_BeginTitle installs the composed job into TitleStep+0x130.","rollback_reason":"run_experiment timed out before METRIC lines, so primary metric is 0/crash. Runtime still had native_submit_hits=0, continue_phase=0, title_native_ready flags=0, zero input, zero MessageBox.","next_action_hint":"Corrected hook proved TitleStep+0x130 receives a composed job, not the raw BeginTitle out-slot/custom-cover job. Next instrument the composed installed job/sequence (vtable/class/children or ExecuteMenuJob match against title_begin_job_install_last_owner_after) to see which child runs and why native title rows remain invalid. Do not use old live 0x140b0e620 for this function.","artifact":"/home/banon/projects/er-effects-rs/target/runtime-probe/product-continue-direct-20260625-145227","finding_key":"autoload-corrected-b0e530-installs-composed-title-job-2026-06-25","validation":"Ghidra/deobf shift check: dump 0x140b0e620 -> deobf 0x140b0e530 content-unique; `cargo xwin build --release --target x86_64-pc-windows-msvc` succeeded before runtime attempt.","evidence":"Telemetry: oracle_title_begin_job_install_hits=2, owner_before=0, owner_after=param_job=0x7ffe9e5f0ea0, matches_title_out=false, matches_custom_cover=false; runtime timed out with title_native_ready_last_flags=0."}}
