{"run":508,"commit":"9353857","metric":0,"metrics":{"readiness_gate_failures":0,"target_constants_remaining":0,"helpers_missing":0,"fixed_wait_predicates":0,"autoload_static_failures":0,"asset_chain_failures":0,"dll_patch_failures":0,"native_continue_failures":0,"field58_gate_failures":0,"direct_shortcut_failures":0,"input_path_failures":0,"runtime_proof_failures":0,"runtime_mode_failures":0,"eula_popup_failures":0,"save_data_popup_failures":0,"messagebox_dialog_failures":0,"server_status_failures":0,"title_cover_failures":2,"title_cover_penalty":1800,"native_trace_blockers":0,"native_trace_hits_total":74,"native_trace_unique_breakpoints":11,"false_positives":1,"offline_face_source_ready":1,"removed path_cpu_texture_bridge_ready":1,"offline_face_texture_runtime_drawn":0,"stylized_facedata_pixel_oracle":0,"real_portrait_asset_candidates":0,"profile_placeholder_assets_only":1},"status":"discard","description":"Static RE maps GXSgCompositeScene/GXSgLayerFlat traversal but no direct readback bridge","timestamp":1782572321827,"segment":2,"confidence":null,"asi":{"hypothesis":"Inspect GXSgCompositeScene/GXSgLayerFlat traversal and CSEzOffscreenRend scene path after CSModelDispEntity internals lacked a texture bridge, looking for an offscreen render target or readback/register point.","static_re_finding":"GXSgCompositeScene vtable 0x142f0b6e0 slots include destructor 0x141a0aad0, child iteration/propagation helpers 0x141b646f0/650/640/e0/680/d0, and traversal/draw dispatcher 0x141b64280 at +0x38. FUN_141b64280 builds draw-scene state, calls this+0x50, then when synchronous calls vtable+0x68 and iterates children [this+0x20..0x28] calling child vtable+0x40; async path allocates GXDrawSceneJob and later still runs vtable+0x58/+0x60. GXSgLayerFlat vtable 0x142f21918 includes add/remove methods 0x141ad9f60/0x141ada0a0, mask propagation 0x141ada1e0/1d0, no-op slots 0x140e62870/0x140e62840, and layer dispatcher 0x141ada130, which checks draw masks then iterates field1_0x10 children and calls each child object callback through *(child+0x10) vtable. RendMan phase 0x140cc7200 calls FUN_141ad8a80 on scene list at RendMan+0x8, sorting scene/layer entries then invoking each entry vtable+0x38. CSEzOffscreenRend setup 0x140bb7440 creates this CompositeScene/LayerFlat graph and attaches CSModelDispEntity/GXSgEntity children, but the traversal route remains scene graph dispatch into GxDrawContext, not a direct CPU-readable portrait texture or removed path TextureId bridge.","validation":"Recalled Beads memories; Ghidra xrefs_from GXSgCompositeScene vtable 0x142f0b6e0 and GXSgLayerFlat vtable 0x142f21918; decompiled 0x141b64280, 0x141b646f0/650/640/e0/680/d0, 0x141ada130, 0x141ad9f60, 0x141ada0a0, 0x141ada1e0, 0x141ad8a80, layer no-ops 0x140e62840/870, and CSEzOffscreenRend-related xrefs; run_experiment ./.auto/measure.sh without runtime trigger.","rollback_reason":"Primary metric stayed 0. Static RE found traversal semantics but no visible portrait cover, readback path, or final portrait oracle.","next_action_hint":"Stop looking for an easy raw pointer bridge in the profile renderer object graph. The viable path is likely to reuse the engine scene graph itself: either graft/show the existing offscreen CompositeScene/LayerFlat output on an earlier title-safe surface, or use a removed path CPU/precomputed portrait route. Next spike should identify a native copy/blit/readback or scene-to-texture presentation call around GxDrawContext/FUN_141aca7d0/FUN_1419e0820/FUN_141aca560 used in RendMan/CSEzOffscreenRend, rather than more vtable slot enumeration."}}
{"run":509,"commit":"9353857","metric":0,"metrics":{"readiness_gate_failures":0,"target_constants_remaining":0,"helpers_missing":0,"fixed_wait_predicates":0,"autoload_static_failures":0,"asset_chain_failures":0,"dll_patch_failures":0,"native_continue_failures":0,"field58_gate_failures":0,"direct_shortcut_failures":0,"input_path_failures":0,"runtime_proof_failures":0,"runtime_mode_failures":0,"eula_popup_failures":0,"save_data_popup_failures":0,"messagebox_dialog_failures":0,"server_status_failures":0,"title_cover_failures":2,"title_cover_penalty":1800,"native_trace_blockers":0,"native_trace_hits_total":74,"native_trace_unique_breakpoints":11,"false_positives":1,"offline_face_source_ready":1,"removed path_cpu_texture_bridge_ready":1,"offline_face_texture_runtime_drawn":0,"stylized_facedata_pixel_oracle":0,"real_portrait_asset_candidates":0,"profile_placeholder_assets_only":1},"status":"discard","description":"Static RE maps GxDrawContext offscreen presentation helpers but no copy/readback path","timestamp":1782572550192,"segment":2,"confidence":null,"asi":{"hypothesis":"Investigate native scene-to-texture/copy/presentation calls around GxDrawContext/FUN_141aca7d0/FUN_1419e0820/FUN_141aca560 used by RendMan/CSEzOffscreenRend, looking for a product-safe way to present or copy the profile offscreen scene as the title portrait cover.","static_re_finding":"RendMan phase FUN_140cc7200 is the clearest presentation context. It sets g_GxDrawContext->field_0x30=param_2, dispatches scene graph via FUN_141ad8a80(*(param_1+8), &g_GxDrawContext->field_0x30), then for an EzDraw queue at param_1+0x28 obtains a draw resource uVar5 from g_GxDrawContext->field_0x128, obtains a render target/context uVar6 via FUN_141adf190, calls FUN_1419e0820(*(param_2+0x25c8), uVar6), calls FUN_141aca7d0(param_2,uVar5,uVar6,viewport_rect), constructs FD4HkDrawSceneContext, draws CSEzDraw 0x142650030, then calls FUN_141aca560(param_2) and FUN_1419e1570(*(param_2+0x25c8),uVar6). FUN_141aca7d0 snapshots context state via param_1+0x1c10, stores current handle to +0x23a8, and sets viewport/scissor through virtual calls at underlying device vtable +0xa8/+0xb0 (FUN_141e8bfe0/FUN_141e8c000), optionally from explicit rect. FUN_141aca560 restores/ends context state from +0x1c10 and clears a flag in +0x1be0. FUN_1419e0820 and FUN_1419e1570 build render-target/depth binding descriptors from param_2 resource metadata and call FUN_141e8ccc0 -> FUN_141e8e140, which ultimately calls device vtable +0xd0 to set RT/depth bindings; FUN_1419e0e30 registers/uses a target resource through FUN_141e8af80 -> device vtable +0x180. CSEzOffscreenRend setup FUN_140bb7440 obtains an available draw context with FUN_1419e5850, pulls a resource from the offscreen scene, calls FUN_1419e0e30 to register/clear it, and returns it with FUN_1419eaa40. These are GPU state binding/presentation helpers, not CPU readback or removed path TextureId registration.","validation":"Read .auto/prompt.md targeted lines; searched Beads memories for GxDrawContext/CSEzOffscreenRend/FUN_141aca7d0/FUN_1419e0820/FUN_141aca560; Ghidra decompiled/inspected functions 0x140cc7200, 0x141aca7d0, 0x141aca560, 0x1419e0820, 0x1419e1570, 0x141e8bfe0, 0x141e8c000, 0x141e8ccc0, 0x141e8e140, 0x1419e0e30, 0x141e8af80, 0x1419e5850, 0x1419eaa40, 0x140bb7440; run_experiment ./.auto/measure.sh without runtime trigger.","rollback_reason":"Primary metric stayed 0. Static RE found the native viewport/render-target binding route but did not implement a visible portrait cover or final pixel/native oracle.","next_action_hint":"A raw readback shortcut is unlikely in this layer. More promising next iteration: either implement/reapply the removed path CPU/precomputed portrait route as a real asset-derived portrait image with pixel oracle, or if staying native, identify how to submit/draw the already-rendered offscreen resource through a title-safe EzDraw/GFx surface rather than trying to read it back."}}
{"run":510,"commit":"9353857","metric":0,"metrics":{"readiness_gate_failures":0,"target_constants_remaining":0,"helpers_missing":0,"fixed_wait_predicates":0,"autoload_static_failures":0,"asset_chain_failures":0,"dll_patch_failures":0,"native_continue_failures":0,"field58_gate_failures":0,"direct_shortcut_failures":0,"input_path_failures":0,"runtime_proof_failures":0,"runtime_mode_failures":0,"eula_popup_failures":0,"save_data_popup_failures":0,"messagebox_dialog_failures":0,"server_status_failures":0,"title_cover_failures":1,"title_cover_penalty":1600,"native_trace_blockers":0,"native_trace_hits_total":74,"native_trace_unique_breakpoints":11,"false_positives":0,"offline_face_source_ready":1,"removed path_cpu_texture_bridge_ready":0,"offline_face_texture_runtime_drawn":1,"stylized_facedata_pixel_oracle":1,"real_portrait_asset_candidates":0,"profile_placeholder_assets_only":1},"status":"discard","description":"FaceData-derived removed path foreground portrait cover becomes visible but remains secondary-only","timestamp":1782573148276,"segment":2,"confidence":null,"asi":{"hypothesis":"Since GxDrawContext/native offscreen traversal exposed no raw readback bridge, reapply the invalidated CPU texture route but draw a FaceData-derived portrait-like RGBA texture on the foreground draw list during the title gap, with explicit telemetry and no promotion to oracle_title_portrait_pixels_visible.","implementation":"Added diagnostic TITLE_OFFLINE_FACE_TEXTURE_* telemetry, built a deterministic 512x512 RGBA portrait-like texture from the persisted Banon FaceData SHA256 439f92e2..., uploaded it with removed path RenderContext::load_texture in EffectsOverlay::initialize, and drew it with ui.get_foreground_draw_list() over a black title cover only while product autoload is active and no player is available. Telemetry fields oracle_title_offline_face_texture_uploaded/drawn were appended separately from final portrait_pixels_visible fields.","validation":"cargo fmt applied; Steam was running; wrote .auto/run_runtime_probe_once and .auto/enable_removed path_runtime_once; run_experiment executed ./.auto/measure.sh in 26.8s with runtime artifact /home/banon/projects/er-effects-rs/target/runtime-probe/product-continue-direct-20260627-081103. Runtime reached world_stable, Banon, zero popup/failure metrics. Telemetry reported oracle_title_offline_face_texture_uploaded=true, upload_failures=0, draw_calls=315, drawn=true, display=1600x900, image=512x512. Screenshot analysis reported black32_ratio=0.8118527745212973, dark64_ratio=0.8163442751074639, black_ratio_sane_for_portrait_stage=true, known_false_positive_signature=false, making stylized_facedata_pixel_oracle=1 and false_positives=0.","rollback_reason":"Primary metric stayed 0 because this is still a stylized FaceData-derived staging image, not a true loaded-character/precomputed native portrait. It deliberately does not set oracle_title_portrait_pixels_visible; removed path_cpu_texture_bridge_ready also regressed to 0 due the static checker no longer matching the bridge implementation signature despite runtime upload/draw proof.","next_action_hint":"The foreground removed path route is visually viable. Next primary-improving path should replace the stylized generated texture with a real precomputed/decoded portrait image or a native-rendered offscreen resource registered into removed path, then add a non-cheating oracle_title_portrait_pixels_visible tied to that real portrait. Also fix measure's removed path_cpu_texture_bridge_ready static signature check so it accepts the actual render_context.load_texture implementation without relying on stale parameter names."}}
{"run":511,"commit":"9353857","metric":0,"metrics":{"readiness_gate_failures":0,"target_constants_remaining":0,"helpers_missing":0,"fixed_wait_predicates":0,"autoload_static_failures":0,"asset_chain_failures":0,"dll_patch_failures":0,"native_continue_failures":0,"field58_gate_failures":0,"direct_shortcut_failures":0,"input_path_failures":0,"runtime_proof_failures":0,"runtime_mode_failures":0,"eula_popup_failures":0,"save_data_popup_failures":0,"messagebox_dialog_failures":0,"server_status_failures":0,"title_cover_failures":1,"title_cover_penalty":1600,"native_trace_blockers":0,"native_trace_hits_total":74,"native_trace_unique_breakpoints":11,"false_positives":0,"offline_face_source_ready":1,"removed path_cpu_texture_bridge_ready":1,"offline_face_texture_runtime_drawn":1,"stylized_facedata_pixel_oracle":1,"real_portrait_asset_candidates":0,"profile_placeholder_assets_only":1},"status":"discard","description":"Accept imported RenderContext in invalidated CPU texture bridge checker","timestamp":1782573391526,"segment":2,"confidence":null,"asi":{"hypothesis":"Fix the static removed path_cpu_texture_bridge_ready checker so it recognizes both `&mut dyn removed path::RenderContext` and the imported `&mut dyn RenderContext` form used by the working foreground texture experiment, without promoting stylized FaceData cover proof to final portrait_pixels_visible.","implementation":"Changed only `.auto/measure.sh` regex from `&mut dyn removed path::RenderContext` to `&mut dyn (?:removed path::)?RenderContext`. No product source changed and no final oracle gate was weakened.","validation":"run_experiment ./.auto/measure.sh without a runtime trigger passed in 1.6s. Metrics now report removed path_cpu_texture_bridge_ready=1 while preserving autoload_re_score=0, title_cover_failures=1, title_cover_penalty=1600, and the hard missing portrait_pixels_visible gate. The offline_face_texture_runtime_drawn/stylized_facedata_pixel_oracle values come from the previous artifact /home/banon/projects/er-effects-rs/target/runtime-probe/product-continue-direct-20260627-081103, not a new runtime run.","rollback_reason":"Primary metric stayed 0. This is metric hygiene for a false negative in a secondary static check, not final portrait proof.","next_action_hint":"Use the now-correct bridge check for the next real implementation iteration: replace the generated/stylized FaceData texture with an actual precomputed/decoded portrait image or native-rendered offscreen resource registered into removed path, then add a non-cheating `oracle_title_portrait_pixels_visible` tied to that real portrait."}}
{"run":512,"commit":"9353857","metric":0,"metrics":{"readiness_gate_failures":0,"target_constants_remaining":0,"helpers_missing":0,"fixed_wait_predicates":0,"autoload_static_failures":0,"asset_chain_failures":0,"dll_patch_failures":0,"native_continue_failures":0,"field58_gate_failures":0,"direct_shortcut_failures":0,"input_path_failures":0,"runtime_proof_failures":0,"runtime_mode_failures":0,"eula_popup_failures":0,"save_data_popup_failures":0,"messagebox_dialog_failures":0,"server_status_failures":0,"title_cover_failures":1,"title_cover_penalty":1600,"native_trace_blockers":0,"native_trace_hits_total":74,"native_trace_unique_breakpoints":11,"false_positives":0,"offline_face_source_ready":1,"removed path_cpu_texture_bridge_ready":1,"offline_face_texture_runtime_drawn":1,"stylized_facedata_pixel_oracle":1,"real_portrait_asset_candidates":0,"profile_placeholder_assets_only":1},"status":"discard","description":"Inventory existing runtime screenshots for a real precomputed portrait source","timestamp":1782573582985,"segment":2,"confidence":null,"asi":{"hypothesis":"Before inventing another renderer, inventory existing runtime visual artifacts to see whether any contain a real selected-character/profile portrait crop that could seed a non-cheating precomputed portrait asset for the foreground removed path route.","implementation":"Created an offline contact sheet of the 40 most recent runtime `logo-replacement-screenshot`, `teardown-screenshot`, and Steam target images under `target/autoresearch/portrait-screenshot-inventory-20260627/` using ImageMagick. Pillow was unavailable, so no package install was performed; existing `montage`/`magick` tools were used.","validation":"Read the generated contact sheet `/home/banon/projects/er-effects-rs/target/autoresearch/portrait-screenshot-inventory-20260627/runtime-image-contact-sheet.jpg` and summary `/home/banon/projects/er-effects-rs/target/autoresearch/portrait-screenshot-inventory-20260627/summary.json`; then ran `./.auto/measure.sh` without a runtime trigger. The contact sheet shows only the stylized FaceData staging portraits, dark/ProfileSelect or title/loading screens, native loading art, world/boss captures, and Elden Ring title/Steam views. It does not show a clean real ProfileSelect/loaded-character portrait crop suitable as a precomputed portrait asset.","rollback_reason":"Primary metric stayed 0. This iteration produced evidence that the existing artifact pool does not contain a usable real portrait source; it did not implement final portrait pixels.","next_action_hint":"Do not mine the current runtime screenshot archive for a real portrait crop. Next viable path is to generate/capture a true profile portrait deliberately: either make a controlled native ProfileSelect/profile-renderer capture before loading takeover, or build a native/removed path bridge that registers the profile renderer output; otherwise continue using the stylized FaceData route only as secondary staging."}}
{"run":513,"commit":"0dfc45e","metric":0,"metrics":{"readiness_gate_failures":0,"target_constants_remaining":0,"helpers_missing":0,"fixed_wait_predicates":0,"autoload_static_failures":0,"asset_chain_failures":0,"dll_patch_failures":0,"native_continue_failures":0,"field58_gate_failures":0,"direct_shortcut_failures":0,"input_path_failures":0,"runtime_proof_failures":0,"runtime_mode_failures":0,"eula_popup_failures":0,"save_data_popup_failures":0,"messagebox_dialog_failures":0,"server_status_failures":0,"title_cover_failures":1,"title_cover_penalty":1600,"native_trace_blockers":0,"native_trace_hits_total":74,"native_trace_unique_breakpoints":11,"false_positives":0,"offline_face_source_ready":1,"removed path_cpu_texture_bridge_ready":1,"offline_face_texture_runtime_drawn":1,"stylized_facedata_pixel_oracle":1,"real_portrait_asset_candidates":0,"profile_placeholder_assets_only":1},"status":"discard","description":"Native profile portrait capture probe fails before Load Game/profile renderer source readiness","timestamp":1782611847002,"segment":2,"confidence":null,"asi":{"hypothesis":"Deliberately run the existing native ProfileSelect/profile-renderer capture path to obtain a true native profile portrait crop before doing another overlay implementation; if it succeeds, use the image/provenance as the seed for a real portrait-backed surface instead of stylized FaceData art.","artifact":"/home/banon/projects/er-effects-rs/target/runtime-probe/profile-portrait-capture-20260627-185645","failure_evidence":"/home/banon/projects/er-effects-rs/target/runtime-probe/profile-portrait-capture-20260627-185645/profile-portrait-failure.json","finding":"Capture did not reach the ready condition. Telemetry showed native_profile_capture_enabled=true and product_autoload_not_armed=true, but native_load_game_fired=false, source_ready=false, renderer/offscreen/tex_rescap pointers all 0, and systex_bind_hits=0. The launcher exited before the native Load Game/ProfileSelect renderer source became visible.","rollback_reason":"Primary metric stayed 0; no real portrait asset/oracle was captured or implemented.","next_action_hint":"Fix the native profile capture driver first: inspect why ER_EFFECTS_NATIVE_LOAD in native_profile_capture mode did not fire the native Load Game row. Focus on gating in native_load_game_tick/title_accept/native_profile_capture_enabled rather than more portrait renderer enumeration."}}
{"run":514,"commit":"0dfc45e","metric":0,"metrics":{"readiness_gate_failures":0,"target_constants_remaining":0,"helpers_missing":0,"fixed_wait_predicates":0,"autoload_static_failures":0,"asset_chain_failures":0,"dll_patch_failures":0,"native_continue_failures":0,"field58_gate_failures":0,"direct_shortcut_failures":0,"input_path_failures":0,"runtime_proof_failures":0,"runtime_mode_failures":0,"eula_popup_failures":0,"save_data_popup_failures":0,"messagebox_dialog_failures":0,"server_status_failures":0,"title_cover_failures":1,"title_cover_penalty":1600,"native_trace_blockers":0,"native_trace_hits_total":74,"native_trace_unique_breakpoints":11,"false_positives":0,"offline_face_source_ready":1,"removed path_cpu_texture_bridge_ready":1,"offline_face_texture_runtime_drawn":1,"stylized_facedata_pixel_oracle":1,"real_portrait_asset_candidates":0,"profile_placeholder_assets_only":1},"status":"discard","description":"Allow native profile capture to open menu; ready condition reached but target window capture raced teardown","timestamp":1782612019782,"segment":2,"confidence":null,"asi":{"hypothesis":"Remove the native_profile_capture_enabled guard around maybe_set_title_accept_byte so native profile-capture mode still uses the zero-input native title accept gate to create Load Game/ProfileSelect rows, while keeping product Continue/title-cover mutations disabled.","artifact":"/home/banon/projects/er-effects-rs/target/runtime-probe/profile-portrait-capture-20260627-185929","failure_evidence":"/home/banon/projects/er-effects-rs/target/runtime-probe/profile-portrait-capture-20260627-185929/profile-portrait-failure.json","finding":"The change moved the native profile-capture harness past the previous blocker: failure JSON had missing=[] and all readiness checks true, including native_load_game_fired=true, source_ready=true, renderer/offscreen/tex_rescap pointers nonzero, systex_bind_hits=10, product_autoload_not_armed=true, and no title-cover/custom-cover mutations. Capture then failed at the window-capture step with `no exact target window class=steam_app_1245620`, likely a capture/teardown race rather than source-readiness failure.","rollback_reason":"Primary metric stayed 0 and no portrait image/oracle was captured; discard follows primary-metric policy even though the driver fix is promising.","next_action_hint":"Reapply the accept-gate change, then fix the capture harness race: capture immediately when ready before launcher teardown/exit, or keep launcher alive through capture; inspect launcher stderr/teardown timing. This path is now a viable deliberate native portrait capture route."}}
