{"run":478,"commit":"9353857","metric":0,"metrics":{"readiness_gate_failures":0,"target_constants_remaining":0,"helpers_missing":0,"fixed_wait_predicates":0,"autoload_static_failures":0,"asset_chain_failures":0,"dll_patch_failures":0,"native_continue_failures":0,"field58_gate_failures":0,"direct_shortcut_failures":0,"input_path_failures":0,"runtime_proof_failures":0,"runtime_mode_failures":0,"eula_popup_failures":0,"save_data_popup_failures":0,"messagebox_dialog_failures":0,"server_status_failures":0,"title_cover_failures":2,"title_cover_penalty":1800,"native_trace_blockers":0,"native_trace_hits_total":74,"native_trace_unique_breakpoints":11,"false_positives":1},"status":"discard","description":"Profile source timing telemetry shows current latch is after loading takeover","timestamp":1782533881305,"segment":2,"confidence":null,"asi":{"hypothesis":"Before implementing a custom surface, measure whether the latched RAM-backed CSMenuProfModelRend/CSEzOffscreenRend/CSRuntimeTexResCap portrait source exists before native render-loading takeover. Add telemetry for render-loading slot masks at the exact source-sample time.","artifact":"/home/banon/projects/er-effects-rs/target/runtime-probe/product-continue-direct-20260626-211641","runtime_finding":"The current source latch is too late: oracle_title_custom_cover_profile_source_render_slots_at_sample=127 and oracle_title_custom_cover_profile_source_render_visible_slots_at_sample=127. Debug shows profile renderer init/refresh at +16042ms, after the BeginTitle/ProfileSelect path, and final screenshot is still the dark ProfileSelect false positive. Therefore an earlier custom surface cannot rely on the current maybe_refresh_title_profile_cover timing; it must initialize/latch the profile renderer source before render-loading slots become visible.","validation":"cargo fmt; bash -n .auto/measure.sh; bash -n scripts/run-product-continue-direct-probe.sh; python3 -m py_compile scripts/er-readiness-watch.py; python3 scripts/test-runtime-probe-contract.py; python3 scripts/check-runtime-probe-contract.py; shellcheck scripts/run-product-continue-direct-probe.sh; run_experiment ./.auto/measure.sh with .auto/run_runtime_probe_once.","rollback_reason":"Primary metric stayed 0 and false_positives stayed 1; the added telemetry found a timing blocker but did not render a portrait cover.","next_action_hint":"Move profile-render init/source latching earlier in the title flow, before native render-loading visible slots become nonzero. Candidate: initialize profile renderer when title profile summary/profile source is first ready, independent of the late ProfileSelect replay/BeginTitle cover run, then feed that earlier source into a custom surface or removed path resource registration."}}
{"run":479,"commit":"9353857","metric":0,"metrics":{"readiness_gate_failures":0,"target_constants_remaining":0,"helpers_missing":0,"fixed_wait_predicates":0,"autoload_static_failures":0,"asset_chain_failures":0,"dll_patch_failures":0,"native_continue_failures":0,"field58_gate_failures":0,"direct_shortcut_failures":0,"input_path_failures":0,"runtime_proof_failures":0,"runtime_mode_failures":1,"eula_popup_failures":0,"save_data_popup_failures":0,"messagebox_dialog_failures":0,"server_status_failures":0,"title_cover_failures":2,"title_cover_penalty":1800,"native_trace_blockers":0,"native_trace_hits_total":74,"native_trace_unique_breakpoints":11,"false_positives":1},"status":"discard","description":"Early pre-ready profile latch still loses race to render-loading takeover","timestamp":1782534242438,"segment":2,"confidence":null,"asi":{"hypothesis":"Latch CSMenuProfModelRend/CSEzOffscreenRend/CSRuntimeTexResCap as soon as profile_summary and renderer heap allocator are present in the pre-ready path, instead of waiting for full title/PAB readiness, and record render-loading slot masks at the source sample instant.","artifact":"/home/banon/projects/er-effects-rs/target/runtime-probe/product-continue-direct-20260626-212237","runtime_finding":"The earlier pre-ready latch still happened after takeover: profile renderer init/refresh logged at +14520ms, while oracle_title_custom_cover_profile_source_render_slots_at_sample=127 and oracle_title_custom_cover_profile_source_render_visible_slots_at_sample=127. The first pre-ready log at +15075ms showed title_loop=false/textfadeout=false/menu_latch=0/press_start_vt=0, so profile_summary+heap_allocator became usable only late in this path. Runtime still reached Banon/player/world proof, but screenshot remained the dark ProfileSelect false positive.","validation":"cargo fmt; bash -n .auto/measure.sh; bash -n scripts/run-product-continue-direct-probe.sh; python3 -m py_compile scripts/er-readiness-watch.py; python3 scripts/test-runtime-probe-contract.py; python3 scripts/check-runtime-probe-contract.py; shellcheck scripts/run-product-continue-direct-probe.sh; run_experiment ./.auto/measure.sh with .auto/run_runtime_probe_once.","rollback_reason":"Primary metric stayed 0; false_positives stayed 1; runtime_mode_failures=1 because the edit disturbed a static diagnostic token. The candidate latch timing did not beat render-loading takeover.","next_action_hint":"Do not gate early portrait source on ProductCoreAutoloadReady/profile_summary. Next static target should find the native save/profile summary load or profile renderer source before TitleStep MenuJobWait, or pivot to an intentional cover that can render without waiting for CSMenuProfModelRend init. If keeping timing telemetry, preserve measure.sh static token strings exactly."}}
{"run":480,"commit":"9353857","metric":0,"metrics":{"readiness_gate_failures":0,"target_constants_remaining":0,"helpers_missing":0,"fixed_wait_predicates":0,"autoload_static_failures":0,"asset_chain_failures":0,"dll_patch_failures":0,"native_continue_failures":0,"field58_gate_failures":0,"direct_shortcut_failures":0,"input_path_failures":0,"runtime_proof_failures":0,"runtime_mode_failures":0,"eula_popup_failures":0,"save_data_popup_failures":0,"messagebox_dialog_failures":0,"server_status_failures":0,"title_cover_failures":2,"title_cover_penalty":1800,"native_trace_blockers":0,"native_trace_hits_total":74,"native_trace_unique_breakpoints":11,"false_positives":1},"status":"discard","description":"Profile-source timing map shows prerequisites appear only with render-loading already active","timestamp":1782534662268,"segment":2,"confidence":null,"asi":{"hypothesis":"Add non-invasive timing-map telemetry to record the first product tick where profile_summary, heap allocator, both together, render-loading slots, and the full ready predicate become observable. This tests whether a merely earlier call site can beat render-loading takeover without changing product behavior.","artifact":"/home/banon/projects/er-effects-rs/target/runtime-probe/product-continue-direct-20260626-212944","runtime_finding":"The earliest profile_summary, heap allocator, and render-loading slots all appeared on the same product tick: profile_summary_tick=92, heap_allocator_tick=92, profile_and_heap_tick=92, render_slots_tick=92, render_slots_mask=127. first_ready_predicate_tick remained 0. Debug showed title owner absent at tick 60, then by tick 120 profile/heap existed but press_start_vt=0 and render-loading slots were already active; profile renderer init/refresh followed at +15138ms. This indicates ProductCore/title-owner telemetry cannot yield a pre-takeover CSMenuProfModelRend source by moving call sites earlier.","validation":"cargo fmt; bash -n .auto/measure.sh; bash -n scripts/run-product-continue-direct-probe.sh; python3 -m py_compile scripts/er-readiness-watch.py; python3 scripts/test-runtime-probe-contract.py; python3 scripts/check-runtime-probe-contract.py; shellcheck scripts/run-product-continue-direct-probe.sh; run_experiment ./.auto/measure.sh with .auto/run_runtime_probe_once.","rollback_reason":"Primary metric stayed 0 and false_positives stayed 1; telemetry-only diagnostic did not render a portrait cover.","next_action_hint":"Stop trying to obtain an early cover from CSMenuProfModelRend via ProductCore/title-owner readiness. Next path should be static RE for a save-file/offline portrait asset source available before title owner, or implement an intentional cover that renders from a host-decoded save/face/portrait source rather than waiting for native ProfileSelect/profile renderer."}}
{"run":481,"commit":"9353857","metric":0,"metrics":{"readiness_gate_failures":0,"target_constants_remaining":0,"helpers_missing":0,"fixed_wait_predicates":0,"autoload_static_failures":0,"asset_chain_failures":0,"dll_patch_failures":0,"native_continue_failures":0,"field58_gate_failures":0,"direct_shortcut_failures":0,"input_path_failures":0,"runtime_proof_failures":0,"runtime_mode_failures":0,"eula_popup_failures":0,"save_data_popup_failures":0,"messagebox_dialog_failures":0,"server_status_failures":0,"title_cover_failures":2,"title_cover_penalty":1800,"native_trace_blockers":0,"native_trace_hits_total":74,"native_trace_unique_breakpoints":11,"false_positives":1,"offline_face_source_ready":1},"status":"discard","description":"Static offline FaceData source exists but is not a rendered portrait cover","timestamp":1782534895384,"segment":2,"confidence":null,"asi":{"hypothesis":"After timing probes showed ProductCore/title-owner CSMenuProfModelRend prerequisites arrive only with render-loading already active, test whether the gold save already provides a pre-runtime offline FaceData source that an intentional cover could consume without waiting for native ProfileSelect/profile renderer.","static_finding":"scripts/save-slot-oracle.py can extract the gold slot FaceData buffer and body fields before launch. Static diagnostic emitted offline_face_source_ready=1 with name=Banon and face_sha256=439f92e2c629415be00252799e4d697e374f0df40715d094a641269247fb5f77.","validation":"bash -n .auto/measure.sh; python3 scripts/save-slot-oracle.py --save save-files/150-Banon/ER0000.sl2 --slot 0 --output /tmp/er-face-check.json; run_experiment ./.auto/measure.sh.","rollback_reason":"Primary metric stayed 0 because this only proves a pre-runtime FaceData source exists; it does not render a visible portrait/pixel cover and the latest runtime artifact still has the known ProfileSelect false-positive screenshot.","next_action_hint":"Implement a renderer path that consumes the offline FaceData-derived source (or a host/precomputed portrait artifact derived from it) before native render-loading takeover. Do not score offline_face_source_ready alone; it is only provenance/input material for an intentional cover."}}
{"run":482,"commit":"9353857","metric":0,"metrics":{"readiness_gate_failures":0,"target_constants_remaining":0,"helpers_missing":0,"fixed_wait_predicates":0,"autoload_static_failures":0,"asset_chain_failures":0,"dll_patch_failures":0,"native_continue_failures":0,"field58_gate_failures":0,"direct_shortcut_failures":0,"input_path_failures":0,"runtime_proof_failures":0,"runtime_mode_failures":0,"eula_popup_failures":0,"save_data_popup_failures":0,"messagebox_dialog_failures":0,"server_status_failures":0,"title_cover_failures":2,"title_cover_penalty":1800,"native_trace_blockers":0,"native_trace_hits_total":74,"native_trace_unique_breakpoints":11,"false_positives":1,"offline_face_source_ready":1,"removed path_cpu_texture_bridge_ready":1},"status":"discard","description":"Static invalidated CPU texture bridge exists for FaceData-derived cover path","timestamp":1782535117203,"segment":2,"confidence":null,"asi":{"hypothesis":"Since offline FaceData exists before launch, verify whether current removed path can upload CPU RGBA bytes into an removed UI TextureId without patching native D3D resources. This would support a pre-rendered/FaceData-derived intentional cover path before render-loading takeover.","static_finding":"Local removed path checkout exposes RenderContext::load_texture(data,width,height), and EffectsOverlay::initialize receives &mut dyn removed path::RenderContext. Therefore the next implementation can create a CPU RGBA image from FaceData/offline portrait material and upload it during overlay initialize, instead of patching removed path for an existing native SRV first.","validation":"bash -n .auto/measure.sh; run_experiment ./.auto/measure.sh.","rollback_reason":"Primary metric stayed 0 because this only proves bridge feasibility; it does not render a visible portrait/pixel cover and the latest runtime artifact is still the known ProfileSelect false positive.","next_action_hint":"Implement a minimal invalidated CPU texture path: build RGBA bytes from the offline FaceData/precomputed portrait source, call render_context.load_texture in EffectsOverlay::initialize, draw it in the title cover interval with Image/draw_list, and add visible-pixel telemetry. Do not score a generic/generated placeholder unless it is explicitly FaceData/portrait-derived and visually validated."}}
{"run":483,"commit":"9353857","metric":0,"metrics":{"readiness_gate_failures":0,"target_constants_remaining":0,"helpers_missing":0,"fixed_wait_predicates":0,"autoload_static_failures":0,"asset_chain_failures":0,"dll_patch_failures":0,"native_continue_failures":0,"field58_gate_failures":0,"direct_shortcut_failures":0,"input_path_failures":0,"runtime_proof_failures":0,"runtime_mode_failures":0,"eula_popup_failures":0,"save_data_popup_failures":0,"messagebox_dialog_failures":0,"server_status_failures":0,"title_cover_failures":0,"title_cover_penalty":0,"native_trace_blockers":0,"native_trace_hits_total":0,"native_trace_unique_breakpoints":0,"false_positives":0,"offline_face_source_ready":0,"removed path_cpu_texture_bridge_ready":0,"offline_face_texture_runtime_drawn":0},"status":"crash","description":"Deleted path FaceData CPU texture diagnostic aborted on measure.sh syntax error","timestamp":1782535576824,"segment":2,"confidence":null,"asi":{"hypothesis":"Implement a minimal FaceData-derived CPU RGBA texture upload through removed path RenderContext::load_texture, enable removed path for one runtime probe, draw it during the title-cover interval, and expose texture upload/draw telemetry.","artifact":"/home/banon/projects/er-effects-rs/target/runtime-probe/product-continue-direct-20260626-214521","error":"run_experiment failed after runtime launch/deploy because .auto/measure.sh embedded Python had an unterminated string literal at line 1335: runtime_raw += '\\n' was inserted as a literal newline inside single quotes.","validation_before_run":"cargo fmt; bash -n .auto/measure.sh; bash -n scripts/run-product-continue-direct-probe.sh; python3 -m py_compile scripts/er-readiness-watch.py; python3 scripts/test-runtime-probe-contract.py; python3 scripts/check-runtime-probe-contract.py; shellcheck scripts/run-product-continue-direct-probe.sh. Bash -n did not catch the embedded Python syntax error.","rollback_reason":"Crash/no metrics; code and measure patch are untrusted. Need fix embedded Python string using a raw escaped newline or add a py_compile-like check for the measure embedded Python before runtime.","next_action_hint":"Reapply the CPU texture path after first extracting/validating the Python block in .auto/measure.sh, or avoid editing measure parsing until the DLL overlay code compiles/runs. Add a preflight that runs the embedded measure Python under python -m py_compile or executes measure without runtime before launching."}}
{"run":484,"commit":"9353857","metric":0,"metrics":{"readiness_gate_failures":0,"target_constants_remaining":0,"helpers_missing":0,"fixed_wait_predicates":0,"autoload_static_failures":0,"asset_chain_failures":0,"dll_patch_failures":0,"native_continue_failures":0,"field58_gate_failures":0,"direct_shortcut_failures":0,"input_path_failures":0,"runtime_proof_failures":0,"runtime_mode_failures":0,"eula_popup_failures":0,"save_data_popup_failures":0,"messagebox_dialog_failures":0,"server_status_failures":0,"title_cover_failures":2,"title_cover_penalty":1800,"native_trace_blockers":0,"native_trace_hits_total":74,"native_trace_unique_breakpoints":11,"false_positives":1,"offline_face_source_ready":1,"removed path_cpu_texture_bridge_ready":0,"offline_face_texture_runtime_drawn":1},"status":"discard","description":"FaceData-derived invalidated CPU texture uploads and draws but not visible in logo capture","timestamp":1782535919398,"segment":2,"confidence":null,"asi":{"hypothesis":"Reapply the FaceData-derived invalidated CPU texture path after repairing measure.sh: generate deterministic RGBA from the Banon FaceData hash, upload it with RenderContext::load_texture, draw it during product title-cover interval, and expose runtime upload/draw telemetry.","artifact":"/home/banon/projects/er-effects-rs/target/runtime-probe/product-continue-direct-20260626-215042","runtime_finding":"Runtime telemetry proved the invalidated CPU texture path works mechanically: oracle_title_offline_face_texture_uploads=1, upload_failures=0, draw_calls=315, drawn=true, display_size=1600x900, while native zero-input load still reached Banon/player. However logo-replacement screenshot analysis still matched the known false-positive dark panel (black32_ratio=0.4755, known_false_positive_signature=true), so the CPU texture window is not visible in the target logo replacement capture / title-safe layer.","validation":"embedded measure Python py_compile; cargo fmt; bash -n .auto/measure.sh; bash -n scripts/run-product-continue-direct-probe.sh; python3 -m py_compile scripts/er-readiness-watch.py; python3 scripts/test-runtime-probe-contract.py; python3 scripts/check-runtime-probe-contract.py; run_experiment ./.auto/measure.sh with .auto/run_runtime_probe_once and .auto/enable_removed path_runtime_once.","rollback_reason":"Primary metric stayed 0 and false_positives stayed 1 because the rendered CPU texture did not appear in the logo-replacement screenshot and no visible-pixel portrait oracle became true. removed path_cpu_texture_bridge_ready=0 is a static check bug caused by matching the old `_render_context` signature after the implementation renamed it to `render_context`; runtime upload/draw telemetry supersedes that static probe.","next_action_hint":"The next implementation should move the CPU texture draw from an removed UI window into a background/foreground draw-list or other title-safe layer that is visible in the logo-replacement capture, then capture at the draw edge and add a true pixel oracle. Also fix the static removed path_cpu_texture_bridge_ready signature check so it accepts `render_context`."}}
{"run":485,"commit":"9353857","metric":0,"metrics":{"readiness_gate_failures":0,"target_constants_remaining":0,"helpers_missing":0,"fixed_wait_predicates":0,"autoload_static_failures":0,"asset_chain_failures":0,"dll_patch_failures":0,"native_continue_failures":0,"field58_gate_failures":0,"direct_shortcut_failures":0,"input_path_failures":0,"runtime_proof_failures":0,"runtime_mode_failures":0,"eula_popup_failures":0,"save_data_popup_failures":0,"messagebox_dialog_failures":0,"server_status_failures":0,"title_cover_failures":2,"title_cover_penalty":1800,"native_trace_blockers":0,"native_trace_hits_total":74,"native_trace_unique_breakpoints":11,"false_positives":1,"offline_face_source_ready":1,"removed path_cpu_texture_bridge_ready":1,"offline_face_texture_runtime_drawn":1},"status":"discard","description":"Foreground draw-list FaceData texture is visible but still fails current pixel oracle","timestamp":1782536301986,"segment":2,"confidence":null,"asi":{"hypothesis":"Move the FaceData-derived CPU texture from an removed UI window into the foreground draw-list so it lands in the title/logo replacement capture instead of a hidden/window layer.","artifact":"/home/banon/projects/er-effects-rs/target/runtime-probe/product-continue-direct-20260626-215657","visual_artifact":"/home/banon/projects/er-effects-rs/target/runtime-probe/product-continue-direct-20260626-215657/logo-replacement-screenshot.jpg","runtime_finding":"The foreground draw-list path is visibly present in the exact logo-replacement screenshot: the artifact shows the FaceData-derived portrait-like image centered over the menu while the ER Effects window remains at upper-left. Telemetry confirms upload/draw: uploads=1, failures=0, draw_calls=317, drawn=true, display=1600x900, Banon/player loaded. Existing screenshot analyzer still reports known_false_positive_signature=true because its black-ratio heuristic was tuned only for dark ProfileSelect vs portrait-on-black and does not recognize this new visible texture.","validation":"embedded measure Python py_compile; cargo fmt; bash -n .auto/measure.sh; bash -n scripts/run-product-continue-direct-probe.sh; python3 -m py_compile scripts/er-readiness-watch.py; python3 scripts/test-runtime-probe-contract.py; python3 scripts/check-runtime-probe-contract.py; shellcheck scripts/run-product-continue-direct-probe.sh; run_experiment ./.auto/measure.sh with .auto/run_runtime_probe_once and .auto/enable_removed path_runtime_once; read logo-replacement-screenshot.jpg.","rollback_reason":"Primary metric stayed 0 because the current pixel oracle/measure still classifies the screenshot as the known false-positive signature and the FaceData image is a diagnostic/procedural source, not yet a real loaded-character portrait render oracle.","next_action_hint":"Replace the crude hash-derived oval with a real precomputed/decoded portrait image or improve the pixel oracle to detect the visible FaceData-derived draw-list texture as a distinct non-dark/non-ProfileSelect phenomenon. Do not score it as final product until the image is an intentional loaded-character portrait/beauty surface and the screenshot pixel oracle recognizes it."}}
