{"run":11,"commit":"1061e93","metric":0,"metrics":{"readiness_gate_failures":6,"target_constants_remaining":0,"helpers_missing":0,"fixed_wait_predicates":0,"autoload_static_failures":6,"asset_chain_failures":0,"dll_patch_failures":0,"native_continue_failures":0,"field58_gate_failures":0,"direct_shortcut_failures":0,"input_path_failures":0,"runtime_proof_failures":1,"runtime_mode_failures":0,"eula_popup_failures":0,"save_data_popup_failures":1,"messagebox_dialog_failures":0,"server_status_failures":0,"title_cover_failures":0,"title_cover_penalty":0,"native_trace_blockers":0,"native_trace_hits_total":74,"native_trace_unique_breakpoints":11,"false_positives":0,"runtime_timeout_failures":0,"runtime_title_visual_suppressed_builds":0,"runtime_custom_cover_builds":0,"runtime_simulated_button_presses_total":0},"status":"crash","description":"visible vanilla telemetry probe aborted because it was incorrectly launched telemetry-only without a supplied save file","timestamp":1782353152081,"segment":0,"confidence":4,"asi":{"hypothesis":"Run a visible vanilla telemetry/manual trace with autoload disabled so the user can navigate to the Load Game/profile screen and let telemetry capture the native empty-profile/menu state.","error_details":"The run was aborted before useful telemetry because I incorrectly used RUNTIME_TELEMETRY_ONLY=1, which skips staging a save file. User correction: the visible manual trace must supply a save file.","rollback_reason":"No runtime evidence was collected; the launch setup was wrong for the requested manual Load Game trace.","next_action_hint":"Rerun immediately with ER_EFFECTS_GOLD_SAVE=/home/banon/projects/er-effects-rs/save-files/150-Banon/ER0000.sl2 and ER_EFFECTS_NO_AUTOLOAD=1, without RUNTIME_TELEMETRY_ONLY, so the DLL stages a save while leaving input/user navigation unblocked."}}
{"run":12,"commit":"1061e93","metric":0,"metrics":{"readiness_gate_failures":6,"target_constants_remaining":0,"helpers_missing":0,"fixed_wait_predicates":0,"autoload_static_failures":6,"asset_chain_failures":0,"dll_patch_failures":0,"native_continue_failures":0,"field58_gate_failures":0,"direct_shortcut_failures":0,"input_path_failures":0,"runtime_proof_failures":1,"runtime_mode_failures":0,"eula_popup_failures":0,"save_data_popup_failures":1,"messagebox_dialog_failures":0,"server_status_failures":0,"title_cover_failures":0,"title_cover_penalty":0,"native_trace_blockers":0,"native_trace_hits_total":74,"native_trace_unique_breakpoints":11,"false_positives":0,"runtime_timeout_failures":1,"runtime_title_visual_suppressed_builds":0,"runtime_custom_cover_builds":0,"runtime_simulated_button_presses_total":0},"status":"crash","description":"visible vanilla manual telemetry with supplied Banon save hit corrupted-save semaphore and timed out","timestamp":1782353254521,"segment":0,"confidence":4,"asi":{"hypothesis":"With autoload disabled and a supplied staged Banon save, a visible user-driven vanilla trace to the Load Game/profile screen can reveal the native profile/menu state without input suppression or cover hooks contaminating it.","error_details":"Artifact /home/banon/projects/er-effects-rs/target/runtime-probe/product-continue-direct-20260624-190609: first telemetry +1.6s, teardown +40.1s, reason=timeout_seconds_budget_exhausted. Save redirect opened the staged ER0000.sl2 repeatedly, but at +17.962s logged CORRUPTED-SAVE SEMAPHORE GetGR_System_Message id=401106 ('save data is corrupted dialog'); oracle_char_name remained empty, player false, title suppression/custom cover 0, simulated inputs 0, MessageBoxDialog 0. Teardown screenshot fail-closed because ER window was not focused.","rollback_reason":"Runtime proof failed and native save validation rejected the staged save; no product improvement.","next_action_hint":"Most promising next step: run the same visible vanilla manual trace with a known native-accepted live/default save path or adjust staging to include the required .bak/cloud metadata, then add explicit RAM telemetry for profile active slot count/row names so the empty-profile grid is a native oracle instead of an LLM screenshot observation.","artifact_dir":"/home/banon/projects/er-effects-rs/target/runtime-probe/product-continue-direct-20260624-190609","runtime_evidence":{"timing_reason":"timeout_seconds_budget_exhausted","save_data_corrupted_text_id":401106,"oracle_char_name":"","oracle_player_present":false,"simulated_button_presses_total":0,"messagebox_dialog_builds":0,"title_suppressed_builds":0,"custom_cover_builds":0}}}
{"run":13,"commit":"1061e93","metric":0,"metrics":{"readiness_gate_failures":6,"target_constants_remaining":0,"helpers_missing":0,"fixed_wait_predicates":0,"autoload_static_failures":6,"asset_chain_failures":0,"dll_patch_failures":0,"native_continue_failures":0,"field58_gate_failures":0,"direct_shortcut_failures":0,"input_path_failures":0,"runtime_proof_failures":1,"runtime_mode_failures":0,"eula_popup_failures":0,"save_data_popup_failures":0,"messagebox_dialog_failures":1,"server_status_failures":0,"title_cover_failures":0,"title_cover_penalty":0,"native_trace_blockers":0,"native_trace_hits_total":74,"native_trace_unique_breakpoints":11,"false_positives":0,"runtime_timeout_failures":0,"runtime_title_visual_suppressed_builds":0,"runtime_custom_cover_builds":0,"runtime_simulated_button_presses_total":0},"status":"crash","description":"visible manual trace with staged .bak/autocloud loaded Banon but was contaminated by accidental user Continue/postload modal","timestamp":1782353409693,"segment":0,"confidence":4,"asi":{"hypothesis":"Stage ER0000.sl2.bak and steam_autocloud metadata with the supplied Banon save, then run a visible vanilla/manual telemetry trace to see whether native save validation and the profile/load path accept the staged save.","error_details":"Artifact /home/banon/projects/er-effects-rs/target/runtime-probe/product-continue-direct-20260624-190824: corrupted-save semaphore did not recur; oracle_char_name=Banon, level=150, player_present=true, world_stable at +25.6s, saved_map_c30=0xe000000, simulated_button_presses_total=0. The watcher failed at +31.6s with reason=native_messagebox_dialog_detected because a postload modal was built. User reported they accidentally clicked Continue, so the run is contaminated and not product proof.","rollback_reason":"Runtime proof is invalid: the user accidentally clicked Continue and the run ended with a native MessageBoxDialog/postload modal. The .bak/autocloud staging is promising but should be reapplied in a controlled probe.","next_action_hint":"Reapply the staging fix (copy ER0000.sl2.bak or mirror primary, plus steam_autocloud.vdf account marker) and rerun a controlled visible/manual or zero-input probe that does not rely on user input. Use native telemetry for profile active slot/name counts and treat screenshots only as diagnostic artifacts.","artifact_dir":"/home/banon/projects/er-effects-rs/target/runtime-probe/product-continue-direct-20260624-190824","runtime_evidence":{"oracle_char_name":"Banon","oracle_char_level":150,"player_present":true,"world_stable_seconds":25.6,"timing_reason":"native_messagebox_dialog_detected","messagebox_dialog_builds":1,"postload_modal_seen":true,"simulated_button_presses_total":0},"contamination":"User reported accidental Continue click during the visible manual trace."}}
{"run":14,"commit":"1061e93","metric":0,"metrics":{"readiness_gate_failures":6,"target_constants_remaining":0,"helpers_missing":0,"fixed_wait_predicates":0,"autoload_static_failures":6,"asset_chain_failures":0,"dll_patch_failures":0,"native_continue_failures":1,"field58_gate_failures":0,"direct_shortcut_failures":0,"input_path_failures":0,"runtime_proof_failures":1,"runtime_mode_failures":0,"eula_popup_failures":0,"save_data_popup_failures":0,"messagebox_dialog_failures":0,"server_status_failures":0,"title_cover_failures":0,"title_cover_penalty":0,"native_trace_blockers":0,"native_trace_hits_total":74,"native_trace_unique_breakpoints":11,"false_positives":0,"runtime_timeout_failures":1,"runtime_title_visual_suppressed_builds":1,"runtime_custom_cover_builds":1,"runtime_simulated_button_presses_total":0},"status":"crash","description":"zero-input headless probe with staged .bak/autocloud still timed out under ProfileSelect cover path","timestamp":1782353572602,"segment":0,"confidence":4,"asi":{"hypothesis":"If the staged .bak/autocloud metadata fixed the save-validation problem, the current zero-input product path with ProfileSelect cover might see active profile slots and progress without user input.","error_details":"Artifact /home/banon/projects/er-effects-rs/target/runtime-probe/product-continue-direct-20260624-191107: headless zero-input run, title suppression=1, ProfileSelect cover build=1, simulated_button_presses_total=0, msgbox/policy/server=0, but title_owner_scan_last_state=10, profile summary present with ZERO active slots, oracle_char_name='', player_present=false, game_save_slot=-1, reason=timeout_seconds_budget_exhausted at +35.1s.","rollback_reason":"Runtime proof failed. The metadata staging removed the corrupted-save popup in the contaminated manual run, but it does not make the current ProfileSelect title-job replacement product path advance or populate active slots under zero input.","next_action_hint":"Stop testing ProfileSelect as the returned BeginTitle job. Reapply metadata staging only when needed, but next code experiment should suppress native title rendering below the job-return/control-flow boundary or add an independent non-blocking cover/overlay path. Also add RAM telemetry for profile active-slot count/row names to replace screenshot interpretation of the empty-grid state.","artifact_dir":"/home/banon/projects/er-effects-rs/target/runtime-probe/product-continue-direct-20260624-191107","runtime_evidence":{"title_suppressed_builds":1,"custom_cover_profile_select_builds":1,"profile_active_slots":0,"oracle_char_name":"","player_present":false,"simulated_button_presses_total":0,"messagebox_dialog_builds":0,"reason":"timeout_seconds_budget_exhausted"}}}
{"run":15,"commit":"1061e93","metric":0,"metrics":{"readiness_gate_failures":6,"target_constants_remaining":0,"helpers_missing":0,"fixed_wait_predicates":0,"autoload_static_failures":6,"asset_chain_failures":0,"dll_patch_failures":0,"native_continue_failures":0,"field58_gate_failures":0,"direct_shortcut_failures":0,"input_path_failures":0,"runtime_proof_failures":1,"runtime_mode_failures":0,"eula_popup_failures":0,"save_data_popup_failures":0,"messagebox_dialog_failures":0,"server_status_failures":0,"title_cover_failures":0,"title_cover_penalty":0,"native_trace_blockers":0,"native_trace_hits_total":74,"native_trace_unique_breakpoints":11,"false_positives":0,"runtime_timeout_failures":1,"runtime_title_visual_suppressed_builds":0,"runtime_custom_cover_builds":0,"runtime_simulated_button_presses_total":0},"status":"crash","description":"visible vanilla manual trace with staged .bak/autocloud reached user-observed Load Game character screen but timed out without RAM profile oracle","timestamp":1782353794537,"segment":0,"confidence":4,"asi":{"hypothesis":"Stage ER0000.sl2.bak and steam_autocloud.vdf alongside the supplied Banon save, disable autoload, and let the user drive vanilla to Load Game/profile screen so we can observe whether the staged save is accepted and whether the empty-profile visual has a RAM oracle.","error_details":"Artifact /home/banon/projects/er-effects-rs/target/runtime-probe/product-continue-direct-20260624-191429: first telemetry +1.6s, teardown +40.1s, reason=timeout_seconds_budget_exhausted. User reported reaching the Load Game screen with the character about to be selected. RAM telemetry did not yet expose profile row/name/active-slot state: oracle_char_name remained empty, player false, msgbox/policy/server counts zero, title-cover hooks zero, simulated input zero. Teardown screenshot failed closed because ER window was mapped but not focused (focusHistoryID=1), so no trustworthy image artifact exists for scoring.","rollback_reason":"Runtime proof failed and the new staged-metadata wrapper change is not keepable yet; the key observation is diagnostic only until profile-menu state is exposed as RAM telemetry and the watcher has a bounded success/fail condition for the manual trace.","next_action_hint":"Add in-process telemetry for the Load Game/ProfileLoad profile list: active slot count, selected slot index, visible row names/levels, and empty-profile-grid flag. Use the user-observed screen only as diagnostic ground truth; the next successful run should score/fail from RAM fields, not screenshots or LLM interpretation.","artifact_dir":"/home/banon/projects/er-effects-rs/target/runtime-probe/product-continue-direct-20260624-191429","runtime_evidence":{"timing_reason":"timeout_seconds_budget_exhausted","user_observed":"Load Game/profile screen with character about to be selected","oracle_char_name":"","oracle_player_present":false,"simulated_button_presses_total":0,"messagebox_dialog_builds":0,"policy_window_builds":0,"server_status_builds":0,"teardown_screenshot":"fail-closed: ER window not focused"}}}
{"run":16,"commit":"1061e93","metric":0,"metrics":{"readiness_gate_failures":6,"target_constants_remaining":0,"helpers_missing":0,"fixed_wait_predicates":0,"autoload_static_failures":6,"asset_chain_failures":0,"dll_patch_failures":0,"native_continue_failures":0,"field58_gate_failures":0,"direct_shortcut_failures":0,"input_path_failures":0,"runtime_proof_failures":1,"runtime_mode_failures":0,"eula_popup_failures":0,"save_data_popup_failures":0,"messagebox_dialog_failures":0,"server_status_failures":0,"title_cover_failures":0,"title_cover_penalty":0,"native_trace_blockers":0,"native_trace_hits_total":74,"native_trace_unique_breakpoints":11,"false_positives":0,"runtime_timeout_failures":1,"runtime_title_visual_suppressed_builds":0,"runtime_custom_cover_builds":0,"runtime_simulated_button_presses_total":0},"status":"crash","description":"added profile-list RAM oracle and visible manual trace confirmed Banon row in Load Game profile summary","timestamp":1782354036315,"segment":0,"confidence":4,"asi":{"hypothesis":"Add in-process RAM telemetry for the Load Game/ProfileLoad profile list (active slot count, first active row name/level/map, empty-grid flag), then rerun the visible manual trace so the user-observed Load Game screen is represented by native oracles rather than screenshot interpretation.","error_details":"Artifact /home/banon/projects/er-effects-rs/target/runtime-probe/product-continue-direct-20260624-191851: user drove to Load Game/profile screen. New telemetry reported oracle_profile_active_slot_count=1, flags=[1,0,0,0,0,0,0,0,0,0], oracle_profile_empty_grid=false, first_active_slot=0, first_active_name=Banon, first_active_level=150, first_active_map=234881024. oracle_char_name remained empty, player false, no MessageBox/policy/server popups, zero simulated input. Watcher timed out because this was a manual profile-screen observation, not a world-stable product load.","rollback_reason":"The run_experiment failed with timeout_seconds_budget_exhausted and primary metric 0; useful diagnostic code is not keepable under the current product metric until the watcher/measure treats the profile-list RAM oracle as a bounded manual-trace success criterion or it contributes to product proof.","next_action_hint":"Reapply the profile-list RAM telemetry and add a checker/measure guard for these fields as a diagnostic oracle (not product success), plus a manual-trace watcher success mode that can stop when oracle_profile_first_active_name matches the supplied save and profile_empty_grid=false. Then rerun visible manual trace; keep only if the primary metric improves without weakening product constraints.","artifact_dir":"/home/banon/projects/er-effects-rs/target/runtime-probe/product-continue-direct-20260624-191851","runtime_evidence":{"oracle_profile_active_slot_count":1,"oracle_profile_active_slot_flags":[1,0,0,0,0,0,0,0,0,0],"oracle_profile_empty_grid":false,"oracle_profile_first_active_slot":0,"oracle_profile_first_active_name":"Banon","oracle_profile_first_active_level":150,"oracle_profile_first_active_map":234881024,"timing_reason":"timeout_seconds_budget_exhausted","simulated_button_presses_total":0,"messagebox_dialog_builds":0}}}
{"run":17,"commit":"1061e93","metric":0,"metrics":{"readiness_gate_failures":6,"target_constants_remaining":0,"helpers_missing":0,"fixed_wait_predicates":0,"autoload_static_failures":6,"asset_chain_failures":0,"dll_patch_failures":0,"native_continue_failures":0,"field58_gate_failures":0,"direct_shortcut_failures":0,"input_path_failures":0,"runtime_proof_failures":1,"runtime_mode_failures":0,"eula_popup_failures":0,"save_data_popup_failures":0,"messagebox_dialog_failures":0,"server_status_failures":0,"title_cover_failures":0,"title_cover_penalty":0,"native_trace_blockers":0,"native_trace_hits_total":74,"native_trace_unique_breakpoints":11,"false_positives":0,"runtime_timeout_failures":0,"runtime_title_visual_suppressed_builds":0,"runtime_custom_cover_builds":0,"runtime_simulated_button_presses_total":0},"status":"crash","description":"profile-list watcher target failed too early on transient empty profile summary before user reached Load Game","timestamp":1782354263078,"segment":0,"confidence":4,"asi":{"hypothesis":"A new watcher target profile-list can stop the visible manual trace as soon as profile-list RAM telemetry reports a populated character row, avoiding screenshots and LLM interpretation.","error_details":"Artifact /home/banon/projects/er-effects-rs/target/runtime-probe/product-continue-direct-20260624-192342 failed at +9.9s with reason=profile_list_empty before the user could reach Load Game. Telemetry had profile_summary_present=true, active_count=0, empty_grid=true, privacy_policy_gate=true, corrupted_save=0; this is a transient boot/profile state, not a terminal manual-trace failure.","rollback_reason":"Watcher success/fail condition was too aggressive and killed the run before the requested manual navigation. No useful product proof and primary metric 0.","next_action_hint":"Remove profile_list_empty as an early failure for manual profile-list target; wait only for positive RAM evidence (active_count>0, non-empty first_active_name) or the normal timeout. Then rerun the visible manual trace.","artifact_dir":"/home/banon/projects/er-effects-rs/target/runtime-probe/product-continue-direct-20260624-192342","runtime_evidence":{"timing_reason":"profile_list_empty","oracle_profile_active_slot_count":0,"oracle_profile_empty_grid":true,"oracle_privacy_policy_gate":true,"simulated_button_presses_total":0}}}
{"run":18,"commit":"1061e93","metric":1430,"metrics":{"readiness_gate_failures":6,"target_constants_remaining":0,"helpers_missing":0,"fixed_wait_predicates":0,"autoload_static_failures":6,"asset_chain_failures":0,"dll_patch_failures":0,"native_continue_failures":0,"field58_gate_failures":0,"direct_shortcut_failures":0,"input_path_failures":0,"runtime_proof_failures":1,"runtime_mode_failures":0,"eula_popup_failures":0,"save_data_popup_failures":0,"messagebox_dialog_failures":0,"server_status_failures":0,"title_cover_failures":0,"title_cover_penalty":0,"native_trace_blockers":0,"native_trace_hits_total":74,"native_trace_unique_breakpoints":11,"false_positives":0,"runtime_timeout_failures":0,"runtime_title_visual_suppressed_builds":0,"runtime_custom_cover_builds":0,"runtime_simulated_button_presses_total":0},"status":"discard","description":"profile-list watcher/static guard attempt did not launch runtime and produced unchanged score","timestamp":1782354331879,"segment":0,"confidence":4,"asi":{"hypothesis":"Make the Load Game/ProfileLoad profile-list RAM oracle a bounded manual-trace watcher target so the visible trace can stop on native profile-row evidence instead of timing out or relying on screenshots.","rollback_reason":"Primary metric was unchanged at the kept best. The run completed in 1.3s, so it did not actually execute the intended runtime probe; likely the .auto/run_runtime_probe_once sentinel was absent/consumed before .auto/measure.sh entered the runtime branch. No new runtime evidence was collected.","next_action_hint":"Reapply the profile-list RAM telemetry + watcher target changes, ensure .auto/run_runtime_probe_once exists immediately before run_experiment, and verify measure emits the runtime preflight/launch lines. If it still skips runtime, inspect the sentinel branch in .auto/measure.sh before another run."}}
{"run":19,"commit":"1061e93","metric":1430,"metrics":{"readiness_gate_failures":6,"target_constants_remaining":0,"helpers_missing":0,"fixed_wait_predicates":0,"autoload_static_failures":6,"asset_chain_failures":0,"dll_patch_failures":0,"native_continue_failures":0,"field58_gate_failures":0,"direct_shortcut_failures":0,"input_path_failures":0,"runtime_proof_failures":1,"runtime_mode_failures":0,"eula_popup_failures":0,"save_data_popup_failures":0,"messagebox_dialog_failures":0,"server_status_failures":0,"title_cover_failures":0,"title_cover_penalty":0,"native_trace_blockers":0,"native_trace_hits_total":74,"native_trace_unique_breakpoints":11,"false_positives":0,"runtime_timeout_failures":0,"runtime_title_visual_suppressed_builds":0,"runtime_custom_cover_builds":0,"runtime_simulated_button_presses_total":0},"status":"discard","description":"static rebaseline before targeted guard fix showed unchanged score","timestamp":1782354378201,"segment":0,"confidence":4,"asi":{"hypothesis":"Run a clean static rebaseline after discards so the next targeted static-guard fix starts from known current metrics.","rollback_reason":"No code change and no primary improvement; this was only a baseline check.","next_action_hint":"Inspect the full measure DETAIL failures from /tmp/pi-experiment-e978c114da470acb.log, then make a focused executable guard/source improvement that removes one real autoload_static_failure without weakening runtime proof."}}
