{"run":221,"commit":"2100051","metric":0,"metrics":{"readiness_gate_failures":0,"target_constants_remaining":0,"helpers_missing":0,"fixed_wait_predicates":0,"autoload_static_failures":0,"asset_chain_failures":0,"dll_patch_failures":0,"native_continue_failures":0,"field58_gate_failures":0,"direct_shortcut_failures":0,"input_path_failures":0,"runtime_proof_failures":1,"runtime_mode_failures":0,"eula_popup_failures":0,"save_data_popup_failures":0,"messagebox_dialog_failures":0,"server_status_failures":0,"title_cover_failures":1,"title_cover_penalty":0,"native_trace_blockers":0,"native_trace_hits_total":74,"native_trace_unique_breakpoints":11,"false_positives":0,"runtime_timeout_failures":0,"runtime_title_visual_suppressed_builds":0,"runtime_custom_cover_builds":0,"runtime_simulated_button_presses_total":0},"status":"crash","description":"runtime map sampler found AV at Scaleform objectInterface AddRef","timestamp":1782431160898,"segment":0,"confidence":null,"asi":{"hypothesis":"Extending the host-process sampler with executable maps and running a crash probe would allow the pre-BeginTitle process_exited_before_ready crash to be attributed to a concrete module/fault site.","rollback_reason":"run_experiment failed before METRIC lines with primary metric 0. Product proof still failed before BeginTitle/title-owner allocation, but crash evidence improved.","next_action_hint":"Add native crash logging for the faulting-context registers/stack around AVs, or statically trace the producer feeding the invalid ScaleformValue objectInterface into the 0x14074bbe0 copy helper. Avoid broad hooks on 0x14074bbe0.","artifact":"/home/banon/projects/er-effects-rs/target/runtime-probe/product-continue-direct-20260625-164342","finding_key":"autoload-pre-begintitle-av-title-scaleform-copy-74bbfd-2026-06-25","validation":"`bash -n .auto/runtime_probe.sh` and `shellcheck .auto/runtime_probe.sh` passed after adding executable-map capture; smoke invocation wrote host-process-lifetime.jsonl. Runtime artifact produced 46 sampler samples and exact post-run process scan found no eldenring.exe/start_protected_game.exe.","evidence":"Crash log: `access-violation rva=0x74bbfd addr=0x14074bbfd callers=[#0=0x6ffebc245129,#1=0x6ffebc245cc7,#2=0x6ffebff798ae,#3=0x6ffebff40b2a,#4=0x74bbfd,#5=0x10dbb24]`, followed by `NtTerminateProcess code=0xc0000005`. Disasm at 0x14074bbfd is `mov (%rcx),%rax`, where rcx is objectInterface loaded from stack+0x48 before vtable+0x8 AddRef."}}
{"run":222,"commit":"2100051","metric":0,"metrics":{"readiness_gate_failures":0,"target_constants_remaining":0,"helpers_missing":0,"fixed_wait_predicates":0,"autoload_static_failures":0,"asset_chain_failures":0,"dll_patch_failures":0,"native_continue_failures":0,"field58_gate_failures":0,"direct_shortcut_failures":0,"input_path_failures":0,"runtime_proof_failures":1,"runtime_mode_failures":0,"eula_popup_failures":0,"save_data_popup_failures":0,"messagebox_dialog_failures":0,"server_status_failures":0,"title_cover_failures":1,"title_cover_penalty":0,"native_trace_blockers":0,"native_trace_hits_total":74,"native_trace_unique_breakpoints":11,"false_positives":0,"runtime_timeout_failures":1,"runtime_title_visual_suppressed_builds":1,"runtime_custom_cover_builds":1,"runtime_simulated_button_presses_total":0},"status":"crash","description":"runtime AV context logger did not reproduce 74bbfd crash without broad hook","timestamp":1782431532725,"segment":0,"confidence":null,"asi":{"hypothesis":"Adding AV fault-context register/stack logging and running without the broad a48 hook would either capture rcx/stack for the 0x14074bbfd crash or show whether that crash was induced by the broad hook itself.","rollback_reason":"run_experiment timed out before METRIC lines, so primary metric is 0/crash. The AV did not reproduce; product proof still failed because baseline ProfileSelect title replacement reached title but timed out without native submit/load.","next_action_hint":"Do not reintroduce the broad 0x14074bbe0 a48 hook. Use non-hook sampling from the safe title-window update path or a narrower hook that runs only after BeginTitle/native title window exists.","artifact":"/home/banon/projects/er-effects-rs/target/runtime-probe/product-continue-direct-20260625-164944","finding_key":"autoload-av-74bbfd-not-baseline-repro-broad-hook-suspect-2026-06-25","validation":"`cargo xwin build --release --target x86_64-pc-windows-msvc` succeeded after adding AV context logging; exact post-run process scan found no eldenring.exe/start_protected_game.exe.","evidence":"Artifact timed out at +35.1s with ProfileSelect title cover: title_cover builds=1, title_native_ready_hits=1826, game_task_ticks=667, product_core_ready_blocker=title_dialog, native_submit=0, continue_phase=0. Crash log had no access-violation/process-exit entry, unlike the broad-hook run where AV rva=0x74bbfd occurred at +11.3s."}}
{"run":223,"commit":"2100051","metric":0,"metrics":{"readiness_gate_failures":0,"target_constants_remaining":0,"helpers_missing":0,"fixed_wait_predicates":0,"autoload_static_failures":0,"asset_chain_failures":0,"dll_patch_failures":0,"native_continue_failures":0,"field58_gate_failures":0,"direct_shortcut_failures":0,"input_path_failures":0,"runtime_proof_failures":1,"runtime_mode_failures":0,"eula_popup_failures":0,"save_data_popup_failures":0,"messagebox_dialog_failures":0,"server_status_failures":0,"title_cover_failures":1,"title_cover_penalty":0,"native_trace_blockers":0,"native_trace_hits_total":74,"native_trace_unique_breakpoints":11,"false_positives":0,"runtime_timeout_failures":1,"runtime_title_visual_suppressed_builds":1,"runtime_custom_cover_builds":0,"runtime_simulated_button_presses_total":0},"status":"crash","description":"runtime sampled title a48 source from safe window update path","timestamp":1782431908248,"segment":0,"confidence":null,"asi":{"hypothesis":"Sampling title a48+0x28 source fields from the safe native title-window update hook would reveal whether the upstream ScaleformValue source is empty/non-object without reintroducing the broad 0x14074bbe0 hook that induced/correlated with an AV.","rollback_reason":"run_experiment timed out before METRIC lines, so primary metric is 0/crash. The diagnostic improved evidence but product proof still failed: native submit/load never fired and runtime_proof_failures remains 1.","next_action_hint":"Do not resample a48 source again; it is stable/object-like. Next sample the native-ready predicate getter's returned state object fields more deeply, or statically trace the objectInterface+0xd0 extraction result without broad hooking.","artifact":"/home/banon/projects/er-effects-rs/target/runtime-probe/product-continue-direct-20260625-165550","finding_key":"autoload-title-a48-source-object-valid-ready-still-false-2026-06-25","validation":"`cargo xwin build --release --target x86_64-pc-windows-msvc` succeeded; exact post-run process scan found no eldenring.exe/start_protected_game.exe; runtime had zero input and zero MessageBox.","evidence":"Debug lines: BeginTitle at +15425ms, title-window-source-sample hit=0 at +15498ms with a48_vt=0x142a94a70, src_type=0xa, src_raw=0x4a, src_iface=0x7ffe9690e2d0, src_value=0x7ffe969aa350; same values stable through hit=256. Telemetry: game_task_ticks=681, product_core_ready_blocker=ready, title_native_ready_hits=1861, native_submit=0, continue_phase=0."}}
{"run":224,"commit":"2100051","metric":0,"metrics":{"readiness_gate_failures":0,"target_constants_remaining":0,"helpers_missing":0,"fixed_wait_predicates":0,"autoload_static_failures":0,"asset_chain_failures":0,"dll_patch_failures":0,"native_continue_failures":0,"field58_gate_failures":0,"direct_shortcut_failures":0,"input_path_failures":0,"runtime_proof_failures":1,"runtime_mode_failures":0,"eula_popup_failures":0,"save_data_popup_failures":0,"messagebox_dialog_failures":0,"server_status_failures":0,"title_cover_failures":1,"title_cover_penalty":0,"native_trace_blockers":0,"native_trace_hits_total":74,"native_trace_unique_breakpoints":11,"false_positives":0,"runtime_timeout_failures":1,"runtime_title_visual_suppressed_builds":1,"runtime_custom_cover_builds":1,"runtime_simulated_button_presses_total":0},"status":"crash","description":"runtime deep-sampled native-ready predicate state objects","timestamp":1782432166807,"segment":0,"confidence":null,"asi":{"hypothesis":"Deepening the existing native-ready predicate hook to log returned state qwords would distinguish a globally dead predicate from a specific empty SceneObjProxy state object.","rollback_reason":"run_experiment timed out before METRIC lines, so primary metric is 0/crash. The diagnostic improved evidence but product proof still failed: native submit/load never fired and runtime_proof_failures remains 1.","next_action_hint":"Identify the owner/field for the persistent empty object checked at caller 0x140745bf9, or statically map caller 0x140745b30 argument `param_1+0x6a` to the exact row/proxy field. Do not keep resampling generic predicate hits.","artifact":"/home/banon/projects/er-effects-rs/target/runtime-probe/product-continue-direct-20260625-170011","finding_key":"autoload-native-ready-specific-empty-proxy-2026-06-25","validation":"`cargo xwin build --release --target x86_64-pc-windows-msvc` succeeded; exact post-run process scan found no eldenring.exe/start_protected_game.exe; runtime had zero input and zero MessageBox.","evidence":"Debug: valid predicate samples exist (`flags=0x4a`, `masked=0xa`, ret=1) at hits 0/2/512. Persistent empty object `this=0x7ffe94cd60b0`, state=0x7ffe94cd60d8, caller_rva=0x745bf9 had state_qwords `[0x142a94a58,-1,-1,0,0,0,0,0]` and ret=0 across hits 5/6/7/64/256/1024. Telemetry: title_native_ready_hits present, native_submit=0, continue_phase=0."}}
{"run":225,"commit":"2100051","metric":1520,"metrics":{"readiness_gate_failures":0,"target_constants_remaining":0,"helpers_missing":0,"fixed_wait_predicates":0,"autoload_static_failures":0,"asset_chain_failures":0,"dll_patch_failures":0,"native_continue_failures":0,"field58_gate_failures":0,"direct_shortcut_failures":0,"input_path_failures":0,"runtime_proof_failures":1,"runtime_mode_failures":0,"eula_popup_failures":0,"save_data_popup_failures":0,"messagebox_dialog_failures":0,"server_status_failures":0,"title_cover_failures":0,"title_cover_penalty":0,"native_trace_blockers":0,"native_trace_hits_total":74,"native_trace_unique_breakpoints":11,"false_positives":0,"runtime_timeout_failures":0,"runtime_title_visual_suppressed_builds":0,"runtime_custom_cover_builds":0,"runtime_simulated_button_presses_total":0},"status":"discard","description":"statically mapped empty native-ready proxy to owner+0x350 gate","timestamp":1782432371612,"segment":0,"confidence":null,"asi":{"hypothesis":"Static mapping of caller 0x140745bf9 / FUN_140745cd0 would identify the owner/field for the persistent empty SceneObjProxy state object checked by native-ready predicate.","rollback_reason":"Primary metric remained 1520, equal to the persisted best, and runtime_proof_failures remains 1. This iteration produced static RE mapping only; no product proof improvement was added.","next_action_hint":"Identify the concrete runtime owner/vtable at owner base `empty_proxy_this - 0x350` and find the constructor/populator for that owner+0x350 SceneObjProxy field. Do not treat 0x140733150 as globally broken.","finding_key":"autoload-empty-ready-proxy-is-owner-plus350-2026-06-25","validation":"Ghidra/deobf grounding: live 0x140745bf9 -> dump 0x140745cf9 content-unique; live disasm shows `add rcx,0x350` then call 0x140733150. .auto/measure.sh passed with autoload_re_score=1520 and false_positives=0.","evidence":"Ghidra FUN_140745cd0 decompile: `bVar2 = FUN_140733250((SceneObjProxy *)(param_1 + 0x6a)); if (bVar2) { FUN_1407519e0(...); lVar1=*param_1; call vfunc+0x20; call vfunc+0x48; }`. Runtime empty proxy this=0x7ffe94cd60b0 implies owner base 0x7ffe94cd5d60."}}
{"run":226,"commit":"2100051","metric":0,"metrics":{"readiness_gate_failures":0,"target_constants_remaining":0,"helpers_missing":0,"fixed_wait_predicates":0,"autoload_static_failures":0,"asset_chain_failures":0,"dll_patch_failures":0,"native_continue_failures":0,"field58_gate_failures":0,"direct_shortcut_failures":0,"input_path_failures":0,"runtime_proof_failures":1,"runtime_mode_failures":0,"eula_popup_failures":0,"save_data_popup_failures":0,"messagebox_dialog_failures":0,"server_status_failures":0,"title_cover_failures":1,"title_cover_penalty":0,"native_trace_blockers":0,"native_trace_hits_total":74,"native_trace_unique_breakpoints":11,"false_positives":0,"runtime_timeout_failures":1,"runtime_title_visual_suppressed_builds":1,"runtime_custom_cover_builds":1,"runtime_simulated_button_presses_total":0},"status":"crash","description":"runtime identified empty native-ready proxy owner vtable","timestamp":1782432666815,"segment":0,"confidence":null,"asi":{"hypothesis":"Logging owner base/vtable for the persistent owner+0x350 native-ready proxy would identify the concrete class/owner whose SceneObjProxy stays empty, enabling a targeted static constructor/populator search.","rollback_reason":"run_experiment timed out before METRIC lines, so primary metric is 0/crash. The diagnostic improved evidence but product proof still failed: native submit/load never fired and runtime_proof_failures remains 1.","next_action_hint":"Identify/classify vtable 0x142aa0080 and contrast it with good owner_vt 0x142b229f8, then find constructor/populator/writer for +0x350 on the 0x142aa0080 owner class. Do not resample generic native-ready hits again.","artifact":"/home/banon/projects/er-effects-rs/target/runtime-probe/product-continue-direct-20260625-170833","finding_key":"autoload-empty-ready-owner-vtable-142aa0080-2026-06-25","validation":"`cargo xwin build --release --target x86_64-pc-windows-msvc` succeeded; exact post-run process scan found no eldenring.exe/start_protected_game.exe; runtime had zero input and zero MessageBox.","evidence":"Persistent failing samples: owner=0x7ffe94cd5d60 owner_vt=0x142aa0080 owner20=0x7ffe9e5e0150 owner48=0 owner130=0x7ffe94cd5e80 proxy_this=0x7ffe94cd60b0 state=0x7ffe94cd60d8 flags=0 masked=0 ret=0. Good contrast sample at same caller_rva=0x745bf9: owner_vt=0x142b229f8, flags=0x4a masked=0xa ret=1. Telemetry: native_submit=0, continue_phase=0."}}
{"run":227,"commit":"2100051","metric":1520,"metrics":{"readiness_gate_failures":0,"target_constants_remaining":0,"helpers_missing":0,"fixed_wait_predicates":0,"autoload_static_failures":0,"asset_chain_failures":0,"dll_patch_failures":0,"native_continue_failures":0,"field58_gate_failures":0,"direct_shortcut_failures":0,"input_path_failures":0,"runtime_proof_failures":1,"runtime_mode_failures":0,"eula_popup_failures":0,"save_data_popup_failures":0,"messagebox_dialog_failures":0,"server_status_failures":0,"title_cover_failures":0,"title_cover_penalty":0,"native_trace_blockers":0,"native_trace_hits_total":74,"native_trace_unique_breakpoints":11,"false_positives":0,"runtime_timeout_failures":0,"runtime_title_visual_suppressed_builds":0,"runtime_custom_cover_builds":0,"runtime_simulated_button_presses_total":0},"status":"discard","description":"statically classified empty native-ready owner as BackScreen Fade proxy","timestamp":1782432944485,"segment":0,"confidence":null,"asi":{"hypothesis":"Classifying failing owner_vt 0x142aa0080 against good owner_vt 0x142b229f8 would identify the exact native component whose +0x350 SceneObjProxy remains empty.","rollback_reason":"Primary metric remained 1520, equal to the persisted best, and runtime_proof_failures remains 1. This iteration produced static RE classification only; no product proof improvement was added.","next_action_hint":"Find why the BackScreen constructor/source SceneObjProxy passed to FUN_1407836a0 lacks/does not expose the `Fade` component under the current BeginTitle/ProfileSelect replacement path. Product-safe direction remains preserving native 05_000_Title or render-only suppression so native BackScreen/Fade source resolves.","finding_key":"autoload-empty-owner-is-backscreen-fade-proxy-2026-06-25","validation":"Ghidra VtableDump/DecompAddr: 0x142aa0080 names as CS::BackScreen::vftable; 0x142b229f8 names as CS::ProfileLoadDialog::vftable; .auto/measure.sh passed with autoload_re_score=1520 and false_positives=0.","evidence":"BackScreen ctor FUN_1407836a0 calls MenuWindow::MenuWindow, sets FullScreenMenu then BackScreen vtable, and `SceneObjProxy::assignComponentWithName(param_2, owner+0x350, \"Fade\", ...)`. Good ProfileLoadDialog path 0x1409a3ee0 assigns `ProfileList/ItemList/ItemList/ItemList`; hence good flags=0x4a samples are not the title BackScreen Fade gate."}}
{"run":228,"commit":"2100051","metric":1520,"metrics":{"readiness_gate_failures":0,"target_constants_remaining":0,"helpers_missing":0,"fixed_wait_predicates":0,"autoload_static_failures":0,"asset_chain_failures":0,"dll_patch_failures":0,"native_continue_failures":0,"field58_gate_failures":0,"direct_shortcut_failures":0,"input_path_failures":0,"runtime_proof_failures":1,"runtime_mode_failures":0,"eula_popup_failures":0,"save_data_popup_failures":0,"messagebox_dialog_failures":0,"server_status_failures":0,"title_cover_failures":0,"title_cover_penalty":0,"native_trace_blockers":0,"native_trace_hits_total":74,"native_trace_unique_breakpoints":11,"false_positives":0,"runtime_timeout_failures":0,"runtime_title_visual_suppressed_builds":0,"runtime_custom_cover_builds":0,"runtime_simulated_button_presses_total":0},"status":"discard","description":"statically reclassified BackScreen Fade as idle branch, not Continue row","timestamp":1782433298018,"segment":0,"confidence":null,"asi":{"hypothesis":"Tracing BackScreen/Fade source through FUN_140764380 and CSMenuMan backScreenData would determine whether the empty Fade proxy is the real title Continue blocker or only an idle/back-screen branch artifact.","rollback_reason":"Primary metric remained 1520, equal to the persisted best, and runtime_proof_failures remains 1. This iteration produced static RE classification only; no product proof improvement was added.","next_action_hint":"Do not patch/satisfy BackScreen Fade or CSMenuMan request flags. Return to the product-safe path: preserve native 05_000_Title and suppress render only, then instrument preserved-native sequence/row execution rather than CSMenuMan backScreenData/ProfileSelect replacement.","finding_key":"autoload-backscreen-fade-is-idle-branch-not-continue-2026-06-25","validation":"Ghidra decompile of FUN_140764380/FUN_1407ad070/FUN_140767270 plus .auto/measure.sh passed with autoload_re_score=1520 and false_positives=0.","evidence":"FUN_140764380 constructs `_Func_impl<lambda_606..., CS::MenuWindow*(CS::SceneProxy&)>` and passes it to FUN_1407ad070 MenuWindowJob builder. CSMenuManImp::Update/FUN_140767270 builds/ticks backScreenData field_0x708 from request flags 0x6b0/0x6b1. Prior BackScreen ctor evidence shows owner+0x350 is `assignComponentWithName(source, \"Fade\")`; therefore the stuck BackScreen/Fade object is the idle/back-screen gate, not selected Continue semantics."}}
{"run":229,"commit":"2100051","metric":0,"metrics":{"readiness_gate_failures":0,"target_constants_remaining":0,"helpers_missing":0,"fixed_wait_predicates":0,"autoload_static_failures":0,"asset_chain_failures":0,"dll_patch_failures":0,"native_continue_failures":0,"field58_gate_failures":0,"direct_shortcut_failures":0,"input_path_failures":0,"runtime_proof_failures":1,"runtime_mode_failures":0,"eula_popup_failures":0,"save_data_popup_failures":0,"messagebox_dialog_failures":0,"server_status_failures":0,"title_cover_failures":1,"title_cover_penalty":0,"native_trace_blockers":0,"native_trace_hits_total":74,"native_trace_unique_breakpoints":11,"false_positives":0,"runtime_timeout_failures":1,"runtime_title_visual_suppressed_builds":1,"runtime_custom_cover_builds":1,"runtime_simulated_button_presses_total":0},"status":"crash","description":"visible runtime probe confirmed onscreen mode with same ProfileSelect title-dialog blocker","timestamp":1782433627531,"segment":0,"confidence":null,"asi":{"hypothesis":"Adding RUNTIME_ONSCREEN=1 to .auto/measure.sh and running a bounded visible probe would honor the session-visible-run requirement while confirming whether the current product path behaves differently outside gamescope headless.","rollback_reason":"run_experiment failed before METRIC lines with timeout_seconds_budget_exhausted, so primary metric is 0/crash. The visible run changed the render surface but did not improve product proof: native submit/load never fired and runtime_proof_failures remains 1.","next_action_hint":"Keep RUNTIME_ONSCREEN=1 in .auto/measure.sh for this session. Next optimization should change the product path away from BeginTitle ProfileSelect replacement and toward preserving native 05_000_Title with render-only suppression; visible mode itself is not the fix.","artifact":"/home/banon/projects/er-effects-rs/target/runtime-probe/product-continue-direct-20260625-172529","validation":"run output explicitly reported `render: ON-SCREEN direct Proton window (RUNTIME_ONSCREEN=1) -- watch + test`; exact post-run process scan found no eldenring.exe/start_protected_game.exe; zero input and zero MessageBox.","evidence":"Telemetry: game_task_ticks=1356, product_core_ready_blocker=title_dialog, native_submit=0, continue_phase=0, title_native_ready_hits=3858, title_native_visual_suppressed_builds=1, custom_cover_profile_select_builds=1, simulated_button_presses_total=0, oracle_msgbox_total_builds=0. Runtime err timing: launch->title=1.9s, reason=timeout_seconds_budget_exhausted."}}
