{"run":462,"commit":"92c1be0","metric":1600,"metrics":{"readiness_gate_failures":0,"target_constants_remaining":0,"helpers_missing":0,"fixed_wait_predicates":0,"autoload_static_failures":0,"asset_chain_failures":0,"dll_patch_failures":0,"native_continue_failures":0,"field58_gate_failures":0,"direct_shortcut_failures":0,"input_path_failures":0,"runtime_proof_failures":0,"runtime_mode_failures":0,"eula_popup_failures":0,"save_data_popup_failures":0,"messagebox_dialog_failures":0,"server_status_failures":0,"title_cover_failures":0,"title_cover_penalty":0,"native_trace_blockers":0,"native_trace_hits_total":74,"native_trace_unique_breakpoints":11,"false_positives":0},"status":"keep","description":"Fresh runtime rerun confirms visible-surface portrait oracle remains max-score","timestamp":1782528990581,"segment":2,"confidence":null,"asi":{"hypothesis":"Run a fresh runtime probe of the kept visible-surface ProfileSelect portrait path to check stability and avoid overfitting to stale artifacts or the prior single run.","artifact":"/home/banon/projects/er-effects-rs/target/runtime-probe/product-continue-direct-20260626-195449","evidence":"Fresh runtime rerun scored autoload_re_score=1600 with false_positives=0. RAM telemetry confirms oracle_title_portrait_visible_surface_bound=true, bind_rewrites=1, loaded_character_portrait_rendered=true, visible_during_boot=true, held_until_loading_takeover=true, custom_cover_run_calls=1, scaleform_bind_observer_systex_hits=10, overlay_cover_render_calls=0, simulated_button_presses_total=0, oracle_player_present=true, oracle_char_name=Banon. Mandatory teardown screenshot was produced at target/runtime-probe/product-continue-direct-20260626-195449/teardown-screenshot.jpg but product proof remains RAM telemetry.","validation":"Supported trigger .auto/run_runtime_probe_once; run_experiment command ./.auto/measure.sh; runtime cap <=45s; mandatory teardown screenshot observed; no benchmark cheating or stale artifact reuse."}}
{"run":463,"commit":"92c1be0","metric":1600,"metrics":{"readiness_gate_failures":0,"target_constants_remaining":0,"helpers_missing":0,"fixed_wait_predicates":0,"autoload_static_failures":0,"asset_chain_failures":0,"dll_patch_failures":0,"native_continue_failures":0,"field58_gate_failures":0,"direct_shortcut_failures":0,"input_path_failures":0,"runtime_proof_failures":0,"runtime_mode_failures":0,"eula_popup_failures":0,"save_data_popup_failures":0,"messagebox_dialog_failures":0,"server_status_failures":0,"title_cover_failures":0,"title_cover_penalty":0,"native_trace_blockers":0,"native_trace_hits_total":74,"native_trace_unique_breakpoints":11,"false_positives":0},"status":"discard","description":"Fresh stability rerun of visible-surface portrait oracle remains max-score","timestamp":1782529136204,"segment":2,"confidence":null,"asi":{"hypothesis":"Run another fresh runtime probe of the kept visible-surface ProfileSelect portrait path to check stability without editing product code or benchmark logic.","artifact":"/home/banon/projects/er-effects-rs/target/runtime-probe/product-continue-direct-20260626-195742","evidence":"Fresh runtime rerun scored autoload_re_score=1600 with false_positives=0. RAM telemetry confirms oracle_title_portrait_visible_surface_bound=true, bind_rewrites=1, loaded_character_portrait_rendered=true, visible_during_boot=true, held_until_loading_takeover=true, custom_cover_run_calls=1, scaleform_bind_observer_systex_hits=10, overlay_cover_render_calls=0, simulated_button_presses_total=0, oracle_player_present=true, oracle_char_name=Banon. Mandatory teardown screenshot was produced at target/runtime-probe/product-continue-direct-20260626-195742/teardown-screenshot.jpg but product proof remains RAM telemetry.","validation":"Read .auto/prompt.md and Beads memories first; used supported trigger .auto/run_runtime_probe_once; run_experiment command ./.auto/measure.sh; runtime cap <=45s; no benchmark changes or stale artifact reuse.","rollback_reason":"Primary metric was unchanged at the current 1600-point ceiling, so the stability rerun is not a keepable improvement.","next_action_hint":"Do not chase score above 1600 under this metric. Next useful non-cheating work is either finalization/quality gates or a new explicitly stronger objective such as visible-pixel/native-surface proof beyond the current RAM-visible-surface oracle."}}
{"run":464,"commit":"92c1be0","metric":1600,"metrics":{"readiness_gate_failures":0,"target_constants_remaining":0,"helpers_missing":0,"fixed_wait_predicates":0,"autoload_static_failures":0,"asset_chain_failures":0,"dll_patch_failures":0,"native_continue_failures":0,"field58_gate_failures":0,"direct_shortcut_failures":0,"input_path_failures":0,"runtime_proof_failures":0,"runtime_mode_failures":0,"eula_popup_failures":0,"save_data_popup_failures":0,"messagebox_dialog_failures":0,"server_status_failures":0,"title_cover_failures":0,"title_cover_penalty":0,"native_trace_blockers":0,"native_trace_hits_total":74,"native_trace_unique_breakpoints":11,"false_positives":0},"status":"discard","description":"Fresh stability rerun of visible-surface portrait oracle remains max-score","timestamp":1782529272847,"segment":2,"confidence":null,"asi":{"hypothesis":"Run a fresh runtime stability probe of the kept visible-surface ProfileSelect portrait path without editing product code or benchmark logic, to verify the max-score result is stable and not stale-artifact reuse.","artifact":"/home/banon/projects/er-effects-rs/target/runtime-probe/product-continue-direct-20260626-200008","evidence":"Fresh runtime rerun scored autoload_re_score=1600 with false_positives=0. RAM telemetry confirms oracle_title_portrait_visible_surface_bound=true, bind_rewrites=1, loaded_character_portrait_rendered=true, visible_during_boot=true, held_until_loading_takeover=true, custom_cover_run_calls=1, scaleform_bind_observer_systex_hits=10, overlay_cover_render_calls=0, simulated_button_presses_total=0, oracle_player_present=true, oracle_char_name=Banon. Mandatory teardown screenshot was produced at target/runtime-probe/product-continue-direct-20260626-200008/teardown-screenshot.jpg but product proof remains RAM telemetry.","validation":"Read .auto/prompt.md and Beads memories first; used supported trigger .auto/run_runtime_probe_once; run_experiment command ./.auto/measure.sh; runtime cap <=45s; no source/scoring changes or stale artifact reuse.","rollback_reason":"Primary metric was unchanged at the current 1600-point ceiling, so this stability run is not a keepable improvement.","next_action_hint":"Under this metric, do not chase score above 1600. Next useful non-cheating work is finalization/quality gates or an explicitly stronger objective such as visible-pixel/native-surface proof beyond the current RAM-visible-surface oracle."}}
{"run":465,"commit":"92c1be0","metric":1600,"metrics":{"readiness_gate_failures":0,"target_constants_remaining":0,"helpers_missing":0,"fixed_wait_predicates":0,"autoload_static_failures":0,"asset_chain_failures":0,"dll_patch_failures":0,"native_continue_failures":0,"field58_gate_failures":0,"direct_shortcut_failures":0,"input_path_failures":0,"runtime_proof_failures":0,"runtime_mode_failures":0,"eula_popup_failures":0,"save_data_popup_failures":0,"messagebox_dialog_failures":0,"server_status_failures":0,"title_cover_failures":0,"title_cover_penalty":0,"native_trace_blockers":0,"native_trace_hits_total":74,"native_trace_unique_breakpoints":11,"false_positives":0},"status":"discard","description":"Fresh stability rerun of visible-surface portrait oracle remains max-score","timestamp":1782529415208,"segment":2,"confidence":null,"asi":{"hypothesis":"Run another fresh runtime stability probe of the kept visible-surface ProfileSelect portrait path without changing product code or the scoring contract, to verify stability and avoid stale-artifact overfitting.","artifact":"/home/banon/projects/er-effects-rs/target/runtime-probe/product-continue-direct-20260626-200223","evidence":"Fresh runtime rerun scored autoload_re_score=1600 with false_positives=0. RAM telemetry confirms oracle_title_portrait_visible_surface_bound=true, bind_rewrites=1, loaded_character_portrait_rendered=true, visible_during_boot=true, held_until_loading_takeover=true, custom_cover_run_calls=1, scaleform_bind_observer_systex_hits=10, overlay_cover_render_calls=0, simulated_button_presses_total=0, oracle_player_present=true, oracle_char_name=Banon. Mandatory teardown screenshot was produced at target/runtime-probe/product-continue-direct-20260626-200223/teardown-screenshot.jpg but product proof remains RAM telemetry.","validation":"Read .auto/prompt.md and Beads memories first; used supported trigger .auto/run_runtime_probe_once; run_experiment command ./.auto/measure.sh; runtime cap <=45s; no source/scoring changes or stale artifact reuse.","rollback_reason":"Primary metric was unchanged at the current 1600-point ceiling, so this stability run is not a keepable improvement.","next_action_hint":"Under the current metric, do not chase scores above 1600. Useful non-cheating next work is finalization/quality gates or an explicitly stronger objective such as visible-pixel/native-surface proof beyond the current RAM-visible-surface oracle."}}
{"run":466,"commit":"92c1be0","metric":1600,"metrics":{"readiness_gate_failures":0,"target_constants_remaining":0,"helpers_missing":0,"fixed_wait_predicates":0,"autoload_static_failures":0,"asset_chain_failures":0,"dll_patch_failures":0,"native_continue_failures":0,"field58_gate_failures":0,"direct_shortcut_failures":0,"input_path_failures":0,"runtime_proof_failures":0,"runtime_mode_failures":0,"eula_popup_failures":0,"save_data_popup_failures":0,"messagebox_dialog_failures":0,"server_status_failures":0,"title_cover_failures":0,"title_cover_penalty":0,"native_trace_blockers":0,"native_trace_hits_total":74,"native_trace_unique_breakpoints":11,"false_positives":0},"status":"discard","description":"Fresh stability rerun of visible-surface portrait oracle remains max-score","timestamp":1782529562513,"segment":2,"confidence":null,"asi":{"hypothesis":"Run another fresh runtime stability probe of the kept visible-surface ProfileSelect portrait path without changing product code or the scoring contract, to verify stability and avoid stale-artifact overfitting.","artifact":"/home/banon/projects/er-effects-rs/target/runtime-probe/product-continue-direct-20260626-200438","evidence":"Fresh runtime rerun scored autoload_re_score=1600 with false_positives=0. RAM telemetry confirms oracle_title_portrait_visible_surface_bound=true, bind_rewrites=1, loaded_character_portrait_rendered=true, visible_during_boot=true, held_until_loading_takeover=true, custom_cover_run_calls=1, scaleform_bind_observer_systex_hits=10, overlay_cover_render_calls=0, simulated_button_presses_total=0, oracle_player_present=true, oracle_char_name=Banon. Mandatory teardown screenshot was produced at target/runtime-probe/product-continue-direct-20260626-200438/teardown-screenshot.jpg but product proof remains RAM telemetry.","validation":"Read .auto/prompt.md and Beads memories first; used supported trigger .auto/run_runtime_probe_once; run_experiment command ./.auto/measure.sh; runtime cap <=45s; no source/scoring changes or stale artifact reuse.","blocker_note":"Valid context-mode guard blocked ctx_execute_file on /tmp/pi-experiment-667f1b6f55a2a5ff.log because it is outside the project root; pivoted to the normal read tool for the external experiment log. Future iterations should use read for /tmp run_experiment logs or process only project-local artifacts with ctx_execute_file.","rollback_reason":"Primary metric was unchanged at the current 1600-point ceiling, so this stability run is not a keepable improvement.","next_action_hint":"Under the current metric, do not chase scores above 1600. Useful non-cheating next work is finalization/quality gates or an explicitly stronger objective such as visible-pixel/native-surface proof beyond the current RAM-visible-surface oracle."}}
{"run":467,"commit":"92c1be0","metric":1600,"metrics":{"readiness_gate_failures":0,"target_constants_remaining":0,"helpers_missing":0,"fixed_wait_predicates":0,"autoload_static_failures":0,"asset_chain_failures":0,"dll_patch_failures":0,"native_continue_failures":0,"field58_gate_failures":0,"direct_shortcut_failures":0,"input_path_failures":0,"runtime_proof_failures":0,"runtime_mode_failures":0,"eula_popup_failures":0,"save_data_popup_failures":0,"messagebox_dialog_failures":0,"server_status_failures":0,"title_cover_failures":0,"title_cover_penalty":0,"native_trace_blockers":0,"native_trace_hits_total":74,"native_trace_unique_breakpoints":11,"false_positives":0},"status":"discard","description":"Fresh stability rerun of visible-surface portrait oracle remains max-score","timestamp":1782529699314,"segment":2,"confidence":null,"asi":{"hypothesis":"Run another fresh runtime stability probe of the kept visible-surface ProfileSelect portrait path without changing product code or the scoring contract, to verify stability and avoid stale-artifact overfitting.","artifact":"/home/banon/projects/er-effects-rs/target/runtime-probe/product-continue-direct-20260626-200709","evidence":"Fresh runtime rerun scored autoload_re_score=1600 with false_positives=0. RAM telemetry confirms oracle_title_portrait_visible_surface_bound=true, bind_rewrites=1, loaded_character_portrait_rendered=true, visible_during_boot=true, held_until_loading_takeover=true, custom_cover_run_calls=1, scaleform_bind_observer_systex_hits=10, overlay_cover_render_calls=0, simulated_button_presses_total=0, oracle_player_present=true, oracle_char_name=Banon. Mandatory teardown screenshot was produced at target/runtime-probe/product-continue-direct-20260626-200709/teardown-screenshot.jpg but product proof remains RAM telemetry.","validation":"Read .auto/prompt.md and Beads memories first; used supported trigger .auto/run_runtime_probe_once; run_experiment command ./.auto/measure.sh; runtime cap <=45s; no source/scoring changes or stale artifact reuse.","rollback_reason":"Primary metric was unchanged at the current 1600-point ceiling, so this stability run is not a keepable improvement.","next_action_hint":"Under the current metric, do not chase scores above 1600. Useful non-cheating next work is finalization/quality gates or an explicitly stronger objective such as visible-pixel/native-surface proof beyond the current RAM-visible-surface oracle."}}
{"run":468,"commit":"62773ec","metric":0,"metrics":{"readiness_gate_failures":0,"target_constants_remaining":0,"helpers_missing":0,"fixed_wait_predicates":0,"autoload_static_failures":0,"asset_chain_failures":0,"dll_patch_failures":0,"native_continue_failures":0,"field58_gate_failures":0,"direct_shortcut_failures":0,"input_path_failures":0,"runtime_proof_failures":0,"runtime_mode_failures":0,"eula_popup_failures":0,"save_data_popup_failures":0,"messagebox_dialog_failures":0,"server_status_failures":0,"title_cover_failures":1,"title_cover_penalty":1600,"native_trace_blockers":0,"native_trace_hits_total":74,"native_trace_unique_breakpoints":11,"false_positives":1},"status":"keep","description":"Fail closed on visual-falsified visible-surface oracle and capture logo-replacement proof moment","timestamp":1782530689827,"segment":2,"confidence":null,"asi":{"hypothesis":"Replace useless teardown screenshots with a logo-replacement/portrait-cover event capture, inspect that image directly, and fail closed because the current RAM visible-surface semaphore is visually falsified until a correct pixel/native memory semaphore exists.","artifact":"/home/banon/projects/er-effects-rs/target/runtime-probe/product-continue-direct-20260626-202128","visual_evidence":"I read /home/banon/projects/er-effects-rs/target/runtime-probe/product-continue-direct-20260626-202128/logo-replacement-screenshot.jpg. It shows a dark LOAD GAME/ProfileSelect-style panel with no visible loaded-character portrait, so the feature is not visually working even though RAM telemetry asserted visible_surface_bound/loaded_character_portrait_* booleans.","runtime_evidence":"Runtime still reached autoload_re_score=1600 under the old contract with false_positives=0 before tightening; RAM telemetry had oracle_title_portrait_visible_surface_bound=true, bind_rewrites=1, loaded_character_portrait_rendered=true, visible_during_boot=true, held_until_loading_takeover=true, custom_cover_run_calls=1, scaleform_bind_observer_systex_hits=10, overlay_cover_render_calls=0, simulated_button_presses_total=0, oracle_player_present=true, oracle_char_name=Banon.","validation":"py_compile scripts/er-readiness-watch.py scripts/check-runtime-probe-contract.py scripts/test-runtime-probe-contract.py scripts/capture-er-window.py; bash -n .auto/measure.sh; bash -n scripts/run-product-continue-direct-probe.sh; python3 scripts/test-runtime-probe-contract.py; python3 scripts/check-runtime-probe-contract.py; shellcheck scripts/run-product-continue-direct-probe.sh; run_experiment ./.auto/measure.sh under tightened contract => autoload_re_score=0, title_cover_failures=1, title_cover_penalty=1600, false_positives=1.","next_action_hint":"Find a real visible portrait path/semaphore. Current visible-surface/ProfileSelect bind telemetry is insufficient; future success requires oracle_title_portrait_pixels_visible or equivalent native/pixel evidence tied to an event screenshot that actually shows the loaded-character portrait."}}
{"run":469,"commit":"62773ec","metric":0,"metrics":{"readiness_gate_failures":0,"target_constants_remaining":0,"helpers_missing":0,"fixed_wait_predicates":0,"autoload_static_failures":0,"asset_chain_failures":0,"dll_patch_failures":0,"native_continue_failures":0,"field58_gate_failures":0,"direct_shortcut_failures":0,"input_path_failures":0,"runtime_proof_failures":0,"runtime_mode_failures":0,"eula_popup_failures":0,"save_data_popup_failures":0,"messagebox_dialog_failures":0,"server_status_failures":0,"title_cover_failures":1,"title_cover_penalty":1600,"native_trace_blockers":0,"native_trace_hits_total":74,"native_trace_unique_breakpoints":11,"false_positives":1},"status":"discard","description":"Fresh logo-replacement screenshot confirms visible-surface path is still visually false-positive","timestamp":1782530854759,"segment":2,"confidence":null,"asi":{"hypothesis":"Run a fresh runtime probe under the tightened fail-closed contract and inspect the logo-replacement event screenshot. If the visual failure repeats, the next path must move away from ProfileSelect visible-surface bind telemetry toward a real pixel/native portrait semaphore.","artifact":"/home/banon/projects/er-effects-rs/target/runtime-probe/product-continue-direct-20260626-202629","visual_evidence":"I read /home/banon/projects/er-effects-rs/target/runtime-probe/product-continue-direct-20260626-202629/logo-replacement-screenshot.jpg. It again shows a dark LOAD GAME/ProfileSelect-style panel with no visible loaded-character portrait. This confirms the current visible-surface/ProfileSelect bind path is still visually false-positive.","validation":"run_experiment command ./.auto/measure.sh with .auto/run_runtime_probe_once trigger; metric autoload_re_score=0, title_cover_failures=1, title_cover_penalty=1600, false_positives=1; runtime proof otherwise clean with zero popup/input regressions.","rollback_reason":"Primary metric was unchanged at the current fail-closed baseline of 0, so this confirmation run is not a keepable improvement.","next_action_hint":"Stop rerunning the same visible-surface/ProfileSelect bind path for score. Next implement or statically identify a real portrait pixel/native surface path; success must produce a logo-replacement screenshot with a visible character portrait and expose oracle_title_portrait_pixels_visible or an equivalent native/pixel semaphore."}}
