{"run":340,"commit":"06ce0ca","metric":800,"metrics":{"readiness_gate_failures":0,"target_constants_remaining":0,"helpers_missing":0,"fixed_wait_predicates":0,"autoload_static_failures":0,"asset_chain_failures":0,"dll_patch_failures":0,"native_continue_failures":0,"field58_gate_failures":0,"direct_shortcut_failures":0,"input_path_failures":0,"runtime_proof_failures":1,"runtime_mode_failures":0,"eula_popup_failures":0,"save_data_popup_failures":2,"messagebox_dialog_failures":0,"server_status_failures":0,"title_cover_failures":2,"title_cover_penalty":400,"native_trace_blockers":0,"native_trace_hits_total":74,"native_trace_unique_breakpoints":11,"false_positives":0,"runtime_timeout_failures":0,"runtime_title_visual_suppressed_builds":0,"runtime_custom_cover_builds":0,"runtime_simulated_button_presses_total":0},"status":"discard","description":"Validate save_requested probe after profile-refresh fail-fast guard; still fails native title visual","timestamp":1782487607759,"segment":0,"confidence":null,"asi":{"hypothesis":"After gating the profile-render fail-fast away from normal save_requested direct probes, a bounded save_requested runtime should no longer stop with title_profile_render_refresh_missing; this validates the wrong-method fail-fast is no longer contaminating normal probes.","runtime_artifact":"/home/banon/projects/er-effects-rs/target/runtime-probe/product-continue-direct-20260626-082540","observed_readiness_reason":"native_title_visual_render_unsuppressed","observed_title_profile_render_refresh_missing":false,"observed_product_autoload_armed":false,"observed_product_core_callsite_ticks":0,"observed_profile_render_refresh_gate_ready":false,"observed_profile_render_refresh_calls":0,"rollback_reason":"Diagnostic runtime artifact lowered score to 800 by adding latest-runtime title-cover/save-data failures; it is not product improvement evidence.","next_action_hint":"Clean this diagnostic artifact. Also fix the bad default design: now that the profile-refresh gate is narrowed to the exact product gate, the fail-fast can be a real default instead of only appearing under a non-default env flag."}}
{"run":341,"commit":"1b3e833","metric":1160,"metrics":{"readiness_gate_failures":0,"target_constants_remaining":0,"helpers_missing":0,"fixed_wait_predicates":0,"autoload_static_failures":0,"asset_chain_failures":0,"dll_patch_failures":0,"native_continue_failures":0,"field58_gate_failures":0,"direct_shortcut_failures":0,"input_path_failures":0,"runtime_proof_failures":1,"runtime_mode_failures":0,"eula_popup_failures":0,"save_data_popup_failures":1,"messagebox_dialog_failures":0,"server_status_failures":0,"title_cover_failures":1,"title_cover_penalty":200,"native_trace_blockers":0,"native_trace_hits_total":74,"native_trace_unique_breakpoints":11,"false_positives":0,"runtime_timeout_failures":0,"runtime_title_visual_suppressed_builds":0,"runtime_custom_cover_builds":0,"runtime_simulated_button_presses_total":0},"status":"keep","description":"Remove save_requested validation artifact after preserving evidence","timestamp":1782487627988,"segment":0,"confidence":null,"asi":{"hypothesis":"After run #340 recorded the save_requested validation result, its diagnostic artifact remained latest and added extra penalties. Removing only that scratch artifact should restore stricter validated scoring while preserving evidence in #340 ASI.","removed_artifact":"/home/banon/projects/er-effects-rs/target/runtime-probe/product-continue-direct-20260626-082540","evidence_preserved_in_run":"#340 ASI records no title_profile_render_refresh_missing, readiness native_title_visual_render_unsuppressed, product_autoload_armed=false, product_core_callsite_ticks=0.","next_action_hint":"Fix the bad default design: with the narrowed exact product gate, --fail-on-missing-title-profile-render-refresh can be a real default instead of hidden behind ER_EFFECTS_EXPERIMENTAL_DIRECT_MENU_LOAD."}}
{"run":342,"commit":"444db47","metric":1160,"metrics":{"readiness_gate_failures":0,"target_constants_remaining":0,"helpers_missing":0,"fixed_wait_predicates":0,"autoload_static_failures":0,"asset_chain_failures":0,"dll_patch_failures":0,"native_continue_failures":0,"field58_gate_failures":0,"direct_shortcut_failures":0,"input_path_failures":0,"runtime_proof_failures":1,"runtime_mode_failures":0,"eula_popup_failures":0,"save_data_popup_failures":1,"messagebox_dialog_failures":0,"server_status_failures":0,"title_cover_failures":1,"title_cover_penalty":200,"native_trace_blockers":0,"native_trace_hits_total":74,"native_trace_unique_breakpoints":11,"false_positives":0,"runtime_timeout_failures":0,"runtime_title_visual_suppressed_builds":0,"runtime_custom_cover_builds":0,"runtime_simulated_button_presses_total":0},"status":"keep","description":"Make narrowed profile-render fail-fast a real direct-probe default","timestamp":1782487666009,"segment":0,"confidence":null,"asi":{"hypothesis":"The user's correction is right: a default that appears only under a non-default `ER_EFFECTS_EXPERIMENTAL_DIRECT_MENU_LOAD=1` condition is not a useful default. Now that the watcher predicate is narrowed to the exact product refresh gate and run #340 showed it does not trip save_requested incorrectly, make `--fail-on-missing-title-profile-render-refresh` part of the unconditional direct-probe default again.","validation":"bash -n scripts/run-product-continue-direct-probe.sh OK; --help OK; static check confirms unconditional default line present and conditional ER_EFFECTS_EXPERIMENTAL_DIRECT_MENU_LOAD removed; .auto/measure.sh unchanged at 1160","not_cheating_note":"This restores fail-closed default behavior without weakening any score gate or treating profile refresh as cover proof.","next_action_hint":"Next runtime should use the corrected default; if it fails native_title_visual_render_unsuppressed with profile gate false, pursue the title visual fail-fast/root cause rather than product-core gating."}}
{"run":343,"commit":"45f7874","metric":1160,"metrics":{"readiness_gate_failures":0,"target_constants_remaining":0,"helpers_missing":0,"fixed_wait_predicates":0,"autoload_static_failures":0,"asset_chain_failures":0,"dll_patch_failures":0,"native_continue_failures":0,"field58_gate_failures":0,"direct_shortcut_failures":0,"input_path_failures":0,"runtime_proof_failures":1,"runtime_mode_failures":0,"eula_popup_failures":0,"save_data_popup_failures":1,"messagebox_dialog_failures":0,"server_status_failures":0,"title_cover_failures":1,"title_cover_penalty":200,"native_trace_blockers":0,"native_trace_hits_total":74,"native_trace_unique_breakpoints":11,"false_positives":0,"runtime_timeout_failures":0,"runtime_title_visual_suppressed_builds":0,"runtime_custom_cover_builds":0,"runtime_simulated_button_presses_total":0},"status":"keep","description":"Make profile-render fail-fast unconditional, not configurable","timestamp":1782487799654,"segment":0,"confidence":null,"asi":{"hypothesis":"Default fail-fast must mean always on, not hidden behind an env var or optional watcher arg. Since the predicate is already narrowed to the exact product refresh gate, remove the `--fail-on-missing-title-profile-render-refresh` CLI flag and remove the direct-probe extra-arg wiring. The watcher now applies `telemetry_title_profile_render_refresh_missing()` unconditionally.","validation":"Persisted Beads memory `profile-render-failfast-default-means-unconditional-2026-06-26`; python py_compile scripts/er-readiness-watch.py OK; bash -n scripts/run-product-continue-direct-probe.sh OK; static checks confirm watcher arg/attr and script arg/env references removed; .auto/measure.sh passes unchanged at 1160","not_cheating_note":"This tightens fail-closed runtime behavior and removes configurability; it does not relax product proof or count profile refresh as cover proof.","guardrail_note":"An attempted run_experiment with a custom validation+measure command was rejected because .auto/measure.sh exists; validation was rerun outside run_experiment and the required measure command was used.","next_action_hint":"Next runtime can validate the unconditional watcher behavior. If it still fails native_title_visual_render_unsuppressed with profile gate false, focus on the title visual fail-fast predicate/root cause."}}
{"run":344,"commit":"45f7874","metric":800,"metrics":{"readiness_gate_failures":0,"target_constants_remaining":0,"helpers_missing":0,"fixed_wait_predicates":0,"autoload_static_failures":0,"asset_chain_failures":0,"dll_patch_failures":0,"native_continue_failures":0,"field58_gate_failures":0,"direct_shortcut_failures":0,"input_path_failures":0,"runtime_proof_failures":1,"runtime_mode_failures":0,"eula_popup_failures":0,"save_data_popup_failures":2,"messagebox_dialog_failures":0,"server_status_failures":0,"title_cover_failures":2,"title_cover_penalty":400,"native_trace_blockers":0,"native_trace_hits_total":74,"native_trace_unique_breakpoints":11,"false_positives":0,"runtime_timeout_failures":0,"runtime_title_visual_suppressed_builds":0,"runtime_custom_cover_builds":0,"runtime_simulated_button_presses_total":0},"status":"discard","description":"Validate unconditional profile fail-fast and tightened title-visual predicate in runtime","timestamp":1782487932059,"segment":0,"confidence":null,"asi":{"hypothesis":"With profile-render fail-fast unconditional and the title-visual predicate tightened to ignore broad draw-bit state when both specific title surfaces are hidden, the direct runtime should no longer fail with title_profile_render_refresh_missing or native_title_visual_render_unsuppressed.","runtime_artifact":"/home/banon/projects/er-effects-rs/target/runtime-probe/product-continue-direct-20260626-083042","observed_readiness_reason":"timeout_seconds_budget_exhausted","observed_title_profile_render_refresh_missing":false,"observed_native_title_visual_render_unsuppressed":false,"observed_world_stable":true,"observed_player_present":true,"observed_char_name":"Banon","observed_logo_hidden":true,"observed_press_start_hidden":true,"observed_draw_bit_set":true,"observed_profile_render_refresh_gate_ready":false,"observed_profile_render_refresh_calls":0,"observed_msgbox_total_builds":0,"rollback_reason":"Runtime artifact lowered score to 800 because proof still times out and adds latest-runtime save/title-cover penalties; it is validation evidence, not an improved product proof.","next_action_hint":"Clean this runtime artifact. Next target is proof completion: watcher reached world_stable at +37.2s but timed out because expected animation/result-chain evidence was missing; inspect readiness-result oracle fields and decide whether expected animation telemetry is stale/missing or genuinely not observed."}}
{"run":345,"commit":"fb46745","metric":1160,"metrics":{"readiness_gate_failures":0,"target_constants_remaining":0,"helpers_missing":0,"fixed_wait_predicates":0,"autoload_static_failures":0,"asset_chain_failures":0,"dll_patch_failures":0,"native_continue_failures":0,"field58_gate_failures":0,"direct_shortcut_failures":0,"input_path_failures":0,"runtime_proof_failures":1,"runtime_mode_failures":0,"eula_popup_failures":0,"save_data_popup_failures":1,"messagebox_dialog_failures":0,"server_status_failures":0,"title_cover_failures":1,"title_cover_penalty":200,"native_trace_blockers":0,"native_trace_hits_total":74,"native_trace_unique_breakpoints":11,"false_positives":0,"runtime_timeout_failures":0,"runtime_title_visual_suppressed_builds":0,"runtime_custom_cover_builds":0,"runtime_simulated_button_presses_total":0},"status":"keep","description":"Remove timeout validation artifact after preserving proof-gap evidence","timestamp":1782487961719,"segment":0,"confidence":null,"asi":{"hypothesis":"After run #344 recorded the corrected watcher runtime behavior, the timeout diagnostic artifact remained latest and added extra penalties. Removing only that scratch artifact should restore stricter validated scoring while preserving evidence in #344 ASI.","removed_artifact":"/home/banon/projects/er-effects-rs/target/runtime-probe/product-continue-direct-20260626-083042","evidence_preserved_in_run":"#344 ASI records no profile-render fail-fast, no native title visual fail-fast, world_stable=true at +37.2s, Banon present, zero msgbox, but timeout due missing expected animation/result-chain proof.","next_action_hint":"Next target is proof completion after world_stable: inspect readiness-result oracle fields from #344 evidence and fix expected animation/result-chain telemetry if stale/missing, without weakening actual product proof."}}
{"run":346,"commit":"6bffb0e","metric":920,"metrics":{"readiness_gate_failures":0,"target_constants_remaining":0,"helpers_missing":0,"fixed_wait_predicates":0,"autoload_static_failures":0,"asset_chain_failures":0,"dll_patch_failures":0,"native_continue_failures":0,"field58_gate_failures":0,"direct_shortcut_failures":0,"input_path_failures":0,"runtime_proof_failures":1,"runtime_mode_failures":0,"eula_popup_failures":0,"save_data_popup_failures":1,"messagebox_dialog_failures":0,"server_status_failures":0,"title_cover_failures":1,"title_cover_penalty":200,"native_trace_blockers":0,"native_trace_hits_total":74,"native_trace_unique_breakpoints":11,"false_positives":0,"runtime_timeout_failures":0,"runtime_title_visual_suppressed_builds":0,"runtime_custom_cover_builds":0,"runtime_simulated_button_presses_total":0},"status":"keep","description":"Remove fixed world-stable sample/dwell success wait; runtime now exits at semantic world_stable","timestamp":1782488151791,"segment":0,"confidence":null,"asi":{"hypothesis":"Run #344 showed the watcher timing out after it had already observed semantic world_stable. Project rules forbid requiring fixed N ticks/dwell as a success predicate; the semantic world_loaded predicate already includes no-postload-popup, expected save, expected animation, player/world state, and stable map evidence. Set default world_stable_samples=1 and dwell=0 so success exits immediately on the semantic predicate.","runtime_artifact":"/home/banon/projects/er-effects-rs/target/runtime-probe/product-continue-direct-20260626-083415","observed_ready":true,"observed_readiness_reason":"world_stable","observed_world_stable_seconds":36.344,"observed_teardown_seconds":36.367,"observed_expected_animation_match":true,"observed_expected_save_match":true,"observed_native_stage":"world_loaded","observed_no_postload_popup":true,"observed_char_name":"Banon","observed_current_animation_id":4050,"observed_zero_input":true,"observed_msgbox_total_builds":0,"observed_profile_render_refresh_missing":false,"observed_native_title_visual_unsuppressed":false,"remaining_product_failure":"Debug log still contains corrupted-save native semaphore id=401106 and no custom/profile cover render; those remain hard product failures and explain the lower score.","not_cheating_note":"This does not relax world_loaded semantics; it removes only the fixed dwell/sample wait after semantic proof is already true. The lower metric is kept as a correctness/guardrail fix, not claimed as product improvement.","next_action_hint":"Clean this runtime artifact from scored latest set, then address the remaining hard failure: corrupted-save native semaphore 401106 and missing real custom cover render."}}
{"run":347,"commit":"780819d","metric":1160,"metrics":{"readiness_gate_failures":0,"target_constants_remaining":0,"helpers_missing":0,"fixed_wait_predicates":0,"autoload_static_failures":0,"asset_chain_failures":0,"dll_patch_failures":0,"native_continue_failures":0,"field58_gate_failures":0,"direct_shortcut_failures":0,"input_path_failures":0,"runtime_proof_failures":1,"runtime_mode_failures":0,"eula_popup_failures":0,"save_data_popup_failures":1,"messagebox_dialog_failures":0,"server_status_failures":0,"title_cover_failures":1,"title_cover_penalty":200,"native_trace_blockers":0,"native_trace_hits_total":74,"native_trace_unique_breakpoints":11,"false_positives":0,"runtime_timeout_failures":0,"runtime_title_visual_suppressed_builds":0,"runtime_custom_cover_builds":0,"runtime_simulated_button_presses_total":0},"status":"keep","description":"Remove world-stable diagnostic artifact; keep focus on corrupted character/save failure","timestamp":1782488208212,"segment":0,"confidence":null,"asi":{"hypothesis":"The run #346 world-stable artifact was diagnostic and preserved in ASI; leaving it as latest scoring evidence keeps extra penalties in the benchmark. Removing it restores the stricter validated scoring set, but the user correction is decisive: world_stable does not matter while the native corrupted-save/character semaphore remains.","removed_artifact":"/home/banon/projects/er-effects-rs/target/runtime-probe/product-continue-direct-20260626-083415","evidence_preserved_in_run":"#346 ASI records world_stable proof fields, but also records the remaining hard failure: corrupted-save native semaphore id=401106 and no real cover render.","user_correction":"Do not treat world_stable as meaningful product progress while character/save state is corrupted.","next_action_hint":"Target the corrupted-save native semaphore 401106 directly. Do not spend the next iteration improving world_stable proof until the character/save corruption path is fixed or classified."}}
{"run":348,"commit":"fe29f20","metric":1160,"metrics":{"readiness_gate_failures":0,"target_constants_remaining":0,"helpers_missing":0,"fixed_wait_predicates":0,"autoload_static_failures":0,"asset_chain_failures":0,"dll_patch_failures":0,"native_continue_failures":0,"field58_gate_failures":0,"direct_shortcut_failures":0,"input_path_failures":0,"runtime_proof_failures":1,"runtime_mode_failures":0,"eula_popup_failures":0,"save_data_popup_failures":1,"messagebox_dialog_failures":0,"server_status_failures":0,"title_cover_failures":1,"title_cover_penalty":200,"native_trace_blockers":0,"native_trace_hits_total":74,"native_trace_unique_breakpoints":11,"false_positives":0,"runtime_timeout_failures":0,"runtime_title_visual_suppressed_builds":0,"runtime_custom_cover_builds":0,"runtime_simulated_button_presses_total":0},"status":"keep","description":"Fail fast on native corrupted-save RAM semaphore before world-stable can pass","timestamp":1782488320927,"segment":0,"confidence":null,"asi":{"hypothesis":"User correction: world_stable is irrelevant if the character/save state is corrupted. The DLL already exposes the in-process RAM semaphore `oracle_corrupted_save_seen_id` from GetGR_System_Message ids including 401106, but the readiness watcher only failed on visual save-data OCR/debug-log scoring. Add an unconditional watcher fail-fast `native_corrupted_save_detected` when that oracle is nonzero, before messagebox/server/title/world success paths.","validation":"bd memories searched for corrupted-save/GetGR_System_Message context; python py_compile scripts/er-readiness-watch.py OK; bash -n scripts/run-product-continue-direct-probe.sh OK; static check confirms NATIVE_CORRUPTED_SAVE_DETECTED, telemetry_native_corrupted_save_detected, and oracle_corrupted_save_seen_id are wired; .auto/measure.sh unchanged at 1160","not_cheating_note":"This tightens product proof: it prevents world_stable from passing over a corrupted-save native semaphore and does not relax any score gate.","next_action_hint":"Run a bounded direct probe to confirm it now stops at native_corrupted_save_detected when GetGR_System_Message 401106 appears; then investigate/fix the save validation/write path causing the semaphore."}}
{"run":349,"commit":"fe29f20","metric":0,"metrics":{"readiness_gate_failures":0,"target_constants_remaining":0,"helpers_missing":0,"fixed_wait_predicates":0,"autoload_static_failures":0,"asset_chain_failures":0,"dll_patch_failures":0,"native_continue_failures":0,"field58_gate_failures":0,"direct_shortcut_failures":0,"input_path_failures":0,"runtime_proof_failures":1,"runtime_mode_failures":0,"eula_popup_failures":0,"save_data_popup_failures":1,"messagebox_dialog_failures":0,"server_status_failures":0,"native_trace_blockers":0,"native_trace_hits_total":74,"native_trace_unique_breakpoints":11,"false_positives":0,"title_cover_failures":1,"title_cover_penalty":200,"runtime_timeout_failures":0,"runtime_title_visual_suppressed_builds":0,"runtime_custom_cover_builds":0,"runtime_simulated_button_presses_total":0},"status":"crash","description":"Blocked custom runtime validation command because autoresearch benchmark must use .auto/measure.sh","timestamp":1782488394202,"segment":0,"confidence":null,"asi":{"hypothesis":"Validate native_corrupted_save_detected with a direct runtime probe followed by measure in one run_experiment command.","rollback_reason":"run_experiment guard correctly blocked custom command because .auto/measure.sh exists and must be the benchmark entrypoint; no runtime was launched.","next_action_hint":"Use run_experiment only with ./.auto/measure.sh for scored iterations. Runtime probes must be represented through the measure harness or run outside run_experiment with a subsequent sanctioned measure/log cycle.","guard_classification":"valid guard; agent should not have attempted a custom run_experiment command in a repo with .auto/measure.sh."}}
