{"run":82,"commit":"2100051","metric":0,"metrics":{"readiness_gate_failures":1,"target_constants_remaining":0,"helpers_missing":0,"fixed_wait_predicates":0,"autoload_static_failures":1,"asset_chain_failures":0,"dll_patch_failures":0,"native_continue_failures":0,"field58_gate_failures":0,"direct_shortcut_failures":0,"input_path_failures":0,"runtime_proof_failures":1,"runtime_mode_failures":0,"eula_popup_failures":0,"save_data_popup_failures":0,"messagebox_dialog_failures":0,"server_status_failures":0,"title_cover_failures":0,"title_cover_penalty":0,"native_trace_blockers":0,"native_trace_hits_total":74,"native_trace_unique_breakpoints":11,"false_positives":0,"runtime_timeout_failures":1,"runtime_title_visual_suppressed_builds":0,"runtime_custom_cover_builds":0,"runtime_simulated_button_presses_total":0},"status":"crash","description":"traced FixOrderJobSequence insert; open_menu inserts chain jobs at dialog+0x18 but product action scan ignores them","timestamp":1782373441750,"segment":0,"confidence":4.833333333333333,"asi":{"hypothesis":"Hook the underlying FixOrderJobSequence insert helper deobf 0x1407a8820 while preserving native TitleTopDialog and running the open_menu/continuation/open_menu cycle, to identify the exact sequence object and job inserted by the native title menu chain.","rollback_reason":"Runtime timed out before native Continue/load proof. The hook installed and showed open_menu inserted chain jobs at seq=0x7ffe969d3d58 (dialog+0x18, because enqueue passes dialog+0x10 then insert uses +8) with jobs 0x7ffe9e507640 and 0x7ffe9e4e0af0, both vtable 0x142aa2958. Insert returned success and seq_count_after=1. Product_core still rejected only idle MenuWindowJob 0x7ffe9e52c000 and never entered menu_continue_wrapper/TITLE-CONTINUE/native_submit/continue_load, proving current action discovery is looking at the wrong object, not that open_menu failed to build jobs.","next_action_hint":"Next experiment should decode/traverse the inserted chain job object(s) 0x142aa2958, not hook more insertion layers. Static RE the vtable/RTTI for 0x142aa2958 and/or hook its Run/Update virtual to log child jobs. Product action discovery should walk dialog+0x18 sequence children or execute/observe the chain's child MenuWindowJobs, rather than scanning the owner idle candidate at 0x7ffe9e52c000.","artifact_dir":"/home/banon/projects/er-effects-rs/target/runtime-probe/product-continue-direct-20260625-004131","observed_runtime_oracles":{"hook_installed":"title_fixorder_insert 0x1407a8820","fixorder_insert_hits":11,"open_menu_calls_logged":2,"forced_textfadeout_continuation_logs":1,"product_core_ready_blocker":"ready","product_core_ready_successes":568,"product_core_last_title_dialog_vt":"0x142b26468/TitleTopDialog","product_core_last_menu_opened_latch":1,"profile_slot_active_bytes_qword":"0x1","title_handoff_complete":true,"interesting_insert_records":[{"seq":8,"caller_rva":"0x7a929d","seq_obj":"0x7ffe969d3d58","job":"0x7ffe9e507640","job_vt":"0x142aa2958","ret":"0x1","seq_count_after":"0x1"},{"seq":9,"caller_rva":"0x7a929d","seq_obj":"0x7ffe969d3d58","job":"0x7ffe9e4e0af0","job_vt":"0x142aa2958","ret":"0x1","seq_count_after":"0x1"}],"other_insert_vtables":["0x142a93af8"],"idle_candidate_item":"0x7ffe9e52c000","idle_candidate_hits":1197,"menu_continue_wrapper_hits":0,"title_continue_builder_hits":0,"native_submit_hits":0,"continue_load_fired":false,"oracle_player_present":false,"simulated_button_presses_total":0,"messagebox_total_builds":0,"processes_remaining":0},"static_re":{"fixorder_insert_mapping":"dump 0x1407a8910 -> deobf 0x1407a8820","fixorder_insert_semantics":"if *job_ref non-null and sequence capacity permits, calls 0x1407a8fa0 then clears job_ref; returns 1 on insertion."},"build":"cargo xwin build --release --target x86_64-pc-windows-msvc succeeded.","cleanup":"No eldenring.exe or start_protected_game.exe processes remained."}}
{"run":83,"commit":"2100051","metric":0,"metrics":{"readiness_gate_failures":1,"target_constants_remaining":0,"helpers_missing":0,"fixed_wait_predicates":0,"autoload_static_failures":1,"asset_chain_failures":0,"dll_patch_failures":0,"native_continue_failures":0,"field58_gate_failures":0,"direct_shortcut_failures":0,"input_path_failures":0,"runtime_proof_failures":1,"runtime_mode_failures":0,"eula_popup_failures":0,"save_data_popup_failures":0,"messagebox_dialog_failures":0,"server_status_failures":0,"title_cover_failures":0,"title_cover_penalty":0,"native_trace_blockers":0,"native_trace_hits_total":74,"native_trace_unique_breakpoints":11,"false_positives":0,"runtime_timeout_failures":1,"runtime_title_visual_suppressed_builds":0,"runtime_custom_cover_builds":0,"runtime_simulated_button_presses_total":0},"status":"crash","description":"traced IfElseJob Run; inserted chain runs every tick but child decoding used wrong layout","timestamp":1782373906751,"segment":0,"confidence":4.833333333333333,"asi":{"hypothesis":"Hook `CS::FixOrderJobSequence::Run` / `CS::MenuJobSequence::IfElseJob::Run` deobf 0x1407aa1f0 to decode the enqueued IfElseJob chain children after open_menu, because previous insertion traces proved open_menu inserts vtable 0x142aa2958 jobs into dialog+0x18 but product action discovery ignores them.","rollback_reason":"Runtime timed out before native Continue/load proof. The Run hook installed and fired heavily; it confirmed the inserted IfElseJob objects 0x7ffe9e507640 and 0x7ffe9e5f02a0 run every tick via caller_rva=0x7a968e. However the diagnostic child decoder used the generic FixOrderJobSequence offsets and showed count=0 while q08=0x2 and q18/q20 were nonzero pointers, meaning IfElseJob has a different compact layout. No real Continue action was captured; product still rejected only the idle MenuWindowJob and no native submit/continue_load fired.","next_action_hint":"Static RE the `CS::MenuJobSequence::IfElseJob` layout/vtable specifically. The Run trace says vtable 0x142aa2958, q08=0x2, q18/q20 point at likely branch child jobs (e.g. q18=0x7ffe9e500a80, q20=0x7ffe9e4f43c0 for job 0x7ffe9e507640; q18=0x7ffe9e500920, q20=0x7ffe9e4f40c0 for job 0x7ffe9e5f02a0). Next runtime should log the vtables of q18/q20 and maybe q28/q30 directly, or statically decompile 0x1407aa2e0 with the IfElseJob type to identify branch child offsets. Do not keep using generic count at +0x28 for IfElseJob.","artifact_dir":"/home/banon/projects/er-effects-rs/target/runtime-probe/product-continue-direct-20260625-004915","observed_runtime_oracles":{"hook_installed":"title_fixorder_run 0x1407aa1f0","fixorder_run_hits_logged":2598,"run_objects":[{"seq":"0x7ffe9e507640","vt":"0x142aa2958/IfElseJob","q08":"0x2","q18":"0x7ffe9e500a80","q20":"0x7ffe9e4f43c0","count_probe":"0x0","caller_rva":"0x7a968e"},{"seq":"0x7ffe9e5f02a0","vt":"0x142aa2958/IfElseJob","q08":"0x2","q18":"0x7ffe9e500920","q20":"0x7ffe9e4f40c0","count_probe":"0x0","caller_rva":"0x7a968e"}],"product_core_ready_blocker":"ready","product_core_ready_successes":561,"product_core_last_title_dialog_vt":"0x142b26468/TitleTopDialog","product_core_last_menu_opened_latch":1,"profile_slot_active_bytes_qword":"0x1","idle_candidate_item":"0x7ffe9e52c000","idle_candidate_hits":1183,"idle_rejections":556,"menu_continue_wrapper_hits":0,"title_continue_builder_hits":0,"native_submit_hits":0,"continue_load_fired":false,"oracle_player_present":false,"simulated_button_presses_total":0,"messagebox_total_builds":0,"processes_remaining":0},"static_re":{"ifelse_rtti":"vtable 0x142aa2958 => .?AVIfElseJob@MenuJobSequence@CS@@","ifelse_vtable_methods":{"slot0":"dump 0x140744e90/deobf 0x140744d90 Deallocate","slot1":"dump 0x140792180/deobf 0x140792090 destructor","slot2":"dump 0x1407aa2e0/deobf 0x1407aa1f0 Run"},"run_decomp":"Generic FixOrderJobSequence::Run decomp assumes jobs.count at +0x28, but runtime IfElseJob objects show q08=2 and +0x28=0, so type-specific layout differs."},"build":"cargo xwin build --release --target x86_64-pc-windows-msvc succeeded.","cleanup":"No eldenring.exe or start_protected_game.exe processes remained."}}
{"run":84,"commit":"2100051","metric":0,"metrics":{"readiness_gate_failures":1,"target_constants_remaining":0,"helpers_missing":0,"fixed_wait_predicates":0,"autoload_static_failures":1,"asset_chain_failures":0,"dll_patch_failures":0,"native_continue_failures":0,"field58_gate_failures":0,"direct_shortcut_failures":0,"input_path_failures":0,"runtime_proof_failures":1,"runtime_mode_failures":0,"eula_popup_failures":0,"save_data_popup_failures":0,"messagebox_dialog_failures":0,"server_status_failures":0,"title_cover_failures":0,"title_cover_penalty":0,"native_trace_blockers":0,"native_trace_hits_total":74,"native_trace_unique_breakpoints":11,"false_positives":0,"runtime_timeout_failures":1,"runtime_title_visual_suppressed_builds":0,"runtime_custom_cover_builds":0,"runtime_simulated_button_presses_total":0},"status":"crash","description":"decoded IfElseJob branch pointers; branch wrappers point toward actual child jobs including idle title job","timestamp":1782374257774,"segment":0,"confidence":4.833333333333333,"asi":{"hypothesis":"Hook IfElseJob::Run deobf 0x1407aa1f0 again but decode q18/q20 as branch wrapper objects, logging their vtables and inner pointers, because previous Run trace showed IfElseJob q18/q20 are likely branch child pointers rather than a generic vector/count layout.","rollback_reason":"Runtime timed out before native Continue/load proof. The hook installed and decoded stable IfElseJob branch wrappers. q18/q20 are wrapper jobs with vtables 0x142aa2938 and 0x142aa2c38, not direct MenuWindowJobs. Their +0x10 fields point to candidate inner child jobs, including 0x7fff3e52c280 (the native 05_000_Title BeginTitle job) and other sequence/wrapper objects, but no Continue wrapper/native submit/continue_load fired. Product still rejected the idle d180 MenuWindowJob only.","next_action_hint":"Static RE RTTI/vtables 0x142aa2938 and 0x142aa2c38 and decode their Run methods/layouts. Runtime next should hook those branch wrapper Run methods or log the vtable/fields of their +0x10 inner jobs recursively. The useful finding: IfElseJob 0x142aa2958 uses q18/q20 branch wrappers, and q18+0x10 for one open_menu chain points directly to native title job 0x7fff3e52c280; action discovery needs to recurse through these wrappers instead of treating q18/q20 as leaf jobs.","artifact_dir":"/home/banon/projects/er-effects-rs/target/runtime-probe/product-continue-direct-20260625-005504","observed_runtime_oracles":{"hook_installed":"title_ifelse_run 0x1407aa1f0","ifelse_run_trace_lines":2554,"product_core_ready_blocker":"ready","product_core_ready_successes":569,"product_core_last_title_dialog_vt":"0x142b26468/TitleTopDialog","product_core_last_menu_opened_latch":1,"profile_slot_active_bytes_qword":"0x1","title_handoff_complete":true,"ifelse_objects":[{"job":"0x7fff3e507640","vt":"0x142aa2958/IfElseJob","q08":"0x2","q18":"0x7fff3e500a80","q18_vt":"0x142aa2938","q18_plus_10":"0x7fff3e5cd400","q20":"0x7fff3e4f43c0","q20_vt":"0x142aa2c38","q20_plus_10":"0x7fff3e500aa0"},{"job":"0x7fff3e5f02a0","vt":"0x142aa2958/IfElseJob","q08":"0x2","q18":"0x7fff3e500920","q18_vt":"0x142aa2938","q18_plus_10":"0x7fff3e52c280","q20":"0x7fff3e4f40c0","q20_vt":"0x142aa2c38","q20_plus_10":"0x7fff3e500940"}],"idle_candidate_item":"0x7fff3e52c000","idle_candidate_hits":1199,"idle_rejections":561,"menu_continue_wrapper_hits":0,"title_continue_builder_hits":0,"native_submit_hits":0,"continue_load_fired":false,"oracle_player_present":false,"simulated_button_presses_total":0,"messagebox_total_builds":0,"processes_remaining":0},"static_re":{"ifelse_rtti":"vtable 0x142aa2958 => .?AVIfElseJob@MenuJobSequence@CS@@","ifelse_vtable_methods":{"slot0":"dump 0x140744e90/deobf 0x140744d90 Deallocate","slot1":"dump 0x140792180/deobf 0x140792090 destructor","slot2":"dump 0x1407aa2e0/deobf 0x1407aa1f0 Run"},"branch_wrapper_candidates":["0x142aa2938","0x142aa2c38"]},"build":"cargo xwin build --release --target x86_64-pc-windows-msvc succeeded.","cleanup":"No eldenring.exe or start_protected_game.exe processes remained."}}
{"run":85,"commit":"2100051","metric":0,"metrics":{"readiness_gate_failures":1,"target_constants_remaining":0,"helpers_missing":0,"fixed_wait_predicates":0,"autoload_static_failures":1,"asset_chain_failures":0,"dll_patch_failures":0,"native_continue_failures":0,"field58_gate_failures":0,"direct_shortcut_failures":0,"input_path_failures":0,"runtime_proof_failures":1,"runtime_mode_failures":0,"eula_popup_failures":0,"save_data_popup_failures":0,"messagebox_dialog_failures":0,"server_status_failures":0,"title_cover_failures":0,"title_cover_penalty":0,"native_trace_blockers":0,"native_trace_hits_total":74,"native_trace_unique_breakpoints":11,"false_positives":0,"runtime_timeout_failures":1,"runtime_title_visual_suppressed_builds":0,"runtime_custom_cover_builds":0,"runtime_simulated_button_presses_total":0},"status":"crash","description":"traced CalcCondition/Switch branch wrappers; active branches select non-Continue jobs, not native wrapper","timestamp":1782374693449,"segment":0,"confidence":4.833333333333333,"asi":{"hypothesis":"Hook CalcConditionJob::Run deobf 0x140792460 and SwitchJob::Run deobf 0x1407931e0 to decode the branch wrappers inside the IfElseJob title chain and identify the selected active child jobs, especially whether the native Continue wrapper/action appears inside those branches.","rollback_reason":"Runtime timed out before native Continue/load proof. The hooks installed and fired. CalcConditionJob shows inner title jobs 0x7ffe9e52c280 (vt 0x142aa97e8 native 05_000_Title job) and 0x7ffe9e5cd400 (vt 0x142aa9428), with condition flags staying true. SwitchJob selected active branches with vtables 0x142aa86a0, 0x142aa8d78, and 0x142a93af8, but no branch selected a semantic Continue wrapper or fired continue_load/native submit. Product still rejected only the idle MenuWindowJob candidate.","next_action_hint":"Next static/runtime target: decode the active branch child job vtables 0x142aa86a0, 0x142aa8d78, 0x142a93af8, and 0x142aa9428. The SwitchJob active branches show those are the actual selected descendants. Hook their Run methods or inspect RTTI; one of them likely owns the row/menu update that eventually emits idle d180. Need find where the real Continue action would live or prove this self-open path only builds title visual/status jobs, not title row actions.","artifact_dir":"/home/banon/projects/er-effects-rs/target/runtime-probe/product-continue-direct-20260625-010206","observed_runtime_oracles":{"hooks_installed":["title_calc_condition_run 0x140792460","title_switch_job_run 0x1407931e0"],"calc_condition_trace_count":320,"switch_job_trace_count":14,"product_core_ready_blocker":"ready","product_core_ready_successes":552,"product_core_last_title_dialog_vt":"0x142b26468/TitleTopDialog","product_core_last_menu_opened_latch":1,"profile_slot_active_bytes_qword":"0x1","title_handoff_complete":true,"calc_conditions":[{"job":"0x7ffe9e500920","inner":"0x7ffe9e52c280","inner_vt":"0x142aa97e8","flag_after":1},{"job":"0x7ffe9e500a80","inner":"0x7ffe9e5cd400","inner_vt":"0x142aa9428","flag_after":1}],"switch_active_vtables":["0x142aa86a0","0x142aa8d78","0x142a93af8"],"switch_examples":[{"job":"0x7ffe9e4f4480","selector_vt":"0x142aa2c58","active_after":"0x7ffe9e4f86c0","active_after_vt":"0x142aa86a0"},{"job":"0x7ffe9e4f4540","selector_vt":"0x142aa2c58","active_after":"0x7ffe9e507aa0","active_after_vt":"0x142aa8d78"},{"job":"0x7ffe9e4f4c00","selector_vt":"0x142aa2c58","active_after":"0x7ffe9e5ce2b0","active_after_vt":"0x142a93af8"}],"idle_candidate_item":"0x7ffe9e52c000","idle_candidate_hits":1167,"idle_rejections":545,"menu_continue_wrapper_hits":0,"title_continue_builder_hits":0,"native_submit_hits":0,"continue_load_fired":false,"oracle_player_present":false,"simulated_button_presses_total":0,"messagebox_total_builds":0,"processes_remaining":0},"static_re":{"calc_condition_rtti":"vtable 0x142aa2938 => .?AVCalcConditionJob@MenuJobSequence@CS@@; Run dump 0x140792550/deobf 0x140792460","switch_rtti":"vtable 0x142aa2c38 => .?AVSwitchJob@MenuJobSequence@CS@@; Run dump 0x1407932d0/deobf 0x1407931e0","calc_condition_semantics":"runs inner job at +0x10 and writes IsSuccess result into *[job+0x18]","switch_semantics":"uses selector at +0x10, selects branch into +0xb0 via FUN_140793480, then runs active branch at +0xb0"},"build":"cargo xwin build --release --target x86_64-pc-windows-msvc succeeded.","cleanup":"No eldenring.exe or start_protected_game.exe processes remained."}}
{"run":86,"commit":"2100051","metric":0,"metrics":{"readiness_gate_failures":1,"target_constants_remaining":0,"helpers_missing":0,"fixed_wait_predicates":0,"autoload_static_failures":1,"asset_chain_failures":0,"dll_patch_failures":0,"native_continue_failures":0,"field58_gate_failures":0,"direct_shortcut_failures":0,"input_path_failures":0,"runtime_proof_failures":1,"runtime_mode_failures":0,"eula_popup_failures":0,"save_data_popup_failures":0,"messagebox_dialog_failures":0,"server_status_failures":0,"title_cover_failures":0,"title_cover_penalty":0,"native_trace_blockers":0,"native_trace_hits_total":74,"native_trace_unique_breakpoints":11,"false_positives":0,"runtime_timeout_failures":1,"runtime_title_visual_suppressed_builds":0,"runtime_custom_cover_builds":0,"runtime_simulated_button_presses_total":0},"status":"crash","description":"traced active branch child jobs; title chain recurses into MenuUnion/FixOrder/LazyCreate/Functor but no Continue action","timestamp":1782375193817,"segment":0,"confidence":4.833333333333333,"asi":{"hypothesis":"Decode the active SwitchJob-selected descendants by hooking LazyCreateJobImpl::Run, FixOrderJobSequence::Run, MenuFunctorJob::Run, and MenuUnionJob::Run while preserving native TitleTopDialog and forcing the open_menu/TextFadeOut continuation cycle. One descendant might own the real title row/menu action that eventually invokes Continue.","rollback_reason":"Runtime timed out before native Continue/load proof. Hooks installed and fired. The active chain recursed through LazyCreateJobImpl, FixOrderJobSequence, MenuFunctorJob, and MenuUnionJob, but still never produced menu_continue_wrapper/TITLE-CONTINUE/native_submit/continue_load. Product stayed ready in TitleTopDialog with profile active and rejected only the idle d180 MenuWindowJob candidate.","next_action_hint":"Static/runtime next should identify the newly observed concrete descendants: LazyCreate created vtables 0x142aa2710, 0x142aa26f0, 0x142a93af8, and 0x142a93d18 functors with do=0x140746830 plus a persistent MenuFunctor do=0x1407a6de0. MenuUnion contains child vt 0x142b264d8 plus FixOrderJobSequence vt 0x142aa8d78. Decode RTTI/vtables 0x142aa2710, 0x142aa26f0, 0x142b264d8, 0x142a93d18 and function 0x140746830 / 0x1407a6de0; likely this path is title visual/status job plumbing, not real Continue row action.","artifact_dir":"/home/banon/projects/er-effects-rs/target/runtime-probe/product-continue-direct-20260625-011030","observed_runtime_oracles":{"hooks_installed":["title_lazy_create_run 0x1407a7330","title_fix_order_sequence_run 0x1407aa1f0","title_menu_functor_run 0x140745510","title_menu_union_run 0x1407abdd0"],"product_core_ready_blocker":"ready","product_core_ready_successes":561,"product_core_last_title_dialog_vt":"0x142b26468/TitleTopDialog","product_core_last_menu_opened_latch":1,"profile_slot_active_bytes_qword":"0x1","title_handoff_complete":true,"lazy_create_trace_count":56,"fix_order_trace_count":">=220 logged (many sequence runs)","menu_functor_trace_count":">=120 logged","menu_union_trace_count":">=219 logged","lazy_created_vtables":["0x142aa2710","0x142aa26f0","0x142a93af8"],"menu_functor_fns":[{"vt":"0x142aa8350","do":"0x1407a6de0"},{"vt":"0x142a93d18","do":"0x140746830"}],"menu_union_unique_child_vtables":["0x142aa8d78","0x142b264d8"],"menu_union_example_children":[{"ptr":"0x7ffe9e500a60","vt":"0x142b264d8","q10":"0x7ffffdb7fa38","q18":"0x0","q38":"0x7ffe9e5076a8"},{"ptr":"0x7ffe9e5075d0","vt":"0x142aa8d78","q10":"0x1","q18":"0x7ffe9e507560","q38":"0x0"}],"idle_candidate_item":"0x7ffe9e52c000","idle_candidate_hits":1184,"idle_rejections":">=545","menu_continue_wrapper_hits":0,"title_continue_builder_hits":0,"native_submit_hits":0,"continue_load_fired":false,"oracle_player_present":false,"oracle_saved_map_c30":"0xa010000","oracle_char_name":"","simulated_button_presses_total":0,"messagebox_total_builds":0,"processes_remaining":0},"static_re":{"LazyCreateJobImpl_Run":"vtable 0x142aa86a0 => LazyCreateJobImpl; Run dump 0x1407a7420/deobf 0x1407a7330; creates child into +0x50 then runs it","FixOrderJobSequence_Run":"vtable 0x142aa8d78 => FixOrderJobSequence; Run dump 0x1407aa2e0/deobf 0x1407aa1f0; iterates fixed vector from +0x18/count +0x28","MenuFunctorJob_Run":"vtable 0x142a93af8 => MenuFunctorJob; Run dump 0x140745610/deobf 0x140745510; invokes std::function at +0x48","MenuUnionJob_Run":"vtable 0x142aa9428 => MenuUnionJob; Run dump 0x1407abec0/deobf 0x1407abdd0; runs vector children from +0x10/count +0x38 and caches first continue result at +0x40"},"build":"cargo xwin build --release --target x86_64-pc-windows-msvc succeeded after fixing diagnostic safe_read_u32 usage to safe_read_usize.","cleanup":"No eldenring.exe or start_protected_game.exe processes remained."}}
