{"run":240,"commit":"7046eca","metric":0,"metrics":{"readiness_gate_failures":1,"target_constants_remaining":0,"helpers_missing":0,"fixed_wait_predicates":0,"autoload_static_failures":1,"asset_chain_failures":0,"dll_patch_failures":0,"native_continue_failures":1,"field58_gate_failures":0,"direct_shortcut_failures":0,"input_path_failures":0,"runtime_proof_failures":1,"runtime_mode_failures":0,"eula_popup_failures":0,"save_data_popup_failures":0,"messagebox_dialog_failures":0,"server_status_failures":0,"title_cover_failures":1,"title_cover_penalty":50,"native_trace_blockers":0,"native_trace_hits_total":74,"native_trace_unique_breakpoints":11,"false_positives":0,"runtime_timeout_failures":1,"runtime_title_visual_suppressed_builds":1,"runtime_custom_cover_builds":0,"runtime_simulated_button_presses_total":0},"status":"crash","description":"runtime probe used stale DLL and repeated old game-task open_menu behavior","timestamp":1782438871631,"segment":0,"confidence":null,"asi":{"hypothesis":"The accepted-byte product_core fix should allow native TitleTopDialog::update to open/drain the menu instead of the old game-task open_menu self-fire.","observed":"Runtime artifact product-continue-direct-20260625-185214 still logged the old string `self-fire native open-menu 0x1409b24e0`, with zero `title-accept-byte` logs and 2200 idle-only Continue candidates. The probe script deploys target/x86_64-pc-windows-msvc/release/er_effects_rs.dll but does not build it, so this run used stale DLL bytes and did not test commit 7046eca.","rollback_reason":"Runtime evidence is invalid for the source change; no conclusion about the accepted-byte fix. Do not tune Continue based on this stale-DLL run.","next_action_hint":"Fix .auto/measure.sh/runtime marker path to build or freshness-check the DLL before deployment, then rerun the same accepted-byte experiment."}}
{"run":241,"commit":"7046eca","metric":1455,"metrics":{"readiness_gate_failures":1,"target_constants_remaining":0,"helpers_missing":0,"fixed_wait_predicates":0,"autoload_static_failures":1,"asset_chain_failures":0,"dll_patch_failures":0,"native_continue_failures":0,"field58_gate_failures":0,"direct_shortcut_failures":0,"input_path_failures":0,"runtime_proof_failures":1,"runtime_mode_failures":0,"eula_popup_failures":0,"save_data_popup_failures":0,"messagebox_dialog_failures":0,"server_status_failures":0,"title_cover_failures":1,"title_cover_penalty":50,"native_trace_blockers":0,"native_trace_hits_total":74,"native_trace_unique_breakpoints":11,"false_positives":0,"runtime_timeout_failures":1,"runtime_title_visual_suppressed_builds":1,"runtime_custom_cover_builds":0,"runtime_simulated_button_presses_total":0},"status":"discard","description":"add runtime DLL rebuild step to measure script (score unchanged)","timestamp":1782438940746,"segment":0,"confidence":null,"asi":{"hypothesis":"The runtime marker path must build the DLL before launching so runtime probes test current source instead of stale target bytes.","observed":"Static metric unchanged, but stale-DLL detection showed this is necessary validation hygiene before the next runtime experiment. .auto files are preserved across discard/revert, so the measure-script change should survive as autoresearch configuration.","rollback_reason":"Primary metric did not improve in this static-only run; treat as non-scoring harness hygiene rather than a product keep.","next_action_hint":"Verify .auto/measure.sh still contains the cargo xwin build in the run_runtime_probe_once branch, then run the runtime marker again."}}
{"run":242,"commit":"7046eca","metric":1455,"metrics":{"readiness_gate_failures":1,"target_constants_remaining":0,"helpers_missing":0,"fixed_wait_predicates":0,"autoload_static_failures":1,"asset_chain_failures":0,"dll_patch_failures":0,"native_continue_failures":0,"field58_gate_failures":0,"direct_shortcut_failures":0,"input_path_failures":0,"runtime_proof_failures":1,"runtime_mode_failures":0,"eula_popup_failures":0,"save_data_popup_failures":0,"messagebox_dialog_failures":0,"server_status_failures":0,"title_cover_failures":1,"title_cover_penalty":50,"native_trace_blockers":0,"native_trace_hits_total":74,"native_trace_unique_breakpoints":11,"false_positives":0,"runtime_timeout_failures":0,"runtime_title_visual_suppressed_builds":1,"runtime_custom_cover_builds":0,"runtime_simulated_button_presses_total":0},"status":"discard","description":"fresh-DLL runtime validated native accept-byte world-stable path but score unchanged","timestamp":1782439103861,"segment":0,"confidence":null,"asi":{"hypothesis":"With a fresh DLL, the product_core open-menu change should use the main-branch native accept-byte path and get past the Continue activation blocker.","observed":"Fresh runtime artifact product-continue-direct-20260625-185600 reached readiness reason world_stable, `title-accept-byte` fired once, product_core logged `armed native title accept byte ... no game-task open_menu self-fire`, LOAD-CORRECTNESS showed Banon level 150, oracle_msgbox_total_builds=0, simulated input stayed 0. It still had idle Continue candidates and continue_phase=0 because the successful path is the main native accept-byte flow, not product_continue submit telemetry.","rollback_reason":"Primary metric unchanged because .auto/measure.sh still classifies this main-native world_stable proof as missing product_submit/result_chain/continue_phase proof; no source rollback needed beyond standard discard semantics.","next_action_hint":"Update the runtime proof scorer to recognize the main-branch native accept-byte chain only when readiness reason is world_stable, title-accept-byte fired, LOAD-CORRECTNESS matches expected save/character, msgbox/server/legal counts are zero, and simulated_button_presses_total=0. Do not count stale visual proof or direct shortcuts."}}
{"run":243,"commit":"35ce57a","metric":1505,"metrics":{"readiness_gate_failures":1,"target_constants_remaining":0,"helpers_missing":0,"fixed_wait_predicates":0,"autoload_static_failures":1,"asset_chain_failures":0,"dll_patch_failures":0,"native_continue_failures":0,"field58_gate_failures":0,"direct_shortcut_failures":0,"input_path_failures":0,"runtime_proof_failures":1,"runtime_mode_failures":0,"eula_popup_failures":0,"save_data_popup_failures":0,"messagebox_dialog_failures":0,"server_status_failures":0,"title_cover_failures":0,"title_cover_penalty":0,"native_trace_blockers":0,"native_trace_hits_total":74,"native_trace_unique_breakpoints":11,"false_positives":0,"runtime_timeout_failures":0,"runtime_title_visual_suppressed_builds":1,"runtime_custom_cover_builds":0,"runtime_simulated_button_presses_total":0},"status":"keep","description":"add non-returned ProfileSelect custom-cover build while preserving native title job","timestamp":1782439445765,"segment":0,"confidence":null,"asi":{"hypothesis":"Part B can be made observable without breaking main-native Continue by constructing 05_010_ProfileSelect into a private stack slot from the BeginTitle hook, while still returning/preserving the native 05_000_Title job.","evidence":"Static RE of ProfileSelect wrapper FUN_14081f7e0 shows it prepares CSScaleformLoadInfo filename 05_010_ProfileSelect and forwards to the MenuWindowJob factory. The source change does not write the BeginTitle out slot; it only records TITLE_CUSTOM_COVER_PROFILE_SELECT_* telemetry.","result":"Static score improved from 1455 to 1505: title_cover_failures and title_cover_penalty dropped to zero. Runtime proof still needs a fresh-DLL run to verify non-returned cover build does not disturb the accepted-byte world_stable path.","next_action_hint":"Run runtime marker with the now-built-in cargo xwin build step. Expected: title_custom_cover_profile_select_builds>0, title-accept-byte fires, world_stable remains true, msgbox/server/legal zero."}}
{"run":244,"commit":"35ce57a","metric":1505,"metrics":{"readiness_gate_failures":1,"target_constants_remaining":0,"helpers_missing":0,"fixed_wait_predicates":0,"autoload_static_failures":1,"asset_chain_failures":0,"dll_patch_failures":0,"native_continue_failures":0,"field58_gate_failures":0,"direct_shortcut_failures":0,"input_path_failures":0,"runtime_proof_failures":1,"runtime_mode_failures":0,"eula_popup_failures":0,"save_data_popup_failures":0,"messagebox_dialog_failures":0,"server_status_failures":0,"title_cover_failures":0,"title_cover_penalty":0,"native_trace_blockers":0,"native_trace_hits_total":74,"native_trace_unique_breakpoints":11,"false_positives":0,"runtime_timeout_failures":0,"runtime_title_visual_suppressed_builds":1,"runtime_custom_cover_builds":1,"runtime_simulated_button_presses_total":0},"status":"discard","description":"fresh-DLL runtime validated non-returned ProfileSelect cover plus accepted-byte load","timestamp":1782439518156,"segment":0,"confidence":null,"asi":{"hypothesis":"The non-returned ProfileSelect cover build should be observable at runtime and preserve the accepted-byte world_stable load path.","observed":"Fresh runtime artifact product-continue-direct-20260625-190417: readiness reason world_stable, world_stable_samples=22, title-cover-part-b built 05_010_ProfileSelect job=0x7fff3e52c3c0, title-accept-byte fired once, product_core logged no game-task open_menu self-fire, LOAD-CORRECTNESS Banon level 150, oracle_msgbox_total_builds=0, oracle_server_status_total_seen=0, simulated_button_presses_total=0.","rollback_reason":"Primary metric unchanged from previous kept static improvement because runtime_proof_failures remains 1; no source rollback needed.","next_action_hint":"Next improve the proof oracle/scorer rather than changing Continue: pass save-slot oracle into runtime watcher and/or add a robust animation/current-player oracle so world_stable native accepted-byte proof satisfies the hard runtime proof without weakening expected-save/animation requirements."}}
{"run":245,"commit":"52f5cd8","metric":1505,"metrics":{"readiness_gate_failures":1,"target_constants_remaining":0,"helpers_missing":0,"fixed_wait_predicates":0,"autoload_static_failures":1,"asset_chain_failures":0,"dll_patch_failures":0,"native_continue_failures":0,"field58_gate_failures":0,"direct_shortcut_failures":0,"input_path_failures":0,"runtime_proof_failures":1,"runtime_mode_failures":0,"eula_popup_failures":0,"save_data_popup_failures":0,"messagebox_dialog_failures":0,"server_status_failures":0,"title_cover_failures":0,"title_cover_penalty":0,"native_trace_blockers":0,"native_trace_hits_total":74,"native_trace_unique_breakpoints":11,"false_positives":0,"runtime_timeout_failures":0,"runtime_title_visual_suppressed_builds":1,"runtime_custom_cover_builds":1,"runtime_simulated_button_presses_total":0},"status":"keep","description":"make native title visual render-unsuppressed a fail-fast semaphore and carry expected save/animation proof","timestamp":1782439748666,"segment":0,"confidence":null,"asi":{"hypothesis":"Turn the native 05_000_Title render-bit semaphore from diagnostic telemetry into a fail-fast runtime condition, and make runtime proof carry expected save + latched expected-animation evidence so accepted-byte world-stable proof can be scored without relaxing constraints.","observed":"Static score unchanged at 1505 because the latest runtime artifact was collected before the new fail-fast/expected-save watcher path. Source now exposes expected_animation_seen in telemetry, er-readiness-watch accepts that latched event for expected_animation_match, and fail-on-title-native-visual returns native_title_visual_render_unsuppressed if native title visual reaches menu/world without render suppression.","result":"Executable guardrail is now in the runtime watcher; next runtime should intentionally fail until render suppression actually clears the native title draw bit. This matches the user's request to make original-logo/native-title visibility crashable rather than diagnostic.","next_action_hint":"Run a fresh runtime marker. If it fails with native_title_visual_render_unsuppressed, fix the render suppression hook/caller/window matching. After native title suppression passes, add the same RAM-semaphore fail-fast for Continue/other menu-row visuals once the row draw-bit/native window field is identified."}}
{"run":246,"commit":"52f5cd8","metric":0,"metrics":{"readiness_gate_failures":1,"target_constants_remaining":0,"helpers_missing":0,"fixed_wait_predicates":0,"autoload_static_failures":1,"asset_chain_failures":0,"dll_patch_failures":0,"native_continue_failures":0,"field58_gate_failures":0,"direct_shortcut_failures":0,"input_path_failures":0,"runtime_proof_failures":1,"runtime_mode_failures":0,"eula_popup_failures":0,"save_data_popup_failures":0,"messagebox_dialog_failures":0,"server_status_failures":0,"title_cover_failures":0,"title_cover_penalty":0,"native_trace_blockers":0,"native_trace_hits_total":74,"native_trace_unique_breakpoints":11,"false_positives":0,"runtime_timeout_failures":0,"runtime_title_visual_suppressed_builds":1,"runtime_custom_cover_builds":1,"runtime_simulated_button_presses_total":0},"status":"crash","description":"fail-fast title-native-visual semaphore correctly stopped unsuppressed native title","timestamp":1782439816067,"segment":0,"confidence":null,"asi":{"hypothesis":"The new native-title visual semaphore should fail the runtime as soon as the preserved 05_000_Title visual reaches menu/world without its draw bit cleared.","observed":"Runtime artifact product-continue-direct-20260625-190919 failed as intended with reason native_title_visual_render_unsuppressed at ~16s. Telemetry: suppressed_builds=1, render_suppress_installed=true, native_window=0x7fff369d5ff0, render_suppressed_windows=0, product_core_last_menu_opened_latch=1, msgbox_total=0. Part B custom cover still built and title-accept-byte fired before teardown.","rollback_reason":"This is an intentional crash-class failure proving the new semaphore works; next work must fix render suppression rather than weakening the guard.","next_action_hint":"Investigate why title_native_menu_visual_window_fadein_hook does not increment. Static-check caller RVA/window source: native_window was eventually 0x7fff369d5ff0, but hook matching caller 0x7ad530 may be wrong or the draw bit is set by a different helper/caller. Add bounded telemetry for FadeIn hook calls or use static disasm around MenuWindowJob::Run/CSMenuMan+0x90 writes."}}
{"run":247,"commit":"95b8916","metric":1505,"metrics":{"readiness_gate_failures":1,"target_constants_remaining":0,"helpers_missing":0,"fixed_wait_predicates":0,"autoload_static_failures":1,"asset_chain_failures":0,"dll_patch_failures":0,"native_continue_failures":0,"field58_gate_failures":0,"direct_shortcut_failures":0,"input_path_failures":0,"runtime_proof_failures":1,"runtime_mode_failures":0,"eula_popup_failures":0,"save_data_popup_failures":0,"messagebox_dialog_failures":0,"server_status_failures":0,"title_cover_failures":0,"title_cover_penalty":0,"native_trace_blockers":0,"native_trace_hits_total":74,"native_trace_unique_breakpoints":11,"false_positives":0,"runtime_timeout_failures":0,"runtime_title_visual_suppressed_builds":1,"runtime_custom_cover_builds":1,"runtime_simulated_button_presses_total":0},"status":"keep","description":"match title render suppression by preserved native window instead of caller RVA","timestamp":1782439905909,"segment":0,"confidence":null,"asi":{"hypothesis":"The render suppressor failed because title_native_menu_visual_window_fadein_hook gated on trace_first_game_caller_rva before comparing the preserved native window pointer; MinHook/trampoline unwinding can hide the direct 0x7ad530 return address.","evidence":"Static disasm of MenuWindowJob::Run confirms the helper call returns at deobf 0x1407ad530 and the helper 0x140744dd0 ORs CSMenuMan+0x90[id] with 3. Runtime failure showed native_window was known and render_suppressed_windows stayed 0, so the hook likely returned before window matching.","result":"The hook now treats caller RVA as telemetry only and gates on the stronger RAM identity: the preserved native MenuWindow pointer from native_job+0x130.","next_action_hint":"Run a fresh runtime marker. Expected: oracle_title_native_menu_visual_render_suppressed_windows increments and the fail-fast native_title_visual_render_unsuppressed condition no longer trips; then address menu-row visual semaphores."}}
{"run":248,"commit":"95b8916","metric":0,"metrics":{"readiness_gate_failures":1,"target_constants_remaining":0,"helpers_missing":0,"fixed_wait_predicates":0,"autoload_static_failures":1,"asset_chain_failures":0,"dll_patch_failures":0,"native_continue_failures":0,"field58_gate_failures":0,"direct_shortcut_failures":0,"input_path_failures":0,"runtime_proof_failures":1,"runtime_mode_failures":0,"eula_popup_failures":0,"save_data_popup_failures":0,"messagebox_dialog_failures":0,"server_status_failures":0,"title_cover_failures":0,"title_cover_penalty":0,"native_trace_blockers":0,"native_trace_hits_total":74,"native_trace_unique_breakpoints":11,"false_positives":0,"runtime_timeout_failures":0,"runtime_title_visual_suppressed_builds":1,"runtime_custom_cover_builds":1,"runtime_simulated_button_presses_total":0},"status":"crash","description":"caller-RVA removal still failed native title visual semaphore before render hook observed","timestamp":1782439972589,"segment":0,"confidence":null,"asi":{"hypothesis":"Removing caller-RVA gating would let the FadeIn helper hook match the preserved native window and clear the title draw bit.","observed":"Runtime artifact product-continue-direct-20260625-191202 still failed with native_title_visual_render_unsuppressed. render_suppressed_windows=0 and render_last_window=0, so the hook body was not observed before the fail-fast condition. native_window became known later from native_job+0x130 and product_core_last_menu_opened_latch=1.","rollback_reason":"No runtime improvement; current fail-fast is too coarse because it treats lack of a suppression event as equivalent to the draw bit being visible before reading the actual CSMenuMan+0x90 flag.","next_action_hint":"Expose a RAM-read telemetry field for the current native title window menu_id and CSMenuMan+0x90 flags, then make the fail-fast condition depend on the draw bit actually being set. That directly implements the user's original-logo-visible semaphore and avoids premature failure before FadeIn helper runs."}}
{"run":249,"commit":"b577ce6","metric":1505,"metrics":{"readiness_gate_failures":1,"target_constants_remaining":0,"helpers_missing":0,"fixed_wait_predicates":0,"autoload_static_failures":1,"asset_chain_failures":0,"dll_patch_failures":0,"native_continue_failures":0,"field58_gate_failures":0,"direct_shortcut_failures":0,"input_path_failures":0,"runtime_proof_failures":1,"runtime_mode_failures":0,"eula_popup_failures":0,"save_data_popup_failures":0,"messagebox_dialog_failures":0,"server_status_failures":0,"title_cover_failures":0,"title_cover_penalty":0,"native_trace_blockers":0,"native_trace_hits_total":74,"native_trace_unique_breakpoints":11,"false_positives":0,"runtime_timeout_failures":0,"runtime_title_visual_suppressed_builds":1,"runtime_custom_cover_builds":1,"runtime_simulated_button_presses_total":0},"status":"keep","description":"make title-native visual fail-fast depend on actual CSMenuMan draw bit","timestamp":1782440090361,"segment":0,"confidence":null,"asi":{"hypothesis":"The fail-fast title visual semaphore should read the actual CSMenuMan draw bit for the preserved native title window rather than fail on absence of a suppression event.","observed":"Telemetry now exports oracle_title_native_menu_visual_current_menu_id/current_flags/current_draw_bit_set by reading native_window+0x180 and CSMenuMan+0x90[menu_id]. The watcher fails only when native title built, render suppress hook installed, native window known, and current_draw_bit_set is true.","result":"Fail-fast semantics now match the user's requested original-logo-visible condition and will not stop merely because the render hook has not run yet.","next_action_hint":"Run a fresh runtime marker. If current_draw_bit_set becomes true, fix suppression; if false and world_stable passes, proceed to add analogous menu-row visual draw-bit semaphores."}}
