{"run":439,"commit":"profile","metric":0,"metrics":{"readiness_gate_failures":0,"target_constants_remaining":0,"helpers_missing":0,"fixed_wait_predicates":0,"autoload_static_failures":0,"asset_chain_failures":0,"dll_patch_failures":0,"native_continue_failures":0,"field58_gate_failures":0,"direct_shortcut_failures":0,"input_path_failures":0,"runtime_proof_failures":0,"runtime_mode_failures":0,"eula_popup_failures":0,"save_data_popup_failures":0,"messagebox_dialog_failures":0,"server_status_failures":0,"title_cover_failures":2,"title_cover_penalty":1700,"native_trace_blockers":0,"native_trace_hits_total":74,"native_trace_unique_breakpoints":11,"false_positives":0},"status":"discard","description":"Bounded 90-tick ProfileSelect canvas still stalls before world proof","timestamp":1782522199131,"segment":2,"confidence":null,"asi":{"hypothesis":"If ProfileSelect stalls only because its MenuWindowJob ticks forever, cap the non-returned canvas to 90 MenuWindowJob::Run calls so it can render briefly during the cover interval and then stop interfering with native load.","rollback_reason":"Runtime artifact /home/banon/projects/er-effects-rs/target/runtime-probe/product-continue-direct-20260626-180153 still timed out before world/player after exactly 90 cover run calls; ProfileSelect MenuWindowJob ticking at all remains unsafe for product proof.","next_action_hint":"Do not use the native ProfileSelect MenuWindowJob state machine. Reuse only its GFX/asset semantics: find the Scaleform child paths/transform needed for the selected dummy face, or build a custom overlay/image from the profile renderer output.","artifact":"/home/banon/projects/er-effects-rs/target/runtime-probe/product-continue-direct-20260626-180153","validation":"cargo fmt; cargo xwin build --release --target x86_64-pc-windows-msvc -q; runtime probe; ./.auto/measure.sh"}}
{"run":440,"commit":"native-","metric":0,"metrics":{"readiness_gate_failures":0,"target_constants_remaining":0,"helpers_missing":0,"fixed_wait_predicates":0,"autoload_static_failures":0,"asset_chain_failures":0,"dll_patch_failures":0,"native_continue_failures":0,"field58_gate_failures":0,"direct_shortcut_failures":0,"input_path_failures":0,"runtime_proof_failures":0,"runtime_mode_failures":0,"eula_popup_failures":0,"save_data_popup_failures":0,"messagebox_dialog_failures":0,"server_status_failures":0,"title_cover_failures":1,"title_cover_penalty":1600,"native_trace_blockers":0,"native_trace_hits_total":74,"native_trace_unique_breakpoints":11,"false_positives":0},"status":"discard","description":"Diagnostic profile texture wrapper object-shape telemetry preserves world proof","timestamp":1782522353795,"segment":2,"confidence":null,"asi":{"hypothesis":"Read-only object-shape telemetry for the native profile texture wrapper can reveal whether the latched CSGxTexture exposes a plausible backing object for a real pixel-copy/render path, without treating that telemetry as product success.","rollback_reason":"Metric unchanged at 0 by design; this was diagnostic-only and not a portrait-render implementation.","next_action_hint":"Runtime artifact /home/banon/projects/er-effects-rs/target/runtime-probe/product-continue-direct-20260626-180441 shows world_stable with gx_texture=0x7fffb22123f0, gx_vtable=0x1432940f0, gx_field18=0x7ffede74bdc0, texture_resource/static object=0x143b405b8, resource_vtable=0x142bdbb38, resource_field10=0x5f9ffb00. Static RE the resource vtable 0x142bdbb38 / CSGxTexture vtable 0x1432940f0 methods next to identify a real copy or dimensions API.","artifact":"/home/banon/projects/er-effects-rs/target/runtime-probe/product-continue-direct-20260626-180441","validation":"cargo fmt; cargo xwin build --release --target x86_64-pc-windows-msvc -q; runtime probe; ./.auto/measure.sh"}}
{"run":441,"commit":"profile","metric":0,"metrics":{"readiness_gate_failures":0,"target_constants_remaining":0,"helpers_missing":0,"fixed_wait_predicates":0,"autoload_static_failures":0,"asset_chain_failures":0,"dll_patch_failures":0,"native_continue_failures":0,"field58_gate_failures":0,"direct_shortcut_failures":0,"input_path_failures":0,"runtime_proof_failures":0,"runtime_mode_failures":0,"eula_popup_failures":0,"save_data_popup_failures":0,"messagebox_dialog_failures":0,"server_status_failures":0,"title_cover_failures":2,"title_cover_penalty":1700,"native_trace_blockers":0,"native_trace_hits_total":74,"native_trace_unique_breakpoints":11,"false_positives":0},"status":"discard","description":"One-tick ProfileSelect canvas preserves world proof but still lacks render oracle","timestamp":1782522527484,"segment":2,"confidence":null,"asi":{"hypothesis":"Run ProfileSelect cover MenuWindowJob exactly once to create/latch the canvas/window without continuing its state machine. This tests whether the user-suggested ProfileSelect canvas can coexist if later crop/scale work avoids repeated native job ticks.","rollback_reason":"Metric unchanged at 0 because no oracle proves actual portrait rendering; installed ProfileSelect canvas remains a false-positive under the current product gate.","next_action_hint":"Promising route: one tick is safe. Runtime artifact /home/banon/projects/er-effects-rs/target/runtime-probe/product-continue-direct-20260626-180732 reached world_stable with ProfileSelect builds=1, run_calls=1, cover_window=0x7fffa0b60f40, systex_hits=10, source_ready=true. Next implement crop/scale/visibility on that latched cover_window/SceneObjProxy without running ProfileSelect again, and add an oracle that proves MENU_DummyProfileFace_01/SYSTEX_Menu_Profile00 is visible during boot interval.","artifact":"/home/banon/projects/er-effects-rs/target/runtime-probe/product-continue-direct-20260626-180732","validation":"cargo fmt; cargo xwin build --release --target x86_64-pc-windows-msvc -q; runtime probe; ./.auto/measure.sh"}}
{"run":442,"commit":"profile","metric":0,"metrics":{"readiness_gate_failures":0,"target_constants_remaining":0,"helpers_missing":0,"fixed_wait_predicates":0,"autoload_static_failures":0,"asset_chain_failures":0,"dll_patch_failures":0,"native_continue_failures":0,"field58_gate_failures":0,"direct_shortcut_failures":0,"input_path_failures":0,"runtime_proof_failures":0,"runtime_mode_failures":0,"eula_popup_failures":0,"save_data_popup_failures":0,"messagebox_dialog_failures":0,"server_status_failures":0,"title_cover_failures":1,"title_cover_penalty":1600,"native_trace_blockers":0,"native_trace_hits_total":74,"native_trace_unique_breakpoints":11,"false_positives":0},"status":"discard","description":"Dummy face is texture-bind symbol, not named child proxy; transform did not apply","timestamp":1782522903647,"segment":2,"confidence":null,"asi":{"hypothesis":"Use the one-tick ProfileSelect canvas, then catch MENU_DummyProfileFace_01 in the named-child bind hook and apply native GFx position/scale while hiding other dummy faces.","rollback_reason":"Runtime artifact /home/banon/projects/er-effects-rs/target/runtime-probe/product-continue-direct-20260626-181335 reached world_stable but dummy-face named-child telemetry stayed zero; debug shows MENU_DummyProfileFace_01 appears only in the Scaleform texture bind observer, not as a SceneObjProxy named child, so the transform hook did not apply.","next_action_hint":"Target the ProfileSelect container path from FUN_1409a2f30 (`ProfileList/ItemList/ItemList/ItemList`) or another actual SceneObjProxy, then translate/scale the container to crop slot0; do not expect MENU_DummyProfileFace_01 to be a named child proxy.","artifact":"/home/banon/projects/er-effects-rs/target/runtime-probe/product-continue-direct-20260626-181335","validation":"cargo fmt; cargo xwin build --release --target x86_64-pc-windows-msvc -q; runtime probe; ./.auto/measure.sh"}}
{"run":443,"commit":"profile","metric":0,"metrics":{"readiness_gate_failures":0,"target_constants_remaining":0,"helpers_missing":0,"fixed_wait_predicates":0,"autoload_static_failures":0,"asset_chain_failures":0,"dll_patch_failures":0,"native_continue_failures":0,"field58_gate_failures":0,"direct_shortcut_failures":0,"input_path_failures":0,"runtime_proof_failures":0,"runtime_mode_failures":0,"eula_popup_failures":0,"save_data_popup_failures":0,"messagebox_dialog_failures":0,"server_status_failures":0,"title_cover_failures":2,"title_cover_penalty":1800,"native_trace_blockers":0,"native_trace_hits_total":74,"native_trace_unique_breakpoints":11,"false_positives":0},"status":"discard","description":"ProfileSelect list-container transform crashed before one-tick cover run","timestamp":1782523141397,"segment":2,"confidence":null,"asi":{"hypothesis":"Target the ProfileSelect container path `ProfileList/ItemList/ItemList/ItemList` as the actual SceneObjProxy and apply native GFx position/scale to crop slot0 after building the one-tick ProfileSelect canvas.","rollback_reason":"Runtime artifact /home/banon/projects/er-effects-rs/target/runtime-probe/product-continue-direct-20260626-181736 exited before ready with access violation at 0x0 around +18.176s, before custom cover run_calls or SYSTEX bind telemetry. The transform path did not log, so the container name is not yet proven safe/live and direct setters are premature.","next_action_hint":"Run observer-only named-child/path telemetry first: record ProfileSelect named-child strings/proxy values during one-tick canvas without SetPosition/SetScale, then choose a proven live proxy/container. Avoid mutating GFx setters until the path is observed.","artifact":"/home/banon/projects/er-effects-rs/target/runtime-probe/product-continue-direct-20260626-181736","crash_log":"/home/banon/projects/er-effects-rs/target/runtime-probe/product-continue-direct-20260626-181736/er-effects-crash-log.txt","validation":"cargo fmt; cargo xwin build --release --target x86_64-pc-windows-msvc -q; runtime probe; ./.auto/measure.sh"}}
{"run":444,"commit":"profile","metric":0,"metrics":{"readiness_gate_failures":0,"target_constants_remaining":0,"helpers_missing":0,"fixed_wait_predicates":0,"autoload_static_failures":0,"asset_chain_failures":0,"dll_patch_failures":0,"native_continue_failures":0,"field58_gate_failures":0,"direct_shortcut_failures":0,"input_path_failures":0,"runtime_proof_failures":0,"runtime_mode_failures":0,"eula_popup_failures":0,"save_data_popup_failures":0,"messagebox_dialog_failures":0,"server_status_failures":0,"title_cover_failures":2,"title_cover_penalty":1700,"native_trace_blockers":0,"native_trace_hits_total":74,"native_trace_unique_breakpoints":11,"false_positives":0},"status":"discard","description":"Observer-only ProfileSelect container logging preserves world proof","timestamp":1782523270747,"segment":2,"confidence":null,"asi":{"hypothesis":"Run ProfileSelect one tick but only observe named-child SceneObjProxy strings and native SYSTEX binds; prove the real container path before mutating GFx transform fields.","rollback_reason":"Diagnostic-only run intentionally did not implement the render oracle or transform, so metric remains 0.","next_action_hint":"Transform only the first observed ProfileSelect container proxy for `ProfileList/ItemList/ItemList/ItemList` after native bind returns; it was observed at +17.365s before SYSTEX bind and world_stable survived. Avoid broad dummy-face names; they are texture-bind symbols only.","artifact":"/home/banon/projects/er-effects-rs/target/runtime-probe/product-continue-direct-20260626-182002","evidence":"debug shows name='ProfileList/ItemList/ItemList/ItemList' parent=0x10f3a0 out_proxy=0x10f210 ret=0x10f210, then MENU_DummyProfileFace_01 -> SYSTEX_Menu_Profile00, then one cover run; readiness reason world_stable.","validation":"cargo fmt; cargo xwin build --release --target x86_64-pc-windows-msvc -q; runtime probe; ./.auto/measure.sh"}}
{"run":445,"commit":"profile","metric":0,"metrics":{"readiness_gate_failures":0,"target_constants_remaining":0,"helpers_missing":0,"fixed_wait_predicates":0,"autoload_static_failures":0,"asset_chain_failures":0,"dll_patch_failures":0,"native_continue_failures":0,"field58_gate_failures":0,"direct_shortcut_failures":0,"input_path_failures":0,"runtime_proof_failures":0,"runtime_mode_failures":0,"eula_popup_failures":0,"save_data_popup_failures":0,"messagebox_dialog_failures":0,"server_status_failures":0,"title_cover_failures":2,"title_cover_penalty":1800,"native_trace_blockers":0,"native_trace_hits_total":74,"native_trace_unique_breakpoints":11,"false_positives":0},"status":"discard","description":"Observed container position/scale setter crashes before cover run","timestamp":1782523516530,"segment":2,"confidence":null,"asi":{"hypothesis":"After observing ProfileList/ItemList/ItemList/ItemList safely, call only GFx value SetPosition/SetScale on out_proxy+0x18 (no proxy SetVisible wrapper) and assert transformed portrait oracle if world proof survives.","rollback_reason":"Runtime artifact /home/banon/projects/er-effects-rs/target/runtime-probe/product-continue-direct-20260626-182423 logged the observed container proxy/value, then process_exited_before_ready before SYSTEX bind/one-tick run. Therefore the direct display-info setter target/ABI is unsafe for this proxy/value shape.","next_action_hint":"Run object-shape observer for the container proxy before any setters: log qwords/flags at out_proxy, out_proxy+0x18, +0x20, +0x28, +0x38 and compare against PressStart proxy/value shape. Use the correct native wrapper or actual CSScaleformValue pointer only after shape is proven.","artifact":"/home/banon/projects/er-effects-rs/target/runtime-probe/product-continue-direct-20260626-182423","validation":"cargo fmt; cargo xwin build --release --target x86_64-pc-windows-msvc -q; runtime probe; ./.auto/measure.sh"}}
{"run":446,"commit":"profile","metric":0,"metrics":{"readiness_gate_failures":0,"target_constants_remaining":0,"helpers_missing":0,"fixed_wait_predicates":0,"autoload_static_failures":0,"asset_chain_failures":0,"dll_patch_failures":0,"native_continue_failures":0,"field58_gate_failures":0,"direct_shortcut_failures":0,"input_path_failures":0,"runtime_proof_failures":0,"runtime_mode_failures":0,"eula_popup_failures":0,"save_data_popup_failures":0,"messagebox_dialog_failures":0,"server_status_failures":0,"title_cover_failures":2,"title_cover_penalty":1700,"native_trace_blockers":0,"native_trace_hits_total":74,"native_trace_unique_breakpoints":11,"false_positives":0},"status":"discard","description":"ProfileSelect object-shape observer identifies correct ScaleformValue receiver","timestamp":1782523644796,"segment":2,"confidence":null,"asi":{"hypothesis":"Log object shape for the observed ProfileSelect container proxy before any setters so the correct GFx receiver can be identified without crashing.","rollback_reason":"Diagnostic-only run intentionally did not implement the transform/oracle, so metric remains 0.","next_action_hint":"Use out_proxy itself, not out_proxy+0x18, as the CSScaleformValue receiver for SetPosition/SetScale. Shape: q00=0x142a94a70 q08=q10=q18=out_proxy, q20=0x7ffe9e52c3d0, q28=0x142a94a58, q38=0x7ffe96a80480. Prior crash was from using out_proxy+0x18 as rcx.","artifact":"/home/banon/projects/er-effects-rs/target/runtime-probe/product-continue-direct-20260626-182612","evidence":"world_stable with one-tick cover; debug shape line logged ProfileList/ItemList/ItemList/ItemList out_proxy=0x10f210 q18=0x10f210 then SYSTEX bind and run_calls=1.","validation":"cargo fmt; cargo xwin build --release --target x86_64-pc-windows-msvc -q; runtime probe; ./.auto/measure.sh"}}
{"run":447,"commit":"profile","metric":0,"metrics":{"readiness_gate_failures":0,"target_constants_remaining":0,"helpers_missing":0,"fixed_wait_predicates":0,"autoload_static_failures":0,"asset_chain_failures":0,"dll_patch_failures":0,"native_continue_failures":0,"field58_gate_failures":0,"direct_shortcut_failures":0,"input_path_failures":0,"runtime_proof_failures":0,"runtime_mode_failures":0,"eula_popup_failures":0,"save_data_popup_failures":0,"messagebox_dialog_failures":0,"server_status_failures":0,"title_cover_failures":2,"title_cover_penalty":1800,"native_trace_blockers":0,"native_trace_hits_total":74,"native_trace_unique_breakpoints":11,"false_positives":0},"status":"discard","description":"ProfileSelect container transform crashes when called in bind hook","timestamp":1782523777541,"segment":2,"confidence":null,"asi":{"hypothesis":"Use the proven correct receiver out_proxy (not out_proxy+0x18) for SetPosition/SetScale in the named-child bind hook, then assert the portrait render oracle if the one-tick cover and world proof survive.","rollback_reason":"Runtime artifact /home/banon/projects/er-effects-rs/target/runtime-probe/product-continue-direct-20260626-182845 logged the out_proxy transform attempt, then exited before ready with no SYSTEX bind or run_calls. The receiver is correct but bind-time setter invocation is still too early/unsafe.","next_action_hint":"Record the ProfileList/ItemList/ItemList/ItemList out_proxy during bind, do not mutate there; defer SetPosition/SetScale until after the one-tick ProfileSelect MenuWindowJob::Run returns, when native init/binds have completed.","artifact":"/home/banon/projects/er-effects-rs/target/runtime-probe/product-continue-direct-20260626-182845","validation":"cargo fmt; cargo xwin build --release --target x86_64-pc-windows-msvc -q; runtime probe; ./.auto/measure.sh"}}
{"run":448,"commit":"1fccd8e","metric":1600,"metrics":{"readiness_gate_failures":0,"target_constants_remaining":0,"helpers_missing":0,"fixed_wait_predicates":0,"autoload_static_failures":0,"asset_chain_failures":0,"dll_patch_failures":0,"native_continue_failures":0,"field58_gate_failures":0,"direct_shortcut_failures":0,"input_path_failures":0,"runtime_proof_failures":0,"runtime_mode_failures":0,"eula_popup_failures":0,"save_data_popup_failures":0,"messagebox_dialog_failures":0,"server_status_failures":0,"title_cover_failures":0,"title_cover_penalty":0,"native_trace_blockers":0,"native_trace_hits_total":74,"native_trace_unique_breakpoints":11,"false_positives":0},"status":"keep","description":"Deferred one-tick ProfileSelect container transform proves loaded-character portrait cover and world-stable zero-input load","timestamp":1782524106711,"segment":2,"confidence":null,"asi":{"hypothesis":"Record the ProfileSelect list container during native bind, run the ProfileSelect MenuWindowJob exactly once, then defer SetPosition/SetScale until after the one-tick run returns. Use the native SYSTEX_Menu_Profile00 bind plus the transformed container as the actual portrait render oracle.","artifact":"/home/banon/projects/er-effects-rs/target/runtime-probe/product-continue-direct-20260626-183356","evidence":"Runtime reached world_stable with Banon/player_present, one ProfileSelect build/run, MENU_DummyProfileFace_01->SYSTEX_Menu_Profile00 hits=10, profile source ready, transform_applied=true, other_hidden=9, loaded_character_portrait_rendered=true, visible_during_boot=true, held_until_loading_takeover=true, title_cover_failures=0, false_positives=0.","validation":"cargo fmt; cargo xwin build --release --target x86_64-pc-windows-msvc -q; .auto/run-portrait-source-probe.sh --autoload-request .auto/autoload-request-direct-slot0.txt; ./.auto/measure.sh","next_action_hint":"No further primary-metric headroom under current 1600 portrait-cover contract. Next useful step is stability rerun/full quality gates or visual observer proof, not score inflation."}}
{"run":449,"commit":"stabili","metric":1600,"metrics":{"readiness_gate_failures":0,"target_constants_remaining":0,"helpers_missing":0,"fixed_wait_predicates":0,"autoload_static_failures":0,"asset_chain_failures":0,"dll_patch_failures":0,"native_continue_failures":0,"field58_gate_failures":0,"direct_shortcut_failures":0,"input_path_failures":0,"runtime_proof_failures":0,"runtime_mode_failures":0,"eula_popup_failures":0,"save_data_popup_failures":0,"messagebox_dialog_failures":0,"server_status_failures":0,"title_cover_failures":0,"title_cover_penalty":0,"native_trace_blockers":0,"native_trace_hits_total":74,"native_trace_unique_breakpoints":11,"false_positives":0},"status":"discard","description":"Unchanged stability check at portrait-cover metric ceiling","timestamp":1782524130185,"segment":2,"confidence":null,"asi":{"hypothesis":"Rerun the unchanged 1600-point portrait-cover scoring contract after the keep to confirm no transient latest-artifact/measure drift.","rollback_reason":"Primary metric was unchanged at the current ceiling; discard is correct under autoresearch policy because there is no improvement headroom.","next_action_hint":"Stop score chasing under this metric. Useful next work is final quality gates/finalization or a separate visual/pixel-observer objective outside the current primary metric.","artifact":"/home/banon/projects/er-effects-rs/target/runtime-probe/product-continue-direct-20260626-183356","validation":"./.auto/measure.sh unchanged stability check"}}
