{"run":494,"commit":"9353857","metric":0,"metrics":{"readiness_gate_failures":0,"target_constants_remaining":0,"helpers_missing":0,"fixed_wait_predicates":0,"autoload_static_failures":0,"asset_chain_failures":0,"dll_patch_failures":0,"native_continue_failures":0,"field58_gate_failures":0,"direct_shortcut_failures":0,"input_path_failures":0,"runtime_proof_failures":0,"runtime_mode_failures":0,"eula_popup_failures":0,"save_data_popup_failures":0,"messagebox_dialog_failures":0,"server_status_failures":0,"title_cover_failures":1,"title_cover_penalty":1600,"native_trace_blockers":0,"native_trace_hits_total":74,"native_trace_unique_breakpoints":11,"false_positives":0,"offline_face_source_ready":1,"removed path_cpu_texture_bridge_ready":1,"offline_face_texture_runtime_drawn":1,"stylized_facedata_pixel_oracle":1},"status":"discard","description":"Fresh runtime reproduces bright FaceData cover secondary oracle from current source","timestamp":1782568812511,"segment":2,"confidence":null,"asi":{"hypothesis":"Reapply the bright FaceData texture source patch and run a fresh removed path-enabled runtime with the aligned secondary oracle, proving stylized_facedata_pixel_oracle=1 comes from current source rather than stale artifact rescoring.","artifact":"/home/banon/projects/er-effects-rs/target/runtime-probe/product-continue-direct-20260627-065854","visual_artifact":"/home/banon/projects/er-effects-rs/target/runtime-probe/product-continue-direct-20260627-065854/logo-replacement-screenshot.jpg","runtime_finding":"Fresh runtime reproduced the visible stylized FaceData cover from current source. Telemetry: offline_face_texture_runtime_drawn=1, stylized_facedata_pixel_oracle=1, false_positives=0. Screenshot visibly shows the large stylized portrait. Analyzer values matched the prior bright artifact: black32_ratio=0.6184227237202032, dark64_ratio=0.6216148886283704; measure prints the secondary-only diagnostic detail and still keeps final product gate active.","validation":"cargo fmt; embedded measure Python py_compile; bash -n .auto/measure.sh; touch .auto/run_runtime_probe_once .auto/enable_removed path_runtime_once; run_experiment ./.auto/measure.sh; read fresh logo-replacement-screenshot.jpg.","rollback_reason":"Primary metric stayed 0 because final oracle_title_portrait_pixels_visible/equivalent real loaded-character portrait proof is still missing. This is a reproducible secondary staging signal, not primary success.","next_action_hint":"Move from stylized FaceData staging to a real portrait/precomputed portrait asset path. A safe next spike is to produce/load an explicit precomputed portrait image derived from the gold save/FaceData and promote only that to a stronger pixel oracle, while preserving the hard native/loaded-character gate distinction."}}
{"run":495,"commit":"9353857","metric":0,"metrics":{"readiness_gate_failures":0,"target_constants_remaining":0,"helpers_missing":0,"fixed_wait_predicates":0,"autoload_static_failures":0,"asset_chain_failures":0,"dll_patch_failures":0,"native_continue_failures":0,"field58_gate_failures":0,"direct_shortcut_failures":0,"input_path_failures":0,"runtime_proof_failures":0,"runtime_mode_failures":0,"eula_popup_failures":0,"save_data_popup_failures":0,"messagebox_dialog_failures":0,"server_status_failures":0,"title_cover_failures":1,"title_cover_penalty":1600,"native_trace_blockers":0,"native_trace_hits_total":74,"native_trace_unique_breakpoints":11,"false_positives":0,"offline_face_source_ready":1,"removed path_cpu_texture_bridge_ready":1,"offline_face_texture_runtime_drawn":1,"stylized_facedata_pixel_oracle":1,"real_portrait_asset_candidates":8,"profile_placeholder_assets_only":0},"status":"discard","description":"Static portrait asset inventory finds ProfileSelect chrome but no final portrait proof","timestamp":1782568997978,"segment":2,"confidence":null,"asi":{"hypothesis":"Inventory FFDEC-exported ProfileSelect/profile-named PNG assets as a possible real/precomputed portrait source before writing any product oracle. Do not promote UI chrome or dummy placeholders to portrait proof.","static_finding":"Measure inventory found 8 profile/face-named PNGs, but the listed files are ProfileSelect UI chrome/surface assets such as MENU_ProfileSelect_Cursor/Base, MENU_ProfileSelect, and MENU_FL_40135_Profile, not a loaded-character portrait image. This confirms the simple filename inventory is too broad and must be refined; it did not identify a real precomputed portrait asset.","validation":"embedded measure Python py_compile; bash -n .auto/measure.sh; run_experiment ./.auto/measure.sh.","rollback_reason":"Primary metric stayed 0; no final portrait pixel/native oracle was implemented. The new secondary inventory metric is misleading as written because it counts ProfileSelect chrome as candidates.","next_action_hint":"Refine the asset inventory to distinguish chrome/surface assets from actual character portrait assets. Count only DummyProfileFace placeholders separately and require a real portrait candidate to be non-dummy, non-cursor/base/chrome, and linked to save/Profile renderer output; otherwise keep real_portrait_asset_candidates=0."}}
{"run":496,"commit":"9353857","metric":0,"metrics":{"readiness_gate_failures":0,"target_constants_remaining":0,"helpers_missing":0,"fixed_wait_predicates":0,"autoload_static_failures":0,"asset_chain_failures":0,"dll_patch_failures":0,"native_continue_failures":0,"field58_gate_failures":0,"direct_shortcut_failures":0,"input_path_failures":0,"runtime_proof_failures":0,"runtime_mode_failures":0,"eula_popup_failures":0,"save_data_popup_failures":0,"messagebox_dialog_failures":0,"server_status_failures":0,"title_cover_failures":1,"title_cover_penalty":1600,"native_trace_blockers":0,"native_trace_hits_total":74,"native_trace_unique_breakpoints":11,"false_positives":0,"offline_face_source_ready":1,"removed path_cpu_texture_bridge_ready":1,"offline_face_texture_runtime_drawn":1,"stylized_facedata_pixel_oracle":1,"real_portrait_asset_candidates":0,"profile_placeholder_assets_only":1},"status":"discard","description":"Refined portrait asset inventory excludes ProfileSelect chrome and counts only placeholders","timestamp":1782569126117,"segment":2,"confidence":null,"asi":{"hypothesis":"Refine the FFDEC portrait asset inventory so it does not count ProfileSelect chrome/surface PNGs as real portrait candidates. Count DummyProfileFace placeholders separately and keep real_portrait_asset_candidates at zero unless a non-dummy, non-chrome, save/profile-linked portrait image exists.","static_finding":"Refined inventory now reports real_portrait_asset_candidates=0 and profile_placeholder_assets_only=1. Detail: only dummy ProfileSelect placeholder face assets found (20 PNGs); excluded 58 ProfileSelect chrome/surface PNGs; no loaded-character/precomputed portrait asset is present in the known FFDEC exports.","validation":"embedded measure Python py_compile; bash -n .auto/measure.sh; run_experiment ./.auto/measure.sh.","rollback_reason":"Primary metric stayed 0. This was a correctness/hygiene improvement to prevent false candidate classification, not a product implementation.","next_action_hint":"Since FFDEC menu exports do not contain a real loaded-character/precomputed portrait, the next primary path should generate or capture a precomputed portrait from save/Profile renderer output, or statically identify a native renderer/readback path, rather than searching menu chrome assets."}}
{"run":497,"commit":"9353857","metric":0,"metrics":{"readiness_gate_failures":0,"target_constants_remaining":0,"helpers_missing":0,"fixed_wait_predicates":0,"autoload_static_failures":0,"asset_chain_failures":0,"dll_patch_failures":0,"native_continue_failures":0,"field58_gate_failures":0,"direct_shortcut_failures":0,"input_path_failures":0,"runtime_proof_failures":0,"runtime_mode_failures":0,"eula_popup_failures":0,"save_data_popup_failures":0,"messagebox_dialog_failures":0,"server_status_failures":0,"title_cover_failures":1,"title_cover_penalty":1600,"native_trace_blockers":0,"native_trace_hits_total":74,"native_trace_unique_breakpoints":11,"false_positives":0,"offline_face_source_ready":1,"removed path_cpu_texture_bridge_ready":1,"offline_face_texture_runtime_drawn":1,"stylized_facedata_pixel_oracle":1,"real_portrait_asset_candidates":0,"profile_placeholder_assets_only":1},"status":"discard","description":"Static RE shows CSGxTexture wrapper delegates to underlying resource, not a direct readback API","timestamp":1782569326515,"segment":2,"confidence":null,"asi":{"hypothesis":"Before implementing a native/readback portrait path, statically inspect the CSEzOffscreenRend/TexResCap/CSGxTexture wrapper path in Ghidra to see whether the existing wrapper exposes a direct CPU readback/copy API.","static_finding":"Ghidra runtime dump: TexResCap ctor 0x140b826a0 allocates CSGxTexture at +0x78. CSGxTexture ctor 0x140b7cf40 sets vtable 0x142b761b0 and stores underlying resource pointers at +0x10/+0x18. Wrapper method 0x140b7cd90 only queries underlying vfuncs +0x40/+0x48/+0x50 for dimensions/state. CSGxTexture reset/bind 0x140b7d310 replaces the underlying pointer. TexResCap update/load 0x140b82c40 calls wrapper vtable +0x90, which is a thunk forwarding to the underlying resource at +0x10, and uses vfuncs +0x28/+0x30/+0x38/+0x40/+0x48/+0x50/+0x68 to compute sizes/state. No direct CPU readback API was identified in these wrapper functions; a readback path likely requires following the underlying resource vtable or using a removed path/native GPU copy/registration path.","validation":"Ghidra decompile 0x140b7cf40, 0x140b7cd90, 0x140b826a0, 0x140b82c40, 0x140b7d310 and vtable-slot callees; run_experiment ./.auto/measure.sh.","rollback_reason":"Primary metric stayed 0; this is static RE triage, not an implementation. No direct wrapper readback shortcut was found.","next_action_hint":"Follow the underlying resource vtable behind CSGxTexture+0x10 for copy/readback/register operations, or implement a removed path backend extension to register an existing native SRV/descriptor. Do not keep looking at CSGxTexture wrapper methods alone for CPU portrait pixels."}}
{"run":498,"commit":"9353857","metric":0,"metrics":{"readiness_gate_failures":0,"target_constants_remaining":0,"helpers_missing":0,"fixed_wait_predicates":0,"autoload_static_failures":0,"asset_chain_failures":0,"dll_patch_failures":0,"native_continue_failures":0,"field58_gate_failures":0,"direct_shortcut_failures":0,"input_path_failures":0,"runtime_proof_failures":0,"runtime_mode_failures":0,"eula_popup_failures":0,"save_data_popup_failures":0,"messagebox_dialog_failures":0,"server_status_failures":0,"title_cover_failures":1,"title_cover_penalty":1600,"native_trace_blockers":0,"native_trace_hits_total":74,"native_trace_unique_breakpoints":11,"false_positives":0,"offline_face_source_ready":1,"removed path_cpu_texture_bridge_ready":1,"offline_face_texture_runtime_drawn":1,"stylized_facedata_pixel_oracle":1,"real_portrait_asset_candidates":0,"profile_placeholder_assets_only":1},"status":"discard","description":"Static RE shows CSOffscreenGxTexture is another delegating wrapper, not the final readback resource","timestamp":1782569501561,"segment":2,"confidence":null,"asi":{"hypothesis":"Follow the underlying resource vtable observed behind CSGxTexture+0x10 (not the outer CSGxTexture wrapper) to look for a direct readback/copy path for profile portrait pixels.","static_finding":"The observed underlying vtable 0x142b80278 is CS::CSOffscreenGxTexture, constructed by 0x140bbe950 and installed by CSEzOffscreenRend ctor 0x140bb6c50. Its slots +0x28/+0x30/+0x38/+0x40/+0x48/+0x50/+0x68 are still thin delegates: each chooses [this+0x18] if present, otherwise [this+0x10], then calls the same offset on that deeper resource. The ctor initializes [this+0x10] from the input texture or SYSTEX_BLACK fallback; [this+0x18] starts null. Therefore 0x142b80278 is another wrapper layer, not a CPU readback API. A real path must identify when/where CSOffscreenGxTexture+0x18 is populated or follow the deeper [this+0x10] resource vtable.","validation":"Ghidra decompile/xrefs for 0x142b80278 slots, constructors 0x140bbe950/0x140bbea80, CSEzOffscreenRend ctor 0x140bb6c50; run_experiment ./.auto/measure.sh.","rollback_reason":"Primary metric stayed 0; this was static RE triage with no implementation. No final portrait pixel oracle was added.","next_action_hint":"Static target: find writers to CSOffscreenGxTexture+0x18 or decompile the functions that render/fill CSEzOffscreenRend buffers. If no writer appears, follow the SYSTEX/runtime resource vtable behind [CSOffscreenGxTexture+0x10] for actual GPU resource registration/copy semantics."}}
{"run":499,"commit":"9353857","metric":0,"metrics":{"readiness_gate_failures":0,"target_constants_remaining":0,"helpers_missing":0,"fixed_wait_predicates":0,"autoload_static_failures":0,"asset_chain_failures":0,"dll_patch_failures":0,"native_continue_failures":0,"field58_gate_failures":0,"direct_shortcut_failures":0,"input_path_failures":0,"runtime_proof_failures":0,"runtime_mode_failures":0,"eula_popup_failures":0,"save_data_popup_failures":0,"messagebox_dialog_failures":0,"server_status_failures":0,"title_cover_failures":1,"title_cover_penalty":1600,"native_trace_blockers":0,"native_trace_hits_total":74,"native_trace_unique_breakpoints":11,"false_positives":0,"offline_face_source_ready":1,"removed path_cpu_texture_bridge_ready":1,"offline_face_texture_runtime_drawn":1,"stylized_facedata_pixel_oracle":1,"real_portrait_asset_candidates":0,"profile_placeholder_assets_only":1},"status":"discard","description":"Offline scan finds no CSOffscreenGxTexture +0x18 writers in texture region","timestamp":1782569712999,"segment":2,"confidence":null,"asi":{"hypothesis":"Find writers to CSOffscreenGxTexture+0x18. If +0x18 is the alternate populated resource path, static scans should find stores to [object+0x18] in the offscreen/texture code region.","static_finding":"Ghidra headless scan was blocked by project locking, so I used an offline Capstone scan of eldenring-deobf.bin for write operands with displacement 0x18 across 0x140bb0000..0x140bc5000 and broader 0x140b70000..0x140bc5000. It found no +0x18 write matches in those regions. Combined with prior Ghidra decompile showing CSOffscreenGxTexture+0x18 starts null and delegate slots fall back to +0x10, this suggests the portrait path probably uses the +0x10/SYSTEX/runtime texture resource rather than a late +0x18 replacement in this code band.","validation":"bd memory recall; Ghidra/MCP decompile from prior step; offline Capstone scan through uv --with capstone; run_experiment ./.auto/measure.sh.","rollback_reason":"Primary metric stayed 0. This was static RE triage, no product implementation or final portrait oracle.","next_action_hint":"Follow the deeper +0x10 resource path instead of +0x18 writers. Next static target: identify the concrete vtable behind the real runtime +0x10 pointer in a representative artifact, then decompile its copy/register/dimension methods or hook telemetry to capture that vtable when nonzero."}}
{"run":500,"commit":"9353857","metric":0,"metrics":{"readiness_gate_failures":0,"target_constants_remaining":0,"helpers_missing":0,"fixed_wait_predicates":0,"autoload_static_failures":0,"asset_chain_failures":0,"dll_patch_failures":0,"native_continue_failures":0,"field58_gate_failures":0,"direct_shortcut_failures":0,"input_path_failures":0,"runtime_proof_failures":0,"runtime_mode_failures":0,"eula_popup_failures":0,"save_data_popup_failures":0,"messagebox_dialog_failures":0,"server_status_failures":0,"title_cover_failures":2,"title_cover_penalty":1800,"native_trace_blockers":0,"native_trace_hits_total":74,"native_trace_unique_breakpoints":11,"false_positives":1,"offline_face_source_ready":1,"removed path_cpu_texture_bridge_ready":1,"offline_face_texture_runtime_drawn":0,"stylized_facedata_pixel_oracle":0,"real_portrait_asset_candidates":0,"profile_placeholder_assets_only":1},"status":"discard","description":"Runtime deep texture telemetry confirms sampled +0x10 points at allocator vtable, not GPU portrait resource","timestamp":1782570070629,"segment":2,"confidence":null,"asi":{"hypothesis":"Add read-only runtime telemetry for gx_texture+0x10/+0x18 and the +0x10 vtable so the concrete deeper resource vtable can be identified from a fresh runtime artifact, then use Ghidra to classify it.","artifact":"/home/banon/projects/er-effects-rs/target/runtime-probe/product-continue-direct-20260627-071925","runtime_finding":"Fresh runtime sampled the profile source: tex_rescap=0x7fff218fbb00, gx_texture=0x7fff322123f0, gx_inner_10=0x143b405b8, gx_inner_18=0x7fffde14bdc0, texture_resource_vtable=0x142bdbb38. Ghidra xrefs classify 0x142bdbb38 as a heap/allocator vtable (slots GetFreeSize/GetMaxSize/GetBlockNumber/GetBlockSize/Allocate/Deallocate), not a GPU texture/readback resource. This confirms the prior warning that 0x143b405b8/0x142bdbb38 is an allocator/static object from mis-following the wrapper, while +0x18 is nonzero at runtime and now looks more promising than the earlier offline write scan implied.","validation":"cargo fmt; measure embedded Python py_compile; bash -n .auto/measure.sh; touch .auto/run_runtime_probe_once .auto/enable_removed path_runtime_once; run_experiment ./.auto/measure.sh; inspect telemetry JSON; Ghidra xrefs-from 0x142bdbb38 slots.","rollback_reason":"Primary metric stayed 0. The added telemetry found that the sampled +0x10 path is not the desired resource; no final portrait pixel oracle was implemented.","next_action_hint":"Pivot to the runtime-nonzero gx_inner_18=0x7fffde14bdc0 path: add/read its vtable in telemetry or statically identify how CSOffscreenGxTexture+0x18 becomes nonzero despite the earlier narrow write scan. Follow that vtable, not 0x142bdbb38."}}
{"run":501,"commit":"9353857","metric":0,"metrics":{"readiness_gate_failures":0,"target_constants_remaining":0,"helpers_missing":0,"fixed_wait_predicates":0,"autoload_static_failures":0,"asset_chain_failures":0,"dll_patch_failures":0,"native_continue_failures":0,"field58_gate_failures":0,"direct_shortcut_failures":0,"input_path_failures":0,"runtime_proof_failures":0,"runtime_mode_failures":0,"eula_popup_failures":0,"save_data_popup_failures":0,"messagebox_dialog_failures":0,"server_status_failures":0,"title_cover_failures":2,"title_cover_penalty":1800,"native_trace_blockers":0,"native_trace_hits_total":74,"native_trace_unique_breakpoints":11,"false_positives":1,"offline_face_source_ready":1,"removed path_cpu_texture_bridge_ready":1,"offline_face_texture_runtime_drawn":0,"stylized_facedata_pixel_oracle":0,"real_portrait_asset_candidates":0,"profile_placeholder_assets_only":1},"status":"discard","description":"Runtime gx_inner_18 vtable resolves to RSResourceFileLoadEventQueue, not portrait GPU resource","timestamp":1782570359110,"segment":2,"confidence":null,"asi":{"hypothesis":"Add read-only telemetry for gx_inner_18_vtable and run a fresh runtime. If gx_inner_18 is the actual resource path, its vtable should classify to a GPU/texture object worth following.","artifact":"/home/banon/projects/er-effects-rs/target/runtime-probe/product-continue-direct-20260627-072402","runtime_finding":"Fresh runtime captured profile source texture fields: gx_inner_10_vtable=0x142bdbb38, gx_inner_18=0x7ffede74bdc0, gx_inner_18_vtable=0x14329e108. Ghidra xrefs classify 0x14329e108 as DLCR2::RSResourceFileLoadEventQueue vtable, with CreateEvent at 0x1426e9bd0 and worker/event-processing functions nearby; it is not a GPU texture/readback resource vtable. Thus both sampled +0x10 and +0x18 paths are not directly usable as portrait texture objects in this telemetry placement.","validation":"cargo fmt; measure embedded Python py_compile; bash -n .auto/measure.sh; touch .auto/run_runtime_probe_once .auto/enable_removed path_runtime_once; run_experiment ./.auto/measure.sh; inspect er-effects-telemetry.json; Ghidra xrefs/decompile for vtable 0x14329e108.","rollback_reason":"Primary metric stayed 0. This was read-only telemetry/static classification and did not implement final portrait pixel proof.","next_action_hint":"The current overlay sampler is still following the wrong object layer. Next static target should inspect CSMenuProfModelRend/CSEzOffscreenRend fields and the code that writes renderer+0xa8/offscreen+0x10 to identify the actual profile render target object, rather than reading CSGxTexture wrapper internals at fixed +0x10/+0x18 offsets."}}
