{"run":176,"commit":"2100051","metric":1520,"metrics":{"readiness_gate_failures":0,"target_constants_remaining":0,"helpers_missing":0,"fixed_wait_predicates":0,"autoload_static_failures":0,"asset_chain_failures":0,"dll_patch_failures":0,"native_continue_failures":0,"field58_gate_failures":0,"direct_shortcut_failures":0,"input_path_failures":0,"runtime_proof_failures":1,"runtime_mode_failures":0,"eula_popup_failures":0,"save_data_popup_failures":0,"messagebox_dialog_failures":0,"server_status_failures":0,"title_cover_failures":0,"title_cover_penalty":0,"native_trace_blockers":0,"native_trace_hits_total":74,"native_trace_unique_breakpoints":11,"false_positives":0,"runtime_timeout_failures":0,"runtime_title_visual_suppressed_builds":1,"runtime_custom_cover_builds":1,"runtime_simulated_button_presses_total":0},"status":"discard","description":"static classified field1_0xa38 as GridControl registration","timestamp":1782416698398,"segment":0,"confidence":null,"asi":{"hypothesis":"Decoding field1_0xa38 list-control setup/update would reveal selected/active row behavior or a vtable path to the selection state.","rollback_reason":"Primary metric remained 1520, equal to the persisted best, and runtime_proof_failures remains 1. Static decode classified control registration but did not produce product/runtime proof.","next_action_hint":"Identify/decode CS::GridControl::vftable slots, especially +0x18 and update/navigation/submit slots, or add a passive runtime hook after GenericListSelectDialog construction logging GridControl fields plus row vector first entry. Do not treat field1_0xa38 registration as selection proof and do not cold-call GridControl/MenuWindow methods.","static_finding_key":"autoload-genericlist-field-a38-gridcontrol-registration-2026-06-25","evidence":"FUN_140735b90 sets field1_0xa38 vtables to DLUT::DLReferenceCountObject -> CS::SceneObjModifier -> CS::GridControl, initializes control fields and arrow components. FUN_14077f020 calls vtable+0x18 then FUN_140733ff0; FUN_140733ff0 just calls FUN_1407340e0, which appends the GridControl pointer to MenuWindow.field_0x50 fixed vector and increments +0x48 count."}}
{"run":177,"commit":"2100051","metric":1520,"metrics":{"readiness_gate_failures":0,"target_constants_remaining":0,"helpers_missing":0,"fixed_wait_predicates":0,"autoload_static_failures":0,"asset_chain_failures":0,"dll_patch_failures":0,"native_continue_failures":0,"field58_gate_failures":0,"direct_shortcut_failures":0,"input_path_failures":0,"runtime_proof_failures":1,"runtime_mode_failures":0,"eula_popup_failures":0,"save_data_popup_failures":0,"messagebox_dialog_failures":0,"server_status_failures":0,"title_cover_failures":0,"title_cover_penalty":0,"native_trace_blockers":0,"native_trace_hits_total":74,"native_trace_unique_breakpoints":11,"false_positives":0,"runtime_timeout_failures":0,"runtime_title_visual_suppressed_builds":1,"runtime_custom_cover_builds":1,"runtime_simulated_button_presses_total":0},"status":"discard","description":"static decoded GridControl vtable slot18 as render setup not selection","timestamp":1782417063991,"segment":0,"confidence":null,"asi":{"hypothesis":"Identifying/decode CS::GridControl::vftable slots, especially +0x18, would reveal whether field1_0xa38 setup exposes selected/active row behavior.","rollback_reason":"Primary metric remained 1520, equal to the persisted best, and runtime_proof_failures remains 1. Static decode corrected the vtable slot role but did not add runtime/product proof.","next_action_hint":"Decode MenuWindow/CommandSelectDialog Run path around FUN_1407ad070 / Run 0x1407ad2b0 and row callback invocation, or add passive runtime telemetry for first row vtable/docall when the CommandList is constructed. Do not cold-call GridControl slots or treat +0x18 as selection proof.","static_finding_key":"autoload-gridcontrol-vtable-slot18-render-not-selection-2026-06-25","evidence":"CS::GridControl::vftable dump 0x142a913b8: slots [0]=0x1407343b0, [1]=0x140736820, [2]=0x1407393f0, [3]=0x140737d60 (+0x18), [4]=0x14073b4e0, then strings/data. Slot +0x18 updates ScrollGuide_UpArrow/DownArrow, BaseChangeDstSelectDialog/Scaleform state around 0x358/0x3c0/0x490/0x698. Slot [4] only sets byte [grid+0x7c5]=1. Temporary helper scripts/ghidra/FindSymbolsByName.java was used for bounded symbol lookup and should be reverted by discard."}}
{"run":178,"commit":"2100051","metric":1520,"metrics":{"readiness_gate_failures":0,"target_constants_remaining":0,"helpers_missing":0,"fixed_wait_predicates":0,"autoload_static_failures":0,"asset_chain_failures":0,"dll_patch_failures":0,"native_continue_failures":0,"field58_gate_failures":0,"direct_shortcut_failures":0,"input_path_failures":0,"runtime_proof_failures":1,"runtime_mode_failures":0,"eula_popup_failures":0,"save_data_popup_failures":0,"messagebox_dialog_failures":0,"server_status_failures":0,"title_cover_failures":0,"title_cover_penalty":0,"native_trace_blockers":0,"native_trace_hits_total":74,"native_trace_unique_breakpoints":11,"false_positives":0,"runtime_timeout_failures":0,"runtime_title_visual_suppressed_builds":1,"runtime_custom_cover_builds":1,"runtime_simulated_button_presses_total":0},"status":"discard","description":"static tied MenuWindowJob Run to field254 result propagation","timestamp":1782417340827,"segment":0,"confidence":null,"asi":{"hypothesis":"Decoding MenuWindow/CommandSelectDialog Run path around FUN_1407ad070 / Run 0x1407ad2b0 would identify selected-row callback invocation or the result propagation edge to instrument passively.","rollback_reason":"Primary metric remained 1520, equal to the persisted best, and runtime_proof_failures remains 1. Static decode found the result propagation edge but not the callback writer/product runtime proof.","next_action_hint":"Decode the owning MenuWindow/CommandSelectDialog virtual +0x18 path used by FUN_140744ed0 and the vtable +0x60 result setter/row callback path that writes field254_0x1e8; this should identify the selected-row callback invocation that leads to lambda_896b/Continue. Product-safe instrumentation should passively observe field254 after FUN_140744ed0/Run, not cold-call row builders.","static_finding_key":"autoload-menuwindowjob-run-propagates-field254-result-2026-06-25","evidence":"CS::MenuWindowJob::Run 0x1407ad2b0 calls FUN_140744ed0(owningMenuWindow), FUN_140733ff0(field2_0x50), then reads owningMenuWindow->field254_0x1e8 and calls MenuJobResult::ShouldContinue. If true it destructs the job and copies field254 to loadParams->jobResult; else it sets Continue. FUN_140744ed0 is visual/pump/CSMenuMan marking, and FUN_1407ac980 is a generic Failed-result vtable+0x60 helper."}}
{"run":179,"commit":"2100051","metric":1520,"metrics":{"readiness_gate_failures":0,"target_constants_remaining":0,"helpers_missing":0,"fixed_wait_predicates":0,"autoload_static_failures":0,"asset_chain_failures":0,"dll_patch_failures":0,"native_continue_failures":0,"field58_gate_failures":0,"direct_shortcut_failures":0,"input_path_failures":0,"runtime_proof_failures":1,"runtime_mode_failures":0,"eula_popup_failures":0,"save_data_popup_failures":0,"messagebox_dialog_failures":0,"server_status_failures":0,"title_cover_failures":0,"title_cover_penalty":0,"native_trace_blockers":0,"native_trace_hits_total":74,"native_trace_unique_breakpoints":11,"false_positives":0,"runtime_timeout_failures":0,"runtime_title_visual_suppressed_builds":1,"runtime_custom_cover_builds":1,"runtime_simulated_button_presses_total":0},"status":"discard","description":"static refined MenuWindow vtable60 as queued fadeout/result path","timestamp":1782417624474,"segment":0,"confidence":null,"asi":{"hypothesis":"Decoding the owning MenuWindow/CommandSelectDialog virtual +0x18 path used by FUN_140744ed0 and the vtable +0x60 result setter should identify the selected-row callback invocation that leads to lambda_896b/Continue.","rollback_reason":"Primary metric remained 1520, equal to the persisted best, and runtime_proof_failures remains 1. Static decode refined the result path but did not add product/runtime proof.","next_action_hint":"Decode/decompile the real function at deobf 0x140746a00, whose Ghidra boundary is currently wrong, and the lambda vtable 0x142a93ea0 invoke/copy slots; or add a passive runtime oracle at +0x60 that logs [this+0x3b0], field254 before/after, and whether lambda_896b/Continue result appears. Do not cold-call +0x60, 0x140746a00, or row builders.","static_finding_key":"autoload-menuwindow-vtable60-queues-result-fadeout-2026-06-25","evidence":"Raw deobf disasm shows 0x140746e80 is a real function entry despite Ghidra merging it into FUN_140746b00. It checks [this+0x3b0], calls vtable +0x18 and FUN_140749960/FUN_140814ed0, resets sequence at this+0x10 via FUN_1407a92f0, constructs std::function vtable 0x142a93ea0, calls 0x140746a00(this,&function), then sets [this+0x3b0]=1. FUN_1409abd80 installs Continue row lambda_896b via FUN_1407448b0 with text id 0x61f95."}}
{"run":180,"commit":"2100051","metric":1520,"metrics":{"readiness_gate_failures":0,"target_constants_remaining":0,"helpers_missing":0,"fixed_wait_predicates":0,"autoload_static_failures":0,"asset_chain_failures":0,"dll_patch_failures":0,"native_continue_failures":0,"field58_gate_failures":0,"direct_shortcut_failures":0,"input_path_failures":0,"runtime_proof_failures":1,"runtime_mode_failures":0,"eula_popup_failures":0,"save_data_popup_failures":0,"messagebox_dialog_failures":0,"server_status_failures":0,"title_cover_failures":0,"title_cover_penalty":0,"native_trace_blockers":0,"native_trace_hits_total":74,"native_trace_unique_breakpoints":11,"false_positives":0,"runtime_timeout_failures":0,"runtime_title_visual_suppressed_builds":1,"runtime_custom_cover_builds":1,"runtime_simulated_button_presses_total":0},"status":"discard","description":"static decoded queued lambda_ab77 field254 result setter","timestamp":1782417876218,"segment":0,"confidence":null,"asi":{"hypothesis":"Decode/decompile the real function at deobf 0x140746a00 and lambda vtable 0x142a93ea0 invoke/copy slots to identify the queued result writer behind MenuWindow vtable +0x60.","rollback_reason":"Primary metric remained 1520, equal to the persisted best, and runtime_proof_failures remains 1. Static decode found the queued field254 writer but did not add runtime/product proof.","next_action_hint":"Add/enable passive telemetry at 0x140746a30 or 0x140746e80 under preserved native title, logging captured MenuWindow pointer/result and field254 before/after, to prove whether selected row is Continue/lambda_896b before trying render suppression changes. Do not cold-call 0x140746a30, 0x140746e80, 0x140746a00, or row builders.","static_finding_key":"autoload-menuwindow-queued-lambda-writes-field254-2026-06-25","evidence":"VtableDump 0x142a93ea0: [1]=0x1407473c0 clone/copy, [2]=0x140746a30 Do_call, [3]=0x1407481c0 RTTI, [4]=0x140746690 dtor, [5]=0x140747100 helper. Decompile of 0x140746a30 writes *(u64 *)(*(u64 *)(fn+8)+0x1e8)=*(u64 *)(fn+0x10), i.e. captured MenuJobResult into captured MenuWindow field254. Disasm 0x140746e80 constructs vtable 0x142a93ea0 function and calls 0x140746a00; 0x140746a00 composes fade/disabled jobs and installs sequence into this+0x10 via 0x1407a9250."}}
{"run":181,"commit":"2100051","metric":1520,"metrics":{"readiness_gate_failures":0,"target_constants_remaining":0,"helpers_missing":0,"fixed_wait_predicates":0,"autoload_static_failures":0,"asset_chain_failures":0,"dll_patch_failures":0,"native_continue_failures":0,"field58_gate_failures":0,"direct_shortcut_failures":0,"input_path_failures":0,"runtime_proof_failures":1,"runtime_mode_failures":0,"eula_popup_failures":0,"save_data_popup_failures":0,"messagebox_dialog_failures":0,"server_status_failures":0,"title_cover_failures":0,"title_cover_penalty":0,"native_trace_blockers":0,"native_trace_hits_total":74,"native_trace_unique_breakpoints":11,"false_positives":0,"runtime_timeout_failures":0,"runtime_title_visual_suppressed_builds":1,"runtime_custom_cover_builds":1,"runtime_simulated_button_presses_total":0},"status":"discard","description":"added passive 746a30 field254 writer telemetry hook","timestamp":1782418280909,"segment":0,"confidence":null,"asi":{"hypothesis":"Add/enable passive telemetry at 0x140746a30 under preserved native title, logging captured MenuWindow pointer/result and field254 before/after, to prove whether selected row is Continue/lambda_896b without cold-calling any row builders or result functions.","rollback_reason":"Primary metric remained 1520, equal to the persisted best, and runtime_proof_failures remains 1. The diagnostic hook was compile-format clean but only adds runtime observability; no runtime proof was collected in this static measure iteration, so the code change was not kept.","next_action_hint":"If pursuing this path, run a bounded runtime probe with the 0x140746a30 telemetry hook enabled and preserved native title, then inspect oracle_result_action_field254_writer_hits/last_result plus continue trace lines. If runtime remains unavailable, statically decode which result value lambda_896b should capture before 746a30 fires.","validation":"cargo fmt was required and completed; .auto/measure.sh passed with false_positives=0.","changed_files":"src/constants.rs, src/experiments/trace.rs, src/telemetry.rs","telemetry_added":"RESULT_ACTION_FIELD254_WRITER_ORIG/HITS/LAST_FUNCTION/LAST_WINDOW/LAST_RESULT/LAST_BEFORE/LAST_AFTER; hook result_action_field254_writer_746a30; telemetry JSON oracle_result_action_field254_* fields.","evidence":"Hook was installed in install_continue_trace_hooks after result_action_builder_746a00. Detour reads fn+0x8 captured MenuWindow, fn+0x10 captured MenuJobResult, MenuWindow+0x1e8 before/after, calls original via RESULT_ACTION_FIELD254_WRITER_ORIG, and appends continue-trace ENTER/LEAVE lines. This is pass-through and does not invoke native code cold."}}
{"run":182,"commit":"2100051","metric":1520,"metrics":{"readiness_gate_failures":0,"target_constants_remaining":0,"helpers_missing":0,"fixed_wait_predicates":0,"autoload_static_failures":0,"asset_chain_failures":0,"dll_patch_failures":0,"native_continue_failures":0,"field58_gate_failures":0,"direct_shortcut_failures":0,"input_path_failures":0,"runtime_proof_failures":1,"runtime_mode_failures":0,"eula_popup_failures":0,"save_data_popup_failures":0,"messagebox_dialog_failures":0,"server_status_failures":0,"title_cover_failures":0,"title_cover_penalty":0,"native_trace_blockers":0,"native_trace_hits_total":74,"native_trace_unique_breakpoints":11,"false_positives":0,"runtime_timeout_failures":0,"runtime_title_visual_suppressed_builds":1,"runtime_custom_cover_builds":1,"runtime_simulated_button_presses_total":0},"status":"discard","description":"static decoded CommandSelectDialog selected-row activation chain","timestamp":1782418662301,"segment":0,"confidence":null,"asi":{"hypothesis":"Decoding the selected-row activation builder downstream of FUN_1407448b0 should reveal how a CommandSelectDialog row entry becomes the MenuWindowJob/result path that eventually writes field254, without cold-calling native builders.","rollback_reason":"Primary metric remained 1520, equal to the persisted best, and runtime_proof_failures remains 1. Static RE clarified the activation chain but did not add runtime/product proof.","next_action_hint":"Decode FUN_14078fdb0 / GenericListSelectDialog state update to prove the selected runtime index, or run a bounded preserved-native runtime probe with 0x140746a30/0x140746e80 telemetry. Do not cold-call FUN_14078d860, FUN_1407ac9b0, FUN_1407448b0, or row builders.","static_finding_key":"autoload-commandselect-selected-row-activation-chain-2026-06-25","evidence":"FUN_1407448b0 appends 0x210-byte rows into container param_1+0x28 through FUN_140748960. FUN_14078d860 snapshots list config, builds row/list data via FUN_14078b2c0, then calls FUN_1407ac9b0(&out, *(param_1+0x10a0), row_data) and clones the returned job. FUN_1407ac9b0 allocates a 0x138 MenuWindowJob, installs vtable/control getter FUN_1407ad900, and copies row/list payload into job fields."}}
{"run":183,"commit":"2100051","metric":1520,"metrics":{"readiness_gate_failures":0,"target_constants_remaining":0,"helpers_missing":0,"fixed_wait_predicates":0,"autoload_static_failures":0,"asset_chain_failures":0,"dll_patch_failures":0,"native_continue_failures":0,"field58_gate_failures":0,"direct_shortcut_failures":0,"input_path_failures":0,"runtime_proof_failures":1,"runtime_mode_failures":0,"eula_popup_failures":0,"save_data_popup_failures":0,"messagebox_dialog_failures":0,"server_status_failures":0,"title_cover_failures":0,"title_cover_penalty":0,"native_trace_blockers":0,"native_trace_hits_total":74,"native_trace_unique_breakpoints":11,"false_positives":0,"runtime_timeout_failures":0,"runtime_title_visual_suppressed_builds":1,"runtime_custom_cover_builds":1,"runtime_simulated_button_presses_total":0},"status":"discard","description":"static corrected 78fdb0 as render setup not selected-index proof","timestamp":1782418801167,"segment":0,"confidence":null,"asi":{"hypothesis":"Decoding FUN_14078fdb0 / GenericListSelectDialog state update should prove the selected runtime index for CommandSelectDialog rows, or identify that the selection path lives elsewhere.","rollback_reason":"Primary metric remained 1520, equal to the persisted best, and runtime_proof_failures remains 1. Static decode corrected a false lead but did not add runtime/product proof.","next_action_hint":"Do not treat FUN_14078fdb0 as selected-index proof. Decode the actual GenericList runtime/update/submit vtable path, or run a bounded preserved-native runtime probe with passive 0x140746a30/0x140746e80 telemetry. Do not cold-call row builders.","static_finding_key":"autoload-genericlist-78fdb0-render-not-selected-index-2026-06-25","evidence":"FUN_14078fdb0 decompile is dominated by visual/safe-area/Scaleform setup (FUN_14078d570, SafeArea, FUN_1407332a0, FUN_14074bc40, FUN_14074bbd0, FUN_140d82b00) and fields 0x870/0x874. ScanDispWrite over 0x140780000..0x140792000 for 0x10a0/0x1098/0x109a/0x10e0/0xa78/0xa88/0x28 found no direct writes."}}
{"run":184,"commit":"2100051","metric":0,"metrics":{"readiness_gate_failures":0,"target_constants_remaining":0,"helpers_missing":0,"fixed_wait_predicates":0,"autoload_static_failures":0,"asset_chain_failures":0,"dll_patch_failures":0,"native_continue_failures":0,"field58_gate_failures":0,"direct_shortcut_failures":0,"input_path_failures":0,"runtime_proof_failures":1,"runtime_mode_failures":0,"eula_popup_failures":0,"save_data_popup_failures":0,"messagebox_dialog_failures":0,"server_status_failures":0,"title_cover_failures":0,"title_cover_penalty":0,"native_trace_blockers":0,"native_trace_hits_total":74,"native_trace_unique_breakpoints":11,"false_positives":0,"runtime_timeout_failures":1,"runtime_title_visual_suppressed_builds":1,"runtime_custom_cover_builds":1,"runtime_simulated_button_presses_total":0},"status":"crash","description":"runtime probe with passive 746a30 field254 telemetry timed out during launch/setup","timestamp":1782419184077,"segment":0,"confidence":null,"asi":{"hypothesis":"A bounded runtime probe with passive 0x140746a30 field254-writer telemetry enabled under preserved native title would show whether the native selected row reaches Continue/lambda_896b without cold-calling row builders.","rollback_reason":"run_experiment timed out after runtime launch/setup output before METRIC lines, so the primary metric is 0/crash. Exact post-timeout check found no eldenring.exe process, but an attempted exact protected-game cleanup scan was blocked by a guard false positive.","next_action_hint":"Before another runtime attempt, inspect target/runtime-probe/product-continue-direct-20260625-132336 partial artifacts for whether the DLL loaded and whether cleanup finished; fix or route around the guard false positive via issue er-effects-rs-9iz rather than embedding forbidden process-name cleanup text. If runtime setup remains too slow, avoid full runtime and keep static RE or prebuild/deploy outside the 45s measure window.","validation":"Steam was verified running with pgrep -x steam. .auto/run_runtime_probe_once was armed separately, then run_experiment ran exactly ./.auto/measure.sh. Post-timeout pgrep -x eldenring.exe returned no process.","guard_blocker_issue":"er-effects-rs-9iz","artifact_dir":"/home/banon/projects/er-effects-rs/target/runtime-probe/product-continue-direct-20260625-132336","telemetry_attempted":"Temporary code added RESULT_ACTION_FIELD254_WRITER_ORIG/HITS/LAST_FUNCTION/LAST_WINDOW/LAST_RESULT/LAST_BEFORE/LAST_AFTER, hook result_action_field254_writer_746a30, and telemetry JSON oracle_result_action_field254_* fields; log_experiment crash should revert these changes.","error_detail":"run_experiment output timed out after deploy/save-source/graphics-config/render setup lines; no METRIC lines were emitted."}}
