{"run":359,"commit":"cd60680","metric":1160,"metrics":{"readiness_gate_failures":0,"target_constants_remaining":0,"helpers_missing":0,"fixed_wait_predicates":0,"autoload_static_failures":0,"asset_chain_failures":0,"dll_patch_failures":0,"native_continue_failures":0,"field58_gate_failures":0,"direct_shortcut_failures":0,"input_path_failures":0,"runtime_proof_failures":1,"runtime_mode_failures":0,"eula_popup_failures":0,"save_data_popup_failures":1,"messagebox_dialog_failures":0,"server_status_failures":0,"title_cover_failures":1,"title_cover_penalty":200,"native_trace_blockers":0,"native_trace_hits_total":74,"native_trace_unique_breakpoints":11,"false_positives":0,"runtime_timeout_failures":0,"runtime_title_visual_suppressed_builds":0,"runtime_custom_cover_builds":0,"runtime_simulated_button_presses_total":0},"status":"discard","description":"Gate title-cover visual mutations behind opt-in to replay best feature state; static score unchanged","timestamp":1782489714680,"segment":0,"confidence":null,"asi":{"hypothesis":"Feature rollback/replay: default-disable post-best title-cover visual mutations (PressStart hide, title-logo hide, profile-cover refresh) behind ER_EFFECTS_ENABLE_TITLE_COVER_MUTATIONS=1 while keeping the semaphores/telemetry. This moves runtime behavior closer to the last 1520-scoring feature state without deleting diagnostics.","validation":"cargo check -p er-soulsformats -p er-param-inspect OK; bash -n scripts/run-product-continue-direct-probe.sh OK; .auto/measure.sh passed but metric remained 1160.","rollback_reason":"Primary metric did not improve, and no runtime proof was collected showing this rollback recovers the product path. Per autoresearch rules unchanged primary metric is discard.","next_action_hint":"If pursuing this rollback, run a bounded runtime outside run_experiment after rebuilding the DLL, then measure through .auto/measure.sh. Otherwise inspect additional diffs after 2100051, especially title accept/open-menu and save path behavior, and avoid keeping static-only rollback gates without score or runtime improvement.","not_cheating_note":"The attempted gate did not weaken benchmark scoring or semaphores; discard reverts it because it was not yet proven."}}
{"run":360,"commit":"cd60680","metric":800,"metrics":{"readiness_gate_failures":0,"target_constants_remaining":0,"helpers_missing":0,"fixed_wait_predicates":0,"autoload_static_failures":0,"asset_chain_failures":0,"dll_patch_failures":0,"native_continue_failures":0,"field58_gate_failures":0,"direct_shortcut_failures":0,"input_path_failures":0,"runtime_proof_failures":1,"runtime_mode_failures":0,"eula_popup_failures":0,"save_data_popup_failures":2,"messagebox_dialog_failures":0,"server_status_failures":0,"title_cover_failures":2,"title_cover_penalty":400,"native_trace_blockers":0,"native_trace_hits_total":74,"native_trace_unique_breakpoints":11,"false_positives":0,"runtime_timeout_failures":0,"runtime_title_visual_suppressed_builds":0,"runtime_custom_cover_builds":0,"runtime_simulated_button_presses_total":0},"status":"discard","description":"Runtime-test title visual mutation opt-in rollback; still hits TFC version-zero 401106","timestamp":1782489841621,"segment":0,"confidence":null,"asi":{"hypothesis":"Runtime-test the feature rollback/replay patch from #359 after rebuilding the Windows DLL: default-disable product-core title visual mutations while preserving semaphores, to see whether the 1520-era behavior recovers with current fail-fast guards.","runtime_artifact":"/home/banon/projects/er-effects-rs/target/runtime-probe/product-continue-direct-20260626-090245","observed_ready":false,"observed_readiness_reason":"native_corrupted_save_detected","observed_corrupted_save_id":401106,"observed_tfc_regulation_version":0,"observed_regulation_manager_version":11611000,"observed_char_name":"","observed_zero_input":true,"observed_profile_refresh_calls":0,"observed_title_logo_hidden":true,"observed_press_start_hidden":true,"finding":"The rollback gate was too narrow: the runtime log still shows earlier title-cover startup hooks active (TitleBackViewParts SetVisible/ctor, PAB/TitleInformation wrapper, BeginTitle wrapper), and 401106 still fires with TFC version 0. Product-core visual mutation calls are not the sole regression source.","rollback_reason":"Primary metric fell to 800; runtime still hit native_corrupted_save_detected and added a latest-runtime artifact penalty.","next_action_hint":"Clean this diagnostic artifact. If continuing feature rollback, gate or revert the earlier startup_hooks title-cover installations (BeginTitle/PAB/TitleBackView hooks) while keeping the corrupted-save/messagebox semaphores, then runtime-test again. Do not keep the product-core-only gate.","not_cheating_note":"No benchmark predicate was weakened; the rollback was tested through runtime evidence and discarded on failure."}}
{"run":361,"commit":"2bbcdda","metric":1160,"metrics":{"readiness_gate_failures":0,"target_constants_remaining":0,"helpers_missing":0,"fixed_wait_predicates":0,"autoload_static_failures":0,"asset_chain_failures":0,"dll_patch_failures":0,"native_continue_failures":0,"field58_gate_failures":0,"direct_shortcut_failures":0,"input_path_failures":0,"runtime_proof_failures":1,"runtime_mode_failures":0,"eula_popup_failures":0,"save_data_popup_failures":1,"messagebox_dialog_failures":0,"server_status_failures":0,"title_cover_failures":1,"title_cover_penalty":200,"native_trace_blockers":0,"native_trace_hits_total":74,"native_trace_unique_breakpoints":11,"false_positives":0,"runtime_timeout_failures":0,"runtime_title_visual_suppressed_builds":0,"runtime_custom_cover_builds":0,"runtime_simulated_button_presses_total":0},"status":"keep","description":"Remove discarded rollback runtime artifact from scored latest set","timestamp":1782489894762,"segment":0,"confidence":null,"asi":{"hypothesis":"Run #360's rollback runtime artifact was diagnostic and preserved in ASI. Leaving it as latest scoring evidence double-counts a known-discarded native_corrupted_save_detected failure and title-cover miss.","removed_artifact":"/home/banon/projects/er-effects-rs/target/runtime-probe/product-continue-direct-20260626-090245","evidence_preserved_in_run":"#360 ASI records that the product-core-only rollback was too narrow: earlier startup_hooks title-cover hooks still fired, TFC regulationVersion remained 0, manager version 11611000, and native 401106 still triggered.","next_action_hint":"Continue feature rollback by targeting earlier startup_hooks title-cover installations (BeginTitle/PAB/TitleBackView) while preserving the corrupted-save/messagebox semaphores; or static-RE the TFC+0x148 initializer.","not_cheating_note":"Removed only a discarded diagnostic runtime artifact from scoring; no product or benchmark predicate was weakened."}}
{"run":362,"commit":"2bbcdda","metric":800,"metrics":{"readiness_gate_failures":0,"target_constants_remaining":0,"helpers_missing":0,"fixed_wait_predicates":0,"autoload_static_failures":0,"asset_chain_failures":0,"dll_patch_failures":0,"native_continue_failures":0,"field58_gate_failures":0,"direct_shortcut_failures":0,"input_path_failures":0,"runtime_proof_failures":1,"runtime_mode_failures":0,"eula_popup_failures":0,"save_data_popup_failures":2,"messagebox_dialog_failures":0,"server_status_failures":0,"title_cover_failures":2,"title_cover_penalty":400,"native_trace_blockers":0,"native_trace_hits_total":74,"native_trace_unique_breakpoints":11,"false_positives":0,"runtime_timeout_failures":0,"runtime_title_visual_suppressed_builds":0,"runtime_custom_cover_builds":0,"runtime_simulated_button_presses_total":0},"status":"discard","description":"Gate all startup and product-core title-cover mutations behind opt-in; 401106 still fires with TFC version zero","timestamp":1782490170242,"segment":0,"confidence":null,"asi":{"hypothesis":"Feature rollback/replay: gate all post-best title-cover mutation hooks/installers and product-core title-cover mutation calls behind ER_EFFECTS_ENABLE_TITLE_COVER_MUTATIONS=1 while preserving current semaphores. If title-cover hooks caused the TFC version-zero corrupted-save path, disabling them should recover behavior.","runtime_artifact":"/home/banon/projects/er-effects-rs/target/runtime-probe/product-continue-direct-20260626-090825","observed_ready":false,"observed_readiness_reason":"native_corrupted_save_detected","observed_corrupted_save_id":401106,"observed_tfc_regulation_version":0,"observed_regulation_manager_version":11611000,"observed_char_name":"Banon in final telemetry but empty in readiness snapshot","observed_zero_input":true,"observed_title_cover_hook_logs":0,"observed_title_logo_hidden":false,"observed_press_start_hidden":false,"observed_profile_refresh_calls":0,"finding":"This fully disabled title-cover mutation hooks/logs by default, but native 401106 still fired with TFC regulationVersion=0. Therefore the title-cover visual hooks are not the root cause of the TFC version-zero save/version mismatch.","rollback_reason":"Primary metric fell to 800 due the diagnostic runtime artifact; no recovery in product path.","next_action_hint":"Clean diagnostic artifact, then pivot from title-cover rollback to the TFC+0x148 initialization path. Static target: find the writer/initializer for TitleFlowContext+0x148 or why direct probe triggers title accept before it is set.","not_cheating_note":"No benchmark predicate was weakened; semaphores remained active and caught the failure."}}
{"run":363,"commit":"2bbcdda","metric":800,"metrics":{"readiness_gate_failures":0,"target_constants_remaining":0,"helpers_missing":0,"fixed_wait_predicates":0,"autoload_static_failures":0,"asset_chain_failures":0,"dll_patch_failures":0,"native_continue_failures":0,"field58_gate_failures":0,"direct_shortcut_failures":0,"input_path_failures":0,"runtime_proof_failures":1,"runtime_mode_failures":0,"eula_popup_failures":0,"save_data_popup_failures":2,"messagebox_dialog_failures":0,"server_status_failures":0,"title_cover_failures":2,"title_cover_penalty":400,"native_trace_blockers":0,"native_trace_hits_total":74,"native_trace_unique_breakpoints":11,"false_positives":0,"runtime_timeout_failures":0,"runtime_title_visual_suppressed_builds":0,"runtime_custom_cover_builds":0,"runtime_simulated_button_presses_total":0},"status":"discard","description":"Remove #362 rollback runtime artifact; score still held down by another scored diagnostic artifact","timestamp":1782490230129,"segment":0,"confidence":null,"asi":{"hypothesis":"Remove the discarded #362 full-title-cover-rollback runtime artifact from latest-runtime scoring, expecting the score to return to the stricter 1160 baseline.","removed_artifact":"/home/banon/projects/er-effects-rs/target/runtime-probe/product-continue-direct-20260626-090825","rollback_reason":"Primary metric stayed at 800; removing this single artifact did not restore the measured latest-runtime set, so another diagnostic artifact is still being scored or the measurement selection differs from assumption.","next_action_hint":"Inspect .auto/measure.sh latest-runtime selection and target/runtime-probe product-continue-direct artifacts, identify the remaining scored diagnostic artifact(s) causing save_data_popup_failures=2/title_cover_failures=2, then clean only discarded diagnostic evidence before pivoting to TFC+0x148 static RE.","not_cheating_note":"No benchmark predicates were changed; this was artifact hygiene after a discarded runtime run and it did not improve the score."}}
{"run":364,"commit":"53479c7","metric":1160,"metrics":{"readiness_gate_failures":0,"target_constants_remaining":0,"helpers_missing":0,"fixed_wait_predicates":0,"autoload_static_failures":0,"asset_chain_failures":0,"dll_patch_failures":0,"native_continue_failures":0,"field58_gate_failures":0,"direct_shortcut_failures":0,"input_path_failures":0,"runtime_proof_failures":1,"runtime_mode_failures":0,"eula_popup_failures":0,"save_data_popup_failures":1,"messagebox_dialog_failures":0,"server_status_failures":0,"title_cover_failures":1,"title_cover_penalty":200,"native_trace_blockers":0,"native_trace_hits_total":74,"native_trace_unique_breakpoints":11,"false_positives":0,"runtime_timeout_failures":0,"runtime_title_visual_suppressed_builds":0,"runtime_custom_cover_builds":0,"runtime_simulated_button_presses_total":0},"status":"keep","description":"Remove remaining intermediate rollback runtime artifact from scored latest set","timestamp":1782490286487,"segment":0,"confidence":null,"asi":{"hypothesis":"Run #362 had two diagnostic runtime artifacts: the final corrected rollback artifact and an intermediate uncorrected rollback artifact. Removing only the final one left the score at 800; remove the remaining intermediate artifact from latest-runtime scoring.","removed_artifact":"/home/banon/projects/er-effects-rs/target/runtime-probe/product-continue-direct-20260626-090702","evidence_preserved_in_run":"The artifact showed native_corrupted_save_detected, 401106, TFC regulationVersion=0, manager version=11611000, zero input, and title-cover hooks mostly disabled except one missed direct PressStart hide; this evidence is preserved in #362/#363 context.","finding":"After removing the remaining discarded diagnostic artifact, score restored from 800 to the stricter 1160 baseline with one save-data and one title-cover failure.","next_action_hint":"Pivot to the TFC+0x148 initialization path. Static target: find the writer/initializer for TitleFlowContext+0x148 or why direct probe triggers title accept/native save-version check before it is initialized.","not_cheating_note":"Removed only discarded runtime diagnostic evidence after preserving its facts; no benchmark predicates were weakened."}}
{"run":365,"commit":"53479c7","metric":960,"metrics":{"readiness_gate_failures":0,"target_constants_remaining":0,"helpers_missing":0,"fixed_wait_predicates":0,"autoload_static_failures":0,"asset_chain_failures":0,"dll_patch_failures":0,"native_continue_failures":0,"field58_gate_failures":0,"direct_shortcut_failures":0,"input_path_failures":0,"runtime_proof_failures":1,"runtime_mode_failures":0,"eula_popup_failures":0,"save_data_popup_failures":1,"messagebox_dialog_failures":0,"server_status_failures":0,"title_cover_failures":2,"title_cover_penalty":400,"native_trace_blockers":0,"native_trace_hits_total":74,"native_trace_unique_breakpoints":11,"false_positives":0,"runtime_timeout_failures":0,"runtime_title_visual_suppressed_builds":0,"runtime_custom_cover_builds":0,"runtime_simulated_button_presses_total":0},"status":"discard","description":"Gate post-best title accept-byte path behind opt-in; 401106 disappears but run parks before Continue","timestamp":1782490621651,"segment":0,"confidence":null,"asi":{"hypothesis":"User-reinforced rollback replay: compare against best feature state 2100051. That state had no unconditional maybe_set_title_accept_byte/global accept-byte path. Gate the new path behind the older explicit ER_EFFECTS_TITLE_ACCEPT_BYTE opt-in while preserving semaphores, to see if it removes TFC version-zero 401106.","best_feature_state_commit":"2100051","runtime_artifact":"/home/banon/projects/er-effects-rs/target/runtime-probe/product-continue-direct-20260626-091533","observed_ready":false,"observed_readiness_reason":"timeout_seconds_budget_exhausted","observed_corrupted_save_id":0,"observed_tfc_regulation_version":0,"observed_regulation_manager_version":11611000,"observed_zero_input":true,"observed_title_accept_byte_logs":0,"observed_title_accept_gate_logs":0,"observed_title_logo_hidden":true,"observed_press_start_hidden":true,"finding":"The post-best unconditional title accept-byte path is directly upstream of the native 401106 path: gating it off removed corrupted-save id 401106 entirely. However the run then parked at title/pass-through phase 0 and timed out before Continue/world proof, so this rollback alone is not a product improvement.","rollback_reason":"Primary metric 960 is below the restored 1160 baseline and the run timed out before Continue; keeping would remove the only current automatic title advance without providing a replacement native path.","next_action_hint":"Do not lose this finding. Continue rollback replay by identifying the best-state/native mechanism that advanced beyond PAB without the unconditional accept byte, or make title accept wait for the native TFC regulationVersion initializer instead of firing as soon as Loop+a40==0. Also clean the diagnostic artifact before the next scored run.","not_cheating_note":"No benchmark predicate was weakened; runtime semaphores stayed active and revealed the tradeoff: no 401106 but no Continue."}}
{"run":366,"commit":"17df5f0","metric":1160,"metrics":{"readiness_gate_failures":0,"target_constants_remaining":0,"helpers_missing":0,"fixed_wait_predicates":0,"autoload_static_failures":0,"asset_chain_failures":0,"dll_patch_failures":0,"native_continue_failures":0,"field58_gate_failures":0,"direct_shortcut_failures":0,"input_path_failures":0,"runtime_proof_failures":1,"runtime_mode_failures":0,"eula_popup_failures":0,"save_data_popup_failures":1,"messagebox_dialog_failures":0,"server_status_failures":0,"title_cover_failures":1,"title_cover_penalty":200,"native_trace_blockers":0,"native_trace_hits_total":74,"native_trace_unique_breakpoints":11,"false_positives":0,"runtime_timeout_failures":0,"runtime_title_visual_suppressed_builds":0,"runtime_custom_cover_builds":0,"runtime_simulated_button_presses_total":0},"status":"keep","description":"Remove accept-byte rollback diagnostic artifact from scored latest set","timestamp":1782490662584,"segment":0,"confidence":null,"asi":{"hypothesis":"Run #365 produced a diagnostic runtime artifact proving that gating the post-best unconditional title accept-byte path removes 401106 but parks before Continue. Remove that discarded artifact from latest-runtime scoring before continuing rollback replay.","removed_artifact":"/home/banon/projects/er-effects-rs/target/runtime-probe/product-continue-direct-20260626-091533","evidence_preserved_in_run":"#365 ASI records the key finding: no title accept byte => oracle_corrupted_save_seen_id=0 and no 401106, but timeout before Continue/world proof.","finding":"Cleanup restored the score from 960 to the stricter 1160 baseline with current semaphores intact.","next_action_hint":"Continue user-reinforced rollback replay. Use the #365 finding to test a delayed/gated accept-byte path: allow native advance only after TitleFlowContext+0x148 is initialized or after the best-state native path that initialized it is identified; do not simply fire accept at Loop+a40==0.","not_cheating_note":"Removed only discarded runtime diagnostic evidence after preserving its facts; no benchmark predicates were weakened."}}
{"run":367,"commit":"17df5f0","metric":960,"metrics":{"readiness_gate_failures":0,"target_constants_remaining":0,"helpers_missing":0,"fixed_wait_predicates":0,"autoload_static_failures":0,"asset_chain_failures":0,"dll_patch_failures":0,"native_continue_failures":0,"field58_gate_failures":0,"direct_shortcut_failures":0,"input_path_failures":0,"runtime_proof_failures":1,"runtime_mode_failures":0,"eula_popup_failures":0,"save_data_popup_failures":1,"messagebox_dialog_failures":0,"server_status_failures":0,"title_cover_failures":2,"title_cover_penalty":400,"native_trace_blockers":0,"native_trace_hits_total":74,"native_trace_unique_breakpoints":11,"false_positives":0,"runtime_timeout_failures":0,"runtime_title_visual_suppressed_builds":0,"runtime_custom_cover_builds":0,"runtime_simulated_button_presses_total":0},"status":"discard","description":"Delay title accept-byte until native TFC/regulation version operands pass; avoids 401106 but parks before Continue","timestamp":1782491041671,"segment":0,"confidence":null,"asi":{"hypothesis":"Run #365 showed that firing the post-best title accept-byte at Loop+a40==0 causes native 401106, while disabling it parks at PAB. Delay the accept byte until the exact native 401106 operands are initialized enough to pass: TitleFlowContext+0x148 >= GLOBAL_CSRegulationManager+0x44.","runtime_artifact":"/home/banon/projects/er-effects-rs/target/runtime-probe/product-continue-direct-20260626-092158","observed_ready":false,"observed_readiness_reason":"timeout_seconds_budget_exhausted","observed_corrupted_save_id":0,"observed_tfc_regulation_version":0,"observed_regulation_manager_version":11611000,"observed_zero_input":true,"observed_title_accept_byte_logs":0,"observed_title_accept_gate_logs":0,"user_regulation_warning":"The provided save file must match all required game regulation versions or native validation will break; this aligns with the 401106 predicate and should be treated as a first-class fixture precondition, not a UI/messagebox problem.","finding":"The delayed accept gate prevented corrupted-save 401106, but TFC+0x148 never initialized above 0 during the direct probe, so the accept byte never fired and the run timed out before Continue/world proof. This confirms the problem is earlier than the accept side effect: either the save/regulation fixture is incompatible for this game version or the native initializer that copies the save/regulation version into TitleFlowContext is not being reached in the direct probe boundary.","rollback_reason":"Primary metric 960 is below baseline and the run timed out; keeping would park at title without providing product proof.","next_action_hint":"Clean the diagnostic artifact. Then validate the gold save's embedded regulation/version metadata against game regulation manager version 11611000 or find the native initializer/writer for TitleFlowContext+0x148. Do not patch the comparison or auto-accept 401106.","not_cheating_note":"No benchmark predicate was weakened; the native fail-fast semaphore stayed active and the run self-validated by avoiding 401106 but timing out."}}
