{"run":450,"commit":"visual-false-positive-correction","metric":0,"status":"discard","description":"User-visible no-teardown falsified ProfileSelect transform portrait semaphores","metrics":{"readiness_gate_failures":0,"target_constants_remaining":0,"helpers_missing":0,"fixed_wait_predicates":0,"autoload_static_failures":0,"asset_chain_failures":0,"dll_patch_failures":0,"native_continue_failures":0,"field58_gate_failures":0,"direct_shortcut_failures":0,"input_path_failures":0,"runtime_proof_failures":0,"runtime_mode_failures":0,"eula_popup_failures":0,"save_data_popup_failures":0,"messagebox_dialog_failures":0,"server_status_failures":0,"title_cover_failures":1,"title_cover_penalty":1600,"native_trace_blockers":0,"native_trace_hits_total":74,"native_trace_unique_breakpoints":11,"false_positives":0},"asi":{"hypothesis":"Treat the user-visible no-teardown run as ground truth and fail closed on the ProfileSelect one-tick transform/SYSTEX semaphore signature.","rollback_reason":"Artifact product-continue-direct-20260626-183818 showed a blank/cursed ProfileSelect panel stuck at Select profile to load, even while the prior semaphores claimed portrait rendered/visible/held and Banon/player_present. Those semaphores proved plumbing, not visible portrait pixels or clean handoff.","next_action_hint":"Do not resurrect ProfileSelect one-tick transform as product proof. Next keepable work must add a real visible-pixel/surface oracle such as oracle_title_portrait_pixels_visible=true tied to the displayed loaded-character portrait, or pivot to a native title-safe surface with RAM/pixel evidence.","artifact":"/home/banon/projects/er-effects-rs/target/runtime-probe/product-continue-direct-20260626-183818","commit":"7e74565 Fail closed on ProfileSelect portrait false positive","validation":"cargo fmt --check; ./.auto/measure.sh -> autoload_re_score=0, title_cover_failures=1, title_cover_penalty=1600"}}
{"run":451,"commit":"3c32b87","metric":0,"metrics":{"readiness_gate_failures":0,"target_constants_remaining":0,"helpers_missing":0,"fixed_wait_predicates":0,"autoload_static_failures":0,"asset_chain_failures":0,"dll_patch_failures":0,"native_continue_failures":0,"field58_gate_failures":0,"direct_shortcut_failures":0,"input_path_failures":0,"runtime_proof_failures":0,"runtime_mode_failures":0,"eula_popup_failures":0,"save_data_popup_failures":0,"messagebox_dialog_failures":0,"server_status_failures":0,"title_cover_failures":1,"title_cover_penalty":1600,"native_trace_blockers":0,"native_trace_hits_total":74,"native_trace_unique_breakpoints":11,"false_positives":0},"status":"discard","description":"Baseline after visual false-positive correction remains fail-closed at portrait-pixel hard gate","timestamp":1782525328613,"segment":2,"confidence":null,"asi":{"hypothesis":"Reconfirm the current corrected scoring baseline before the next portrait-visible/surface oracle spike; the latest false-positive artifact should keep score at 0 and false_positives at 0.","rollback_reason":"No code change and no primary-metric improvement; current blocker is still the missing real portrait-pixel/surface oracle rather than zero-input load or static gates.","next_action_hint":"Continue from bd memory portrait-texture-wrapper-shape-2026-06-26: statically inspect CSGxTexture/resource vtables for dimensions/copy/readback or a safe way to feed a portrait-backed overlay/custom surface."}}
{"run":452,"commit":"3c32b87","metric":0,"metrics":{"readiness_gate_failures":0,"target_constants_remaining":0,"helpers_missing":0,"fixed_wait_predicates":0,"autoload_static_failures":0,"asset_chain_failures":0,"dll_patch_failures":0,"native_continue_failures":0,"field58_gate_failures":0,"direct_shortcut_failures":0,"input_path_failures":0,"runtime_proof_failures":0,"runtime_mode_failures":0,"eula_popup_failures":0,"save_data_popup_failures":0,"messagebox_dialog_failures":0,"server_status_failures":0,"title_cover_failures":1,"title_cover_penalty":1600,"native_trace_blockers":0,"native_trace_hits_total":74,"native_trace_unique_breakpoints":11,"false_positives":0},"status":"crash","description":"Invalid custom autoresearch command blocked by measure.sh guard","timestamp":1782525919295,"segment":2,"confidence":null,"asi":{"hypothesis":"Build and run a bounded portrait-source runtime probe after adding diagnostic texture-shape telemetry, then score with measure.sh.","rollback_reason":"run_experiment refused custom command because .auto/measure.sh exists; valid guard requires driving experiments through .auto/measure.sh only. Diagnostic code changes were reverted by crash logging.","next_action_hint":"Use the supported trigger-file path for runtime probes (`touch .auto/run_runtime_probe_once`) and then run only `./.auto/measure.sh`; keep any build checks outside run_experiment or encoded inside measure.sh."}}
{"run":453,"commit":"3c32b87","metric":0,"metrics":{"readiness_gate_failures":0,"target_constants_remaining":0,"helpers_missing":0,"fixed_wait_predicates":0,"autoload_static_failures":0,"asset_chain_failures":0,"dll_patch_failures":0,"native_continue_failures":0,"field58_gate_failures":0,"direct_shortcut_failures":0,"input_path_failures":0,"runtime_proof_failures":0,"runtime_mode_failures":0,"eula_popup_failures":0,"save_data_popup_failures":0,"messagebox_dialog_failures":0,"server_status_failures":0,"title_cover_failures":2,"title_cover_penalty":1800,"native_trace_blockers":0,"native_trace_hits_total":74,"native_trace_unique_breakpoints":11,"false_positives":0},"status":"discard","description":"Diagnostic overlay texture-shape telemetry did not run in measure-triggered runtime path","timestamp":1782526056259,"segment":2,"confidence":null,"asi":{"hypothesis":"Add read-only overlay telemetry for CSRuntimeTexResCap/CSGxTexture vtables and inner pointers, then run the supported measure-triggered runtime probe to observe the actual portrait texture object shape.","rollback_reason":"Primary metric stayed 0 and title_cover_failures worsened to 2. The runtime artifact /home/banon/projects/er-effects-rs/target/runtime-probe/product-continue-direct-20260626-190647 reached Banon/world proof, but `oracle_title_overlay_cover_render_calls=0`, so the removed path overlay path did not execute under `.auto/run_runtime_probe_once`; the new fields stayed zero and the diagnostic did not answer the object-shape question.","next_action_hint":"For overlay diagnostics, use the existing portrait-source runtime env path (`.auto/run-portrait-source-probe.sh` sets ER_EFFECTS_ENABLE_REMOVED_OVERLAY=1) through a measure-compatible trigger/env path, or move the pointer-shape sampling into normal telemetry/game-task code instead of the removed path render loop.","artifact":"/home/banon/projects/er-effects-rs/target/runtime-probe/product-continue-direct-20260626-190647","validation":"cargo fmt; touch .auto/run_runtime_probe_once; ./.auto/measure.sh (run_experiment 45s)"}}
{"run":454,"commit":"3c32b87","metric":0,"metrics":{"readiness_gate_failures":0,"target_constants_remaining":0,"helpers_missing":0,"fixed_wait_predicates":0,"autoload_static_failures":0,"asset_chain_failures":0,"dll_patch_failures":0,"native_continue_failures":0,"field58_gate_failures":0,"direct_shortcut_failures":0,"input_path_failures":0,"runtime_proof_failures":0,"runtime_mode_failures":0,"eula_popup_failures":0,"save_data_popup_failures":0,"messagebox_dialog_failures":0,"server_status_failures":0,"title_cover_failures":3,"title_cover_penalty":1900,"native_trace_blockers":0,"native_trace_hits_total":74,"native_trace_unique_breakpoints":11,"false_positives":1},"status":"discard","description":"Guard black-screen overlay as visual false positive","timestamp":1782526143000,"segment":2,"confidence":null,"asi":{"hypothesis":"Encode the user correction that a big black screen/generic fullscreen rectangle is a visual false positive, so future experiments cannot treat dark removed path coverage as portrait-cover progress.","rollback_reason":"Primary score intentionally stayed 0 and false_positives rose to 1 because this was a stricter anti-cheat/visual-beauty guard, not a product implementation.","next_action_hint":"Remove or replace `draw_title_overlay_cover`'s fullscreen dark rectangle with an actual portrait-backed image/surface; metric now explicitly reports a false positive until the black-screen scaffold is gone or portrait-backed."}}
{"run":455,"commit":"3c32b87","metric":0,"metrics":{"readiness_gate_failures":0,"target_constants_remaining":0,"helpers_missing":0,"fixed_wait_predicates":0,"autoload_static_failures":0,"asset_chain_failures":0,"dll_patch_failures":0,"native_continue_failures":0,"field58_gate_failures":0,"direct_shortcut_failures":0,"input_path_failures":0,"runtime_proof_failures":0,"runtime_mode_failures":0,"eula_popup_failures":0,"save_data_popup_failures":0,"messagebox_dialog_failures":0,"server_status_failures":0,"title_cover_failures":3,"title_cover_penalty":1900,"native_trace_blockers":0,"native_trace_hits_total":74,"native_trace_unique_breakpoints":11,"false_positives":1},"status":"crash","description":"Runtime probe iteration aborted before metrics returned","timestamp":1782526336159,"segment":2,"confidence":null,"asi":{"hypothesis":"Move profile texture object-shape sampling into normal telemetry and run a supported measure-triggered runtime probe, while keeping the black-screen visual false-positive guard active.","rollback_reason":"run_experiment returned aborted before METRIC lines, so the iteration produced no trustworthy score or artifact outcome.","next_action_hint":"After crash revert, reapply only the most promising non-runtime-scoring change if needed: a normal-telemetry sampler for CSRuntimeTexResCap+0x78/CSGxTexture+0x10/+0x18, then run exactly ./.auto/measure.sh through run_experiment. Keep the black-screen guard in .auto/measure.sh/prompt if preserved."}}
{"run":456,"commit":"3c32b87","metric":0,"metrics":{"readiness_gate_failures":0,"target_constants_remaining":0,"helpers_missing":0,"fixed_wait_predicates":0,"autoload_static_failures":0,"asset_chain_failures":0,"dll_patch_failures":0,"native_continue_failures":0,"field58_gate_failures":0,"direct_shortcut_failures":0,"input_path_failures":0,"runtime_proof_failures":1,"runtime_mode_failures":0,"eula_popup_failures":0,"save_data_popup_failures":0,"messagebox_dialog_failures":0,"server_status_failures":0,"title_cover_failures":3,"title_cover_penalty":1900,"native_trace_blockers":0,"native_trace_hits_total":74,"native_trace_unique_breakpoints":11,"false_positives":1},"status":"crash","description":"Normal telemetry texture-shape sampler captured pointers but runtime exited before ready","timestamp":1782526453050,"segment":2,"confidence":null,"asi":{"hypothesis":"Move CSRuntimeTexResCap/CSGxTexture object-shape sampling into normal telemetry so it runs even when removed path overlay does not, then use the supported .auto/run_runtime_probe_once + .auto/measure.sh path.","rollback_reason":"Runtime artifact exited before ready (`reason=process_exited_before_ready`), so no product score. The diagnostic did capture useful pointer evidence but the source change is not a primary-metric improvement.","next_action_hint":"Use captured artifact evidence to avoid repeating this probe: `gx_texture=0x7fff13ad55e0`, `gx_vtable=0x142b761b0`, `gx_inner_10=0x7fff898ee1e0`, `inner_10_vtable=0x142b80278`, `profile_source_ready=true`. This confirms the native source-wrapper path; next RE should target native Scaleform/surface binding for `SYSTEX_Menu_Profile00`, not removed path raw texture consumption or black overlay.","artifact":"/home/banon/projects/er-effects-rs/target/runtime-probe/product-continue-direct-20260626-191322","validation":"cargo fmt; touch .auto/run_runtime_probe_once; ./.auto/measure.sh via run_experiment (failed before METRIC lines)"}}
{"run":457,"commit":"3c32b87","metric":0,"metrics":{"readiness_gate_failures":0,"target_constants_remaining":0,"helpers_missing":0,"fixed_wait_predicates":0,"autoload_static_failures":0,"asset_chain_failures":0,"dll_patch_failures":0,"native_continue_failures":0,"field58_gate_failures":0,"direct_shortcut_failures":0,"input_path_failures":0,"runtime_proof_failures":0,"runtime_mode_failures":0,"eula_popup_failures":0,"save_data_popup_failures":0,"messagebox_dialog_failures":0,"server_status_failures":0,"title_cover_failures":3,"title_cover_penalty":2000,"native_trace_blockers":0,"native_trace_hits_total":74,"native_trace_unique_breakpoints":11,"false_positives":0},"status":"discard","description":"Remove fullscreen dark overlay fill from diagnostic scaffold","timestamp":1782526534611,"segment":2,"confidence":null,"asi":{"hypothesis":"Removing the fullscreen dark rectangle from `draw_title_overlay_cover` should eliminate the explicit black-screen false positive without claiming portrait-cover success.","rollback_reason":"Primary metric stayed 0, so policy requires discard. `false_positives` improved to 0, but `title_cover_penalty` worsened to 2000 because the overlay still is not portrait-backed product cover; this is not enough to keep.","next_action_hint":"Do not spend more iterations on cosmetic black-overlay removal alone. The only primary-metric path is a real portrait-backed native surface or removed path bridge that exposes an actual visible portrait oracle."}}
{"run":458,"commit":"4630c53","metric":0,"metrics":{"readiness_gate_failures":0,"target_constants_remaining":0,"helpers_missing":0,"fixed_wait_predicates":0,"autoload_static_failures":0,"asset_chain_failures":0,"dll_patch_failures":0,"native_continue_failures":0,"field58_gate_failures":0,"direct_shortcut_failures":0,"input_path_failures":0,"runtime_proof_failures":0,"runtime_mode_failures":0,"eula_popup_failures":0,"save_data_popup_failures":0,"messagebox_dialog_failures":0,"server_status_failures":0,"title_cover_failures":3,"title_cover_penalty":1900,"native_trace_blockers":0,"native_trace_hits_total":74,"native_trace_unique_breakpoints":11,"false_positives":1},"status":"discard","description":"Visible-surface bind rewrite still fails portrait-cover gate and leaves generic black overlay false positive","timestamp":1782527434202,"segment":2,"confidence":null,"asi":{"hypothesis":"Test the current visible-surface bind rewrite plus stricter black-overlay false-positive gate through the supported .auto/run_runtime_probe_once -> .auto/measure.sh path.","rollback_reason":"Primary metric stayed 0 and false_positives=1 because the product still contains a generic fullscreen dark rectangle scaffold and no actual portrait-visible runtime oracle.","next_action_hint":"First remove or disable the generic black rectangle overlay so false_positives returns to 0, then pursue a real portrait-backed surface/pixel oracle; do not count MENU_DummyProfileFace/ProfileSelect bind rewrites without oracle_title_portrait_pixels_visible or oracle_title_portrait_visible_surface_bound evidence."}}
{"run":459,"commit":"4630c53","metric":0,"metrics":{"readiness_gate_failures":0,"target_constants_remaining":0,"helpers_missing":0,"fixed_wait_predicates":0,"autoload_static_failures":0,"asset_chain_failures":0,"dll_patch_failures":0,"native_continue_failures":0,"field58_gate_failures":0,"direct_shortcut_failures":0,"input_path_failures":0,"runtime_proof_failures":0,"runtime_mode_failures":0,"eula_popup_failures":0,"save_data_popup_failures":0,"messagebox_dialog_failures":0,"server_status_failures":0,"title_cover_failures":3,"title_cover_penalty":1900,"native_trace_blockers":0,"native_trace_hits_total":74,"native_trace_unique_breakpoints":11,"false_positives":0},"status":"discard","description":"Visible-surface bind rewrite never executed because ProfileSelect cover run hook did not fire","timestamp":1782528009919,"segment":2,"confidence":null,"asi":{"hypothesis":"Replay the last world-stable ProfileSelect cover implementation, remove the generic removed UI black/text scaffold, and rewrite the native MENU_DummyProfileFace_01 -> SYSTEX_Menu_Profile00 bind pair to visible surface MENU_FL_40135_Profile so score can come only from oracle_title_portrait_visible_surface_bound.","rollback_reason":"Primary metric stayed 0. Latest artifact /home/banon/projects/er-effects-rs/target/runtime-probe/product-continue-direct-20260626-193814 reached world_stable but title cover failed: ProfileSelect job built once, MenuWindowJob::Run hook never fired, scaleform bind observer hits stayed 0, visible-surface rewrites stayed 0, and loaded portrait booleans stayed false.","next_action_hint":"Do not repeat visible-surface bind rewrite until the run hook is proven installed/firing. Compare source/log with 1fccd8e: good artifact logged `hooked MenuWindowJob::Run 0x1407ad1c0`; latest did not. Next experiment should restore/force install_title_custom_cover_run_hook or statically inspect why START_TITLE_CUSTOM_COVER_RUN is not called after replay."}}
{"run":460,"commit":"4630c53","metric":0,"metrics":{"readiness_gate_failures":0,"target_constants_remaining":0,"helpers_missing":0,"fixed_wait_predicates":0,"autoload_static_failures":0,"asset_chain_failures":0,"dll_patch_failures":0,"native_continue_failures":0,"field58_gate_failures":0,"direct_shortcut_failures":0,"input_path_failures":0,"runtime_proof_failures":0,"runtime_mode_failures":0,"eula_popup_failures":0,"save_data_popup_failures":0,"messagebox_dialog_failures":0,"server_status_failures":0,"title_cover_failures":1,"title_cover_penalty":1600,"native_trace_blockers":0,"native_trace_hits_total":74,"native_trace_unique_breakpoints":11,"false_positives":0},"status":"discard","description":"ProfileSelect run hook restored and visible-surface bind oracle fires, but stale-artifact false-positive gate keeps primary metric at zero","timestamp":1782528512307,"segment":2,"confidence":null,"asi":{"hypothesis":"Restore the 1fccd8e startup wiring including START_TITLE_CUSTOM_COVER_RUN, remove the generic overlay scaffold, and add native visible-surface rewrite telemetry for MENU_DummyProfileFace_01 -> MENU_FL_40135_Profile so product proof depends on RAM-backed native surface evidence rather than rectangles.","rollback_reason":"Primary metric did not improve. The latest runtime artifact is promising but not scored: /home/banon/projects/er-effects-rs/target/runtime-probe/product-continue-direct-20260626-194707 has world-stable product proof and RAM oracle `oracle_title_portrait_visible_surface_bound=true`, rewrites=1, run_calls=1, loaded_character_portrait_rendered=true, false_positives=0, but .auto/measure.sh still reports the historical ProfileSelect false-positive hard gate from stale runtime artifacts.","next_action_hint":"Fix .auto/measure.sh to apply ProfileSelect false-positive detection to the latest relevant runtime artifact (or per-artifact latest proof set), not any stale artifact in target/runtime-probe. Keep the hard gate: if the latest artifact lacks oracle_title_portrait_visible_surface_bound or oracle_title_portrait_pixels_visible, it must fail."}}
{"run":461,"commit":"2c4ade8","metric":1600,"metrics":{"readiness_gate_failures":0,"target_constants_remaining":0,"helpers_missing":0,"fixed_wait_predicates":0,"autoload_static_failures":0,"asset_chain_failures":0,"dll_patch_failures":0,"native_continue_failures":0,"field58_gate_failures":0,"direct_shortcut_failures":0,"input_path_failures":0,"runtime_proof_failures":0,"runtime_mode_failures":0,"eula_popup_failures":0,"save_data_popup_failures":0,"messagebox_dialog_failures":0,"server_status_failures":0,"title_cover_failures":0,"title_cover_penalty":0,"native_trace_blockers":0,"native_trace_hits_total":74,"native_trace_unique_breakpoints":11,"false_positives":0},"status":"keep","description":"Visible-surface ProfileSelect portrait bind oracle with stale-artifact scoring fix restores max score","timestamp":1782528794132,"segment":2,"confidence":null,"asi":{"hypothesis":"Restore the high-scoring ProfileSelect run-hook wiring, remove generic removed UI overlay drawing, rewrite the native slot0 ProfileSelect SYSTEX bind from MENU_DummyProfileFace_01 to the visibly placed MENU_FL_40135_Profile surface, and fix .auto/measure.sh so stale historical artifacts do not veto the latest/scored runtime artifact.","artifact":"/home/banon/projects/er-effects-rs/target/runtime-probe/product-continue-direct-20260626-195157","evidence":"Runtime scored autoload_re_score=1600 with false_positives=0. RAM telemetry: oracle_title_portrait_visible_surface_bound=true, bind_rewrites=1, loaded_character_portrait_rendered=true, visible_during_boot=true, held_until_loading_takeover=true, custom_cover_run_calls=1, scaleform_bind_observer_systex_hits=10, overlay_cover_render_calls=0, simulated_button_presses_total=0, oracle_player_present=true, oracle_char_name=Banon. Teardown screenshot artifact was produced at target/runtime-probe/product-continue-direct-20260626-195157/teardown-screenshot.jpg but product proof is RAM telemetry.","validation":"cargo fmt; supported runtime trigger .auto/run_runtime_probe_once; run_experiment command ./.auto/measure.sh; runtime cap <=45s; mandatory teardown screenshot observed."}}
