{"type":"config","name":"Masquerade Elden Ring boot-init load behind a clean custom title cover","metricName":"autoload_re_score","metricUnit":"points","bestDirection":"higher"}
{"run":1,"commit":"089a89f","metric":1230,"metrics":{"readiness_gate_failures":6,"target_constants_remaining":0,"helpers_missing":0,"fixed_wait_predicates":0,"autoload_static_failures":6,"asset_chain_failures":0,"dll_patch_failures":0,"native_continue_failures":0,"field58_gate_failures":0,"direct_shortcut_failures":0,"input_path_failures":0,"runtime_proof_failures":1,"runtime_mode_failures":0,"eula_popup_failures":0,"save_data_popup_failures":0,"messagebox_dialog_failures":0,"server_status_failures":0,"native_trace_blockers":0,"native_trace_hits_total":74,"native_trace_unique_breakpoints":11,"false_positives":0},"status":"keep","description":"baseline current spike/boot-parallelization before title-cover masquerade changes","timestamp":1782350524220,"segment":0,"confidence":null,"asi":{"hypothesis":"Baseline establishes existing static/autoload proof score before implementing Part A title MenuWindowJob suppression or Part B custom cover injection.","task_direction":"Masquerade irreducible boot-init behind intentional title/loading visual; no ms target; validate A disable-native-title-view and B custom cover separately.","hard_constraints":["zero simulated input","save-safe","oracle_char_name=Banon","zero CS::MessageBoxDialog","preserve splash-skip/pab-advance/FadeIn-skip","do not touch STEP_Wait or CSMenuMan+0x21"]}}
{"run":2,"commit":"089a89f","metric":1230,"metrics":{"readiness_gate_failures":6,"target_constants_remaining":0,"helpers_missing":0,"fixed_wait_predicates":0,"autoload_static_failures":6,"asset_chain_failures":0,"dll_patch_failures":0,"native_continue_failures":0,"field58_gate_failures":0,"direct_shortcut_failures":0,"input_path_failures":0,"runtime_proof_failures":1,"runtime_mode_failures":0,"eula_popup_failures":0,"save_data_popup_failures":0,"messagebox_dialog_failures":0,"server_status_failures":0,"title_cover_failures":2,"native_trace_blockers":0,"native_trace_hits_total":74,"native_trace_unique_breakpoints":11,"false_positives":0},"status":"discard","description":"attempted Part A BeginTitle native-title visual suppression but static measure failed to see constants/source anchors","timestamp":1782351243758,"segment":0,"confidence":null,"asi":{"hypothesis":"Suppress only the BeginTitle 05_000_Title MenuWindowJob wrapper and expose telemetry; extend the score so Part A and Part B are independently penalized.","rollback_reason":"Primary score did not improve because .auto/measure.sh checked constants in a source string that did not include src/constants.rs, so Part A was still reported missing; Part B remains missing by design.","next_action_hint":"Fix measure to include constants, then reapply the Part A hook/telemetry/checker changes and rerun. Keep the two-cover-failure scoring: old baseline remains comparable, Part A should reduce title_cover_failures from 2 to 1.","details":["Ghidra decompile showed FUN_14081f9f0 only constructs CSScaleformLoadInfo filename 05_000_Title and calls FUN_1407acbf0.","Implementation shape used a MinHook detour returning param_1 after writing null to *out_slot, matching factory allocation-failure shape.","Need rerun static checker after reapply; check-autoload-happy-path had passed before measure failure."]}}
{"run":3,"commit":"1c19301","metric":1330,"metrics":{"readiness_gate_failures":6,"target_constants_remaining":0,"helpers_missing":0,"fixed_wait_predicates":0,"autoload_static_failures":6,"asset_chain_failures":0,"dll_patch_failures":0,"native_continue_failures":0,"field58_gate_failures":0,"direct_shortcut_failures":0,"input_path_failures":0,"runtime_proof_failures":1,"runtime_mode_failures":0,"eula_popup_failures":0,"save_data_popup_failures":0,"messagebox_dialog_failures":0,"server_status_failures":0,"title_cover_failures":1,"native_trace_blockers":0,"native_trace_hits_total":74,"native_trace_unique_breakpoints":11,"false_positives":0},"status":"keep","description":"Part A suppresses native 05_000_Title BeginTitle visual wrapper and exposes telemetry","timestamp":1782351420980,"segment":0,"confidence":null,"asi":{"hypothesis":"Part A can hide the native title view safely by detouring only BeginTitle's 05_000_Title wrapper (0x14081f9f0) and returning a null MenuWindowJob out slot, leaving TitleStep/STEP_Wait/native Continue untouched.","evidence":"Static Ghidra: dump 0x14081fae0 (deobf 0x14081f9f0) builds CSScaleformLoadInfo filename 05_000_Title then calls factory 0x1407acbf0; deobf/dump shift +0xf0 verified by scripts/dump-deobf-shift.py --reverse.","score_reason":"title_cover_failures reduced from 2 to 1; remaining title_cover failure is Part B custom cover render path not yet implemented.","validation":["python3 scripts/check-autoload-happy-path.py passed","python3 -m py_compile scripts/check-autoload-happy-path.py scripts/er-readiness-watch.py passed","cargo fmt --check passed",".auto/measure.sh passed with false_positives=0"],"next_action_hint":"Implement Part B custom image render path or resolve asset blocker: inspect 05_001_Title_Logo for dummy texture remap; otherwise author a small Scaleform target referencing MENU_DummyProfileFace_NN/SYSTEX_Menu_ProfileNN. Then runtime-validate A and B separately."}}
{"run":4,"commit":"2ea4cac","metric":1380,"metrics":{"readiness_gate_failures":6,"target_constants_remaining":0,"helpers_missing":0,"fixed_wait_predicates":0,"autoload_static_failures":6,"asset_chain_failures":0,"dll_patch_failures":0,"native_continue_failures":0,"field58_gate_failures":0,"direct_shortcut_failures":0,"input_path_failures":0,"runtime_proof_failures":1,"runtime_mode_failures":0,"eula_popup_failures":0,"save_data_popup_failures":0,"messagebox_dialog_failures":0,"server_status_failures":0,"title_cover_failures":1,"title_cover_penalty":50,"native_trace_blockers":0,"native_trace_hits_total":74,"native_trace_unique_breakpoints":11,"false_positives":0},"status":"keep","description":"Resolved Part B asset fork: 05_001_Title_Logo has no dummy-profile/SYSTEX texture symbol","timestamp":1782351692590,"segment":0,"confidence":3,"asi":{"hypothesis":"Part B should stop targeting 05_001_Title_Logo directly if its extracted GFX has no MENU_DummyProfileFace/SYSTEX symbol; a custom Scaleform target or different dummy-profile surface is required.","evidence":"Offline asset strings from /home/banon/er-extract/nuxe-menu-20260619-170932/menu/05_001_title_logo.gfx list static title textures (MENU_Title_GR, MENU_Title_EldenRing, MENU_DS3_LOGO, MENU_Title_EldenRing_01) and no MENU_DummyProfileFace or SYSTEX_Menu_Profile. Control 05_000_title.gfx also lacks profile dummy symbols.","score_reason":"Part B asset-decision penalty cleared; remaining title_cover_penalty=50 is the actual custom cover render implementation/proof.","validation":[".auto/measure.sh passed with false_positives=0","Evidence recorded in docs/recon/title-cover-asset-decision-2026-06-25.md and .auto/prompt.md"],"next_action_hint":"Implement/render a custom cover target referencing MENU_DummyProfileFace_NN / SYSTEX_Menu_ProfileNN, or find an existing Scaleform surface with those symbols; do not keep trying 05_001_Title_Logo remap."}}
{"run":5,"commit":"1061e93","metric":1430,"metrics":{"readiness_gate_failures":6,"target_constants_remaining":0,"helpers_missing":0,"fixed_wait_predicates":0,"autoload_static_failures":6,"asset_chain_failures":0,"dll_patch_failures":0,"native_continue_failures":0,"field58_gate_failures":0,"direct_shortcut_failures":0,"input_path_failures":0,"runtime_proof_failures":1,"runtime_mode_failures":0,"eula_popup_failures":0,"save_data_popup_failures":0,"messagebox_dialog_failures":0,"server_status_failures":0,"title_cover_failures":0,"title_cover_penalty":0,"native_trace_blockers":0,"native_trace_hits_total":74,"native_trace_unique_breakpoints":11,"false_positives":0},"status":"keep","description":"Part B static cover path replaces 05_000_Title with ProfileSelect dummy-profile/SYSTEX surface","timestamp":1782352034340,"segment":0,"confidence":2,"asi":{"hypothesis":"Instead of authoring a new GFX immediately, reuse the existing ProfileSelect Scaleform as the cover because it already contains MENU_DummyProfileFace_01..10 placeholders mapped to SYSTEX_Menu_Profile targets.","evidence":"Ghidra xrefs: 05_010_ProfileSelect wrappers at dump 0x14081f6f0/0x14081f7e0; dump-deobf-shift maps chosen wrapper to deobf 0x14081f6f0. Extracted 05_010_profileselect.gfx contains MENU_DummyProfileFace_01..10. The BeginTitle detour now clears the 05_000 out slot then calls the 05_010 ProfileSelect wrapper and records oracle_title_custom_cover_profile_select_* telemetry.","score_reason":"Static title_cover_penalty reached 0; remaining score loss is pre-existing readiness/runtime-proof debt, not the cover static path.","validation":["python3 scripts/check-autoload-happy-path.py passed","python3 -m py_compile scripts/check-autoload-happy-path.py scripts/er-readiness-watch.py passed","cargo fmt --check passed",".auto/measure.sh passed with false_positives=0"],"runtime_caveat":"This is not runtime proof yet. Next run must prove no crash, native 05_000 gone, ProfileSelect/dummy cover visible, zero MessageBoxDialog, zero input, and gold loads (Banon).","next_action_hint":"Run the bounded product runtime probe only after checking Steam is running; validate A and B separately from telemetry plus teardown screenshot. If ProfileSelect cover conflicts with title flow, fallback is a minimal custom Scaleform target using the same dummy-profile symbol."}}
{"run":6,"commit":"1061e93","metric":0,"metrics":{"readiness_gate_failures":6,"target_constants_remaining":0,"helpers_missing":0,"fixed_wait_predicates":0,"autoload_static_failures":6,"asset_chain_failures":0,"dll_patch_failures":0,"native_continue_failures":0,"field58_gate_failures":0,"direct_shortcut_failures":0,"input_path_failures":0,"runtime_proof_failures":1,"runtime_mode_failures":0,"eula_popup_failures":0,"save_data_popup_failures":0,"messagebox_dialog_failures":0,"server_status_failures":0,"title_cover_failures":0,"title_cover_penalty":0,"native_trace_blockers":0,"native_trace_hits_total":74,"native_trace_unique_breakpoints":11,"false_positives":0,"runtime_timeout_failures":1,"runtime_title_visual_suppressed_builds":1,"runtime_custom_cover_builds":1,"runtime_simulated_button_presses_total":0},"status":"crash","description":"runtime probe with ProfileSelect cover built A/B but timed out before gold load","timestamp":1782352289053,"segment":0,"confidence":2,"asi":{"hypothesis":"Runtime should prove the ProfileSelect cover replacement is safe: native 05_000_Title suppressed, custom ProfileSelect cover built, zero input, no MessageBoxDialog, and Banon loads behind it.","error_details":"run_experiment timed out; artifact target/runtime-probe/product-continue-direct-20260624-184915 reached first telemetry at +2.3s and watcher teardown at +40.1s with reason=timeout_seconds_budget_exhausted. Telemetry had oracle_title_native_menu_visual_suppressed_builds=1 and oracle_title_custom_cover_profile_select_builds=1, simulated_button_presses_total=0, oracle_msgbox_total_builds=0, but oracle_char_name='' and oracle_player_present=false.","rollback_reason":"Runtime did not prove gold load/world-stable. Treat as failed runtime experiment even though A/B cover telemetry worked.","next_action_hint":"Investigate why replacing the BeginTitle visual with ProfileSelect leaves owner_state=10 / no Continue progress. Likely the ProfileSelect visual job perturbs the title menu's press/start or MenuJobWait pump; next experiment should preserve Part A null suppression for load and render cover through a separate surface/overlay path rather than replacing the title job slot, or make the replacement job passive/non-blocking.","artifact_dir":"/home/banon/projects/er-effects-rs/target/runtime-probe/product-continue-direct-20260624-184915","runtime_evidence":{"title_native_menu_visual_suppressed_builds":1,"title_custom_cover_profile_select_builds":1,"simulated_button_presses_total":0,"oracle_msgbox_total_builds":0,"oracle_char_name":"","oracle_player_present":false,"reason":"timeout_seconds_budget_exhausted"}}}
{"run":7,"commit":"1061e93","metric":1430,"metrics":{"readiness_gate_failures":6,"target_constants_remaining":0,"helpers_missing":0,"fixed_wait_predicates":0,"autoload_static_failures":6,"asset_chain_failures":0,"dll_patch_failures":0,"native_continue_failures":0,"field58_gate_failures":0,"direct_shortcut_failures":0,"input_path_failures":0,"runtime_proof_failures":1,"runtime_mode_failures":0,"eula_popup_failures":0,"save_data_popup_failures":0,"messagebox_dialog_failures":0,"server_status_failures":0,"title_cover_failures":0,"title_cover_penalty":0,"native_trace_blockers":0,"native_trace_hits_total":74,"native_trace_unique_breakpoints":11,"false_positives":0,"runtime_timeout_failures":1,"runtime_title_visual_suppressed_builds":1,"runtime_custom_cover_builds":1,"runtime_simulated_button_presses_total":0},"status":"discard","description":"attempted to revert ProfileSelect cover replacement back to Part A null suppression but existing measure still credited stale Part B tokens","timestamp":1782352511323,"segment":0,"confidence":2.6666666666666665,"asi":{"hypothesis":"After runtime showed ProfileSelect replacement blocks title progress, revert the BeginTitle hook to pure null suppression so Part A can be runtime-validated independently and leave Part B as unresolved.","rollback_reason":"Primary metric was unchanged because .auto/measure.sh still credited stale TITLE_CUSTOM_COVER/oracle tokens after the hook no longer built the custom cover. The experiment did not produce a trustworthy metric improvement.","next_action_hint":"First harden .auto/measure.sh so Part B requires an actual observable cover build path (e.g. TITLE_CUSTOM_COVER_PROFILE_SELECT_BUILDS.fetch_add in the hook or a successor runtime observable). Then reapply the PartA-only null suppression change and run the static measure/runtime probe."}}
{"run":8,"commit":"1061e93","metric":1380,"metrics":{"readiness_gate_failures":6,"target_constants_remaining":0,"helpers_missing":0,"fixed_wait_predicates":0,"autoload_static_failures":6,"asset_chain_failures":0,"dll_patch_failures":0,"native_continue_failures":0,"field58_gate_failures":0,"direct_shortcut_failures":0,"input_path_failures":0,"runtime_proof_failures":1,"runtime_mode_failures":0,"eula_popup_failures":0,"save_data_popup_failures":0,"messagebox_dialog_failures":0,"server_status_failures":0,"title_cover_failures":1,"title_cover_penalty":50,"native_trace_blockers":0,"native_trace_hits_total":74,"native_trace_unique_breakpoints":11,"false_positives":0,"runtime_timeout_failures":1,"runtime_title_visual_suppressed_builds":1,"runtime_custom_cover_builds":1,"runtime_simulated_button_presses_total":0},"status":"discard","description":"Part A-only null suppression makes measure honestly mark Part B still missing","timestamp":1782352595747,"segment":0,"confidence":4,"asi":{"hypothesis":"Remove the product-unsafe ProfileSelect job replacement and let the metric honestly score Part B as still missing, so Part A null suppression can later be validated separately at runtime.","rollback_reason":"Primary metric decreased from the kept 1430 to 1380 because Part B is intentionally missing. This change is not independently keepable without a successful runtime proof that removes runtime_proof_failures or a non-blocking custom cover implementation.","next_action_hint":"Reapply the PartA-only null suppression change only as part of a runtime-validation experiment; use .auto/run_runtime_probe_once so a successful gold load can offset the PartB penalty. If runtime succeeds, keep that as validated Part A and continue Part B with a non-blocking/custom surface."}}
{"run":9,"commit":"1061e93","metric":0,"metrics":{"readiness_gate_failures":6,"target_constants_remaining":0,"helpers_missing":0,"fixed_wait_predicates":0,"autoload_static_failures":6,"asset_chain_failures":0,"dll_patch_failures":0,"native_continue_failures":1,"field58_gate_failures":0,"direct_shortcut_failures":0,"input_path_failures":0,"runtime_proof_failures":1,"runtime_mode_failures":0,"eula_popup_failures":0,"save_data_popup_failures":0,"messagebox_dialog_failures":0,"server_status_failures":0,"title_cover_failures":1,"title_cover_penalty":50,"native_trace_blockers":0,"native_trace_hits_total":74,"native_trace_unique_breakpoints":11,"false_positives":0,"runtime_timeout_failures":1,"runtime_title_visual_suppressed_builds":1,"runtime_custom_cover_builds":0,"runtime_simulated_button_presses_total":0},"status":"crash","description":"runtime probe with Part A-only null suppression reached wrong placeholder character and timed out before product Continue","timestamp":1782352808072,"segment":0,"confidence":4,"asi":{"hypothesis":"Validate that pure Part A null suppression of the 05_000_Title BeginTitle MenuWindowJob leaves native Continue/gold autoload intact while hiding the native title visual.","error_details":"Artifact target/runtime-probe/product-continue-direct-20260624-185800: title-cover hook installed and suppressed once, ProfileSelect cover builds=0, zero simulated input and zero MessageBoxDialog, but product_core_ready_successes=0, title owner remained state 10, native Continue never started, and the run reached the placeholder '_' level-9 character (oracle_char_name='_') rather than Banon before timing out.","rollback_reason":"Runtime proof failed and loaded the wrong character; Part A null suppression alone is not a keepable product proof without fixing the native Continue/product autoload gate.","next_action_hint":"Run a visible non-headless bounded probe to observe the UI state during the Part A null-suppression stall/wrong-load behavior. Then static-trace why title_owner state 10 with null out-slot bypasses product Continue readiness; likely the hook must suppress render without returning null to the title flow or needs a separate non-blocking cover/suppress path."}}
{"run":10,"commit":"1061e93","metric":0,"metrics":{"readiness_gate_failures":6,"target_constants_remaining":0,"helpers_missing":0,"fixed_wait_predicates":0,"autoload_static_failures":6,"asset_chain_failures":0,"dll_patch_failures":0,"native_continue_failures":1,"field58_gate_failures":0,"direct_shortcut_failures":0,"input_path_failures":0,"runtime_proof_failures":1,"runtime_mode_failures":0,"eula_popup_failures":0,"save_data_popup_failures":0,"messagebox_dialog_failures":0,"server_status_failures":0,"title_cover_failures":0,"title_cover_penalty":0,"native_trace_blockers":0,"native_trace_hits_total":74,"native_trace_unique_breakpoints":11,"false_positives":0,"runtime_timeout_failures":0,"runtime_title_visual_suppressed_builds":1,"runtime_custom_cover_builds":1,"runtime_simulated_button_presses_total":0},"status":"crash","description":"visible on-screen runtime probe confirmed ProfileSelect cover path exits before readiness","timestamp":1782352912683,"segment":0,"confidence":4,"asi":{"hypothesis":"Run the current ProfileSelect cover replacement in on-screen mode so the UI state is visible while telemetry still enforces the zero-input/runtime gates.","error_details":"Artifact target/runtime-probe/product-continue-direct-20260624-190035: on-screen direct Proton window launched; first telemetry +3.1s, teardown +33.4s, reason=process_exited_before_ready. Telemetry showed title suppression=1, ProfileSelect cover build=1, simulated_button_presses_total=0, msgbox_total=0, char empty/player false. Debug log ended with save-override watchdog abort: profile summary reports zero active slots after 900 frames; gold save did not load. Teardown screenshot fail-closed because the game was gone before capture.","rollback_reason":"Runtime proof failed and the process exited before native Continue/player/world evidence. Visible mode did not make the ProfileSelect cover replacement keepable.","next_action_hint":"Stop returning ProfileSelect as the title out-job. The visible/on-screen run confirmed it still reaches the same state-10/no-Continue path and then save-override aborts. Next static RE should find a render-only suppression point below the BeginTitle job return, or inject cover through an independent overlay/custom Scaleform surface that does not occupy the title job slot.","artifact_dir":"/home/banon/projects/er-effects-rs/target/runtime-probe/product-continue-direct-20260624-190035"}}
