{"run":270,"commit":"4b02470","metric":1520,"metrics":{"readiness_gate_failures":0,"target_constants_remaining":0,"helpers_missing":0,"fixed_wait_predicates":0,"autoload_static_failures":0,"asset_chain_failures":0,"dll_patch_failures":0,"native_continue_failures":0,"field58_gate_failures":0,"direct_shortcut_failures":0,"input_path_failures":0,"runtime_proof_failures":1,"runtime_mode_failures":0,"eula_popup_failures":0,"save_data_popup_failures":0,"messagebox_dialog_failures":0,"server_status_failures":0,"title_cover_failures":0,"title_cover_penalty":0,"native_trace_blockers":0,"native_trace_hits_total":74,"native_trace_unique_breakpoints":11,"false_positives":0,"runtime_timeout_failures":0,"runtime_title_visual_suppressed_builds":0,"runtime_custom_cover_builds":0,"runtime_simulated_button_presses_total":0},"status":"keep","description":"force TitleBackViewParts hidden at ctor and SetVisible wrapper","timestamp":1782447782338,"segment":0,"confidence":null,"asi":{"hypothesis":"The screenshot and telemetry showed start-login did not fire, so the hide must attach directly to TitleBackViewParts construction and its own SetVisible wrapper rather than a downstream product/start-login phase.","evidence":"User screenshot showed the Elden Ring logo still visible during Updating save data. Runtime artifact target/runtime-probe/product-continue-direct-20260625-212001 had the start-login hook installed but oracle_title_logo_gfx_hide_calls=0 and loaded Banon. Added hooks for deobf/live TitleBackViewParts ctor 0x1409a6180 and SetVisible wrapper 0x1409a62c0; ctor calls original then forces hidden, SetVisible detour forces visible=false. cargo fmt and cargo xwin build passed; ./.auto/measure.sh stayed 1520 with false_positives=0.","user_observation":"Logo remained visible on screen even though Continue/load reached the Banon character.","next_action_hint":"Run the Banon gold-save on-screen probe again. Success requires oracle_title_logo_gfx_hide_calls>0 and no visible Elden Ring logo; if visible persists with hide_calls>0, the logo is not controlled by this TitleBackViewParts proxy visibility and the next target is the actual Scaleform display object/renderer draw node for root char 7/depth 3."}}
{"run":271,"commit":"6929670","metric":1520,"metrics":{"readiness_gate_failures":0,"target_constants_remaining":0,"helpers_missing":0,"fixed_wait_predicates":0,"autoload_static_failures":0,"asset_chain_failures":0,"dll_patch_failures":0,"native_continue_failures":0,"field58_gate_failures":0,"direct_shortcut_failures":0,"input_path_failures":0,"runtime_proof_failures":1,"runtime_mode_failures":0,"eula_popup_failures":0,"save_data_popup_failures":0,"messagebox_dialog_failures":0,"server_status_failures":0,"title_cover_failures":0,"title_cover_penalty":0,"native_trace_blockers":0,"native_trace_hits_total":74,"native_trace_unique_breakpoints":11,"false_positives":0,"runtime_timeout_failures":0,"runtime_title_visual_suppressed_builds":0,"runtime_custom_cover_builds":0,"runtime_simulated_button_presses_total":0},"status":"keep","description":"runtime proves TitleBackViewParts forced-hidden logo suppression works","timestamp":1782447873904,"segment":0,"confidence":null,"asi":{"hypothesis":"Forcing TitleBackViewParts hidden at both construction and SetVisible should suppress the visible startup logo while preserving the native Continue/load chain.","evidence":"Runtime artifact /home/banon/projects/er-effects-rs/target/runtime-probe/product-continue-direct-20260625-212324: oracle_title_logo_gfx_hide_calls=2, oracle_title_logo_gfx_any_hidden=true, last requested visible=1 forced hidden, oracle_char_name=Banon, simulated_button_presses_total=0, oracle_msgbox_total_builds=0, oracle_server_status_any_seen=false. User screenshot showed black title/loading screen with only 'Checking save data...' and no Elden Ring logo.","metric_note":"./.auto/measure.sh remained at autoload_re_score=1520 because title_cover_failures were already 0 and the remaining failure is runtime_proof_failures=1/world_stable. This keep is justified by new runtime evidence for Part A, not by a static-score increase.","user_observation":"User provided screenshot confirming the logo is gone during the startup/loading cover window.","next_action_hint":"Part A is proven. Next optimize Part B: replace the now-black cover with a custom/profile render surface. Use the GFX root-reachable finding: 05_010 dummy profile faces are exported but not root-reachable, so build or bind a visible surface rather than relying on profile-render refresh alone."}}
{"run":272,"commit":"c2cb40e","metric":1520,"metrics":{"readiness_gate_failures":0,"target_constants_remaining":0,"helpers_missing":0,"fixed_wait_predicates":0,"autoload_static_failures":0,"asset_chain_failures":0,"dll_patch_failures":0,"native_continue_failures":0,"field58_gate_failures":0,"direct_shortcut_failures":0,"input_path_failures":0,"runtime_proof_failures":1,"runtime_mode_failures":0,"eula_popup_failures":0,"save_data_popup_failures":0,"messagebox_dialog_failures":0,"server_status_failures":0,"title_cover_failures":0,"title_cover_penalty":0,"native_trace_blockers":0,"native_trace_hits_total":74,"native_trace_unique_breakpoints":11,"false_positives":0,"runtime_timeout_failures":0,"runtime_title_visual_suppressed_builds":0,"runtime_custom_cover_builds":0,"runtime_simulated_button_presses_total":0},"status":"keep","description":"run ProfileSelect custom cover job in native title pump context","timestamp":1782448860913,"segment":0,"confidence":null,"asi":{"hypothesis":"The non-returned ProfileSelect cover job was constructed but never displayed because it never entered the native MenuWindowJob pump. Running it through the same MenuWindowJob::Run trampoline when the preserved native title job runs should attach/render it without replacing the authoritative native title job or touching Continue/load semantics.","evidence":"Static RE: MenuWindowJob::Run dump 0x1407ad2b0 -> deobf/live 0x1407ad1c0 takes the valid native pump context (job, loadParams, FD4Time, CSMenuMan). Added a guarded detour: call original for the current job; only when job==TITLE_NATIVE_MENU_VISUAL_NATIVE_JOB and cover_job exists, call original on cover_job with the same args, with recursion guard and telemetry oracle_title_custom_cover_run_*. cargo fmt and cargo xwin build passed; ./.auto/measure.sh stayed 1520 with false_positives=0.","tooling_artifacts":"Also added bounded Ghidra scripts scripts/ghidra/FindAsciiRefs.java and scripts/ghidra/XrefsTo.java for targeted string/xref queries used to identify the SYSTEX/DummyProfileFace binding function.","metric_note":"Static metric unchanged because Part B static tokens were already satisfied; this keep is for runtime-testable visual path instrumentation.","next_action_hint":"Run the Banon gold-save on-screen probe. Success requires oracle_title_custom_cover_run_calls>0 and a visible ProfileSelect/profile cover surface while oracle_title_logo_gfx_any_hidden remains true and Banon still loads with zero input/message boxes."}}
{"run":273,"commit":"dc5bf61","metric":1520,"metrics":{"readiness_gate_failures":0,"target_constants_remaining":0,"helpers_missing":0,"fixed_wait_predicates":0,"autoload_static_failures":0,"asset_chain_failures":0,"dll_patch_failures":0,"native_continue_failures":0,"field58_gate_failures":0,"direct_shortcut_failures":0,"input_path_failures":0,"runtime_proof_failures":1,"runtime_mode_failures":0,"eula_popup_failures":0,"save_data_popup_failures":0,"messagebox_dialog_failures":0,"server_status_failures":0,"title_cover_failures":0,"title_cover_penalty":0,"native_trace_blockers":0,"native_trace_hits_total":74,"native_trace_unique_breakpoints":11,"false_positives":0,"runtime_timeout_failures":0,"runtime_title_visual_suppressed_builds":0,"runtime_custom_cover_builds":0,"runtime_simulated_button_presses_total":0},"status":"keep","description":"cover PAB TitleInformation surface before later title cover","timestamp":1782449498616,"segment":0,"confidence":null,"asi":{"hypothesis":"The prior ProfileSelect cover only ran after the native title job existed, leaving 05_020_TitleInformation / Press Any Button uncovered. Hooking the PAB/TitleInformation wrapper at live 0x14081f8d0, building the cover there too, and allowing the cover job to run in either PAB or title MenuWindowJob::Run context should cover the pre-menu phase without replacing native jobs.","evidence":"User observed two false positives: ProfileSelect cover is only the Load Game/profile-list canvas, not the live character scene renderer; Press Any Button also appeared and did not visibly advance. Persisted bd memory profile-select-cover-canvas-and-pab-false-positive-2026-06-25. Static grounding: deobf 0x14081f8d0 -> dump 0x14081f9c0 = 05_020_TitleInformation; deobf 0x14081f9f0 -> dump 0x14081fae0 = 05_000_Title. Added PAB wrapper hook, PAB telemetry oracle_title_pab_information_visual_*, and cover run eligibility for either the PAB job or title job. cargo fmt and cargo xwin build passed. .auto/measure.sh now recognizes helper-based cover construction and requires the PAB oracle tokens.","false_positive_handling":"oracle_title_custom_cover_run_* remains only canvas-pump proof; final visual cover still requires replacing/binding the live renderer/camera-scene surface. The PAB hook is a separate early-phase coverage fix, not proof of final profile scene cover.","next_action_hint":"Run the Banon gold-save on-screen probe. Required observations: no visible PAB leak, oracle_title_pab_information_visual_any_built=true, oracle_title_custom_cover_run_calls includes early PAB/title contexts, Banon still loads with zero input and zero MessageBox."}}
{"run":274,"commit":"574e85d","metric":1520,"metrics":{"readiness_gate_failures":0,"target_constants_remaining":0,"helpers_missing":0,"fixed_wait_predicates":0,"autoload_static_failures":0,"asset_chain_failures":0,"dll_patch_failures":0,"native_continue_failures":0,"field58_gate_failures":0,"direct_shortcut_failures":0,"input_path_failures":0,"runtime_proof_failures":1,"runtime_mode_failures":0,"eula_popup_failures":0,"save_data_popup_failures":0,"messagebox_dialog_failures":0,"server_status_failures":0,"title_cover_failures":0,"title_cover_penalty":0,"native_trace_blockers":0,"native_trace_hits_total":74,"native_trace_unique_breakpoints":11,"false_positives":0,"runtime_timeout_failures":0,"runtime_title_visual_suppressed_builds":0,"runtime_custom_cover_builds":0,"runtime_simulated_button_presses_total":0},"status":"keep","description":"hide 05_000_Title PressStart GFx component","timestamp":1782449863910,"segment":0,"confidence":null,"asi":{"hypothesis":"The visible Press Any Button text comes from 05_000_Title's own PressStart component, not 05_020_TitleInformation. Hiding TitleTopDialog+0xb78 PressStart SceneObjProxy through the native GFx visibility wrapper should remove PAB without disabling the native title job/state machine or zero-input accept byte path.","evidence":"Static GFX analysis: 05_000_title.gfx has PressStart sprite 23 at sprite33 depths 10 and 13, wrapping StaticSystemText_101000 / PRESS BUTTON; frame labels Loop=90, TextFadeOut=93, Title_TopMenu=112. Existing constants already identified TitleTopDialog+0xb78 as the PressStart SceneObjProxy. Static RE: dump 0x140733440 -> live/deobf 0x140733340 resolves SceneObjProxy value and calls GFx visibility setter FUN_140d84580(value,bool). Added maybe_hide_title_press_start before accept byte arming plus telemetry oracle_title_press_start_gfx_*; cargo fmt, cargo xwin build, and .auto/measure.sh pass at 1520 with false_positives=0.","next_action_hint":"Run the Banon gold-save on-screen probe. Required observations: oracle_title_press_start_gfx_any_hidden=true, no visible Press Any Button, title_accept_byte still fires, Banon still loads with zero input/message boxes. If PAB remains visible despite hide calls, the target is not +0xb78 or native re-shows it later; hook the named-child constructor 0x14074a7c0/PressStart binding next."}}
{"run":275,"commit":"998e21f","metric":1520,"metrics":{"readiness_gate_failures":0,"target_constants_remaining":0,"helpers_missing":0,"fixed_wait_predicates":0,"autoload_static_failures":0,"asset_chain_failures":0,"dll_patch_failures":0,"native_continue_failures":0,"field58_gate_failures":0,"direct_shortcut_failures":0,"input_path_failures":0,"runtime_proof_failures":1,"runtime_mode_failures":0,"eula_popup_failures":0,"save_data_popup_failures":0,"messagebox_dialog_failures":0,"server_status_failures":0,"title_cover_failures":0,"title_cover_penalty":0,"native_trace_blockers":0,"native_trace_hits_total":74,"native_trace_unique_breakpoints":11,"false_positives":0,"runtime_timeout_failures":0,"runtime_title_visual_suppressed_builds":0,"runtime_custom_cover_builds":0,"runtime_simulated_button_presses_total":0},"status":"keep","description":"hide PressStart on proven title accept-byte path","timestamp":1782450038207,"segment":0,"confidence":null,"asi":{"hypothesis":"The PressStart hide did not fire because the product-core readiness branch was not the active runtime path in the observed probe. The proven path is maybe_set_title_accept_byte, which has the live TitleTopDialog and fires before the zero-input accept byte; colocating the PressStart SceneObjProxy hide there should hide PAB at the actual transition point.","evidence":"Runtime falsification artifact product-continue-direct-20260625-215803: screenshot showed PAB; telemetry had oracle_title_press_start_gfx_hide_calls=0 and product_core_last_title_dialog=None, while debug showed title-accept-byte fired. Moved PressStart hide into maybe_set_title_accept_byte using dialog+0xb78 when its vtable matches SceneObjProxy. cargo fmt, cargo xwin build, and .auto/measure.sh pass at 1520.","next_action_hint":"Run the Banon gold-save on-screen probe. Required: title-accept-byte fires and immediately prior PressStart hide log/telemetry appears. If PAB still visible with hide_calls>0, the named-child proxy is not the drawn text or native re-shows it after accept; hook the named-child constructor / GFx SetVisible calls for StaticSystemText_101000 next."}}
{"run":276,"commit":"0983751","metric":1520,"metrics":{"readiness_gate_failures":0,"target_constants_remaining":0,"helpers_missing":0,"fixed_wait_predicates":0,"autoload_static_failures":0,"asset_chain_failures":0,"dll_patch_failures":0,"native_continue_failures":0,"field58_gate_failures":0,"direct_shortcut_failures":0,"input_path_failures":0,"runtime_proof_failures":1,"runtime_mode_failures":0,"eula_popup_failures":0,"save_data_popup_failures":0,"messagebox_dialog_failures":0,"server_status_failures":0,"title_cover_failures":0,"title_cover_penalty":0,"native_trace_blockers":0,"native_trace_hits_total":74,"native_trace_unique_breakpoints":11,"false_positives":0,"runtime_timeout_failures":0,"runtime_title_visual_suppressed_builds":0,"runtime_custom_cover_builds":0,"runtime_simulated_button_presses_total":0},"status":"keep","description":"force hidden only latched PressStart GFx value","timestamp":1782450306382,"segment":0,"confidence":null,"asi":{"hypothesis":"The PressStart proxy wrapper hide hit but the text remained visible; native may re-show the underlying CSScaleformValue or the proxy identity may differ. Hooking the lower-level GFx visibility setter and forcing false only when its value pointer matches the latched PressStart value should catch re-show without a global GFx visibility side effect.","evidence":"Static RE: FUN_140d84580 has one code caller, FUN_140733440, and mutates GFx visible flag. live/deobf 0x140d844d0. Added TITLE_GFX_VALUE_SET_VISIBLE_RVA hook and telemetry oracle_title_press_start_gfx_force_false_*. The hook only changes requested visible to 0 when value == TITLE_PRESS_START_GFX_VALUE latched from proxy+0x18 before the existing wrapper call. cargo fmt/cargo xwin build succeeded; .auto/measure.sh passed at 1520.","next_action_hint":"Run the Banon gold-save on-screen probe. If PAB remains visible and force_false_calls is 0, the drawn text is a different value/proxy; next hook named-child constructor 0x14074a7c0 for PressStart/StaticSystemText. If force_false_calls > 0 but PAB remains, visibility is not sufficient and the text/display list must be removed or text alpha set directly."}}
{"run":277,"commit":"05ea1de","metric":1520,"metrics":{"readiness_gate_failures":0,"target_constants_remaining":0,"helpers_missing":0,"fixed_wait_predicates":0,"autoload_static_failures":0,"asset_chain_failures":0,"dll_patch_failures":0,"native_continue_failures":0,"field58_gate_failures":0,"direct_shortcut_failures":0,"input_path_failures":0,"runtime_proof_failures":1,"runtime_mode_failures":0,"eula_popup_failures":0,"save_data_popup_failures":0,"messagebox_dialog_failures":0,"server_status_failures":0,"title_cover_failures":0,"title_cover_penalty":0,"native_trace_blockers":0,"native_trace_hits_total":74,"native_trace_unique_breakpoints":11,"false_positives":0,"runtime_timeout_failures":0,"runtime_title_visual_suppressed_builds":0,"runtime_custom_cover_builds":0,"runtime_simulated_button_presses_total":0},"status":"keep","description":"hide PressStart at named-child bind time","timestamp":1782450803195,"segment":0,"confidence":null,"asi":{"hypothesis":"The drawn PAB object may be bound/recreated after the direct dialog+0xb78 hide. Hooking the actual named-child SceneObjProxy bind helper at live 0x14074a2f0 should hide PressStart/StaticSystemText immediately after native binding and expose whether that helper sees the drawn PAB object.","evidence":"Static disassembly of TitleTopDialog ctor shows call 0x14074a2f0 with r8=0x142b26500 at dialog+0xb78; 0x14074a2f0 is a real 3-arg child-bind helper despite Ghidra boundary confusion. Added hook for names PressStart, StaticSystemText_101000, PRESS BUTTON; it forwards native, latches out_proxy/context/value, hides through 0x140733340, and records oracle_title_press_start_bind_*. cargo fmt/cargo xwin build and .auto/measure.sh passed at 1520.","next_action_hint":"Run the Banon gold-save on-screen probe. If PAB remains and bind_hits=0, the bind hook is too late/wrong name pointer format; trace all 0x14074a2f0 names. If bind_hits>0 but PAB remains, the visible text is a separate static text field/display-list copy; target character 22/23 display-list removal or text alpha."}}
{"run":278,"commit":"15483ca","metric":1520,"metrics":{"readiness_gate_failures":0,"target_constants_remaining":0,"helpers_missing":0,"fixed_wait_predicates":0,"autoload_static_failures":0,"asset_chain_failures":0,"dll_patch_failures":0,"native_continue_failures":0,"field58_gate_failures":0,"direct_shortcut_failures":0,"input_path_failures":0,"runtime_proof_failures":1,"runtime_mode_failures":0,"eula_popup_failures":0,"save_data_popup_failures":0,"messagebox_dialog_failures":0,"server_status_failures":0,"title_cover_failures":0,"title_cover_penalty":0,"native_trace_blockers":0,"native_trace_hits_total":74,"native_trace_unique_breakpoints":11,"false_positives":0,"runtime_timeout_failures":0,"runtime_title_visual_suppressed_builds":0,"runtime_custom_cover_builds":0,"runtime_simulated_button_presses_total":0},"status":"keep","description":"runtime validates PressStart bind-time hide removes PAB","timestamp":1782450983172,"segment":0,"confidence":null,"asi":{"hypothesis":"If the named-child bind hook is the correct PAB object path, runtime should show bind-time PressStart hides and the visible Press Any Button text should disappear while the native zero-input load still reaches Banon without input/message boxes.","evidence":"Runtime artifact target/runtime-probe/product-continue-direct-20260625-221400: oracle_title_press_start_bind_hits=2, oracle_title_press_start_bind_hide_calls=2, oracle_title_press_start_gfx_hide_calls=1, oracle_char_name=Banon, simulated_button_presses_total=0, oracle_msgbox_total_builds=0. User screenshot confirmed PAB text is gone. Persisted bd memory pressstart-bind-hide-validated-2026-06-25.","metric_note":"Primary metric unchanged at 1520 because the scorer already had title_cover_failures=0; this keep preserves runtime-validated visual false-positive fix.","next_action_hint":"Proceed to final Part B: ProfileSelect cover is only the canvas/list screen. Identify/bind the live profile/character renderer scene or replace the visible cover with a custom root-reachable surface, without regressing PAB hide or native Continue/load."}}
