{"run":537,"commit":"4dc167b","metric":0,"metrics":{"readiness_gate_failures":0,"target_constants_remaining":0,"helpers_missing":0,"fixed_wait_predicates":0,"autoload_static_failures":0,"asset_chain_failures":0,"dll_patch_failures":0,"native_continue_failures":0,"field58_gate_failures":0,"direct_shortcut_failures":0,"input_path_failures":0,"runtime_proof_failures":0,"runtime_mode_failures":0,"eula_popup_failures":0,"save_data_popup_failures":0,"messagebox_dialog_failures":0,"server_status_failures":0,"title_cover_failures":2,"title_cover_penalty":1800,"native_trace_blockers":0,"native_trace_hits_total":74,"native_trace_unique_breakpoints":11,"false_positives":0,"offline_face_source_ready":1,"removed path_cpu_texture_bridge_ready":0,"offline_face_texture_runtime_drawn":0,"stylized_facedata_pixel_oracle":0,"real_portrait_asset_candidates":0,"profile_placeholder_assets_only":1},"status":"discard","description":"Ground custom MemoryFile return allocator and constructor ABI","timestamp":1782618407592,"segment":2,"confidence":null,"asi":{"hypothesis":"Before implementing an embedded-GFX return from the synthetic Scaleform Open hook, ground the exact native allocator and MemoryFile constructor ABI to avoid passing invalid raw URL/name pointers or inventing object layout.","static_finding":"Deobf 0x140ce8240 repository wrapper allocates a 0x30-byte File object via allocator singleton 0x144593250 vfunc +0x50, then calls MemoryFile ctor deobf 0x140ce7bb0 with rcx=obj, rdx=&ScaleformStringRef, r8=payload_bytes_ptr, r9d=payload_len. The ctor writes MemoryFile vtable 0x142ba4c80, refcount=1, initializes embedded filename/string object at +0x10 via 0x1411410f0, stores bytes +0x18, size +0x20, cursor +0x24, and valid byte +0x28. Hazard: ctor rdx is not a raw C string; the native wrapper first builds a proper Scaleform string/ref object on stack using deobf 0x141141390. Passing url: *const i8 directly as rdx to 0x140ce7bb0 would be invalid and likely crash. Deallocation pair is the same allocator vfunc +0x60.","validation":"Beads memory precheck; er_disasm deobf 0x140ce8240 and 0x140ce7bb0; Ghidra decompile 0x140ce8320 and 0x140ce7c90; Ghidra/deobf lookup of string helper 0x141141110/0x1411413b0 and deobf disasm 0x1411410f0/0x141141390; run_experiment ./.auto/measure.sh without runtime trigger.","memory_recorded":"bd remember scaleform-memoryfile-custom-return-abi-2026-06-28","rollback_reason":"Primary metric stayed 0; this was static ABI grounding and did not implement a visible portrait-cover surface, custom File return, synthetic URL request, or runtime portrait-pixel oracle.","next_action_hint":"Next code spike can safely build a MemoryFile return only if it either calls 0x141141390 to create a valid Scaleform string/ref for the name before 0x140ce7bb0, or manually initializes the +0x10 string object correctly. Use a tiny known-good GFX payload such as 05_000_title.gfx for route validation, but do not score it as portrait proof."}}
{"run":538,"commit":"4dc167b","metric":0,"metrics":{"readiness_gate_failures":0,"target_constants_remaining":0,"helpers_missing":0,"fixed_wait_predicates":0,"autoload_static_failures":0,"asset_chain_failures":0,"dll_patch_failures":0,"native_continue_failures":0,"field58_gate_failures":0,"direct_shortcut_failures":0,"input_path_failures":0,"runtime_proof_failures":0,"runtime_mode_failures":0,"eula_popup_failures":0,"save_data_popup_failures":0,"messagebox_dialog_failures":0,"server_status_failures":0,"title_cover_failures":2,"title_cover_penalty":1800,"native_trace_blockers":0,"native_trace_hits_total":74,"native_trace_unique_breakpoints":11,"false_positives":0,"offline_face_source_ready":1,"removed path_cpu_texture_bridge_ready":0,"offline_face_texture_runtime_drawn":0,"stylized_facedata_pixel_oracle":0,"real_portrait_asset_candidates":0,"profile_placeholder_assets_only":1},"status":"discard","description":"Ground ScaleformStringRef helper ABI for safe MemoryFile return","timestamp":1782618531955,"segment":2,"confidence":null,"asi":{"hypothesis":"Ground whether the string/ref builder used before MemoryFile ctor can consume a normal null-terminated ASCII name pointer, so the next embedded-GFX hook implementation does not manually fake a Scaleform string object or pass raw URL directly to the ctor.","static_finding":"Deobf 0x141141390 initializes an out string/ref to the shared empty block 0x143b6aa68, increments refcount 0x143b6aa70, then if name is non-null calls deobf 0x141142b70. 0x141142b70 computes strlen(name) via 0x141175160, allocates a string block via allocator/state vfunc +0x50 with length+0x10, writes len/refcount/bytes/trailing NUL, stores the block pointer with tag bits into *out, and releases the previous ref via 0x141140bb0/allocator +0x60. This means a future hook can build a stack name_ref with 0x141141390(&mut name_ref, SCALEFORM_SYNTHETIC_COVER_URL.as_ptr()), then call MemoryFile ctor 0x140ce7bb0(obj, &name_ref, embedded_gfx_ptr, embedded_gfx_len). The helper accepts a normal char* name, but the MemoryFile ctor still does not.","validation":"Beads memory precheck; Ghidra decompile of 0x141142b90 and 0x141140d70; deobf disassembly of 0x141142b70, 0x141140d50, 0x141141390 path; run_experiment ./.auto/measure.sh without runtime trigger.","memory_recorded":"bd remember scaleform-string-ref-helper-abi-2026-06-28","rollback_reason":"Primary metric stayed 0; this was static ABI grounding and did not implement a custom File return, visible portrait surface, synthetic URL request, or runtime portrait-pixel oracle.","next_action_hint":"Next code spike can reapply the default-off Open hook, call 0x141141390 to build a name_ref, allocate 0x30 bytes via 0x144593250 vfunc +0x50, then call 0x140ce7bb0 to return a MemoryFile over embedded 05_000_title.gfx bytes for route validation. Keep it diagnostic-only and compile-check it."}}
{"run":539,"commit":"4dc167b","metric":0,"metrics":{"readiness_gate_failures":0,"target_constants_remaining":0,"helpers_missing":0,"fixed_wait_predicates":0,"autoload_static_failures":0,"asset_chain_failures":0,"dll_patch_failures":0,"native_continue_failures":0,"field58_gate_failures":0,"direct_shortcut_failures":0,"input_path_failures":0,"runtime_proof_failures":0,"runtime_mode_failures":0,"eula_popup_failures":0,"save_data_popup_failures":0,"messagebox_dialog_failures":0,"server_status_failures":0,"title_cover_failures":2,"title_cover_penalty":1800,"native_trace_blockers":0,"native_trace_hits_total":74,"native_trace_unique_breakpoints":11,"false_positives":0,"offline_face_source_ready":1,"removed path_cpu_texture_bridge_ready":0,"offline_face_texture_runtime_drawn":0,"stylized_facedata_pixel_oracle":0,"real_portrait_asset_candidates":0,"profile_placeholder_assets_only":1},"status":"discard","description":"Implement compile-checked default-on synthetic Scaleform MemoryFile return","timestamp":1782619004084,"segment":2,"confidence":null,"asi":{"hypothesis":"Implement the actual default-on-for-real-runs synthetic Scaleform Open hook that returns a native MemoryFile over embedded known-good 05_000_title.gfx bytes only when the synthetic URL is requested. This validates route plumbing without claiming portrait proof.","implementation":"Patched constants, default-on real-autoload gating, lib attach wiring, startup_hooks hook/install/MemoryFile construction, and telemetry. The hook compares menu:/er_effects_portrait_cover.gfx and menu:/Win/er_effects_portrait_cover.gfx, allocates 0x30 bytes via allocator singleton vfunc +0x50, builds name_ref via 0x141141390, calls MemoryFile ctor 0x140ce7bb0 with embedded 05_000_title.gfx bytes, records memoryfile return telemetry, and passes native URLs to the original opener. Telemetry-only and autoload-disabled runs remain clean. User correction folded in: this is not opt-in for product runs; it is default-on as long as the hook is present and not broken.","validation":"Plain cargo check failed due non-xwin MSVC toolchain gaps (`windows.h`/`lib.exe`), so used repo-appropriate `cargo xwin check --target x86_64-pc-windows-msvc -q`, which passed with warnings only. Then run_experiment ./.auto/measure.sh passed without runtime trigger.","memory_recorded":"bd remember scaleform-memoryfile-return-implementation-spike-2026-06-28","rollback_reason":"Primary metric stayed 0; the hook compiles but no native code requested the synthetic URL, no custom surface rendered, and no runtime portrait-pixel oracle exists. Keeping route plumbing alone would not be a primary improvement.","next_action_hint":"Next step is to identify or create the title-safe native load/render call that requests menu:/er_effects_portrait_cover.gfx and validates memoryfile_returns at runtime. Also fix the temporary name_ref release/leak before keeping product code if repeated synthetic requests are possible."}}
{"run":540,"commit":"4dc167b","metric":0,"metrics":{"readiness_gate_failures":0,"target_constants_remaining":0,"helpers_missing":0,"fixed_wait_predicates":0,"autoload_static_failures":0,"asset_chain_failures":0,"dll_patch_failures":0,"native_continue_failures":0,"field58_gate_failures":0,"direct_shortcut_failures":0,"input_path_failures":0,"runtime_proof_failures":0,"runtime_mode_failures":0,"eula_popup_failures":0,"save_data_popup_failures":0,"messagebox_dialog_failures":0,"server_status_failures":0,"title_cover_failures":2,"title_cover_penalty":1800,"native_trace_blockers":0,"native_trace_hits_total":74,"native_trace_unique_breakpoints":11,"false_positives":0,"offline_face_source_ready":1,"removed path_cpu_texture_bridge_ready":0,"offline_face_texture_runtime_drawn":0,"stylized_facedata_pixel_oracle":0,"real_portrait_asset_candidates":0,"profile_placeholder_assets_only":1},"status":"discard","description":"Static map of native dynamic Scaleform load consumer for synthetic URL route","timestamp":1782619207166,"segment":2,"confidence":null,"asi":{"hypothesis":"Map the native dynamic Scaleform load consumer that can request the synthetic er_effects_portrait_cover GFX URL, so the compiled MemoryFile hook has a real engine path instead of dead FileOpener plumbing.","evidence":"Ghidra decompilation shows dump FUN_140d6a990 (deobf 0x140d6a8e0) calls FUN_140d786e0 (deobf 0x140d78630), which resolves/creates resources through FUN_140d7ac70 (deobf 0x140d7abc0). Its callers include MenuResource/SceneObjProxy helpers FUN_140749840 (deobf 0x140749740), FUN_1407495f0 (deobf 0x1407494f0), and CS::MenuWindowJob::Run dump 0x1407ad2b0 -> deobf 0x1407ad1c0. These populate CSScaleformLoadInfo from object+0x48/+0x50 and call GLOBAL_CSScaleform dynamic load.","memory_recorded":"bd remember scaleform-dynamic-load-consumer-map-2026-06-28","validation":"run_experiment ./.auto/measure.sh passed in 1.5s with unchanged score 0 and false_positives=0.","rollback_reason":"Primary metric stayed 0; this was static route mapping only, with no code change, no synthetic URL request, no visible custom surface, and no portrait pixel/native oracle.","next_action_hint":"Implement or prototype a native MenuResource/MenuWindowJob-style request object whose filename is the synthetic er_effects_portrait_cover name, letting the native dynamic load path request menu:/...gfx and hit the MemoryFile hook. Do not cold-call FileOpener directly or infer portrait proof from route plumbing."}}
{"run":541,"commit":"4dc167b","metric":0,"metrics":{"readiness_gate_failures":0,"target_constants_remaining":0,"helpers_missing":0,"fixed_wait_predicates":0,"autoload_static_failures":0,"asset_chain_failures":0,"dll_patch_failures":0,"native_continue_failures":0,"field58_gate_failures":0,"direct_shortcut_failures":0,"input_path_failures":0,"runtime_proof_failures":0,"runtime_mode_failures":0,"eula_popup_failures":0,"save_data_popup_failures":0,"messagebox_dialog_failures":0,"server_status_failures":0,"title_cover_failures":2,"title_cover_penalty":1800,"native_trace_blockers":0,"native_trace_hits_total":74,"native_trace_unique_breakpoints":11,"false_positives":0,"offline_face_source_ready":1,"removed path_cpu_texture_bridge_ready":0,"offline_face_texture_runtime_drawn":0,"stylized_facedata_pixel_oracle":0,"real_portrait_asset_candidates":0,"profile_placeholder_assets_only":1},"status":"discard","description":"Static map of MenuWindowProxy request-object shape for synthetic Scaleform GFX","timestamp":1782619375821,"segment":2,"confidence":null,"asi":{"hypothesis":"Map the native MenuWindowProxy/MenuResource constructor path so a future implementation can request er_effects_portrait_cover through an engine-owned resource object instead of cold-calling FileOpener.","evidence":"Ghidra shows FUN_140748cf0 constructs a CS::MenuWindowProxy-like object, copying a 16-byte load-info record into +0x48/+0x4c/+0x50/+0x54 and initializing fields later consumed by FUN_140749440/4e0/0f0. Dump->deobf: 0x140748cf0->0x140748bf0, 0x140749440->0x140749340, 0x1407494e0->0x1407493e0, 0x1407490f0->0x140748ff0, 0x140749140->0x140749040, ChrMakeTopDialog caller 0x1408b4b60->0x1408b4a70. ChrMakeTopDialog demonstrates the constructor with filename L\"04_100_ChrMake_BG\" before native wrapper load/show/fade calls.","memory_recorded":"bd remember scaleform-menuwindowproxy-request-object-map-2026-06-28","validation":"run_experiment ./.auto/measure.sh passed in 1.5s with unchanged score 0 and false_positives=0.","rollback_reason":"Primary metric stayed 0; this was static route mapping only, with no synthetic resource object implemented, no runtime synthetic URL request, no visible custom surface, and no portrait oracle.","next_action_hint":"Next implementation spike should construct or embed the same 16-byte load-info/filename layout for er_effects_portrait_cover and use native MenuWindowProxy wrapper semantics to request/show it, while restoring/keeping the MemoryFile hook. Do not cold-call FileOpener or score route plumbing as portrait proof."}}
{"run":542,"commit":"4dc167b","metric":0,"metrics":{"readiness_gate_failures":0,"target_constants_remaining":0,"helpers_missing":0,"fixed_wait_predicates":0,"autoload_static_failures":0,"asset_chain_failures":0,"dll_patch_failures":0,"native_continue_failures":0,"field58_gate_failures":0,"direct_shortcut_failures":0,"input_path_failures":0,"runtime_proof_failures":0,"runtime_mode_failures":0,"eula_popup_failures":0,"save_data_popup_failures":0,"messagebox_dialog_failures":0,"server_status_failures":0,"title_cover_failures":2,"title_cover_penalty":1800,"native_trace_blockers":0,"native_trace_hits_total":74,"native_trace_unique_breakpoints":11,"false_positives":0,"offline_face_source_ready":1,"removed path_cpu_texture_bridge_ready":0,"offline_face_texture_runtime_drawn":0,"stylized_facedata_pixel_oracle":0,"real_portrait_asset_candidates":0,"profile_placeholder_assets_only":1},"status":"discard","description":"Compile-checked MenuWindowProxy synthetic Scaleform request scaffold","timestamp":1782619637498,"segment":2,"confidence":null,"asi":{"hypothesis":"Prototype the native MenuWindowProxy request path enough to compile-check it by adding constants/types and a guarded load-info helper for er_effects_portrait_cover, without promoting route plumbing to portrait proof.","implementation":"Added deobf route constants for MenuWindowProxy ctor/wrappers and dynamic Scaleform load path, load-info offsets, min object size, wide synthetic name, diagnostic counters, `SyntheticScaleformLoadInfo`, default-off operator gate, and `synthetic_scaleform_cover_load_info()` returning the native 16-byte `{MenuJobResult, filename}` shape. The helper records filename/counter telemetry and deliberately does not store a pointer to its local return value.","validation":"`cargo fmt && cargo xwin check --target x86_64-pc-windows-msvc -q` passed with no output. `run_experiment ./.auto/measure.sh` passed in 1.6s with unchanged score 0 and false_positives=0.","memory_recorded":"bd remember scaleform-menuwindowproxy-request-scaffold-2026-06-28","rollback_reason":"Primary metric stayed 0; this scaffold does not request the synthetic URL, does not restore/trigger the MemoryFile hook, renders no custom surface, and exposes no portrait oracle. Keeping constants/helper alone would not improve the product.","next_action_hint":"Next spike should wire this load-info into a real engine-owned MenuWindowProxy/MenuResource object and call native wrapper semantics to request/show it, while restoring the MemoryFile hook. Validate runtime synthetic URL hits/memoryfile_returns before any portrait scoring."}}
{"run":543,"commit":"4dc167b","metric":0,"metrics":{"readiness_gate_failures":0,"target_constants_remaining":0,"helpers_missing":0,"fixed_wait_predicates":0,"autoload_static_failures":0,"asset_chain_failures":0,"dll_patch_failures":0,"native_continue_failures":0,"field58_gate_failures":0,"direct_shortcut_failures":0,"input_path_failures":0,"runtime_proof_failures":0,"runtime_mode_failures":0,"eula_popup_failures":0,"save_data_popup_failures":0,"messagebox_dialog_failures":0,"server_status_failures":0,"title_cover_failures":2,"title_cover_penalty":1800,"native_trace_blockers":0,"native_trace_hits_total":74,"native_trace_unique_breakpoints":11,"false_positives":0,"offline_face_source_ready":1,"removed path_cpu_texture_bridge_ready":0,"offline_face_texture_runtime_drawn":0,"stylized_facedata_pixel_oracle":0,"real_portrait_asset_candidates":0,"profile_placeholder_assets_only":1},"status":"discard","description":"Compile-checked native-call scaffold for synthetic Scaleform MenuWindowProxy route","timestamp":1782619865068,"segment":2,"confidence":null,"asi":{"hypothesis":"Extend the synthetic Scaleform route from a data-only scaffold to a compile-checked native-call scaffold with typed function pointers for the MenuWindowProxy ctor/show path, still default-off and not scored as portrait proof.","implementation":"Added route constants and SyntheticScaleformLoadInfo, then added typed native function pointers and default-off `try_request_synthetic_scaleform_cover_with_proxy(proxy_storage, scene_context, arg4)`. The function refuses unless the explicit diagnostic gate is present, rejects null/missing context, builds the 16-byte wide-name load-info for er_effects_portrait_cover, resolves ctor/show RVAs, calls the ctor, records return/filename/counters, then calls the native show wrapper only after a non-null ctor return.","validation":"Initial compile failed because NULL_PTR is not in startup_hooks scope; fixed by using literal 0 for null checks. `cargo fmt && cargo xwin check --target x86_64-pc-windows-msvc -q` then passed with no output. `run_experiment ./.auto/measure.sh` passed in 1.4s with unchanged score 0 and false_positives=0.","memory_recorded":"bd remember scaleform-menuwindowproxy-native-call-scaffold-2026-06-28","rollback_reason":"Primary metric stayed 0; this function is not called by product code, does not restore/trigger the MemoryFile hook, requests/renders no synthetic surface, and proves no portrait pixels. Keeping an unused default-off scaffold would not improve the product.","next_action_hint":"Next step: identify a real engine-owned proxy storage/context (for example a TitleBackViewParts/MenuWindow embedded object or safe custom object lifetime) and wire this scaffold under a bounded runtime diagnostic together with the MemoryFile hook to prove synthetic URL requests/memoryfile_returns before any portrait scoring."}}
