{"run":544,"commit":"4dc167b","metric":0,"metrics":{"readiness_gate_failures":0,"target_constants_remaining":0,"helpers_missing":0,"fixed_wait_predicates":0,"autoload_static_failures":0,"asset_chain_failures":0,"dll_patch_failures":0,"native_continue_failures":0,"field58_gate_failures":0,"direct_shortcut_failures":0,"input_path_failures":0,"runtime_proof_failures":0,"runtime_mode_failures":0,"eula_popup_failures":0,"save_data_popup_failures":0,"messagebox_dialog_failures":0,"server_status_failures":0,"title_cover_failures":2,"title_cover_penalty":1800,"native_trace_blockers":0,"native_trace_hits_total":74,"native_trace_unique_breakpoints":11,"false_positives":0,"offline_face_source_ready":1,"removed path_cpu_texture_bridge_ready":0,"offline_face_texture_runtime_drawn":0,"stylized_facedata_pixel_oracle":0,"real_portrait_asset_candidates":0,"profile_placeholder_assets_only":1},"status":"discard","description":"Static correction: TitleBackViewParts uses MenuResource, not MenuWindowProxy storage","timestamp":1782620035879,"segment":2,"confidence":null,"asi":{"hypothesis":"Identify whether TitleBackViewParts already owns a suitable MenuWindowProxy/proxy storage/context for the synthetic er_effects_portrait_cover request, instead of allocating an unsafe standalone object.","evidence":"Ghidra shows TitleBackViewParts constructor dump 0x1409a62d0 -> deobf 0x1409a6180 writes the TitleBackViewParts vtable, calls CS::MenuResource::MenuResource on this+0x8, then calls resolver FUN_140749290 on this+0x8 and this+0x70. MenuResource ctor dump 0x140748b30 -> deobf 0x140748a30 copies only the 16-byte {jobResult, filename} record into +0x48/+0x50 and zeroes +0x58/+0x60; it is not the larger MenuWindowProxy ctor 0x140748cf0/0x140748bf0. TitleTopDialog dump 0x1409a82d0 embeds TitleBackViewParts at dialog+0xaa8 and passes L\"05_001_Title_Logo\".","memory_recorded":"bd remember titlebackviewparts-menuresource-not-menuwindowproxy-2026-06-28","validation":"run_experiment ./.auto/measure.sh passed in 1.9s with unchanged score 0 and false_positives=0.","transient_issue":"bd remember initially warned that auto-export git add could not create .git/index.lock; immediate check found no lock file and no active git processes, so it was transient and did not block run_experiment/log_experiment.","rollback_reason":"Primary metric stayed 0; this was static route correction only, with no runtime synthetic request, no MemoryFile hit, no visible surface, and no portrait oracle.","next_action_hint":"Do not shoehorn the MenuWindowProxy scaffold into TitleBackViewParts. Next static target is MenuResource destructor/release and resolver/reinit semantics; implementation should either reconstruct a TitleBackViewParts/MenuResource with synthetic load-info safely or create a separate owned TitleBackViewParts-like object before runtime testing."}}
{"run":545,"commit":"4dc167b","metric":0,"metrics":{"readiness_gate_failures":0,"target_constants_remaining":0,"helpers_missing":0,"fixed_wait_predicates":0,"autoload_static_failures":0,"asset_chain_failures":0,"dll_patch_failures":0,"native_continue_failures":0,"field58_gate_failures":0,"direct_shortcut_failures":0,"input_path_failures":0,"runtime_proof_failures":0,"runtime_mode_failures":0,"eula_popup_failures":0,"save_data_popup_failures":0,"messagebox_dialog_failures":0,"server_status_failures":0,"title_cover_failures":2,"title_cover_penalty":1800,"native_trace_blockers":0,"native_trace_hits_total":74,"native_trace_unique_breakpoints":11,"false_positives":0,"offline_face_source_ready":1,"removed path_cpu_texture_bridge_ready":0,"offline_face_texture_runtime_drawn":0,"stylized_facedata_pixel_oracle":0,"real_portrait_asset_candidates":0,"profile_placeholder_assets_only":1},"status":"discard","description":"Static map of MenuResource/TitleBackViewParts teardown semantics","timestamp":1782620234167,"segment":2,"confidence":null,"asi":{"hypothesis":"Decode CS::MenuResource teardown/reinit safety before any runtime attempt to replace the title-logo resource with synthetic er_effects_portrait_cover.","evidence":"MenuResource ctor dump 0x140748b30 -> deobf 0x140748a30 initializes vtable/load result/Scaleform value, copies {jobResult, filename} into +0x48/+0x50, zeroes +0x58/+0x60. Related ctor 0x140748bc0 -> 0x140748ac0 copies extra +0x58. Destructor/release dump 0x140748e80 -> deobf 0x140748d80 unregisters +0x60 via GLOBAL_CSScaleform helper 0x140d6aaa0 -> 0x140d6a9f0, destroys +0x10 CSScaleformValue, releases +0x8 load-result refs, then sets DLNonCopyable vtable. TitleBackViewParts destructor dump 0x1409a6330 -> deobf 0x1409a61e0 destroys +0x98 SceneObjProxy/ScaleformValue and calls MenuResource destructor on this+0x8; deleting destructor 0x1409a6380 -> 0x1409a6230 then operator_deletes size 0xd0.","memory_recorded":"bd remember menuresource-titleback-teardown-semantics-2026-06-28","validation":"run_experiment ./.auto/measure.sh passed in 1.5s with unchanged score 0 and false_positives=0.","rollback_reason":"Primary metric stayed 0; this was static lifetime mapping only, with no runtime synthetic request, no MemoryFile hit, no visible surface, and no portrait oracle.","next_action_hint":"For runtime implementation, either allocate/own a fresh 0xd0 TitleBackViewParts-like object or call the proven destructor before reinitializing live dialog+0xaa8. Do not overwrite live title logo cold, and do not use the MenuWindowProxy scaffold for this object."}}
{"run":546,"commit":"4dc167b","metric":0,"metrics":{"readiness_gate_failures":0,"target_constants_remaining":0,"helpers_missing":0,"fixed_wait_predicates":0,"autoload_static_failures":0,"asset_chain_failures":0,"dll_patch_failures":0,"native_continue_failures":0,"field58_gate_failures":0,"direct_shortcut_failures":0,"input_path_failures":0,"runtime_proof_failures":0,"runtime_mode_failures":0,"eula_popup_failures":0,"save_data_popup_failures":0,"messagebox_dialog_failures":0,"server_status_failures":0,"title_cover_failures":2,"title_cover_penalty":1800,"native_trace_blockers":0,"native_trace_hits_total":74,"native_trace_unique_breakpoints":11,"false_positives":0,"offline_face_source_ready":1,"removed path_cpu_texture_bridge_ready":0,"offline_face_texture_runtime_drawn":0,"stylized_facedata_pixel_oracle":0,"real_portrait_asset_candidates":0,"profile_placeholder_assets_only":1},"status":"discard","description":"Static owned TitleBackViewParts construction route for synthetic Scaleform surface","timestamp":1782620417897,"segment":2,"confidence":null,"asi":{"hypothesis":"Identify whether a fresh owned TitleBackViewParts object can be constructed/attached safely, versus reinitializing live dialog+0xaa8.","evidence":"TitleTopDialog constructs title-logo part at dialog+0xaa8 with load-info {state=5, field byte=1, filename=L\"05_001_Title_Logo\"} and ctor deobf 0x1409a6180. Constructor only writes TitleBackViewParts vtable, constructs MenuResource at this+0x8, and resolves into SceneObjProxy at this+0x70; no parent pointer is stored in the object. Native post-construct method dump 0x1409a63f0 -> deobf 0x1409a62a0 just calls FUN_140749ae0(this+0x88,\"FadeIn\"), where this+0x88 is SceneObjProxy+0x18. Grounded helper addresses: FadeIn label call 0x1407499e0, set-visible 0x140733340, scene insert/helper 0x140733ef0, assignComponentWithName 0x14074a200.","memory_recorded":"bd remember titlebackviewparts-owned-object-route-2026-06-28","validation":"run_experiment ./.auto/measure.sh passed in 1.5s with unchanged score 0 and false_positives=0.","rollback_reason":"Primary metric stayed 0; this was static route validation only, with no owned object implemented, no runtime synthetic URL request, no MemoryFile hit, no visible surface, and no portrait oracle.","next_action_hint":"Next implementation spike can allocate/own 0xd0 bytes in the DLL, call TitleBackViewParts ctor 0x1409a6180 with synthetic load-info {state=5, field byte=1, filename=L\"er_effects_portrait_cover\"}, call post-construct fade-in 0x1409a62a0, keep storage alive, and call non-deleting destructor 0x1409a61e0 on teardown. It must run only as a bounded diagnostic with the MemoryFile hook and must not score until synthetic URL hits plus visible portrait proof exist."}}
{"run":547,"commit":"4dc167b","metric":0,"metrics":{"readiness_gate_failures":0,"target_constants_remaining":0,"helpers_missing":0,"fixed_wait_predicates":0,"autoload_static_failures":0,"asset_chain_failures":0,"dll_patch_failures":0,"native_continue_failures":0,"field58_gate_failures":0,"direct_shortcut_failures":0,"input_path_failures":0,"runtime_proof_failures":0,"runtime_mode_failures":0,"eula_popup_failures":0,"save_data_popup_failures":0,"messagebox_dialog_failures":0,"server_status_failures":0,"title_cover_failures":2,"title_cover_penalty":1800,"native_trace_blockers":0,"native_trace_hits_total":74,"native_trace_unique_breakpoints":11,"false_positives":0,"offline_face_source_ready":1,"removed path_cpu_texture_bridge_ready":0,"offline_face_texture_runtime_drawn":0,"stylized_facedata_pixel_oracle":0,"real_portrait_asset_candidates":0,"profile_placeholder_assets_only":1},"status":"discard","description":"Compile-checked owned TitleBackViewParts diagnostic route scaffold","timestamp":1782620648930,"segment":2,"confidence":null,"asi":{"hypothesis":"Implement the next diagnostic scaffold: allocate/own a fresh 0xd0 TitleBackViewParts-like object, call native ctor/fade-in with synthetic er_effects_portrait_cover load-info, and provide teardown, without wiring it into product or scoring route plumbing.","implementation":"Added constants for TitleBack ctor/fadein/dtor, MenuResource ctor/dtor, object size, synthetic wide filename, and telemetry counters. Added `SyntheticScaleformLoadInfo`, DLL-owned 0xd0 static storage, default-off gate, `try_request_synthetic_titleback_cover(scene_context,arg4)`, and `teardown_synthetic_titleback_cover()`. The request helper zeroes storage, resolves native ctor/fade-in, calls ctor with {state=5, field=1, filename=er_effects_portrait_cover}, records counters, and calls fade-in only on non-null return; teardown calls the non-deleting destructor.","validation":"`cargo fmt && cargo xwin check --target x86_64-pc-windows-msvc -q` passed with no output. `run_experiment ./.auto/measure.sh` passed in 1.4s with unchanged score 0 and false_positives=0.","memory_recorded":"bd remember scaleform-owned-titleback-route-scaffold-2026-06-28","rollback_reason":"Primary metric stayed 0; this scaffold is not wired into product code, does not install/trigger the MemoryFile hook, performs no runtime synthetic URL request, renders no visible custom surface, and exposes no portrait oracle. Keeping unused default-off plumbing is not a product improvement.","next_action_hint":"Next spike must wire the owned TitleBack route to a real scene_context in a bounded runtime diagnostic together with the synthetic MemoryFile hook, then validate synthetic URL hits/memoryfile_returns before attempting any visible portrait oracle or scoring."}}
{"run":548,"commit":"4dc167b","metric":0,"metrics":{"readiness_gate_failures":0,"target_constants_remaining":0,"helpers_missing":0,"fixed_wait_predicates":0,"autoload_static_failures":0,"asset_chain_failures":0,"dll_patch_failures":0,"native_continue_failures":0,"field58_gate_failures":0,"direct_shortcut_failures":0,"input_path_failures":0,"runtime_proof_failures":0,"runtime_mode_failures":0,"eula_popup_failures":0,"save_data_popup_failures":0,"messagebox_dialog_failures":0,"server_status_failures":0,"title_cover_failures":2,"title_cover_penalty":1800,"native_trace_blockers":0,"native_trace_hits_total":74,"native_trace_unique_breakpoints":11,"false_positives":0,"offline_face_source_ready":1,"removed path_cpu_texture_bridge_ready":0,"offline_face_texture_runtime_drawn":0,"stylized_facedata_pixel_oracle":0,"real_portrait_asset_candidates":0,"profile_placeholder_assets_only":1},"status":"discard","description":"Compile-checked owned TitleBackViewParts live-dialog diagnostic wiring","timestamp":1782620954341,"segment":2,"confidence":null,"asi":{"hypothesis":"Wire the owned TitleBackViewParts diagnostic route to a real scene_context at the existing TitleTopDialog probe point, explicit-gate-only, while keeping it non-scoring and not affecting normal/product runs.","implementation":"Added route constants/counters and startup_hooks helper. `try_request_synthetic_titleback_cover(dialog,arg4)` derives scene_context as dialog+0xa48, owns DLL-local 0xd0 storage, calls native TitleBack ctor 0x1409a6180 with synthetic load-info {state=5, field=1, filename=er_effects_portrait_cover}, calls fade-in 0x1409a62a0 on success, records telemetry counters, and has teardown via non-deleting dtor 0x1409a61e0. In own_stepper Stage1d, after vtable-gating owner+0xe0 as TitleTopDialog and probing state/latch, added a call only if ER_EFFECTS_SCALEFORM_SYNTHETIC_TITLEBACK=1 or er-effects-scaleform-synthetic-titleback.txt exists.","validation":"`cargo fmt && cargo xwin check --target x86_64-pc-windows-msvc -q` passed with no output. `run_experiment ./.auto/measure.sh` passed in 1.5s with unchanged score 0 and false_positives=0.","memory_recorded":"bd remember scaleform-owned-titleback-live-dialog-wiring-2026-06-28","rollback_reason":"Primary metric stayed 0; the diagnostic wiring is not active without an explicit gate, does not include/trigger the MemoryFile hook, produced no runtime synthetic URL hit, rendered no surface, and exposed no portrait oracle. Keeping unused gated plumbing is not a product improvement.","next_action_hint":"Next spike should combine this explicit gate with the synthetic Open/MemoryFile hook and the .auto runtime trigger, then require telemetry for synthetic URL hits/memoryfile_returns before any visual or portrait scoring."}}
{"run":549,"commit":"4dc167b","metric":0,"metrics":{"readiness_gate_failures":0,"target_constants_remaining":0,"helpers_missing":0,"fixed_wait_predicates":0,"autoload_static_failures":0,"asset_chain_failures":0,"dll_patch_failures":0,"native_continue_failures":0,"field58_gate_failures":0,"direct_shortcut_failures":0,"input_path_failures":0,"runtime_proof_failures":0,"runtime_mode_failures":0,"eula_popup_failures":0,"save_data_popup_failures":0,"messagebox_dialog_failures":0,"server_status_failures":0,"title_cover_failures":2,"title_cover_penalty":1800,"native_trace_blockers":0,"native_trace_hits_total":74,"native_trace_unique_breakpoints":11,"false_positives":0,"offline_face_source_ready":1,"removed path_cpu_texture_bridge_ready":0,"offline_face_texture_runtime_drawn":0,"stylized_facedata_pixel_oracle":0,"real_portrait_asset_candidates":0,"profile_placeholder_assets_only":1},"status":"discard","description":"Compile-checked combined TitleBackViewParts + MemoryFile diagnostic route","timestamp":1782621271319,"segment":2,"confidence":null,"asi":{"hypothesis":"Combine the explicit-gated owned TitleBackViewParts diagnostic with the synthetic FileOpener/MemoryFile hook, still without scoring route plumbing as portrait proof.","implementation":"Added route constants/counters for TitleBack ctor/fadein/dtor, synthetic FileOpener Open, Scaleform string-ref init, MemoryFile ctor, allocator singleton/vfunc, embedded known-good 05_000_title.gfx bytes, and synthetic URLs. Added `scaleform_synthetic_open_hook` that passes native URLs through but returns a native MemoryFile for `menu:/er_effects_portrait_cover.gfx` / `menu:/Win/er_effects_portrait_cover.gfx`, recording calls/hits/memoryfile_returns/alloc_failures. Added `try_request_synthetic_titleback_cover(dialog,0)` to install the Open hook, derive scene_context=dialog+0xa48, construct DLL-owned 0xd0 TitleBackViewParts with synthetic load-info, and call fade-in. Wired it only at the existing vtable-gated TitleTopDialog Stage1d point when explicit gate `ER_EFFECTS_SCALEFORM_SYNTHETIC_TITLEBACK=1` or file `er-effects-scaleform-synthetic-titleback.txt` exists.","validation":"`cargo fmt && cargo xwin check --target x86_64-pc-windows-msvc -q` passed with no output. `run_experiment ./.auto/measure.sh` passed in 1.5s with unchanged score 0 and false_positives=0.","memory_recorded":"bd remember scaleform-owned-titleback-memoryfile-combined-diagnostic-2026-06-28","rollback_reason":"Primary metric stayed 0; no runtime trigger/gate was executed, so there were no synthetic Open hits, no memoryfile_returns, no rendered custom surface, and no portrait oracle. Keeping unused explicit-gated diagnostic plumbing is not a product improvement.","next_action_hint":"Next iteration should perform the bounded runtime diagnostic by touching .auto/run_runtime_probe_once and enabling ER_EFFECTS_SCALEFORM_SYNTHETIC_TITLEBACK=1 (or trigger file), then require telemetry for synthetic Open hits/memoryfile_returns before considering any visible surface or portrait scoring."}}
{"run":550,"commit":"4dc167b","metric":0,"metrics":{"readiness_gate_failures":0,"target_constants_remaining":0,"helpers_missing":0,"fixed_wait_predicates":0,"autoload_static_failures":0,"asset_chain_failures":0,"dll_patch_failures":0,"native_continue_failures":0,"field58_gate_failures":0,"direct_shortcut_failures":0,"input_path_failures":0,"runtime_proof_failures":0,"runtime_mode_failures":0,"eula_popup_failures":0,"save_data_popup_failures":0,"messagebox_dialog_failures":0,"server_status_failures":0,"title_cover_failures":2,"title_cover_penalty":1800,"native_trace_blockers":0,"native_trace_hits_total":74,"native_trace_unique_breakpoints":11,"false_positives":1,"offline_face_source_ready":1,"removed path_cpu_texture_bridge_ready":0,"offline_face_texture_runtime_drawn":0,"stylized_facedata_pixel_oracle":0,"real_portrait_asset_candidates":0,"profile_placeholder_assets_only":1},"status":"discard","description":"Runtime diagnostic shows synthetic Scaleform gate never reached","timestamp":1782621808872,"segment":2,"confidence":null,"asi":{"hypothesis":"Run the combined owned TitleBackViewParts + synthetic FileOpener/MemoryFile diagnostic in a bounded runtime probe, with `ER_EFFECTS_SCALEFORM_SYNTHETIC_TITLEBACK=1`, and require telemetry for synthetic Open hits / memoryfile_returns before treating the route as useful.","implementation":"Reapplied the compile-checked combined diagnostic route from prior memory, added telemetry JSON fields for `oracle_scaleform_synthetic_*`, touched `.auto/run_runtime_probe_once`, verified Steam was running, then ran `ER_EFFECTS_SCALEFORM_SYNTHETIC_TITLEBACK=1 ./.auto/measure.sh`. The code remained explicit-gated and non-scoring; it did not set a portrait oracle.","validation":"`cargo fmt && cargo xwin check --target x86_64-pc-windows-msvc -q` passed with no output. Runtime measurement completed in 27.5s within the 45s cap and reached `reason=world_stable`. Artifact: `/home/banon/projects/er-effects-rs/target/runtime-probe/product-continue-direct-20260627-214134`. Telemetry fields were present but all zero: synthetic_open_installed=0, open_calls=0, open_hits=0, memoryfile_returns=0, titleback_requests=0, titleback_ctor_ret=0. The logo screenshot analysis reported `known_false_positive_signature=true`, `black32_ratio=0.4656`, and `black_ratio_sane_for_portrait_stage=false`. Measure reported false_positives=1 and score 0.","runtime_artifact":"/home/banon/projects/er-effects-rs/target/runtime-probe/product-continue-direct-20260627-214134","memory_recorded":"bd remember scaleform-runtime-gate-not-reached-2026-06-28","rollback_reason":"Primary metric stayed 0 and false_positives=1. The explicit Stage1d gate did not run under this runtime path, so there were no synthetic Open hits or MemoryFile returns, and the legacy ProfileSelect false-positive still appeared. Keeping this patch would preserve unused diagnostic code plus a known false-positive runtime state.","next_action_hint":"Do not infer the MemoryFile path is falsified. Next move the env-gated FileOpener hook install to startup/attach when the env gate is set, and separately request the owned TitleBack object from a guaranteed title-dialog/telemetry point once dialog+0xa48 exists."}}
