{"run":77,"commit":"2100051","metric":0,"metrics":{"readiness_gate_failures":1,"target_constants_remaining":0,"helpers_missing":0,"fixed_wait_predicates":0,"autoload_static_failures":1,"asset_chain_failures":0,"dll_patch_failures":0,"native_continue_failures":0,"field58_gate_failures":0,"direct_shortcut_failures":0,"input_path_failures":0,"runtime_proof_failures":1,"runtime_mode_failures":0,"eula_popup_failures":0,"save_data_popup_failures":0,"messagebox_dialog_failures":0,"server_status_failures":0,"title_cover_failures":0,"title_cover_penalty":0,"native_trace_blockers":0,"native_trace_hits_total":74,"native_trace_unique_breakpoints":11,"false_positives":0,"runtime_timeout_failures":1,"runtime_title_visual_suppressed_builds":0,"runtime_custom_cover_builds":0,"runtime_simulated_button_presses_total":0},"status":"crash","description":"forced TextFadeOut continuation patch was not exercised because preserved-title hook was absent after revert","timestamp":1782371669406,"segment":0,"confidence":4.833333333333333,"asi":{"hypothesis":"Force the native TitleTopDialog TextFadeOut continuation (dump 0x1409b3050 -> deobf 0x1409b2f00) once after validated TextFadeOut+latch to perform the native title-menu side effects that the fade job would call, then let product_core continue toward native Continue without input or direct load/deserializer shortcuts.","rollback_reason":"Runtime timed out and the new continuation path was not exercised: logs contain zero forced-continuation entries. After the prior crash log reverted code, this experiment only patched the continuation call and did not also preserve the native 05_000_Title TitleTopDialog job. The runtime therefore regressed to title_dialog/ProfileLoadDialog state (vt 0x142b229f8), product_core_ready_successes=0, menu_latch=0, profile active qword=0, and no native Continue/load proof.","next_action_hint":"Rerun the forced TextFadeOut continuation only together with the preserved-native-title-job BeginTitle hook used in runs #67-#76, or first make that preservation the explicit experiment precondition. The static finding still stands: open_menu deobf 0x1409b24e0 maps to dump FUN_1409b2630 and installs continuation dump 0x1409b3050/deobf 0x1409b2f00; the continuation was not falsified here because it never ran.","artifact_dir":"/home/banon/projects/er-effects-rs/target/runtime-probe/product-continue-direct-20260625-001217","observed_runtime_oracles":{"forced_continuation_logs":0,"autoload_method":"direct_menu_load","product_autoload_armed":true,"product_core_ready_blocker":"title_dialog","product_core_ready_successes":0,"product_core_last_title_dialog_vt":"0x142b229f8/ProfileLoadDialog","product_core_last_menu_opened_latch":0,"profile_slot_active_bytes_qword":"0x0","title_handoff_complete":false,"idle_candidate_item":"0x7ffe9e52c000","idle_candidate_hits":641,"native_submit_hits":0,"continue_load_fired":false,"simulated_button_presses_total":0,"messagebox_total_builds":0,"processes_remaining":0},"static_re":{"open_menu_mapping":"deobf 0x1409b24e0 -> dump 0x1409b2630","continuation_mapping":"dump 0x1409b3050 -> deobf 0x1409b2f00","continuation_semantics":"FUN_1409b3050 sets registry visibility, calls 0x1409a6410 and 0x1409b35a0, clears dialog+0xa40, calls 0x14082d1c0 with save slot, calls 0x1409b3750, and SetState Loop 0x142a8f9e8."},"build":"cargo xwin build --release --target x86_64-pc-windows-msvc succeeded.","cleanup":"No eldenring.exe or start_protected_game.exe processes remained."}}
{"run":78,"commit":"2100051","metric":0,"metrics":{"readiness_gate_failures":1,"target_constants_remaining":0,"helpers_missing":0,"fixed_wait_predicates":0,"autoload_static_failures":1,"asset_chain_failures":0,"dll_patch_failures":0,"native_continue_failures":0,"field58_gate_failures":0,"direct_shortcut_failures":0,"input_path_failures":0,"runtime_proof_failures":1,"runtime_mode_failures":0,"eula_popup_failures":0,"save_data_popup_failures":0,"messagebox_dialog_failures":0,"server_status_failures":0,"title_cover_failures":0,"title_cover_penalty":0,"native_trace_blockers":0,"native_trace_hits_total":74,"native_trace_unique_breakpoints":11,"false_positives":0,"runtime_timeout_failures":1,"runtime_title_visual_suppressed_builds":0,"runtime_custom_cover_builds":0,"runtime_simulated_button_presses_total":0},"status":"crash","description":"forced native TextFadeOut continuation fired under preserved TitleTopDialog but cleared latch and still no Continue load","timestamp":1782371996684,"segment":0,"confidence":4.833333333333333,"asi":{"hypothesis":"Combine the preserved native 05_000_Title/TitleTopDialog hook with a single call to the native TextFadeOut continuation (dump 0x1409b3050 -> deobf 0x1409b2f00) after validated TextFadeOut+latch, so the fade-job side effects run before product_core seeks a real Continue action.","rollback_reason":"Runtime timed out. The experiment did exercise the new path: preserved native BeginTitle fired and the forced TextFadeOut continuation fired once at +14.997s with dialog=0x7fffc97d3b20 and latch=1. It did not produce Continue/load evidence: menu_continue_wrapper/title-continue hooks stayed zero, continue_load did not fire, native_submit_hits=0, and no player loaded. After the continuation, telemetry showed TitleTopDialog still ready but menu_opened_latch=0, consistent with FUN_1409b3050 clearing dialog+0xa40; product_core did not proceed to a semantic Continue action.","next_action_hint":"Static/patch next should account for FUN_1409b3050 clearing the latch: either observe its post-continuation menu/job result chain directly (hook/log 0x14082d1c0 and 0x1409b3750 outputs, plus owner/list pointers), or reset the product_core open-menu sentinel after continuation so the normal zero-input open_menu path can run again from Loop and rebuild rows. Do not treat forcing the continuation as sufficient; it ran but still did not materialize the real 0x14082bac0 Continue wrapper.","artifact_dir":"/home/banon/projects/er-effects-rs/target/runtime-probe/product-continue-direct-20260625-001733","observed_runtime_oracles":{"preserved_native_title":true,"forced_textfadeout_continuation_logs":1,"forced_continuation_time_ms":14997,"forced_continuation_dialog":"0x7fffc97d3b20","forced_continuation_latch_before":1,"autoload_method":"direct_menu_load","product_autoload_armed":true,"product_core_ready_blocker":"ready","product_core_ready_successes":569,"product_core_last_title_dialog_vt":"0x142b26468/TitleTopDialog","product_core_last_menu_opened_latch":0,"profile_slot_active_bytes_qword":"0x1","title_handoff_complete":true,"idle_candidate_item":"0x7fffd132c000","idle_candidate_hits":638,"menu_continue_wrapper_hits":0,"title_continue_builder_hits":0,"native_submit_hits":0,"continue_load_fired":false,"oracle_player_present":false,"oracle_char_name":"","simulated_button_presses_total":0,"messagebox_total_builds":0,"processes_remaining":0},"static_re":{"open_menu_mapping":"deobf 0x1409b24e0 -> dump FUN_1409b2630","continuation_mapping":"dump 0x1409b3050 -> deobf 0x1409b2f00","continuation_semantics":"FUN_1409b3050 calls registry/show helpers, clears dialog+0xa40, calls 0x14082d1c0 with save slot, 0x1409b3750, then SetState Loop 0x142a8f9e8."},"build":"cargo xwin build --release --target x86_64-pc-windows-msvc succeeded.","cleanup":"No eldenring.exe or start_protected_game.exe processes remained."}}
{"run":79,"commit":"2100051","metric":0,"metrics":{"readiness_gate_failures":1,"target_constants_remaining":0,"helpers_missing":0,"fixed_wait_predicates":0,"autoload_static_failures":1,"asset_chain_failures":0,"dll_patch_failures":0,"native_continue_failures":0,"field58_gate_failures":0,"direct_shortcut_failures":0,"input_path_failures":0,"runtime_proof_failures":1,"runtime_mode_failures":0,"eula_popup_failures":0,"save_data_popup_failures":0,"messagebox_dialog_failures":0,"server_status_failures":0,"title_cover_failures":0,"title_cover_penalty":0,"native_trace_blockers":0,"native_trace_hits_total":74,"native_trace_unique_breakpoints":11,"false_positives":0,"runtime_timeout_failures":1,"runtime_title_visual_suppressed_builds":0,"runtime_custom_cover_builds":0,"runtime_simulated_button_presses_total":0},"status":"crash","description":"reset open-menu sentinel after TextFadeOut continuation reran open_menu but still only idle candidate appeared","timestamp":1782372290962,"segment":0,"confidence":4.833333333333333,"asi":{"hypothesis":"After forcing native TitleTopDialog TextFadeOut continuation, reset product_core's open-menu sentinel so the validated TitleTopDialog can call native open_menu again from Loop and perhaps materialize the real Continue action instead of staying latch-cleared.","rollback_reason":"Runtime timed out. The intended path ran: preserved native BeginTitle fired, open_menu ran once, forced TextFadeOut continuation fired, sentinel reset, and open_menu ran a second time from the same TitleTopDialog. This restored ready TitleTopDialog/menu_latch/profile-active state, but no real Continue action appeared: menu_continue_wrapper/TITLE-CONTINUE hooks stayed zero, native_submit_hits=0, continue_load_fired=false, and product_core rejected only the idle MenuWindowJob candidate 554 times.","next_action_hint":"The open_menu+continuation+open_menu cycle is falsified for materializing the real 0x14082bac0 Continue wrapper. Next target should instrument outputs of the continuation's actual side-effect calls, especially deobf 0x14082d1c0 (SaveLoad slot handoff) and 0x1409b3750, plus list/job pointers after those calls, instead of retrying open_menu sequencing. Alternatively static RE those functions to identify what row/job chain they create and why product sees only the idle d180 candidate.","artifact_dir":"/home/banon/projects/er-effects-rs/target/runtime-probe/product-continue-direct-20260625-002240","observed_runtime_oracles":{"preserved_native_title":true,"forced_textfadeout_continuation_logs":1,"open_menu_calls_logged":2,"sentinel_reset_logs":1,"autoload_method":"direct_menu_load","product_autoload_armed":true,"product_core_ready_blocker":"ready","product_core_ready_successes":560,"product_core_last_title_dialog_vt":"0x142b26468/TitleTopDialog","product_core_last_menu_opened_latch":1,"profile_slot_active_bytes_qword":"0x1","title_handoff_complete":true,"idle_candidate_item":"0x7ffe9e52c000","idle_candidate_hits":1181,"idle_rejections":554,"menu_continue_wrapper_hits":0,"title_continue_builder_hits":0,"native_submit_hits":0,"continue_load_fired":false,"oracle_player_present":false,"oracle_char_name":"","simulated_button_presses_total":0,"messagebox_total_builds":0,"processes_remaining":0},"static_re":{"open_menu_mapping":"deobf 0x1409b24e0 -> dump FUN_1409b2630","continuation_mapping":"dump 0x1409b3050 -> deobf 0x1409b2f00","continuation_semantics":"FUN_1409b3050 calls registry/show helpers, clears dialog+0xa40, calls 0x14082d1c0 with save slot, 0x1409b3750, then SetState Loop 0x142a8f9e8."},"build":"cargo xwin build --release --target x86_64-pc-windows-msvc succeeded.","cleanup":"No eldenring.exe or start_protected_game.exe processes remained."}}
{"run":80,"commit":"2100051","metric":0,"metrics":{"readiness_gate_failures":1,"target_constants_remaining":0,"helpers_missing":0,"fixed_wait_predicates":0,"autoload_static_failures":1,"asset_chain_failures":0,"dll_patch_failures":0,"native_continue_failures":0,"field58_gate_failures":0,"direct_shortcut_failures":0,"input_path_failures":0,"runtime_proof_failures":1,"runtime_mode_failures":0,"eula_popup_failures":0,"save_data_popup_failures":0,"messagebox_dialog_failures":0,"server_status_failures":0,"title_cover_failures":0,"title_cover_penalty":0,"native_trace_blockers":0,"native_trace_hits_total":74,"native_trace_unique_breakpoints":11,"false_positives":0,"runtime_timeout_failures":1,"runtime_title_visual_suppressed_builds":0,"runtime_custom_cover_builds":0,"runtime_simulated_button_presses_total":0},"status":"crash","description":"traced TextFadeOut continuation side-effect helpers; save slot handoff receives all-zero slot data","timestamp":1782372722348,"segment":0,"confidence":4.833333333333333,"asi":{"hypothesis":"Instrument the native TextFadeOut continuation side-effect helpers deobf 0x14082d0d0 (TitleFlowContext save-load handoff) and 0x1409b3600 (status/update UI helper), while preserving native TitleTopDialog and forcing the continuation once, to learn what row/job chain is actually produced before product_core sees only the idle candidate.","rollback_reason":"Runtime timed out before native Continue/load proof. The hooks installed and fired, but they only confirmed title/status side effects and did not materialize the real Continue wrapper. The save-load handoff helper saw save_slot_ptr with slot_q0=0 and slot_q1=0 on every call, and status update only toggled title status UI visibility. Product still reached ready TitleTopDialog/menu_latch/profile-active and rejected only the idle MenuWindowJob candidate; menu_continue_wrapper/TITLE-CONTINUE/native_submit/continue_load remained zero.","next_action_hint":"Static RE the callers observed for the side-effect helpers: deobf caller_rva 0x9a8341 and 0x9a842a during native title fade setup, 0x9b302d/0x9b3037 inside the forced continuation, 0x837708 for an extra save-load handoff with flag=1, and 0x9aabd5 for later status visible=1. Most importantly, the continuation's SaveLoad handoff receives all-zero save_slot data, so the missing Continue row is not downstream of these helpers. Next target should shift back to the actual menu item container/job chain: instrument the MenuJob chain insertion/enqueue around FUN_1407928c0/FUN_1407a9340 or the dialog+0x50 fixed vector after open_menu/continuation, not retry continuation helpers.","artifact_dir":"/home/banon/projects/er-effects-rs/target/runtime-probe/product-continue-direct-20260625-002924","observed_runtime_oracles":{"hooks_installed":["title_saveload_handoff 0x14082d0d0","title_status_update 0x1409b3600"],"saveload_handoff_hits":3,"status_update_hits":3,"forced_textfadeout_continuation_logs":1,"open_menu_calls_logged":2,"sentinel_reset_logs":1,"saveload_handoff_records":[{"seq":1,"caller_rva":"0x9a8341","flag":0,"slot_q0":"0x0","slot_q1":"0x0","ctx_18e_after":"0x0"},{"seq":2,"caller_rva":"0x9b302d","flag":0,"slot_q0":"0x0","slot_q1":"0x0","ctx_18e_after":"0x0"},{"seq":3,"caller_rva":"0x837708","flag":1,"slot_q0":"0x0","slot_q1":"0x0","ctx_18e_after":"0x1"}],"status_update_records":[{"seq":1,"caller_rva":"0x9a842a","visible":0},{"seq":2,"caller_rva":"0x9b3037","visible":0},{"seq":3,"caller_rva":"0x9aabd5","visible":1}],"product_core_ready_blocker":"ready","product_core_ready_successes":560,"product_core_last_title_dialog_vt":"0x142b26468/TitleTopDialog","product_core_last_menu_opened_latch":1,"profile_slot_active_bytes_qword":"0x1","idle_candidate_item":"0x7fff3e52c000","idle_candidate_hits":1181,"idle_rejections":552,"menu_continue_wrapper_hits":0,"title_continue_builder_hits":0,"native_submit_hits":0,"continue_load_fired":false,"oracle_player_present":false,"oracle_char_name":"","simulated_button_presses_total":0,"messagebox_total_builds":0,"processes_remaining":0},"static_re":{"saveload_handoff_mapping":"dump 0x14082d1c0 -> deobf 0x14082d0d0","status_update_mapping":"dump 0x1409b3750 -> deobf 0x1409b3600","saveload_handoff_semantics":"resets TitleFlowContext strings/status fields and copies flag byte plus fields from save_slot_ptr into ctx+0x120/0x128/0x130.","status_update_semantics":"updates online/multiplayer/app/regulation/DLC text visibility under dialog+0xbd8 and calls b35a0."},"build":"cargo xwin build --release --target x86_64-pc-windows-msvc succeeded.","cleanup":"No eldenring.exe or start_protected_game.exe processes remained."}}
{"run":81,"commit":"2100051","metric":0,"metrics":{"readiness_gate_failures":1,"target_constants_remaining":0,"helpers_missing":0,"fixed_wait_predicates":0,"autoload_static_failures":1,"asset_chain_failures":0,"dll_patch_failures":0,"native_continue_failures":0,"field58_gate_failures":0,"direct_shortcut_failures":0,"input_path_failures":0,"runtime_proof_failures":1,"runtime_mode_failures":0,"eula_popup_failures":0,"save_data_popup_failures":0,"messagebox_dialog_failures":0,"server_status_failures":0,"title_cover_failures":0,"title_cover_penalty":0,"native_trace_blockers":0,"native_trace_hits_total":74,"native_trace_unique_breakpoints":11,"false_positives":0,"runtime_timeout_failures":1,"runtime_title_visual_suppressed_builds":0,"runtime_custom_cover_builds":0,"runtime_simulated_button_presses_total":0},"status":"crash","description":"traced MenuJob chain/enqueue around open_menu; real chain enqueued but product still scans idle owner job","timestamp":1782373106107,"segment":0,"confidence":4.833333333333333,"asi":{"hypothesis":"Hook MenuJob chain builder/enqueue helpers deobf 0x1407927d0 and 0x1407a9250 while preserving native TitleTopDialog and forcing the TextFadeOut continuation/open_menu cycle, to identify whether the real open_menu job chain is built/enqueued even though product_core sees only the idle d180 candidate.","rollback_reason":"Runtime timed out before native Continue/load proof. Hooks installed and fired. They showed open_menu did build and enqueue MenuJob chains into dialog+0x10 (owner_slot=dialog+0x10; caller_rva 0x9b2c59) twice, with chain jobs vtable 0x142aa2958. However product_core still scanned/rejected only the idle MenuWindowJob candidate at 0x7ffe9e52c000 and never saw menu_continue_wrapper/TITLE-CONTINUE/native_submit/continue_load. The experiment is diagnostic-only and weakens title-cover proof by preserving native title visuals.","next_action_hint":"Static/runtime next should inspect/walk the enqueued chain objects themselves (e.g. 0x7ffe9e507640 then 0x7ffe9e4e0af0) or hook the underlying sequence iterator/FUN_1407a8910 to decode children, rather than scanning owner idle candidates. Candidate vtables: input jobs 0x142aa86a0 and 0x142aa8d78 were composed into chain vtable 0x142aa2958 by caller 0x9b28ea; enqueue caller 0x9b2c59 installs them at dialog+0x10. Product action discovery should pivot to traversing dialog+0x10's FixOrderJobSequence/chain children after open_menu, not owner+idle MenuWindowJob.","artifact_dir":"/home/banon/projects/er-effects-rs/target/runtime-probe/product-continue-direct-20260625-003551","observed_runtime_oracles":{"hooks_installed":["title_menujob_chain 0x1407927d0","title_menujob_enqueue 0x1407a9250"],"menujob_chain_hits":9,"menujob_enqueue_hits":2,"open_menu_calls_logged":2,"forced_textfadeout_continuation_logs":1,"product_core_ready_blocker":"ready","product_core_ready_successes":552,"product_core_last_title_dialog_vt":"0x142b26468/TitleTopDialog","product_core_last_menu_opened_latch":1,"profile_slot_active_bytes_qword":"0x1","title_handoff_complete":true,"interesting_chain_records":[{"seq":3,"caller_rva":"0x9b28ea","in_job":"0x7ffe9e5f0230","in_job_vt":"0x142aa8d78","dst_after":"0x7ffe9e507640","dst_after_vt":"0x142aa2958"},{"seq":7,"caller_rva":"0x9b28ea","in_job":"0x7ffe9e507cd0","in_job_vt":"0x142aa8d78","dst_after":"0x7ffe9e4e0af0","dst_after_vt":"0x142aa2958"}],"enqueue_records":[{"seq":1,"caller_rva":"0x9b2c59","owner_slot":"0x7ffe969d3d50","owner_slot_before":"0x0","job":"0x7ffe9e507640","job_vt":"0x142aa2958","owner_slot_after":"0x0"},{"seq":2,"caller_rva":"0x9b2c59","owner_slot":"0x7ffe969d3d50","owner_slot_before":"0x7ffe9e507640","job":"0x7ffe9e4e0af0","job_vt":"0x142aa2958","owner_slot_after":"0x7ffe9e507640"}],"idle_candidate_item":"0x7ffe9e52c000","idle_candidate_hits":1165,"idle_rejections":545,"menu_continue_wrapper_hits":0,"title_continue_builder_hits":0,"native_submit_hits":0,"continue_load_fired":false,"oracle_player_present":false,"simulated_button_presses_total":0,"messagebox_total_builds":0,"processes_remaining":0},"static_re":{"chain_builder_mapping":"dump 0x1407928c0 -> deobf 0x1407927d0","enqueue_mapping":"dump 0x1407a9340 -> deobf 0x1407a9250","chain_builder_semantics":"wraps/clones an input job pointer into a chain/job reference result via 0x140792a60","enqueue_semantics":"if *job_ptr non-null, increments ref and calls 0x1407a8910(param_1+8, job), then clears job_ptr"},"build":"cargo xwin build --release --target x86_64-pc-windows-msvc succeeded.","cleanup":"No eldenring.exe or start_protected_game.exe processes remained."}}
