{"run":212,"commit":"2100051","metric":1520,"metrics":{"readiness_gate_failures":0,"target_constants_remaining":0,"helpers_missing":0,"fixed_wait_predicates":0,"autoload_static_failures":0,"asset_chain_failures":0,"dll_patch_failures":0,"native_continue_failures":0,"field58_gate_failures":0,"direct_shortcut_failures":0,"input_path_failures":0,"runtime_proof_failures":1,"runtime_mode_failures":0,"eula_popup_failures":0,"save_data_popup_failures":0,"messagebox_dialog_failures":0,"server_status_failures":0,"title_cover_failures":0,"title_cover_penalty":0,"native_trace_blockers":0,"native_trace_hits_total":74,"native_trace_unique_breakpoints":11,"false_positives":0,"runtime_timeout_failures":0,"runtime_title_visual_suppressed_builds":0,"runtime_custom_cover_builds":0,"runtime_simulated_button_presses_total":0},"status":"discard","description":"static decoded 140d82880 Scaleform extraction helper","timestamp":1782428976033,"segment":0,"confidence":null,"asi":{"hypothesis":"Decoding FUN_140d82880 / the param_1+0x28 source for the title a48 object would identify which GFx/Scaleform value/member lookup remains invalid upstream of the native SceneObjProxy ready predicate.","rollback_reason":"Primary metric remained 1520, equal to the persisted best, and runtime_proof_failures remains 1. This iteration produced static RE only; no runtime proof or product improvement was added.","next_action_hint":"Add a narrowly gated runtime hook at live 0x140d827d0 or caller live 0x14074bbe0 for the title a48 object, logging source datatype `[src+0x20]&0x8f`, source objectInterface `[src+0x18]`, source value `[src+0x28]`, and output datatype after return. Avoid broad ungated hooks because FUN_140d82880 is generic.","finding_key":"autoload-title-scaleform-extract-helper-140d82880-2026-06-25","validation":"Beads memory search for FUN_140d82880/ScaleformValue found no prior matching memory. Ghidra dump/deobf grounding: dump 0x140d82880 -> live/deobf 0x140d827d0 content-unique shift -0xb0. .auto/measure.sh passed with autoload_re_score=1520 and false_positives=0.","evidence":"FUN_140d82880 returns empty unless `(byte[src+0x20] & 0x8f)==10`; when object-like, it calls objectInterface vfunc +0xd0 using source value `[src+0x28]`, then copies output unless result datatype masked equals 1. `DAT_1429e7cf0` is a CSScaleformValue sentinel (-1,-1), not a member string."}}
{"run":213,"commit":"2100051","metric":0,"metrics":{"readiness_gate_failures":0,"target_constants_remaining":0,"helpers_missing":0,"fixed_wait_predicates":0,"autoload_static_failures":0,"asset_chain_failures":0,"dll_patch_failures":0,"native_continue_failures":0,"field58_gate_failures":0,"direct_shortcut_failures":0,"input_path_failures":0,"runtime_proof_failures":1,"runtime_mode_failures":0,"eula_popup_failures":0,"save_data_popup_failures":0,"messagebox_dialog_failures":0,"server_status_failures":0,"title_cover_failures":1,"title_cover_penalty":0,"native_trace_blockers":0,"native_trace_hits_total":74,"native_trace_unique_breakpoints":11,"false_positives":0,"runtime_timeout_failures":0,"runtime_title_visual_suppressed_builds":0,"runtime_custom_cover_builds":0,"runtime_simulated_button_presses_total":0},"status":"crash","description":"runtime attempted gated title a48 Scaleform proxy hook but failed before hook","timestamp":1782429243787,"segment":0,"confidence":null,"asi":{"hypothesis":"A narrowly gated runtime hook at live 0x14074bbe0 for vtable 0x142a94a70 would log the title a48 source datatype/interface/value and output datatype, revealing whether the GFx source or extraction result is empty.","rollback_reason":"run_experiment failed before METRIC lines and before the target hook fired. The artifact had blocker product_core_no_title_owner, title_native_ready_hits=0, menu window/item hits=0, native_submit=0, continue_phase=0, and no `title-a48-scaleform-proxy` debug lines. No valid evidence about the a48 Scaleform source was collected.","next_action_hint":"First restore/native-preserve BeginTitle so the title owner/window path reaches the a48 proxy function, then reapply the same gated 0x14074bbe0 hook. Do not infer source datatype from product-continue-direct-20260625-161227.","artifact":"/home/banon/projects/er-effects-rs/target/runtime-probe/product-continue-direct-20260625-161227","finding_key":"autoload-title-a48-proxy-runtime-failed-before-hook-2026-06-25","validation":"`cargo xwin build --release --target x86_64-pc-windows-msvc` succeeded before arming `.auto/run_runtime_probe_once`; exact process scan after failure found no eldenring.exe/start_protected_game.exe.","evidence":"Telemetry: oracle_title_native_ready_hits=0, oracle_title_native_ready_last_flags=0, oracle_native_submit_hits=0, oracle_continue_phase=0, oracle_msgbox_total_builds=0, simulated_button_presses_total=0; runtime-probe.out blocker=product_core_no_title_owner."}}
{"run":214,"commit":"2100051","metric":0,"metrics":{"readiness_gate_failures":0,"target_constants_remaining":0,"helpers_missing":0,"fixed_wait_predicates":0,"autoload_static_failures":0,"asset_chain_failures":0,"dll_patch_failures":0,"native_continue_failures":0,"field58_gate_failures":0,"direct_shortcut_failures":0,"input_path_failures":0,"runtime_proof_failures":1,"runtime_mode_failures":0,"eula_popup_failures":0,"save_data_popup_failures":0,"messagebox_dialog_failures":0,"server_status_failures":0,"title_cover_failures":1,"title_cover_penalty":0,"native_trace_blockers":0,"native_trace_hits_total":74,"native_trace_unique_breakpoints":11,"false_positives":0,"runtime_timeout_failures":0,"runtime_title_visual_suppressed_builds":0,"runtime_custom_cover_builds":0,"runtime_simulated_button_presses_total":0},"status":"crash","description":"runtime native-preserving a48 hook exited before BeginTitle","timestamp":1782429677828,"segment":0,"confidence":null,"asi":{"hypothesis":"Restoring native-preserving BeginTitle before the gated title a48 Scaleform proxy hook would let the runtime reach the title window path and log source/output datatype at live 0x14074bbe0.","rollback_reason":"run_experiment failed before METRIC lines and before BeginTitle fired. Debug log only has hook-install text, no `PRESERVED native` call line and no `title-a48-scaleform-proxy` lines. The artifact therefore contains no valid evidence about the a48 Scaleform source or output.","next_action_hint":"Before another a48 runtime attempt, restore the older runtime setup that reliably reached BeginTitle/native window under native-preserving diagnostics, or instrument the launch/early TitleStep boundary to explain why the current measure exits before BeginTitle.","artifact":"/home/banon/projects/er-effects-rs/target/runtime-probe/product-continue-direct-20260625-161928","finding_key":"autoload-native-preserve-a48-runtime-exited-before-begintitle-2026-06-25","validation":"`cargo xwin build --release --target x86_64-pc-windows-msvc` succeeded before arming `.auto/run_runtime_probe_once`; exact process scan after failure found no eldenring.exe/start_protected_game.exe.","evidence":"Telemetry: oracle_title_native_ready_hits=0, oracle_title_native_ready_last_flags=0, oracle_native_submit_hits=0, oracle_continue_phase=0, oracle_msgbox_total_builds=0, simulated_button_presses_total=0; runtime-probe.out blocker=product_core_no_title_owner."}}
{"run":215,"commit":"2100051","metric":1520,"metrics":{"readiness_gate_failures":0,"target_constants_remaining":0,"helpers_missing":0,"fixed_wait_predicates":0,"autoload_static_failures":0,"asset_chain_failures":0,"dll_patch_failures":0,"native_continue_failures":0,"field58_gate_failures":0,"direct_shortcut_failures":0,"input_path_failures":0,"runtime_proof_failures":1,"runtime_mode_failures":0,"eula_popup_failures":0,"save_data_popup_failures":0,"messagebox_dialog_failures":0,"server_status_failures":0,"title_cover_failures":0,"title_cover_penalty":0,"native_trace_blockers":0,"native_trace_hits_total":74,"native_trace_unique_breakpoints":11,"false_positives":0,"runtime_timeout_failures":0,"runtime_title_visual_suppressed_builds":0,"runtime_custom_cover_builds":0,"runtime_simulated_button_presses_total":0},"status":"discard","description":"triaged title-owner early exit as not scan throttling","timestamp":1782429982407,"segment":0,"confidence":null,"asi":{"hypothesis":"The repeated `product_core_no_title_owner` early-exit artifacts might be caused by title_owner scan throttling/cooldown rather than true absence of the TitleStep owner.","rollback_reason":"Primary metric remained 1520, equal to the persisted best, and runtime_proof_failures remains 1. This iteration produced artifact triage only; no code/product proof improvement was added.","next_action_hint":"Do not spend another run on title_owner scan throttling. Instrument/inspect the earlier boot/title-step transition or launch/runtime setup to explain why recent runtime probes exit before real title-owner allocation/BeginTitle.","finding_key":"autoload-title-owner-scan-not-throttled-early-exit-2026-06-25","validation":".auto/measure.sh passed with autoload_re_score=1520 and false_positives=0 after the triage finding was persisted.","evidence":"Artifact product-continue-direct-20260625-161928 telemetry: product_core_autoload_ticks=55, product_core_ready_blocks=55, product_core_owner_ticks=0, title_owner_scan_attempts=2, title_owner_scan_vtable_hits=4, table_rejects=4, state_rejects=0, last_candidate=0x1000ffc08, last_table=0x1000ffc18, last_state=0."}}
{"run":216,"commit":"2100051","metric":1520,"metrics":{"readiness_gate_failures":0,"target_constants_remaining":0,"helpers_missing":0,"fixed_wait_predicates":0,"autoload_static_failures":0,"asset_chain_failures":0,"dll_patch_failures":0,"native_continue_failures":0,"field58_gate_failures":0,"direct_shortcut_failures":0,"input_path_failures":0,"runtime_proof_failures":1,"runtime_mode_failures":0,"eula_popup_failures":0,"save_data_popup_failures":0,"messagebox_dialog_failures":0,"server_status_failures":0,"title_cover_failures":0,"title_cover_penalty":0,"native_trace_blockers":0,"native_trace_hits_total":74,"native_trace_unique_breakpoints":11,"false_positives":0,"runtime_timeout_failures":0,"runtime_title_visual_suppressed_builds":0,"runtime_custom_cover_builds":0,"runtime_simulated_button_presses_total":0},"status":"discard","description":"classified product_core_no_title_owner as summary not kill reason","timestamp":1782430117284,"segment":0,"confidence":null,"asi":{"hypothesis":"The runtime probe might be killed early by the watcher when `product_core_no_title_owner` persists before BeginTitle, rather than the game process exiting independently.","rollback_reason":"Primary metric remained 1520, equal to the persisted best, and runtime_proof_failures remains 1. This iteration produced static watcher/harness classification only; no product proof improvement was added.","next_action_hint":"Inspect/trace the process exit path or launch/runtime setup to find why Elden Ring exits before BeginTitle/title-owner allocation. Do not patch product_core_no_title_owner or the watcher summary label as if it were the cause.","finding_key":"autoload-product-core-no-title-owner-is-summary-not-kill-2026-06-25","validation":".auto/measure.sh passed with autoload_re_score=1520 and false_positives=0 after the finding was persisted.","evidence":"scripts/er-readiness-watch.py: autoload_progress_summary reports product_core_${product_core_ready_blocker}; classify_snapshot returns PROCESS_EXITED only when not process_running. No code path was found that fail-fast kills solely for product_core_no_title_owner."}}
{"run":217,"commit":"2100051","metric":1520,"metrics":{"readiness_gate_failures":0,"target_constants_remaining":0,"helpers_missing":0,"fixed_wait_predicates":0,"autoload_static_failures":0,"asset_chain_failures":0,"dll_patch_failures":0,"native_continue_failures":0,"field58_gate_failures":0,"direct_shortcut_failures":0,"input_path_failures":0,"runtime_proof_failures":1,"runtime_mode_failures":0,"eula_popup_failures":0,"save_data_popup_failures":0,"messagebox_dialog_failures":0,"server_status_failures":0,"title_cover_failures":0,"title_cover_penalty":0,"native_trace_blockers":0,"native_trace_hits_total":74,"native_trace_unique_breakpoints":11,"false_positives":0,"runtime_timeout_failures":0,"runtime_title_visual_suppressed_builds":0,"runtime_custom_cover_builds":0,"runtime_simulated_button_presses_total":0},"status":"discard","description":"classified early runtime exit as process_exited_before_ready","timestamp":1782430340099,"segment":0,"confidence":null,"asi":{"hypothesis":"The current launch-boundary blocker can be narrowed by extracting the watcher final reason and timing from the latest early-exit artifact, distinguishing process exit from product-core/no-title-owner fail-fast.","rollback_reason":"Primary metric remained 1520, equal to the persisted best, and runtime_proof_failures remains 1. This iteration produced artifact/harness classification only; no product proof improvement was added.","next_action_hint":"Compare proton-run/gamescope failure lines and/or add host-side pid lifetime/process-tree sampling to distinguish true game self-exit from launcher/gamescope boundary teardown. In-process title/a48 hooks will not fire until this launch boundary is stable past +12s.","finding_key":"autoload-runtime-exits-before-ready-actual-reason-2026-06-25","validation":".auto/measure.sh passed with autoload_re_score=1520 and false_positives=0 after the finding was persisted.","evidence":"Artifact product-continue-direct-20260625-161928 runtime-probe.err: `TIMING +2.1s first_telemetry`, `TIMING +12.2s teardown`, `reason=process_exited_before_ready`; telemetry has no windows and no BeginTitle/a48 hook evidence; crash log lacks process-exit API line."}}
{"run":218,"commit":"2100051","metric":1520,"metrics":{"readiness_gate_failures":0,"target_constants_remaining":0,"helpers_missing":0,"fixed_wait_predicates":0,"autoload_static_failures":0,"asset_chain_failures":0,"dll_patch_failures":0,"native_continue_failures":0,"field58_gate_failures":0,"direct_shortcut_failures":0,"input_path_failures":0,"runtime_proof_failures":1,"runtime_mode_failures":0,"eula_popup_failures":0,"save_data_popup_failures":0,"messagebox_dialog_failures":0,"server_status_failures":0,"title_cover_failures":0,"title_cover_penalty":0,"native_trace_blockers":0,"native_trace_hits_total":74,"native_trace_unique_breakpoints":11,"false_positives":0,"runtime_timeout_failures":0,"runtime_title_visual_suppressed_builds":0,"runtime_custom_cover_builds":0,"runtime_simulated_button_presses_total":0},"status":"discard","description":"compared Proton tails and correlated broad a48 hook with pre-BeginTitle exit","timestamp":1782430510782,"segment":0,"confidence":null,"asi":{"hypothesis":"Comparing early-exit artifacts against BeginTitle-reaching artifacts would show whether Proton/gamescope logs distinguish true self-exit from teardown noise, and whether the broad a48 hook correlates with the pre-BeginTitle exit.","rollback_reason":"Primary metric remained 1520, equal to the persisted best, and runtime_proof_failures remains 1. This iteration produced artifact comparison only; no product proof improvement was added.","next_action_hint":"Do not use the broad 0x14074bbe0 a48 hook again. Add a safer higher-level/non-hook semaphore: sample a48+0x28 source fields from the native title window update path after BeginTitle/native window exists, and separately improve host/in-process exit attribution for pre-BeginTitle process_exited_before_ready artifacts.","finding_key":"autoload-broad-a48-hook-correlates-with-pre-begintitle-exit-2026-06-25","validation":".auto/measure.sh passed with autoload_re_score=1520 and false_positives=0 after the finding was persisted.","evidence":"BeginTitle-reaching runs product-continue-direct-20260625-155313/154525 survive ~35s, fire BeginTitle at +15.46..15.70s, ready_blocker=ready, title_native_ready_hits~1800; early exits 161227/161928 exit +12.2..12.6s before BeginTitle with ready_blocker=no_title_owner. Proton tail lines are the same Fossilize/Broken pipe teardown noise."}}
{"run":219,"commit":"2100051","metric":1520,"metrics":{"readiness_gate_failures":0,"target_constants_remaining":0,"helpers_missing":0,"fixed_wait_predicates":0,"autoload_static_failures":0,"asset_chain_failures":0,"dll_patch_failures":0,"native_continue_failures":0,"field58_gate_failures":0,"direct_shortcut_failures":0,"input_path_failures":0,"runtime_proof_failures":1,"runtime_mode_failures":0,"eula_popup_failures":0,"save_data_popup_failures":0,"messagebox_dialog_failures":0,"server_status_failures":0,"title_cover_failures":0,"title_cover_penalty":0,"native_trace_blockers":0,"native_trace_hits_total":74,"native_trace_unique_breakpoints":11,"false_positives":0,"runtime_timeout_failures":0,"runtime_title_visual_suppressed_builds":0,"runtime_custom_cover_builds":0,"runtime_simulated_button_presses_total":0},"status":"discard","description":"added host process lifetime sampler for early-exit probes","timestamp":1782430678102,"segment":0,"confidence":null,"asi":{"hypothesis":"A host-side PID-tree lifetime JSONL sampler in .auto/runtime_probe.sh will provide a better semaphore for process_exited_before_ready cases, distinguishing launched PID disappearance/process-tree teardown from in-process title/autoload state.","rollback_reason":"Primary metric remained 1520, equal to the persisted best, and runtime_proof_failures remains 1. The change improves crash/exit diagnostics but does not improve the primary product proof score in this static benchmark iteration.","next_action_hint":"On the next runtime artifact, inspect `<artifact>/host-process-lifetime.jsonl` alongside runtime-probe.err to see whether the launched Proton PID, descendants, or game process disappear before BeginTitle. If needed, extend the sampler to capture exit status from the parent launcher boundary.","validation":"Validated with `bash -n .auto/runtime_probe.sh`; shellcheck was available and passed; direct smoke invocation with temp ARTIFACT_DIR/PID_FILE/RUNTIME_TIMEOUT_SECONDS=1 exercised the sampler and wrote 5 JSONL samples to `/tmp/er-runtime-probe-smoke.Y5vv4K/host-process-lifetime.jsonl`. `.auto/measure.sh` passed with autoload_re_score=1520 and false_positives=0.","evidence":"Smoke stderr included `host-process-sampler: pid=1334535 trace=/tmp/er-runtime-probe-smoke.Y5vv4K/host-process-lifetime.jsonl`; first sample was `{\"pid_file_pid\": null, \"t\": 0.0, \"tree\": []}`. The sampler outputs only the PID file root and descendants, not a full process list.","user_request":"User requested a better semaphore/logging mechanism for this crash scenario after the investigation."}}
{"run":220,"commit":"2100051","metric":0,"metrics":{"readiness_gate_failures":0,"target_constants_remaining":0,"helpers_missing":0,"fixed_wait_predicates":0,"autoload_static_failures":0,"asset_chain_failures":0,"dll_patch_failures":0,"native_continue_failures":0,"field58_gate_failures":0,"direct_shortcut_failures":0,"input_path_failures":0,"runtime_proof_failures":1,"runtime_mode_failures":0,"eula_popup_failures":0,"save_data_popup_failures":0,"messagebox_dialog_failures":0,"server_status_failures":0,"title_cover_failures":1,"title_cover_penalty":0,"native_trace_blockers":0,"native_trace_hits_total":74,"native_trace_unique_breakpoints":11,"false_positives":0,"runtime_timeout_failures":0,"runtime_title_visual_suppressed_builds":0,"runtime_custom_cover_builds":0,"runtime_simulated_button_presses_total":0},"status":"crash","description":"runtime host sampler attributed pre-BeginTitle exit to NtTerminateProcess c0000005","timestamp":1782430843556,"segment":0,"confidence":null,"asi":{"hypothesis":"Running one runtime probe with the new host-process-lifetime sampler would distinguish watcher cleanup/gamescope boundary noise from true game-process exit before BeginTitle.","rollback_reason":"run_experiment failed before METRIC lines with primary metric 0. Product proof still failed before BeginTitle/title-owner allocation.","next_action_hint":"Symbolize/attribute the NtTerminateProcess caller frames or extend crash logging to include module names for process-exit caller frames. Avoid broad 0x14074bbe0 hooks until the access-violation-class pre-BeginTitle termination is attributed.","artifact":"/home/banon/projects/er-effects-rs/target/runtime-probe/product-continue-direct-20260625-163849","finding_key":"autoload-pre-begintitle-exit-ntterminate-c0000005-2026-06-25","validation":"Exact post-run process scan found no eldenring.exe/start_protected_game.exe. Host sampler produced 47 JSONL samples in `host-process-lifetime.jsonl`.","evidence":"runtime-probe.err: first_telemetry +2.2s, teardown +12.7s, reason=process_exited_before_ready. host-process-lifetime.jsonl: root gamescope/gamescope-wl descendants include eldenring.exe as zombie. er-effects-crash-log.txt: process-exit via NtTerminateProcess code=0xc0000005 handle=0xffffffffffffffff callers=[#0=0x6ffebc245129,#1=0x6ffebc2442ab,#2=0x6ffebc246890,#3=0x6ffebff77963,#4=0x6ffebff40af9,#5=0x6ffebff772e9,#6=0x6ffebff799ed,#7=0x6ffebff40b2a]."}}
