{"run":65,"commit":"2100051","metric":1490,"metrics":{"readiness_gate_failures":2,"target_constants_remaining":0,"helpers_missing":0,"fixed_wait_predicates":0,"autoload_static_failures":2,"asset_chain_failures":0,"dll_patch_failures":0,"native_continue_failures":0,"field58_gate_failures":0,"direct_shortcut_failures":0,"input_path_failures":0,"runtime_proof_failures":1,"runtime_mode_failures":0,"eula_popup_failures":0,"save_data_popup_failures":0,"messagebox_dialog_failures":0,"server_status_failures":0,"title_cover_failures":0,"title_cover_penalty":0,"native_trace_blockers":0,"native_trace_hits_total":74,"native_trace_unique_breakpoints":11,"false_positives":0,"runtime_timeout_failures":0,"runtime_title_visual_suppressed_builds":0,"runtime_custom_cover_builds":0,"runtime_simulated_button_presses_total":0},"status":"discard","description":"static rebaseline after direct_menu_load/idle-node falsification","timestamp":1782367156175,"segment":0,"confidence":4.833333333333333,"asi":{"hypothesis":"Run a clean static rebaseline after reverting the diagnostic idle-node/direct_menu_load experiments to see current executable-score loss before picking the next static/runtime target.","rollback_reason":"No code change and primary score 1490 is below the known kept best 1520; this was only a baseline measurement. Current static losses are readiness_gate_failures=2, autoload_static_failures=2, and runtime_proof_failures=1.","next_action_hint":"Inspect measure/check details for the two static readiness/autoload failures. Fix only true false positives or executable guards; otherwise pivot to static RE of the native TitleTopDialog open-menu transition instead of more direct_menu_load runtime probes.","details_log":"/tmp/pi-experiment-9ba78270e1a484e6.log","parsed_metrics":{"autoload_re_score":1490,"readiness_gate_failures":2,"autoload_static_failures":2,"runtime_proof_failures":1,"false_positives":0}}}
{"run":66,"commit":"2100051","metric":0,"metrics":{"readiness_gate_failures":1,"target_constants_remaining":0,"helpers_missing":0,"fixed_wait_predicates":0,"autoload_static_failures":1,"asset_chain_failures":0,"dll_patch_failures":0,"native_continue_failures":0,"field58_gate_failures":0,"direct_shortcut_failures":0,"input_path_failures":0,"runtime_proof_failures":1,"runtime_mode_failures":0,"eula_popup_failures":0,"save_data_popup_failures":0,"messagebox_dialog_failures":0,"server_status_failures":0,"title_cover_failures":0,"title_cover_penalty":0,"native_trace_blockers":0,"native_trace_hits_total":74,"native_trace_unique_breakpoints":11,"false_positives":0,"runtime_timeout_failures":1,"runtime_title_visual_suppressed_builds":1,"runtime_custom_cover_builds":0,"runtime_simulated_button_presses_total":0},"status":"crash","description":"arming product_core for save_requested still lands in ProfileLoadDialog, not TitleTopDialog","timestamp":1782367314928,"segment":0,"confidence":4.833333333333333,"asi":{"hypothesis":"Arm product_core for a normal `method=save_requested` request with `require_title_bootstrap=true` instead of direct_menu_load, so product core might wait in actual TitleTopDialog/title-main state rather than the ProfileLoadDialog state observed under direct_menu_load.","rollback_reason":"Runtime timed out. The request method was `save_requested` and product_autoload_armed=true, but product_core still blocked on `title_dialog` with holder vtable 0x142b229f8 (ProfileLoadDialog), menu_latch=0, no press_start_context, no title rows, and only the idle candidate. Native title visual suppression fired once. This falsifies request-method-only pivot; the current title hook/state path still routes to ProfileLoadDialog/empty profile state, not usable TitleTopDialog.","next_action_hint":"Inspect and alter the current BeginTitle/native title visual hook/state code: determine why `owner+e0` is ProfileLoadDialog in both direct_menu_load and save_requested product probes. Reapply the preserved native title job/render-only suppression path if current code still replaces/suppresses the title job too early, and only then retry TitleTopDialog/open-menu row tracing.","artifact_dir":"/home/banon/projects/er-effects-rs/target/runtime-probe/product-continue-direct-20260624-230013","observed_runtime_oracles":{"autoload_method":"save_requested","autoload_require_title_bootstrap":true,"product_autoload_armed":true,"product_core_ready_blocker":"title_dialog","product_core_last_title_dialog_vt":"0x142b229f8/ProfileLoadDialog","title_native_menu_visual_suppressed_builds":1,"menu_continue_candidate_hits":634,"native_submit_hits":0,"continue_load_fired":false,"profile_slot_active_bytes_qword":"0x0","simulated_button_presses_total":0,"processes_remaining":0},"build":"cargo xwin build --release --target x86_64-pc-windows-msvc succeeded.","cleanup":"No eldenring.exe or start_protected_game.exe processes remained."}}
{"run":67,"commit":"2100051","metric":0,"metrics":{"readiness_gate_failures":1,"target_constants_remaining":0,"helpers_missing":0,"fixed_wait_predicates":0,"autoload_static_failures":1,"asset_chain_failures":0,"dll_patch_failures":0,"native_continue_failures":0,"field58_gate_failures":0,"direct_shortcut_failures":0,"input_path_failures":0,"runtime_proof_failures":1,"runtime_mode_failures":0,"eula_popup_failures":0,"save_data_popup_failures":0,"messagebox_dialog_failures":0,"server_status_failures":0,"title_cover_failures":0,"title_cover_penalty":0,"native_trace_blockers":0,"native_trace_hits_total":74,"native_trace_unique_breakpoints":11,"false_positives":0,"runtime_timeout_failures":1,"runtime_title_visual_suppressed_builds":0,"runtime_custom_cover_builds":0,"runtime_simulated_button_presses_total":0},"status":"crash","description":"preserving native 05_000_Title job restores TitleTopDialog readiness but Continue item is still rejected as idle","timestamp":1782367654092,"segment":0,"confidence":4.833333333333333,"asi":{"hypothesis":"Replace the product-unsafe ProfileSelect BeginTitle hook with a diagnostic hook that calls the original native 05_000_Title wrapper and preserves the native title MenuWindowJob, so product_core can reach real TitleTopDialog/menu readiness instead of ProfileLoadDialog.","rollback_reason":"Runtime timed out before native Continue/load/world proof. The hypothesis was partially validated: product_core reached ready state with TitleTopDialog vtable 0x142b26468, menu_opened_latch=1, press_start_context non-null, title_handoff_complete=true, and profile_slot_active_bytes_qword=0x1. However product_continue_item_action still rejected the selected Continue MenuWindowJob because accept_predicate=0x1407add70 (idle/constant-false) and no native submit/continue_load fired. The diagnostic also weakens visual-cover scoring by preserving native title visual, so it is not keepable.","next_action_hint":"Reapply the preserved-native-title-job hook, then allow the selected idle-tick candidate only in this valid TitleTopDialog-ready state (menu_latch=1, TitleTopDialog vtable, profile active) and submit via the native item accept/result path or 7ac890 as a diagnostic. This differs from the earlier falsified idle-node submit under ProfileLoadDialog: here TitleTopDialog is valid and profile summary is active without repair.","artifact_dir":"/home/banon/projects/er-effects-rs/target/runtime-probe/product-continue-direct-20260624-230518","observed_runtime_oracles":{"autoload_method":"direct_menu_load","product_autoload_armed":true,"title_hook":"preserved native 05_000_Title, no ProfileSelect replacement","native_job":"0x7ffe9e52c280","product_core_ready_blocker":"ready","product_core_ready_successes":563,"product_core_last_title_dialog_vt":"0x142b26468/TitleTopDialog","product_core_last_menu_opened_latch":1,"product_core_last_press_start_context":"0x7ffe9e52c290","profile_slot_active_bytes_qword":"0x1","title_handoff_complete":true,"menu_continue_candidate_hits":"present","idle_candidate_rejection_logs":"present, accept_predicate=0x1407add70","native_submit_hits":0,"continue_load_fired":false,"simulated_button_presses_total":0,"messagebox_postload_builds":0,"processes_remaining":0},"build":"cargo xwin build --release --target x86_64-pc-windows-msvc succeeded.","cleanup":"No eldenring.exe or start_protected_game.exe processes remained."}}
{"run":68,"commit":"2100051","metric":0,"metrics":{"readiness_gate_failures":1,"target_constants_remaining":0,"helpers_missing":0,"fixed_wait_predicates":0,"autoload_static_failures":1,"asset_chain_failures":0,"dll_patch_failures":0,"native_continue_failures":0,"field58_gate_failures":0,"direct_shortcut_failures":0,"input_path_failures":0,"runtime_proof_failures":1,"runtime_mode_failures":0,"eula_popup_failures":0,"save_data_popup_failures":0,"messagebox_dialog_failures":0,"server_status_failures":0,"title_cover_failures":0,"title_cover_penalty":0,"native_trace_blockers":0,"native_trace_hits_total":74,"native_trace_unique_breakpoints":11,"false_positives":0,"runtime_timeout_failures":1,"runtime_title_visual_suppressed_builds":0,"runtime_custom_cover_builds":0,"runtime_simulated_button_presses_total":0},"status":"crash","description":"selected idle item accept under valid TitleTopDialog still does not fire continue_load","timestamp":1782367940450,"segment":0,"confidence":4.833333333333333,"asi":{"hypothesis":"With native 05_000_Title/TitleTopDialog preserved and product_core ready (menu latch + profile active), allow the selected idle-tick MenuWindowJob candidate and submit through the native MenuWindowJob accept pipeline; earlier idle-node submits were contaminated by ProfileLoadDialog state, so this valid TitleTopDialog state might fire native Continue.","rollback_reason":"Runtime timed out. The selected idle candidate was accepted in valid TitleTopDialog state and the native MenuWindowJob accept pipeline ran, but `continue_load_67b750` still did not fire. The post-click guard shows profile summary slot0 is Banon level 150/map 0xe000000, but PGD remains the placeholder level-9 empty-name character, b80=0, c30=0xa010000, native_submit_entered=false, and native_continue_chain_stage=guard_without_native_submit. Thus the idle d180 MenuWindowJob/result is not the real native Continue callback even when TitleTopDialog is valid.","next_action_hint":"Stop submitting the idle d180 candidate. The next promising path is to capture/invoke the actual `0x14082bac0` Continue wrapper or its registered MenuMemberFuncJob/row. Use the preserved native title job state (it proves TitleTopDialog/menu_latch/profile active), enable continue trace, and add hooks/field scans specifically for TitleTopDialog's row registry around `0x1409b24e0`, `0x1407ab370`, and `0x1407a6c00`, or call `diagnostic_menu_walk` on the correct TitleTopDialog/menu controller instead of owner+0x138.","artifact_dir":"/home/banon/projects/er-effects-rs/target/runtime-probe/product-continue-direct-20260624-231007","observed_runtime_oracles":{"title_hook":"preserved native 05_000_Title","product_core_ready_blocker":"ready","product_core_ready_successes":26,"product_core_last_title_dialog_vt":"0x142b26468/TitleTopDialog","product_core_last_menu_opened_latch":1,"profile_slot_active_bytes_qword":"0x1","selected_idle_candidate_accepted_logs":1,"native_item_accept_pipeline_logs":1,"continue_load_fired":false,"native_submit_hits":0,"native_continue_chain_stage":"guard_without_native_submit","profile_slot_identity":"Banon level150 map 0xe000000","pgd_identity":"level9 empty-name placeholder","b80":0,"c30":"0xa010000","simulated_button_presses_total":0,"messagebox_postload_builds":0,"processes_remaining":0},"build":"cargo xwin build --release --target x86_64-pc-windows-msvc succeeded.","cleanup":"No eldenring.exe or start_protected_game.exe processes remained."}}
{"run":69,"commit":"2100051","metric":0,"metrics":{"readiness_gate_failures":1,"target_constants_remaining":0,"helpers_missing":0,"fixed_wait_predicates":0,"autoload_static_failures":1,"asset_chain_failures":0,"dll_patch_failures":0,"native_continue_failures":0,"field58_gate_failures":0,"direct_shortcut_failures":0,"input_path_failures":0,"runtime_proof_failures":1,"runtime_mode_failures":0,"eula_popup_failures":0,"save_data_popup_failures":0,"messagebox_dialog_failures":0,"server_status_failures":0,"title_cover_failures":0,"title_cover_penalty":0,"native_trace_blockers":0,"native_trace_hits_total":74,"native_trace_unique_breakpoints":11,"false_positives":0,"runtime_timeout_failures":1,"runtime_title_visual_suppressed_builds":0,"runtime_custom_cover_builds":0,"runtime_simulated_button_presses_total":0},"status":"crash","description":"continue-trace under preserved TitleTopDialog still captures no real Continue wrapper/member node","timestamp":1782368417266,"segment":0,"confidence":4.833333333333333,"asi":{"hypothesis":"With the native 05_000_Title job preserved, product_core reaches valid TitleTopDialog/menu-latch/profile-active state. Enabling existing continue-trace hooks in that state should capture the real 0x14082bac0 Continue wrapper or registered MenuMemberFuncJob if those rows/actions are built by the self-opened title menu.","rollback_reason":"Runtime timed out. The preserved-title state again reached ready TitleTopDialog (vt 0x142b26468, menu_latch=1, profile active qword=0x1), but continue-trace captured zero TITLE-ROW-BUILD, zero TITLE-CONTINUE-ACTION-BUILD, zero continue_member_node/task_node, zero menu_continue_wrapper, and zero result_action hits. The only ticking candidate remained the idle MenuWindowJob (item 0x7ffe9e52c000, idle accept hits 1152), so existing hooks do not observe the real Continue row/action in the product self-open path.","next_action_hint":"Add a direct read-only scan/dump of the actual TitleTopDialog object/registry after ready instead of relying on hooks: scan around dialog+0xa38/a48/a60 and heap pointers for MEMBERFUNCJOB_VTABLE_RVA nodes whose member_fn equals/chains to 0x14082bac0, log qword windows for registry object 0xa48, and call diagnostic_menu_walk with the correct title dialog/controller pointer rather than owner+0x138. Do not submit idle candidate again.","artifact_dir":"/home/banon/projects/er-effects-rs/target/runtime-probe/product-continue-direct-20260624-231747","observed_runtime_oracles":{"autoload_method":"direct_menu_load","product_autoload_armed":true,"title_hook":"preserved native 05_000_Title, no ProfileSelect replacement","product_core_ready_blocker":"ready","product_core_ready_successes":555,"product_core_last_title_dialog_vt":"0x142b26468/TitleTopDialog","product_core_last_menu_opened_latch":1,"product_core_last_press_start_context":"0x7ffe9e52c290","profile_slot_active_bytes_qword":"0x1","title_handoff_complete":true,"title_row_build_hits":0,"title_continue_action_build_hits":0,"continue_member_node":null,"continue_task_node":null,"menu_continue_wrapper_hits":0,"result_action_builder_hits":0,"result_action_insert_hits":0,"idle_candidate_item":"0x7ffe9e52c000","idle_candidate_hits":1152,"native_submit_hits":0,"continue_load_fired":false,"simulated_button_presses_total":0,"messagebox_postload_builds":0,"saved_map_c30":"0xa010000","processes_remaining":0},"build":"cargo xwin build --release --target x86_64-pc-windows-msvc succeeded.","cleanup":"No eldenring.exe or start_protected_game.exe processes remained."}}
{"run":70,"commit":"2100051","metric":0,"metrics":{"readiness_gate_failures":1,"target_constants_remaining":0,"helpers_missing":0,"fixed_wait_predicates":0,"autoload_static_failures":1,"asset_chain_failures":0,"dll_patch_failures":0,"native_continue_failures":0,"field58_gate_failures":0,"direct_shortcut_failures":0,"input_path_failures":0,"runtime_proof_failures":1,"runtime_mode_failures":0,"eula_popup_failures":0,"save_data_popup_failures":0,"messagebox_dialog_failures":0,"server_status_failures":0,"title_cover_failures":0,"title_cover_penalty":0,"native_trace_blockers":0,"native_trace_hits_total":74,"native_trace_unique_breakpoints":11,"false_positives":0,"runtime_timeout_failures":1,"runtime_title_visual_suppressed_builds":0,"runtime_custom_cover_builds":0,"runtime_simulated_button_presses_total":0},"status":"crash","description":"read-only TitleTopDialog registry scan found no Continue MenuMemberFuncJob nodes in self-open product state","timestamp":1782368798736,"segment":0,"confidence":4.833333333333333,"asi":{"hypothesis":"In the preserved native 05_000_Title/TitleTopDialog ready state, the real Continue wrapper may exist in the TitleTopDialog registry but the existing hooks miss it. Add a read-only scanner in the submit-wait branch to dump dialog+0xa38/a48/a60, scan dialog fields and the registry object for MenuMemberFuncJob nodes whose member_fn chains to 0x14082bac0, and latch any found node without submitting it.","rollback_reason":"Runtime timed out. The diagnostic scanner ran repeatedly in the ready TitleTopDialog state but found member_hits=0 and continue_hits=0 every time. It reported dialog=0x7ffe969d3b20, registry(+0xa48)=0x142a94a70, registry_vt=0x14074baf0, capture(+0xa38)=0x7ffffdb7fa38, latch=1, continue=0x14082bac0, memberjob_vt=0x142b265d0. Registry qwords looked like static vtable/function/string metadata (e.g. Static*/Frame*/Dynamic strings and function pointers), not heap MenuMemberFuncJob nodes. No Continue node, native submit, or continue_load fired.","next_action_hint":"Static RE the actual meaning of TitleTopDialog+0xa48/registry_vt=0x14074baf0 and the open-menu/state transition. The product self-open state has a ready TitleTopDialog but apparently no heap row/member nodes; the real Continue callback likely lives behind a different object/state (or is only materialized by a later input-driven selection layer). Use Ghidra/static disassembly of 0x1409b24e0, 0x1407ab370, 0x1407a6c00, and the registry vtable functions seen at 0x14074baf0/0x14074bae0 before another runtime run. Do not submit the idle MenuWindowJob again.","artifact_dir":"/home/banon/projects/er-effects-rs/target/runtime-probe/product-continue-direct-20260624-232407","observed_runtime_oracles":{"autoload_method":"direct_menu_load","product_autoload_armed":true,"title_hook":"preserved native 05_000_Title, no ProfileSelect replacement","product_core_ready_blocker":"ready","product_core_last_title_dialog_vt":"0x142b26468/TitleTopDialog","product_core_last_menu_opened_latch":1,"profile_slot_active_bytes_qword":"0x1","scanner_dialog":"0x7ffe969d3b20","scanner_registry":"0x142a94a70","scanner_registry_vt":"0x14074baf0","scanner_capture":"0x7ffffdb7fa38","scanner_latch":1,"scanner_continue_abs":"0x14082bac0","scanner_memberjob_vt":"0x142b265d0","scanner_member_hits":0,"scanner_continue_hits":0,"continue_member_node":null,"idle_candidate_item":"0x7ffe9e52c000","native_submit_hits":0,"continue_load_fired":false,"simulated_button_presses_total":0,"messagebox_postload_builds":0,"processes_remaining":0},"build":"cargo xwin build --release --target x86_64-pc-windows-msvc succeeded.","cleanup":"No eldenring.exe or start_protected_game.exe processes remained."}}
