{"run":20,"commit":"ad5b42e","metric":1445,"metrics":{"readiness_gate_failures":5,"target_constants_remaining":0,"helpers_missing":0,"fixed_wait_predicates":0,"autoload_static_failures":5,"asset_chain_failures":0,"dll_patch_failures":0,"native_continue_failures":0,"field58_gate_failures":0,"direct_shortcut_failures":0,"input_path_failures":0,"runtime_proof_failures":1,"runtime_mode_failures":0,"eula_popup_failures":0,"save_data_popup_failures":0,"messagebox_dialog_failures":0,"server_status_failures":0,"title_cover_failures":0,"title_cover_penalty":0,"native_trace_blockers":0,"native_trace_hits_total":74,"native_trace_unique_breakpoints":11,"false_positives":0,"runtime_timeout_failures":0,"runtime_title_visual_suppressed_builds":0,"runtime_custom_cover_builds":0,"runtime_simulated_button_presses_total":0},"status":"keep","description":"fixed static measure false positive for MenuWindowJob ctor constant after module split","timestamp":1782354429026,"segment":0,"confidence":8.6,"asi":{"hypothesis":"The first autoload_static_failure was a measure false positive: MENU_WINDOW_JOB_CTOR_RVA is implemented in src/constants.rs after the module split, but .auto/measure.sh checked only lib_code while checking the trace hook body in experiments. Switch that one constant check to the combined source string so the existing real constructor hook is credited.","next_action_hint":"Inspect the remaining five autoload_static_failures; several likely have the same module-split false-positive shape (constants in src/constants.rs or hook install tokens outside lib.rs). Fix only when the implementation actually exists and the measure is checking the wrong source slice.","validation":"./.auto/measure.sh passed; autoload_re_score improved 1430 -> 1445, readiness/autoload_static failures 6 -> 5, false_positives remains 0."}}
{"run":21,"commit":"bc0d2f3","metric":1475,"metrics":{"readiness_gate_failures":3,"target_constants_remaining":0,"helpers_missing":0,"fixed_wait_predicates":0,"autoload_static_failures":3,"asset_chain_failures":0,"dll_patch_failures":0,"native_continue_failures":0,"field58_gate_failures":0,"direct_shortcut_failures":0,"input_path_failures":0,"runtime_proof_failures":1,"runtime_mode_failures":0,"eula_popup_failures":0,"save_data_popup_failures":0,"messagebox_dialog_failures":0,"server_status_failures":0,"title_cover_failures":0,"title_cover_penalty":0,"native_trace_blockers":0,"native_trace_hits_total":74,"native_trace_unique_breakpoints":11,"false_positives":0,"runtime_timeout_failures":0,"runtime_title_visual_suppressed_builds":0,"runtime_custom_cover_builds":0,"runtime_simulated_button_presses_total":0},"status":"keep","description":"credited existing native-accept and idle MenuWindowJob constructor hooks after constants.rs split","timestamp":1782354477235,"segment":0,"confidence":5.444444444444445,"asi":{"hypothesis":"The next two autoload_static_failures were the same module-split false-positive class: the native-accept and idle MenuWindowJob constructor hooks and telemetry exist in src/experiments/trace.rs, while their RVA constants live in src/constants.rs. .auto/measure.sh incorrectly looked for the constants only in lib_code.","next_action_hint":"Inspect the remaining three static failures. Apply the same correction only if source inspection proves the implementation/check exists and the metric is looking in the wrong source slice.","validation":"./.auto/measure.sh passed; score improved 1445 -> 1475, readiness/autoload_static failures 5 -> 3, false_positives remains 0."}}
{"run":22,"commit":"657faf4","metric":1505,"metrics":{"readiness_gate_failures":1,"target_constants_remaining":0,"helpers_missing":0,"fixed_wait_predicates":0,"autoload_static_failures":1,"asset_chain_failures":0,"dll_patch_failures":0,"native_continue_failures":0,"field58_gate_failures":0,"direct_shortcut_failures":0,"input_path_failures":0,"runtime_proof_failures":1,"runtime_mode_failures":0,"eula_popup_failures":0,"save_data_popup_failures":0,"messagebox_dialog_failures":0,"server_status_failures":0,"title_cover_failures":0,"title_cover_penalty":0,"native_trace_blockers":0,"native_trace_hits_total":74,"native_trace_unique_breakpoints":11,"false_positives":0,"runtime_timeout_failures":0,"runtime_title_visual_suppressed_builds":0,"runtime_custom_cover_builds":0,"runtime_simulated_button_presses_total":0},"status":"keep","description":"credited existing LangSelect predicate and Continue member-node telemetry after module split","timestamp":1782354531839,"segment":0,"confidence":5.7894736842105265,"asi":{"hypothesis":"Two remaining autoload_static_failures were also module-split measure false positives: Title native-ready predicate RVA/original and MENU_CONTINUE_MEMBER_NODE exist outside src/lib.rs, while the implemented hooks/telemetry/checker text are present.","next_action_hint":"Investigate the final autoload_static_failure separately. Source inspection showed result-chain telemetry is mostly present, but oracle_result_action_last_insert_update_rva may be genuinely missing or renamed; do not simply broaden the measure until the telemetry field is implemented or mapped to an existing equivalent.","validation":"./.auto/measure.sh passed; score improved 1475 -> 1505, readiness/autoload_static failures 3 -> 1, false_positives remains 0."}}
{"run":23,"commit":"06340be","metric":1520,"metrics":{"readiness_gate_failures":0,"target_constants_remaining":0,"helpers_missing":0,"fixed_wait_predicates":0,"autoload_static_failures":0,"asset_chain_failures":0,"dll_patch_failures":0,"native_continue_failures":0,"field58_gate_failures":0,"direct_shortcut_failures":0,"input_path_failures":0,"runtime_proof_failures":1,"runtime_mode_failures":0,"eula_popup_failures":0,"save_data_popup_failures":0,"messagebox_dialog_failures":0,"server_status_failures":0,"title_cover_failures":0,"title_cover_penalty":0,"native_trace_blockers":0,"native_trace_hits_total":74,"native_trace_unique_breakpoints":11,"false_positives":0,"runtime_timeout_failures":0,"runtime_title_visual_suppressed_builds":0,"runtime_custom_cover_builds":0,"runtime_simulated_button_presses_total":0},"status":"keep","description":"credited existing result-chain and policy telemetry statics after constants.rs split","timestamp":1782354619353,"segment":0,"confidence":5.8,"asi":{"hypothesis":"The final autoload_static_failure was also a module-split false positive: the result-chain/policy telemetry statics and RVA/orig constants all exist in src/constants.rs/experiments, but the measure checked only lib_code. Broaden only the verified constants/statics in that result-chain block to the combined code source.","next_action_hint":"With static false positives gone, the only remaining score loss is runtime_proof_failures=1. Next real iteration should focus on product runtime proof: either make the profile-list RAM oracle an explicit diagnostic target without claiming product success, or solve the native Continue/load chain so product_submit/result_chain/continue_load/expected_save pass.","validation":"./.auto/measure.sh passed; score improved 1505 -> 1520, readiness/autoload_static failures 1 -> 0, false_positives remains 0."}}
{"run":24,"commit":"06340be","metric":1520,"metrics":{"readiness_gate_failures":0,"target_constants_remaining":0,"helpers_missing":0,"fixed_wait_predicates":0,"autoload_static_failures":0,"asset_chain_failures":0,"dll_patch_failures":0,"native_continue_failures":0,"field58_gate_failures":0,"direct_shortcut_failures":0,"input_path_failures":0,"runtime_proof_failures":1,"runtime_mode_failures":0,"eula_popup_failures":0,"save_data_popup_failures":0,"messagebox_dialog_failures":0,"server_status_failures":0,"title_cover_failures":0,"title_cover_penalty":0,"native_trace_blockers":0,"native_trace_hits_total":74,"native_trace_unique_breakpoints":11,"false_positives":0,"runtime_timeout_failures":0,"runtime_title_visual_suppressed_builds":0,"runtime_custom_cover_builds":0,"runtime_simulated_button_presses_total":0},"status":"discard","description":"wired expected-save oracle and direct-probe artifacts into measure, but score stayed unchanged","timestamp":1782354746612,"segment":0,"confidence":5.8,"asi":{"hypothesis":"Make the approved direct/offline product probe self-generate/pass an expected save oracle and include product-continue-direct artifacts in .auto/measure.sh runtime scoring, so future direct runtime proofs can count without relying on product-core artifact naming.","rollback_reason":"Primary metric stayed at 1520 with runtime_proof_failures=1. The wiring alone did not produce a new runtime proof artifact or reduce failures.","next_action_hint":"Steam autocloud is now disabled by the user, so the next runtime iteration should use the live visible/manual path or a direct product probe with the staged .bak/autocloud metadata and expected-save oracle reapplied only if it actually runs. Do not keep artifact-name scoring changes unless a runtime proof improves the metric.","validation":"bash -n scripts/run-product-continue-direct-probe.sh; bash -n .auto/runtime_probe.sh; python3 -m py_compile scripts/er-readiness-watch.py; ./.auto/measure.sh passed unchanged at 1520."}}
{"run":25,"commit":"06340be","metric":0,"metrics":{"readiness_gate_failures":0,"target_constants_remaining":0,"helpers_missing":0,"fixed_wait_predicates":0,"autoload_static_failures":0,"asset_chain_failures":0,"dll_patch_failures":0,"native_continue_failures":1,"field58_gate_failures":0,"direct_shortcut_failures":0,"input_path_failures":0,"runtime_proof_failures":1,"runtime_mode_failures":0,"eula_popup_failures":0,"save_data_popup_failures":0,"messagebox_dialog_failures":0,"server_status_failures":0,"title_cover_failures":0,"title_cover_penalty":0,"native_trace_blockers":0,"native_trace_hits_total":74,"native_trace_unique_breakpoints":11,"false_positives":0,"runtime_timeout_failures":1,"runtime_title_visual_suppressed_builds":1,"runtime_custom_cover_builds":1,"runtime_simulated_button_presses_total":0},"status":"crash","description":"headless zero-input product probe with staged save/oracle still hit privacy-policy no-character gate","timestamp":1782354971587,"segment":0,"confidence":5.8,"asi":{"hypothesis":"With Steam autocloud disabled and per-run save companions staged, the zero-input direct product probe might let the gold save profile summary load and then continue through native autoload behind the cover.","error_details":"Artifact /home/banon/projects/er-effects-rs/target/runtime-probe/product-continue-direct-20260624-193342: expected-save-oracle decoded slot0 Banon level 150 map 234881024, but telemetry stayed at profile_slot_active_bytes_qword=0x0, oracle_privacy_policy_gate=true, oracle_char_name='', oracle_player_present=false. Title cover telemetry fired (native suppressed=1, ProfileSelect cover builds=1), zero simulated input, zero MessageBox/server/policy-window builds. No readiness-result was written before the outer tool timeout.","rollback_reason":"Runtime proof failed: the staged save was not accepted into the native profile summary in the headless product path, so Continue/load never became valid.","next_action_hint":"User requested non-headless. Re-run visible/on-screen so the user can drive or observe the native screen while the same staged-save/oracle path is active; do not claim success unless RAM telemetry shows profile active slot/name and downstream product load proof.","artifact_dir":"/home/banon/projects/er-effects-rs/target/runtime-probe/product-continue-direct-20260624-193342","runtime_evidence":{"expected_save_name":"Banon","expected_level":150,"profile_slot_active_bytes_qword":"0x0","oracle_privacy_policy_gate":true,"oracle_char_name":"","oracle_player_present":false,"title_native_suppressed_builds":1,"custom_cover_builds":1,"simulated_button_presses_total":0,"messagebox_dialog_builds":0}}}
{"run":26,"commit":"06340be","metric":0,"metrics":{"readiness_gate_failures":0,"target_constants_remaining":0,"helpers_missing":0,"fixed_wait_predicates":0,"autoload_static_failures":0,"asset_chain_failures":0,"dll_patch_failures":0,"native_continue_failures":1,"field58_gate_failures":0,"direct_shortcut_failures":0,"input_path_failures":0,"runtime_proof_failures":1,"runtime_mode_failures":0,"eula_popup_failures":0,"save_data_popup_failures":0,"messagebox_dialog_failures":0,"server_status_failures":0,"title_cover_failures":0,"title_cover_penalty":0,"native_trace_blockers":0,"native_trace_hits_total":74,"native_trace_unique_breakpoints":11,"false_positives":0,"runtime_timeout_failures":0,"runtime_title_visual_suppressed_builds":1,"runtime_custom_cover_builds":1,"runtime_simulated_button_presses_total":0},"status":"crash","description":"non-headless product probe showed same ProfileSelect/empty-profile state and exited before readiness","timestamp":1782355136371,"segment":0,"confidence":5.8,"asi":{"hypothesis":"Run the product probe non-headless so the user can observe the visible state while telemetry validates whether the staged Banon save becomes active and the native Continue chain begins.","error_details":"Artifact /home/banon/projects/er-effects-rs/target/runtime-probe/product-continue-direct-20260624-193731: user observed same visible state as prior ProfileSelect/empty-profile run. Readiness failed with reason=process_exited_before_ready. Telemetry: oracle_privacy_policy_gate=true, profile_slot_active_bytes_qword=0x0, oracle_char_name='', player=false, native submit/result hooks all 0, continue_expected_slot=-1. Title cover still fired (suppressed=1, custom_cover_builds=1), zero simulated input, zero MessageBox/policy/server statuses. Teardown screenshot absent because game was gone by cleanup.","rollback_reason":"Runtime proof failed: non-headless visibility confirmed the same bad state, not a product load. The ProfileSelect cover replacement remains product-unsafe and the save/profile summary is still empty in the product path.","next_action_hint":"Stop using ProfileSelect as the title out-slot replacement. Use static RE to suppress render below the title job return or inject an independent cover surface; separately fix staged save/profile summary load before trying native Continue. If using visible manual trace, keep autoload disabled and profile-list RAM oracle target; for product proof, require zero-input downstream native Continue/load/world evidence.","artifact_dir":"/home/banon/projects/er-effects-rs/target/runtime-probe/product-continue-direct-20260624-193731","runtime_evidence":{"reason":"process_exited_before_ready","profile_slot_active_bytes_qword":"0x0","oracle_privacy_policy_gate":true,"oracle_char_name":"","oracle_player_present":false,"title_native_suppressed_builds":1,"custom_cover_builds":1,"simulated_button_presses_total":0,"messagebox_dialog_builds":0}}}
{"run":27,"commit":"06340be","metric":0,"metrics":{"readiness_gate_failures":0,"target_constants_remaining":0,"helpers_missing":0,"fixed_wait_predicates":0,"autoload_static_failures":0,"asset_chain_failures":0,"dll_patch_failures":0,"native_continue_failures":1,"field58_gate_failures":0,"direct_shortcut_failures":0,"input_path_failures":0,"runtime_proof_failures":1,"runtime_mode_failures":0,"eula_popup_failures":0,"save_data_popup_failures":0,"messagebox_dialog_failures":0,"server_status_failures":0,"title_cover_failures":1,"title_cover_penalty":50,"native_trace_blockers":0,"native_trace_hits_total":74,"native_trace_unique_breakpoints":11,"false_positives":0,"runtime_timeout_failures":1,"runtime_title_visual_suppressed_builds":1,"runtime_custom_cover_builds":0,"runtime_simulated_button_presses_total":0},"status":"crash","description":"Part A-only visible runtime avoided ProfileSelect replacement but spawned placeholder New Game path, not Banon","timestamp":1782355854470,"segment":0,"confidence":5.8,"asi":{"hypothesis":"After static RE showed 0x14081f9f0 is one of the real 05_000_Title wrappers and 0x14081f6f0/0x14081f7e0 are ProfileSelect wrappers, remove the ProfileSelect replacement and validate Part A-only null suppression with staged save companions in a visible runtime run.","error_details":"Artifact /home/banon/projects/er-effects-rs/target/runtime-probe/product-continue-direct-20260624-194927: visible run reached New Game starting cutscene. RAM telemetry disproved expected save: expected-save-oracle slot0 Banon level150 map234881024, but observed oracle_char_name='_', oracle_char_name_len=1, oracle_char_level=9, oracle_saved_map_c30=0xa010000, profile_slot_active_bytes_qword=0x0, oracle_privacy_policy_gate=true. player_present=true and current_animation_id=4050 only prove placeholder/default character spawned; native Continue/product result hooks stayed 0. Title suppression fired once, ProfileSelect cover builds=0, zero simulated input and zero MessageBox/server/policy window builds.","rollback_reason":"Runtime proof failed and title_cover static score regressed because Part B cover path was absent. The run is useful evidence that PartA-only null suppression no longer parks the ProfileSelect screen, but it falls into New Game/default placeholder because the staged save/profile summary is still not active.","next_action_hint":"Focus next on save/profile activation: direct Proton staged save tree still has profile active bytes 0 despite reading ER0000.sl2. Static RE the boot profile-summary read/validation path around GameDataMan+0x78 and the save directory enumeration; figure out why the staged save is not populating active slots before trying further title-cover changes. Also update docs/prompt"}}
{"run":28,"commit":"fa10a85","metric":1520,"metrics":{"readiness_gate_failures":0,"target_constants_remaining":0,"helpers_missing":0,"fixed_wait_predicates":0,"autoload_static_failures":0,"asset_chain_failures":0,"dll_patch_failures":0,"native_continue_failures":0,"field58_gate_failures":0,"direct_shortcut_failures":0,"input_path_failures":0,"runtime_proof_failures":1,"runtime_mode_failures":0,"eula_popup_failures":0,"save_data_popup_failures":0,"messagebox_dialog_failures":0,"server_status_failures":0,"title_cover_failures":0,"title_cover_penalty":0,"native_trace_blockers":0,"native_trace_hits_total":74,"native_trace_unique_breakpoints":11,"false_positives":0,"runtime_timeout_failures":0,"runtime_title_visual_suppressed_builds":0,"runtime_custom_cover_builds":0,"runtime_simulated_button_presses_total":0},"status":"keep","description":"fail fast when expected-save runtime reaches placeholder '_' character","timestamp":1782356138129,"segment":0,"confidence":5.8,"asi":{"hypothesis":"The watcher should crash/fail fast as soon as product proof telemetry reports a live player with an empty-like placeholder character name such as '_' while an expected save oracle is active, instead of waiting for the world-stable timeout.","result":"Implemented PLACEHOLDER_CHARACTER_DETECTED / placeholder_character_detected in scripts/er-readiness-watch.py. It only triggers with an expected save oracle and live player semaphore (oracle_player_present or player_available), so title/menu pre-load '_' values do not false fail. Added regression tests in scripts/test-er-readiness-watch.py and validated py_compile plus python3 scripts/test-er-readiness-watch.py. Static measure remains 1520 with runtime_proof_failures=1; this keep preserves a user-requested hard product invariant rather than claiming primary-score improvement.","next_action_hint":"Next experiment should continue static RE of why direct Proton staged save/profile summary stays inactive (profile_slot_active_bytes_qword=0, privacy gate true) before more title-cover runtime runs."}}
