{"run":618,"commit":"978974d","metric":0,"metrics":{"readiness_gate_failures":0,"target_constants_remaining":0,"helpers_missing":0,"fixed_wait_predicates":0,"autoload_static_failures":0,"asset_chain_failures":0,"dll_patch_failures":0,"native_continue_failures":0,"field58_gate_failures":0,"direct_shortcut_failures":0,"input_path_failures":0,"runtime_proof_failures":0,"runtime_mode_failures":0,"eula_popup_failures":0,"save_data_popup_failures":0,"messagebox_dialog_failures":0,"server_status_failures":0,"title_cover_failures":3,"title_cover_penalty":2000,"native_trace_blockers":0,"native_trace_hits_total":74,"native_trace_unique_breakpoints":11,"false_positives":0,"offline_face_source_ready":1,"removed path_cpu_texture_bridge_ready":0,"offline_face_texture_runtime_drawn":0,"stylized_facedata_pixel_oracle":0,"real_portrait_asset_candidates":0,"profile_placeholder_assets_only":1},"status":"discard","description":"Scaffolded default-off MenuWindow-only bind-owner diagnostic; static gate passed but no score.","timestamp":1782663000254,"segment":2,"confidence":null,"asi":{"hypothesis":"Implement an explicit-gated, default-off MenuWindow-only diagnostic scaffold using logo+0x70 as SceneObjProxy, MenuWindow ctor live/deobf 0x140741960, bind owner this+0x3b8, and non-deleting dtor 0x1407430c0, while keeping it non-scoring until runtime proves it.","observed_evidence":"Added scaffold constants/telemetry and a gated helper ER_EFFECTS_MENUWINDOW_BIND_OWNER_DIAGNOSTIC=1 that would construct DLL-owned 0xa38 MenuWindow storage, record bind_owner=this+0x3b8 and count at owner+0x668, then tear down via non-deleting dtor. Also replaced the raw `menu_id >= 0x47` guard with named constant/comment per user correction. Static/preflight measure passed: /tmp/pi-experiment-33f01e2f5ac2ad90.log. Saved memories: menuwindow-diagnostic-scaffold-static-pass-2026-06-28 and csmenu-visibility-flag-count-constant-style-2026-06-28.","rollback_reason":"Primary metric stayed 0; the scaffold is default-off route plumbing and no runtime proof/visible portrait surface was produced.","next_action_hint":"Reapply the scaffold, then run a bounded runtime diagnostic with ER_EFFECTS_MENUWINDOW_BIND_OWNER_DIAGNOSTIC=1. Before adding/attempting a bind, ensure deeper crash/register/owner-field trace evidence is active; if ctor/dtor survives, add one native-shaped bind through this+0x3b8."}}
{"run":619,"commit":"978974d","metric":0,"metrics":{"readiness_gate_failures":0,"target_constants_remaining":0,"helpers_missing":0,"fixed_wait_predicates":0,"autoload_static_failures":0,"asset_chain_failures":0,"dll_patch_failures":0,"native_continue_failures":0,"field58_gate_failures":0,"direct_shortcut_failures":0,"input_path_failures":0,"runtime_proof_failures":0,"runtime_mode_failures":0,"eula_popup_failures":0,"save_data_popup_failures":0,"messagebox_dialog_failures":0,"server_status_failures":0,"title_cover_failures":2,"title_cover_penalty":1800,"native_trace_blockers":0,"native_trace_hits_total":74,"native_trace_unique_breakpoints":11,"false_positives":1,"offline_face_source_ready":1,"removed path_cpu_texture_bridge_ready":0,"offline_face_texture_runtime_drawn":0,"stylized_facedata_pixel_oracle":0,"real_portrait_asset_candidates":0,"profile_placeholder_assets_only":1},"status":"discard","description":"Runtime-tested MenuWindow-only ctor/dtor diagnostic; survived but blank ProfileSelect false-positive remained.","timestamp":1782663168656,"segment":2,"confidence":null,"asi":{"hypothesis":"Reapply the default-off MenuWindow-only diagnostic scaffold and run a bounded runtime probe with ER_EFFECTS_MENUWINDOW_BIND_OWNER_DIAGNOSTIC=1 to validate ctor/dtor safety before adding any bind call.","observed_evidence":"Artifact /home/banon/projects/er-effects-rs/target/runtime-probe/product-continue-direct-20260628-091128 reached readiness/world_stable. Debug shows MenuWindow-only diagnostic constructed object=0x36331130 scene_proxy=0x7fff329e3208 bind_owner=0x363314e8, returned ctor_ret=0x36331130, bind_owner_count=0, and tore down with non-deleting dtor 0x1407430c0. The event screenshot /home/banon/projects/er-effects-rs/target/runtime-probe/product-continue-direct-20260628-091128/logo-replacement-screenshot.jpg shows the known blank LOAD GAME/ProfileSelect panel; analysis reports known_false_positive_signature=true and black32_ratio=0.4577935717076983 < 0.55. Saved memory menuwindow-only-ctor-dtor-runtime-safe-but-blank-2026-06-28.","rollback_reason":"Primary metric stayed 0 and false_positives=1. Ctor/dtor plumbing survived but no portrait was rendered; the run remained the known blank ProfileSelect false positive.","next_action_hint":"Reapply the scaffold and add exactly one native-shaped MENU_DummyProfileFace_01 -> SYSTEX_Menu_Profile00 bind through object+0x3b8. Before running, add deeper crash/register/owner-field evidence so any bind crash is diagnosable rather than just logged as process exit."}}
{"run":620,"commit":"978974d","metric":0,"metrics":{"readiness_gate_failures":0,"target_constants_remaining":0,"helpers_missing":0,"fixed_wait_predicates":0,"autoload_static_failures":0,"asset_chain_failures":0,"dll_patch_failures":0,"native_continue_failures":0,"field58_gate_failures":0,"direct_shortcut_failures":0,"input_path_failures":0,"runtime_proof_failures":0,"runtime_mode_failures":0,"eula_popup_failures":0,"save_data_popup_failures":0,"messagebox_dialog_failures":0,"server_status_failures":0,"title_cover_failures":2,"title_cover_penalty":1800,"native_trace_blockers":0,"native_trace_hits_total":74,"native_trace_unique_breakpoints":11,"false_positives":1,"offline_face_source_ready":1,"removed path_cpu_texture_bridge_ready":0,"offline_face_texture_runtime_drawn":0,"stylized_facedata_pixel_oracle":0,"real_portrait_asset_candidates":0,"profile_placeholder_assets_only":1},"status":"discard","description":"Runtime-tested one native bind through MenuWindow-only owner; bind succeeded but portrait still invisible.","timestamp":1782663423805,"segment":2,"confidence":null,"asi":{"hypothesis":"Reapply MenuWindow-only scaffold and add exactly one native-shaped MENU_DummyProfileFace_01 -> SYSTEX_Menu_Profile00 bind through object+0x3b8, with pre-bind owner/vector evidence, to test whether a valid passive bind owner makes the aliased ProfileSelect surface render the profile portrait.","observed_evidence":"Artifact /home/banon/projects/er-effects-rs/target/runtime-probe/product-continue-direct-20260628-091541 reached readiness/world_stable. Pre-bind debug: owner=0x22bab4c8 owner_vt=0x142a94a70 owner_context=0x7fff61de31a8 vector_base=0x22bab528 count_before=0 pair=0x10ef40 symbol=MENU_DummyProfileFace_01 target=SYSTEX_Menu_Profile00. Bind observer rewrote symbol to MENU_FL_40135_Profile, target SYSTEX_Menu_Profile00, hit=1; bind returned with count_after=1. Telemetry reports portrait_visible_surface_bound=true and native profile source ready. Event screenshot /home/banon/projects/er-effects-rs/target/runtime-probe/product-continue-direct-20260628-091541/logo-replacement-screenshot.jpg still shows blank LOAD GAME/ProfileSelect; analysis known_false_positive_signature=true and black32_ratio=0.4639141266119578 < 0.55. Saved memory menuwindow-one-bind-safe-but-not-visible-2026-06-28.","rollback_reason":"Primary metric stayed 0 and false_positives=1. Bind-only telemetry is a proven false positive; no visible loaded-character portrait pixels appeared.","next_action_hint":"Do not score or repeat bind-only path. Statically inspect whether FUN_140d6ac00 applies immediately to resolved GFx or only stores vector state, then find the construction-time/refresh/apply step needed to materialize bound SYSTEX symbols on the visible ProfileSelect-alias surface."}}
{"run":621,"commit":"978974d","metric":0,"metrics":{"readiness_gate_failures":0,"target_constants_remaining":0,"helpers_missing":0,"fixed_wait_predicates":0,"autoload_static_failures":0,"asset_chain_failures":0,"dll_patch_failures":0,"native_continue_failures":0,"field58_gate_failures":0,"direct_shortcut_failures":0,"input_path_failures":0,"runtime_proof_failures":0,"runtime_mode_failures":0,"eula_popup_failures":0,"save_data_popup_failures":0,"messagebox_dialog_failures":0,"server_status_failures":0,"title_cover_failures":2,"title_cover_penalty":1800,"native_trace_blockers":0,"native_trace_hits_total":74,"native_trace_unique_breakpoints":11,"false_positives":1,"offline_face_source_ready":1,"removed path_cpu_texture_bridge_ready":0,"offline_face_texture_runtime_drawn":0,"stylized_facedata_pixel_oracle":0,"real_portrait_asset_candidates":0,"profile_placeholder_assets_only":1},"status":"discard","description":"Static RE decoded Scaleform bind apply as immediate live-object replacement, not queued-only state.","timestamp":1782663536489,"segment":2,"confidence":null,"asi":{"hypothesis":"Statically inspect whether FUN_140d6ac00 applies immediately to the resolved GFx object or only stores vector state, after #620 proved a MenuWindow-only bind can return but still leave the visual cover blank.","observed_evidence":"Decompiled dump FUN_1407452c0/FUN_140d6ac00/FUN_140d7c0c0/FUN_140d7be60/FUN_140748700/FUN_140d60950. FUN_1407452c0 appends the pair to owner+0x60 fixed vector via FUN_140748700, then immediately calls FUN_140d6ac00(GLOBAL_CSScaleform, owner, target, symbol). FUN_140d6ac00 locks the singleton and calls FUN_140d7c0c0. FUN_140d7c0c0 resolves target and symbol names, calls FUN_140d7be60, and on success calls vfunc+0x208. FUN_140d7be60 resolves the symbol display object via root vfunc+0xd8(symbol), requires object type low bits 0x100, and replaces display_obj child texture via FUN_141148050 + FUN_140d60950. Saved memory scaleform-bind-apply-immediate-not-queue-2026-06-28. Gate output /tmp/pi-experiment-874c920ee4bd99a3.log stayed autoload_re_score=0.","rollback_reason":"Primary metric stayed 0; static RE produced direction only and no visible loaded-character portrait surface/oracle.","next_action_hint":"Stop asking whether bind applies. Next hook FUN_140d7be60 observe-only to record symbol, display_obj, display_obj+0x18/+0x48, target object, and success for native ProfileSelect construction versus the MenuWindow-only bind, or statically identify the exact visible face symbol instead of MENU_FL_40135_Profile."}}
{"run":622,"commit":"978974d","metric":0,"metrics":{"readiness_gate_failures":0,"target_constants_remaining":0,"helpers_missing":0,"fixed_wait_predicates":0,"autoload_static_failures":0,"asset_chain_failures":0,"dll_patch_failures":0,"native_continue_failures":0,"field58_gate_failures":0,"direct_shortcut_failures":0,"input_path_failures":0,"runtime_proof_failures":0,"runtime_mode_failures":0,"eula_popup_failures":0,"save_data_popup_failures":0,"messagebox_dialog_failures":0,"server_status_failures":0,"title_cover_failures":2,"title_cover_penalty":1800,"native_trace_blockers":0,"native_trace_hits_total":74,"native_trace_unique_breakpoints":11,"false_positives":1,"offline_face_source_ready":1,"removed path_cpu_texture_bridge_ready":0,"offline_face_texture_runtime_drawn":0,"stylized_facedata_pixel_oracle":0,"real_portrait_asset_candidates":0,"profile_placeholder_assets_only":1},"status":"discard","description":"Runtime-observed Scaleform bind-apply success path; display objects update but ProfileSelect panel remains blank.","timestamp":1782663860991,"segment":2,"confidence":null,"asi":{"hypothesis":"Add an observe-only hook on FUN_140d7be60 to record symbol/display-object/target replacement evidence for native ProfileSelect versus the MenuWindow-only one-bind, while keeping the one-bind diagnostic explicit-gated.","observed_evidence":"Artifact /home/banon/projects/er-effects-rs/target/runtime-probe/product-continue-direct-20260628-092249 reached readiness/world_stable. Hook installed at live 0x140d7bdb0. Native/rewrite hit MENU_FL_40135_Profile -> SYSTEX_Menu_Profile00 returned ret=1: root=0x7fff829d9270 root_vt=0x142cc0b80 target_before=0x7fff83dcf830 display_obj=0x7fff829ef200 child18=0x7fff829ef220 child48=0x7fff83dcf830 lookup=0x14116ce70. Native dummy profile binds also returned ret=1 for MENU_DummyProfileFace_02..10 with distinct display objects/targets. Screenshot /home/banon/projects/er-effects-rs/target/runtime-probe/product-continue-direct-20260628-092249/logo-replacement-screenshot.jpg still shows blank LOAD GAME/ProfileSelect, analysis known_false_positive_signature=true black32_ratio=0.4805856779992184 < 0.55. Saved memory scaleform-bind-apply-success-but-profile-panel-blank-2026-06-28.","rollback_reason":"Primary metric stayed 0 and false_positives=1. The hook produced useful route evidence but no visible loaded-character portrait; keeping would preserve diagnostic-only code that does not satisfy product proof.","next_action_hint":"Do not add more binds. The bind/apply path works. Next inspect GFx visibility/alpha/transform parent chain for display_obj=0x7fff829ef200 and ProfileList/ItemList/ItemList/ItemList, or hook later visibility/render updates; failure is likely parent/container hidden/blank or profile texture source empty at that stage."}}
{"run":623,"commit":"978974d","metric":0,"metrics":{"readiness_gate_failures":0,"target_constants_remaining":0,"helpers_missing":0,"fixed_wait_predicates":0,"autoload_static_failures":0,"asset_chain_failures":0,"dll_patch_failures":0,"native_continue_failures":0,"field58_gate_failures":0,"direct_shortcut_failures":0,"input_path_failures":0,"runtime_proof_failures":0,"runtime_mode_failures":0,"eula_popup_failures":0,"save_data_popup_failures":0,"messagebox_dialog_failures":0,"server_status_failures":0,"title_cover_failures":2,"title_cover_penalty":1800,"native_trace_blockers":0,"native_trace_hits_total":74,"native_trace_unique_breakpoints":11,"false_positives":1,"offline_face_source_ready":1,"removed path_cpu_texture_bridge_ready":0,"offline_face_texture_runtime_drawn":0,"stylized_facedata_pixel_oracle":0,"real_portrait_asset_candidates":0,"profile_placeholder_assets_only":1},"status":"discard","description":"Static RE mapped Scaleform bind replacement fields; next oracle should log dimensions/type, not more binds.","timestamp":1782663977937,"segment":2,"confidence":null,"asi":{"hypothesis":"Static-first map the GFx lookup/replacement helpers around FUN_140d7be60 after #622 proved successful bind-apply but a blank panel, so the next runtime hook can distinguish hidden parent/container from empty SYSTEX source without adding more binds.","observed_evidence":"Decompiled/disassembled FUN_14116ce70 tail-entry, FUN_141148050, FUN_140d60950, and FUN_140d7be60. The lookup vfunc resolves a named display object through root+0x70 movie tables. FUN_141148050 writes/allocates transform matrix at target+0x20. FUN_140d60950 releases old display_obj+0x18 child, AddRefs the target, releases display_obj+0x48, stores target at display_obj+0x48, and resets display_obj+0x18 to display_obj+0x20. Saved memory scaleform-bind-next-oracle-dimensions-not-more-binds-2026-06-28. Gate output /tmp/pi-experiment-eb1531bc440904bb.log stayed autoload_re_score=0.","rollback_reason":"Primary metric stayed 0; this was static RE only and produced no visible loaded-character portrait surface/oracle.","next_action_hint":"Next runtime hook should record target byte +0x70, target width/height from +0x2c/+0x30 or +0x84/+0x88, old child vtable/type/width/height, display_obj vtable/type, and relevant root/container fields. Do not add more binds."}}
{"run":624,"commit":"978974d","metric":0,"metrics":{"readiness_gate_failures":0,"target_constants_remaining":0,"helpers_missing":0,"fixed_wait_predicates":0,"autoload_static_failures":0,"asset_chain_failures":0,"dll_patch_failures":0,"native_continue_failures":0,"field58_gate_failures":0,"direct_shortcut_failures":0,"input_path_failures":0,"runtime_proof_failures":0,"runtime_mode_failures":0,"eula_popup_failures":0,"save_data_popup_failures":0,"messagebox_dialog_failures":0,"server_status_failures":0,"title_cover_failures":2,"title_cover_penalty":1800,"native_trace_blockers":0,"native_trace_hits_total":74,"native_trace_unique_breakpoints":11,"false_positives":1,"offline_face_source_ready":1,"removed path_cpu_texture_bridge_ready":0,"offline_face_texture_runtime_drawn":0,"stylized_facedata_pixel_oracle":0,"real_portrait_asset_candidates":0,"profile_placeholder_assets_only":1},"status":"discard","description":"Static correction: ProfileSelect remains diagnostic-only; product path must use the underlying portrait mechanism, not hide/polish ProfileSelect.","timestamp":1782664120589,"segment":2,"confidence":null,"asi":{"hypothesis":"Incorporate user correction: ProfileSelect was only a diagnostic surface for learning the portrait pipeline. Reframe the current static asset finding away from hiding/polishing ProfileSelect chrome and toward extracting the underlying portrait render mechanism for a separate title-safe surface.","observed_evidence":"User explicitly corrected that ProfileSelect was chosen out of flailing to learn how the game uses it, if at all, to render character portraits. Persisted memory profileselect-is-diagnostic-not-product-surface-2026-06-28. Prior byte-symbol scan still shows ProfileSelect contains portrait/bind symbols and chrome/list symbols, but that should be treated as diagnostic evidence for the portrait pipeline only. Gate output /tmp/pi-experiment-72743c66eb1ce6b0.log passed with autoload_re_score=0.","rollback_reason":"Primary metric stayed 0; this iteration produced no visible loaded-character portrait product surface and intentionally does not keep any ProfileSelect productization path.","next_action_hint":"Stop framing ProfileSelect as the cover surface. Use it only to identify the portrait source/bind/display mechanism, then build or locate a native/non-native title-safe surface that renders the loaded-character portrait without showing ProfileSelect UI/list/panel."}}
{"run":625,"commit":"978974d","metric":0,"metrics":{"readiness_gate_failures":0,"target_constants_remaining":0,"helpers_missing":0,"fixed_wait_predicates":0,"autoload_static_failures":0,"asset_chain_failures":0,"dll_patch_failures":0,"native_continue_failures":0,"field58_gate_failures":0,"direct_shortcut_failures":0,"input_path_failures":0,"runtime_proof_failures":0,"runtime_mode_failures":0,"eula_popup_failures":0,"save_data_popup_failures":0,"messagebox_dialog_failures":0,"server_status_failures":0,"title_cover_failures":2,"title_cover_penalty":1800,"native_trace_blockers":0,"native_trace_hits_total":74,"native_trace_unique_breakpoints":11,"false_positives":0,"offline_face_source_ready":1,"removed path_cpu_texture_bridge_ready":0,"offline_face_texture_runtime_drawn":0,"stylized_facedata_pixel_oracle":0,"real_portrait_asset_candidates":0,"profile_placeholder_assets_only":1},"status":"keep","description":"invalidated deliberate ProfileSelect replay so it no longer obscures the actual native render surface.","timestamp":1782664569386,"segment":2,"confidence":null,"asi":{"hypothesis":"Keep the source change that stops deliberately building/running the non-vanilla ProfileSelect diagnostic surface while preserving native BeginTitle/PAB hooks, because ProfileSelect was obscuring the actual render surface and is no longer useful as diagnostic or product path.","observed_evidence":"Source diff removes build_profile_select_cover_job from title_native_menu_visual_begin_title_hook and stops spawning install_title_custom_cover_run_hook. Runtime artifact /home/banon/projects/er-effects-rs/target/runtime-probe/product-continue-direct-20260628-093124 measured false_positives=0, oracle_title_custom_cover_run_any=false, and no ProfileSelect custom/profile cover bound to visible logo/title surface. Gate output /tmp/pi-exp-profile-invalidated-keep.log passed with autoload_re_score=0 and false_positives=0. User confirmed the behavior worked as expected and should be kept.","rollback_reason":"","next_action_hint":"With ProfileSelect invalidated, verify the conditional TitleBack/logo-surface hypothesis next: current telemetry shows TitleBackViewParts/05_001_Title_Logo is actively forced hidden (hide_calls=176, visibility=false). Test whether leaving that native logo surface visible, without ProfileSelect replay, exposes the actual intended portrait-host surface or simply restores the native logo."}}
