{"run":289,"commit":"2c76d2f","metric":0,"metrics":{"readiness_gate_failures":0,"target_constants_remaining":0,"helpers_missing":0,"fixed_wait_predicates":0,"autoload_static_failures":0,"asset_chain_failures":0,"dll_patch_failures":0,"native_continue_failures":0,"field58_gate_failures":0,"direct_shortcut_failures":0,"input_path_failures":0,"runtime_proof_failures":1,"runtime_mode_failures":0,"eula_popup_failures":0,"save_data_popup_failures":0,"messagebox_dialog_failures":0,"server_status_failures":0,"title_cover_failures":4,"title_cover_penalty":200,"native_trace_blockers":0,"native_trace_hits_total":74,"native_trace_unique_breakpoints":11,"false_positives":0,"runtime_timeout_failures":0,"runtime_title_visual_suppressed_builds":0,"runtime_custom_cover_builds":0,"runtime_simulated_button_presses_total":0},"status":"crash","description":"TitleBackViewParts resource SYSTEX remap exits before readiness","timestamp":1782453118928,"segment":0,"confidence":null,"asi":{"hypothesis":"Binding SYSTEX through the correct TitleBackViewParts MenuResource owner (logo+0x8) after profile refresh should avoid the previous wrong-context remap and produce a visible profile cover without ProfileSelect canvas.","error_details":"Runtime artifact target/runtime-probe/product-continue-direct-20260625-225103 failed with reason process_exited_before_ready. Telemetry: logo_remap_calls=0, profile_cover_bound_to_logo_surface=false, profile_render_refresh_calls=0, logo_profile_summary_ready=true, char_name empty, player_present=false, simulated_input=0, msgboxes=0. The corrected bind did not fire; the branch regressed early boot/readiness before reaching refresh/remap.","rollback_reason":"Runtime-unsafe branch; restore validated no-canvas Banon-load state. Static finding remains useful: if a future remap is attempted, the likely owner for 05_001_Title_Logo is TitleBackViewParts+0x8, not TitleTopDialog+0x3b8.","next_action_hint":"Stop product-tick remap attempts. Next pursue a passive diagnostic hook on native FUN_1407452c0/FUN_140749290 to observe valid owner/resource mappings at runtime without adding new calls, or build a custom Scaleform asset offline."}}
{"run":290,"commit":"086812d","metric":1320,"metrics":{"readiness_gate_failures":0,"target_constants_remaining":0,"helpers_missing":0,"fixed_wait_predicates":0,"autoload_static_failures":0,"asset_chain_failures":0,"dll_patch_failures":0,"native_continue_failures":0,"field58_gate_failures":0,"direct_shortcut_failures":0,"input_path_failures":0,"runtime_proof_failures":1,"runtime_mode_failures":0,"eula_popup_failures":0,"save_data_popup_failures":0,"messagebox_dialog_failures":0,"server_status_failures":0,"title_cover_failures":4,"title_cover_penalty":200,"native_trace_blockers":0,"native_trace_hits_total":74,"native_trace_unique_breakpoints":11,"false_positives":0,"runtime_timeout_failures":0,"runtime_title_visual_suppressed_builds":0,"runtime_custom_cover_builds":0,"runtime_simulated_button_presses_total":0},"status":"keep","description":"add passive Scaleform bind observer for SYSTEX owner discovery","timestamp":1782453280581,"segment":0,"confidence":null,"asi":{"hypothesis":"Instead of making product-time SYSTEX bind calls, observe native FUN_1407452c0 image-symbol->texture mappings to learn valid owner/resource contexts for SYSTEX surfaces without perturbing title advance/load.","evidence":"Added passive hook at live 0x1407451c0 that logs native mapping owner, pair, symbol preview, and target preview, increments observer telemetry, then forwards to original. Verified source has no SYSTEX remap calls and no ProfileSelect run install. cargo fmt/cargo xwin build green; static measure 1320 due previous crash artifacts.","next_action_hint":"Run marker-gated runtime. If Banon load remains intact, inspect er-effects-autoload-debug.log for 'observed native Scaleform bind' lines to identify valid owner/resource fields for SYSTEX_Menu_ProfileNN. If passive hook destabilizes, revert hook and rely on static Ghidra/custom asset path."}}
{"run":291,"commit":"15bf401","metric":1420,"metrics":{"readiness_gate_failures":0,"target_constants_remaining":0,"helpers_missing":0,"fixed_wait_predicates":0,"autoload_static_failures":0,"asset_chain_failures":0,"dll_patch_failures":0,"native_continue_failures":0,"field58_gate_failures":0,"direct_shortcut_failures":0,"input_path_failures":0,"runtime_proof_failures":1,"runtime_mode_failures":0,"eula_popup_failures":0,"save_data_popup_failures":0,"messagebox_dialog_failures":0,"server_status_failures":0,"title_cover_failures":2,"title_cover_penalty":100,"native_trace_blockers":0,"native_trace_hits_total":74,"native_trace_unique_breakpoints":11,"false_positives":0,"runtime_timeout_failures":0,"runtime_title_visual_suppressed_builds":0,"runtime_custom_cover_builds":0,"runtime_simulated_button_presses_total":0},"status":"keep","description":"passive Scaleform bind observer preserves Banon load but sees no native binds","timestamp":1782453365955,"segment":0,"confidence":null,"asi":{"hypothesis":"A passive hook on native FUN_1407452c0 can safely observe any native image-symbol/SYSTEX bindings that occur under the restored no-canvas path, revealing valid owner/resource contexts without perturbing load.","evidence":"Runtime artifact target/runtime-probe/product-continue-direct-20260625-225452 passed: ready=true reason=world_stable, oracle_char_name=Banon, expected_save_match=true, native_continue_chain_stage=world_loaded, no_postload_popup=true, simulated_button_presses_total=0, oracle_msgbox_total_builds=0. Observer installed at +145ms but telemetry showed observer_hits=0/systex_hits=0 and no 'observed native Scaleform bind' lines. Thus no native 0x1407451c0 bindings occur on this no-canvas path.","next_action_hint":"Do not expect passive 0x1407451c0 observation to reveal SYSTEX under no-canvas path. Next static target: lower-level CSScaleform texture binding/global texture registry, or build a custom root-reachable Scaleform/GFX surface that references the already-refreshed SYSTEX target."}}
{"run":292,"commit":"ec82fb6","metric":1120,"metrics":{"readiness_gate_failures":0,"target_constants_remaining":0,"helpers_missing":0,"fixed_wait_predicates":0,"autoload_static_failures":0,"asset_chain_failures":0,"dll_patch_failures":0,"native_continue_failures":0,"field58_gate_failures":0,"direct_shortcut_failures":0,"input_path_failures":0,"runtime_proof_failures":1,"runtime_mode_failures":0,"eula_popup_failures":0,"save_data_popup_failures":0,"messagebox_dialog_failures":0,"server_status_failures":0,"title_cover_failures":2,"title_cover_penalty":400,"native_trace_blockers":0,"native_trace_hits_total":74,"native_trace_unique_breakpoints":11,"false_positives":0,"runtime_timeout_failures":0,"runtime_title_visual_suppressed_builds":0,"runtime_custom_cover_builds":0,"runtime_simulated_button_presses_total":0},"status":"keep","description":"penalize missing masquerade character scene as major product failure","timestamp":1782453420967,"segment":0,"confidence":null,"asi":{"hypothesis":"The benchmark was over-scoring no-cover/no-character-masquerade runs. Missing oracle_title_profile_cover_bound_to_logo_surface should be a major product failure so a run that merely hides native title/PAB and loads Banon cannot be treated as the highest score.","evidence":"Changed .auto/measure.sh title_cover_penalty from 50 points per title-cover failure to 200 points per failure, with explicit benchmark rationale. Re-running measure gives autoload_re_score=1120, title_cover_failures=2, title_cover_penalty=400, preserving Banon/runtime evidence metrics but correctly demoting the missing masquerade scene.","next_action_hint":"Next real optimization must create an observable character/masquerade cover scene: static target lower-level CSScaleform texture binding/global texture registry or custom root-reachable GFX surface, not more scoring work or ProfileSelect canvas."}}
{"run":293,"commit":"77c6348","metric":1120,"metrics":{"readiness_gate_failures":0,"target_constants_remaining":0,"helpers_missing":0,"fixed_wait_predicates":0,"autoload_static_failures":0,"asset_chain_failures":0,"dll_patch_failures":0,"native_continue_failures":0,"field58_gate_failures":0,"direct_shortcut_failures":0,"input_path_failures":0,"runtime_proof_failures":1,"runtime_mode_failures":0,"eula_popup_failures":0,"save_data_popup_failures":0,"messagebox_dialog_failures":0,"server_status_failures":0,"title_cover_failures":2,"title_cover_penalty":400,"native_trace_blockers":0,"native_trace_hits_total":74,"native_trace_unique_breakpoints":11,"false_positives":0,"runtime_timeout_failures":0,"runtime_title_visual_suppressed_builds":0,"runtime_custom_cover_builds":0,"runtime_simulated_button_presses_total":0},"status":"keep","description":"bind title logo image to SYSTEX during TitleBackViewParts ctor lifecycle","timestamp":1782453711948,"segment":0,"confidence":null,"asi":{"hypothesis":"The late product-tick SYSTEX remap never fired before early exit. Binding MENU_Title_EldenRing_01 -> SYSTEX_Menu_Profile00 during the native TitleBackViewParts constructor lifecycle should register the texture mapping while the 05_001_Title_Logo MenuResource is definitely initialized, then later profile-render refresh can populate the SYSTEX target.","evidence":"Static RE: TitleBackViewParts ctor calls FUN_140749290(logo+0x8, logo+0x70); FUN_1407452c0 maps a resource/list owner at +0x60 through GLOBAL_CSScaleform. Implemented ctor-time one-shot remap using NativeStaticDlStringPair on logo+0x8, disables forced logo hide after remap, and only reports oracle_title_profile_cover_bound_to_logo_surface when both remap and profile-render refresh have occurred. cargo fmt/cargo xwin build green; static measure unchanged at 1120 until runtime proof updates artifact telemetry.","next_action_hint":"Run marker-gated runtime. Success requires remap_calls>0, profile_render_refresh_calls>0, profile_cover_bound_to_logo_surface=true, Banon/world/zero-input/no-popup intact. If old logo is visible or load regresses, revert and move to custom GFX asset/lower-level texture registry."}}
{"run":294,"commit":"77c6348","metric":0,"metrics":{"readiness_gate_failures":0,"target_constants_remaining":0,"helpers_missing":0,"fixed_wait_predicates":0,"autoload_static_failures":0,"asset_chain_failures":0,"dll_patch_failures":0,"native_continue_failures":0,"field58_gate_failures":0,"direct_shortcut_failures":0,"input_path_failures":0,"runtime_proof_failures":1,"runtime_mode_failures":0,"eula_popup_failures":0,"save_data_popup_failures":0,"messagebox_dialog_failures":0,"server_status_failures":0,"title_cover_failures":2,"title_cover_penalty":400,"native_trace_blockers":0,"native_trace_hits_total":74,"native_trace_unique_breakpoints":11,"false_positives":0,"runtime_timeout_failures":0,"runtime_title_visual_suppressed_builds":0,"runtime_custom_cover_builds":0,"runtime_simulated_button_presses_total":0},"status":"crash","description":"ctor-lifecycle SYSTEX title-logo remap exits before readiness","timestamp":1782453776098,"segment":0,"confidence":null,"asi":{"hypothesis":"Binding MENU_Title_EldenRing_01 -> SYSTEX_Menu_Profile00 during the native TitleBackViewParts constructor lifecycle should register the mapping while the 05_001_Title_Logo MenuResource is initialized, avoiding the late product-tick call that never fired.","error_details":"Runtime artifact target/runtime-probe/product-continue-direct-20260625-230159 failed with reason process_exited_before_ready, native_continue_chain_stage=pre_submit, character_name empty, player_present=false, simulated_button_presses_total=0, msgboxes=0. Debug log shows the native bind did fire once at +16005ms: owner=0x7ffe969d31a0 pair=0x10efc8 symbol='MENU_Title_EldenRing_01' target='SYSTEX_Menu_Profile00', then the process exited before profile refresh/load. Final telemetry did not latch remap counters, likely because the process exited before telemetry flush or the hook/observer statics diverged after early exit.","rollback_reason":"Ctor-time remap perturbs the title/logo resource lifecycle enough to exit before readiness. It is not product-safe and must be reverted.","next_action_hint":"Do not bind the live 05_001_Title_Logo resource to SYSTEX in the title constructor. Use this finding only as proof that the mapping ABI/pair layout works. Next path: build a separate custom root-reachable GFX/surface or find a non-title-logo texture registry path that does not mutate the native logo resource lifecycle."}}
{"run":295,"commit":"b9e0493","metric":1120,"metrics":{"readiness_gate_failures":0,"target_constants_remaining":0,"helpers_missing":0,"fixed_wait_predicates":0,"autoload_static_failures":0,"asset_chain_failures":0,"dll_patch_failures":0,"native_continue_failures":0,"field58_gate_failures":0,"direct_shortcut_failures":0,"input_path_failures":0,"runtime_proof_failures":1,"runtime_mode_failures":0,"eula_popup_failures":0,"save_data_popup_failures":0,"messagebox_dialog_failures":0,"server_status_failures":0,"title_cover_failures":2,"title_cover_penalty":400,"native_trace_blockers":0,"native_trace_hits_total":74,"native_trace_unique_breakpoints":11,"false_positives":0,"runtime_timeout_failures":0,"runtime_title_visual_suppressed_builds":0,"runtime_custom_cover_builds":0,"runtime_simulated_button_presses_total":0},"status":"keep","description":"restore no-remap Banon load after rejected ctor-remap visual branch","timestamp":1782453994195,"segment":0,"confidence":null,"asi":{"hypothesis":"After the ctor-time SYSTEX remap crashed before readiness, restore the validated no-remap source and refresh the latest runtime proof so stale crash artifacts do not define the current branch.","evidence":"Marker-gated runtime passed in 32.9s with autoload_re_score=1120, title_cover_failures=2, title_cover_penalty=400, zero simulated input, zero messagebox/server/legal/save-data popup failures. User-provided screenshot visually confirms the current feature state is only a dark/hidden-title cover, not the desired character/masquerade scene.","next_action_hint":"Do not count the dark hidden-title screen as the visual feature. Next implementation must add a separate visible masquerade/character surface or custom root-reachable GFX asset; do not retry live 05_001_Title_Logo ctor remap or ProfileSelect canvas.","rollback_reason":"Keeping a non-improving metric is intentional here because discard would restore the runtime-crashing ctor-remap source."}}
{"run":296,"commit":"f0310dc","metric":1120,"metrics":{"readiness_gate_failures":0,"target_constants_remaining":0,"helpers_missing":0,"fixed_wait_predicates":0,"autoload_static_failures":0,"asset_chain_failures":0,"dll_patch_failures":0,"native_continue_failures":0,"field58_gate_failures":0,"direct_shortcut_failures":0,"input_path_failures":0,"runtime_proof_failures":1,"runtime_mode_failures":0,"eula_popup_failures":0,"save_data_popup_failures":0,"messagebox_dialog_failures":0,"server_status_failures":0,"title_cover_failures":2,"title_cover_penalty":400,"native_trace_blockers":0,"native_trace_hits_total":74,"native_trace_unique_breakpoints":11,"false_positives":0,"runtime_timeout_failures":0,"runtime_title_visual_suppressed_builds":0,"runtime_custom_cover_builds":0,"runtime_simulated_button_presses_total":0},"status":"keep","description":"add observe-only CSNowLoadingHelper surface telemetry","timestamp":1782454210814,"segment":0,"confidence":null,"asi":{"hypothesis":"The visible black/progress-bar screen in the user screenshot is the native now-loading surface, not a title logo surface. Observe-only hooks on CSNowLoadingHelperImp ctor/update can identify replaceTexInfo/requestedReplaceTexInfo/menu index state for a safer custom loading/masquerade surface without mutating title resources.","evidence":"Static RE: CSNowLoadingHelperImp ctor at 0x1402a20e0 installs update task function 0x1402a2c40 and owns currentMenuLoadIndex at +0xd0, replaceTexInfo at +0xd8, requestedReplaceTexInfo at +0xe0, request/load flags near +0xec. Added observe-only hooks and telemetry oracle_title_now_loading_helper_*; cargo fmt/cargo xwin build green; static measure remains 1120 until runtime proof observes fields.","next_action_hint":"Run marker-gated runtime. If hooks observe now-loading update hits while Banon load remains intact, use replaceTexInfo/requestedReplaceTexInfo as the next custom cover insertion point. If no hits, target CSFakeLoadingScreenImp/CSDrawStep instead."}}
{"run":297,"commit":"f0310dc","metric":0,"metrics":{"readiness_gate_failures":0,"target_constants_remaining":0,"helpers_missing":0,"fixed_wait_predicates":0,"autoload_static_failures":0,"asset_chain_failures":0,"dll_patch_failures":0,"native_continue_failures":0,"field58_gate_failures":0,"direct_shortcut_failures":0,"input_path_failures":0,"runtime_proof_failures":1,"runtime_mode_failures":0,"eula_popup_failures":0,"save_data_popup_failures":0,"messagebox_dialog_failures":0,"server_status_failures":0,"title_cover_failures":2,"title_cover_penalty":400,"native_trace_blockers":0,"native_trace_hits_total":74,"native_trace_unique_breakpoints":11,"false_positives":0,"runtime_timeout_failures":0,"runtime_title_visual_suppressed_builds":0,"runtime_custom_cover_builds":0,"runtime_simulated_button_presses_total":0},"status":"crash","description":"observe-only CSNowLoadingHelper hook exits before readiness","timestamp":1782454260878,"segment":0,"confidence":null,"asi":{"hypothesis":"Observe-only hooks on CSNowLoadingHelperImp ctor/update can identify replaceTexInfo/requestedReplaceTexInfo state for the native black/progress loading surface without mutating title resources.","error_details":"Runtime artifact target/runtime-probe/product-continue-direct-20260625-231020 failed with reason process_exited_before_ready. Hook installed at +156ms, but ctor_hits=0 and update_hits=0; native_continue_chain_stage=pre_submit, character empty, player_present=false, zero simulated input, zero messagebox. Early exit occurred after hook installation and before helper activity, so even observe-only patching of these functions is not product-safe under this launch path.","rollback_reason":"The CSNowLoadingHelper observe hook destabilized boot before the target helper ran. Revert this branch and do not hook 0x1402a20e0/0x1402a2c40 at startup as product instrumentation.","next_action_hint":"Use static analysis or a later/conditional hook installed after the title accept/load transition, not attach-time hooks. Alternative: inspect CSFakeLoadingScreenImp/CSDrawStep statically or build a separate custom surface outside these early loading-helper hooks."}}
{"run":298,"commit":"652edea","metric":720,"metrics":{"readiness_gate_failures":0,"target_constants_remaining":0,"helpers_missing":0,"fixed_wait_predicates":0,"autoload_static_failures":0,"asset_chain_failures":0,"dll_patch_failures":0,"native_continue_failures":0,"field58_gate_failures":0,"direct_shortcut_failures":0,"input_path_failures":0,"runtime_proof_failures":1,"runtime_mode_failures":0,"eula_popup_failures":0,"save_data_popup_failures":0,"messagebox_dialog_failures":0,"server_status_failures":0,"title_cover_failures":4,"title_cover_penalty":800,"native_trace_blockers":0,"native_trace_hits_total":74,"native_trace_unique_breakpoints":11,"false_positives":0,"runtime_timeout_failures":0,"runtime_title_visual_suppressed_builds":0,"runtime_custom_cover_builds":0,"runtime_simulated_button_presses_total":0},"status":"keep","description":"delay CSNowLoadingHelper observer until title accept fires","timestamp":1782454371001,"segment":0,"confidence":null,"asi":{"hypothesis":"Attach-time CSNowLoadingHelper detours exited before readiness because they touched the helper too early. Delaying installation until TITLE_ACCEPT_BYTE_GATE_FIRED should preserve the title path while still observing the native black/progress loading surface before world load.","evidence":"Removed START_NOW_LOADING_HELPER_OBSERVER attach-time thread from lib.rs and added a product_autoload-gated install only after TITLE_ACCEPT_BYTE_GATE_FIRED. cargo fmt/cargo xwin build passed. Static measure is 720 only because latest runtime artifact is the rejected #297 crash with duplicated missing-cover penalties; runtime marker is required to evaluate this source.","next_action_hint":"Run marker-gated runtime. If delayed install passes and now_loading update_hits>0, inspect replaceTexInfo/requestedReplaceTexInfo fields as a safer custom cover insertion point. If it exits before ready again, discard and do not hook CSNowLoadingHelper even after accept."}}
