{"run":36,"commit":"2100051","metric":0,"metrics":{"readiness_gate_failures":0,"target_constants_remaining":0,"helpers_missing":0,"fixed_wait_predicates":0,"autoload_static_failures":0,"asset_chain_failures":0,"dll_patch_failures":0,"native_continue_failures":0,"field58_gate_failures":0,"direct_shortcut_failures":0,"input_path_failures":0,"runtime_proof_failures":1,"runtime_mode_failures":0,"eula_popup_failures":0,"save_data_popup_failures":0,"messagebox_dialog_failures":0,"server_status_failures":0,"native_trace_blockers":0,"native_trace_hits_total":74,"native_trace_unique_breakpoints":11,"false_positives":0,"title_cover_failures":1,"title_cover_penalty":50,"runtime_timeout_failures":1,"runtime_title_visual_suppressed_builds":1,"runtime_custom_cover_builds":0,"runtime_simulated_button_presses_total":0},"status":"crash","description":"full save-stream reader oracle confirmed native full deserializer runs but preserves empty profile summary","timestamp":1782359268018,"segment":0,"confidence":4.64,"asi":{"hypothesis":"Hook both the parent full save-stream reader at deobf 0x140258410 and the ProfileSummary subobject deserializer at deobf 0x1402621b0, while keeping PartA-only title suppression, to determine whether the profile summary is already empty before the subobject read or is being cleared after it.","rollback_reason":"Runtime timed out before native Continue submit, so primary metric is 0/crash. Static score for this diagnostic source is 1470 because PartB cover is intentionally absent. Artifact target/runtime-probe/product-continue-direct-20260624-204602 shows the hooks installed and fired twice: full deserializer ret=1 with stream=0x10fb50 arg2=0x1, profile_before=profile_after=0x7fffa0b56c80, active_before=active_after=0x0, caller_rva=0x67b633; the nested ProfileSummary hook ret=1 with active_qword=0x0 and empty slot0 name. Thus the parent reader succeeds but the stream being deserialized contains an empty profile summary; it is not a post-read clear.","next_action_hint":"Static RE caller 0x14067b633 (inside b80/current-slot path) and the stream source for stream=0x10fb50. The native full reader is succeeding on an empty/placeholder stream; next find which file/container/resource populated that stream, likely upstream of 0x14067b633 and the save session/file-load helpers, rather than tweaking title-cover or companion files.","artifact_dir":"/home/banon/projects/er-effects-rs/target/runtime-probe/product-continue-direct-20260624-204602","observed_runtime_oracles":{"save_stream_oracle_log_lines":3,"full_deserialize_hits":2,"full_deserialize_ret":1,"full_deserialize_stream":"0x10fb50","full_deserialize_arg2":"0x1","full_deserialize_caller_rva":"0x67b633","full_deserialize_active_before":"0x0","full_deserialize_active_after":"0x0","profile_summary_deserialize_hits":2,"profile_summary_active_qword":"0x0","profile_summary_slot0_name":"","profile_summary_slot0_empty_like":true,"oracle_title_native_menu_visual_suppressed_builds":1,"oracle_title_custom_cover_profile_select_builds":0,"profile_slot_active_bytes_qword":"0x0","oracle_player_present":true,"oracle_char_name":"_","oracle_msgbox_total_builds":0,"oracle_policy_window_total_builds":0,"simulated_button_presses_total":0,"native_submit_entered":false},"build":"cargo xwin build --release --target x86_64-pc-windows-msvc succeeded before runtime; deployed DLL contained PartA-only hook and save-stream/profile-summary oracles.","cleanup":"Probe cleanup left no eldenring.exe or start_protected_game.exe process running."}}
{"run":37,"commit":"2100051","metric":0,"metrics":{"readiness_gate_failures":0,"target_constants_remaining":0,"helpers_missing":0,"fixed_wait_predicates":0,"autoload_static_failures":0,"asset_chain_failures":0,"dll_patch_failures":0,"native_continue_failures":0,"field58_gate_failures":0,"direct_shortcut_failures":0,"input_path_failures":0,"runtime_proof_failures":1,"runtime_mode_failures":0,"eula_popup_failures":0,"save_data_popup_failures":0,"messagebox_dialog_failures":0,"server_status_failures":0,"native_trace_blockers":0,"native_trace_hits_total":74,"native_trace_unique_breakpoints":11,"false_positives":0,"title_cover_failures":1,"title_cover_penalty":50,"runtime_timeout_failures":1,"runtime_title_visual_suppressed_builds":1,"runtime_custom_cover_builds":0,"runtime_simulated_button_presses_total":0},"status":"crash","description":"profile-summary cache repair from staged save populated Banon but happened too late for title accept","timestamp":1782359695678,"segment":0,"confidence":4.64,"asi":{"hypothesis":"If the native full save-stream/ProfileSummary reader succeeds on an empty profile summary, minimally repair only the title profile-summary cache from the staged ER0000.sl2 UD10 metadata (active bytes, name, level/map) and still let native Continue/load do the actual character load; do not call direct load/deserializer/confirm paths.","rollback_reason":"Runtime still timed out before native Continue submit, so primary metric is 0/crash and static score is only 1470 because PartB cover is intentionally absent. Artifact target/runtime-probe/product-continue-direct-20260624-205312 shows the repair worked at the profile-summary cache level: active_qword became 0x1 and slot0_name='Banon', slot0_len=5, slot0_empty_like=false from the staged save. However the repair happened at +24.565s, after the profile-active watchdog/title gate had already observed zero active slots at +13.454s, and no title-accept/native-submit/continue_load ever fired (oracle_native_submit_hits=0, native_continue_chain_stage=pre_submit).","next_action_hint":"Move the profile-summary cache population earlier than the title accept gate, e.g. initialize GameDataMan+profileSummary from staged ER0000.sl2 as soon as the profile object appears in the recurring game-task tick, before the PAB/title menu accept window. Then rerun with PartA-only title suppression; if native submit starts, verify downstream continue_load/deser/confirm/world. Keep evaluating whether this cache repair is acceptable product semantics versus requiring the native save-summary source path.","artifact_dir":"/home/banon/projects/er-effects-rs/target/runtime-probe/product-continue-direct-20260624-205312","observed_runtime_oracles":{"profile_summary_repair":"name='Banon' level=150 map=0xe000000 active0=1","profile_slot_active_bytes_qword":"0x1","profile_summary_slot0_empty_like":false,"profile_summary_repair_time_ms":24565,"watchdog_zero_active_time_ms":13454,"oracle_title_native_menu_visual_suppressed_builds":1,"oracle_title_custom_cover_profile_select_builds":0,"oracle_player_present":true,"oracle_char_name":"_","oracle_native_submit_hits":0,"native_submit_entered":false,"oracle_msgbox_total_builds":0,"oracle_policy_window_total_builds":0,"simulated_button_presses_total":0},"build":"cargo xwin build --release --target x86_64-pc-windows-msvc succeeded before runtime; deployed DLL contained PartA-only hook and profile-summary cache repair hook.","cleanup":"Probe cleanup left no eldenring.exe or start_protected_game.exe process running."}}
{"run":38,"commit":"2100051","metric":0,"metrics":{"readiness_gate_failures":0,"target_constants_remaining":0,"helpers_missing":0,"fixed_wait_predicates":0,"autoload_static_failures":0,"asset_chain_failures":0,"dll_patch_failures":0,"native_continue_failures":0,"field58_gate_failures":0,"direct_shortcut_failures":0,"input_path_failures":0,"runtime_proof_failures":1,"runtime_mode_failures":0,"eula_popup_failures":0,"save_data_popup_failures":0,"messagebox_dialog_failures":0,"server_status_failures":0,"native_trace_blockers":0,"native_trace_hits_total":74,"native_trace_unique_breakpoints":11,"false_positives":0,"title_cover_failures":1,"title_cover_penalty":50,"runtime_timeout_failures":1,"runtime_title_visual_suppressed_builds":1,"runtime_custom_cover_builds":0,"runtime_simulated_button_presses_total":0},"status":"crash","description":"early profile-summary cache repair removed zero-active watchdog but still did not trigger title accept","timestamp":1782360021964,"segment":0,"confidence":4.64,"asi":{"hypothesis":"Populate GameDataMan+profileSummary from the staged ER0000.sl2 UD10 metadata as soon as the profile object appears in the recurring game task, before the title accept gate, while keeping PartA-only native-title suppression and avoiding any direct load/deserializer/confirm call.","rollback_reason":"Runtime still timed out before native Continue submit, so primary metric is 0/crash and static score is 1470 because PartB cover is absent. Artifact target/runtime-probe/product-continue-direct-20260624-205752 shows the early repair worked at +10.550s (tick=54), set active_after=0x1 and Banon slot0 metadata, and eliminated the earlier zero-active watchdog. However no title-accept, native-fullread, continue_load, or native submit occurred (oracle_native_submit_hits=0, native_continue_chain_stage=pre_submit), so profile-summary readiness alone is not sufficient to open/submit Continue under PartA-only null title suppression.","next_action_hint":"Find the remaining title menu/open/accept gate after profile summary is non-empty. Static/runtime focus should shift from save-summary population to why title-accept/native submit does not fire despite profile_slot_active_bytes_qword=0x1: inspect product_core_autoload_tick/title open-menu predicate, PAB-to-title menu transition, and whether PartA null out-slot prevents the main-menu row/action registration. Avoid ProfileSelect out-slot replacement; it is already falsified.","artifact_dir":"/home/banon/projects/er-effects-rs/target/runtime-probe/product-continue-direct-20260624-205752","observed_runtime_oracles":{"profile_summary_repair_time_ms":10550,"profile_summary_repair_tick":54,"profile_summary_active_after":"0x1","profile_summary_name":"Banon","profile_summary_level":150,"profile_summary_map":"0xe000000","zero_active_watchdog_hits":0,"profile_slot_active_bytes_qword":"0x1","oracle_title_native_menu_visual_suppressed_builds":1,"oracle_title_custom_cover_profile_select_builds":0,"oracle_player_present":true,"oracle_char_name":"_","oracle_native_submit_hits":0,"native_submit_entered":false,"oracle_msgbox_total_builds":0,"oracle_policy_window_total_builds":0,"simulated_button_presses_total":0},"build":"cargo xwin build --release --target x86_64-pc-windows-msvc succeeded before runtime; deployed DLL contained PartA-only hook and early profile-summary repair tick.","cleanup":"Probe cleanup left no eldenring.exe or start_protected_game.exe process running."}}
{"run":39,"commit":"2100051","metric":0,"metrics":{"readiness_gate_failures":0,"target_constants_remaining":0,"helpers_missing":0,"fixed_wait_predicates":0,"autoload_static_failures":0,"asset_chain_failures":0,"dll_patch_failures":0,"native_continue_failures":0,"field58_gate_failures":0,"direct_shortcut_failures":0,"input_path_failures":0,"runtime_proof_failures":1,"runtime_mode_failures":0,"eula_popup_failures":0,"save_data_popup_failures":0,"messagebox_dialog_failures":0,"server_status_failures":0,"native_trace_blockers":0,"native_trace_hits_total":74,"native_trace_unique_breakpoints":11,"false_positives":0,"title_cover_failures":1,"title_cover_penalty":50,"runtime_timeout_failures":1,"runtime_title_visual_suppressed_builds":1,"runtime_custom_cover_builds":0,"runtime_simulated_button_presses_total":0},"status":"crash","description":"direct_menu_load product-core armed with early profile-summary repair but PartA null title job blocks title dialog readiness","timestamp":1782360512226,"segment":0,"confidence":4.64,"asi":{"hypothesis":"Arm the direct_menu_load/product-core path explicitly (experimental env gate + method), keep PartA-only native title visual suppression, and populate the title profile-summary cache early from staged Banon metadata so product_core_autoload_tick can open/submit native Continue without input.","rollback_reason":"Runtime timed out before native Continue submit, so primary metric is 0/crash and static score is 1470 because PartB cover is absent. The experiment successfully armed product_core (product_autoload_armed=true, product_core_autoload_ticks=181) and repaired the profile summary early at +10.304s. It still blocked on product_core readiness: product_core_ready_blocker=title_owner_state, state progressed 10/10 then 6/6, title_dialog pointer was invalid/sentinel-like (0xffffffff00001788), press_start_proxy=0xffffffff00002300, press_start_vt=0, press_start_ctx=0. No title_accept/native_submit/continue_load fired.","next_action_hint":"Stop nulling the BeginTitle out-slot as the PartA product mechanism. It suppresses the visual but destroys/invalidates the title dialog/PressStart state needed by product_core. Static RE should find a render-only suppression point below the 05_000_Title MenuWindowJob creation (e.g. job update/render/visible flag/Scaleform movie draw) so the native title job/dialog exists but its native visual is hidden. Alternatively call original wrapper and immediately disable only rendering while preserving out_slot/job ownership; do not return ProfileSelect in the out-slot.","artifact_dir":"/home/banon/projects/er-effects-rs/target/runtime-probe/product-continue-direct-20260624-210637","observed_runtime_oracles":{"product_autoload_armed":true,"product_core_autoload_ticks":181,"product_core_ready_blocker":"title_owner_state","product_core_last_owner":"0x7ffffdb7f900","product_core_last_phase":0,"product_core_last_title_dialog":"0xffffffff00001788","product_core_last_press_start_proxy":"0xffffffff00002300","product_core_last_press_start_vt":"0x0","product_core_last_press_start_context":"0x0","profile_summary_repair_time_ms":10304,"profile_slot_active_bytes_qword":"0x1","oracle_title_native_menu_visual_suppressed_builds":1,"oracle_title_custom_cover_profile_select_builds":0,"oracle_player_present":true,"oracle_char_name":"_","oracle_native_submit_hits":0,"native_submit_entered":false,"oracle_msgbox_total_builds":0,"oracle_policy_window_total_builds":0,"simulated_button_presses_total":0},"build":"bash -n scripts/run-product-continue-direct-probe.sh and cargo xwin build --release --target x86_64-pc-windows-msvc succeeded before runtime; deployed DLL contained PartA-only hook, early profile-summary repair, and direct_menu_load env export in the probe script.","cleanup":"Probe cleanup left no eldenring.exe or start_protected_game.exe process running."}}
{"run":40,"commit":"2100051","metric":0,"metrics":{"readiness_gate_failures":0,"target_constants_remaining":0,"helpers_missing":0,"fixed_wait_predicates":0,"autoload_static_failures":0,"asset_chain_failures":0,"dll_patch_failures":0,"native_continue_failures":0,"field58_gate_failures":0,"direct_shortcut_failures":0,"input_path_failures":0,"runtime_proof_failures":1,"runtime_mode_failures":0,"eula_popup_failures":0,"save_data_popup_failures":0,"messagebox_dialog_failures":0,"server_status_failures":0,"title_cover_failures":1,"title_cover_penalty":50,"native_trace_blockers":0,"native_trace_hits_total":74,"native_trace_unique_breakpoints":11,"false_positives":0,"runtime_timeout_failures":1,"runtime_title_visual_suppressed_builds":1,"runtime_custom_cover_builds":0,"runtime_simulated_button_presses_total":0},"status":"crash","description":"preserved native title MenuWindowJob with render-bit suppression and early profile-summary repair, but product core only found idle/non-accept Continue job","timestamp":1782361284894,"segment":0,"confidence":4.64,"asi":{"hypothesis":"Returning null from BeginTitle's out-slot breaks the native title dialog, so preserve the real 05_000_Title MenuWindowJob, hide only its CSMenuMan draw bit after MenuWindowJob::Run/FadeIn, arm direct_menu_load product-core, and repair the profile-summary cache early from the staged Banon save. This should retain title dialog/PressStart ownership while suppressing native visual render and letting native Continue submit proceed without input.","rollback_reason":"Runtime timed out before native Continue submit. The preserved-job path fixed the previous title-dialog invalid/sentinel problem: product_core_ready_successes=516, title_dialog=0x7ffe969d3d40, press_start_proxy/vtable were valid, profile_slot_active_bytes_qword=0x1, and no MessageBox/policy/input occurred. However product_core only found/rejected the MenuWindowJob item at 0x7ffe9e52c000 with accept_predicate=0x1407add70 (constant false idle predicate) 516 times; oracle_native_submit_hits stayed 0 and native_continue_chain_stage stayed pre_submit. The render-bit hook installed but did not clear the draw bit because the actual caller_rva observed was 0x7ad530, not the gated 0x7ad52b, so runtime title_render_suppressed_windows=0. Static score was 1470 because Part B is absent and runtime proof still fails.","next_action_hint":"Keep the preserved native title job approach; it restores valid title dialog/PressStart state and is better than nulling the out-slot. Next iteration should correct the render-bit callsite gate from 0x7ad52b to observed live return/caller 0x7ad530 if still using draw-bit suppression, but the main blocker is semantic Continue action discovery: product_core is scanning/latching the idle MenuWindowJob itself, not the accept-ready Continue member/action. Static RE the native TitleTopDialog action registration / registry around 0x1407ab370 and 0x1407a6c00, or add a read-only registry observer that latches inserted MenuMemberFuncJob nodes with callback 0x14082bac0/result-chain provenance. Do not go back to ProfileSelect out-slot replacement or null out-slot suppression.","artifact_dir":"/home/banon/projects/er-effects-rs/target/runtime-probe/product-continue-direct-20260624-211902","observed_runtime_oracles":{"ready":false,"reason":"timeout_seconds_budget_exhausted","product_autoload_armed":true,"product_core_autoload_ticks":646,"product_core_ready_blocker":"ready","product_core_ready_successes":516,"product_core_ready_blocks":130,"profile_slot_active_bytes_qword":"0x1","oracle_title_native_menu_visual_suppressed_builds":1,"oracle_title_native_menu_visual_render_suppress_installed":true,"oracle_title_native_menu_visual_render_suppressed_windows":0,"oracle_title_native_menu_visual_render_last_caller_rva":"0x7ad530","oracle_title_custom_cover_profile_select_builds":0,"oracle_native_submit_hits":0,"native_submit_entered":false,"native_result_chain_ready":false,"oracle_continue_load_hits":null,"oracle_player_present":false,"oracle_char_name":"","expected_save_match":true,"expected_animation_match":false,"oracle_msgbox_total_builds":0,"oracle_policy_window_total_builds":0,"simulated_button_presses_total":0,"constant_false_idle_predicate_rejections":516},"build":"bash -n .auto/measure.sh scripts/run-product-continue-direct-probe.sh scripts/er-readiness-watch.py and cargo xwin build --release --target x86_64-pc-windows-msvc succeeded before runtime.","cleanup":"Probe cleanup left no eldenring.exe or start_protected_game.exe process running."}}
