{"run":530,"commit":"4dc167b","metric":0,"metrics":{"readiness_gate_failures":0,"target_constants_remaining":0,"helpers_missing":0,"fixed_wait_predicates":0,"autoload_static_failures":0,"asset_chain_failures":0,"dll_patch_failures":0,"native_continue_failures":0,"field58_gate_failures":0,"direct_shortcut_failures":0,"input_path_failures":0,"runtime_proof_failures":0,"runtime_mode_failures":0,"eula_popup_failures":0,"save_data_popup_failures":0,"messagebox_dialog_failures":0,"server_status_failures":0,"title_cover_failures":2,"title_cover_penalty":1800,"native_trace_blockers":0,"native_trace_hits_total":74,"native_trace_unique_breakpoints":11,"false_positives":0,"offline_face_source_ready":1,"removed path_cpu_texture_bridge_ready":0,"offline_face_texture_runtime_drawn":0,"stylized_facedata_pixel_oracle":0,"real_portrait_asset_candidates":0,"profile_placeholder_assets_only":1},"status":"discard","description":"Static RE identifies Scaleform FileOpener seam for memory-backed custom view","timestamp":1782615198667,"segment":2,"confidence":null,"asi":{"hypothesis":"Continue RE below FUN_140d7ac70 into the Scaleform file/resource opener to verify whether a DLL can supply memory-backed GFX bytes by filename for a custom full-screen portrait+stats view, instead of trusting memory or assuming an in-app builder library exists.","static_finding":"CSScaleform load path is filename/resource-cache based at the game layer: CSScaleformImp load 0x140d6a990 -> CSScaleformSystem 0x140d786e0. Filename canonicalizer FUN_140d7b8b0 probes menu:/Win/%s.gfx then menu:/%s.gfx via FD4FilePathBase + DLFileOperatorContainer; preload/register path FUN_140d774b0 calls CSFileImp::make_gfx_file_cap for that resolved path. Deeper GFx loader path FUN_14112b150 -> FUN_141163c80 -> FUN_141163e20 opens bytes through a Scaleform FileOpener seam: FUN_1411ceda0 checks *(loader+0x10)+0x10 and calls that FileOpener vfunc +0x18 with filename, emitting 'FileOpener not installed' if absent; then FUN_141164cb0 detects file format and normal SWF/GFX parser/binder continues. This makes a memory-backed custom view plausibly a FileOpener/File provider hook, not necessarily an in-app GFX builder. It is not yet implementation proof because the concrete CSScaleformFileOpener vtable and File object interface are not mapped.","memory_recorded":"bd remember scaleform-fileopener-memory-backed-seam-2026-06-27","ideas_updated":".auto/ideas.md appended with Scaleform FileOpener memory-backed seam path","validation":"Beads memory precheck for Scaleform/FileOpener terms returned no prior records; Ghidra decompile of 0x140d6fd30, 0x140d79f90, 0x140d71a50, 0x140d71a90, 0x140d724b0, 0x140d71030, 0x14112b150, 0x141163c80, 0x141163e20, 0x1411ceda0, 0x140d7b8b0, 0x140d774b0, 0x1401f2380, 0x140212e50; run_experiment ./.auto/measure.sh without runtime trigger. bd auto-export briefly saw .git/index.lock, but follow-up read-only check found the lock already gone and no matching git/bd process.","rollback_reason":"Primary metric stayed 0; this was static RE triage and did not implement a visible portrait-cover surface or oracle.","next_action_hint":"Map the concrete CS::CSScaleformFileOpener vtable/open implementation and the File interface returned by vfunc +0x18. Then decide whether to hook a synthetic menu:/er_effects_portrait_cover.gfx name to an in-memory File, or fall back to registering/packing a custom GFX-compatible asset by name without loose live asset edits."}}
{"run":531,"commit":"4dc167b","metric":0,"metrics":{"readiness_gate_failures":0,"target_constants_remaining":0,"helpers_missing":0,"fixed_wait_predicates":0,"autoload_static_failures":0,"asset_chain_failures":0,"dll_patch_failures":0,"native_continue_failures":0,"field58_gate_failures":0,"direct_shortcut_failures":0,"input_path_failures":0,"runtime_proof_failures":0,"runtime_mode_failures":0,"eula_popup_failures":0,"save_data_popup_failures":0,"messagebox_dialog_failures":0,"server_status_failures":0,"title_cover_failures":2,"title_cover_penalty":1800,"native_trace_blockers":0,"native_trace_hits_total":74,"native_trace_unique_breakpoints":11,"false_positives":0,"offline_face_source_ready":1,"removed path_cpu_texture_bridge_ready":0,"offline_face_texture_runtime_drawn":0,"stylized_facedata_pixel_oracle":0,"real_portrait_asset_candidates":0,"profile_placeholder_assets_only":1},"status":"discard","description":"Concrete FileOpener map blocked pending bounded displacement-scan tooling","timestamp":1782615862209,"segment":2,"confidence":null,"asi":{"hypothesis":"Map the concrete CS::CSScaleformFileOpener vtable/open implementation and returned File interface behind the vfunc +0x18 seam, using exact evidence rather than trusting prior memories. User also asked for a Ghidra MCP displacement-scan tool; delegate that side-task rather than blocking the autoresearch loop.","static_finding":"Prior FileOpener seam remains valid, but this pass did not yet map the concrete CSScaleformFileOpener implementation. Headless persistent Ghidra project was locked, so per repo rule the pass used live Ghidra MCP and bounded local deobf scans. Broad MCP byte/xref fanout timed out and was the trigger for the tooling side-task. Small MCP queries confirmed the direct CSScaleformFileOpener RTTI/string hit at 0x143d010f0 has no simple xrefs; FUN_1411ceda0 remains the concrete open seam and calls the installed FileOpener vfunc +0x18. Bounded local raw displacement scans found candidate CSScaleformSystem loader-field references around 0x140d753xx/0x140d766xx/0x140d7a0xx, but no validated writer or vtable yet.","delegation":"Launched async worker subagent b0f081ce-85ff-4c26-ac77-abc779439866 from /home/banon/projects to identify/revise the local Ghidra MCP repo with a bounded displacement-scan tool/API. Parent should not poll just to wait; use status only when needed.","memory_recorded":"bd remember scaleform-fileopener-concrete-map-blocked-by-scan-tooling-2026-06-27","validation":"Beads memory precheck, live Ghidra MCP small queries, bounded local deobf raw displacement scans, run_experiment ./.auto/measure.sh without runtime trigger. A temporary scripts/ghidra/ScaleformFileOpenerMap.java helper was written but headless Ghidra could not run it because the persistent project was locked; discard will revert it.","rollback_reason":"Primary metric stayed 0; this was static RE/tooling triage and did not implement a visible portrait-cover surface or oracle.","next_action_hint":"Use the forthcoming MCP bounded displacement scan, or equivalent exact static evidence, to map writes to CSScaleformSystem+0x970 and loader+(0x10)+0x10, then identify the FileOpener vtable/open implementation. Avoid broad Ghidra scans and do not infer from RTTI strings alone."}}
{"run":532,"commit":"4dc167b","metric":0,"metrics":{"readiness_gate_failures":0,"target_constants_remaining":0,"helpers_missing":0,"fixed_wait_predicates":0,"autoload_static_failures":0,"asset_chain_failures":0,"dll_patch_failures":0,"native_continue_failures":0,"field58_gate_failures":0,"direct_shortcut_failures":0,"input_path_failures":0,"runtime_proof_failures":0,"runtime_mode_failures":0,"eula_popup_failures":0,"save_data_popup_failures":0,"messagebox_dialog_failures":0,"server_status_failures":0,"title_cover_failures":2,"title_cover_penalty":1800,"native_trace_blockers":0,"native_trace_hits_total":74,"native_trace_unique_breakpoints":11,"false_positives":0,"offline_face_source_ready":1,"removed path_cpu_texture_bridge_ready":0,"offline_face_texture_runtime_drawn":0,"stylized_facedata_pixel_oracle":0,"real_portrait_asset_candidates":0,"profile_placeholder_assets_only":1},"status":"discard","description":"Map CSScaleformFileOpener vtable/open path using new displacement scan","timestamp":1782617133455,"segment":2,"confidence":null,"asi":{"hypothesis":"After restarting the Ghidra MCP Java side, use the new bounded displacement scan to map the concrete CSScaleformSystem+0x970 writer and CSScaleformFileOpener vtable/open path for a memory-backed custom full-screen portrait+stats GFX surface.","static_finding":"New ghidra_scan_x86_displacements tool works after restart. Displacement scan shows CSScaleformSystem ctor 0x140d744b0 zeroes +0x970, destructor 0x140d75190 clears/releases it, and the real writer is FUN_140d78260 at 0x140d785ce storing FUN_140d70b90 result into +0x970. FUN_140d70b90 constructs the GFx loader object and installs CS::CSScaleformFileOpener as GFx state id 0x0c. Disassembly pins CSScaleformFileOpener vtable at 0x142bbb378. Slots: +0x00 -> 0x140d70640 destructor, +0x08 -> 0x140d6b580 concrete open override, +0x10 -> 0x141156ae0 stat/default helper, +0x18 -> 0x141156b60 wrapper that calls vfunc +0x08 and checks returned File vfunc +0x40. Open override 0x140d6b580 checks Scaleform.SwfCache; when cache/repository path is active, it converts URL to wide, calls GfxRepository lookup 0x140ce7810, returns 0x140ce8320(resource) as File; otherwise falls back to default SysFile opener 0x141156a10. This makes a synthetic menu:/er_effects_portrait_cover.gfx hook at 0x140d6b580 or the repository lookup path plausible.","memory_recorded":"bd remember scaleform-cs-fileopener-vtable-open-map-2026-06-28","validation":"Installed rebuilt GhidraMCP jar, restarted headless MCPServeHeadless server on port 8765, verified ghidra_scan_x86_displacements returns Java-side results, used bounded scans and Ghidra decompilation/disassembly only; run_experiment ./.auto/measure.sh without runtime trigger.","rollback_reason":"Primary metric stayed 0; this was static RE mapping and tooling enablement, not a visible portrait-cover implementation.","next_action_hint":"Map 0x140ce8320 return File object/vtable or implement a narrow prototype hook at 0x140d6b580 for one synthetic URL that returns a File-compatible in-memory object/resource. Preserve constraints: no removed path overlay, no loose live Game edits, and no product shortcut."}}
{"run":533,"commit":"4dc167b","metric":0,"metrics":{"readiness_gate_failures":0,"target_constants_remaining":0,"helpers_missing":0,"fixed_wait_predicates":0,"autoload_static_failures":0,"asset_chain_failures":0,"dll_patch_failures":0,"native_continue_failures":0,"field58_gate_failures":0,"direct_shortcut_failures":0,"input_path_failures":0,"runtime_proof_failures":0,"runtime_mode_failures":0,"eula_popup_failures":0,"save_data_popup_failures":0,"messagebox_dialog_failures":0,"server_status_failures":0,"title_cover_failures":2,"title_cover_penalty":1800,"native_trace_blockers":0,"native_trace_hits_total":74,"native_trace_unique_breakpoints":11,"false_positives":0,"offline_face_source_ready":1,"removed path_cpu_texture_bridge_ready":0,"offline_face_texture_runtime_drawn":0,"stylized_facedata_pixel_oracle":0,"real_portrait_asset_candidates":0,"profile_placeholder_assets_only":1},"status":"discard","description":"Map Scaleform repository MemoryFile interface for in-memory GFX hook","timestamp":1782617367040,"segment":2,"confidence":null,"asi":{"hypothesis":"Map 0x140ce8320 return File object/vtable so a synthetic memory-backed menu:/er_effects_portrait_cover.gfx route can reuse the engine's existing Scaleform file interface instead of inventing a new class or touching live files.","static_finding":"0x140ce8320 allocates 0x30 bytes and calls 0x140ce7c90(name, data_ptr=resource+0x78, size=resource+0x80, valid=1). 0x140ce7c90 constructs Scaleform::MemoryFile with vtable 0x142ba4c80, name/string ref at +0x10, byte pointer +0x18, size +0x20, cursor +0x24, valid byte +0x28. Mapped slots: +0x08 0x140ce8300 returns name chars; +0x20 0x140ce84d0 returns valid byte; +0x30 0x140ce8310 returns size; +0x40 0x140ce82f0 returns 0 and satisfies FileOpener wrapper 0x141156b60 error check; +0x50 0x140ce8530 reads/copies bytes and advances; +0x58 0x140ce85c0 skips; +0x60 0x140ce81c0 returns bytes remaining; +0x70 0x140ce8580 seek; +0x78 0x140ce8500 delegates/tells via +0x70. A narrow hook at CSScaleformFileOpener open override 0x140d6b580 can plausibly return a MemoryFile-compatible object for synthetic menu:/er_effects_portrait_cover.gfx using embedded GFX bytes and stable name storage.","memory_recorded":"bd remember scaleform-memoryfile-interface-map-2026-06-28","validation":"Beads memory precheck; Ghidra decompile 0x140ce8320, 0x140ce7810, 0x140ce7c90 and MemoryFile slot functions; ghidra_scan_x86_displacements on 0x140ce8320 and 0x140ce7c90; run_experiment ./.auto/measure.sh without runtime trigger.","rollback_reason":"Primary metric stayed 0; this was static interface mapping, not an implemented visible portrait-cover surface or oracle.","next_action_hint":"Next step is no longer File interface RE; either obtain/author valid GFX/SWF bytes for a full-screen portrait+stats surface, or implement a narrow diagnostic hook at 0x140d6b580 that serves an existing known-good GFX asset from embedded bytes under a synthetic URL to prove the in-memory route before custom authoring."}}
{"run":534,"commit":"4dc167b","metric":0,"metrics":{"readiness_gate_failures":0,"target_constants_remaining":0,"helpers_missing":0,"fixed_wait_predicates":0,"autoload_static_failures":0,"asset_chain_failures":0,"dll_patch_failures":0,"native_continue_failures":0,"field58_gate_failures":0,"direct_shortcut_failures":0,"input_path_failures":0,"runtime_proof_failures":0,"runtime_mode_failures":0,"eula_popup_failures":0,"save_data_popup_failures":0,"messagebox_dialog_failures":0,"server_status_failures":0,"title_cover_failures":2,"title_cover_penalty":1800,"native_trace_blockers":0,"native_trace_hits_total":74,"native_trace_unique_breakpoints":11,"false_positives":0,"offline_face_source_ready":1,"removed path_cpu_texture_bridge_ready":0,"offline_face_texture_runtime_drawn":0,"stylized_facedata_pixel_oracle":0,"real_portrait_asset_candidates":0,"profile_placeholder_assets_only":1},"status":"discard","description":"Ground synthetic Scaleform URL open hook runtime address and ABI","timestamp":1782617526972,"segment":2,"confidence":null,"asi":{"hypothesis":"Before implementing a product hook, ground CSScaleformFileOpener::Open in the deobf/runtime binary: exact address, ABI, vtable slot, and safe hook prologue. This tests whether the synthetic in-memory URL route can be implemented inside the DLL without patching loose assets or relying on dump addresses.","static_finding":"CSScaleformFileOpener::Open override dump 0x140d6b580 maps content-unique to deobf/runtime 0x140d6b4d0 (shift -0xb0). Prototype from Ghidra/deobf prologue is effectively `void* open(this, char* url, u32 arg2, u32 arg3)` with Windows x64 registers rcx=this, rdx=url, r8d/r9d flags/args; vtable entry is 0x142bbb378 +0x08. Wrapper slot +0x18 (0x141156b60) calls the open override and then calls returned File vfunc +0x40 expecting zero for success. MemoryFile constructor dump 0x140ce7c90 maps to deobf 0x140ce7bb0; repository return 0x140ce8320 maps to deobf 0x140ce8240. Deobf prologue at 0x140d6b4d0 is normal/hookable, not a mid-function ambiguous address. Future hook can compare URL against synthetic menu:/er_effects_portrait_cover.gfx or menu:/Win/er_effects_portrait_cover.gfx, return a MemoryFile-compatible object over embedded bytes, otherwise call original opener.","memory_recorded":"bd remember scaleform-synthetic-url-open-hook-grounding-2026-06-28","validation":"Beads memory precheck; Ghidra function/xref/decompile and bounded displacement scan for 0x140d6b580; scripts/dump-deobf-shift.py for 0x140d6b580, 0x140ce7c90, 0x140ce8320, 0x142ba4c80; er_disasm deobf 0x140d6b4d0 prologue; run_experiment ./.auto/measure.sh without runtime trigger.","rollback_reason":"Primary metric stayed 0; this was static hook grounding, not an implemented visible portrait-cover surface or oracle.","next_action_hint":"Next implementable diagnostic is a narrow CSScaleformFileOpener::Open hook that serves an existing known-good GFX asset from embedded bytes under a synthetic URL, proving the memory route before custom full-screen portrait+stats authoring. Do not promote it as final portrait proof."}}
{"run":535,"commit":"4dc167b","metric":0,"metrics":{"readiness_gate_failures":0,"target_constants_remaining":0,"helpers_missing":0,"fixed_wait_predicates":0,"autoload_static_failures":0,"asset_chain_failures":0,"dll_patch_failures":0,"native_continue_failures":0,"field58_gate_failures":0,"direct_shortcut_failures":0,"input_path_failures":0,"runtime_proof_failures":0,"runtime_mode_failures":0,"eula_popup_failures":0,"save_data_popup_failures":0,"messagebox_dialog_failures":0,"server_status_failures":0,"title_cover_failures":2,"title_cover_penalty":1800,"native_trace_blockers":0,"native_trace_hits_total":74,"native_trace_unique_breakpoints":11,"false_positives":0,"offline_face_source_ready":1,"removed path_cpu_texture_bridge_ready":0,"offline_face_texture_runtime_drawn":0,"stylized_facedata_pixel_oracle":0,"real_portrait_asset_candidates":0,"profile_placeholder_assets_only":1},"status":"discard","description":"Add default-off synthetic Scaleform Open diagnostic hook scaffold","timestamp":1782618021083,"segment":2,"confidence":null,"asi":{"hypothesis":"Implement the next diagnostic prerequisite for the custom Scaleform route: a default-off CSScaleformFileOpener::Open hook scaffold at deobf 0x140d6b4d0 that detects synthetic menu:/er_effects_portrait_cover.gfx URLs, records telemetry, and passes through. This should not claim portrait proof or alter product/default runs.","implementation":"Patched constants, gating, lib attach wiring, startup_hooks detour/install function, and telemetry fields. Gate was ER_EFFECTS_SCALEFORM_SYNTHETIC_OPEN_DIAG=1 or er-effects-scaleform-synthetic-open-diag.txt. Detour prototype used rcx=this, rdx=url, r8d/r9d args; it matched menu:/er_effects_portrait_cover.gfx and menu:/Win/er_effects_portrait_cover.gfx, incremented synthetic hit telemetry, then called the original opener. It did not construct or return a custom MemoryFile.","validation":"Ran the guarded ./.auto/measure.sh through run_experiment; it passed with no runtime trigger and all existing static regression metrics clean, but this fast measure does not prove Windows-target compilation of the newly added Rust hook path.","memory_recorded":"bd remember scaleform-synthetic-open-diag-implementation-spike-2026-06-28","rollback_reason":"Primary metric stayed 0; a pass-through diagnostic hook scaffold is not a visible portrait-cover surface or runtime portrait-pixel oracle. Discarding also avoids keeping an uncompiled hook-path patch as product code.","next_action_hint":"Before reapplying code, decide whether to prototype actual MemoryFile return with native allocator/constructor or instead first obtain valid GFX/SWF bytes. If reapplying the hook scaffold, run a real Windows-target cargo check/smoke because .auto/measure.sh is not sufficient compile validation."}}
{"run":536,"commit":"4dc167b","metric":0,"metrics":{"readiness_gate_failures":0,"target_constants_remaining":0,"helpers_missing":0,"fixed_wait_predicates":0,"autoload_static_failures":0,"asset_chain_failures":0,"dll_patch_failures":0,"native_continue_failures":0,"field58_gate_failures":0,"direct_shortcut_failures":0,"input_path_failures":0,"runtime_proof_failures":0,"runtime_mode_failures":0,"eula_popup_failures":0,"save_data_popup_failures":0,"messagebox_dialog_failures":0,"server_status_failures":0,"title_cover_failures":2,"title_cover_penalty":1800,"native_trace_blockers":0,"native_trace_hits_total":74,"native_trace_unique_breakpoints":11,"false_positives":0,"offline_face_source_ready":1,"removed path_cpu_texture_bridge_ready":0,"offline_face_texture_runtime_drawn":0,"stylized_facedata_pixel_oracle":0,"real_portrait_asset_candidates":0,"profile_placeholder_assets_only":1},"status":"discard","description":"Inventory known-good GFX payloads for synthetic Scaleform route","timestamp":1782618231959,"segment":2,"confidence":null,"asi":{"hypothesis":"Before returning a custom MemoryFile, verify a concrete known-good GFX payload source and local authoring/tooling state for the synthetic Scaleform route. This avoids inventing bytes blindly or scoring ProfileSelect/chrome as portrait proof.","static_finding":"Bounded local inventory found valid extracted GFX v11 payloads with `GFX` headers: 05_000_title.gfx size 12174 sha256 0872535842a9493e9c63959bb57515d8a7ec37f3d1ef539c14b1720f55a037d4; 05_001_title_logo.gfx size 2862 sha256 be6d47205f689823e96f8c586df92ca44f3d4a8d94dada158d900c3a4a18c830; 05_010_profileselect.gfx size 14388 sha256 503f931b9a61a955c28f3726d0bd850f755cb7c1583f30ce11467772b4a650f8; 02_050_detailstatus_player.gfx size 11877 sha256 096551972261374f1b240881d06c246aca8b97e21b268d3dbd34ed1f8e33940a; 02_070_status.gfx size 24598 sha256 3759e7d940721b6563ee7f925740555b7f35aed760743f44442fa4dbba05d8c6. `ffdec`, `java`, `ruffle`, and `ffmpeg` are installed; `swfmill` and `mtasc` are absent. FFDEC export directories may have `.gfx` suffixes, so future inventory scripts must require is_file().","validation":"Beads memory precheck; bounded Python inventory under /home/banon/er-extract/nuxe-menu-20260619-170932/menu and target/autoresearch; exact candidate hash/header check; run_experiment ./.auto/measure.sh without runtime trigger.","memory_recorded":"bd remember scaleform-known-good-gfx-payload-inventory-2026-06-28","rollback_reason":"Primary metric stayed 0; this was static payload/tooling inventory and did not implement a visible portrait-cover surface, custom MemoryFile return, or runtime portrait-pixel oracle.","next_action_hint":"Use 05_000_title.gfx or another tiny known-good GFX as a diagnostic payload for the synthetic URL MemoryFile route; keep 05_010/ProfileSelect as route-validation only, not final portrait proof. Next implementation should either return embedded known-good bytes from the Open hook or identify the native load/render call that requests the synthetic URL."}}
