{"run":250,"commit":"b577ce6","metric":1505,"metrics":{"readiness_gate_failures":1,"target_constants_remaining":0,"helpers_missing":0,"fixed_wait_predicates":0,"autoload_static_failures":1,"asset_chain_failures":0,"dll_patch_failures":0,"native_continue_failures":0,"field58_gate_failures":0,"direct_shortcut_failures":0,"input_path_failures":0,"runtime_proof_failures":1,"runtime_mode_failures":0,"eula_popup_failures":0,"save_data_popup_failures":0,"messagebox_dialog_failures":0,"server_status_failures":0,"title_cover_failures":0,"title_cover_penalty":0,"native_trace_blockers":0,"native_trace_hits_total":74,"native_trace_unique_breakpoints":11,"false_positives":0,"runtime_timeout_failures":0,"runtime_title_visual_suppressed_builds":1,"runtime_custom_cover_builds":1,"runtime_simulated_button_presses_total":0},"status":"discard","description":"runtime validated actual draw-bit semaphore and accepted-byte world-stable path","timestamp":1782440175998,"segment":0,"confidence":null,"asi":{"hypothesis":"With fail-fast tied to the actual CSMenuMan draw bit, the runtime should pass if the native title surface is not drawable and still fail if it is visible.","observed":"Runtime artifact product-continue-direct-20260625-191504 reached world_stable. Telemetry showed native title menu_id=13, current_flags=1, current_draw_bit_set=false, custom cover builds=1, simulated_button_presses_total=0, msgbox_total=0, server_status_total=0, LOAD-CORRECTNESS Banon level 150. render_suppressed_windows remained 0, proving the actual flag semaphore is more accurate than event-count absence.","rollback_reason":"No primary metric improvement; this was validation of the kept b577ce6 guardrail, not a new source change.","next_action_hint":"Remaining score blocker is runtime_proof_failures due expected_animation_match=false/current_animation_id=null despite world_stable and expected_save_match=true. Fix telemetry ordering/latching so expected_animation_seen is updated before the world-stable readiness sample, or revise the animation oracle to use a stable in-world player/action state semaphore rather than a one-frame TimeAct sample."}}
{"run":251,"commit":"540e395","metric":1505,"metrics":{"readiness_gate_failures":1,"target_constants_remaining":0,"helpers_missing":0,"fixed_wait_predicates":0,"autoload_static_failures":1,"asset_chain_failures":0,"dll_patch_failures":0,"native_continue_failures":0,"field58_gate_failures":0,"direct_shortcut_failures":0,"input_path_failures":0,"runtime_proof_failures":1,"runtime_mode_failures":0,"eula_popup_failures":0,"save_data_popup_failures":0,"messagebox_dialog_failures":0,"server_status_failures":0,"title_cover_failures":0,"title_cover_penalty":0,"native_trace_blockers":0,"native_trace_hits_total":74,"native_trace_unique_breakpoints":11,"false_positives":0,"runtime_timeout_failures":0,"runtime_title_visual_suppressed_builds":1,"runtime_custom_cover_builds":1,"runtime_simulated_button_presses_total":0},"status":"keep","description":"clear full native title visible flags mask after user observed title/PAB/Continue","timestamp":1782440343983,"segment":0,"confidence":null,"asi":{"hypothesis":"User-observed title logo/PAB/Continue with CSMenuMan flags=1 proves the old 0x2 draw-bit-only mask was wrong; native title visibility uses bit 0 as well, so suppression must clear the full 0x3 visible mask.","evidence":"Static disasm of MenuWindowJob::Run sets CSMenuMan+0x90[id] |= 1 before FadeIn helper sets |=3. Runtime product-continue-direct-20260625-191504 had current_flags=1, draw_bit false, but user observed native title/PAB/Continue. Therefore bit 0 is visible and the RAM semaphore must treat any mask bit in 0x3 as unsuppressed.","result":"TITLE_NATIVE_MENU_VISUAL_VISIBLE_FLAGS_MASK is now 0x3; render suppressor clears flags_before & !0x3; telemetry/watcher visible semaphore checks the same mask. .auto/measure static guard now requires 0x3.","next_action_hint":"Run a fresh runtime marker. Expected: native title current_flags becomes 0 after suppression or the watcher fails with native_title_visual_render_unsuppressed if any native title flag remains visible. Then add equivalent RAM semaphore for Continue/other menu-row visual surfaces."}}
{"run":252,"commit":"540e395","metric":0,"metrics":{"readiness_gate_failures":1,"target_constants_remaining":0,"helpers_missing":0,"fixed_wait_predicates":0,"autoload_static_failures":1,"asset_chain_failures":0,"dll_patch_failures":0,"native_continue_failures":0,"field58_gate_failures":0,"direct_shortcut_failures":0,"input_path_failures":0,"runtime_proof_failures":1,"runtime_mode_failures":0,"eula_popup_failures":0,"save_data_popup_failures":0,"messagebox_dialog_failures":0,"server_status_failures":0,"title_cover_failures":0,"title_cover_penalty":0,"native_trace_blockers":0,"native_trace_hits_total":74,"native_trace_unique_breakpoints":11,"false_positives":1,"runtime_timeout_failures":0,"runtime_title_visual_suppressed_builds":1,"runtime_custom_cover_builds":1,"runtime_simulated_button_presses_total":0},"status":"crash","description":"visual evidence falsified CSMenuMan flag semaphore for native title/logo visibility","timestamp":1782440471738,"segment":0,"confidence":null,"asi":{"hypothesis":"Clearing/reading the CSMenuMan+0x90 native-title visible mask would make the original title/PAB/Continue visibility crashable and non-visible.","observed":"User-provided screenshot during product-continue-direct-20260625-191917 visibly shows the ELDEN RING title logo and Checking save data while telemetry reported menu_id=0, current_flags=0, current_draw_bit_set=false, world_stable=true. Therefore the CSMenuMan+0x90 flag semaphore is a false negative for the visible logo/title surface, and the run is invalid product proof.","rollback_reason":"False positive visual coverage: native title/logo remains visible despite RAM flag semaphore saying hidden. Need deeper/static RE of the title logo surface rather than tuning CSMenuMan flags.","next_action_hint":"Statically identify and suppress the separate 05_001_Title_Logo/title-logo render path or active-screen surface. Do not rely on CSMenuMan+0x90[05_000_Title] flags as the product-proof oracle; add a RAM semaphore tied to the actual visible logo/menu row surface."}}
{"run":253,"commit":"fe3f2d7","metric":1455,"metrics":{"readiness_gate_failures":1,"target_constants_remaining":0,"helpers_missing":0,"fixed_wait_predicates":0,"autoload_static_failures":1,"asset_chain_failures":0,"dll_patch_failures":0,"native_continue_failures":0,"field58_gate_failures":0,"direct_shortcut_failures":0,"input_path_failures":0,"runtime_proof_failures":1,"runtime_mode_failures":0,"eula_popup_failures":0,"save_data_popup_failures":0,"messagebox_dialog_failures":0,"server_status_failures":0,"title_cover_failures":1,"title_cover_penalty":50,"native_trace_blockers":0,"native_trace_hits_total":74,"native_trace_unique_breakpoints":11,"false_positives":0,"runtime_timeout_failures":0,"runtime_title_visual_suppressed_builds":0,"runtime_custom_cover_builds":0,"runtime_simulated_button_presses_total":0},"status":"keep","description":"fail closed on title-cover scoring until logo surface is tied to post-SL2 portrait readiness","timestamp":1782441083991,"segment":0,"confidence":null,"asi":{"hypothesis":"After the user-visible false positive, the scorer must fail closed unless the actual TitleBackViewParts/05_001_Title_Logo surface is tied to post-SL2 profile portrait readiness; old CSMenuMan+0x90 title flags are not sufficient.","evidence":"User screenshot showed native title/logo/PAB/Continue while telemetry reported current_flags=0/hidden. Bd memory sibling-pi-harvest-menu-visual-injection-pipeline-2026-06-24 says ProfileSelect/SYSTEX portrait rendering depends on loaded profile/SL2 readiness (profile_summary, slot active, 0x1409aa680, MenuWindow+0x754/+0x755). New bd memory title-logo-cover-sl2-profile-render-dependency-2026-06-25 links the two findings.","result":"Added .auto/measure.sh fail-closed title_cover_failure until executable code/telemetry includes TitleBackViewParts, 05_001_Title_Logo, profile_summary, and SYSTEX_Menu_Profile. Added reusable Ghidra string-xref helper scripts/ghidra/FindUnicodeStringRefs.java, smoke-used to identify 05_001_Title_Logo xrefs.","next_action_hint":"Implement observable product code/telemetry for the actual logo surface: latch TitleTopDialog+0xaa8 TitleBackViewParts / 05_001_Title_Logo and update/replace it only after loaded profile/SL2 portrait render target readiness, not at early constructor time."}}
{"run":254,"commit":"85f5b43","metric":1505,"metrics":{"readiness_gate_failures":1,"target_constants_remaining":0,"helpers_missing":0,"fixed_wait_predicates":0,"autoload_static_failures":1,"asset_chain_failures":0,"dll_patch_failures":0,"native_continue_failures":0,"field58_gate_failures":0,"direct_shortcut_failures":0,"input_path_failures":0,"runtime_proof_failures":1,"runtime_mode_failures":0,"eula_popup_failures":0,"save_data_popup_failures":0,"messagebox_dialog_failures":0,"server_status_failures":0,"title_cover_failures":0,"title_cover_penalty":0,"native_trace_blockers":0,"native_trace_hits_total":74,"native_trace_unique_breakpoints":11,"false_positives":0,"runtime_timeout_failures":0,"runtime_title_visual_suppressed_builds":0,"runtime_custom_cover_builds":0,"runtime_simulated_button_presses_total":0},"status":"keep","description":"add telemetry for actual TitleBackViewParts logo surface and post-SL2 profile readiness","timestamp":1782441215314,"segment":0,"confidence":null,"asi":{"hypothesis":"Adding observation-only telemetry for the real visible logo surface (TitleBackViewParts / 05_001_Title_Logo) and profile_summary readiness will satisfy the corrected title-cover guard without mutating render behavior too early.","evidence":"Static RE: TitleTopDialog constructs TitleBackViewParts at dialog+0xaa8 from 05_001_Title_Logo. Bd memory link says the character portrait path must wait for loaded SL2/profile render target readiness. Code now exposes oracle_title_logo_surface_name, oracle_title_logo_resource_name, oracle_title_logo_back_view_parts, oracle_title_logo_back_view_parts_vtable, oracle_title_logo_profile_summary, and oracle_title_logo_profile_summary_ready.","result":"The fail-closed title_cover_penalty returned to 0 because executable telemetry now names the actual logo surface and post-SL2 profile dependency. No product render mutation yet.","next_action_hint":"Run a fresh runtime marker to validate the new oracle_title_logo_* fields. Then use those fields to gate a late profile/SYSTEX portrait cover update after profile_summary_ready, rather than replacing the logo resource during early TitleTopDialog construction."}}
{"run":255,"commit":"85f5b43","metric":0,"metrics":{"readiness_gate_failures":1,"target_constants_remaining":0,"helpers_missing":0,"fixed_wait_predicates":0,"autoload_static_failures":1,"asset_chain_failures":0,"dll_patch_failures":0,"native_continue_failures":0,"field58_gate_failures":0,"direct_shortcut_failures":0,"input_path_failures":0,"runtime_proof_failures":1,"runtime_mode_failures":0,"eula_popup_failures":0,"save_data_popup_failures":0,"messagebox_dialog_failures":0,"server_status_failures":0,"title_cover_failures":0,"title_cover_penalty":0,"native_trace_blockers":0,"native_trace_hits_total":74,"native_trace_unique_breakpoints":11,"false_positives":0,"runtime_timeout_failures":0,"runtime_title_visual_suppressed_builds":0,"runtime_custom_cover_builds":0,"runtime_simulated_button_presses_total":0},"status":"crash","description":"runtime marker compile failed for title-logo telemetry private helper path","timestamp":1782441247241,"segment":0,"confidence":null,"asi":{"hypothesis":"Fresh runtime marker would validate the new oracle_title_logo_* telemetry fields.","error_details":"cargo xwin build failed before launching Elden Ring with E0603. The truncated compile log only retained the tail, but the new telemetry code called crate::experiments::game_data_man_ptr_or_null from telemetry.rs; likely privacy/path issue.","rollback_reason":"Compile failure; no runtime probe launched.","next_action_hint":"Re-add title-logo telemetry using the existing telemetry module imports/in-scope helper access pattern, or expose a public wrapper for game_data_man/profile_summary. Then run static measure and a fresh marker build again."}}
{"run":256,"commit":"ff97819","metric":1505,"metrics":{"readiness_gate_failures":1,"target_constants_remaining":0,"helpers_missing":0,"fixed_wait_predicates":0,"autoload_static_failures":1,"asset_chain_failures":0,"dll_patch_failures":0,"native_continue_failures":0,"field58_gate_failures":0,"direct_shortcut_failures":0,"input_path_failures":0,"runtime_proof_failures":1,"runtime_mode_failures":0,"eula_popup_failures":0,"save_data_popup_failures":0,"messagebox_dialog_failures":0,"server_status_failures":0,"title_cover_failures":0,"title_cover_penalty":0,"native_trace_blockers":0,"native_trace_hits_total":74,"native_trace_unique_breakpoints":11,"false_positives":0,"runtime_timeout_failures":0,"runtime_title_visual_suppressed_builds":0,"runtime_custom_cover_builds":0,"runtime_simulated_button_presses_total":0},"status":"keep","description":"fix title-logo telemetry profile-summary helper path","timestamp":1782441301230,"segment":0,"confidence":null,"asi":{"hypothesis":"The runtime build failure was caused by using the wrong module path for game_data_man_ptr_or_null in telemetry.rs.","evidence":"Existing telemetry.rs already calls crate::game_data_man_ptr_or_null elsewhere; replacing crate::experiments::game_data_man_ptr_or_null with crate::game_data_man_ptr_or_null preserves the same profile_summary read pattern.","result":"Static measure passes again with title_cover_failures=0/title_cover_penalty=0. This is a compile-path fix for the previously kept telemetry.","next_action_hint":"Run the marker-gated runtime probe again to validate oracle_title_logo_back_view_parts, oracle_title_logo_profile_summary_ready, and the existing world-stable proof."}}
{"run":257,"commit":"ff97819","metric":1505,"metrics":{"readiness_gate_failures":1,"target_constants_remaining":0,"helpers_missing":0,"fixed_wait_predicates":0,"autoload_static_failures":1,"asset_chain_failures":0,"dll_patch_failures":0,"native_continue_failures":0,"field58_gate_failures":0,"direct_shortcut_failures":0,"input_path_failures":0,"runtime_proof_failures":1,"runtime_mode_failures":0,"eula_popup_failures":0,"save_data_popup_failures":0,"messagebox_dialog_failures":0,"server_status_failures":0,"title_cover_failures":0,"title_cover_penalty":0,"native_trace_blockers":0,"native_trace_hits_total":74,"native_trace_unique_breakpoints":11,"false_positives":0,"runtime_timeout_failures":0,"runtime_title_visual_suppressed_builds":0,"runtime_custom_cover_builds":1,"runtime_simulated_button_presses_total":0},"status":"discard","description":"runtime validated TitleBackViewParts logo and profile-summary telemetry","timestamp":1782441362517,"segment":0,"confidence":null,"asi":{"hypothesis":"Fresh runtime marker should validate the new oracle_title_logo_* fields without changing the native Continue/load path.","observed":"Artifact product-continue-direct-20260625-193510 reached world_stable. oracle_title_logo_surface_name=TitleBackViewParts, resource=05_001_Title_Logo, back_view_parts=0x7ffe9e4e4698, vtable=0x142b23160, profile_summary=0x7fffa0830580, profile_summary_ready=true. expected_save_match=true for Banon, zero simulated input, zero MessageBox/server statuses. Remaining blocker is expected_animation_seen=false/current_animation_id=null.","rollback_reason":"No primary metric improvement; this was runtime validation of already kept telemetry, not a new scoring/product improvement.","next_action_hint":"Use the validated TitleBackViewParts pointer and profile_summary_ready gate for a late cover update path: call/use the ProfileSelect/SYSTEX portrait render pipeline only after profile_summary_ready, instead of early resource substitution."}}
{"run":258,"commit":"f235b02","metric":1505,"metrics":{"readiness_gate_failures":1,"target_constants_remaining":0,"helpers_missing":0,"fixed_wait_predicates":0,"autoload_static_failures":1,"asset_chain_failures":0,"dll_patch_failures":0,"native_continue_failures":0,"field58_gate_failures":0,"direct_shortcut_failures":0,"input_path_failures":0,"runtime_proof_failures":1,"runtime_mode_failures":0,"eula_popup_failures":0,"save_data_popup_failures":0,"messagebox_dialog_failures":0,"server_status_failures":0,"title_cover_failures":0,"title_cover_penalty":0,"native_trace_blockers":0,"native_trace_hits_total":74,"native_trace_unique_breakpoints":11,"false_positives":0,"runtime_timeout_failures":0,"runtime_title_visual_suppressed_builds":0,"runtime_custom_cover_builds":1,"runtime_simulated_button_presses_total":0},"status":"keep","description":"call post-SL2 profile portrait render refresh before native accept","timestamp":1782441504055,"segment":0,"confidence":null,"asi":{"hypothesis":"Once profile_summary is ready, a one-shot call to the decoded profile render refresh function (live 0x1409aa680) should populate SYSTEX_Menu_Profile targets for the loaded SL2/profile before native Continue opens, without replacing the early title logo resource.","evidence":"Ghidra decompile of dump 0x1409aa7d0/live 0x1409aa680: function reads CS::GameDataMan::GetProfileSummary(), loops slots 0..9, checks active slot and renderer ready bytes +0x754/+0x755, sets model/face data, then calls FUN_140bb8cf0(renderer, slot*2) for SYSTEX target mapping. The new call is gated by ProductCoreAutoloadReady.profile_summary and occurs before maybe_set_title_accept_byte.","result":"Added maybe_refresh_title_profile_cover one-shot and telemetry oracle_title_custom_cover_profile_render_refresh_* fields. Static measure passes with title_cover_failures=0.","next_action_hint":"Run marker-gated runtime to verify refresh_calls=1 and no regression in zero-input world-stable proof. If stable, next RE target is binding the refreshed SYSTEX profile target into the visible TitleBackViewParts/custom cover surface."}}
{"run":259,"commit":"f235b02","metric":0,"metrics":{"readiness_gate_failures":1,"target_constants_remaining":0,"helpers_missing":0,"fixed_wait_predicates":0,"autoload_static_failures":1,"asset_chain_failures":0,"dll_patch_failures":0,"native_continue_failures":0,"field58_gate_failures":0,"direct_shortcut_failures":0,"input_path_failures":0,"runtime_proof_failures":1,"runtime_mode_failures":0,"eula_popup_failures":0,"save_data_popup_failures":0,"messagebox_dialog_failures":0,"server_status_failures":0,"title_cover_failures":0,"title_cover_penalty":0,"native_trace_blockers":0,"native_trace_hits_total":74,"native_trace_unique_breakpoints":11,"false_positives":0,"runtime_timeout_failures":0,"runtime_title_visual_suppressed_builds":0,"runtime_custom_cover_builds":1,"runtime_simulated_button_presses_total":0},"status":"crash","description":"runtime profile refresh ran but native title remained visibly unsuppressed","timestamp":1782441573376,"segment":0,"confidence":null,"asi":{"hypothesis":"Post-SL2 profile portrait render refresh at live 0x1409aa680 should populate SYSTEX profile targets without regressing zero-input load.","observed":"Artifact product-continue-direct-20260625-193834: refresh_calls=1, profile_summary_ready=true, debug log shows title-cover-part-b refreshed post-SL2 profile portrait render targets via 0x1409aa680 at +14876ms. Native load still reached LOAD-CORRECTNESS Banon. However watcher failed with native_title_visual_render_unsuppressed, and the user observed the native title screen again. Zero simulated input, zero MessageBox/server statuses.","rollback_reason":"Runtime failure: profile target refresh alone does not bind the portrait into the visible cover and the native title remains visible. The mutation must not be kept as proof.","next_action_hint":"Do not call 0x1409aa680 as sufficient cover. Next static target is the binding/display step from SYSTEX_Menu_Profile00 into a visible surface: either custom Scaleform target referencing MENU_DummyProfileFace/SYSTEX after readiness, or a native active-screen attachment distinct from 05_001_Title_Logo. Keep the native_title_visual_render_unsuppressed fail-fast."}}
