{"run":515,"commit":"0dfc45e","metric":0,"metrics":{"readiness_gate_failures":0,"target_constants_remaining":0,"helpers_missing":0,"fixed_wait_predicates":0,"autoload_static_failures":0,"asset_chain_failures":0,"dll_patch_failures":0,"native_continue_failures":0,"field58_gate_failures":0,"direct_shortcut_failures":0,"input_path_failures":0,"runtime_proof_failures":0,"runtime_mode_failures":0,"eula_popup_failures":0,"save_data_popup_failures":0,"messagebox_dialog_failures":0,"server_status_failures":0,"title_cover_failures":1,"title_cover_penalty":1600,"native_trace_blockers":0,"native_trace_hits_total":74,"native_trace_unique_breakpoints":11,"false_positives":0,"offline_face_source_ready":1,"removed path_cpu_texture_bridge_ready":1,"offline_face_texture_runtime_drawn":1,"stylized_facedata_pixel_oracle":1,"real_portrait_asset_candidates":0,"profile_placeholder_assets_only":1},"status":"discard","description":"No-teardown native profile capture still reaches source readiness but no target window maps","timestamp":1782612195496,"segment":2,"confidence":null,"asi":{"hypothesis":"Reapply the native profile-capture accept-gate fix and run the capture launcher with RUNTIME_NO_TEARDOWN=1 so the owner Proton process stays alive while the Python capture grabs the window after source readiness.","artifact":"/home/banon/projects/er-effects-rs/target/runtime-probe/profile-portrait-capture-20260627-190200","failure_evidence":"/home/banon/projects/er-effects-rs/target/runtime-probe/profile-portrait-capture-20260627-190200/profile-portrait-failure.json","finding":"No-teardown did not solve capture. The capture readiness checks again all passed (missing=[]; native_load_game_fired/source_ready true; renderer/offscreen/tex_rescap nonzero; systex_bind_hits=10), but the exact target Hyprland class `steam_app_1245620` was never observed. The hypr-window-placer log contains only repeated no_target_window events for the class across the run. This suggests the diagnostic native ProfileSelect build/source path can run without a mapped target window, so screenshot-based capture is not available from this mode as written.","rollback_reason":"Primary metric stayed 0; still no portrait image/oracle captured.","next_action_hint":"Do not spend another cycle just tweaking teardown timing. Pivot to static/native observer work: implement/ground the FUN_140749290 MenuResource->SceneObjProxy resolver from the planner output, or use an already window-mapped product runtime path and capture native profile source from there."}}
{"run":516,"commit":"0dfc45e","metric":0,"metrics":{"readiness_gate_failures":0,"target_constants_remaining":0,"helpers_missing":0,"fixed_wait_predicates":0,"autoload_static_failures":0,"asset_chain_failures":0,"dll_patch_failures":1,"native_continue_failures":0,"field58_gate_failures":0,"direct_shortcut_failures":0,"input_path_failures":0,"runtime_proof_failures":0,"runtime_mode_failures":0,"eula_popup_failures":0,"save_data_popup_failures":0,"messagebox_dialog_failures":0,"server_status_failures":0,"title_cover_failures":1,"title_cover_penalty":1600,"native_trace_blockers":0,"native_trace_hits_total":74,"native_trace_unique_breakpoints":11,"false_positives":0,"offline_face_source_ready":1,"removed path_cpu_texture_bridge_ready":1,"offline_face_texture_runtime_drawn":1,"stylized_facedata_pixel_oracle":1,"real_portrait_asset_candidates":0,"profile_placeholder_assets_only":1},"status":"crash","description":"MenuResource resolver observer implementation failed to compile","timestamp":1782612478399,"segment":2,"confidence":null,"asi":{"hypothesis":"Add an observe-only MinHook for live/deobf 0x140749190 (dump FUN_140749290) to classify MenuResource->SceneObjProxy resolver calls against TitleBackViewParts+0x8/+0x70 and expose telemetry, following the planner's static-native oracle path.","static_grounding":"Ghidra decompile of dump 0x140749290 confirms signature FUN_140749290(longlong param_1, SceneObjProxy *param_2, undefined8 param_3, undefined8 param_4), reading param_1+0x60 and param_1+0x48 then constructing/assigning SceneObjProxy. scripts/dump-deobf-shift.py 0x140749290 returned deobf 0x140749190 shift=-0x100 content-unique.","error":"cargo xwin build inside measure failed: src/telemetry.rs referenced title_profile_visible_surface_bind_rewrites before that local was declared. Full build log: /tmp/er-effects-runtime-build.log","rollback_reason":"Compilation failed before runtime; log_experiment crash correctly reverts source changes.","next_action_hint":"Reapply the resolver observer but either move the title_profile_cover_bound_to_logo_surface calculation after title_profile_visible_surface_bind_rewrites is declared, or use TITLE_PROFILE_VISIBLE_SURFACE_BIND_REWRITES.load(Ordering::SeqCst) directly in that earlier calculation."}}
{"run":517,"commit":"0dfc45e","metric":0,"metrics":{"readiness_gate_failures":0,"target_constants_remaining":0,"helpers_missing":0,"fixed_wait_predicates":0,"autoload_static_failures":0,"asset_chain_failures":0,"dll_patch_failures":0,"native_continue_failures":0,"field58_gate_failures":0,"direct_shortcut_failures":0,"input_path_failures":0,"runtime_proof_failures":0,"runtime_mode_failures":0,"eula_popup_failures":0,"save_data_popup_failures":0,"messagebox_dialog_failures":0,"server_status_failures":0,"title_cover_failures":2,"title_cover_penalty":1800,"native_trace_blockers":0,"native_trace_hits_total":74,"native_trace_unique_breakpoints":11,"false_positives":1,"offline_face_source_ready":1,"removed path_cpu_texture_bridge_ready":1,"offline_face_texture_runtime_drawn":0,"stylized_facedata_pixel_oracle":0,"real_portrait_asset_candidates":0,"profile_placeholder_assets_only":1},"status":"discard","description":"Observe-only MenuResource resolver hits ProfileSelect constructor, not title-logo surface","timestamp":1782612678717,"segment":2,"confidence":null,"asi":{"hypothesis":"Implement the planner's observe-only MenuResource->SceneObjProxy resolver hook at live/deobf 0x140749190 to classify whether constructor-time resource resolution reaches the title logo surface before any rebind/draw attempt.","artifact":"/home/banon/projects/er-effects-rs/target/runtime-probe/product-continue-direct-20260627-191005","finding":"The resolver hook installed and fired once. Telemetry: oracle_title_menu_resource_resolver_hits=1, last_resource=0x7ffe969d31a0, last_scene_proxy=0x7ffe969d3208, logo_resource_hits=0, logo_proxy_hits=0, profile_cover_bound_to_logo_surface=false, portrait_pixels_visible=false. Debug log shows the hit occurred around the non-returned 05_010_ProfileSelect cover constructor, name preview '0', not TitleBackViewParts/05_001_Title_Logo. Existing ProfileSelect visible-surface bind still asserted and the screenshot analysis flagged the known dark LOAD GAME/ProfileSelect false-positive panel (black32_ratio=0.470...), so false_positives=1.","validation":"Ghidra decompile 0x140749290; dump-deobf-shift.py 0x140749290 -> deobf 0x140749190; cargo fmt; bash -n .auto/measure.sh; py_compile watcher; fresh product runtime with removed path enabled via .auto/run_runtime_probe_once .auto/enable_removed path_runtime_once.","rollback_reason":"Primary metric stayed 0 and false_positives became 1; observer did not identify a title-logo surface linkage. Discard per policy.","next_action_hint":"Do not keep iterating on the ProfileSelect/removed path false-positive surface. User now asked to delete the removed path feature; remove the title-cover removed path/FaceData diagnostic path and pivot to native/static resolver or non-removed path surface work."}}
{"run":518,"commit":"4dc167b","metric":0,"metrics":{"readiness_gate_failures":0,"target_constants_remaining":0,"helpers_missing":0,"fixed_wait_predicates":0,"autoload_static_failures":0,"asset_chain_failures":0,"dll_patch_failures":0,"native_continue_failures":0,"field58_gate_failures":0,"direct_shortcut_failures":0,"input_path_failures":0,"runtime_proof_failures":0,"runtime_mode_failures":0,"eula_popup_failures":0,"save_data_popup_failures":0,"messagebox_dialog_failures":0,"server_status_failures":0,"title_cover_failures":2,"title_cover_penalty":1800,"native_trace_blockers":0,"native_trace_hits_total":74,"native_trace_unique_breakpoints":11,"false_positives":1,"offline_face_source_ready":1,"removed path_cpu_texture_bridge_ready":0,"offline_face_texture_runtime_drawn":0,"stylized_facedata_pixel_oracle":0,"real_portrait_asset_candidates":0,"profile_placeholder_assets_only":1},"status":"keep","description":"Delete title-cover removed path/FaceData feature path per user directive","timestamp":1782612864832,"segment":2,"confidence":null,"asi":{"hypothesis":"User explicitly asked to delete the annoying/useless removed path title-cover feature. Remove the title-cover removed path/FaceData lane from active code and measurement while preserving the base effects overlay.","implementation":"Removed title-cover source sampling from src/overlay.rs, removed .auto/enable_removed path_runtime_once forcing in .auto/measure.sh, forced legacy removed path/FaceData secondary metrics to zero for log continuity, removed stale removed path bridge static scoring, and updated .auto/prompt.md/.auto/ideas.md to make removed path/title-overlay cover routes off-limits.","validation":"cargo fmt; bash -n .auto/measure.sh; python3 -m py_compile scripts/er-readiness-watch.py; run_experiment ./.auto/measure.sh without runtime trigger passed in 1.4s. No Elden Ring launch for this cleanup validation.","policy_note":"Kept despite primary metric staying 0 because this is a direct user-requested product-path deletion; discard would revert the requested deletion."}}
{"run":519,"commit":"4dc167b","metric":0,"metrics":{"readiness_gate_failures":0,"target_constants_remaining":0,"helpers_missing":0,"fixed_wait_predicates":0,"autoload_static_failures":0,"asset_chain_failures":0,"dll_patch_failures":0,"native_continue_failures":0,"field58_gate_failures":0,"direct_shortcut_failures":0,"input_path_failures":0,"runtime_proof_failures":0,"runtime_mode_failures":0,"eula_popup_failures":0,"save_data_popup_failures":0,"messagebox_dialog_failures":0,"server_status_failures":0,"title_cover_failures":2,"title_cover_penalty":1800,"native_trace_blockers":0,"native_trace_hits_total":74,"native_trace_unique_breakpoints":11,"false_positives":1,"offline_face_source_ready":1,"removed path_cpu_texture_bridge_ready":0,"offline_face_texture_runtime_drawn":0,"stylized_facedata_pixel_oracle":0,"real_portrait_asset_candidates":0,"profile_placeholder_assets_only":1},"status":"discard","description":"Static title-logo FadeIn path maps to Scaleform label playback only","timestamp":1782612932268,"segment":2,"confidence":null,"asi":{"hypothesis":"After deleting the invalidated title-cover lane, inspect the native TitleBackViewParts/FadeIn path for a non-removed path update/rebind surface.","static_finding":"Ghidra decompile: FUN_1409a63f0 is just `FUN_140749ae0(param_1+0x88, \"FadeIn\")`. FUN_140749ae0 obtains a Scaleform value object from param_1, checks flags, then calls movie vtable +0x150 with label and zero; it is a generic Scaleform gotoAndPlay(label) wrapper. Xrefs show many generic callers. This path can hide/show or animate an already-resolved surface but does not itself bind a new texture/portrait or expose a resource update bridge.","validation":"Ghidra decompile 0x1409a63f0 and 0x140749ae0; Ghidra xrefs_to 0x140749ae0; run_experiment ./.auto/measure.sh without runtime trigger.","rollback_reason":"Primary metric stayed 0; this was static RE only and no code changes were made.","next_action_hint":"Do not target the FadeIn wrapper as the portrait insertion point. Continue static native search at either constructor-time MenuResource resolution before TitleBackViewParts ctor, or scene graph/model renderer presentation, but not removed path/overlay."}}
{"run":520,"commit":"4dc167b","metric":0,"metrics":{"readiness_gate_failures":0,"target_constants_remaining":0,"helpers_missing":0,"fixed_wait_predicates":0,"autoload_static_failures":0,"asset_chain_failures":0,"dll_patch_failures":0,"native_continue_failures":1,"field58_gate_failures":0,"direct_shortcut_failures":0,"input_path_failures":0,"runtime_proof_failures":1,"runtime_mode_failures":0,"eula_popup_failures":0,"save_data_popup_failures":0,"messagebox_dialog_failures":0,"server_status_failures":0,"title_cover_failures":2,"title_cover_penalty":1800,"native_trace_blockers":0,"native_trace_hits_total":74,"native_trace_unique_breakpoints":11,"false_positives":0,"offline_face_source_ready":1,"removed path_cpu_texture_bridge_ready":0,"offline_face_texture_runtime_drawn":0,"stylized_facedata_pixel_oracle":0,"real_portrait_asset_candidates":0,"profile_placeholder_assets_only":1},"status":"crash","description":"Removing ProfileSelect cover run hook crashes product runtime before ready","timestamp":1782613122987,"segment":2,"confidence":null,"asi":{"hypothesis":"Remove the remaining non-returned 05_010_ProfileSelect/MenuWindowJob replay by not installing `install_title_custom_cover_run_hook`, expecting the known ProfileSelect false-positive surface to disappear while native Continue/load remains intact.","artifact":"/home/banon/projects/er-effects-rs/target/runtime-probe/product-continue-direct-20260627-191743","failure_evidence":"/home/banon/projects/er-effects-rs/target/runtime-probe/product-continue-direct-20260627-191743/readiness-result.json","finding":"Fresh product runtime exited before readiness at ~17.9s. Runtime-probe reason=process_exited_before_ready; t_continue_fired/player/world all null. Telemetry still showed Banon save identity/profile_summary present and loadgame_build_ctx_ready=true, but autoload_attempts=0 and product did not reach Continue/world. Removing only the cover-run installer is not a safe standalone cleanup: it changes runtime behavior or leaves an inconsistent title-cover state.","rollback_reason":"Experiment failed before metric emission and before product proof; crash revert required.","next_action_hint":"Do not remove the ProfileSelect run hook blindly as a one-line change. If deleting that false-positive lane, remove the whole paired build/run/bind telemetry path coherently or first statically identify which side effects the run hook was accidentally preserving for native load."}}
{"run":521,"commit":"4dc167b","metric":0,"metrics":{"readiness_gate_failures":0,"target_constants_remaining":0,"helpers_missing":0,"fixed_wait_predicates":0,"autoload_static_failures":0,"asset_chain_failures":0,"dll_patch_failures":0,"native_continue_failures":0,"field58_gate_failures":0,"direct_shortcut_failures":0,"input_path_failures":0,"runtime_proof_failures":0,"runtime_mode_failures":0,"eula_popup_failures":0,"save_data_popup_failures":0,"messagebox_dialog_failures":0,"server_status_failures":0,"title_cover_failures":2,"title_cover_penalty":1800,"native_trace_blockers":0,"native_trace_hits_total":74,"native_trace_unique_breakpoints":11,"false_positives":0,"offline_face_source_ready":1,"removed path_cpu_texture_bridge_ready":0,"offline_face_texture_runtime_drawn":0,"stylized_facedata_pixel_oracle":0,"real_portrait_asset_candidates":0,"profile_placeholder_assets_only":1},"status":"discard","description":"Preserve ProfileSelect run side effect while disabling false-positive bind/transform mutations","timestamp":1782613269020,"segment":2,"confidence":null,"asi":{"hypothesis":"The previous one-line hook removal crashed because the ProfileSelect one-tick `MenuWindowJob::Run` hook may preserve a runtime side effect. Keep the hook installed and keep the one-tick run, but disable the proven false-positive mutations: no `MENU_DummyProfileFace_01 -> MENU_FL_40135_Profile` rewrite and no SetPosition/SetScale transform of the ProfileSelect value.","artifact":"/home/banon/projects/er-effects-rs/target/runtime-probe/product-continue-direct-20260627-192020","finding":"Runtime reached world_stable with Banon/player_present. `oracle_title_custom_cover_run_calls=1` remained, but `oracle_title_profile_face_transform_applied=false`, `oracle_title_portrait_visible_surface_bound=false`, `oracle_title_profile_cover_bound_to_logo_surface=false`, and false_positives=0. This supports that the one-tick run hook itself is currently coupled to product survival, while the bind rewrite/transform mutations can be disabled without crashing. It still does not provide `oracle_title_portrait_pixels_visible`.","validation":"cargo fmt; bash -n .auto/measure.sh; Steam preflight; run_experiment ./.auto/measure.sh with .auto/run_runtime_probe_once. Runtime artifact reached world_stable and was torn down by the harness.","rollback_reason":"Primary metric stayed 0; this is not a final portrait-cover proof. Discard follows the primary-metric policy even though the secondary false-positive cleanup is informative.","next_action_hint":"Use this finding for a future coherent cleanup: preserve any needed one-tick side effect or replace it with the native side effect directly, but do not restore the ProfileSelect visible-surface rewrite/transform as product proof. Next primary path still needs a native/non-removed path surface that produces real portrait pixels."}}
{"run":522,"commit":"4dc167b","metric":0,"metrics":{"readiness_gate_failures":0,"target_constants_remaining":0,"helpers_missing":0,"fixed_wait_predicates":0,"autoload_static_failures":0,"asset_chain_failures":0,"dll_patch_failures":0,"native_continue_failures":0,"field58_gate_failures":0,"direct_shortcut_failures":0,"input_path_failures":0,"runtime_proof_failures":0,"runtime_mode_failures":0,"eula_popup_failures":0,"save_data_popup_failures":0,"messagebox_dialog_failures":0,"server_status_failures":0,"title_cover_failures":2,"title_cover_penalty":1800,"native_trace_blockers":0,"native_trace_hits_total":74,"native_trace_unique_breakpoints":11,"false_positives":0,"offline_face_source_ready":1,"removed path_cpu_texture_bridge_ready":0,"offline_face_texture_runtime_drawn":0,"stylized_facedata_pixel_oracle":0,"real_portrait_asset_candidates":0,"profile_placeholder_assets_only":1},"status":"discard","description":"Static RE identifies ProfileSelect one-tick run as MenuWindow/CSMenuMan side-effect path","timestamp":1782613362636,"segment":2,"confidence":null,"asi":{"hypothesis":"The previous one-line ProfileSelect hook removal crashed because the ProfileSelect one-tick run may preserve a native MenuWindow/CSMenuMan/job-result side effect. Statically decode the wrapper and Run path before another mutation.","static_finding":"Ghidra: ProfileSelect wrapper dump 0x14081f7e0 builds CSScaleformLoadInfo filename L\"05_010_ProfileSelect\" and calls FUN_1407acbf0. Grounded MenuWindowJob::Run deobf 0x1407ad1c0 -> dump 0x1407ad2b0: when owningMenuWindow is null it loads Scaleform, invokes load-result/window callbacks, stores owningMenuWindow, sets CSMenuMan field90 bits, calls FUN_140814fc0/FUN_140744ed0/FUN_140733ff0, handles field7_0xf0 behavior, and propagates owningMenuWindow.field254_0x1e8 MenuJobResult. Caller FUN_1409ad230 chains the ProfileSelect job into a larger sequence with decision/dialogue jobs. This explains why removing the whole hook can disturb product progress even though the visible ProfileSelect panel is false proof.","memory_recorded":"bd remember profileselect-run-side-effect-static-2026-06-27","validation":"Ghidra decompile 0x14081f7e0, grounded deobf->dump for MenuWindowJob::Run with scripts/dump-deobf-shift.py --reverse 0x1407ad1c0, Ghidra decompile 0x1407ad2b0 and 0x1409ad230, then run_experiment ./.auto/measure.sh without runtime trigger.","rollback_reason":"Primary metric stayed 0; this was static RE triage, not a visible portrait-cover implementation.","next_action_hint":"Instrument or statically isolate which of MenuWindowJob::Run's side effects is required (owningMenuWindow creation, CSMenuMan field90 marking, FUN_140744ed0/FUN_140733ff0, or job-result propagation), then replace only that semantic side effect if deleting ProfileSelect replay. Final product still needs a native/non-removed path portrait surface and pixel/native oracle."}}
