{"run":568,"commit":"4dc167b","metric":0,"metrics":{"readiness_gate_failures":0,"target_constants_remaining":0,"helpers_missing":0,"fixed_wait_predicates":0,"autoload_static_failures":0,"asset_chain_failures":0,"dll_patch_failures":0,"native_continue_failures":0,"field58_gate_failures":0,"direct_shortcut_failures":0,"input_path_failures":0,"runtime_proof_failures":1,"runtime_mode_failures":0,"eula_popup_failures":0,"save_data_popup_failures":0,"messagebox_dialog_failures":0,"server_status_failures":0,"title_cover_failures":2,"title_cover_penalty":1800,"native_trace_blockers":0,"native_trace_hits_total":74,"native_trace_unique_breakpoints":11,"false_positives":0,"offline_face_source_ready":1,"removed path_cpu_texture_bridge_ready":0,"offline_face_texture_runtime_drawn":0,"stylized_facedata_pixel_oracle":0,"real_portrait_asset_candidates":0,"profile_placeholder_assets_only":1},"status":"crash","description":"Profile model part-update hook caused process exit before ready.","timestamp":1782629276797,"segment":2,"confidence":null,"asi":{"hypothesis":"Hook the CSChrAsmModelIns part-update helper at deobf 0x1409ec9a0 to observe downstream assembled-character model updates for the CSMenuProfModelRend profile source, while keeping ProfileSelect replay removed and not injecting or shortcutting load.","observed_evidence":"Runtime artifact target/runtime-probe/product-continue-direct-20260627-234711 failed with readiness reason process_exited_before_ready; telemetry had oracle_title_profile_model_part_update_calls=0, profile_render_refresh_gate_ready=true, loadgame_build_ctx_ready=true, no MessageBox builds, and process exited before world-stable.","rollback_reason":"The hook target/path caused or coincided with premature process exit before it produced any useful downstream model-update evidence; primary metric unavailable/0 and runtime proof failed.","next_action_hint":"Do not retry 0x1409ec9a0 as a MinHook detour without static prologue/ABI validation. Use static RE of CSMenuProfModelRend vtable/update first, or use the new linux-x86-debug attach trace/list-modules/inject path for observe-only breakpoints before DLL hooks. Note: the advertised new AGENTS.md linux-x86-debug section was not present in this worktree when searched for heading/text, so re-check the file before using the toolkit."}}
{"run":569,"commit":"4dc167b","metric":0,"metrics":{"readiness_gate_failures":0,"target_constants_remaining":0,"helpers_missing":0,"fixed_wait_predicates":0,"autoload_static_failures":0,"asset_chain_failures":0,"dll_patch_failures":0,"native_continue_failures":0,"field58_gate_failures":0,"direct_shortcut_failures":0,"input_path_failures":0,"runtime_proof_failures":1,"runtime_mode_failures":0,"eula_popup_failures":0,"save_data_popup_failures":0,"messagebox_dialog_failures":0,"server_status_failures":0,"title_cover_failures":2,"title_cover_penalty":1800,"native_trace_blockers":0,"native_trace_hits_total":74,"native_trace_unique_breakpoints":11,"false_positives":0,"offline_face_source_ready":1,"removed path_cpu_texture_bridge_ready":0,"offline_face_texture_runtime_drawn":0,"stylized_facedata_pixel_oracle":0,"real_portrait_asset_candidates":0,"profile_placeholder_assets_only":1},"status":"crash","description":"Profile renderer update vtable-slot observer exited before ready despite recording dynamic slots.","timestamp":1782629489766,"segment":2,"confidence":null,"asi":{"hypothesis":"Hook only CSMenuProfModelRend update at deobf 0x140bba730 observe-only, record dynamic vtable +0xc0/+0xc8 targets and model/offscreen fields, and avoid downstream helper detours or ProfileSelect replay.","observed_evidence":"Runtime artifact target/runtime-probe/product-continue-direct-20260627-235042 failed process_exited_before_ready but telemetry captured oracle_title_profile_renderer_update_profile_source_calls=830, last_vtable_c0=0x140bba6d0, last_vtable_c8=0x140bbe380, last_tex_rescap=0x7fffa18fcbe0, and model_778/model_948 were None.","rollback_reason":"Runtime exited before ready, so the observer was not product-safe as implemented even though it captured the dynamic vtable targets; primary score remained 0 and runtime proof failed.","next_action_hint":"Use the captured dynamic slot targets as static evidence: vtable +0xc0 resolves to deobf 0x140bba6d0 and +0xc8 to deobf 0x140bbe380. Do not keep MinHooking profile-render update in product runtime; next use static RE/disasm or attach tracebreakpoints for those targets, or restore the prior safer #566 update hook shape if only source ticks are needed."}}
{"run":570,"commit":"4dc167b","metric":0,"metrics":{"readiness_gate_failures":0,"target_constants_remaining":0,"helpers_missing":0,"fixed_wait_predicates":0,"autoload_static_failures":0,"asset_chain_failures":0,"dll_patch_failures":0,"native_continue_failures":0,"field58_gate_failures":0,"direct_shortcut_failures":0,"input_path_failures":0,"runtime_proof_failures":0,"runtime_mode_failures":0,"eula_popup_failures":0,"save_data_popup_failures":0,"messagebox_dialog_failures":0,"server_status_failures":0,"title_cover_failures":2,"title_cover_penalty":1800,"native_trace_blockers":0,"native_trace_hits_total":74,"native_trace_unique_breakpoints":11,"false_positives":0,"offline_face_source_ready":1,"removed path_cpu_texture_bridge_ready":0,"offline_face_texture_runtime_drawn":0,"stylized_facedata_pixel_oracle":0,"real_portrait_asset_candidates":0,"profile_placeholder_assets_only":1},"status":"discard","description":"Runtime-safe one-shot profile source field sampling captured vtable slots without hooks; primary stayed 0.","timestamp":1782629695153,"segment":2,"confidence":null,"asi":{"hypothesis":"Avoid high-frequency MinHook detours and instead extend the existing safe one-shot profile portrait source sampler to read CSMenuProfModelRend vtable +0xc0/+0xc8 and model fields +0x778/+0x948 after post-SL2 refresh, while removing the known-falsified ProfileSelect replay.","observed_evidence":"Runtime artifact target/runtime-probe/product-continue-direct-20260627-235403 passed world_stable with false_positives=0. Telemetry captured oracle_title_custom_cover_profile_source_vtable_c0=0x140bba6d0, vtable_c8=0x140bbe380, tex_index=0, tex_rescap=0x7fff4b8bc640, and model_778/model_948=None at the sampling point.","rollback_reason":"Primary metric stayed 0 because this is source/field evidence only; it still does not prove a title-safe visible cover surface consumes the loaded-character portrait pixels.","next_action_hint":"Use the no-hook sampled fields as stable evidence. Since model_778/model_948 are None at the refresh sample, the portrait path may be offscreen texture/resource-only at that moment; next statically inspect deobf 0x140bba6d0 and 0x140bbe380 / the vtable methods rather than detouring them, and find the resource consumer that resolves SYSTEX_Menu_Profile00 from TexRepository into Scaleform/native surface."}}
{"run":571,"commit":"4dc167b","metric":0,"metrics":{"readiness_gate_failures":0,"target_constants_remaining":0,"helpers_missing":0,"fixed_wait_predicates":0,"autoload_static_failures":0,"asset_chain_failures":0,"dll_patch_failures":0,"native_continue_failures":0,"field58_gate_failures":0,"direct_shortcut_failures":0,"input_path_failures":0,"runtime_proof_failures":0,"runtime_mode_failures":0,"eula_popup_failures":0,"save_data_popup_failures":0,"messagebox_dialog_failures":0,"server_status_failures":0,"title_cover_failures":2,"title_cover_penalty":1800,"native_trace_blockers":0,"native_trace_hits_total":74,"native_trace_unique_breakpoints":11,"false_positives":0,"offline_face_source_ready":1,"removed path_cpu_texture_bridge_ready":0,"offline_face_texture_runtime_drawn":0,"stylized_facedata_pixel_oracle":0,"real_portrait_asset_candidates":0,"profile_placeholder_assets_only":1},"status":"discard","description":"Runtime-safe post-refresh profile source sampling still found no model fields; primary stayed 0.","timestamp":1782629913678,"segment":2,"confidence":null,"asi":{"hypothesis":"Move the safe profile source sample to after the post-SL2 profile render refresh, record CSMenuProfModelRend vtable +0xc0/+0xc8 and model fields +0x778/+0x948 without high-frequency hooks, and remove the known-falsified ProfileSelect replay.","observed_evidence":"Runtime artifact target/runtime-probe/product-continue-direct-20260627-235738 passed world_stable with false_positives=0. Telemetry still showed model_778=None and model_948=None after refresh; vtable_c0=0x140bba6d0, vtable_c8=0x140bbe380, tex_index=0, tex_rescap=0x7fffa18fcc40.","rollback_reason":"Primary metric stayed 0; post-refresh source sampling is still producer-side evidence only and no visible title-safe cover surface consumes the loaded-character portrait pixels.","next_action_hint":"Stop expecting model_778/model_948 to identify the visible portrait surface at sample time. Follow the resource path: statically decode the TexRepository/CSRuntimeTexResCap consumer for SYSTEX_Menu_Profile00 or use linux-x86-debug attach/list_modules/inject as a passive runtime path before further DLL hooks."}}
{"run":572,"commit":"4dc167b","metric":0,"metrics":{"readiness_gate_failures":0,"target_constants_remaining":0,"helpers_missing":0,"fixed_wait_predicates":0,"autoload_static_failures":0,"asset_chain_failures":0,"dll_patch_failures":0,"native_continue_failures":0,"field58_gate_failures":0,"direct_shortcut_failures":0,"input_path_failures":0,"runtime_proof_failures":0,"runtime_mode_failures":0,"eula_popup_failures":0,"save_data_popup_failures":0,"messagebox_dialog_failures":0,"server_status_failures":0,"title_cover_failures":2,"title_cover_penalty":1800,"native_trace_blockers":0,"native_trace_hits_total":74,"native_trace_unique_breakpoints":11,"false_positives":0,"offline_face_source_ready":1,"removed path_cpu_texture_bridge_ready":0,"offline_face_texture_runtime_drawn":0,"stylized_facedata_pixel_oracle":0,"real_portrait_asset_candidates":0,"profile_placeholder_assets_only":1},"status":"discard","description":"Static RE decoded profile-renderer vtable slots and TexRepository insertion path; primary stayed 0.","timestamp":1782630084902,"segment":2,"confidence":null,"asi":{"hypothesis":"Use static RE rather than more risky MinHook runtime detours to decode the stable CSMenuProfModelRend vtable +0xc0/+0xc8 targets and TexRepository CSRuntimeTexResCap insertion path, then measure without a runtime launch.","observed_evidence":"Ghidra shows CSMenuProfModelRend vtable +0xc0 resolves to dump 0x140bba7c0 / deobf 0x140bba6d0, a generic FD4 step/update dispatcher thunk; +0xc8 resolves to dump 0x140bbe470 / deobf 0x140bbe380, a no-op. TexRepositoryImp::InsertCSRuntimeTexResCapIfNotExists at dump 0x1401e9760 registers CSEzOffscreenRend runtime texture caps via FD4ResCapHolder; xrefs found were producer-side insertions, not the visible SYSTEX consumer. Finding saved to bd memory profile-renderer-vtable-texrepository-static-2026-06-28.","rollback_reason":"Primary metric stayed 0; this static RE improves direction but does not implement or prove a visible title-safe portrait surface consuming the loaded-character portrait pixels.","next_action_hint":"Stop chasing CSMenuProfModelRend model fields or +0xc0/+0xc8 detours. Next target FD4ResCapHolder/TexRepository lookup or Scaleform bind consumer paths for SYSTEX_Menu_Profile00, ideally with attach/list_modules/inject only after static lookup candidates are known."}}
{"run":573,"commit":"4dc167b","metric":0,"metrics":{"readiness_gate_failures":0,"target_constants_remaining":0,"helpers_missing":0,"fixed_wait_predicates":0,"autoload_static_failures":0,"asset_chain_failures":0,"dll_patch_failures":0,"native_continue_failures":0,"field58_gate_failures":0,"direct_shortcut_failures":0,"input_path_failures":0,"runtime_proof_failures":0,"runtime_mode_failures":0,"eula_popup_failures":0,"save_data_popup_failures":0,"messagebox_dialog_failures":0,"server_status_failures":0,"title_cover_failures":2,"title_cover_penalty":1800,"native_trace_blockers":0,"native_trace_hits_total":74,"native_trace_unique_breakpoints":11,"false_positives":0,"offline_face_source_ready":1,"removed path_cpu_texture_bridge_ready":0,"offline_face_texture_runtime_drawn":0,"stylized_facedata_pixel_oracle":0,"real_portrait_asset_candidates":0,"profile_placeholder_assets_only":1},"status":"discard","description":"Static RE mapped FD4ResCap lookup and Scaleform texture bind helper; primary stayed 0.","timestamp":1782630244549,"segment":2,"confidence":null,"asi":{"hypothesis":"Static RE the resource-cap lookup and Scaleform binding consumer paths for SYSTEX_Menu_Profile00 before any new runtime hook, because TexRepository insertion and profile renderer model fields are producer-side dead ends.","observed_evidence":"Ghidra decompiled FD4ResCapHolder::GetResCap<T> at 0x142650f90 as generic hash/name resource cap lookup. TexRepositoryImp::InsertCSRuntimeTexResCapIfNotExists calls it only for insert/existing producer registration. FUN_1407452c0 validates symbol/target pair strings, resets owner+0x60 via 0x140748700, then calls CSScaleform bind apply FUN_140d6ac00(GLOBAL_CSScaleform, owner, target_string, symbol_string); xrefs include ProfileSelect/other menu constructors, but bind observer hits are absent once ProfileSelect replay is removed. Finding saved as bd memory texrepository-systex-consumer-static-2026-06-28.","rollback_reason":"Primary metric stayed 0; this static RE improved target selection but did not implement or prove a visible title-safe portrait surface consuming loaded-character pixels.","next_action_hint":"Next target the concrete CSScaleform bind apply semantics at FUN_140d6ac00/FUN_140d6ab50 or the native menu constructor that builds a resource with dummy-profile symbols. Do not chase TexRepository insertion or CSMenuProfModelRend model fields further."}}
{"run":574,"commit":"4dc167b","metric":0,"metrics":{"readiness_gate_failures":0,"target_constants_remaining":0,"helpers_missing":0,"fixed_wait_predicates":0,"autoload_static_failures":0,"asset_chain_failures":0,"dll_patch_failures":0,"native_continue_failures":0,"field58_gate_failures":0,"direct_shortcut_failures":0,"input_path_failures":0,"runtime_proof_failures":0,"runtime_mode_failures":0,"eula_popup_failures":0,"save_data_popup_failures":0,"messagebox_dialog_failures":0,"server_status_failures":0,"title_cover_failures":2,"title_cover_penalty":1800,"native_trace_blockers":0,"native_trace_hits_total":74,"native_trace_unique_breakpoints":11,"false_positives":0,"offline_face_source_ready":1,"removed path_cpu_texture_bridge_ready":0,"offline_face_texture_runtime_drawn":0,"stylized_facedata_pixel_oracle":0,"real_portrait_asset_candidates":0,"profile_placeholder_assets_only":1},"status":"discard","description":"Static RE decoded CSScaleform bind-apply internals; primary stayed 0.","timestamp":1782630413904,"segment":2,"confidence":null,"asi":{"hypothesis":"Statically decode FUN_140d6ac00/FUN_140d7c0c0/FUN_140d7be60 bind-apply semantics before another runtime hook, to understand why direct late SYSTEX binding crashes/fails and what a live dummy-profile GFx target must provide.","observed_evidence":"FUN_140d6ac00 only locks the Scaleform workpool mutex and calls FUN_140d7c0c0 through GLOBAL_CSScaleform+8. FUN_140d7c0c0 validates a live GFx owner/resource, converts target/symbol names through FUN_140d7c850, resolves the symbol/display object, then calls FUN_140d7be60. FUN_140d7be60 checks the display object is texture-like, adjusts transform/size, and calls FUN_140d60950 to swap/refcount the target texture into object+0x48. Deobf mappings: d7c0c0=0x140d7c010, d7c850=0x140d7c7a0, d7be60=0x140d7bdb0, d60950=0x140d608a0. Saved to bd memory csscaleform-bind-apply-static-2026-06-28.","rollback_reason":"Primary metric stayed 0; this is static RE direction only and does not yet implement/prove a visible loaded-character portrait surface.","next_action_hint":"Do not raw-call bind apply against TitleBackViewParts strings. Next identify or construct a live GFx object/resource containing dummy-profile texture symbols, then bind SYSTEX_Menu_Profile00 through the normal owner/resource path."}}
{"run":575,"commit":"4dc167b","metric":0,"metrics":{"readiness_gate_failures":0,"target_constants_remaining":0,"helpers_missing":0,"fixed_wait_predicates":0,"autoload_static_failures":0,"asset_chain_failures":0,"dll_patch_failures":0,"native_continue_failures":0,"field58_gate_failures":0,"direct_shortcut_failures":0,"input_path_failures":0,"runtime_proof_failures":0,"runtime_mode_failures":0,"eula_popup_failures":0,"save_data_popup_failures":0,"messagebox_dialog_failures":0,"server_status_failures":0,"title_cover_failures":2,"title_cover_penalty":1800,"native_trace_blockers":0,"native_trace_hits_total":74,"native_trace_unique_breakpoints":11,"false_positives":0,"offline_face_source_ready":1,"removed path_cpu_texture_bridge_ready":0,"offline_face_texture_runtime_drawn":0,"stylized_facedata_pixel_oracle":0,"real_portrait_asset_candidates":0,"profile_placeholder_assets_only":1},"status":"discard","description":"Static RE mapped ProfileSelect GFx owner for dummy-profile bindings; primary stayed 0.","timestamp":1782630515492,"segment":2,"confidence":null,"asi":{"hypothesis":"Static RE the native ProfileSelect/dummy-profile binding constructor path to identify the valid live GFx owner/resource object for MENU_DummyProfileFace_* -> SYSTEX_Menu_Profile* bindings, avoiding another runtime replay or raw bind call.","observed_evidence":"ProfileSelectDialog constructor FUN_1409a5310 initializes GenericListSelectDialog/ProfileSelectDialog and BaseChangeDstSelectDialog GFx value on the passed SceneObjProxy, then binds MENU_DummyProfileFace_01..10 to SYSTEX_Menu_Profile00..09 through FUN_1407452c0 on owner param_1+0x3b8. FUN_14099b7f0 is a wrapper for FUN_1407452c0(param_1+0x3b8,pair). ChrMakePreviewWindow FUN_1408acd20 uses the same pattern for SYSTEX_Menu_ChrMakePreview dummy symbols. Finding saved to bd memory profileselect-gfx-owner-static-2026-06-28.","rollback_reason":"Primary metric stayed 0; this is static RE direction only and does not yet implement or prove a non-blocking title-safe portrait surface.","next_action_hint":"Construct or attach a title-safe ProfileSelect-like/custom MenuWindow/GFx owner with dummy-profile symbols and bind SYSTEX_Menu_Profile00 through its own +0x3b8 owner. Do not replay full blocking ProfileSelect or bind against TitleBackViewParts+0x8."}}
{"run":576,"commit":"4dc167b","metric":0,"metrics":{"readiness_gate_failures":0,"target_constants_remaining":0,"helpers_missing":0,"fixed_wait_predicates":0,"autoload_static_failures":0,"asset_chain_failures":0,"dll_patch_failures":0,"native_continue_failures":0,"field58_gate_failures":0,"direct_shortcut_failures":0,"input_path_failures":0,"runtime_proof_failures":0,"runtime_mode_failures":0,"eula_popup_failures":0,"save_data_popup_failures":0,"messagebox_dialog_failures":0,"server_status_failures":0,"title_cover_failures":2,"title_cover_penalty":1800,"native_trace_blockers":0,"native_trace_hits_total":74,"native_trace_unique_breakpoints":11,"false_positives":0,"offline_face_source_ready":1,"removed path_cpu_texture_bridge_ready":0,"offline_face_texture_runtime_drawn":0,"stylized_facedata_pixel_oracle":0,"real_portrait_asset_candidates":0,"profile_placeholder_assets_only":1},"status":"discard","description":"Static RE shows ProfileLoad constructor path is modal/list active, not safe to replay wholesale.","timestamp":1782630620749,"segment":2,"confidence":null,"asi":{"hypothesis":"Map the direct constructor/caller context for ProfileSelect/ProfileLoad so the next native-surface implementation can reuse the valid GFx resource owner without replaying the known blocking ProfileSelect path.","observed_evidence":"FUN_1409a5310 has two direct constructor callers: FUN_1409a2f30 ProfileDeleteDialog and FUN_1409a3ee0 ProfileLoadDialog. Both assign SceneObjProxy component ProfileList/ItemList/ItemList/ItemList before calling the shared ProfileSelectDialog constructor. FUN_1409a3ee0 sets CS::ProfileLoadDialog vtable, text id 0x631f0, selects GetMenuSystemSaveLoad()->saveSlot through FUN_1409a6070, and installs callbacks/jobs through FUN_1407574d0 and FUN_140744590. FUN_1409a52b0/FUN_1409a2e40 wire/refresh dialog list-selection subobjects. Finding saved to bd memory profileselect-load-dialog-constructor-static-2026-06-28.","rollback_reason":"Primary metric stayed 0; this was static RE and no visible portrait surface/oracle was implemented.","next_action_hint":"Do not replay ProfileLoadDialog/ProfileSelect wholesale. Reuse the +0x3b8 resource owner/binding/GFx symbol pattern in a custom or stripped title-safe owner that avoids modal list selection callbacks/jobs."}}
