{"run":551,"commit":"4dc167b","metric":0,"metrics":{"readiness_gate_failures":0,"target_constants_remaining":0,"helpers_missing":0,"fixed_wait_predicates":0,"autoload_static_failures":0,"asset_chain_failures":0,"dll_patch_failures":0,"native_continue_failures":0,"field58_gate_failures":0,"direct_shortcut_failures":0,"input_path_failures":0,"runtime_proof_failures":0,"runtime_mode_failures":0,"eula_popup_failures":0,"save_data_popup_failures":0,"messagebox_dialog_failures":0,"server_status_failures":0,"title_cover_failures":2,"title_cover_penalty":1800,"native_trace_blockers":0,"native_trace_hits_total":74,"native_trace_unique_breakpoints":11,"false_positives":1,"offline_face_source_ready":1,"removed path_cpu_texture_bridge_ready":0,"offline_face_texture_runtime_drawn":0,"stylized_facedata_pixel_oracle":0,"real_portrait_asset_candidates":0,"profile_placeholder_assets_only":1},"status":"discard","description":"Early pass-through Scaleform FileOpener observer installs and sees native GFX opens","timestamp":1782622378063,"segment":2,"confidence":null,"asi":{"hypothesis":"Move the synthetic Scaleform FileOpener hook install earlier at DLL startup under the explicit env gate, as a pass-through observer only, to distinguish hook installation/native FileOpener reachability from synthetic URL request failure.","implementation":"Added minimal constants and counters for `SCALEFORM_SYNTHETIC_OPEN_RVA`, synthetic URL text, original trampoline, installed/calls/hits/last-url/last-ret. Added `scaleform_synthetic_titleback_enabled`, `scaleform_synthetic_open_observer_hook`, and `install_scaleform_synthetic_open_hook` in startup hooks. The hook is pass-through and does not override or return custom GFX bytes; it only increments hits if the native URL equals `menu:/er_effects_portrait_cover.gfx` or `menu:/Win/er_effects_portrait_cover.gfx`. Installed it from lib.rs at attach when `ER_EFFECTS_SCALEFORM_SYNTHETIC_TITLEBACK=1`. Added telemetry JSON fields for the observer counters.","validation":"`cargo fmt && cargo xwin check --target x86_64-pc-windows-msvc -q` passed. Runtime probe `ER_EFFECTS_SCALEFORM_SYNTHETIC_TITLEBACK=1 ./.auto/measure.sh` completed in 28.3s within cap. Artifact `/home/banon/projects/er-effects-rs/target/runtime-probe/product-continue-direct-20260627-215125` reached world_stable. Telemetry: `oracle_scaleform_synthetic_open_installed=1`, `open_calls=113`, `open_hits=0`, `open_last_ret=140731422178272`, `open_last_url=140731421828972`. Screenshot analysis remained known false positive: `known_false_positive_signature=true`, black32_ratio=0.4729068972254787, portrait_sane=false. Measure score remained 0 with false_positives=1.","runtime_artifact":"/home/banon/projects/er-effects-rs/target/runtime-probe/product-continue-direct-20260627-215125","memory_recorded":"bd remember scaleform-fileopener-startup-observer-proven-2026-06-28","rollback_reason":"Primary metric stayed 0 and false_positives=1. This run proved the early FileOpener hook can install and observe native GFX opens, but no native code requested the synthetic URL and no custom bytes were returned. Keeping pass-through observer code alone is not a product improvement.","next_action_hint":"Now that early FileOpener hooking is proven, add a separate guaranteed request path for the synthetic URL: either construct/attach owned TitleBackViewParts from a title-dialog hook/telemetry point that actually runs, or hook an existing TitleBack/MenuResource construction point to substitute the filename under explicit gate. Only then test MemoryFile returns; still do not score without visible loaded-character portrait evidence."}}
{"run":552,"commit":"4dc167b","metric":0,"metrics":{"readiness_gate_failures":0,"target_constants_remaining":0,"helpers_missing":0,"fixed_wait_predicates":0,"autoload_static_failures":0,"asset_chain_failures":0,"dll_patch_failures":0,"native_continue_failures":0,"field58_gate_failures":0,"direct_shortcut_failures":0,"input_path_failures":0,"runtime_proof_failures":0,"runtime_mode_failures":0,"eula_popup_failures":0,"save_data_popup_failures":0,"messagebox_dialog_failures":0,"server_status_failures":0,"title_cover_failures":2,"title_cover_penalty":1800,"native_trace_blockers":0,"native_trace_hits_total":74,"native_trace_unique_breakpoints":11,"false_positives":1,"offline_face_source_ready":1,"removed path_cpu_texture_bridge_ready":0,"offline_face_texture_runtime_drawn":0,"stylized_facedata_pixel_oracle":0,"real_portrait_asset_candidates":0,"profile_placeholder_assets_only":1},"status":"discard","description":"Byte-identical 05_000_Title GFX MemoryFile override proves Scaleform seam","timestamp":1782622772990,"segment":2,"confidence":null,"asi":{"hypothesis":"Under explicit diagnostic gate, intercept an existing native 05_000_Title GFX request and return byte-identical extracted 05_000_title.gfx bytes from a native Scaleform MemoryFile. If the screen looks unchanged while telemetry shows memoryfile_returns>0, that proves the FileOpener/MemoryFile seam safely without pretending to be portrait proof.","implementation":"Added gated FileOpener override at 0x140d6b4d0. For URLs containing `05_000_title.gfx`, allocate 0x30 bytes through native allocator singleton 0x144593250 vfunc+0x50, build a Scaleform string ref with 0x141141390, call native MemoryFile ctor 0x140ce7bb0 with embedded extracted `/home/banon/er-extract/nuxe-menu-20260619-170932/menu/05_000_title.gfx` bytes, and return that File. All other URLs pass through original. Added telemetry for installed/open_calls/title_gfx_hits/memoryfile_returns/alloc_failures/last_url/last_ret. Installed at DLL attach under `ER_EFFECTS_SCALEFORM_SYNTHETIC_TITLEBACK=1`.","validation":"`cargo fmt && cargo xwin check --target x86_64-pc-windows-msvc -q` passed. Runtime probe `ER_EFFECTS_SCALEFORM_SYNTHETIC_TITLEBACK=1 ./.auto/measure.sh` completed in 27.8s within cap. Artifact `/home/banon/projects/er-effects-rs/target/runtime-probe/product-continue-direct-20260627-215729`. Telemetry: `oracle_scaleform_synthetic_open_installed=1`, `open_calls=113`, `title_gfx_hits=1`, `memoryfile_returns=1`, `alloc_failures=0`, `open_last_ret=140734967965168`. The screen looked unchanged because the returned GFX bytes were byte-identical title bytes; this is good seam proof. Score stayed 0 and false_positives=1 because no portrait/custom surface was rendered and the known ProfileSelect false-positive remained. Screenshot analysis: known_false_positive_signature=true, black32_ratio=0.4579327862446268, portrait_sane=false.","runtime_artifact":"/home/banon/projects/er-effects-rs/target/runtime-probe/product-continue-direct-20260627-215729","memory_recorded":"bd remember scaleform-title-gfx-memoryfile-override-proven-2026-06-28","rollback_reason":"Primary metric stayed 0 and false_positives=1. The seam proof is valuable but still returns the same native title GFX, not a loaded-character portrait/custom surface. Keeping diagnostic override code alone is not a product improvement.","next_action_hint":"Use the proven FileOpener->MemoryFile seam to return a deliberately different known-good GFX under explicit diagnostic gate, or request a synthetic/custom GFX URL from an owned TitleBack/MenuResource path. Then evolve payload toward a full-screen loaded-character portrait/stats surface; do not score until visible portrait evidence is real."}}
{"run":553,"commit":"4dc167b","metric":0,"metrics":{"readiness_gate_failures":0,"target_constants_remaining":0,"helpers_missing":0,"fixed_wait_predicates":0,"autoload_static_failures":0,"asset_chain_failures":0,"dll_patch_failures":0,"native_continue_failures":0,"field58_gate_failures":0,"direct_shortcut_failures":0,"input_path_failures":0,"runtime_proof_failures":0,"runtime_mode_failures":0,"eula_popup_failures":0,"save_data_popup_failures":0,"messagebox_dialog_failures":0,"server_status_failures":0,"title_cover_failures":2,"title_cover_penalty":1800,"native_trace_blockers":0,"native_trace_hits_total":74,"native_trace_unique_breakpoints":11,"false_positives":1,"offline_face_source_ready":1,"removed path_cpu_texture_bridge_ready":0,"offline_face_texture_runtime_drawn":0,"stylized_facedata_pixel_oracle":0,"real_portrait_asset_candidates":0,"profile_placeholder_assets_only":1},"status":"crash","description":"Visible ProfileSelect GFX shell swap proves MemoryFile substitution affects surface but times out","timestamp":1782623161387,"segment":2,"confidence":null,"asi":{"hypothesis":"Use the proven FileOpener->MemoryFile seam to return a deliberately different known-good native GFX (`05_010_ProfileSelect.gfx`) for an existing `05_000_Title.gfx` request under explicit diagnostic gate. This tests whether GFX shell substitution changes the visible title surface, without claiming portrait proof.","implementation":"Added gated FileOpener override at 0x140d6b4d0. For native title GFX URLs containing `05_000_title.gfx`, allocate a native MemoryFile and return embedded extracted `/home/banon/er-extract/nuxe-menu-20260619-170932/menu/05_010_profileselect.gfx` bytes with name `menu:/Win/05_010_ProfileSelect.gfx`; all other URLs pass through. Installed at DLL attach under `ER_EFFECTS_SCALEFORM_SYNTHETIC_TITLEBACK=1`, with telemetry for installed/open_calls/title_gfx_hits/memoryfile_returns/alloc_failures/last_url/last_ret.","validation":"`cargo fmt && cargo xwin check --target x86_64-pc-windows-msvc -q` passed. Runtime command `ER_EFFECTS_SCALEFORM_SYNTHETIC_TITLEBACK=1 ./.auto/measure.sh` ran 40.5s and failed by timeout (`ready=false`, `reason=timeout_seconds_budget_exhausted`). Artifact `/home/banon/projects/er-effects-rs/target/runtime-probe/product-continue-direct-20260627-220336`. Telemetry proves substitution executed: `oracle_scaleform_synthetic_open_installed=1`, `open_calls=113`, `title_gfx_hits=1`, `memoryfile_returns=1`, `alloc_failures=0`. User-visible screenshot showed ProfileSelect shell rows/placeholder data on the title surface, confirming the MemoryFile override changes the rendered GFX shell. No exact Elden Ring processes remained afterward.","runtime_artifact":"/home/banon/projects/er-effects-rs/target/runtime-probe/product-continue-direct-20260627-220336","memory_recorded":"bd remember scaleform-profileselect-shell-swap-visible-2026-06-28","rollback_reason":"Runtime timed out and product proof did not reach world-stable. The visual shell was a placeholder ProfileSelect GFX layout, not the loaded character portrait, and `oracle_title_custom_cover_run_calls=0` / loaded_character_portrait_rendered=false indicate the real profile model/data composite was not wired by the GFX swap alone.","next_action_hint":"Treat FileOpener MemoryFile substitution as proven. Do not assume 05_010_profileselect.gfx contains the profile scene/model; next identify the native ProfileSelect data/model binding path or build/request a custom GFX shell and separately feed it the profile renderer/model source. Keep the seam, but final scoring still needs real visible loaded-character portrait evidence and world-stable load."}}
{"run":554,"commit":"4dc167b","metric":0,"metrics":{"readiness_gate_failures":0,"target_constants_remaining":0,"helpers_missing":0,"fixed_wait_predicates":0,"autoload_static_failures":0,"asset_chain_failures":0,"dll_patch_failures":0,"native_continue_failures":0,"field58_gate_failures":0,"direct_shortcut_failures":0,"input_path_failures":0,"runtime_proof_failures":0,"runtime_mode_failures":0,"eula_popup_failures":0,"save_data_popup_failures":0,"messagebox_dialog_failures":0,"server_status_failures":0,"title_cover_failures":3,"title_cover_penalty":2000,"native_trace_blockers":0,"native_trace_hits_total":74,"native_trace_unique_breakpoints":11,"false_positives":1,"offline_face_source_ready":1,"removed path_cpu_texture_bridge_ready":0,"offline_face_texture_runtime_drawn":0,"stylized_facedata_pixel_oracle":0,"real_portrait_asset_candidates":0,"profile_placeholder_assets_only":1},"status":"discard","description":"Static RE separates ProfileSelect GFX shell from native SYSTEX/profile binding","timestamp":1782623445941,"segment":2,"confidence":null,"asi":{"hypothesis":"After runtime #553 proved 05_010_ProfileSelect.gfx shell swap is visible but placeholder-only, statically determine whether the profile rows/models are native-filled outside the GFX shell and identify the binding seam.","implementation":"Used Ghidra dump first with deobf->dump grounding. Mapped live/deobf profile refresh 0x1409aa680 to dump 0x1409aa7d0 and decompiled it. Decompiled helper calls and ProfileSelect dialog constructor `FUN_1409a5310`, plus bind helper `FUN_1407452c0`. No code mutation was needed for this static RE iteration.","validation":"Static evidence: `FUN_1409aa7d0` calls `GameDataMan::GetProfileSummary`, loops slots 0..9, reads slot record via `FUN_140261c30`, checks `FUN_140875840(slot)` plus renderer ready bytes `+0x754/+0x755`, then feeds `CSMenuProfModelRend` table `DAT_143d6d8d0` with equipment/model data (`FUN_140bbe290(record+0x1a8)`), FaceData (`CS::FaceData::GetFaceDataBuffer(record+0x38)` -> `FUN_140bb9950`), flags `+0x290/+0x294`, and texture index `slot*2` via `FUN_140bb8cf0`. `FUN_1409a5310` constructs `CS::ProfileSelectDialog` and binds `MENU_DummyProfileFace_01..10` to `SYSTEX_Menu_Profile00..09` through `FUN_1407452c0(&(dialog MenuWindow+0x3b8), pair)`. Prior runtime #553 telemetry already showed profile renderer source ready but no destination bind on the swapped title surface. `./.auto/measure.sh` passed in 1.5s with score 0; no runtime trigger used.","memory_recorded":"bd remember profileselect-gfx-shell-vs-native-profile-bind-2026-06-28","rollback_reason":"Primary metric stayed 0; this was static RE and did not implement a visible loaded-character portrait surface or final oracle. Current tree also still contains no kept product change.","next_action_hint":"Next implementation should not swap GFX alone. Either create a real ProfileSelect-like dialog/resource context so the native constructor binds dummy faces to SYSTEX, or reproduce the `MENU_DummyProfileFace_01..10` -> `SYSTEX_Menu_Profile00..09` binding on the actual swapped title resource owner. Remember slot index 0 maps to GFX symbol suffix 01, slot 1 -> suffix 02, etc."}}
{"run":555,"commit":"4dc167b","metric":0,"metrics":{"readiness_gate_failures":0,"target_constants_remaining":0,"helpers_missing":0,"fixed_wait_predicates":0,"autoload_static_failures":0,"asset_chain_failures":0,"dll_patch_failures":0,"native_continue_failures":0,"field58_gate_failures":0,"direct_shortcut_failures":0,"input_path_failures":0,"runtime_proof_failures":0,"runtime_mode_failures":0,"eula_popup_failures":0,"save_data_popup_failures":0,"messagebox_dialog_failures":0,"server_status_failures":0,"title_cover_failures":2,"title_cover_penalty":1800,"native_trace_blockers":0,"native_trace_hits_total":74,"native_trace_unique_breakpoints":11,"false_positives":1,"offline_face_source_ready":1,"removed path_cpu_texture_bridge_ready":0,"offline_face_texture_runtime_drawn":0,"stylized_facedata_pixel_oracle":0,"real_portrait_asset_candidates":0,"profile_placeholder_assets_only":1},"status":"crash","description":"ProfileSelect shell swap has no native SYSTEX bind events to duplicate","timestamp":1782624030623,"segment":2,"confidence":null,"asi":{"hypothesis":"With the ProfileSelect GFX shell visibly swapped into the title surface, duplicate native `MENU_DummyProfileFace_01 -> SYSTEX_Menu_Profile00` bind calls onto the live title `TitleBackViewParts+0x8` resource owner when the bind observer sees native ProfileSelect bind pairs. This tests whether the missing portrait is only destination binding, not model source readiness.","implementation":"Reapplied explicit-gated FileOpener MemoryFile override returning extracted `05_010_profileselect.gfx` for native `05_000_title.gfx` requests. Modified existing `title_scaleform_bind_observer_hook`: under the explicit gate, disable the old false-positive pair rewrite and, after passing a native slot0 dummy-face/SYSTEX bind to original, compute title logo resource owner from latched `TITLE_LOGO_GFX_HIDE_LAST_LOGO` or dialog+0xaa8, then call the original bind helper again with `owner=logo+0x8` and the same pair. Added telemetry counters for duplicate bind attempts and FileOpener override.","validation":"`cargo fmt && cargo xwin check --target x86_64-pc-windows-msvc -q` passed. Runtime command `ER_EFFECTS_SCALEFORM_SYNTHETIC_TITLEBACK=1 ./.auto/measure.sh` ran 40.5s and failed by timeout (`ready=false`, `reason=timeout_seconds_budget_exhausted`). Artifact `/home/banon/projects/er-effects-rs/target/runtime-probe/product-continue-direct-20260627-221814`. FileOpener swap still worked: open_installed=1, open_calls=113, title_gfx_hits=1, memoryfile_returns=1, alloc_failures=0. But no bind events occurred: scaleform_bind_observer_hits=0, systex_hits=0, title_resource_bind_duplicates=0, visible_surface_bind_rewrites=0, profile_face_bind_hits=0. Profile renderer source remained ready, but there was no destination bind event to duplicate. No Elden Ring/start_protected_game process remained after teardown.","runtime_artifact":"/home/banon/projects/er-effects-rs/target/runtime-probe/product-continue-direct-20260627-221814","memory_recorded":"bd remember profileselect-shell-swap-no-native-bind-events-2026-06-28","rollback_reason":"Runtime timed out and product proof did not reach world-stable. The diagnostic proved that shell swapping does not execute the native ProfileSelect constructor/bind path; the duplicate-hook strategy never fired because no native dummy-face/SYSTEX bind event occurred in this path.","next_action_hint":"Do not wait for bind observer events in a pure GFX shell swap. Next explicitly call/reproduce `FUN_1407452c0` with a constructed DLString pair and the title resource owner, or create a real ProfileSelectDialog/GenericListSelectDialog resource context so its constructor runs. Keep MemoryFile seam proven; still require visible real portrait before scoring."}}
{"timestamp":1782625876902,"status":"crash","metric":0,"description":"Explicit ProfileSelect slot0 bind helper did not reach custom-cover run before process exit","runtime_artifact":"/home/banon/projects/er-effects-rs/target/runtime-probe/product-continue-direct-20260627-224703","metrics":{"title_cover_failures":2,"title_cover_penalty":1800,"false_positives":0},"asi":{"hypothesis":"Use captured native ProfileSelect telemetry plus Ghidra static RE to explicitly call FUN_1407452c0(cover_window+0x3b8, pair) with MENU_DummyProfileFace_01 -> SYSTEX_Menu_Profile00 after the custom ProfileSelect cover job runs, instead of waiting for native ProfileSelect bind events.","implementation":"Added constants/counters for explicit custom-cover bind, constructed a stack pair of two DLString-compatible records and called the bind helper from title_custom_cover_menu_window_run_hook after reading cover_window=*(cover_job+0x130). Added telemetry fields oracle_title_custom_cover_explicit_bind_*.","validation":"cargo fmt && cargo xwin check --target x86_64-pc-windows-msvc -q passed. Native run_experiment/log_experiment tools were not exposed in the compacted tool schema; ran the same bounded .auto/measure.sh path directly with .auto/run_runtime_probe_once and 45s cap. Artifact /home/banon/projects/er-effects-rs/target/runtime-probe/product-continue-direct-20260627-224703. Process exited before ready at 18.3s; no MessageBoxDialog; no stale process. Explicit bind did not fire because custom cover run did not happen: oracle_title_custom_cover_explicit_bind_calls=0, oracle_title_custom_cover_run_calls=0, profile_source_ready=false, loaded_character_portrait_rendered=false.","rollback_reason":"Process exited before product proof and explicit bind path was not reached; no evidence of improvement.","next_action_hint":"Static contract is still useful, but next iteration must restore/reach the custom-cover run path first (product_core_title_dialog blocker / process exit before title dialog), then call the explicit bind; do not tune scoring from this failed run."}}
{"run":556,"commit":"4dc167b","metric":0,"metrics":{"readiness_gate_failures":0,"target_constants_remaining":0,"helpers_missing":0,"fixed_wait_predicates":0,"autoload_static_failures":0,"asset_chain_failures":0,"dll_patch_failures":0,"native_continue_failures":0,"field58_gate_failures":0,"direct_shortcut_failures":0,"input_path_failures":0,"runtime_proof_failures":0,"runtime_mode_failures":0,"eula_popup_failures":0,"save_data_popup_failures":0,"messagebox_dialog_failures":0,"server_status_failures":0,"title_cover_failures":3,"title_cover_penalty":2000,"native_trace_blockers":0,"native_trace_hits_total":74,"native_trace_unique_breakpoints":11,"false_positives":1,"offline_face_source_ready":1,"removed path_cpu_texture_bridge_ready":0,"offline_face_texture_runtime_drawn":0,"stylized_facedata_pixel_oracle":0,"real_portrait_asset_candidates":0,"profile_placeholder_assets_only":1},"status":"discard","description":"Baseline/current measurement exposes false-positive title-cover state and no product score.","timestamp":1782625965615,"segment":2,"confidence":null,"asi":{"hypothesis":"Measure current branch before choosing the next portrait-cover experiment; expect the static oracle to identify which title-cover predicates remain false.","rollback_reason":"No primary-score improvement and false_positives=1, so this run cannot be kept under the loop gates.","next_action_hint":"Inspect .auto/measure.sh and source predicates for the three title_cover_failures: likely bridge from offline face source to invalidated CPU texture/runtime drawn/stylized oracle, or eliminate placeholder-only false-positive classification."}}
