{"run":230,"commit":"e65827a","metric":1470,"metrics":{"readiness_gate_failures":0,"target_constants_remaining":0,"helpers_missing":0,"fixed_wait_predicates":0,"autoload_static_failures":0,"asset_chain_failures":0,"dll_patch_failures":0,"native_continue_failures":0,"field58_gate_failures":0,"direct_shortcut_failures":0,"input_path_failures":0,"runtime_proof_failures":1,"runtime_mode_failures":0,"eula_popup_failures":0,"save_data_popup_failures":0,"messagebox_dialog_failures":0,"server_status_failures":0,"title_cover_failures":1,"title_cover_penalty":50,"native_trace_blockers":0,"native_trace_hits_total":74,"native_trace_unique_breakpoints":11,"false_positives":0,"runtime_timeout_failures":0,"runtime_title_visual_suppressed_builds":0,"runtime_custom_cover_builds":0,"runtime_simulated_button_presses_total":0},"status":"keep","description":"preserve native title job and suppress only its render draw bit","timestamp":1782435359298,"segment":0,"confidence":null,"asi":{"hypothesis":"Replacing the BeginTitle/ProfileSelect swap with a product-safe render-only suppressor preserves the native 05_000_Title job/sequence while hiding only its CSMenuMan draw bit, avoiding the ProfileSelect title-dialog blocker without using input or direct-load shortcuts.","evidence":["Ghidra dump mapped deobf 0x140744dd0 -> dump 0x140744ed0 and decompiled it as the FadeIn helper that ORs CSMenuMan+0x90[id] with 3.","Ghidra dump mapped deobf 0x1407ad530 -> dump 0x1407ad620 and decompiled MenuWindowJob::Run; deobf disasm shows call 0x140744dd0 then return at 0x1407ad530.",".auto/measure.sh passed with autoload_re_score=1470 and false_positives=0."],"next_action_hint":"Resolve the remaining title_cover_failures=1 / Part B: implement an actual custom cover that does not replace BeginTitle with ProfileSelect. Prefer a separate render path (custom Scaleform or safe profile-model texture path) layered after render-only native-title suppression, then runtime-validate native Continue/load proof."}}
{"run":231,"commit":"e65827a","metric":0,"metrics":{"readiness_gate_failures":0,"target_constants_remaining":0,"helpers_missing":0,"fixed_wait_predicates":0,"autoload_static_failures":0,"asset_chain_failures":0,"dll_patch_failures":0,"native_continue_failures":0,"field58_gate_failures":0,"direct_shortcut_failures":0,"input_path_failures":0,"runtime_proof_failures":1,"runtime_mode_failures":0,"eula_popup_failures":0,"save_data_popup_failures":0,"messagebox_dialog_failures":0,"server_status_failures":0,"title_cover_failures":1,"title_cover_penalty":50,"native_trace_blockers":0,"native_trace_hits_total":74,"native_trace_unique_breakpoints":11,"false_positives":0,"runtime_timeout_failures":0,"runtime_title_visual_suppressed_builds":0,"runtime_custom_cover_builds":0,"runtime_simulated_button_presses_total":0},"status":"crash","description":"runtime marker command rejected by measure-only experiment guard","timestamp":1782435455468,"segment":0,"confidence":null,"asi":{"hypothesis":"Forcing a visible runtime probe by combining marker creation and measure execution in one run_experiment command would exercise the onscreen path.","rollback_reason":"run_experiment enforces the measure-only command and rejected the combined marker+measure shell before executing the probe.","next_action_hint":"Create .auto/run_runtime_probe_once outside run_experiment, then call run_experiment with exactly ./.auto/measure.sh so the marker path launches the visible runtime probe."}}
{"run":232,"commit":"e65827a","metric":0,"metrics":{"readiness_gate_failures":0,"target_constants_remaining":0,"helpers_missing":0,"fixed_wait_predicates":0,"autoload_static_failures":0,"asset_chain_failures":0,"dll_patch_failures":0,"native_continue_failures":0,"field58_gate_failures":0,"direct_shortcut_failures":0,"input_path_failures":0,"runtime_proof_failures":1,"runtime_mode_failures":0,"eula_popup_failures":0,"save_data_popup_failures":0,"messagebox_dialog_failures":0,"server_status_failures":0,"title_cover_failures":1,"title_cover_penalty":50,"native_trace_blockers":0,"native_trace_hits_total":74,"native_trace_unique_breakpoints":11,"false_positives":0,"runtime_timeout_failures":0,"runtime_title_visual_suppressed_builds":1,"runtime_custom_cover_builds":1,"runtime_simulated_button_presses_total":0},"status":"crash","description":"visible runtime probe stopped at expected unfinished Load Game cover state","timestamp":1782435610820,"segment":0,"confidence":null,"asi":{"hypothesis":"Run visible probe after marker path to validate runtime behavior for the render-only title cover change.","error_detail":"Probe reached the expected unfinished visible state: Load Game/profile-select cover masking the old title menu. This is not product-ready and should not be treated as surprising failure by a visual oracle.","rollback_reason":"Runtime proof still lacks native continue/load completion; the visible state is expected at this stage and is diagnostic only.","next_action_hint":"Do not use screenshots/visual state as stopping oracle. Use RAM telemetry/progress semaphores only for run stopping and product proof; screenshots may be saved/read only as post-run diagnostics when telemetry misses a phenomenon."}}
{"run":233,"commit":"74c5d69","metric":1470,"metrics":{"readiness_gate_failures":0,"target_constants_remaining":0,"helpers_missing":0,"fixed_wait_predicates":0,"autoload_static_failures":0,"asset_chain_failures":0,"dll_patch_failures":0,"native_continue_failures":0,"field58_gate_failures":0,"direct_shortcut_failures":0,"input_path_failures":0,"runtime_proof_failures":1,"runtime_mode_failures":0,"eula_popup_failures":0,"save_data_popup_failures":0,"messagebox_dialog_failures":0,"server_status_failures":0,"title_cover_failures":1,"title_cover_penalty":50,"native_trace_blockers":0,"native_trace_hits_total":74,"native_trace_unique_breakpoints":11,"false_positives":0,"runtime_timeout_failures":0,"runtime_title_visual_suppressed_builds":0,"runtime_custom_cover_builds":0,"runtime_simulated_button_presses_total":0},"status":"keep","description":"fix fresh DLL build for render-only title suppression","timestamp":1782436264855,"segment":0,"confidence":null,"asi":{"hypothesis":"The kept render-only title suppression source had a compile error in the fresh DLL path because the fadein hook used `null` before binding it; fixing that makes the runtime probe deploy the intended e65827a behavior instead of stale DLL bytes.","evidence":["`cargo xwin build --release --target x86_64-pc-windows-msvc` initially failed with E0425 cannot find value `null` in title_native_menu_visual_window_fadein_hook.","Moved the TITLE_OWNER_SCAN_START_ADDRESS sentinel binding before the original-call branch; fresh DLL build completed successfully.","`.auto/measure.sh` passed with autoload_re_score=1470 and false_positives=0."],"next_action_hint":"Run a marker-gated visible/on-screen runtime probe with the freshly built DLL to evaluate RAM telemetry for preserved-native/render-only suppression. Do not use visual state as stop/product oracle; use runtime telemetry fields for native title preserved/render suppression and Continue/load progression."}}
{"run":234,"commit":"74c5d69","metric":0,"metrics":{"readiness_gate_failures":0,"target_constants_remaining":0,"helpers_missing":0,"fixed_wait_predicates":0,"autoload_static_failures":0,"asset_chain_failures":0,"dll_patch_failures":0,"native_continue_failures":0,"field58_gate_failures":0,"direct_shortcut_failures":0,"input_path_failures":0,"runtime_proof_failures":1,"runtime_mode_failures":0,"eula_popup_failures":0,"save_data_popup_failures":0,"messagebox_dialog_failures":0,"server_status_failures":0,"title_cover_failures":1,"title_cover_penalty":50,"native_trace_blockers":0,"native_trace_hits_total":74,"native_trace_unique_breakpoints":11,"false_positives":0,"runtime_timeout_failures":1,"runtime_title_visual_suppressed_builds":1,"runtime_custom_cover_builds":0,"runtime_simulated_button_presses_total":0},"status":"crash","description":"fresh-DLL visible runtime preserved native title but did not render-suppress title draw bit","timestamp":1782436347920,"segment":0,"confidence":null,"asi":{"hypothesis":"Freshly built render-only suppression should preserve the native 05_000_Title job but clear its CSMenuMan draw bit during MenuWindowJob::Run/FadeIn, allowing native Continue to proceed behind a hidden title visual.","error_detail":"Latest runtime telemetry: suppress_installed=true, suppressed_builds=1, native_job/native_window latched, render_suppress_installed=true, render_suppressed_windows=0, custom_cover_builds=0, simulated_button_presses_total=0, msgbox_total_builds=0, continue_phase=0, timeout_seconds_budget_exhausted. User screenshot shows native title menu still visible; diagnostic only, but consistent with RAM telemetry that render suppression did not fire.","rollback_reason":"Runtime proof failed and no runtime improvement; keep static render-only source only if next experiment fixes the missing render suppression trigger.","next_action_hint":"Staging/fresh build is now correct. Investigate why title_native_menu_visual_window_fadein_hook never increments: likely caller RVA filter 0x7ad530 is wrong under hook trampoline/callstack, or the preserved native window pointer differs from the helper rcx. Add bounded RAM telemetry samples in the FadeIn hook for caller/window/menu_id/flags before filtering, or statically choose a more direct hook point for CSMenuMan+0x90 title draw bit clearing."}}
{"run":235,"commit":"74c5d69","metric":0,"metrics":{"readiness_gate_failures":0,"target_constants_remaining":0,"helpers_missing":0,"fixed_wait_predicates":0,"autoload_static_failures":0,"asset_chain_failures":0,"dll_patch_failures":0,"native_continue_failures":0,"field58_gate_failures":0,"direct_shortcut_failures":0,"input_path_failures":0,"runtime_proof_failures":1,"runtime_mode_failures":0,"eula_popup_failures":0,"save_data_popup_failures":0,"messagebox_dialog_failures":0,"server_status_failures":0,"title_cover_failures":1,"title_cover_penalty":50,"native_trace_blockers":0,"native_trace_hits_total":74,"native_trace_unique_breakpoints":11,"false_positives":0,"runtime_timeout_failures":1,"runtime_title_visual_suppressed_builds":1,"runtime_custom_cover_builds":0,"runtime_simulated_button_presses_total":0},"status":"crash","description":"selected Continue row fallback did not resolve a row at runtime","timestamp":1782436900666,"segment":0,"confidence":null,"asi":{"hypothesis":"When the first MenuWindowJob Continue-looking candidate is the constant-false idle predicate, falling back to the selected/default TitleTopDialog Continue row from the router vector would provide a native result to submit without input/direct-load.","error_detail":"Runtime timed out. Telemetry still had continue_phase=0, candidate_last_accept=0x1407add70, native_accept_hits=0, continue_task_node=null, continue_member_node=null, simulated_button_presses_total=0, msgbox_total_builds=0. Debug log showed repeated idle MenuWindowJob rejection and no selected-row fallback/titletop-entry logs, so the fallback never resolved a row.","rollback_reason":"No runtime improvement; the fallback path did not become observable and risks adding dead code around an unresolved router scan.","next_action_hint":"Do not keep the selected-row fallback. Static/RAM-trace why dump_titletop_menu_entries/router scan is not producing titletop-entry logs in product runs, or instrument the constructor/registrar path that creates the idle Continue-looking item to find the adjacent real Continue member/task node. Keep relying on RAM telemetry, not visual state."}}
{"run":236,"commit":"74c5d69","metric":0,"metrics":{"readiness_gate_failures":0,"target_constants_remaining":0,"helpers_missing":0,"fixed_wait_predicates":0,"autoload_static_failures":0,"asset_chain_failures":0,"dll_patch_failures":0,"native_continue_failures":0,"field58_gate_failures":0,"direct_shortcut_failures":0,"input_path_failures":0,"runtime_proof_failures":1,"runtime_mode_failures":0,"eula_popup_failures":0,"save_data_popup_failures":0,"messagebox_dialog_failures":0,"server_status_failures":0,"title_cover_failures":1,"title_cover_penalty":50,"native_trace_blockers":0,"native_trace_hits_total":74,"native_trace_unique_breakpoints":11,"false_positives":0,"runtime_timeout_failures":0,"runtime_title_visual_suppressed_builds":1,"runtime_custom_cover_builds":0,"runtime_simulated_button_presses_total":0},"status":"crash","description":"native Continue docall fallback crashed in MenuJobResult handling","timestamp":1782437155605,"segment":0,"confidence":null,"asi":{"hypothesis":"Calling the native Continue docall wrapper after semantic title-menu readiness and slot setup might invoke the same native Continue action without input/direct-load/deser/confirm when the MenuWindowJob candidate is only the idle predicate.","error_detail":"Runtime exited early with access violation rva=0x74a6ba immediately after `native Continue docall fallback ABI entering wrapper=0x140764b80 result=0x10f460`; no `SUBMITTED` log, continue_phase stayed 0, simulated_button_presses_total=0, msgbox_total_builds=0. This likely used the wrong ABI/receiver/result layout for the std::function docall; direct wrapper fallback is unsafe.","rollback_reason":"Hard crash and no product proof; do not keep direct docall fallback.","next_action_hint":"Do not directly call 0x140764b80/Continue docall with a synthetic result buffer. Static-trace 0x140764b80 call ABI and the std::function receiver, or find the real registered Continue MenuMemberFuncJob/task node and invoke its normal Run path instead."}}
{"run":237,"commit":"74c5d69","metric":0,"metrics":{"readiness_gate_failures":0,"target_constants_remaining":0,"helpers_missing":0,"fixed_wait_predicates":0,"autoload_static_failures":0,"asset_chain_failures":0,"dll_patch_failures":0,"native_continue_failures":0,"field58_gate_failures":0,"direct_shortcut_failures":0,"input_path_failures":0,"runtime_proof_failures":1,"runtime_mode_failures":0,"eula_popup_failures":0,"save_data_popup_failures":0,"messagebox_dialog_failures":1,"server_status_failures":0,"title_cover_failures":1,"title_cover_penalty":50,"native_trace_blockers":0,"native_trace_hits_total":74,"native_trace_unique_breakpoints":11,"false_positives":0,"runtime_timeout_failures":0,"runtime_title_visual_suppressed_builds":1,"runtime_custom_cover_builds":0,"runtime_simulated_button_presses_total":0},"status":"crash","description":"free native Continue wrapper advanced to phase 3 but hit native MessageBox oracle","timestamp":1782437446950,"segment":0,"confidence":null,"asi":{"hypothesis":"Calling the actual free native Continue wrapper at deobf 0x14082bac0 after semantic title-menu readiness and slot setup may advance the native load chain without input/direct-load/raw-deser/direct-confirm, unlike the unsafe std::function docall ABI.","error_detail":"Runtime did not AV and advanced oracle_continue_phase to 3. Logs show free-wrapper fallback entered/returned and SUBMITTED with b80=1, ac0=0, b78=0, c30 still 0xa010000, simulated_button_presses_total=0. It then hit native MessageBox oracle at +17209ms (suppressed before UI allocation but counted as hard failure), so readiness stopped as native_messagebox_dialog_detected.","rollback_reason":"Hard product failure remains: native MessageBox build after free-wrapper fallback. Do not keep as completed product proof; next work should identify the semantic native side effect/gate that MessageBox represents or inspect whether this is the already-known failed-save/load path from b80/ac0/c30 state.","next_action_hint":"The free wrapper 0x14082bac0 is a promising lead (no AV, phase advanced); if revisiting, do not call std::function 0x140764b80. Next statically trace MessageBox caller stack around game RVAs 0x7b04c7/0x7ad2bc/0x7916d5/0x7a747c/0x7aa2bb and the b80/ac0/c30 state after wrapper return to determine why the native load chain reports failure."}}
{"run":238,"commit":"74c5d69","metric":0,"metrics":{"readiness_gate_failures":0,"target_constants_remaining":0,"helpers_missing":0,"fixed_wait_predicates":0,"autoload_static_failures":0,"asset_chain_failures":0,"dll_patch_failures":0,"native_continue_failures":1,"field58_gate_failures":0,"direct_shortcut_failures":0,"input_path_failures":0,"runtime_proof_failures":1,"runtime_mode_failures":0,"eula_popup_failures":0,"save_data_popup_failures":0,"messagebox_dialog_failures":0,"server_status_failures":0,"native_trace_blockers":0,"native_trace_hits_total":0,"native_trace_unique_breakpoints":0,"false_positives":0,"title_cover_failures":1,"title_cover_penalty":50,"runtime_timeout_failures":1,"runtime_title_visual_suppressed_builds":0,"runtime_custom_cover_builds":0,"runtime_simulated_button_presses_total":0},"status":"crash","description":"non-returned ProfileSelect cover build did not reach Continue activation","timestamp":1782438495018,"segment":0,"confidence":null,"asi":{"hypothesis":"Build the ProfileSelect dummy-profile custom cover into a private slot from the BeginTitle hook while preserving the native 05_000_Title job, making Part B telemetry observable without replacing the native Continue path.","error_detail":"Runtime artifact product-continue-direct-20260625-184650 failed before product submit. Readiness telemetry showed product_core_ready but continue_phase=0, menu_continue_candidate_hits=2284 all idle accept, result_chain hits=0, no autoload-debug final logs. This confirms the user's direction: the blocker is Continue activation semantics, not the cover surface itself.","rollback_reason":"No runtime/product improvement and potential extra private cover build side effect; revert the experiment and analyze main branch Continue activation path statically/diff-first before more runtime probes.","next_action_hint":"Compare current branch product_continue path against main/ca5b2df known-good: especially how main gets beyond idle Continue candidate into native accept/submit. Use static source diff and Ghidra/disasm as needed before another runtime run."}}
{"run":239,"commit":"7046eca","metric":1455,"metrics":{"readiness_gate_failures":1,"target_constants_remaining":0,"helpers_missing":0,"fixed_wait_predicates":0,"autoload_static_failures":1,"asset_chain_failures":0,"dll_patch_failures":0,"native_continue_failures":0,"field58_gate_failures":0,"direct_shortcut_failures":0,"input_path_failures":0,"runtime_proof_failures":1,"runtime_mode_failures":0,"eula_popup_failures":0,"save_data_popup_failures":0,"messagebox_dialog_failures":0,"server_status_failures":0,"title_cover_failures":1,"title_cover_penalty":50,"native_trace_blockers":0,"native_trace_hits_total":74,"native_trace_unique_breakpoints":11,"false_positives":0,"runtime_timeout_failures":1,"runtime_title_visual_suppressed_builds":0,"runtime_custom_cover_builds":0,"runtime_simulated_button_presses_total":0},"status":"keep","description":"use main-branch native accept-byte path instead of game-task open_menu self-fire","timestamp":1782438719100,"segment":0,"confidence":null,"asi":{"hypothesis":"The Continue not-activating blocker comes from product_core directly calling TitleTopDialog::open_menu from the game task. Main-branch evidence and deobf static trace show the working path sets the decoded title accept byte so TitleTopDialog::update calls open_menu and then drains MenuWindow jobs in the same native frame.","evidence":"Compared current product_continue functions to main: they are identical, so the divergence is not submit ABI. Main-watch artifact reached LOAD-CORRECTNESS via `title-accept-byte` with product_core_autoload_ticks=0. Deobf 0x1409aac10 shows loop+a40==0 branch calls open_menu 0x1409b24e0 then tail-calls MenuWindow update 0x140745570. Current product_core self-fire set a40 out of that native update frame and saw 2284 idle-only Continue candidates.","result":"Static score improved; native_continue_failures dropped to 0. Runtime proof still pending and must be the next experiment.","next_action_hint":"Run a marker-gated runtime probe with ER_EFFECTS_EXPERIMENTAL_DIRECT_MENU_LOAD still enabled. Expected telemetry: title_accept_byte fires before menu latch, native ctor B captures semantic Continue/native accept instead of idle-only candidates, continue_phase advances beyond 0 without MessageBox."}}
