{"run":47,"commit":"2100051","metric":0,"metrics":{"readiness_gate_failures":0,"target_constants_remaining":0,"helpers_missing":0,"fixed_wait_predicates":0,"autoload_static_failures":0,"asset_chain_failures":0,"dll_patch_failures":0,"native_continue_failures":0,"field58_gate_failures":0,"direct_shortcut_failures":0,"input_path_failures":0,"runtime_proof_failures":1,"runtime_mode_failures":0,"eula_popup_failures":0,"save_data_popup_failures":0,"messagebox_dialog_failures":0,"server_status_failures":0,"title_cover_failures":0,"title_cover_penalty":0,"native_trace_blockers":0,"native_trace_hits_total":74,"native_trace_unique_breakpoints":11,"false_positives":0,"runtime_timeout_failures":1,"runtime_title_visual_suppressed_builds":0,"runtime_custom_cover_builds":0,"runtime_simulated_button_presses_total":0},"status":"crash","description":"manual golden-save run with Continue hooks ungated captured native-accept and idle Continue MenuWindowJob candidates but no row/router logs","timestamp":1782363385349,"segment":0,"confidence":4.64,"asi":{"hypothesis":"The previous clean manual run visually reached the menu, but hooks were gated by product_autoload_enabled. Remove those gates and mirror key row/router logs into autoload_debug so a golden-save user-driven Load Game run can reveal the native Continue/menu construction path under ER_EFFECTS_NO_AUTOLOAD=1.","rollback_reason":"The user again reported a good clean visible run, and telemetry improved: oracle_menu_window_ctor_hits=1 with last_item=0x7fff7192ca00, vtable=0x142aa97e8, native accept_predicate=0x1407ad810; oracle_menu_continue_idle_insert_hits=1 and idle Continue-looking item=0x7fff7192c000 with docall=0x140764b80 and accept_predicate=0x1407add70. However no CAP csmenu_ctor, CAP row_push, titletop, loadgame, or semantic MENU-ITEM-UPDATE logs appeared; MENU_WINDOW_CTOR semantic_hits stayed 0 because the native-accept item had no functor/docall at the checked +0xa8 slot. This is diagnostic evidence only and not product proof, so primary metric remains 0/crash.","next_action_hint":"The native-accept Continue object exists separately from the idle Continue item. Next adjustment should log qword windows / menu_item_action_summary for every Continue-looking/native-accept MenuWindowJob constructor hit, especially item=0x7fff7192ca00 with accept=0x1407ad810 but functor/docall None. The do_call/result/functor may be populated after ctor or stored at a sibling offset; hook MenuWindowJob::Run/update for the native-accept item and dump +0x70/+0xa8/+0xb0/+0xf0/+0x130 windows. Also continue to use manual golden-save visible runs because the user confirms the menu-load flow is clean.","artifact_dir":"/home/banon/projects/er-effects-rs/target/runtime-probe/product-continue-direct-20260624-215443","user_feedback":"User reported: 'Another good run from my perspective' after this visible golden-save diagnostic.","observed_runtime_oracles":{"readiness_result_present":false,"telemetry_present":true,"golden_save_staged":true,"debug_lines":106,"oracle_menu_window_ctor_hits":1,"oracle_menu_window_ctor_last_item":"0x7fff7192ca00","oracle_menu_window_ctor_last_vt":"0x142aa97e8","oracle_menu_window_ctor_last_accept":"0x1407ad810","oracle_menu_window_ctor_last_docall":null,"oracle_menu_window_ctor_semantic_hits":0,"oracle_menu_window_idle_ctor_continue_hits":1,"oracle_menu_window_idle_ctor_continue_last_item":"0x7fff7192c000","oracle_menu_window_idle_ctor_continue_last_docall":"0x140764b80","oracle_menu_window_idle_ctor_continue_last_accept":"0x1407add70","oracle_menu_continue_idle_insert_hits":1,"oracle_menu_continue_idle_insert_last_arg1":"0x10fc48","oracle_menu_continue_idle_insert_last_arg1_update_rva":"0x7ad1c0","cap_csmenu_ctor_logs":0,"cap_row_push_logs":0,"loadgame_logs":0,"simulated_button_presses_total":0,"processes_remaining":0},"build":"cargo xwin build --release --target x86_64-pc-windows-msvc succeeded before run; manual sentinel staged golden save and launched on-screen with ER_EFFECTS_NO_AUTOLOAD=1 and ER_EFFECTS_TRACE_CONTINUE=1.","cleanup":"No eldenring.exe or start_protected_game.exe processes remained."}}
{"run":48,"commit":"2100051","metric":0,"metrics":{"readiness_gate_failures":0,"target_constants_remaining":0,"helpers_missing":0,"fixed_wait_predicates":0,"autoload_static_failures":0,"asset_chain_failures":0,"dll_patch_failures":0,"native_continue_failures":0,"field58_gate_failures":0,"direct_shortcut_failures":0,"input_path_failures":0,"runtime_proof_failures":1,"runtime_mode_failures":0,"eula_popup_failures":0,"save_data_popup_failures":0,"messagebox_dialog_failures":0,"server_status_failures":0,"title_cover_failures":0,"title_cover_penalty":0,"native_trace_blockers":0,"native_trace_hits_total":74,"native_trace_unique_breakpoints":11,"false_positives":0,"runtime_timeout_failures":1,"runtime_title_visual_suppressed_builds":0,"runtime_custom_cover_builds":0,"runtime_simulated_button_presses_total":0},"status":"crash","description":"expanded native-accept Continue object field dump found multiple ctor-b action docalls but not the Continue callback yet","timestamp":1782363528760,"segment":0,"confidence":4.64,"asi":{"hypothesis":"The native-accept Continue item has accept_predicate=0x1407ad810 but no functor/docall at the previously checked +0xa8 slot; dump full qword/action windows for every native-accept MenuWindowJob constructor hit in a clean manual golden-save flow to locate the action/functor field or caller family.","rollback_reason":"The user authorized repeated adjustment and this visible run again timed out as diagnostic-only. Telemetry/logging improved: 10 MENU-WINDOW-NATIVE-CTOR-B observed lines were captured, including accept=0x1407ad810 items with functor vtables/docalls 0x140820b30, 0x140820c60, and 0x14078ee60, plus one MENU-WINDOW-CTOR observed native-accept item with functor/docall still null. None matched the known Continue callback/docall yet, no semantic MenuItem update latched, and no product load proof occurred.","next_action_hint":"Use static RE on the observed ctor-b caller/docall families before another runtime: map deobf callers 0x14081fa90, 0x14081f790, and 0x14078d9f1 plus docalls 0x140820b30, 0x140820c60, 0x14078ee60. The likely issue is that the Continue callback is not at the action vtable +0x10 in these ctor-b objects, or the observed native-accept items are title/load-game UI controls rather than Continue. Next runtime should log full caller stack for native-accept ctor-b and/or compare visible menu row index/text by caller, not just functor docall equality.","artifact_dir":"/home/banon/projects/er-effects-rs/target/runtime-probe/product-continue-direct-20260624-215715","user_feedback":"User said: 'Adjust as many times as you need.'","observed_runtime_oracles":{"readiness_result_present":false,"telemetry_present":true,"golden_save_staged":true,"menu_window_native_ctor_b_observed_lines":10,"menu_window_ctor_observed_lines":1,"example_native_ctor_b":{"item":"0x7ffe9e52cdc0","caller_rva":"0x81f790","accept":"0x1407ad810","functor":"0x7ffe9e52ce30","functor_vt":"0x142ac3ea8","docall":"0x140820c60"},"other_observed_docalls":["0x140820b30","0x140820c60","0x14078ee60"],"oracle_menu_window_ctor_last_item":"0x7ffe9e52ca00","oracle_menu_window_ctor_last_accept":"0x1407ad810","oracle_menu_window_ctor_last_docall":null,"semantic_menu_item_update_hits":0,"cap_csmenu_ctor_logs":0,"cap_row_push_logs":0,"simulated_button_presses_total":0,"processes_remaining":0},"build":"cargo xwin build --release --target x86_64-pc-windows-msvc succeeded before the run; manual sentinel staged golden save and launched on-screen.","cleanup":"No eldenring.exe or start_protected_game.exe processes remained."}}
{"run":49,"commit":"2100051","metric":0,"metrics":{"readiness_gate_failures":0,"target_constants_remaining":0,"helpers_missing":0,"fixed_wait_predicates":0,"autoload_static_failures":0,"asset_chain_failures":0,"dll_patch_failures":0,"native_continue_failures":0,"field58_gate_failures":0,"direct_shortcut_failures":0,"input_path_failures":0,"runtime_proof_failures":1,"runtime_mode_failures":0,"eula_popup_failures":0,"save_data_popup_failures":0,"messagebox_dialog_failures":0,"server_status_failures":0,"title_cover_failures":0,"title_cover_penalty":0,"native_trace_blockers":0,"native_trace_hits_total":74,"native_trace_unique_breakpoints":11,"false_positives":0,"runtime_timeout_failures":1,"runtime_title_visual_suppressed_builds":0,"runtime_custom_cover_builds":0,"runtime_simulated_button_presses_total":0},"status":"crash","description":"generic row-builder hook captured Option/Regulation row builders but not main-menu Continue because run proceeded into submenu","timestamp":1782364056361,"segment":0,"confidence":4.64,"asi":{"hypothesis":"Hook the generic title/profile row builder 0x1408288e0 so a clean visible manual run logs action/predicate stack functors for visible rows instead of relying on later MenuWindowJob wrapper fields.","rollback_reason":"Runtime remained diagnostic-only. The row-builder hook worked and captured two rows, but caller/action mapping showed they were Option and Regulation/settings-family builders (caller chain through 0x828db8/0x825ae0 and 0x828f18/0x824a60; actions 0x14082a740/0x14082a750 and 0x14082ab10/0x14082ab20), not the main-menu Continue builder. No 0x1408251c0/0x14082b8f0 Continue pointers, no native submit, and no product proof were observed. This likely happened because the manual run went into the Load Game/submenu path; the needed next diagnostic is to stop at the first main title menu with Continue highlighted, not proceed to Load Game.","next_action_hint":"Reapply the row-builder hook and rerun a visible manual diagnostic, but instruct the user to stop at the first main title menu and leave Continue highlighted. If row-builder still does not show 0x1408251c0/0x14082b8f0, add direct passive hooks on deobf 0x140822160/0x1408251b0 to log the real wrapper object only if/when native Continue is accepted manually; do not use that as product proof. The row-builder hook should also decode MenuString text in a future iteration for less ambiguous row identification.","artifact_dir":"/home/banon/projects/er-effects-rs/target/runtime-probe/product-continue-direct-20260624-220436","observed_runtime_oracles":{"readiness_result_present":false,"telemetry_present":true,"golden_save_staged":true,"cap_title_row_builder_logs":2,"row0":{"action_vtable":"0x142a93c38","action_q8":"0x14082a740","pred_vtable":"0x142ac7188","pred_q8":"0x14082a750","caller_chain":"0x828db8 -> 0x825ae0 -> 0x82847b -> 0x826efe"},"row1":{"action_vtable":"0x142a93c38","action_q8":"0x14082ab10","pred_vtable":"0x142ac7188","pred_q8":"0x14082ab20","caller_chain":"0x828f18 -> 0x824a60 -> 0x82838e -> 0x826e3e"},"profile_slot_active_bytes_qword":"0x1","oracle_native_submit_hits":0,"oracle_menu_window_ctor_hits":0,"oracle_menu_window_native_ctor_b_hits":0,"oracle_menu_continue_idle_insert_hits":1,"simulated_button_presses_total":0,"messagebox_total_builds":0,"policy_window_total_builds":0,"processes_remaining":0},"static_re":{"row_builder_dump_va":"0x1408289d0","row_builder_deobf_va":"0x1408288e0","actual_continue_wrapper_dump_va":"0x1408251c0","actual_continue_wrapper_deobf_va":"0x1408251b0","continue_load_callback_dump_va":"0x14082b8f0","continue_load_callback_deobf_va":"0x14082b800","xrefs":"FUN_1408251c0 is called by FUN_140822250; FUN_14082b8f0 is called by FUN_1408251c0 when state fields select Continue."},"build":"cargo xwin build --release --target x86_64-pc-windows-msvc succeeded before runtime.","cleanup":"No eldenring.exe or start_protected_game.exe processes remained."}}
{"run":50,"commit":"2100051","metric":0,"metrics":{"readiness_gate_failures":0,"target_constants_remaining":0,"helpers_missing":0,"fixed_wait_predicates":0,"autoload_static_failures":0,"asset_chain_failures":0,"dll_patch_failures":0,"native_continue_failures":0,"field58_gate_failures":0,"direct_shortcut_failures":0,"input_path_failures":0,"runtime_proof_failures":1,"runtime_mode_failures":0,"eula_popup_failures":0,"save_data_popup_failures":0,"messagebox_dialog_failures":0,"server_status_failures":0,"title_cover_failures":0,"title_cover_penalty":0,"native_trace_blockers":0,"native_trace_hits_total":74,"native_trace_unique_breakpoints":11,"false_positives":0,"runtime_timeout_failures":1,"runtime_title_visual_suppressed_builds":0,"runtime_custom_cover_builds":0,"runtime_simulated_button_presses_total":0},"status":"crash","description":"main title menu stop confirmed Continue highlighted but generic row-builder path is not used for title rows","timestamp":1782364241401,"segment":0,"confidence":4.64,"asi":{"hypothesis":"Stop at the first main title menu with Continue highlighted, not inside Load Game, while the generic row-builder hook logs action/predicate functors. If the main title rows use that builder, it should expose the real Continue action identity.","rollback_reason":"The run is diagnostic-only and timed out, but the teardown screenshot proved the exact desired manual state: native title menu visible with Continue highlighted. The generic row-builder hook still only logged the same two settings-family rows; it did not observe 0x1408251c0 or 0x14082b8f0, and no MenuWindow ctor/native-accept hooks were ungated in this experiment. Therefore main title Continue rows are not constructed via the generic 0x8288e0 row-builder path, or that path ran before the hook's observable window. Product proof remains absent.","next_action_hint":"Repeat the main-title-menu stop run with MenuWindowJob ctor/native-accept/update hooks ungated from product_autoload_enabled plus the row-builder hook. The screenshot path confirms the user can reliably land at the needed state; next instrumentation should capture the selected Continue MenuWindowJob fields at that exact state rather than going into Load Game. Also consider adding a watcher target that stops immediately once title menu screenshot/state is present and relevant telemetry appears, to avoid timeout-only diagnostics.","artifact_dir":"/home/banon/projects/er-effects-rs/target/runtime-probe/product-continue-direct-20260624-220904","visual_artifact":"/home/banon/projects/er-effects-rs/target/runtime-probe/product-continue-direct-20260624-220904/teardown-screenshot.jpg","observed_runtime_oracles":{"teardown_screenshot_state":"Elden Ring native title menu visible; Continue highlighted; Load Game/New Game/System below it.","readiness_result_present":false,"telemetry_present":true,"golden_save_staged":true,"cap_title_row_builder_logs":2,"row_builder_contains_continue_callback":false,"profile_slot_active_bytes_qword":"0x1","oracle_native_submit_hits":0,"oracle_menu_window_ctor_hits":0,"oracle_menu_window_native_ctor_b_hits":0,"oracle_menu_continue_idle_insert_hits":1,"oracle_menu_continue_idle_insert_last_arg1":"0x10fc48","oracle_menu_continue_idle_insert_last_arg1_update_rva":"0x7ad1c0","simulated_button_presses_total":0,"messagebox_total_builds":0,"policy_window_total_builds":0,"processes_remaining":0},"static_re":"The generic row-builder path captured only action/predicate helpers around 0x14082a740/0x14082a750 and 0x14082ab10/0x14082ab20; these did not match actual Continue wrapper 0x1408251c0 or callback 0x14082b8f0.","build":"cargo xwin build --release --target x86_64-pc-windows-msvc succeeded before runtime.","cleanup":"No eldenring.exe or start_protected_game.exe processes remained."}}
{"run":51,"commit":"2100051","metric":0,"metrics":{"readiness_gate_failures":0,"target_constants_remaining":0,"helpers_missing":0,"fixed_wait_predicates":0,"autoload_static_failures":0,"asset_chain_failures":0,"dll_patch_failures":0,"native_continue_failures":0,"field58_gate_failures":0,"direct_shortcut_failures":0,"input_path_failures":0,"runtime_proof_failures":1,"runtime_mode_failures":0,"eula_popup_failures":0,"save_data_popup_failures":0,"messagebox_dialog_failures":0,"server_status_failures":0,"title_cover_failures":0,"title_cover_penalty":0,"native_trace_blockers":0,"native_trace_hits_total":74,"native_trace_unique_breakpoints":11,"false_positives":0,"runtime_timeout_failures":1,"runtime_title_visual_suppressed_builds":0,"runtime_custom_cover_builds":0,"runtime_simulated_button_presses_total":0},"status":"crash","description":"ungated MenuWindowJob logging at main menu captured selected idle-looking Continue item but semantic action slot is still unmapped","timestamp":1782364408825,"segment":0,"confidence":4.64,"asi":{"hypothesis":"With the run stopped at the first title menu (Continue highlighted), ungated MenuWindowJob ctor/native-accept/update hooks should capture the selected Continue item fields without going into Load Game.","rollback_reason":"Diagnostic-only timeout. The hook captured a stable main-title menu state and MenuWindowJob data, but not a proven semantic action: oracle_menu_window_idle_ctor_continue_hits=1 with item 0x7fff2e53c000, accept_predicate=0x1407add70, and docall-like field 0x140764b80; native-accept ctor-b items existed but were TitleInformation/ProfileSelect/other wrappers with docalls 0x140820b30/0x14078ee60 and not Continue. No MENU-ITEM-UPDATE semantic hit or native submit occurred. The likely issue is that the current 'docall' slot read is wrong for this std::function/vtable, so the selected Continue item must be identified from update-tick behavior and a deeper action/result object field, not from +0xa8/+0x10 alone.","next_action_hint":"Keep the main-menu-stop procedure. Next code change: log the first N calls to cap_menu_item_update_hook unconditionally with item fields/action summary, not only semantic candidates. This should show which MenuWindowJob is actually ticking while Continue is highlighted and which field changes when selected/accepted. Then map the real action slot with static RE before any product submit attempt.","artifact_dir":"/home/banon/projects/er-effects-rs/target/runtime-probe/product-continue-direct-20260624-221139","visual_artifact":"/home/banon/projects/er-effects-rs/target/runtime-probe/product-continue-direct-20260624-221139/teardown-screenshot.jpg","observed_runtime_oracles":{"teardown_screenshot_state":"Main title menu with Continue highlighted (same target state as previous run, from captured ER window).","readiness_result_present":false,"telemetry_present":true,"golden_save_staged":true,"oracle_menu_window_ctor_hits":1,"oracle_menu_window_ctor_last_item":"0x7fff2e53ca00","oracle_menu_window_ctor_last_accept":"0x1407ad810","oracle_menu_window_ctor_last_docall":null,"oracle_menu_window_native_ctor_b_hits":6,"oracle_menu_window_native_ctor_b_last_docall":"0x14078ee60","oracle_menu_window_idle_ctor_continue_hits":1,"oracle_menu_window_idle_ctor_continue_last_item":"0x7fff2e53c000","oracle_menu_window_idle_ctor_continue_last_docall":"0x140764b80","oracle_menu_window_idle_ctor_continue_last_accept":"0x1407add70","oracle_menu_continue_idle_insert_hits":1,"oracle_menu_continue_idle_insert_last_arg1":"0x10fc48","oracle_menu_continue_idle_insert_last_arg1_update_rva":"0x7ad1c0","semantic_menu_item_update_hits":0,"oracle_native_submit_hits":0,"profile_slot_active_bytes_qword":"0x1","simulated_button_presses_total":0,"messagebox_total_builds":0,"policy_window_total_builds":0,"processes_remaining":0},"static_re":"The deobf/runtime vtable/action slot interpretation is not reliable enough: the supposed +0x10 docall 0x140764b80 decompiles as a std::function destructor-like routine in the Ghidra dump, so product code must not keep treating it as the Continue action identity without update-path proof.","build":"cargo xwin build --release --target x86_64-pc-windows-msvc succeeded before runtime.","cleanup":"No eldenring.exe or start_protected_game.exe processes remained."}}
