{"run":626,"commit":"978974d","metric":0,"metrics":{"readiness_gate_failures":0,"target_constants_remaining":0,"helpers_missing":0,"fixed_wait_predicates":0,"autoload_static_failures":0,"asset_chain_failures":0,"dll_patch_failures":0,"native_continue_failures":1,"field58_gate_failures":0,"direct_shortcut_failures":0,"input_path_failures":0,"runtime_proof_failures":1,"runtime_mode_failures":0,"eula_popup_failures":0,"save_data_popup_failures":0,"messagebox_dialog_failures":0,"server_status_failures":0,"title_cover_failures":2,"title_cover_penalty":1800,"native_trace_blockers":0,"native_trace_hits_total":74,"native_trace_unique_breakpoints":11,"false_positives":0,"offline_face_source_ready":1,"removed path_cpu_texture_bridge_ready":0,"offline_face_texture_runtime_drawn":0,"stylized_facedata_pixel_oracle":0,"real_portrait_asset_candidates":0,"profile_placeholder_assets_only":1},"status":"crash","description":"Tried native 01_900_Black as a full-viewport solid diagnostic carrier; built but process exited before ready.","timestamp":1782665032088,"segment":2,"confidence":null,"asi":{"hypothesis":"Keep logo hidden and ProfileSelect invalidated, but use native 01_900_Black as a solid-color carrier at the same BeginTitle timing to test whether a non-ProfileSelect native MenuWindowJob can cover the viewport long enough.","observed_evidence":"Runtime artifact /home/banon/projects/er-effects-rs/target/runtime-probe/product-continue-direct-20260628-094231. Debug log shows 01_900_Black built via live 0x140764290 at +17102ms with job=0x7ffe92d3c3c0 and ProfileSelect skipped/invalidated. TitleBack/logo hiding was active. Readiness result ready=false reason=process_exited_before_ready; telemetry product_core_ready_blocker=title_dialog, product_core_ready_blocks=132, product_core_ready_successes=0, no logo-replacement screenshot files were produced.","error_details":"process_exited_before_ready after building the black carrier; no world-stable proof and no visual screenshot proof. The native black wrapper may not be lifecycle-compatible in this slot, or the argument shape/timing may differ from the prior ProfileSelect carrier.","rollback_reason":"Do not keep the 01_900_Black carrier patch. It regressed runtime readiness and did not produce the requested solid-color coverage evidence.","next_action_hint":"Revert/discard black carrier changes; preserve only the kept ProfileSelect-retirement change. If solid-color coverage is still needed, statically decode the correct native 01_900_Black owner/argument/lifecycle or use an explicitly custom in-memory GFX/native surface rather than this cold wrapper invocation.","artifact_dir":"/home/banon/projects/er-effects-rs/target/runtime-probe/product-continue-direct-20260628-094231","runtime_evidence":{"reason":"process_exited_before_ready","black_cover_built":1,"profile_select_built":0,"false_positives":0}}}
{"run":627,"commit":"978974d","metric":0,"metrics":{"readiness_gate_failures":0,"target_constants_remaining":0,"helpers_missing":0,"fixed_wait_predicates":0,"autoload_static_failures":0,"asset_chain_failures":0,"dll_patch_failures":0,"native_continue_failures":0,"field58_gate_failures":0,"direct_shortcut_failures":0,"input_path_failures":0,"runtime_proof_failures":0,"runtime_mode_failures":0,"eula_popup_failures":0,"save_data_popup_failures":0,"messagebox_dialog_failures":0,"server_status_failures":0,"title_cover_failures":2,"title_cover_penalty":1800,"native_trace_blockers":0,"native_trace_hits_total":74,"native_trace_unique_breakpoints":11,"false_positives":0,"offline_face_source_ready":1,"removed path_cpu_texture_bridge_ready":0,"offline_face_texture_runtime_drawn":0,"stylized_facedata_pixel_oracle":0,"real_portrait_asset_candidates":0,"profile_placeholder_assets_only":1},"status":"discard","description":"Corrected native 01_900_Black solid carrier survived but was not topmost/full-viewport.","timestamp":1782665243697,"segment":2,"confidence":null,"asi":{"hypothesis":"Use native 01_900_Black with the corrected out/rdx/r8 wrapper ABI as a solid-color diagnostic carrier while keeping ProfileSelect invalidated and logo hidden, to test whether a non-ProfileSelect native MenuWindowJob can cover the viewport.","observed_evidence":"Artifact /home/banon/projects/er-effects-rs/target/runtime-probe/product-continue-direct-20260628-094534 reached readiness/world_stable. Debug shows 01_900_Black built via 0x140764290 at +17073ms, ProfileSelect skipped/invalidated, and oracle_title_custom_cover_run_any=true/run_calls=1. User observed the black was not on top and did not cover Press Any Button or Continue. Metrics autoload_re_score=0 false_positives=0 title_cover_failures=2.","rollback_reason":"Discard as product/cover path because it did not cover the title/PAB/Continue layer. Keep only the finding that this native black job is safe but lower/non-topmost in the current sequence.","next_action_hint":"Find a topmost surface/layer insertion point or custom in-memory GFX/native surface attached to a topmost root. Do not rely on the native 01_900_Black job alone for full-viewport cover.","artifact_dir":"/home/banon/projects/er-effects-rs/target/runtime-probe/product-continue-direct-20260628-094534"}}
