{"run":166,"commit":"2100051","metric":1520,"metrics":{"readiness_gate_failures":0,"target_constants_remaining":0,"helpers_missing":0,"fixed_wait_predicates":0,"autoload_static_failures":0,"asset_chain_failures":0,"dll_patch_failures":0,"native_continue_failures":0,"field58_gate_failures":0,"direct_shortcut_failures":0,"input_path_failures":0,"runtime_proof_failures":1,"runtime_mode_failures":0,"eula_popup_failures":0,"save_data_popup_failures":0,"messagebox_dialog_failures":0,"server_status_failures":0,"title_cover_failures":0,"title_cover_penalty":0,"native_trace_blockers":0,"native_trace_hits_total":74,"native_trace_unique_breakpoints":11,"false_positives":0,"runtime_timeout_failures":0,"runtime_title_visual_suppressed_builds":1,"runtime_custom_cover_builds":1,"runtime_simulated_button_presses_total":0},"status":"discard","description":"static found 9abd80 inline-installs adjacent CommandSelectDialog lambdas","timestamp":1782414489690,"segment":0,"confidence":null,"asi":{"hypothesis":"Decoding the constructor/installer around FUN_1409aa070/FUN_1409abd80 or std::function array/vector construction sites would show where adjacent lambdas d076/896b/5903/102a are installed in CommandSelectDialog.","rollback_reason":"Primary metric remained 1520, equal to the persisted best, and runtime_proof_failures remains 1. This iteration produced static installer mapping only.","next_action_hint":"Decode FUN_1409aa8d0, FUN_1409aaa70, and FUN_1409aab10 (plus nearby d076 helper) to map which menu-result/row/condition each adjacent lambda corresponds to, identifying the native transition that selects lambda_896b without cold-calling builders.","static_finding_key":"autoload-9abd80-installs-adjacent-commandselect-lambdas-2026-06-25","evidence":"FUN_1409aa070 creates lambda_4f61 job then chains FUN_1409abd80. Filtered FUN_1409abd80 decompile shows inline stack construction/order: lambda_896b with helper FUN_1409aa8d0; lambda_5903 with FUN_1409aaa70; lambda_102a with FUN_1409aab10; then lambda_d076. The lambda_896b path is the direct 9a9260->9ac8b0 LoadGame builder."}}
{"run":167,"commit":"2100051","metric":1520,"metrics":{"readiness_gate_failures":0,"target_constants_remaining":0,"helpers_missing":0,"fixed_wait_predicates":0,"autoload_static_failures":0,"asset_chain_failures":0,"dll_patch_failures":0,"native_continue_failures":0,"field58_gate_failures":0,"direct_shortcut_failures":0,"input_path_failures":0,"runtime_proof_failures":1,"runtime_mode_failures":0,"eula_popup_failures":0,"save_data_popup_failures":0,"messagebox_dialog_failures":0,"server_status_failures":0,"title_cover_failures":0,"title_cover_penalty":0,"native_trace_blockers":0,"native_trace_hits_total":74,"native_trace_unique_breakpoints":11,"false_positives":0,"runtime_timeout_failures":0,"runtime_title_visual_suppressed_builds":1,"runtime_custom_cover_builds":1,"runtime_simulated_button_presses_total":0},"status":"discard","description":"static mapped CommandSelectDialog row labels and proved lambda896b is Continue","timestamp":1782414698492,"segment":0,"confidence":null,"asi":{"hypothesis":"Decoding FUN_1409aa8d0, FUN_1409aaa70, FUN_1409aab10, and nearby d076 helpers would map which menu-result/row/condition each adjacent lambda corresponds to and identify the native transition selecting lambda_896b.","rollback_reason":"Primary metric remained 1520, equal to the persisted best, and runtime_proof_failures remains 1. This iteration produced a static row-label mapping only.","next_action_hint":"Decode how FUN_1407448b0 stores row entries/results in the CommandSelectDialog list and whether the default selected row/result is CONTINUE; then instrument/preserve that row result passively only if static proof cannot show execution.","static_finding_key":"autoload-commandselectdialog-row-labels-continue-lambda896b-2026-06-25","evidence":"FUN_1409aa8d0 -> GR_MenuText 401301 CONTINUE; aaa70 -> 401302 LOAD GAME; aab10 -> 401303 NEW GAME; aab60 -> 401304 SYSTEM; aaa20 -> 401305 INFORMATION; aaac0 -> 401306 LOG IN; aac00 -> 401309 QUIT GAME. lambda_896b is the CONTINUE row and its _Do_call path reaches 9a9260->9ac8b0->826600."}}
{"run":168,"commit":"2100051","metric":1520,"metrics":{"readiness_gate_failures":0,"target_constants_remaining":0,"helpers_missing":0,"fixed_wait_predicates":0,"autoload_static_failures":0,"asset_chain_failures":0,"dll_patch_failures":0,"native_continue_failures":0,"field58_gate_failures":0,"direct_shortcut_failures":0,"input_path_failures":0,"runtime_proof_failures":1,"runtime_mode_failures":0,"eula_popup_failures":0,"save_data_popup_failures":0,"messagebox_dialog_failures":0,"server_status_failures":0,"title_cover_failures":0,"title_cover_penalty":0,"native_trace_blockers":0,"native_trace_hits_total":74,"native_trace_unique_breakpoints":11,"false_positives":0,"runtime_timeout_failures":0,"runtime_title_visual_suppressed_builds":1,"runtime_custom_cover_builds":1,"runtime_simulated_button_presses_total":0},"status":"discard","description":"static decoded 1407448b0 row storage and Continue index latch","timestamp":1782414881972,"segment":0,"confidence":null,"asi":{"hypothesis":"Decoding how FUN_1407448b0 stores row entries/results in CommandSelectDialog and whether the default selected row/result is CONTINUE would identify the native transition selecting lambda_896b.","rollback_reason":"Primary metric remained 1520, equal to the persisted best, and runtime_proof_failures remains 1. This iteration produced static row-storage mapping only.","next_action_hint":"Find all later uses/writes of iVar12 in FUN_1409abd80 and the call that transfers iVar12/iStack_1118 into CommandSelectDialog selection state; then decide whether a passive hook on that transfer can prove native Continue selection under preserved title without invoking the builder.","static_finding_key":"autoload-1407448b0-row-storage-continue-index-2026-06-25","evidence":"FUN_1407448b0 stores a row via FUN_140748960(param_1+0x28,...). In FUN_1409abd80, after adding lambda_896b/CONTINUE with FUN_1407448b0, iVar12 is set to row_count-1 unconditionally. LOAD/NEW only latch iStack_1118 when iVar4==1/2. Record size is 0x210."}}
{"run":169,"commit":"2100051","metric":1520,"metrics":{"readiness_gate_failures":0,"target_constants_remaining":0,"helpers_missing":0,"fixed_wait_predicates":0,"autoload_static_failures":0,"asset_chain_failures":0,"dll_patch_failures":0,"native_continue_failures":0,"field58_gate_failures":0,"direct_shortcut_failures":0,"input_path_failures":0,"runtime_proof_failures":1,"runtime_mode_failures":0,"eula_popup_failures":0,"save_data_popup_failures":0,"messagebox_dialog_failures":0,"server_status_failures":0,"title_cover_failures":0,"title_cover_penalty":0,"native_trace_blockers":0,"native_trace_hits_total":74,"native_trace_unique_breakpoints":11,"false_positives":0,"runtime_timeout_failures":0,"runtime_title_visual_suppressed_builds":1,"runtime_custom_cover_builds":1,"runtime_simulated_button_presses_total":0},"status":"discard","description":"static traced iVar12 default Continue index into item-list construction","timestamp":1782415051628,"segment":0,"confidence":null,"asi":{"hypothesis":"Finding all later uses/writes of iVar12 in FUN_1409abd80 and the call that transfers iVar12/iStack_1118 into CommandSelectDialog selection state would prove the default Continue row selection path.","rollback_reason":"Primary metric remained 1520, equal to the persisted best, and runtime_proof_failures remains 1. This iteration produced static transfer mapping only.","next_action_hint":"Decode lambda_cb31 _Do_call and FUN_14078d860/FUN_14097ebd0 to prove field/argument semantics: iVar12 should become the default selected row for the ItemList/CommandSelectDialog. If still ambiguous, add only a passive runtime hook at this transfer, not row builders.","static_finding_key":"autoload-iVar12-default-continue-selection-transfer-2026-06-25","evidence":"iVar12 later uses: packed into uStack_1218 and copied to lambda_cb31 data._8_4_; lambda_cb31 is executed to produce MenuHelpLabelComponent-like data; FUN_14097ebd0 prepares it; ItemList/ItemList component is assigned; FUN_14078d860 builds pMVar10 item-list job; then a final Success lambda_3482 job is chained."}}
{"run":170,"commit":"2100051","metric":1520,"metrics":{"readiness_gate_failures":0,"target_constants_remaining":0,"helpers_missing":0,"fixed_wait_predicates":0,"autoload_static_failures":0,"asset_chain_failures":0,"dll_patch_failures":0,"native_continue_failures":0,"field58_gate_failures":0,"direct_shortcut_failures":0,"input_path_failures":0,"runtime_proof_failures":1,"runtime_mode_failures":0,"eula_popup_failures":0,"save_data_popup_failures":0,"messagebox_dialog_failures":0,"server_status_failures":0,"title_cover_failures":0,"title_cover_penalty":0,"native_trace_blockers":0,"native_trace_hits_total":74,"native_trace_unique_breakpoints":11,"false_positives":0,"runtime_timeout_failures":0,"runtime_title_visual_suppressed_builds":1,"runtime_custom_cover_builds":1,"runtime_simulated_button_presses_total":0},"status":"discard","description":"static corrected lambda_cb31 as DLC side-chain not selection proof","timestamp":1782415254179,"segment":0,"confidence":null,"asi":{"hypothesis":"Decoding lambda_cb31 _Do_call and FUN_14078d860/FUN_14097ebd0 would prove field/argument semantics for iVar12 as the default selected row for the ItemList/CommandSelectDialog.","rollback_reason":"Primary metric remained 1520, equal to the persisted best, and runtime_proof_failures remains 1. The static finding corrected the prior interpretation instead of improving product proof.","next_action_hint":"Decode/filter FUN_14078d860 internals for writes of the row container/default index into the item-list job, especially calls around FUN_140743800 or functions taking auStack_1138/param_2. Do not treat lambda_cb31 as selected-row proof.","static_finding_key":"autoload-lambda-cb31-not-selection-proof-2026-06-25","evidence":"lambda_cb31 _Do_call FUN_1409b1180 calls FUN_1409a9500. FUN_1409a9500 checks FUN_1407a9320 and CSDlc field53_0x43, then builds a DLC/system-message side chain with GR_System_Message 0x61f9e and stores it via FUN_1407a9340(param_3+2). FUN_14097ebd0 is a +0x38 callback-object transfer helper."}}
{"run":171,"commit":"2100051","metric":1520,"metrics":{"readiness_gate_failures":0,"target_constants_remaining":0,"helpers_missing":0,"fixed_wait_predicates":0,"autoload_static_failures":0,"asset_chain_failures":0,"dll_patch_failures":0,"native_continue_failures":0,"field58_gate_failures":0,"direct_shortcut_failures":0,"input_path_failures":0,"runtime_proof_failures":1,"runtime_mode_failures":0,"eula_popup_failures":0,"save_data_popup_failures":0,"messagebox_dialog_failures":0,"server_status_failures":0,"title_cover_failures":0,"title_cover_penalty":0,"native_trace_blockers":0,"native_trace_hits_total":74,"native_trace_unique_breakpoints":11,"false_positives":0,"runtime_timeout_failures":0,"runtime_title_visual_suppressed_builds":1,"runtime_custom_cover_builds":1,"runtime_simulated_button_presses_total":0},"status":"discard","description":"static classified 78d860 as item-list wrapper not selector","timestamp":1782415611827,"segment":0,"confidence":null,"asi":{"hypothesis":"Decoding/filtering FUN_14078d860 internals would show where the row container/default index is written into the item-list job, especially calls around FUN_140743800 or functions taking auStack_1138/param_2.","rollback_reason":"Primary metric remained 1520, equal to the persisted best, and runtime_proof_failures remains 1. This static iteration classified the wrapper/copy chain but did not add product proof.","next_action_hint":"Inspect source config fields set immediately before FUN_14078d860 in FUN_1409abd80, especially first dwords and offsets copied by FUN_14078c6c0 plus the param_1+0xcf8/Menu component context; or add a passive hook at FUN_14078d860/FUN_14078c6c0 to log source config fields under native title. Do not call row builders cold.","static_finding_key":"autoload-78d860-itemlist-wrapper-not-selector-2026-06-25","evidence":"FUN_14078d860 copies param_1 via FUN_14078c850, copies again to auStack_33f0, calls FUN_14078b2c0 to install a heap snapshot at result+0x38, then FUN_1407ac9b0 builds a MenuWindowJob. FUN_14078b910 installs lambda_df379 vtable 0x142aa2290; lambda_df Do_call 0x14078eff0 calls FUN_14078d7f0(param+0x10a8,param+0x1108), allocating a 0x2550 MenuWindow-like object via FUN_14078c2e0. FUN_14078c6c0/FUN_14078c850 verbatim-copy the row/config fields."}}
{"run":172,"commit":"2100051","metric":1520,"metrics":{"readiness_gate_failures":0,"target_constants_remaining":0,"helpers_missing":0,"fixed_wait_predicates":0,"autoload_static_failures":0,"asset_chain_failures":0,"dll_patch_failures":0,"native_continue_failures":0,"field58_gate_failures":0,"direct_shortcut_failures":0,"input_path_failures":0,"runtime_proof_failures":1,"runtime_mode_failures":0,"eula_popup_failures":0,"save_data_popup_failures":0,"messagebox_dialog_failures":0,"server_status_failures":0,"title_cover_failures":0,"title_cover_penalty":0,"native_trace_blockers":0,"native_trace_hits_total":74,"native_trace_unique_breakpoints":11,"false_positives":0,"runtime_timeout_failures":0,"runtime_title_visual_suppressed_builds":1,"runtime_custom_cover_builds":1,"runtime_simulated_button_presses_total":0},"status":"discard","description":"static found no direct selected-index store before 78d860","timestamp":1782415804420,"segment":0,"confidence":null,"asi":{"hypothesis":"Inspecting source config fields set immediately before FUN_14078d860 in FUN_1409abd80 would reveal where the default Continue row index is stored before the item-list job snapshot.","rollback_reason":"Primary metric remained 1520, equal to the persisted best, and runtime_proof_failures remains 1. The static finding narrowed the selector path but did not add product proof.","next_action_hint":"Decode FUN_1407448b0/FUN_1407b0f30 row-entry storage and MenuWindowJob initial selection/default behavior, or add only a passive hook at FUN_14078d860/FUN_1407448b0 to log row-count/order and first active row under preserved native title. Do not cold-call row builders or synthesize selection.","static_finding_key":"autoload-9abd80-source-config-no-direct-selected-index-2026-06-25","evidence":"auStack_1138 is initialized by FUN_14078ca40, configured with L\"01_070_CommandList\" plus uStack_1130=0xc/uStack_1128=0x42a93b10/uStack_1124=1, then rows are appended with FUN_1407448b0. iVar12 is computed immediately after the first saved-character Continue row push as ((lStack_1100-lStack_1108)/0x210)-1, but no direct store of iVar12/iStack_1118 into auStack_1138 was observed before FUN_14078d860 snapshots it."}}
{"run":173,"commit":"2100051","metric":1520,"metrics":{"readiness_gate_failures":0,"target_constants_remaining":0,"helpers_missing":0,"fixed_wait_predicates":0,"autoload_static_failures":0,"asset_chain_failures":0,"dll_patch_failures":0,"native_continue_failures":0,"field58_gate_failures":0,"direct_shortcut_failures":0,"input_path_failures":0,"runtime_proof_failures":1,"runtime_mode_failures":0,"eula_popup_failures":0,"save_data_popup_failures":0,"messagebox_dialog_failures":0,"server_status_failures":0,"title_cover_failures":0,"title_cover_penalty":0,"native_trace_blockers":0,"native_trace_hits_total":74,"native_trace_unique_breakpoints":11,"false_positives":0,"runtime_timeout_failures":0,"runtime_title_visual_suppressed_builds":1,"runtime_custom_cover_builds":1,"runtime_simulated_button_presses_total":0},"status":"discard","description":"static classified row helpers as append/storage not selection setters","timestamp":1782415971731,"segment":0,"confidence":null,"asi":{"hypothesis":"Decoding FUN_1407448b0/FUN_1407b0f30 row-entry storage and MenuWindowJob initial selection/default behavior would reveal whether the first Continue row becomes selected by storage-time defaulting or later CommandList runtime behavior.","rollback_reason":"Primary metric remained 1520, equal to the persisted best, and runtime_proof_failures remains 1. This static iteration proved row storage semantics but not runtime proof.","next_action_hint":"Decode FUN_14078c2e0 and/or MenuWindowJob/CommandList initial-selection logic for how row 0 becomes the selected/default active row, or add a passive runtime hook logging row vector start/end and first row lambda/vtable under preserved native title. Do not cold-call row builders or synthesize selection.","static_finding_key":"autoload-row-storage-append-not-selection-setter-2026-06-25","evidence":"FUN_1407448b0 and FUN_1407b0f30 build temp row entries and append to config+0x28 via FUN_140748960. FUN_140748960 grows/copies a 0x210-byte record and increments vector end by 0x210, explaining iVar12=((end-start)/0x210)-1. No selected/default-index store was found in these helpers; they are append/storage primitives."}}
{"run":174,"commit":"2100051","metric":1520,"metrics":{"readiness_gate_failures":0,"target_constants_remaining":0,"helpers_missing":0,"fixed_wait_predicates":0,"autoload_static_failures":0,"asset_chain_failures":0,"dll_patch_failures":0,"native_continue_failures":0,"field58_gate_failures":0,"direct_shortcut_failures":0,"input_path_failures":0,"runtime_proof_failures":1,"runtime_mode_failures":0,"eula_popup_failures":0,"save_data_popup_failures":0,"messagebox_dialog_failures":0,"server_status_failures":0,"title_cover_failures":0,"title_cover_penalty":0,"native_trace_blockers":0,"native_trace_hits_total":74,"native_trace_unique_breakpoints":11,"false_positives":0,"runtime_timeout_failures":0,"runtime_title_visual_suppressed_builds":1,"runtime_custom_cover_builds":1,"runtime_simulated_button_presses_total":0},"status":"discard","description":"static found CommandList constructor initial index zero","timestamp":1782416145332,"segment":0,"confidence":null,"asi":{"hypothesis":"Decoding FUN_14078c2e0 and MenuWindowJob/CommandList initial-selection logic would show how row 0 becomes the selected/default active row after row storage only appends entries.","rollback_reason":"Primary metric remained 1520, equal to the persisted best, and runtime_proof_failures remains 1. Static evidence improved selected-row identity but did not add runtime proof.","next_action_hint":"Decode the GenericListSelectDialog constructor/FUN_14078fdb0 enough to name the sixth constructor argument as initial selection, or add a passive runtime oracle at FUN_14078c2e0/FUN_14078d860 that logs row count, first-row lambda/vtable, and constructor initial-index argument under preserved native title. Do not cold-call MenuWindowJob/row builders or synthesize selection.","static_finding_key":"autoload-commandlist-constructor-initial-index-zero-2026-06-25","evidence":"FUN_14078c2e0 calls CS::GenericListSelectDialog::GenericListSelectDialog(param_1,param_2,pSVar3,*(byte *)(config+0x109a),FUN_140767ee0(...0xffff),0,*(byte *)(config+0x1098)); the literal sixth argument is 0. It then sets CS::CommandSelectDialog vtable, copies config, clears field_0x10a0, sets component path and calls FUN_14078fdb0. Since Continue is the first appended row when a saved character exists, this is strong static evidence for row0/default Continue."}}
{"run":175,"commit":"2100051","metric":1520,"metrics":{"readiness_gate_failures":0,"target_constants_remaining":0,"helpers_missing":0,"fixed_wait_predicates":0,"autoload_static_failures":0,"asset_chain_failures":0,"dll_patch_failures":0,"native_continue_failures":0,"field58_gate_failures":0,"direct_shortcut_failures":0,"input_path_failures":0,"runtime_proof_failures":1,"runtime_mode_failures":0,"eula_popup_failures":0,"save_data_popup_failures":0,"messagebox_dialog_failures":0,"server_status_failures":0,"title_cover_failures":0,"title_cover_penalty":0,"native_trace_blockers":0,"native_trace_hits_total":74,"native_trace_unique_breakpoints":11,"false_positives":0,"runtime_timeout_failures":0,"runtime_title_visual_suppressed_builds":1,"runtime_custom_cover_builds":1,"runtime_simulated_button_presses_total":0},"status":"discard","description":"static corrected GenericList param6 as not selection proof","timestamp":1782416463539,"segment":0,"confidence":null,"asi":{"hypothesis":"Decoding the GenericListSelectDialog constructor/FUN_14078fdb0 would name or refute the literal sixth ctor argument from FUN_14078c2e0 as initial selected row.","rollback_reason":"Primary metric remained 1520, equal to the persisted best, and runtime_proof_failures remains 1. The static finding corrected over-strong prior evidence instead of improving product proof.","next_action_hint":"Decode field1_0xa38 list-control vtable/update or add a passive runtime oracle at constructed GenericListSelectDialog to log active/selected row. Do not treat param6=0 as selection proof and do not cold-call row builders.","static_finding_key":"autoload-genericlist-param6-not-selection-proof-2026-06-25","evidence":"FindByName resolves GenericListSelectDialog ctor at dump 0x14078c560. FUN_14078c2e0 passes literal 0 as param6, but ctor forwards param6 to FUN_140735b90(&field1_0xa38, sceneObj, param6,...). FUN_140735b90 initializes a control subobject and uses param3 in FUN_140733740(..., \"LeftArrow\", param3,...); no obvious selected-row store was found. FUN_14077f020 branches on param7 for animation/function chains."}}
