{"run":52,"commit":"2100051","metric":0,"metrics":{"readiness_gate_failures":0,"target_constants_remaining":0,"helpers_missing":0,"fixed_wait_predicates":0,"autoload_static_failures":0,"asset_chain_failures":0,"dll_patch_failures":0,"native_continue_failures":0,"field58_gate_failures":0,"direct_shortcut_failures":0,"input_path_failures":0,"runtime_proof_failures":1,"runtime_mode_failures":0,"eula_popup_failures":0,"save_data_popup_failures":0,"messagebox_dialog_failures":0,"server_status_failures":0,"title_cover_failures":0,"title_cover_penalty":0,"native_trace_blockers":0,"native_trace_hits_total":74,"native_trace_unique_breakpoints":11,"false_positives":0,"runtime_timeout_failures":1,"runtime_title_visual_suppressed_builds":0,"runtime_custom_cover_builds":0,"runtime_simulated_button_presses_total":0},"status":"crash","description":"main-menu MenuWindowJob::Run ticks prove selected Continue item is the idle-accept candidate with valid result object","timestamp":1782364629742,"segment":0,"confidence":4.64,"asi":{"hypothesis":"Log every early MenuWindowJob::Run/Update call at the main title menu so the selected Continue item can be identified by native pump activity rather than constructor guesses.","rollback_reason":"Diagnostic-only timeout, but the key semantic blocker was resolved: while Continue is highlighted, the native pump repeatedly ticks exactly one MenuWindowJob item 0x7ffe9e52c000. That item has vtable 0x142aa97e8, functor 0x7ffe9e52c070, slot10=0x140764b80, accept/field7 function 0x1407add70 (constant false/no-input), and a valid result object at +0x130 with vtable 0x142aa0080. Telemetry reported 7631 update hits and 1984 Continue candidate hits on this same item. This means the previous product rejection of the 'idle' candidate was too strict: the idle predicate is the no-input field7 return in MenuWindowJob::Run, not proof the selected Continue item is non-semantic. No product submit was attempted in this diagnostic run.","next_action_hint":"Patch product_continue_item_action to accept the repeatedly ticking selected Continue candidate even when its field7/accept function is the constant-false idle predicate, as long as the item vtable is MenuWindowJob, the functor slot matches the known Continue candidate marker, and result+0x130 has a valid in-image vtable. Keep result+0x58 diagnostic-only. Then run a zero-input product runtime sentinel (not manual) to see whether native_submit_7ac890 on the selected result enters native_continue/load. This is native submit semantics, not a direct load/deserialize shortcut.","artifact_dir":"/home/banon/projects/er-effects-rs/target/runtime-probe/product-continue-direct-20260624-221407","observed_runtime_oracles":{"readiness_result_present":false,"telemetry_present":true,"golden_save_staged":true,"menu_item_update_hits":7631,"menu_item_update_last_item":"0x7ffe9e52c000","menu_item_update_last_vt":"0x142aa97e8","menu_item_update_last_functor":"0x7ffe9e52c070","menu_item_update_last_docall":"0x140764b80","menu_item_update_last_accept":"0x1407add70","menu_continue_candidate_hits":1984,"menu_continue_candidate_item":"0x7ffe9e52c000","menu_continue_candidate_idle_accept_hits":1984,"menu_continue_candidate_native_accept_hits":0,"selected_item_result_ptr":"0x7ffe94cd5d60","selected_item_result_vt":"0x142aa0080","oracle_native_submit_hits":0,"semantic_menu_item_update_hits":0,"simulated_button_presses_total":0,"messagebox_total_builds":0,"policy_window_total_builds":0,"processes_remaining":0},"static_re":"Ghidra decompilation of MenuWindowJob::Run (dump 0x1407ad2b0, deobf 0x1407ad1c0) shows field7_0xf0.impl is invoked each tick; value 1 would call native submit helper 0x1407ac980 on owningMenuWindow, but constant-false 0x1407add70 simply means no user accept occurred. The same Run path still reads owningMenuWindow->field254_0x1e8 and sets Continue otherwise. Therefore product code can use the selected item/result object for native submit once Continue exists, without relying on field7 returning true.","build":"cargo xwin build --release --target x86_64-pc-windows-msvc succeeded before runtime.","cleanup":"No eldenring.exe or start_protected_game.exe processes remained."}}
{"run":53,"commit":"2100051","metric":0,"metrics":{"readiness_gate_failures":0,"target_constants_remaining":0,"helpers_missing":0,"fixed_wait_predicates":0,"autoload_static_failures":0,"asset_chain_failures":0,"dll_patch_failures":0,"native_continue_failures":0,"field58_gate_failures":0,"direct_shortcut_failures":0,"input_path_failures":0,"runtime_proof_failures":1,"runtime_mode_failures":0,"eula_popup_failures":0,"save_data_popup_failures":0,"messagebox_dialog_failures":0,"server_status_failures":0,"title_cover_failures":0,"title_cover_penalty":0,"native_trace_blockers":0,"native_trace_hits_total":74,"native_trace_unique_breakpoints":11,"false_positives":0,"runtime_timeout_failures":1,"runtime_title_visual_suppressed_builds":0,"runtime_custom_cover_builds":0,"runtime_simulated_button_presses_total":0},"status":"crash","description":"selected idle-tick native-submit patch was not exercised because runtime launched save_requested instead of direct_menu_load","timestamp":1782364861691,"segment":0,"confidence":4.64,"asi":{"hypothesis":"Allow product_continue_item_action to submit the selected idle-tick Continue candidate's valid result object via native submit, then run zero-input product runtime proof.","rollback_reason":"The experiment was misconfigured and did not exercise the patched direct_menu_load/product_core path. Telemetry shows autoload_method='save_requested', product_autoload_armed=false, product_core_autoload_ticks=0, product_core_ready_blocker=unseen, menu_item_update_hits=0, and no selected-idle/native-submit logs. Runtime timed out waiting for title bootstrap. The code patch itself needs rerun with AUTOLOAD_REQUEST method=direct_menu_load plus ER_EFFECTS_EXPERIMENTAL_DIRECT_MENU_LOAD=1.","next_action_hint":"Reapply the selected idle-tick native-submit patch, then run .auto/measure.sh with .auto/run_runtime_probe_once plus AUTOLOAD_REQUEST=/home/banon/projects/er-effects-rs/target/autoresearch/active-account-converted-nonempty-slot0/er-effects-autoload.product-continue-slot0.txt and ER_EFFECTS_EXPERIMENTAL_DIRECT_MENU_LOAD=1 so product_core is armed.","artifact_dir":"/home/banon/projects/er-effects-rs/target/runtime-probe/product-continue-direct-20260624-221823","observed_runtime_oracles":{"autoload_method":"save_requested","product_autoload_armed":false,"product_core_autoload_ticks":0,"product_core_ready_blocker":"unseen","blocker":"autoload_not_attempted_waiting_title_bootstrap","profile_slot_active_bytes_qword":"0x0","menu_item_update_hits":0,"menu_continue_candidate_hits":0,"native_submit_hits":0,"simulated_button_presses_total":0,"messagebox_total_builds":0,"policy_window_total_builds":0,"processes_remaining":0},"build":"cargo xwin build --release --target x86_64-pc-windows-msvc succeeded before runtime, but launch request method was wrong.","cleanup":"No eldenring.exe or start_protected_game.exe processes remained."}}
{"run":54,"commit":"2100051","metric":0,"metrics":{"readiness_gate_failures":0,"target_constants_remaining":0,"helpers_missing":0,"fixed_wait_predicates":0,"autoload_static_failures":0,"asset_chain_failures":0,"dll_patch_failures":0,"native_continue_failures":0,"field58_gate_failures":0,"direct_shortcut_failures":0,"input_path_failures":0,"runtime_proof_failures":1,"runtime_mode_failures":0,"eula_popup_failures":0,"save_data_popup_failures":0,"messagebox_dialog_failures":0,"server_status_failures":0,"title_cover_failures":0,"title_cover_penalty":0,"native_trace_blockers":0,"native_trace_hits_total":74,"native_trace_unique_breakpoints":11,"false_positives":0,"runtime_timeout_failures":1,"runtime_title_visual_suppressed_builds":0,"runtime_custom_cover_builds":0,"runtime_simulated_button_presses_total":0},"status":"crash","description":"direct_menu_load selected-idle submit patch armed product_core but readiness blocked on title_dialog before submit","timestamp":1782365047344,"segment":0,"confidence":4.64,"asi":{"hypothesis":"Correctly arm direct_menu_load with the selected idle-tick native-submit patch so product_core submits the selected Continue result object zero-input.","rollback_reason":"The run was correctly armed (`autoload_method=direct_menu_load`, `product_autoload_armed=true`) and the selected Continue candidate appeared (`menu_continue_candidate_hits=608`, item 0x7fff7192c000, idle accept 0x1407add70). But product_core never reached product_continue_item_action: readiness blocked on `product_core_title_dialog` for all 666 ticks. It saw valid owner/session/gm/gdm/profile/iodev/heap and menu candidate telemetry, but `product_core_last_title_dialog_vt=0x142b229f8` did not match the strict TitleTopDialog vtable gate, so native submit was not attempted.","next_action_hint":"Reapply selected idle-tick submit patch and add a readiness fallback: when `MENU_CONTINUE_CANDIDATE_ITEM` is already ticking and the core basics are present (owner, session, GameMan/GameDataMan profile, iodev, heap), call product_continue_autoload_tick with a minimal ready struct instead of blocking on TitleTopDialog/press-start. This uses the stronger observed native menu candidate as readiness and should reach native_submit_7ac890.","artifact_dir":"/home/banon/projects/er-effects-rs/target/runtime-probe/product-continue-direct-20260624-222200","observed_runtime_oracles":{"autoload_method":"direct_menu_load","product_autoload_armed":true,"product_core_autoload_ticks":666,"product_core_ready_blocks":666,"product_core_ready_successes":0,"product_core_ready_blocker":"title_dialog","product_core_last_owner":"0x7ffffdffa440","product_core_last_title_dialog":"0x7fff69e44d50","product_core_last_title_dialog_vt":"0x142b229f8","product_core_last_press_start_proxy":"0x7fff69e458c8","product_core_last_press_start_vt":"0x7fff69e45dc0","profile_slot_active_bytes_qword":"0x1","menu_continue_candidate_hits":608,"menu_continue_candidate_item":"0x7fff7192c000","menu_continue_candidate_idle_accept_hits":608,"menu_item_update_hits":1688,"oracle_native_submit_hits":0,"native_continue_chain_stage":"pre_submit","simulated_button_presses_total":0,"messagebox_total_builds":0,"policy_window_total_builds":0,"processes_remaining":0},"build":"cargo xwin build --release --target x86_64-pc-windows-msvc succeeded before runtime.","cleanup":"No eldenring.exe or start_protected_game.exe processes remained."}}
{"run":55,"commit":"2100051","metric":0,"metrics":{"readiness_gate_failures":1,"target_constants_remaining":0,"helpers_missing":0,"fixed_wait_predicates":0,"autoload_static_failures":1,"asset_chain_failures":0,"dll_patch_failures":0,"native_continue_failures":0,"field58_gate_failures":0,"direct_shortcut_failures":0,"input_path_failures":0,"runtime_proof_failures":1,"runtime_mode_failures":0,"eula_popup_failures":0,"save_data_popup_failures":0,"messagebox_dialog_failures":0,"server_status_failures":0,"title_cover_failures":0,"title_cover_penalty":0,"native_trace_blockers":0,"native_trace_hits_total":74,"native_trace_unique_breakpoints":11,"false_positives":0,"runtime_timeout_failures":1,"runtime_title_visual_suppressed_builds":0,"runtime_custom_cover_builds":0,"runtime_simulated_button_presses_total":0},"status":"crash","description":"candidate-readiness fallback reached product_continue_autoload_tick but action_ready still blocked submit on title dialog/menu latch","timestamp":1782365264108,"segment":0,"confidence":4.64,"asi":{"hypothesis":"If a selected Continue candidate is already ticking, use that stronger native-menu evidence to override the strict TitleTopDialog readiness blocker and reach product_continue_autoload_tick/submit.","rollback_reason":"Diagnostic-only timeout. The fallback fired repeatedly (628 product-core-autoload logs: selected Continue candidate overrides title-dialog readiness blocker), so product_continue_autoload_tick was reached. However native submit still did not occur because product_continue_action_ready independently requires `ready.menu_opened_latch != 0` and `ready.title_dialog` vtable == TitleTopDialog. The fallback ready struct preserved menu_latch=0 and dialog_vt=0x142b229f8, so action_ready returned false and no 'selected idle-tick candidate accepted' / native_submit_7ac890 logs appeared. Static measure also dropped to 1505 because the new fallback lacks matching guard updates.","next_action_hint":"Reapply selected idle-tick submit and candidate readiness fallback, then update product_continue_action_ready to return true when `MENU_CONTINUE_CANDIDATE_ITEM` is present and gm/slot are valid. This uses the selected native candidate as the readiness gate instead of title dialog/menu-latch fields. Add/update static measure/check guard text so the fallback is not scored as autoload_static_failures/readiness_gate_failures if runtime proof succeeds.","artifact_dir":"/home/banon/projects/er-effects-rs/target/runtime-probe/product-continue-direct-20260624-222540","observed_runtime_oracles":{"autoload_method":"direct_menu_load","product_autoload_armed":true,"product_core_autoload_ticks":660,"product_core_ready_blocker":"ready","product_core_ready_successes":628,"candidate_override_logs":628,"menu_continue_candidate_hits":602,"menu_continue_candidate_item":"0x7fff7192c000","menu_continue_candidate_idle_accept_hits":602,"menu_item_update_hits":1670,"native_submit_hits":0,"selected_idle_candidate_accepted_logs":0,"native_continue_submit_abi_logs":0,"native_continue_chain_stage":"pre_submit","profile_slot_active_bytes_qword":"0x1","simulated_button_presses_total":0,"messagebox_total_builds":0,"policy_window_total_builds":0,"processes_remaining":0},"static_re":"product_continue_action_ready still contains the old dialog_vt/menu_latch readiness predicate even after product_core_autoload_tick has accepted the native selected candidate as readiness.","build":"cargo xwin build --release --target x86_64-pc-windows-msvc succeeded before runtime.","cleanup":"No eldenring.exe or start_protected_game.exe processes remained."}}
{"run":56,"commit":"2100051","metric":0,"metrics":{"readiness_gate_failures":1,"target_constants_remaining":0,"helpers_missing":0,"fixed_wait_predicates":0,"autoload_static_failures":1,"asset_chain_failures":0,"dll_patch_failures":0,"native_continue_failures":0,"field58_gate_failures":0,"direct_shortcut_failures":0,"input_path_failures":0,"runtime_proof_failures":1,"runtime_mode_failures":0,"eula_popup_failures":0,"save_data_popup_failures":0,"messagebox_dialog_failures":0,"server_status_failures":0,"title_cover_failures":0,"title_cover_penalty":0,"native_trace_blockers":0,"native_trace_hits_total":74,"native_trace_unique_breakpoints":11,"false_positives":0,"runtime_timeout_failures":1,"runtime_title_visual_suppressed_builds":0,"runtime_custom_cover_builds":0,"runtime_simulated_button_presses_total":0},"status":"crash","description":"action-ready selected-candidate override reached submit branch but product_continue_item_action returned None silently","timestamp":1782365472582,"segment":0,"confidence":4.64,"asi":{"hypothesis":"When a selected Continue candidate exists, product_continue_action_ready should treat it as semantic readiness and allow product_continue_autoload_tick to attempt native submit.","rollback_reason":"Diagnostic-only timeout. Candidate readiness override continued firing and action_ready should now pass, but no native submit occurred. Logs showed no `selected idle-tick candidate accepted`, no `native Continue MenuWindowJob rejected`, and no native_submit_7ac890. Therefore product_continue_item_action likely returns None through an unlogged early return (null item/vt/functor/functor_vt/do_call/result) before the current rejection messages. Runtime telemetry still has candidate item/update evidence, so the next step is to instrument those early returns rather than changing semantics again.","next_action_hint":"Add explicit autoload-debug logs in product_continue_item_action before every early return: null item, wrong vtable, null functor, null functor_vt, missing do_call, do_call mismatch, null result, invalid result_vt. Rerun the same direct_menu_load probe. This should reveal the exact stale offset/field causing the selected candidate not to materialize as NativeContinueItemAction.","artifact_dir":"/home/banon/projects/er-effects-rs/target/runtime-probe/product-continue-direct-20260624-222900","observed_runtime_oracles":{"autoload_method":"direct_menu_load","product_autoload_armed":true,"product_core_autoload_ticks":682,"product_core_ready_blocker":"ready","candidate_override_logs":"present repeatedly","menu_continue_candidate_hits":624,"menu_continue_candidate_item":"0x7ffe9e52c000","menu_continue_candidate_idle_accept_hits":624,"menu_item_update_hits":1736,"menu_item_update_last_accept":"0x1407add70","menu_item_update_last_docall":"0x140764b80","native_submit_hits":0,"selected_idle_candidate_accepted_logs":0,"native_continue_rejection_logs":0,"native_continue_chain_stage":"pre_submit","simulated_button_presses_total":0,"messagebox_total_builds":0,"policy_window_total_builds":0,"processes_remaining":0},"build":"cargo xwin build --release --target x86_64-pc-windows-msvc succeeded before runtime.","cleanup":"No eldenring.exe or start_protected_game.exe processes remained."}}
{"run":57,"commit":"2100051","metric":0,"metrics":{"readiness_gate_failures":1,"target_constants_remaining":0,"helpers_missing":0,"fixed_wait_predicates":0,"autoload_static_failures":1,"asset_chain_failures":0,"dll_patch_failures":0,"native_continue_failures":0,"field58_gate_failures":0,"direct_shortcut_failures":0,"input_path_failures":0,"runtime_proof_failures":1,"runtime_mode_failures":0,"eula_popup_failures":0,"save_data_popup_failures":0,"messagebox_dialog_failures":0,"server_status_failures":0,"title_cover_failures":0,"title_cover_penalty":0,"native_trace_blockers":0,"native_trace_hits_total":74,"native_trace_unique_breakpoints":11,"false_positives":0,"runtime_timeout_failures":1,"runtime_title_visual_suppressed_builds":0,"runtime_custom_cover_builds":0,"runtime_simulated_button_presses_total":0},"status":"crash","description":"item-action early-return diagnostics did not fire, proving submit exits before product_continue_item_action","timestamp":1782365706938,"segment":0,"confidence":4.64,"asi":{"hypothesis":"Instrument every early return in product_continue_item_action so the next zero-input probe reveals why the selected Continue candidate is not becoming a NativeContinueItemAction.","rollback_reason":"Diagnostic-only timeout. The selected candidate override still fired repeatedly and runtime telemetry still showed the selected candidate item/update evidence, but none of the newly-added product_continue_item_action diagnostics fired: no unavailable item, vtable/functor/docall/accept/result rejection, and no selected-idle acceptance. Therefore product_continue_autoload_tick is exiting before calling product_continue_item_action, likely on an unlogged pre-action gate such as product_continue_action_ready, b80, or profile_slot_fingerprint timing.","next_action_hint":"Add an explicit pre-action gate diagnostic inside product_continue_autoload_tick before/around product_continue_action_ready, b80, profile_slot_fingerprint, and the product_continue_item_action call. Log phase, action_ready result, b80, profile_real/map/level/name_len, candidate item, menu_latch, title_dialog/vt, and tick. Rerun the same direct_menu_load probe.","artifact_dir":"/home/banon/projects/er-effects-rs/target/runtime-probe/product-continue-direct-20260624-223317","observed_runtime_oracles":{"autoload_method":"direct_menu_load","product_autoload_armed":true,"product_core_autoload_ticks":682,"product_core_ready_blocker":"ready","candidate_override_logs":"present repeatedly through tick ~684","menu_continue_candidate_hits":624,"menu_continue_candidate_item":"0x7ffe9e52c000","menu_continue_candidate_idle_accept_hits":624,"menu_item_update_hits":1736,"native_submit_hits":0,"product_continue_item_action_diagnostic_logs":0,"selected_idle_candidate_accepted_logs":0,"native_continue_chain_stage":"pre_submit","simulated_button_presses_total":0,"messagebox_total_builds":0,"policy_window_total_builds":0,"processes_remaining":0},"build":"cargo xwin build --release --target x86_64-pc-windows-msvc succeeded before runtime.","cleanup":"No eldenring.exe or start_protected_game.exe processes remained."}}
