{"run":610,"commit":"978974d","metric":0,"metrics":{"readiness_gate_failures":0,"target_constants_remaining":0,"helpers_missing":0,"fixed_wait_predicates":0,"autoload_static_failures":0,"asset_chain_failures":0,"dll_patch_failures":0,"native_continue_failures":0,"field58_gate_failures":0,"direct_shortcut_failures":0,"input_path_failures":0,"runtime_proof_failures":0,"runtime_mode_failures":0,"eula_popup_failures":0,"save_data_popup_failures":0,"messagebox_dialog_failures":0,"server_status_failures":0,"title_cover_failures":2,"title_cover_penalty":1800,"native_trace_blockers":0,"native_trace_hits_total":74,"native_trace_unique_breakpoints":11,"false_positives":0,"offline_face_source_ready":1,"removed path_cpu_texture_bridge_ready":0,"offline_face_texture_runtime_drawn":0,"stylized_facedata_pixel_oracle":0,"real_portrait_asset_candidates":0,"profile_placeholder_assets_only":1},"status":"discard","description":"Static RE grounded TitleBack MenuResource bind-owner ABI and safe next probe.","timestamp":1782661515173,"segment":2,"confidence":null,"asi":{"hypothesis":"Determine whether the existing dialog+0xaa8 TitleBackViewParts/MenuResource can safely host FUN_1407452c0, or whether raw binds are invalid by design.","observed_evidence":"Ghidra: MenuResource ctor dump 0x140748b30 zeroes +0x58/+0x60 after copying load_info; TitleBack ctor dump 0x1409a62d0 calls FUN_140749290(MenuResource=this+0x8, SceneObjProxy=this+0x70); FUN_140749290 calls FUN_140749840 when *(MenuResource+0x60)==0; FUN_140749840 loads Scaleform through FUN_140d6a990, stores the owner/object at MenuResource+0x60, builds load result, constructs SceneObjProxy, and finalizes visibility. FUN_1407452c0 calls FUN_140748700(owner+0x60) then FUN_140d6ac00; FUN_140748700 appends to a fixed vector with count at owner+0x60+0x608 and capacity 0x10 entries. Finding saved as bd memory titleback-menuresource-bind-owner-abi-static-2026-06-28. Measure gate passed: /tmp/pi-experiment-55e113913545c696.log.","rollback_reason":"Primary metric stayed 0. Static ABI grounding only; no implemented portrait surface/oracle.","next_action_hint":"Next add observe-only telemetry for existing dialog+0xaa8 MenuResource+0x60 pointer/count/capacity after the aliased GFX load. Only if initialized and count<0x10 should a later experiment try a single native-shaped MENU_DummyProfileFace_01 -> SYSTEX_Menu_Profile00 bind on the existing title resource owner."}}
{"run":611,"commit":"978974d","metric":0,"metrics":{"readiness_gate_failures":0,"target_constants_remaining":0,"helpers_missing":0,"fixed_wait_predicates":0,"autoload_static_failures":0,"asset_chain_failures":0,"dll_patch_failures":0,"native_continue_failures":0,"field58_gate_failures":0,"direct_shortcut_failures":0,"input_path_failures":0,"runtime_proof_failures":0,"runtime_mode_failures":0,"eula_popup_failures":0,"save_data_popup_failures":0,"messagebox_dialog_failures":0,"server_status_failures":0,"title_cover_failures":2,"title_cover_penalty":1800,"native_trace_blockers":0,"native_trace_hits_total":74,"native_trace_unique_breakpoints":11,"false_positives":0,"offline_face_source_ready":1,"removed path_cpu_texture_bridge_ready":0,"offline_face_texture_runtime_drawn":0,"stylized_facedata_pixel_oracle":0,"real_portrait_asset_candidates":0,"profile_placeholder_assets_only":1},"status":"discard","description":"Observed existing TitleBack bind owner is initialized with empty safe vector.","timestamp":1782661820205,"segment":2,"confidence":null,"asi":{"hypothesis":"Add observe-only telemetry for the existing dialog+0xaa8 TitleBackViewParts/MenuResource bind owner under the existing-object ProfileSelect alias, proving MenuResource+0x60 pointer and bind-vector count/capacity before any native bind call.","observed_evidence":"Runtime artifact /home/banon/projects/er-effects-rs/target/runtime-probe/product-continue-direct-20260628-084911 passed without crash. Telemetry: alias_hits=1, alias last_ret=0x7ffe96434650, bind_owner_samples=86, logo=0x7ffe969e1cc8, menu_resource=0x7ffe969e1cd0, owner=0x7ffe9e5dcf00, vector=0x7ffe9e5dcf60, count=0, capacity=16, count_safe=true. Debug repeatedly sampled the same owner/vector/count=0 via SetVisible detour. Profile source SYSTEX_Menu_Profile00 was ready but no bind was attempted; visible result remained ProfileSelect placeholder/dummy UI. Finding saved as bd memory existing-titleback-bind-owner-safe-empty-vector-2026-06-28.","rollback_reason":"Primary metric stayed 0. This was observe-only telemetry and did not render the loaded-character portrait; placeholder ProfileSelect UI remains non-product.","next_action_hint":"Next experiment may try one gated native-shaped MENU_DummyProfileFace_01 -> SYSTEX_Menu_Profile00 bind on the existing TitleBack MenuResource owner only after count==0/count_safe, while still treating bind-only evidence as plumbing until visible pixels/native surface prove the portrait."}}
{"run":612,"commit":"978974d","metric":0,"metrics":{"readiness_gate_failures":0,"target_constants_remaining":0,"helpers_missing":0,"fixed_wait_predicates":0,"autoload_static_failures":0,"asset_chain_failures":0,"dll_patch_failures":0,"native_continue_failures":0,"field58_gate_failures":0,"direct_shortcut_failures":0,"input_path_failures":0,"runtime_proof_failures":1,"runtime_mode_failures":0,"eula_popup_failures":0,"save_data_popup_failures":0,"messagebox_dialog_failures":0,"server_status_failures":0,"title_cover_failures":2,"title_cover_penalty":1800,"native_trace_blockers":0,"native_trace_hits_total":74,"native_trace_unique_breakpoints":11,"false_positives":0,"offline_face_source_ready":0,"removed path_cpu_texture_bridge_ready":0,"offline_face_texture_runtime_drawn":0,"stylized_facedata_pixel_oracle":0,"real_portrait_asset_candidates":0,"profile_placeholder_assets_only":1},"status":"crash","description":"One gated existing-TitleBack native bind crashed inside CSScaleform bind apply.","timestamp":1782662101437,"segment":2,"confidence":null,"asi":{"hypothesis":"After #611 proved existing TitleBack/MenuResource owner initialized with count=0/capacity=16, try exactly one native-shaped MENU_DummyProfileFace_01 -> SYSTEX_Menu_Profile00 bind on that existing owner under the explicit alias gate, with no duplicate TitleBack and no ProfileSelect job replay.","observed_evidence":"Artifact /home/banon/projects/er-effects-rs/target/runtime-probe/product-continue-direct-20260628-085341 failed process_exited_before_ready. Debug: alias hit ret=0x7ffe957c4650; sampled menu_resource=0x7ffe969e1cd0 owner=0x7ffe9e5dcf00 count=0; attempted bind symbol=MENU_DummyProfileFace_01 target=SYSTEX_Menu_Profile00. The installed bind observer rewrote symbol to MENU_FL_40135_Profile before forwarding and recorded hit=1, then process access-violated at game rva=0x1eb9999 addr=0x141eb9999. Finding saved as bd memory existing-titleback-one-bind-crashes-in-csscaleform-2026-06-28.","rollback_reason":"Runtime crashed before readiness. Late binding existing TitleBack/MenuResource through FUN_1407452c0/FUN_140d6ac00 is unsafe despite initialized owner and empty vector, at least with current object state/pair path.","next_action_hint":"Do not retry one-bind on existing TitleBack unchanged. Pivot to a native/custom surface whose bind pass occurs during construction, or statically decode FUN_140d7c0c0/Scaleform object state to learn why late title-resource binds crash before any further bind attempt."}}
{"run":613,"commit":"978974d","metric":0,"metrics":{"readiness_gate_failures":0,"target_constants_remaining":0,"helpers_missing":0,"fixed_wait_predicates":0,"autoload_static_failures":0,"asset_chain_failures":0,"dll_patch_failures":0,"native_continue_failures":0,"field58_gate_failures":0,"direct_shortcut_failures":0,"input_path_failures":0,"runtime_proof_failures":0,"runtime_mode_failures":0,"eula_popup_failures":0,"save_data_popup_failures":0,"messagebox_dialog_failures":0,"server_status_failures":0,"title_cover_failures":3,"title_cover_penalty":2000,"native_trace_blockers":0,"native_trace_hits_total":74,"native_trace_unique_breakpoints":11,"false_positives":0,"offline_face_source_ready":1,"removed path_cpu_texture_bridge_ready":0,"offline_face_texture_runtime_drawn":0,"stylized_facedata_pixel_oracle":0,"real_portrait_asset_candidates":0,"profile_placeholder_assets_only":1},"status":"discard","description":"Static decode corrected TitleBack/MenuResource is not a valid bind owner.","timestamp":1782662260576,"segment":2,"confidence":null,"asi":{"hypothesis":"Decode FUN_140d7c0c0/FUN_140d7be60 and crash caller evidence from #612 to identify why the gated existing-TitleBack bind crashed, instead of retrying the runtime bind.","observed_evidence":"FUN_140d7c0c0 requires the GFx object state (flags&0x8f)==0x0a, resolves root/member object, converts symbol/target strings via FUN_140d7c850, then calls FUN_140d7be60. Crash mapping shows 0x141eb9999 is inside DLPanic and caller 0x140748642 maps to dump 0x140748742 in FUN_140748700 fixed-vector append. FUN_1407452c0 calls FUN_140748700(param_1+0x60). For TitleBackViewParts+0x8/MenuResource, +0x60 is a pointer to the loaded Scaleform owner/object, not an inline DLFixedVector. The #611 sampler followed that pointer and sampled owner+0x60+0x608, but FUN_140748700 actually read MenuResource+0x668, causing fixed-vector panic. Finding saved as bd memory titleback-menuresource-not-fun7452c0-owner-correction-2026-06-28. Measure gate passed: /tmp/pi-experiment-d3363a378c51caac.log.","rollback_reason":"Primary metric stayed 0. This static correction invalidates the existing TitleBack MenuResource bind route but does not implement a new visible portrait surface.","next_action_hint":"Do not pass TitleBackViewParts+0x8/MenuResource to FUN_1407452c0 again. A valid owner is ProfileSelect/MenuWindow +0x3b8 shape with an inline vector at owner+0x60. Next crash-prone runtime diagnostics should include deeper trace evidence at the crash site (e.g. bounded debugger/VEH trace with relevant registers/stack/owner fields) before logging."}}
{"run":614,"commit":"978974d","metric":0,"metrics":{"readiness_gate_failures":0,"target_constants_remaining":0,"helpers_missing":0,"fixed_wait_predicates":0,"autoload_static_failures":0,"asset_chain_failures":0,"dll_patch_failures":0,"native_continue_failures":0,"field58_gate_failures":0,"direct_shortcut_failures":0,"input_path_failures":0,"runtime_proof_failures":0,"runtime_mode_failures":0,"eula_popup_failures":0,"save_data_popup_failures":0,"messagebox_dialog_failures":0,"server_status_failures":0,"title_cover_failures":3,"title_cover_penalty":2000,"native_trace_blockers":0,"native_trace_hits_total":74,"native_trace_unique_breakpoints":11,"false_positives":0,"offline_face_source_ready":1,"removed path_cpu_texture_bridge_ready":0,"offline_face_texture_runtime_drawn":0,"stylized_facedata_pixel_oracle":0,"real_portrait_asset_candidates":0,"profile_placeholder_assets_only":1},"status":"discard","description":"Static RE mapped valid ProfileSelect bind owner after TitleBack crash correction.","timestamp":1782662376933,"segment":2,"confidence":null,"asi":{"hypothesis":"After proving TitleBack/MenuResource is not a valid FUN_1407452c0 owner, statically map the native ProfileSelect/MenuWindow owner that safely receives MENU_DummyProfileFace -> SYSTEX_Menu_Profile binds, before any runtime implementation.","observed_evidence":"Ghidra dump FUN_1407452c0 is the bind helper and maps to live/deobf 0x1407451c0; live/deobf 0x1407452c0 is a different nearby SceneObjProxy setup helper. MenuWindow::MenuWindow initializes field553_0x3b8 via CS::SceneObjProxy::SceneObjProxy(param_2). Native ProfileSelect constructor FUN_1409a5310 calls FUN_1407452c0(&(param_1->super_MenuWindow).field553_0x3b8, pair) for MENU_DummyProfileFace_01..10 -> SYSTEX_Menu_Profile00..09. The bind helper then calls FUN_140748700(param_1+0x60), so the valid owner is the MenuWindow field553_0x3b8 SceneObjProxy-like object whose +0x60 is an inline fixed vector, not a MenuResource pointer field. Finding saved as bd memory valid-profile-bind-owner-is-menuwindow-sceneobjproxy-2026-06-28. Measure gate passed: /tmp/pi-experiment-b920fbe283c49ed5.log.","rollback_reason":"Primary metric stayed 0. This was static route correction only and did not implement/render a portrait surface.","next_action_hint":"Next implementation target should create or reuse a native MenuWindow/SceneObjProxy bind owner with a GFX that actually has MENU_DummyProfileFace_* symbols, while avoiding GenericListSelectDialog/ProfileSelect modal behavior. Any crash-prone runtime probe must capture deeper crash trace evidence before logging."}}
{"run":615,"commit":"978974d","metric":0,"metrics":{"readiness_gate_failures":0,"target_constants_remaining":0,"helpers_missing":0,"fixed_wait_predicates":0,"autoload_static_failures":0,"asset_chain_failures":0,"dll_patch_failures":0,"native_continue_failures":0,"field58_gate_failures":0,"direct_shortcut_failures":0,"input_path_failures":0,"runtime_proof_failures":0,"runtime_mode_failures":0,"eula_popup_failures":0,"save_data_popup_failures":0,"messagebox_dialog_failures":0,"server_status_failures":0,"title_cover_failures":3,"title_cover_penalty":2000,"native_trace_blockers":0,"native_trace_hits_total":74,"native_trace_unique_breakpoints":11,"false_positives":0,"offline_face_source_ready":1,"removed path_cpu_texture_bridge_ready":0,"offline_face_texture_runtime_drawn":0,"stylized_facedata_pixel_oracle":0,"real_portrait_asset_candidates":0,"profile_placeholder_assets_only":1},"status":"discard","description":"Static RE validated MenuWindow-only bind owner structure without modal ProfileSelect behavior.","timestamp":1782662501841,"segment":2,"confidence":null,"asi":{"hypothesis":"Validate whether MenuWindow::MenuWindow alone constructs the valid +0x3b8 SceneObjProxy bind owner without installing GenericListSelectDialog/ProfileSelect modal/list behavior, before a runtime diagnostic.","observed_evidence":"Dump MenuWindow::MenuWindow 0x140741a60 maps to live/deobf 0x140741960. Disassembly shows it initializes field553_0x3b8 with CS::SceneObjProxy::SceneObjProxy(param_2) at live 0x140741b1d, then immediately writes zero to owner+0x668 at live 0x140741b23. This matches the fixed-vector count that FUN_140748700 reads after FUN_1407452c0 adds +0x60 to the owner. The ctor initializes MenuWindow fields and touches CSMenuMan field106_0x90 but does not install GenericListSelectDialog modal/list callbacks by itself. Finding saved as bd memory menuwindow-only-bind-owner-structurally-valid-2026-06-28. Measure gate passed: /tmp/pi-experiment-cff1d6245dc9a161.log.","rollback_reason":"Primary metric stayed 0. This was static route validation only and did not implement or render a portrait surface.","next_action_hint":"Before runtime, ground MenuWindow non-deleting destructor/teardown for DLL-owned storage. Then a bounded diagnostic can construct a MenuWindow-only owner over a ProfileSelect-like SceneObjProxy/GFX, bind dummy profile symbols via this+0x3b8, and collect deeper crash trace evidence if it fails."}}
{"run":616,"commit":"978974d","metric":0,"metrics":{"readiness_gate_failures":0,"target_constants_remaining":0,"helpers_missing":0,"fixed_wait_predicates":0,"autoload_static_failures":0,"asset_chain_failures":0,"dll_patch_failures":0,"native_continue_failures":0,"field58_gate_failures":0,"direct_shortcut_failures":0,"input_path_failures":0,"runtime_proof_failures":0,"runtime_mode_failures":0,"eula_popup_failures":0,"save_data_popup_failures":0,"messagebox_dialog_failures":0,"server_status_failures":0,"title_cover_failures":3,"title_cover_penalty":2000,"native_trace_blockers":0,"native_trace_hits_total":74,"native_trace_unique_breakpoints":11,"false_positives":0,"offline_face_source_ready":1,"removed path_cpu_texture_bridge_ready":0,"offline_face_texture_runtime_drawn":0,"stylized_facedata_pixel_oracle":0,"real_portrait_asset_candidates":0,"profile_placeholder_assets_only":1},"status":"discard","description":"Static RE grounded MenuWindow non-deleting destructor for DLL-owned bind-owner diagnostics.","timestamp":1782662665802,"segment":2,"confidence":null,"asi":{"hypothesis":"Ground MenuWindow non-deleting destructor/teardown for DLL-owned storage before a runtime diagnostic that constructs a MenuWindow-only bind owner.","observed_evidence":"CS::MenuWindow vtable root is 0x142a93a60. Ghidra xrefs show vtable slot +0x0 -> FUN_1407343b0 heap/deallocate helper, +0x8 -> FUN_140744210 deleting-destructor wrapper, +0x10 -> FUN_140745670 lifecycle/update. FUN_140744210 calls FUN_1407431c0(param_1), then calls operator_delete(param_1,0xa38) only when param_2&1. FUN_1407431c0 tears down job/result refs, field553_0x3b8 bind owner via FUN_140743420, CSScaleformValue/BaseChangeDst fields, vectors, function objects, and +0x18 reference object. Live/deobf mappings: dump 0x1407431c0 -> deobf 0x1407430c0; dump 0x140744210 -> deobf 0x140744110. Finding saved as bd memory menuwindow-owned-storage-teardown-static-2026-06-28. Measure gate passed: /tmp/pi-experiment-7fcd0c3996a02908.log.","rollback_reason":"Primary metric stayed 0. This was static teardown grounding only and did not implement/render a portrait surface.","next_action_hint":"A bounded runtime diagnostic can now allocate DLL-owned MenuWindow-sized storage, call MenuWindow ctor, bind dummy profile symbols through this+0x3b8, and tear down with the non-deleting destructor. It must use deeper crash tracing/register/owner-field evidence if it fails."}}
{"run":617,"commit":"978974d","metric":0,"metrics":{"readiness_gate_failures":0,"target_constants_remaining":0,"helpers_missing":0,"fixed_wait_predicates":0,"autoload_static_failures":0,"asset_chain_failures":0,"dll_patch_failures":0,"native_continue_failures":0,"field58_gate_failures":0,"direct_shortcut_failures":0,"input_path_failures":0,"runtime_proof_failures":0,"runtime_mode_failures":0,"eula_popup_failures":0,"save_data_popup_failures":0,"messagebox_dialog_failures":0,"server_status_failures":0,"title_cover_failures":3,"title_cover_penalty":2000,"native_trace_blockers":0,"native_trace_hits_total":74,"native_trace_unique_breakpoints":11,"false_positives":0,"offline_face_source_ready":1,"removed path_cpu_texture_bridge_ready":0,"offline_face_texture_runtime_drawn":0,"stylized_facedata_pixel_oracle":0,"real_portrait_asset_candidates":0,"profile_placeholder_assets_only":1},"status":"discard","description":"Static RE grounded MenuWindow-only diagnostic ctor args from TitleBack SceneObjProxy.","timestamp":1782662768724,"segment":2,"confidence":null,"asi":{"hypothesis":"Ground exact MenuWindow::MenuWindow arguments for a future DLL-owned MenuWindow-only bind-owner diagnostic over the existing aliased ProfileSelect GFX scene, including where to get a valid live SceneObjProxy.","observed_evidence":"TitleBackViewParts ctor dump 0x1409a62d0 (live/deobf 0x1409a6180 after shift verification) constructs MenuResource at this+0x8 and calls FUN_140749290(menu_resource=this+0x8,out_scene_proxy=this+0x70). FUN_140749290 resolves/constructs the Scaleform object from the MenuResource and initializes out_scene_proxy with CS::SceneObjProxy::SceneObjProxy(param_2,resolved_proxy). Therefore after existing-object ProfileSelect repository alias, logo+0x70 is the exact SceneObjProxy to pass to MenuWindow::MenuWindow. Planned ctor args: rcx=dll_owned_0xa38_storage, rdx=logo+0x70, r8=0, r9=&u16_menu_id; avoid 0xffff unless willing to hit the vtable fallback. Then bind through this+0x3b8 with live/deobf 0x1407451c0 and tear down with live/deobf 0x1407430c0. Finding saved as bd memory menuwindow-only-diagnostic-ctor-args-plan-2026-06-28. Measure gate passed: /tmp/pi-experiment-a52cdebad4f013d0.log.","rollback_reason":"Primary metric stayed 0. This was static implementation planning only and did not render a portrait surface.","next_action_hint":"Next code/runtime iteration can implement an explicit-gated MenuWindow-only diagnostic using logo+0x70 as SceneObjProxy, with deeper crash trace/register/owner-field telemetry before logging any failure."}}
