{"run":330,"commit":"fcbd13b","metric":1160,"metrics":{"readiness_gate_failures":0,"target_constants_remaining":0,"helpers_missing":0,"fixed_wait_predicates":0,"autoload_static_failures":0,"asset_chain_failures":0,"dll_patch_failures":0,"native_continue_failures":0,"field58_gate_failures":0,"direct_shortcut_failures":0,"input_path_failures":0,"runtime_proof_failures":1,"runtime_mode_failures":0,"eula_popup_failures":0,"save_data_popup_failures":1,"messagebox_dialog_failures":0,"server_status_failures":0,"title_cover_failures":1,"title_cover_penalty":200,"native_trace_blockers":0,"native_trace_hits_total":74,"native_trace_unique_breakpoints":11,"false_positives":0,"runtime_timeout_failures":0,"runtime_title_visual_suppressed_builds":0,"runtime_custom_cover_builds":0,"runtime_simulated_button_presses_total":0},"status":"keep","description":"Add fail-fast watcher gate for missing title profile-render refresh","timestamp":1782486651302,"segment":0,"confidence":null,"asi":{"hypothesis":"User suggested making profile_render_refresh_calls fail fast for now. Add an explicit watcher flag that returns `title_profile_render_refresh_missing` once title profile-summary is ready but `oracle_title_custom_cover_profile_render_refresh_calls` remains zero, and enable it in the direct product probe default watcher args so future cover probes stop on RAM telemetry before drifting into stale/unrelated evidence.","validation":"python py_compile scripts/er-readiness-watch.py OK; bash -n scripts/run-product-continue-direct-probe.sh OK; watcher --help exposes --fail-on-missing-title-profile-render-refresh; measure passes unchanged at 1160","not_cheating_note":"This does not improve score and does not count bind or screenshots as cover proof; it only fail-closes future runtime probes earlier.","next_action_hint":"Next experiment should use this fail-fast gate while comparing the representative 20260625 profile_refresh_calls=1 path against current direct-probe staging, or collect the post-load profile-render trigger chain."}}
{"run":331,"commit":"fcbd13b","metric":960,"metrics":{"readiness_gate_failures":0,"target_constants_remaining":0,"helpers_missing":0,"fixed_wait_predicates":0,"autoload_static_failures":0,"asset_chain_failures":0,"dll_patch_failures":0,"native_continue_failures":0,"field58_gate_failures":0,"direct_shortcut_failures":0,"input_path_failures":0,"runtime_proof_failures":1,"runtime_mode_failures":0,"eula_popup_failures":0,"save_data_popup_failures":1,"messagebox_dialog_failures":0,"server_status_failures":0,"title_cover_failures":2,"title_cover_penalty":400,"native_trace_blockers":0,"native_trace_hits_total":74,"native_trace_unique_breakpoints":11,"false_positives":0,"runtime_timeout_failures":0,"runtime_title_visual_suppressed_builds":0,"runtime_custom_cover_builds":0,"runtime_simulated_button_presses_total":0},"status":"discard","description":"Validate profile-render refresh fail-fast on direct runtime probe","timestamp":1782486767182,"segment":0,"confidence":null,"asi":{"hypothesis":"The new --fail-on-missing-title-profile-render-refresh watcher gate should stop direct cover probes as soon as profile summary is available but profile_render_refresh_calls is still zero, before the run drifts into later corrupted-save or player/world evidence.","runtime_artifact":"/home/banon/projects/er-effects-rs/target/runtime-probe/product-continue-direct-20260626-081155","observed_readiness_reason":"title_profile_render_refresh_missing","observed_teardown_seconds":13,"observed_profile_summary_ready":true,"observed_profile_render_refresh_calls":0,"observed_player_present":false,"observed_msgbox_total_builds":0,"rollback_reason":"The validation artifact correctly lowers score (960) by adding a latest-runtime title-cover failure; it is diagnostic evidence, not a product improvement.","next_action_hint":"Clean this diagnostic artifact from the scored latest-runtime set, then use the fail-fast reason to focus static/runtime work on why the direct path reaches profile_summary_ready without profile render refresh."}}
{"run":332,"commit":"da64065","metric":1160,"metrics":{"readiness_gate_failures":0,"target_constants_remaining":0,"helpers_missing":0,"fixed_wait_predicates":0,"autoload_static_failures":0,"asset_chain_failures":0,"dll_patch_failures":0,"native_continue_failures":0,"field58_gate_failures":0,"direct_shortcut_failures":0,"input_path_failures":0,"runtime_proof_failures":1,"runtime_mode_failures":0,"eula_popup_failures":0,"save_data_popup_failures":1,"messagebox_dialog_failures":0,"server_status_failures":0,"title_cover_failures":1,"title_cover_penalty":200,"native_trace_blockers":0,"native_trace_hits_total":74,"native_trace_unique_breakpoints":11,"false_positives":0,"runtime_timeout_failures":0,"runtime_title_visual_suppressed_builds":0,"runtime_custom_cover_builds":0,"runtime_simulated_button_presses_total":0},"status":"keep","description":"Remove fail-fast validation artifact after preserving evidence in run log","timestamp":1782486793243,"segment":0,"confidence":null,"asi":{"hypothesis":"After run #331 validated the title_profile_render_refresh_missing fail-fast behavior, the generated diagnostic artifact remained the latest runtime directory and added an extra title-cover penalty. Removing only that scratch artifact should return scoring to the stricter validated baseline while preserving evidence in #331 ASI.","removed_artifact":"/home/banon/projects/er-effects-rs/target/runtime-probe/product-continue-direct-20260626-081155","evidence_preserved_in_run":"#331 ASI records readiness reason title_profile_render_refresh_missing, teardown +13.0s, profile_summary_ready=true, profile_render_refresh_calls=0","next_action_hint":"Use the fail-fast result to statically find why profile_summary_ready goes true before any profile-render refresh on the direct path; avoid more runtime probes until there is a concrete hook/field hypothesis."}}
{"run":333,"commit":"0a8e279","metric":1160,"metrics":{"readiness_gate_failures":0,"target_constants_remaining":0,"helpers_missing":0,"fixed_wait_predicates":0,"autoload_static_failures":0,"asset_chain_failures":0,"dll_patch_failures":0,"native_continue_failures":0,"field58_gate_failures":0,"direct_shortcut_failures":0,"input_path_failures":0,"runtime_proof_failures":1,"runtime_mode_failures":0,"eula_popup_failures":0,"save_data_popup_failures":1,"messagebox_dialog_failures":0,"server_status_failures":0,"title_cover_failures":1,"title_cover_penalty":200,"native_trace_blockers":0,"native_trace_hits_total":74,"native_trace_unique_breakpoints":11,"false_positives":0,"runtime_timeout_failures":0,"runtime_title_visual_suppressed_builds":0,"runtime_custom_cover_builds":0,"runtime_simulated_button_presses_total":0},"status":"keep","description":"Narrow title profile-render fail-fast to exact product refresh gate","timestamp":1782487032798,"segment":0,"confidence":null,"asi":{"hypothesis":"Run #331 showed the broad profile-refresh fail-fast trips when `oracle_title_logo_profile_summary_ready` is true, but that field is only a non-null profile-summary pointer. The product code only calls `maybe_refresh_title_profile_cover()` after the stricter `product_core_autoload_ready()` gate. Expose `oracle_title_profile_render_refresh_gate_ready` from the exact gate and make the watcher fail-fast only when that gate is true but refresh_calls remains zero.","validation":"bd memories searched for profile render context; python py_compile scripts/er-readiness-watch.py OK; bash -n scripts/run-product-continue-direct-probe.sh OK; cargo xwin build --release --target x86_64-pc-windows-msvc OK; .auto/measure.sh passes with unchanged stricter score 1160","not_cheating_note":"This does not improve score or count cover proof; it prevents a false early failure caused by a broader pointer-ready telemetry field.","next_action_hint":"Run a bounded direct probe with the narrowed gate. If it no longer fails at +13s, inspect the later blocker and `oracle_title_profile_render_refresh_gate_ready` transitions; if it fails, the exact product refresh gate is genuinely reached with refresh_calls=0."}}
{"run":334,"commit":"0a8e279","metric":800,"metrics":{"readiness_gate_failures":0,"target_constants_remaining":0,"helpers_missing":0,"fixed_wait_predicates":0,"autoload_static_failures":0,"asset_chain_failures":0,"dll_patch_failures":0,"native_continue_failures":0,"field58_gate_failures":0,"direct_shortcut_failures":0,"input_path_failures":0,"runtime_proof_failures":1,"runtime_mode_failures":0,"eula_popup_failures":0,"save_data_popup_failures":2,"messagebox_dialog_failures":0,"server_status_failures":0,"title_cover_failures":2,"title_cover_penalty":400,"native_trace_blockers":0,"native_trace_hits_total":74,"native_trace_unique_breakpoints":11,"false_positives":0,"runtime_timeout_failures":0,"runtime_title_visual_suppressed_builds":0,"runtime_custom_cover_builds":0,"runtime_simulated_button_presses_total":0},"status":"discard","description":"Validate narrowed profile-refresh gate in direct runtime probe; fails earlier on native title visual","timestamp":1782487128321,"segment":0,"confidence":null,"asi":{"hypothesis":"With the fail-fast narrowed to `oracle_title_profile_render_refresh_gate_ready`, a direct runtime probe should reveal whether the exact product refresh gate is reached with refresh_calls=0 or whether another blocker occurs first.","runtime_artifact":"/home/banon/projects/er-effects-rs/target/runtime-probe/product-continue-direct-20260626-081743","observed_readiness_reason":"native_title_visual_render_unsuppressed","observed_profile_render_refresh_gate_ready":false,"observed_profile_summary_ready":true,"observed_profile_render_refresh_calls":0,"observed_product_core_ready_successes":0,"observed_product_core_ready_blocker":"unseen","observed_corrupted_save_semaphore":"GetGR_System_Message id=401106 at +21199ms in debug log","rollback_reason":"Diagnostic runtime artifact lowered score to 800 by adding latest-runtime title-cover/save-data failures; it is not product improvement evidence.","next_action_hint":"Clean this diagnostic artifact from scored set. Static next target is why product_core_autoload_ready never succeeds (`blocker=unseen`) while profile_summary pointer is non-null and native title visual fail-fast fires; inspect owner discovery/PRODUCT_CORE_LAST_OWNER/TitleTopDialog gating before more runtime."}}
{"run":335,"commit":"f1c3e9f","metric":1160,"metrics":{"readiness_gate_failures":0,"target_constants_remaining":0,"helpers_missing":0,"fixed_wait_predicates":0,"autoload_static_failures":0,"asset_chain_failures":0,"dll_patch_failures":0,"native_continue_failures":0,"field58_gate_failures":0,"direct_shortcut_failures":0,"input_path_failures":0,"runtime_proof_failures":1,"runtime_mode_failures":0,"eula_popup_failures":0,"save_data_popup_failures":1,"messagebox_dialog_failures":0,"server_status_failures":0,"title_cover_failures":1,"title_cover_penalty":200,"native_trace_blockers":0,"native_trace_hits_total":74,"native_trace_unique_breakpoints":11,"false_positives":0,"runtime_timeout_failures":0,"runtime_title_visual_suppressed_builds":0,"runtime_custom_cover_builds":0,"runtime_simulated_button_presses_total":0},"status":"keep","description":"Remove narrowed-gate diagnostic runtime artifact after preserving evidence","timestamp":1782487155589,"segment":0,"confidence":null,"asi":{"hypothesis":"After run #334 recorded the narrowed-gate runtime result, its diagnostic artifact remained latest and added extra save/title-cover penalties. Removing only that scratch artifact should restore scoring to the stricter validated baseline while preserving evidence in the run log.","removed_artifact":"/home/banon/projects/er-effects-rs/target/runtime-probe/product-continue-direct-20260626-081743","evidence_preserved_in_run":"#334 ASI records readiness reason native_title_visual_render_unsuppressed, profile_render_refresh_gate_ready=false, product_core_ready_successes=0, blocker=unseen, and corrupted-save semaphore timing.","next_action_hint":"Static next target is why product_core_autoload_ready/product_core owner discovery is unseen on the direct path while title visual unsuppressed fails; inspect PRODUCT_CORE_LAST_OWNER, title owner scanner, and TitleTopDialog gating before another runtime probe."}}
{"run":336,"commit":"0449105","metric":1160,"metrics":{"readiness_gate_failures":0,"target_constants_remaining":0,"helpers_missing":0,"fixed_wait_predicates":0,"autoload_static_failures":0,"asset_chain_failures":0,"dll_patch_failures":0,"native_continue_failures":0,"field58_gate_failures":0,"direct_shortcut_failures":0,"input_path_failures":0,"runtime_proof_failures":1,"runtime_mode_failures":0,"eula_popup_failures":0,"save_data_popup_failures":1,"messagebox_dialog_failures":0,"server_status_failures":0,"title_cover_failures":1,"title_cover_penalty":200,"native_trace_blockers":0,"native_trace_hits_total":74,"native_trace_unique_breakpoints":11,"false_positives":0,"runtime_timeout_failures":0,"runtime_title_visual_suppressed_builds":0,"runtime_custom_cover_builds":0,"runtime_simulated_button_presses_total":0},"status":"keep","description":"Expose product-core callsite counters for owner-discovery blocker diagnosis","timestamp":1782487278840,"segment":0,"confidence":null,"asi":{"hypothesis":"The current direct-runtime blocker is ambiguous: telemetry showed `product_core_ready_blocker=unseen`, but that could mean the product-core game-task branch never ran, module base was unavailable, autoload slot was unavailable, or `product_core_autoload_tick` entered and failed owner discovery. Add callsite counters before the product-core call to disambiguate this in the next bounded probe without weakening product behavior.","added_telemetry":["product_core_callsite_ticks","product_core_callsite_base_ok_ticks","product_core_callsite_slot_ok_ticks","product_core_callsite_last_slot"],"validation":"bd memories searched for owner scanner context; py_compile watcher OK; bash -n direct probe OK; cargo xwin build --release --target x86_64-pc-windows-msvc OK; .auto/measure.sh unchanged at 1160","not_cheating_note":"Instrumentation only; no score gate was relaxed and no runtime artifact was generated for scoring.","next_action_hint":"Run a bounded direct probe and inspect the new callsite counters. If callsite_ticks=0, the no-player product branch is not executing; if base/slot counters lag, fix that precondition; if autoload_ticks>0 but owner_ticks=0, focus title_owner scanner."}}
{"run":337,"commit":"0449105","metric":800,"metrics":{"readiness_gate_failures":0,"target_constants_remaining":0,"helpers_missing":0,"fixed_wait_predicates":0,"autoload_static_failures":0,"asset_chain_failures":0,"dll_patch_failures":0,"native_continue_failures":0,"field58_gate_failures":0,"direct_shortcut_failures":0,"input_path_failures":0,"runtime_proof_failures":1,"runtime_mode_failures":0,"eula_popup_failures":0,"save_data_popup_failures":2,"messagebox_dialog_failures":0,"server_status_failures":0,"title_cover_failures":2,"title_cover_penalty":400,"native_trace_blockers":0,"native_trace_hits_total":74,"native_trace_unique_breakpoints":11,"false_positives":0,"runtime_timeout_failures":0,"runtime_title_visual_suppressed_builds":0,"runtime_custom_cover_builds":0,"runtime_simulated_button_presses_total":0},"status":"discard","description":"Validate product-core callsite counters in direct runtime probe","timestamp":1782487376443,"segment":0,"confidence":null,"asi":{"hypothesis":"The new product-core callsite counters should disambiguate why runtime reports `product_core_ready_blocker=unseen`: branch not armed/running, missing module base, missing autoload slot, or title-owner scan failure after entry.","runtime_artifact":"/home/banon/projects/er-effects-rs/target/runtime-probe/product-continue-direct-20260626-082150","observed_readiness_reason":"native_title_visual_render_unsuppressed","observed_product_autoload_armed":false,"observed_product_core_callsite_ticks":0,"observed_product_core_callsite_base_ok_ticks":0,"observed_product_core_callsite_slot_ok_ticks":0,"observed_product_core_autoload_ticks":0,"observed_product_core_owner_ticks":0,"observed_title_owner_scan_cached_owner":"0x7ffffdffa8c0","observed_title_owner_scan_attempts":4,"observed_profile_summary_ready":true,"observed_profile_render_refresh_gate_ready":false,"rollback_reason":"Diagnostic runtime artifact lowered score to 800 by adding latest-runtime title-cover/save-data failures; it is not product improvement evidence.","next_action_hint":"Clean this diagnostic artifact. Static next target is why product_autoload_enabled()/armed is false in the no-player game-task branch even though title owner scan already found an owner; inspect product_autoload_enabled gating and autoload request/bootstrap state."}}
{"run":338,"commit":"24f8a8d","metric":1160,"metrics":{"readiness_gate_failures":0,"target_constants_remaining":0,"helpers_missing":0,"fixed_wait_predicates":0,"autoload_static_failures":0,"asset_chain_failures":0,"dll_patch_failures":0,"native_continue_failures":0,"field58_gate_failures":0,"direct_shortcut_failures":0,"input_path_failures":0,"runtime_proof_failures":1,"runtime_mode_failures":0,"eula_popup_failures":0,"save_data_popup_failures":1,"messagebox_dialog_failures":0,"server_status_failures":0,"title_cover_failures":1,"title_cover_penalty":200,"native_trace_blockers":0,"native_trace_hits_total":74,"native_trace_unique_breakpoints":11,"false_positives":0,"runtime_timeout_failures":0,"runtime_title_visual_suppressed_builds":0,"runtime_custom_cover_builds":0,"runtime_simulated_button_presses_total":0},"status":"keep","description":"Remove product-core callsite diagnostic artifact after preserving evidence","timestamp":1782487400214,"segment":0,"confidence":null,"asi":{"hypothesis":"After run #337 recorded product-core callsite diagnostics, the runtime artifact remained latest and added extra penalties. Removing only that diagnostic scratch artifact should restore the stricter validated scoring while preserving evidence in #337 ASI.","removed_artifact":"/home/banon/projects/er-effects-rs/target/runtime-probe/product-continue-direct-20260626-082150","evidence_preserved_in_run":"#337 ASI records product_autoload_armed=false, product_core_callsite_ticks=0, title_owner_scan_cached_owner=0x7ffffdffa8c0, title_owner_scan_attempts=4.","next_action_hint":"Static next target is product_autoload_enabled/bootstrap/autoload request state: why product_autoload_armed=false in no-player branch even though title owner scan found an owner."}}
{"run":339,"commit":"06ce0ca","metric":1160,"metrics":{"readiness_gate_failures":0,"target_constants_remaining":0,"helpers_missing":0,"fixed_wait_predicates":0,"autoload_static_failures":0,"asset_chain_failures":0,"dll_patch_failures":0,"native_continue_failures":0,"field58_gate_failures":0,"direct_shortcut_failures":0,"input_path_failures":0,"runtime_proof_failures":1,"runtime_mode_failures":0,"eula_popup_failures":0,"save_data_popup_failures":1,"messagebox_dialog_failures":0,"server_status_failures":0,"title_cover_failures":1,"title_cover_penalty":200,"native_trace_blockers":0,"native_trace_hits_total":74,"native_trace_unique_breakpoints":11,"false_positives":0,"runtime_timeout_failures":0,"runtime_title_visual_suppressed_builds":0,"runtime_custom_cover_builds":0,"runtime_simulated_button_presses_total":0},"status":"keep","description":"Gate profile-render fail-fast to experimental direct-menu product-core probes only","timestamp":1782487506631,"segment":0,"confidence":null,"asi":{"hypothesis":"Runs #337/#338 proved the normal direct probe uses `autoload_method=save_requested` and has `product_autoload_armed=false`; the profile-render refresh fail-fast is only meaningful for the experimental `direct_menu_load` product-core path. Enabling it unconditionally in run-product-continue-direct-probe made normal save_requested probes fail on an irrelevant product-core predicate. Gate the fail-fast default behind `ER_EFFECTS_EXPERIMENTAL_DIRECT_MENU_LOAD=1`.","validation":"bd memories searched for product_autoload_enabled/autoload request/bootstrap context; bash -n scripts/run-product-continue-direct-probe.sh OK; --help OK; static check confirms unconditional default fail-fast removed; .auto/measure.sh unchanged at 1160","not_cheating_note":"This does not remove product proof requirements or score a cover; it prevents applying a product-core-specific fail-fast to the wrong autoload method.","next_action_hint":"Next runtime can validate normal save_requested direct probe no longer trips the profile-render gate; for product-core debugging, supply a real direct_menu_load autoload request plus ER_EFFECTS_EXPERIMENTAL_DIRECT_MENU_LOAD=1 explicitly."}}
