{"run":387,"commit":"cc69a1f","metric":1160,"metrics":{"readiness_gate_failures":0,"target_constants_remaining":0,"helpers_missing":0,"fixed_wait_predicates":0,"autoload_static_failures":0,"asset_chain_failures":0,"dll_patch_failures":0,"native_continue_failures":0,"field58_gate_failures":0,"direct_shortcut_failures":0,"input_path_failures":0,"runtime_proof_failures":1,"runtime_mode_failures":0,"eula_popup_failures":0,"save_data_popup_failures":1,"messagebox_dialog_failures":0,"server_status_failures":0,"title_cover_failures":1,"title_cover_penalty":200,"native_trace_blockers":0,"native_trace_hits_total":74,"native_trace_unique_breakpoints":11,"false_positives":0,"runtime_timeout_failures":0,"runtime_title_visual_suppressed_builds":0,"runtime_custom_cover_builds":0,"runtime_simulated_button_presses_total":0},"status":"keep","description":"Remove logged correct-oracle predicate runtime artifact from latest scoring","timestamp":1782512202358,"segment":0,"confidence":19.333333333333332,"asi":{"hypothesis":"After #386 preserved the correct-Banon expected-oracle predicate-hook failure evidence, remove its diagnostic runtime artifact from latest scoring.","validation":".auto/measure.sh recovered from 960 to 1160 with false_positives=0 after removing /home/banon/projects/er-effects-rs/target/runtime-probe/product-continue-direct-20260626-151452.","next_action_hint":"Do not retry the predicate hook without a new ordering/product-proof hypothesis. Current productive lead is either native/semantic TFC initializer ordering or a separate title-cover proof that can improve score without destabilizing load."}}
{"run":388,"commit":"cc69a1f","metric":1160,"metrics":{"readiness_gate_failures":0,"target_constants_remaining":0,"helpers_missing":0,"fixed_wait_predicates":0,"autoload_static_failures":0,"asset_chain_failures":0,"dll_patch_failures":0,"native_continue_failures":0,"field58_gate_failures":0,"direct_shortcut_failures":0,"input_path_failures":0,"runtime_proof_failures":1,"runtime_mode_failures":0,"eula_popup_failures":0,"save_data_popup_failures":1,"messagebox_dialog_failures":0,"server_status_failures":0,"title_cover_failures":1,"title_cover_penalty":200,"native_trace_blockers":0,"native_trace_hits_total":74,"native_trace_unique_breakpoints":11,"false_positives":0,"runtime_timeout_failures":0,"runtime_title_visual_suppressed_builds":0,"runtime_custom_cover_builds":0,"runtime_simulated_button_presses_total":0},"status":"discard","description":"Enable removed UI overlay for product autoload statically; benchmark unchanged without fresh render proof","timestamp":1782512430839,"segment":0,"confidence":19.333333333333332,"asi":{"hypothesis":"The existing overlay path can be a title-safe successor cover if removed path is not skipped for product autoload. Change the skip gate so non-product autoload still skips overlay, but product_autoload_enabled keeps the full-screen title cover render path available.","validation":".auto/measure.sh stayed at 1160 with title_cover_failures=1 and title_cover_penalty=200; no fresh runtime artifact proved oracle_title_overlay_cover_rendered, so static enablement alone is not a keepable improvement.","rollback_reason":"Primary metric was unchanged. Keeping an unproven overlay enablement would add render-hook risk without product proof, and prior memory says removed path render did not fire at title under the offline launcher.","next_action_hint":"Do not retry overlay enablement without a runtime path that proves TITLE_OVERLAY_COVER_RENDER_CALLS increments during product autoload. Prefer a non-native title-safe surface or native RAM-backed cover oracle next."}}
{"run":389,"commit":"cc69a1f","metric":800,"metrics":{"readiness_gate_failures":0,"target_constants_remaining":0,"helpers_missing":0,"fixed_wait_predicates":0,"autoload_static_failures":0,"asset_chain_failures":0,"dll_patch_failures":0,"native_continue_failures":0,"field58_gate_failures":0,"direct_shortcut_failures":0,"input_path_failures":0,"runtime_proof_failures":1,"runtime_mode_failures":0,"eula_popup_failures":0,"save_data_popup_failures":2,"messagebox_dialog_failures":0,"server_status_failures":0,"title_cover_failures":2,"title_cover_penalty":400,"native_trace_blockers":0,"native_trace_hits_total":74,"native_trace_unique_breakpoints":11,"false_positives":0,"runtime_timeout_failures":0,"runtime_title_visual_suppressed_builds":0,"runtime_custom_cover_builds":155,"runtime_simulated_button_presses_total":0},"status":"discard","description":"Runtime-test removed UI overlay cover under product autoload; overlay renders but product proof regresses","timestamp":1782512544845,"segment":0,"confidence":19.333333333333332,"asi":{"hypothesis":"Static overlay enablement did not change score, but a runtime probe could prove whether removed path actually renders the existing full-screen custom cover under product autoload despite prior memory that offline title removed path often did not fire.","validation":"Runtime artifact /home/banon/projects/er-effects-rs/target/runtime-probe/product-continue-direct-20260626-152121 proved oracle_title_overlay_cover_render_calls=155, oracle_title_overlay_cover_rendered=true, display size [1280,720], and zero simulated input. It still failed with native_corrupted_save_detected id=401106, expected_save_match=false, pre_submit, and no logo-surface profile cover; measure dropped to 800 with save_data_popup_failures=2/title_cover_failures=2.","rollback_reason":"Primary metric regressed; the overlay proof is useful but cannot be kept because the latest runtime artifact fails hard product save/continue proof and increases scored failures.","next_action_hint":"Preserve the finding: removed path overlay can render during product autoload when not skipped. A future keepable path should combine this overlay cover with the known TFC/401106 initializer fix or another product-proof path, and scoring/watchers may need to accept oracle_title_overlay_cover_rendered as a successor cover only when full product proof also passes."}}
{"run":390,"commit":"ba9ccae","metric":1160,"metrics":{"readiness_gate_failures":0,"target_constants_remaining":0,"helpers_missing":0,"fixed_wait_predicates":0,"autoload_static_failures":0,"asset_chain_failures":0,"dll_patch_failures":0,"native_continue_failures":0,"field58_gate_failures":0,"direct_shortcut_failures":0,"input_path_failures":0,"runtime_proof_failures":1,"runtime_mode_failures":0,"eula_popup_failures":0,"save_data_popup_failures":1,"messagebox_dialog_failures":0,"server_status_failures":0,"title_cover_failures":1,"title_cover_penalty":200,"native_trace_blockers":0,"native_trace_hits_total":74,"native_trace_unique_breakpoints":11,"false_positives":0,"runtime_timeout_failures":0,"runtime_title_visual_suppressed_builds":0,"runtime_custom_cover_builds":0,"runtime_simulated_button_presses_total":0},"status":"keep","description":"Remove discarded overlay runtime artifact from latest scoring","timestamp":1782512573067,"segment":0,"confidence":19.333333333333332,"asi":{"hypothesis":"After #389 preserved the overlay render finding and Beads memory, remove its discarded hard-failing runtime artifact from latest scoring.","validation":".auto/measure.sh recovered from 800 to 1160 after removing /home/banon/projects/er-effects-rs/target/runtime-probe/product-continue-direct-20260626-152121; false_positives=0.","next_action_hint":"Overlay rendering is now proven separately. Next keepable work should combine a product-proof path (no 401106, expected save, native continue/world) with the overlay enabled, or find the semantic TFC initializer so the overlay proof can coexist with a passing runtime artifact."}}
{"run":391,"commit":"ba9ccae","metric":800,"metrics":{"readiness_gate_failures":0,"target_constants_remaining":0,"helpers_missing":0,"fixed_wait_predicates":0,"autoload_static_failures":0,"asset_chain_failures":0,"dll_patch_failures":0,"native_continue_failures":0,"field58_gate_failures":0,"direct_shortcut_failures":0,"input_path_failures":0,"runtime_proof_failures":1,"runtime_mode_failures":0,"eula_popup_failures":0,"save_data_popup_failures":2,"messagebox_dialog_failures":0,"server_status_failures":0,"title_cover_failures":2,"title_cover_penalty":400,"native_trace_blockers":0,"native_trace_hits_total":74,"native_trace_unique_breakpoints":11,"false_positives":0,"runtime_timeout_failures":0,"runtime_title_visual_suppressed_builds":0,"runtime_custom_cover_builds":155,"runtime_simulated_button_presses_total":0},"status":"discard","description":"Call native TFC regulation initializer before title accept plus overlay; native helper writes zero and 401106 persists","timestamp":1782512793823,"segment":0,"confidence":19.333333333333332,"asi":{"hypothesis":"Static RE showed native FUN_14082cbf0 (live 0x14082cb00) records a regulation version into TitleFlowContext+0x148 and is called by a title job wrapper. Calling that semantic initializer before the zero-input title accept byte, while also enabling the proven removed UI overlay cover, might initialize TFC without patching the stale-regulation comparison and allow the menu-open/load path to proceed.","validation":"Runtime artifact /home/banon/projects/er-effects-rs/target/runtime-probe/product-continue-direct-20260626-152531 showed the native initializer call executed but wrote after=0 despite manager(+0x44)=11611000: `native TFC regulation initializer 0x14082cb00(tfc=...) before=0 after=0 manager=11611000`. The run still failed native_corrupted_save_detected id=401106. Overlay still rendered with calls=155 and display 1280x720.","rollback_reason":"Primary metric regressed to 800; the native initializer did not satisfy the exact 401106 predicate, and the runtime artifact adds save/title failures.","next_action_hint":"Do not use FUN_14082cbf0 as the fix for 401106 without explaining why it writes manager+0x48/zero while the predicate compares manager+0x44=11611000. The exact predicate hook remains diagnostic-only. Next static target: decode CSRegulationManager fields +0x44/+0x48 and the real title job ordering that should populate the nonzero predicate operand."}}
{"run":392,"commit":"4a41481","metric":1160,"metrics":{"readiness_gate_failures":0,"target_constants_remaining":0,"helpers_missing":0,"fixed_wait_predicates":0,"autoload_static_failures":0,"asset_chain_failures":0,"dll_patch_failures":0,"native_continue_failures":0,"field58_gate_failures":0,"direct_shortcut_failures":0,"input_path_failures":0,"runtime_proof_failures":1,"runtime_mode_failures":0,"eula_popup_failures":0,"save_data_popup_failures":1,"messagebox_dialog_failures":0,"server_status_failures":0,"title_cover_failures":1,"title_cover_penalty":200,"native_trace_blockers":0,"native_trace_hits_total":74,"native_trace_unique_breakpoints":11,"false_positives":0,"runtime_timeout_failures":0,"runtime_title_visual_suppressed_builds":0,"runtime_custom_cover_builds":0,"runtime_simulated_button_presses_total":0},"status":"keep","description":"Remove discarded semantic TFC initializer runtime artifact from latest scoring","timestamp":1782512826313,"segment":0,"confidence":19.333333333333332,"asi":{"hypothesis":"After #391 preserved the semantic TFC initializer failure evidence in ASI and Beads memory, remove its discarded hard-failing runtime artifact from latest scoring.","validation":".auto/measure.sh recovered from 800 to 1160 after removing /home/banon/projects/er-effects-rs/target/runtime-probe/product-continue-direct-20260626-152531; false_positives=0.","next_action_hint":"Static next target: CSRegulationManager field semantics around +0x44/+0x48 and the title job ordering that should make the stale-regulation predicate operand nonzero. Overlay cover is proven separately but must be combined with full product proof."}}
{"run":393,"commit":"4a41481","metric":800,"metrics":{"readiness_gate_failures":0,"target_constants_remaining":0,"helpers_missing":0,"fixed_wait_predicates":0,"autoload_static_failures":0,"asset_chain_failures":0,"dll_patch_failures":0,"native_continue_failures":0,"field58_gate_failures":0,"direct_shortcut_failures":0,"input_path_failures":0,"runtime_proof_failures":1,"runtime_mode_failures":0,"eula_popup_failures":0,"save_data_popup_failures":2,"messagebox_dialog_failures":0,"server_status_failures":0,"title_cover_failures":2,"title_cover_penalty":400,"native_trace_blockers":0,"native_trace_hits_total":74,"native_trace_unique_breakpoints":11,"false_positives":0,"runtime_timeout_failures":0,"runtime_title_visual_suppressed_builds":0,"runtime_custom_cover_builds":156,"runtime_simulated_button_presses_total":0},"status":"discard","description":"Initialize TFC regulationVersion from manager +0x44 before title accept; 401106 persists","timestamp":1782513147960,"segment":0,"confidence":19.333333333333332,"asi":{"hypothesis":"Since static RE showed the stale-regulation predicate compares TFC+0x148 against CSRegulationManager+0x44 and the native helper copied a different zero field, initialize TFC+0x148 from the parsed regulation version field +0x44 before title accept, while keeping the separately proven overlay render path enabled.","validation":"Runtime artifact /home/banon/projects/er-effects-rs/target/runtime-probe/product-continue-direct-20260626-153128 logged `initialized TFC regulationVersion from CSRegulationManager+0x44 ... before=0 after=11611000 manager=11611000`, but still failed with native_corrupted_save_detected id=401106, expected_save_match=false, pre_submit. Overlay rendered with calls=156, display 1280x720, zero simulated input.","rollback_reason":"Primary metric regressed to 800. Copying the parsed manager version into the visible TFC before accept is not sufficient; the later 401106 likely uses another TitleFlowContext instance or later overwrites/reinitializes the field.","next_action_hint":"Next static/runtime target should identify which TFC pointer reaches FUN_14082d090 at the 401106 call and compare it to the pre-accept TFC initialized here. Do not keep broad TFC writes; hook/log the predicate pointer or locate the real title job/context instance ordering."}}
{"run":394,"commit":"cdd7ade","metric":1160,"metrics":{"readiness_gate_failures":0,"target_constants_remaining":0,"helpers_missing":0,"fixed_wait_predicates":0,"autoload_static_failures":0,"asset_chain_failures":0,"dll_patch_failures":0,"native_continue_failures":0,"field58_gate_failures":0,"direct_shortcut_failures":0,"input_path_failures":0,"runtime_proof_failures":1,"runtime_mode_failures":0,"eula_popup_failures":0,"save_data_popup_failures":1,"messagebox_dialog_failures":0,"server_status_failures":0,"title_cover_failures":1,"title_cover_penalty":200,"native_trace_blockers":0,"native_trace_hits_total":74,"native_trace_unique_breakpoints":11,"false_positives":0,"runtime_timeout_failures":0,"runtime_title_visual_suppressed_builds":0,"runtime_custom_cover_builds":0,"runtime_simulated_button_presses_total":0},"status":"keep","description":"Remove discarded TFC +0x44 initializer runtime artifact from latest scoring","timestamp":1782513175722,"segment":0,"confidence":19.333333333333332,"asi":{"hypothesis":"After #393 preserved the +0x44 TFC initializer failure evidence in ASI and Beads memory, remove its discarded runtime artifact from latest scoring.","validation":".auto/measure.sh recovered from 800 to 1160 after removing /home/banon/projects/er-effects-rs/target/runtime-probe/product-continue-direct-20260626-153128; false_positives=0.","next_action_hint":"Hook/log the exact FUN_14082d090 predicate TFC pointer and compare it to the pre-accept TitleTopDialog TFC; the failed +0x44 write suggests context mismatch or later overwrite."}}
{"run":395,"commit":"cdd7ade","metric":800,"metrics":{"readiness_gate_failures":0,"target_constants_remaining":0,"helpers_missing":0,"fixed_wait_predicates":0,"autoload_static_failures":0,"asset_chain_failures":0,"dll_patch_failures":0,"native_continue_failures":0,"field58_gate_failures":0,"direct_shortcut_failures":0,"input_path_failures":0,"runtime_proof_failures":1,"runtime_mode_failures":0,"eula_popup_failures":0,"save_data_popup_failures":2,"messagebox_dialog_failures":0,"server_status_failures":0,"title_cover_failures":2,"title_cover_penalty":400,"native_trace_blockers":0,"native_trace_hits_total":74,"native_trace_unique_breakpoints":11,"false_positives":0,"runtime_timeout_failures":0,"runtime_title_visual_suppressed_builds":0,"runtime_custom_cover_builds":0,"runtime_simulated_button_presses_total":0},"status":"discard","description":"Observer-only 401106 predicate hook proves same TFC pointer remains version zero","timestamp":1782513310436,"segment":0,"confidence":19.333333333333332,"asi":{"hypothesis":"The failed pre-accept +0x44 write could have targeted the wrong TitleFlowContext or a context later overwritten. Install an observer-only hook at native FUN_14082d090 and log its TFC pointer/version against the pre-accept TitleTopDialog TFC, with no predicate mutation.","validation":"Runtime artifact /home/banon/projects/er-effects-rs/target/runtime-probe/product-continue-direct-20260626-153411 logged preaccept_tfc=0x7fffa1b77148 version=0 and predicate tfc=0x7fffa1b77148 version=0 manager=11611000 same_tfc=true would_corrupt=true, immediately followed by oracle_corrupted_save_seen_id=401106.","rollback_reason":"Primary metric regressed to 800 because this was diagnostic and produced a hard-failing runtime artifact; no product behavior improvement.","next_action_hint":"The predicate sees the same TFC pointer as preaccept, so the prior +0x44 write either was not present in this observer-only run or would be overwritten before predicate. Next test should combine the +0x44 write with the predicate observer to determine whether a later overwrite happens, or statically find writers to TFC+0x148 between accept and predicate."}}
{"run":396,"commit":"d247d4f","metric":1160,"metrics":{"readiness_gate_failures":0,"target_constants_remaining":0,"helpers_missing":0,"fixed_wait_predicates":0,"autoload_static_failures":0,"asset_chain_failures":0,"dll_patch_failures":0,"native_continue_failures":0,"field58_gate_failures":0,"direct_shortcut_failures":0,"input_path_failures":0,"runtime_proof_failures":1,"runtime_mode_failures":0,"eula_popup_failures":0,"save_data_popup_failures":1,"messagebox_dialog_failures":0,"server_status_failures":0,"title_cover_failures":1,"title_cover_penalty":200,"native_trace_blockers":0,"native_trace_hits_total":74,"native_trace_unique_breakpoints":11,"false_positives":0,"runtime_timeout_failures":0,"runtime_title_visual_suppressed_builds":0,"runtime_custom_cover_builds":0,"runtime_simulated_button_presses_total":0},"status":"keep","description":"Remove discarded predicate-observer runtime artifact from latest scoring","timestamp":1782513339597,"segment":0,"confidence":19.333333333333332,"asi":{"hypothesis":"After #395 preserved the predicate-pointer evidence in ASI and Beads memory, remove its discarded runtime artifact from latest scoring.","validation":".auto/measure.sh recovered from 800 to 1160 after removing /home/banon/projects/er-effects-rs/target/runtime-probe/product-continue-direct-20260626-153411; false_positives=0.","next_action_hint":"Combine the +0x44 TFC write with the predicate observer or statically find TFC+0x148 overwrites; no wrong-pointer hypothesis remains for the baseline."}}
{"run":397,"commit":"d247d4f","metric":800,"metrics":{"readiness_gate_failures":0,"target_constants_remaining":0,"helpers_missing":0,"fixed_wait_predicates":0,"autoload_static_failures":0,"asset_chain_failures":0,"dll_patch_failures":0,"native_continue_failures":0,"field58_gate_failures":0,"direct_shortcut_failures":0,"input_path_failures":0,"runtime_proof_failures":1,"runtime_mode_failures":0,"eula_popup_failures":0,"save_data_popup_failures":2,"messagebox_dialog_failures":0,"server_status_failures":0,"title_cover_failures":2,"title_cover_penalty":400,"native_trace_blockers":0,"native_trace_hits_total":74,"native_trace_unique_breakpoints":11,"false_positives":0,"runtime_timeout_failures":0,"runtime_title_visual_suppressed_builds":0,"runtime_custom_cover_builds":0,"runtime_simulated_button_presses_total":0},"status":"discard","description":"Combine preaccept +0x44 TFC write with predicate observer; native path overwrites version back to zero","timestamp":1782513466663,"segment":0,"confidence":19.333333333333332,"asi":{"hypothesis":"Combine the pre-accept +0x44 write with the observer-only predicate hook to determine whether the failed +0x44 run targeted the wrong TFC or whether native code overwrites TFC+0x148 between accept and the stale-regulation predicate.","validation":"Runtime artifact /home/banon/projects/er-effects-rs/target/runtime-probe/product-continue-direct-20260626-153644 logged preaccept +0x44 write on tfc=0x7fffa1b77148 version=11611000 manager=11611000, then predicate observer saw the same tfc=0x7fffa1b77148 but version=0 manager=11611000, same_tfc=true, would_corrupt=true, followed by 401106. Therefore native code overwrites or reinitializes TFC+0x148 back to zero after the accept byte and before FUN_14082d090.","rollback_reason":"Primary metric regressed to 800; diagnostic runtime artifact hard-failed with native_corrupted_save_detected and no product proof.","next_action_hint":"Static next target: find writers to TFC+0x148 between title accept and FUN_14082d090. The exact overwrite likely calls or inlines the zeroing native helper/ctor. Product fix should preserve native ordering or initialize after the overwrite through a proven semantic job, not a broad preaccept write."}}
