{"run":29,"commit":"fa10a85","metric":0,"metrics":{"readiness_gate_failures":0,"target_constants_remaining":0,"helpers_missing":0,"fixed_wait_predicates":0,"autoload_static_failures":0,"asset_chain_failures":0,"dll_patch_failures":0,"native_continue_failures":0,"field58_gate_failures":0,"direct_shortcut_failures":0,"input_path_failures":0,"runtime_proof_failures":1,"runtime_mode_failures":0,"eula_popup_failures":0,"save_data_popup_failures":0,"messagebox_dialog_failures":0,"server_status_failures":0,"title_cover_failures":0,"title_cover_penalty":0,"native_trace_blockers":0,"native_trace_hits_total":74,"native_trace_unique_breakpoints":11,"false_positives":0,"runtime_timeout_failures":1,"runtime_title_visual_suppressed_builds":1,"runtime_custom_cover_builds":1,"runtime_simulated_button_presses_total":0},"status":"crash","description":"gated title accept on profile-summary active bytes; avoided New Game overwrite but still timed out under ProfileSelect cover","timestamp":1782356571993,"segment":0,"confidence":5.8,"asi":{"hypothesis":"If the zero-input global accept byte fires before the native profile summary reports active save slots, it can select New Game before Continue exists. Gate title accept on GameDataMan+profileSummary active bytes != 0, and stage .bak/autocloud plus an expected save oracle for the direct probe.","result":"Runtime artifact /home/banon/projects/er-effects-rs/target/runtime-probe/product-continue-direct-20260624-200106 timed out. The gate prevented the prior destructive New Game path: final staged ER0000.sl2 and .bak still match the Banon gold save (sha1 c64dc82..., UD10 active [1,0,...], slot0 summary Banon level150 map 0xe000000) instead of being overwritten blank. RAM telemetry stayed profile_slot_active_bytes_qword=0x0, oracle_privacy_policy_gate=true, oracle_player_present=false, oracle_char_name='', native_submit_hits=0. Current kept ProfileSelect cover replacement still built (runtime_custom_cover_builds=1) and likely kept the title flow parked; no MessageBox/server/status and zero input.","rollback_reason":"Runtime did not reach product Continue/load/world-stable; run_experiment timed out. The title accept profile gate is diagnostically useful but not keepable without solving why native GameDataMan profile summary never loads under the current cover/save path.","next_action_hint":"Do not let title accept fire before profile active bytes are nonzero in future, but first remove the product-unsafe ProfileSelect title out-slot replacement or find the native profile-summary load trigger. Static RE should trace when GameDataMan+0x78 is populated/read relative to TitleTopDialog Loop; runtime should preserve final staged save to detect New Game overwrite."}}
{"run":30,"commit":"fa10a85","metric":0,"metrics":{"readiness_gate_failures":0,"target_constants_remaining":0,"helpers_missing":0,"fixed_wait_predicates":0,"autoload_static_failures":0,"asset_chain_failures":0,"dll_patch_failures":0,"native_continue_failures":1,"field58_gate_failures":0,"direct_shortcut_failures":0,"input_path_failures":0,"runtime_proof_failures":1,"runtime_mode_failures":0,"eula_popup_failures":0,"save_data_popup_failures":0,"messagebox_dialog_failures":0,"server_status_failures":0,"title_cover_failures":1,"title_cover_penalty":50,"native_trace_blockers":0,"native_trace_hits_total":74,"native_trace_unique_breakpoints":11,"false_positives":0,"runtime_timeout_failures":0,"runtime_title_visual_suppressed_builds":1,"runtime_custom_cover_builds":0,"runtime_simulated_button_presses_total":0},"status":"crash","description":"PartA-only plus profile-active accept gate failed fast on placeholder '_' without overwriting staged Banon save","timestamp":1782356789981,"segment":0,"confidence":5.8,"asi":{"hypothesis":"Combining pure Part A null suppression (no ProfileSelect out-slot), save companion staging, expected-save fail-fast, and a semantic title-accept gate requiring native profile active bytes may avoid selecting New Game before Continue exists and let the native profile summary become active.","result":"Runtime artifact /home/banon/projects/er-effects-rs/target/runtime-probe/product-continue-direct-20260624-200513 failed fast as intended with reason placeholder_character_detected at +19.0s. It did not press title accept (native_submit_hits=0, continue_phase=0, product_core_ready_blocker=unseen), ProfileSelect cover builds=0, title visual suppressed=1, zero input, zero MessageBox/server/policy windows. RAM still reported profile_slot_active_bytes_qword=0x0 and oracle_privacy_policy_gate=true; a placeholder '_' level9 player became present anyway. Final staged ER0000.sl2 and .bak remained intact Banon gold save (sha1 c64dc82..., UD10 active [1,0,...], slot0 Banon level150), proving the new fail-fast/gate avoids the previous blank save overwrite.","rollback_reason":"Runtime still did not reach native Continue/load/world-stable. PartA-only null suppression plus no accept did not prevent the game from materializing placeholder '_', so the native profile-summary load trigger is missing/deeper than title accept timing.","next_action_hint":"Static RE next: trace the path that creates placeholder player when profile_summary active bytes are zero and title accept never fires; also trace why boot never calls the native profile-summary save reader for staged ER0000.sl2 before placeholder creation. Avoid more runtime until a concrete hook/edge is identified."}}
{"run":31,"commit":"2100051","metric":1520,"metrics":{"readiness_gate_failures":0,"target_constants_remaining":0,"helpers_missing":0,"fixed_wait_predicates":0,"autoload_static_failures":0,"asset_chain_failures":0,"dll_patch_failures":0,"native_continue_failures":0,"field58_gate_failures":0,"direct_shortcut_failures":0,"input_path_failures":0,"runtime_proof_failures":1,"runtime_mode_failures":0,"eula_popup_failures":0,"save_data_popup_failures":0,"messagebox_dialog_failures":0,"server_status_failures":0,"title_cover_failures":0,"title_cover_penalty":0,"native_trace_blockers":0,"native_trace_hits_total":74,"native_trace_unique_breakpoints":11,"false_positives":0,"runtime_timeout_failures":0,"runtime_title_visual_suppressed_builds":0,"runtime_custom_cover_builds":0,"runtime_simulated_button_presses_total":0},"status":"keep","description":"refine '_' fail-fast to loaded-character semaphore, not title-state placeholder PGD","timestamp":1782356878541,"segment":0,"confidence":4.64,"asi":{"hypothesis":"The placeholder '_' fail-fast should catch a real loaded/default character path, but should not kill a run merely because title-state PlayerGameData is initialized to placeholder before any loaded-character signal exists.","result":"Refined telemetry_placeholder_character_detected to require expected save oracle, a player semaphore, and a loaded-character signal (current_animation_id present, oracle_block_id_valid, or oracle_havok_pos) before failing on empty-like names. Regression test now proves '_' with live animation fails, while title-state placeholder with no animation/havok/block signal does not. Static measure remains 1520 with runtime_proof_failures=1.","next_action_hint":"Re-run the PartA-only/profile-active gate later with this refined watcher if static RE identifies a profile-summary load trigger; the previous product-continue-direct-20260624-200513 artifact would now likely time out instead of placeholder-fail at title state."}}
{"run":32,"commit":"2100051","metric":0,"metrics":{"readiness_gate_failures":0,"target_constants_remaining":0,"helpers_missing":0,"fixed_wait_predicates":0,"autoload_static_failures":0,"asset_chain_failures":0,"dll_patch_failures":0,"native_continue_failures":0,"field58_gate_failures":0,"direct_shortcut_failures":0,"input_path_failures":0,"runtime_proof_failures":1,"runtime_mode_failures":0,"eula_popup_failures":0,"save_data_popup_failures":0,"messagebox_dialog_failures":0,"server_status_failures":0,"native_trace_blockers":0,"native_trace_hits_total":74,"native_trace_unique_breakpoints":11,"false_positives":0,"title_cover_failures":0,"title_cover_penalty":0,"runtime_timeout_failures":1,"runtime_title_visual_suppressed_builds":1,"runtime_custom_cover_builds":0,"runtime_simulated_button_presses_total":0},"status":"crash","description":"runtime probe after refined placeholder fail-fast timed out with PartA suppression but no Continue submit","timestamp":1782357549690,"segment":0,"confidence":4.64,"asi":{"hypothesis":"A fresh sentinel-triggered product runtime probe might advance past the title with the current refined placeholder handling and produce downstream native Continue/load proof, or at least show whether PartA/ProfileSelect cover telemetry still contaminates the out-slot.","rollback_reason":"run_experiment timed out before .auto/measure.sh could emit METRIC lines. Follow-up static measure still scores 1520, but the actual experiment is crash/timeout. Readiness artifact target/runtime-probe/product-continue-direct-20260624-201631/readiness-result.json reports timeout_seconds_budget_exhausted, native_continue_chain_stage=pre_submit, native_submit_entered=false, native_result_chain_ready=false, profile_slot_active_bytes_qword=0x0, oracle_char_name='_', no MessageBox/ToS popup, title native visual suppressed once, and custom ProfileSelect cover builds=0.","next_action_hint":"Stop runtime retries until static RE identifies why the boot SaveLoad2/profile-summary path leaves GameDataMan+profileSummary active bytes at 0 and why a placeholder player materializes before any native Continue submit; concrete next hook/edge is SaveLoad2::SLLoadSession::_Func02 at deobf 0x142410cd0 and file-load helpers 0x1424156b0/0x1424156e0 to log ER0000.sl2/.bak status codes and profile-summary deserialize outcomes.","artifact_dir":"/home/banon/projects/er-effects-rs/target/runtime-probe/product-continue-direct-20260624-201631","cleanup":"run_experiment timeout left eldenring.exe pid 3362228 alive; exact process was killed afterward and pgrep -x eldenring.exe/start_protected_game.exe returned empty.","guard_pivot":"Initial run_experiment command was blocked because .auto/measure.sh must be the direct command; sentinel was armed separately and rerun with command './.auto/measure.sh'.","observed_runtime_oracles":{"oracle_title_native_menu_visual_suppressed_builds":1,"oracle_title_custom_cover_profile_select_builds":0,"profile_slot_active_bytes_qword":"0x0","oracle_player_present":true,"oracle_char_name":"_","oracle_msgbox_total_builds":0,"oracle_policy_window_total_builds":0,"native_submit_entered":false}}}
{"run":33,"commit":"2100051","metric":0,"metrics":{"readiness_gate_failures":0,"target_constants_remaining":0,"helpers_missing":0,"fixed_wait_predicates":0,"autoload_static_failures":0,"asset_chain_failures":0,"dll_patch_failures":0,"native_continue_failures":0,"field58_gate_failures":0,"direct_shortcut_failures":0,"input_path_failures":0,"runtime_proof_failures":1,"runtime_mode_failures":0,"eula_popup_failures":0,"save_data_popup_failures":0,"messagebox_dialog_failures":0,"server_status_failures":0,"native_trace_blockers":0,"native_trace_hits_total":74,"native_trace_unique_breakpoints":11,"false_positives":0,"title_cover_failures":0,"title_cover_penalty":0,"runtime_timeout_failures":1,"runtime_title_visual_suppressed_builds":1,"runtime_custom_cover_builds":0,"runtime_simulated_button_presses_total":0},"status":"crash","description":"runtime probe with pre-staged .bak and steam_autocloud companions still timed out before Continue submit","timestamp":1782358339828,"segment":0,"confidence":4.64,"asi":{"hypothesis":"The direct product probe may be failing the title-time profile summary because the isolated staged save lacks vanilla companion files at launch time. Pre-stage ER0000.sl2.bak and steam_autocloud.vdf beside the gold save before launch so native save validation/profile-summary loading sees a complete save directory.","rollback_reason":"Runtime still timed out before native Continue submit. Artifact target/runtime-probe/product-continue-direct-20260624-203036 shows companions were present (ER0000.sl2, ER0000.sl2.bak, steam_autocloud.vdf), but readiness-result.json still reports timeout_seconds_budget_exhausted, native_continue_chain_stage=pre_submit, native_submit_entered=false, native_result_chain_ready=false, profile_slot_active_bytes_qword=0x0, oracle_char_name='_', zero input, zero MessageBox, zero policy window, and custom cover builds=0.","next_action_hint":"Companion staging alone is falsified for the direct/headless product path. Stop save-file companion retries; instrument the native profile-summary deserialize/read path instead. Concrete static/runtime edge remains ProfileSummary deserialize deobf 0x1402621b0 and SaveLoad2::SLLoadSession::_Func02/file helpers 0x142410cd0/0x142415200/0x1424156b0 to learn whether the staged file is parsed into GameDataMan+0x78 or whether placeholder PlayerGameData is created from a different boot path.","artifact_dir":"/home/banon/projects/er-effects-rs/target/runtime-probe/product-continue-direct-20260624-203036","observed_runtime_oracles":{"oracle_title_native_menu_visual_suppressed_builds":1,"oracle_title_custom_cover_profile_select_builds":0,"profile_slot_active_bytes_qword":"0x0","oracle_player_present":true,"oracle_char_name":"_","oracle_msgbox_total_builds":0,"oracle_policy_window_total_builds":0,"simulated_button_presses_total":0,"native_submit_entered":false},"cleanup":"Probe cleanup left no eldenring.exe or start_protected_game.exe process running."}}
{"run":34,"commit":"2100051","metric":0,"metrics":{"readiness_gate_failures":0,"target_constants_remaining":0,"helpers_missing":0,"fixed_wait_predicates":0,"autoload_static_failures":0,"asset_chain_failures":0,"dll_patch_failures":0,"native_continue_failures":0,"field58_gate_failures":0,"direct_shortcut_failures":0,"input_path_failures":0,"runtime_proof_failures":1,"runtime_mode_failures":0,"eula_popup_failures":0,"save_data_popup_failures":0,"messagebox_dialog_failures":0,"server_status_failures":0,"native_trace_blockers":0,"native_trace_hits_total":74,"native_trace_unique_breakpoints":11,"false_positives":0,"title_cover_failures":0,"title_cover_penalty":0,"runtime_timeout_failures":1,"runtime_title_visual_suppressed_builds":1,"runtime_custom_cover_builds":1,"runtime_simulated_button_presses_total":0},"status":"crash","description":"profile-summary deserialize oracle hook attempt timed out and did not install on current runtime path","timestamp":1782358612020,"segment":0,"confidence":4.64,"asi":{"hypothesis":"Instrument the native ProfileSummary stream deserializer at deobf 0x1402621b0 in the DLL so the next runtime probe reveals whether boot parses the staged ER0000.sl2 profile-summary active bytes before the title Continue gate remains empty.","rollback_reason":"Runtime timed out again and the new oracle did not install/fire: artifact target/runtime-probe/product-continue-direct-20260624-203502 has zero profile-summary-oracle log lines. The install was gated under product_autoload_enabled(), which is apparently false for this direct product probe path even though title visual suppression is enabled. The rebuilt source also reintroduced the kept ProfileSelect out-slot replacement, and telemetry shows oracle_title_custom_cover_profile_select_builds=1, preserving the known blocker. No native Continue submit occurred.","next_action_hint":"Move the profile-summary oracle install out of product_autoload_enabled() and gate it with title_native_menu_visual_suppression_enabled()/non-telemetry instead, and combine it with a PartA-only hook that does not call the ProfileSelect cover builder before rerunning. Do not return ProfileSelect in the title out slot; its build is confirmed again as the parked state blocker.","artifact_dir":"/home/banon/projects/er-effects-rs/target/runtime-probe/product-continue-direct-20260624-203502","observed_runtime_oracles":{"profile_summary_oracle_log_lines":0,"oracle_title_native_menu_visual_suppressed_builds":1,"oracle_title_custom_cover_profile_select_builds":1,"profile_slot_active_bytes_qword":"0x0","oracle_player_present":false,"oracle_char_name":"","oracle_msgbox_total_builds":0,"oracle_policy_window_total_builds":0,"simulated_button_presses_total":0,"native_submit_entered":false},"build":"cargo xwin build --release --target x86_64-pc-windows-msvc succeeded before runtime so deployed DLL did contain the attempted hook code.","cleanup":"Probe cleanup left no eldenring.exe or start_protected_game.exe process running."}}
{"run":35,"commit":"2100051","metric":0,"metrics":{"readiness_gate_failures":0,"target_constants_remaining":0,"helpers_missing":0,"fixed_wait_predicates":0,"autoload_static_failures":0,"asset_chain_failures":0,"dll_patch_failures":0,"native_continue_failures":0,"field58_gate_failures":0,"direct_shortcut_failures":0,"input_path_failures":0,"runtime_proof_failures":1,"runtime_mode_failures":0,"eula_popup_failures":0,"save_data_popup_failures":0,"messagebox_dialog_failures":0,"server_status_failures":0,"native_trace_blockers":0,"native_trace_hits_total":74,"native_trace_unique_breakpoints":11,"false_positives":0,"title_cover_failures":1,"title_cover_penalty":50,"runtime_timeout_failures":1,"runtime_title_visual_suppressed_builds":1,"runtime_custom_cover_builds":0,"runtime_simulated_button_presses_total":0},"status":"crash","description":"PartA-only title suppression plus profile-summary oracle proved staged summary deserializes empty","timestamp":1782358855652,"segment":0,"confidence":4.64,"asi":{"hypothesis":"Removing the runtime-falsified ProfileSelect out-slot replacement should avoid the parked-state blocker, and a profile-summary deserialize hook installed with title suppression should reveal whether the staged Banon save summary is parsed before Continue readiness.","rollback_reason":"Runtime still timed out before native Continue submit, so primary metric is 0/crash. Static measure for this source would be 1470 because PartB cover is absent. Artifact target/runtime-probe/product-continue-direct-20260624-203917 proves the new hook installed and fired twice, but both deserializations returned ret=1 with active_qword=0x0, slot0_name='', slot0_len=0, slot0_empty_like=true. Thus the native profile-summary deserializer is running, but the stream it is given is empty/placeholder, not the Banon UD10 summary from the staged ER0000.sl2.","next_action_hint":"Static RE the caller 0x1402584f1 / full save stream reader 0x140258430 and its upstream stream source. The current failure is not absence of profile-summary deserialization; it is an empty profile-summary stream reaching that deserializer. Find why the SaveLoad2 session reads an empty stream despite ER0000.sl2 containing Banon UD10, likely save-index/path/cloud container selection before the ProfileSummary subobject read. Keep PartA-only for runtime diagnostics; do not return ProfileSelect in the title out slot.","artifact_dir":"/home/banon/projects/er-effects-rs/target/runtime-probe/product-continue-direct-20260624-203917","observed_runtime_oracles":{"profile_summary_oracle_log_lines":3,"profile_summary_deserialize_hits":2,"profile_summary_active_qword":"0x0","profile_summary_slot0_name":"","profile_summary_slot0_empty_like":true,"oracle_title_native_menu_visual_suppressed_builds":1,"oracle_title_custom_cover_profile_select_builds":0,"profile_slot_active_bytes_qword":"0x0","oracle_player_present":true,"oracle_char_name":"_","oracle_msgbox_total_builds":0,"oracle_policy_window_total_builds":0,"simulated_button_presses_total":0,"native_submit_entered":false},"build":"cargo xwin build --release --target x86_64-pc-windows-msvc succeeded before runtime; deployed DLL contained PartA-only hook and profile-summary oracle.","cleanup":"Probe cleanup left no eldenring.exe or start_protected_game.exe process running."}}
