{"run":577,"commit":"4dc167b","metric":0,"metrics":{"readiness_gate_failures":0,"target_constants_remaining":0,"helpers_missing":0,"fixed_wait_predicates":0,"autoload_static_failures":0,"asset_chain_failures":0,"dll_patch_failures":0,"native_continue_failures":0,"field58_gate_failures":0,"direct_shortcut_failures":0,"input_path_failures":0,"runtime_proof_failures":0,"runtime_mode_failures":0,"eula_popup_failures":0,"save_data_popup_failures":0,"messagebox_dialog_failures":0,"server_status_failures":0,"title_cover_failures":2,"title_cover_penalty":1800,"native_trace_blockers":0,"native_trace_hits_total":74,"native_trace_unique_breakpoints":11,"false_positives":0,"offline_face_source_ready":1,"removed path_cpu_texture_bridge_ready":0,"offline_face_texture_runtime_drawn":0,"stylized_facedata_pixel_oracle":0,"real_portrait_asset_candidates":0,"profile_placeholder_assets_only":1},"status":"discard","description":"Static RE shows GenericListSelectDialog ctor is behavior-active, not a passive GFx owner.","timestamp":1782630734612,"segment":2,"confidence":null,"asi":{"hypothesis":"Determine whether the shared GenericListSelectDialog/ProfileSelect constructor can be used as a stripped/passive GFx owner for dummy-profile bindings, or whether it already installs blocking/menu behavior and must be avoided.","observed_evidence":"CS::GenericListSelectDialog::GenericListSelectDialog dump 0x14078c560 calls MenuWindow::MenuWindow(root_scene, load_info), initializes field1_0xa38 GridControl/BaseChangeDstSelectDialog over the list SceneObjProxy, constructs another SceneObjProxy at +0x1200, and calls FUN_14077f020. FUN_14077f020 installs multiple MenuJob/lambda callbacks on the MenuWindow via FUN_140744640 and links field_0x50 to field1_0xa38. FUN_140735b90 creates arrow/layout proxies and copies a GFx value from a SceneObjProxy into BaseChangeDstSelectDialog. FUN_140749290 resolves MenuResource into SceneObjProxy from the resource name. Finding saved to bd memory generic-list-owner-static-2026-06-28.","rollback_reason":"Primary metric stayed 0; this was static RE and did not implement or prove a visible portrait cover surface/oracle.","next_action_hint":"Avoid GenericListSelectDialog/ProfileSelectDialog constructors wholesale. Next implement a minimal custom MenuWindow/MenuResource-like owner or authored GFX resource with dummy face symbols and only the +0x3b8 binding path needed for FUN_1407452c0."}}
{"run":578,"commit":"4dc167b","metric":0,"metrics":{"readiness_gate_failures":0,"target_constants_remaining":0,"helpers_missing":0,"fixed_wait_predicates":0,"autoload_static_failures":0,"asset_chain_failures":0,"dll_patch_failures":0,"native_continue_failures":0,"field58_gate_failures":0,"direct_shortcut_failures":0,"input_path_failures":0,"runtime_proof_failures":0,"runtime_mode_failures":0,"eula_popup_failures":0,"save_data_popup_failures":0,"messagebox_dialog_failures":0,"server_status_failures":0,"title_cover_failures":2,"title_cover_penalty":1800,"native_trace_blockers":0,"native_trace_hits_total":74,"native_trace_unique_breakpoints":11,"false_positives":0,"offline_face_source_ready":1,"removed path_cpu_texture_bridge_ready":0,"offline_face_texture_runtime_drawn":0,"stylized_facedata_pixel_oracle":0,"real_portrait_asset_candidates":0,"profile_placeholder_assets_only":1},"status":"discard","description":"Static RE mapped minimal MenuWindow bind owner separate from GenericList behavior.","timestamp":1782630850637,"segment":2,"confidence":null,"asi":{"hypothesis":"Map the minimal MenuWindow/MenuResource-like owner state required for FUN_1407452c0 dummy-face bindings, separating the passive bind owner from GenericListSelectDialog/ProfileSelect behavior.","observed_evidence":"MenuWindow::MenuWindow dump 0x140741a60 initializes field553_0x3b8 as a SceneObjProxy copied from the root SceneObjProxy and zeroes field_0xa20/field_0xa28 immediately after it. FUN_1407452c0(owner,pair) treats owner+0x60 as binding fixed-vector state; FUN_140748700(owner+0x60,pair) increments count at owner+0x668 (MenuWindow+0xa20 for field553) and appends up to 0x10 string pairs before GLOBAL_CSScaleform/FUN_140d6ac00 applies the pair to that owner SceneObjProxy. MenuWindow constructor does not install GenericListSelectDialog callback jobs; FUN_14077f020 does. Finding saved to bd memory menuwindow-bind-owner-minimal-static-2026-06-28.","rollback_reason":"Primary metric stayed 0; static RE only, no custom surface or portrait oracle was implemented.","next_action_hint":"Use an authored/custom GFX SceneObjProxy plus MenuWindow::MenuWindow, or a MenuWindow-shaped owner with +0x3b8 SceneObjProxy and +0xa20 vector initialized, then bind dummy face symbols through FUN_1407452c0 without replaying ProfileSelect/GenericList behavior."}}
{"run":579,"commit":"4dc167b","metric":0,"metrics":{"readiness_gate_failures":0,"target_constants_remaining":0,"helpers_missing":0,"fixed_wait_predicates":0,"autoload_static_failures":0,"asset_chain_failures":0,"dll_patch_failures":0,"native_continue_failures":0,"field58_gate_failures":0,"direct_shortcut_failures":0,"input_path_failures":0,"runtime_proof_failures":0,"runtime_mode_failures":0,"eula_popup_failures":0,"save_data_popup_failures":0,"messagebox_dialog_failures":0,"server_status_failures":0,"title_cover_failures":2,"title_cover_penalty":1800,"native_trace_blockers":0,"native_trace_hits_total":74,"native_trace_unique_breakpoints":11,"false_positives":0,"offline_face_source_ready":1,"removed path_cpu_texture_bridge_ready":0,"offline_face_texture_runtime_drawn":0,"stylized_facedata_pixel_oracle":0,"real_portrait_asset_candidates":0,"profile_placeholder_assets_only":1},"status":"discard","description":"Static RE mapped MenuWindow behavior vtable and visibility/job caveats for passive custom cover owner.","timestamp":1782630971146,"segment":2,"confidence":null,"asi":{"hypothesis":"Map MenuWindow visibility/job vtable semantics before building a passive custom title cover owner, so the implementation does not accidentally borrow modal/result behavior from native menu windows.","observed_evidence":"MenuWindow vtable root 0x142a9f128 dispatches behavior through MenuWindow fields. FUN_14077eba0 reports active when field254_0x1e8 should not continue and field_0x10 job pointer/state is active. FUN_14077ec80 sets Failed and calls vtable +0x60. FUN_140746f80 handles Success/Failed, triggers title/menu transition helpers, clears field_0x10 via FUN_1407a93e0, and installs a one-shot lambda via FUN_140746b00. FUN_140744640 appends jobs into field255_0x1f0 and calls vtable +0x38. Finding saved to bd memory menuwindow-vtable-visibility-static-2026-06-28.","rollback_reason":"Primary metric stayed 0; static RE only, no visible portrait surface or oracle was implemented.","next_action_hint":"For passive cover, use MenuWindow ctor only for SceneObjProxy/bind-owner initialization or build an explicit surface owner driven by an already-active title SceneObjProxy; do not reuse MenuWindow job/result fields unless intentionally integrating lifecycle behavior."}}
{"run":580,"commit":"4dc167b","metric":0,"metrics":{"readiness_gate_failures":0,"target_constants_remaining":0,"helpers_missing":0,"fixed_wait_predicates":0,"autoload_static_failures":0,"asset_chain_failures":0,"dll_patch_failures":0,"native_continue_failures":0,"field58_gate_failures":0,"direct_shortcut_failures":0,"input_path_failures":0,"runtime_proof_failures":0,"runtime_mode_failures":0,"eula_popup_failures":0,"save_data_popup_failures":0,"messagebox_dialog_failures":0,"server_status_failures":0,"title_cover_failures":2,"title_cover_penalty":1800,"native_trace_blockers":0,"native_trace_hits_total":74,"native_trace_unique_breakpoints":11,"false_positives":0,"offline_face_source_ready":1,"removed path_cpu_texture_bridge_ready":0,"offline_face_texture_runtime_drawn":0,"stylized_facedata_pixel_oracle":0,"real_portrait_asset_candidates":0,"profile_placeholder_assets_only":1},"status":"discard","description":"Static RE mapped TitleBackViewParts lifecycle and FadeIn visibility path for custom surface route.","timestamp":1782631076519,"segment":2,"confidence":null,"asi":{"hypothesis":"Map active TitleBackViewParts lifecycle/visibility so a custom title-safe portrait surface can be driven by the same SceneObjProxy/Scaleform action path instead of MenuWindow job lifecycle.","observed_evidence":"TitleTopDialog constructor FUN_1409a82d0 assigns Top, constructs TitleBackViewParts at dialog+0xaa8 with load info filename 05_001_Title_Logo, then calls FUN_1409a63f0(dialog+0xaa8). FUN_1409a63f0 is FUN_140749ae0(TitleBackViewParts+0x88, FadeIn). CSReviewTitleTopDialog FUN_1409a27e0 has the same TitleBackViewParts construction/fade-in pattern. TitleBackViewParts ctor FUN_1409a62d0 sets vtable, constructs MenuResource at +0x8, resolves +0x70 SceneObjProxy with FUN_140749290, and uses +0x88 as GFx/ScaleformValue action target. Visibility is SceneObjProxy/Scaleform actions, not MenuWindow jobs. Finding saved to bd memory titleback-lifecycle-static-2026-06-28.","rollback_reason":"Primary metric stayed 0; static RE only, no custom surface or portrait oracle was implemented.","next_action_hint":"Prototype a TitleBackViewParts-like custom surface with synthetic/custom GFX load_info and call the same +0x88 FadeIn path after resolving its SceneObjProxy. Keep it separate from ProfileSelect/MenuWindow jobs."}}
{"run":581,"commit":"4dc167b","metric":0,"metrics":{"readiness_gate_failures":0,"target_constants_remaining":0,"helpers_missing":0,"fixed_wait_predicates":0,"autoload_static_failures":0,"asset_chain_failures":0,"dll_patch_failures":0,"native_continue_failures":0,"field58_gate_failures":0,"direct_shortcut_failures":0,"input_path_failures":0,"runtime_proof_failures":0,"runtime_mode_failures":0,"eula_popup_failures":0,"save_data_popup_failures":0,"messagebox_dialog_failures":0,"server_status_failures":0,"title_cover_failures":2,"title_cover_penalty":1800,"native_trace_blockers":0,"native_trace_hits_total":74,"native_trace_unique_breakpoints":11,"false_positives":0,"offline_face_source_ready":1,"removed path_cpu_texture_bridge_ready":0,"offline_face_texture_runtime_drawn":0,"stylized_facedata_pixel_oracle":0,"real_portrait_asset_candidates":0,"profile_placeholder_assets_only":1},"status":"discard","description":"Static RE grounded TitleBackViewParts/MenuResource ABI and deobf addresses for custom-surface diagnostic.","timestamp":1782631209623,"segment":2,"confidence":null,"asi":{"hypothesis":"Ground exact MenuResource/TitleBackViewParts constructor, action, visibility ABI and deobf addresses so the next implementation can build an owned custom title-safe surface without guessing.","observed_evidence":"MenuResource ctor dump 0x140748b30 -> deobf 0x140748a30 initializes Scaleform load result/value, copies two-qword load_info into resource+0x48/+0x50, and zeros +0x58/+0x60. TitleBackViewParts ctor dump 0x1409a62d0 -> deobf 0x1409a6180 sets vtable, calls MenuResource ctor at this+0x8, resolves this+0x70 SceneObjProxy via FUN_140749290, and uses this+0x88 as action target. Fade/action helper dump 0x140749ae0 -> deobf 0x1407499e0 calls GFx object vfunc +0x150 with action name. SetVisible dump 0x1409a6410 maps region-estimate to deobf 0x1409a62c0 and calls SceneObjProxy visible setter on this+0x70. Finding saved to bd memory titleback-menuresource-abi-static-2026-06-28.","rollback_reason":"Primary metric stayed 0; this was static ABI grounding only and no custom surface or portrait oracle was implemented.","next_action_hint":"Implement a bounded explicit diagnostic: owned 0xd0 TitleBackViewParts storage, synthetic/custom GFX load_info into deobf 0x1409a6180, then +0x88 FadeIn or +0x70 SetVisible; still require real custom GFX bytes/symbols and visible portrait oracle before scoring."}}
{"run":582,"commit":"4dc167b","metric":0,"metrics":{"readiness_gate_failures":0,"target_constants_remaining":0,"helpers_missing":0,"fixed_wait_predicates":0,"autoload_static_failures":0,"asset_chain_failures":0,"dll_patch_failures":0,"native_continue_failures":0,"field58_gate_failures":0,"direct_shortcut_failures":0,"input_path_failures":0,"runtime_proof_failures":0,"runtime_mode_failures":0,"eula_popup_failures":0,"save_data_popup_failures":0,"messagebox_dialog_failures":0,"server_status_failures":0,"title_cover_failures":2,"title_cover_penalty":1800,"native_trace_blockers":0,"native_trace_hits_total":74,"native_trace_unique_breakpoints":11,"false_positives":0,"offline_face_source_ready":1,"removed path_cpu_texture_bridge_ready":0,"offline_face_texture_runtime_drawn":0,"stylized_facedata_pixel_oracle":0,"real_portrait_asset_candidates":0,"profile_placeholder_assets_only":1},"status":"discard","description":"Static RE grounded TitleBackViewParts teardown for owned custom-surface diagnostic.","timestamp":1782631376573,"segment":2,"confidence":null,"asi":{"hypothesis":"Ground the non-deleting/deleting destructors and MenuResource teardown for a DLL-owned TitleBackViewParts diagnostic before implementing owned storage, so runtime cleanup will not leak or free DLL memory through the engine allocator.","observed_evidence":"TitleBackViewParts vtable root is dump 0x142b23160. Non-deleting dtor FUN_1409a6330 sets the vtable, destroys embedded SceneObjProxy/CSScaleformValue at this+0x98, then calls MenuResource dtor FUN_140748e80(this+0x8). Deleting dtor FUN_1409a6380 does the same and operator_delete(this,0xd0) if flags&1. MenuResource dtor FUN_140748e80 unregisters resource+0x60 via GLOBAL_CSScaleform/FUN_140d6aaa0 when nonzero, destroys load result GFx value at resource+0x10, calls FUN_140d6a3d0(resource+0x8), releases resource+0x8 via FUN_14112c0d0 if non-null, and restores DLNonCopyable vtable. Finding saved to bd memory titleback-destructor-static-2026-06-28.","rollback_reason":"Primary metric stayed 0; this was static teardown ABI grounding only and no custom surface or portrait oracle was implemented.","next_action_hint":"Owned 0xd0 TitleBackViewParts diagnostic should call the non-deleting dtor (dump 0x1409a6330; likely deobf 0x1409a61e0 after shift verification) before freeing DLL storage; never use deleting dtor on DLL-owned memory."}}
{"run":583,"commit":"4dc167b","metric":0,"metrics":{"readiness_gate_failures":0,"target_constants_remaining":0,"helpers_missing":0,"fixed_wait_predicates":0,"autoload_static_failures":0,"asset_chain_failures":0,"dll_patch_failures":0,"native_continue_failures":0,"field58_gate_failures":0,"direct_shortcut_failures":0,"input_path_failures":0,"runtime_proof_failures":0,"runtime_mode_failures":0,"eula_popup_failures":0,"save_data_popup_failures":0,"messagebox_dialog_failures":0,"server_status_failures":0,"title_cover_failures":2,"title_cover_penalty":1800,"native_trace_blockers":0,"native_trace_hits_total":74,"native_trace_unique_breakpoints":11,"false_positives":0,"offline_face_source_ready":1,"removed path_cpu_texture_bridge_ready":0,"offline_face_texture_runtime_drawn":0,"stylized_facedata_pixel_oracle":0,"real_portrait_asset_candidates":0,"profile_placeholder_assets_only":1},"status":"discard","description":"Static RE mapped Scaleform load_info shape for synthetic TitleBackViewParts diagnostics.","timestamp":1782656958340,"segment":2,"confidence":null,"asi":{"hypothesis":"Map the Scaleform/MenuResource load_info ABI so a synthetic/custom TitleBackViewParts diagnostic can pass a stable, native-shaped filename/load descriptor instead of guessing raw strings.","observed_evidence":"MenuResource ctor calls FUN_140d6a2f0, FUN_140d6a460(result,'_level0'), then copies two-qword load_info to resource+0x48/+0x50. FUN_140d7ac70 treats load_info as {u32 kind/state at +0, u8 cache_policy/flags at +4, wchar_t* filename at +8}: byte +4 == 2 triggers queued/cached reuse path; param_2[1] is UTF-16 filename copied to a fixed string before cache/load record lookup/allocation through FUN_140d6fd30. Native TitleTopDialog uses first qword 0x0000000100000005 and filename L\"05_001_Title_Logo\". Finding saved to bd memory scaleform-loadinfo-static-2026-06-28.","rollback_reason":"Primary metric stayed 0; this was static ABI grounding only and no custom surface or portrait oracle was implemented.","next_action_hint":"Use a stable UTF-16 filename pointer and native two-qword load_info shape {0x0000000100000005, filename_ptr} for synthetic/custom TitleBack diagnostics; do not pass ASCII/raw temporary strings."}}
{"run":584,"commit":"4dc167b","metric":0,"metrics":{"readiness_gate_failures":0,"target_constants_remaining":0,"helpers_missing":0,"fixed_wait_predicates":0,"autoload_static_failures":0,"asset_chain_failures":0,"dll_patch_failures":0,"native_continue_failures":0,"field58_gate_failures":0,"direct_shortcut_failures":0,"input_path_failures":0,"runtime_proof_failures":0,"runtime_mode_failures":0,"eula_popup_failures":0,"save_data_popup_failures":0,"messagebox_dialog_failures":0,"server_status_failures":0,"title_cover_failures":2,"title_cover_penalty":1800,"native_trace_blockers":0,"native_trace_hits_total":74,"native_trace_unique_breakpoints":11,"false_positives":0,"offline_face_source_ready":1,"removed path_cpu_texture_bridge_ready":0,"offline_face_texture_runtime_drawn":0,"stylized_facedata_pixel_oracle":0,"real_portrait_asset_candidates":0,"profile_placeholder_assets_only":1},"status":"discard","description":"Static RE verified live deobf TitleBackViewParts prologues before implementation.","timestamp":1782657040884,"segment":2,"confidence":null,"asi":{"hypothesis":"Verify the dump-to-deobf shifts and live prologues for TitleBackViewParts ctor/dtor/action/set-visible before coding an owned custom-surface diagnostic.","observed_evidence":"Deobf disasm confirms ctor 0x1409a6180 stores vtable 0x142b23160, copies 16-byte load_info from RDX, calls MenuResource ctor 0x140748a30 at this+0x8, then resolver 0x140749190 with RCX=this+0x8/RDX=this+0x70. Non-deleting dtor 0x1409a61e0 sets vtable, destroys this+0x98 via 0x140d7f850, then tail-jumps MenuResource dtor 0x140748d80 at this+0x8. SetVisible 0x1409a62c0 is add rcx,0x70; jmp 0x140733340. Action helper 0x1407499e0 expects RCX=&SceneObjProxy/CSScaleformValue handle (e.g. this+0x88) and RDX=action-name pointer, then calls GFx object vfunc +0x150 when object-like. Finding saved to bd memory titleback-deobf-prologue-verify-2026-06-28.","rollback_reason":"Primary metric stayed 0; this was static prologue verification only and no custom surface/oracle was implemented.","next_action_hint":"Use live/deobf addresses from this verification for the owned TitleBackViewParts diagnostic; do not call dump addresses or use region-estimate unverified values."}}
{"run":585,"commit":"4dc167b","metric":0,"metrics":{"readiness_gate_failures":0,"target_constants_remaining":0,"helpers_missing":0,"fixed_wait_predicates":0,"autoload_static_failures":0,"asset_chain_failures":0,"dll_patch_failures":0,"native_continue_failures":0,"field58_gate_failures":0,"direct_shortcut_failures":0,"input_path_failures":0,"runtime_proof_failures":0,"runtime_mode_failures":0,"eula_popup_failures":0,"save_data_popup_failures":0,"messagebox_dialog_failures":0,"server_status_failures":0,"title_cover_failures":2,"title_cover_penalty":1800,"native_trace_blockers":0,"native_trace_hits_total":74,"native_trace_unique_breakpoints":11,"false_positives":0,"offline_face_source_ready":1,"removed path_cpu_texture_bridge_ready":0,"offline_face_texture_runtime_drawn":0,"stylized_facedata_pixel_oracle":0,"real_portrait_asset_candidates":0,"profile_placeholder_assets_only":1},"status":"discard","description":"Added default-off owned TitleBackViewParts diagnostic constants scaffold; primary stayed 0.","timestamp":1782657105940,"segment":2,"confidence":null,"asi":{"hypothesis":"Add non-scoring/default-off constants for the owned TitleBackViewParts diagnostic so the next implementation can use verified object size, load_info word, non-deleting destructor RVA, and telemetry counters without re-deriving them.","observed_evidence":"Added TITLE_CUSTOM_COVER_TITLEBACK_OBJECT_SIZE=0xd0, TITLE_CUSTOM_COVER_TITLEBACK_LOAD_INFO_WORD0=0x0000000100000005, TITLE_CUSTOM_COVER_TITLEBACK_DTOR_RVA=0x9a61e0, TITLE_CUSTOM_COVER_SYNTHETIC_RESOURCE_NAME=er_effects_portrait_cover, and diagnostic counters. .auto/measure.sh stayed pass/fail-closed with title_cover_failures=2 and false_positives=0; no portrait proof was claimed.","rollback_reason":"Primary metric stayed 0; constants-only scaffold does not request/render a custom surface and is not portrait proof.","next_action_hint":"Reapply these constants only together with an actual bounded diagnostic that allocates owned 0xd0 storage, calls TitleBackViewParts ctor with stable UTF-16 load_info, observes synthetic URL/FileOpener hits, then tears down through the non-deleting dtor."}}
