{"run":155,"commit":"2100051","metric":1520,"metrics":{"readiness_gate_failures":0,"target_constants_remaining":0,"helpers_missing":0,"fixed_wait_predicates":0,"autoload_static_failures":0,"asset_chain_failures":0,"dll_patch_failures":0,"native_continue_failures":0,"field58_gate_failures":0,"direct_shortcut_failures":0,"input_path_failures":0,"runtime_proof_failures":1,"runtime_mode_failures":0,"eula_popup_failures":0,"save_data_popup_failures":0,"messagebox_dialog_failures":0,"server_status_failures":0,"title_cover_failures":0,"title_cover_penalty":0,"native_trace_blockers":0,"native_trace_hits_total":74,"native_trace_unique_breakpoints":11,"false_positives":0,"runtime_timeout_failures":0,"runtime_title_visual_suppressed_builds":1,"runtime_custom_cover_builds":1,"runtime_simulated_button_presses_total":0},"status":"discard","description":"static traced 9a7c40 branch to data-only 9b13d0 slot","timestamp":1782412697134,"segment":0,"confidence":null,"asi":{"hypothesis":"Decoding FUN_1409a7c40 and its owner would move the CommandSelectDialog/title-sequence selector search past thin wrappers toward the actual data/vtable selector.","rollback_reason":"Primary metric remained 1520, equal to the persisted best, and runtime_proof_failures remains 1. This iteration produced a static RE finding only.","next_action_hint":"Identify the typed owner/constructor of vtable/data slot 0x142b26830 and what native title/CommandSelectDialog state selects it. Do not cold-call 9b13d0/9a7c40/9aa070 or ChainMenuJobs.","static_finding_key":"autoload-commandselectdialog-9a7c40-to-data-slot-2026-06-25","evidence":"Ghidra DecompAddr/XrefCallers: FUN_1409a7c40 calls FUN_1409a8250; FUN_1409b13d0 calls FUN_1409a7c40; xrefs to FUN_1409b13d0 are data-only at 0x142b26830 plus pdata/unwind."}}
{"run":156,"commit":"2100051","metric":1520,"metrics":{"readiness_gate_failures":0,"target_constants_remaining":0,"helpers_missing":0,"fixed_wait_predicates":0,"autoload_static_failures":0,"asset_chain_failures":0,"dll_patch_failures":0,"native_continue_failures":0,"field58_gate_failures":0,"direct_shortcut_failures":0,"input_path_failures":0,"runtime_proof_failures":1,"runtime_mode_failures":0,"eula_popup_failures":0,"save_data_popup_failures":0,"messagebox_dialog_failures":0,"server_status_failures":0,"title_cover_failures":0,"title_cover_penalty":0,"native_trace_blockers":0,"native_trace_hits_total":74,"native_trace_unique_breakpoints":11,"false_positives":0,"runtime_timeout_failures":0,"runtime_title_visual_suppressed_builds":1,"runtime_custom_cover_builds":1,"runtime_simulated_button_presses_total":0},"status":"discard","description":"static corrected 142b26830 as metadata not direct dispatch slot","timestamp":1782412868416,"segment":0,"confidence":null,"asi":{"hypothesis":"Identifying the typed owner/constructor of 0x142b26830 would reveal the native title/CommandSelectDialog selector for the wrapper slot that ultimately leads to FUN_1409b13d0.","rollback_reason":"Primary metric remained 1520, equal to the persisted best, and runtime_proof_failures remains 1. This iteration produced a static RE correction only.","next_action_hint":"Do not use 0x142b26830 as a direct dispatch slot. Identify which native object constructs/installs the real vtable root 0x142b268d0 and what state selects its FUN_1409b0970-related slot; keep ignoring pdata/unwind refs as gameplay dispatch.","static_finding_key":"autoload-142b26830-not-direct-dispatch-2026-06-25","evidence":"XrefCallers/NameAddrs/XrefRtti show no direct refs/symbol for 0x142b26830; er_disasm data shows metadata; VtableDump 0x142b268d0 and 0x142b26900 show actual std::function/vtable roots and slots, including FUN_1409b0970 at 0x142b26948."}}
{"run":157,"commit":"2100051","metric":1520,"metrics":{"readiness_gate_failures":0,"target_constants_remaining":0,"helpers_missing":0,"fixed_wait_predicates":0,"autoload_static_failures":0,"asset_chain_failures":0,"dll_patch_failures":0,"native_continue_failures":0,"field58_gate_failures":0,"direct_shortcut_failures":0,"input_path_failures":0,"runtime_proof_failures":1,"runtime_mode_failures":0,"eula_popup_failures":0,"save_data_popup_failures":0,"messagebox_dialog_failures":0,"server_status_failures":0,"title_cover_failures":0,"title_cover_penalty":0,"native_trace_blockers":0,"native_trace_hits_total":74,"native_trace_unique_breakpoints":11,"false_positives":0,"runtime_timeout_failures":0,"runtime_title_visual_suppressed_builds":1,"runtime_custom_cover_builds":1,"runtime_simulated_button_presses_total":0},"status":"discard","description":"static identified 142b268d0 as lambda896b CommandSelectDialog vtable root","timestamp":1782412990954,"segment":0,"confidence":null,"asi":{"hypothesis":"Identifying which native object constructs/installs vtable root 0x142b268d0 would reveal the state selector for the FUN_1409b0970-related title wrapper slot.","rollback_reason":"Primary metric remained 1520, equal to the persisted best, and runtime_proof_failures remains 1. This iteration produced a static RE finding only.","next_action_hint":"Search for construction/enqueue sites of lambda_896b std::function objects, especially writes of vtable root 0x142b268d0 or meaningful refs to copy helper FUN_1409b1fb0 beyond metadata, then connect that to CommandSelectDialog/title state selection. Do not cold-call vtable invoke/wrapper functions.","static_finding_key":"autoload-142b268d0-lambda896b-vtable-owner-2026-06-25","evidence":"VtableDump 0x142b268d0: slot0 FUN_1409b1fb0 copy helper for lambda_896b; slot1 FUN_1409b0fa0 wraps FUN_1409a78a0; slot15 FUN_1409b0970; XrefCallers shows no direct refs to 0x142b268d0/0x142b268d8."}}
{"run":158,"commit":"2100051","metric":1520,"metrics":{"readiness_gate_failures":0,"target_constants_remaining":0,"helpers_missing":0,"fixed_wait_predicates":0,"autoload_static_failures":0,"asset_chain_failures":0,"dll_patch_failures":0,"native_continue_failures":0,"field58_gate_failures":0,"direct_shortcut_failures":0,"input_path_failures":0,"runtime_proof_failures":1,"runtime_mode_failures":0,"eula_popup_failures":0,"save_data_popup_failures":0,"messagebox_dialog_failures":0,"server_status_failures":0,"title_cover_failures":0,"title_cover_penalty":0,"native_trace_blockers":0,"native_trace_hits_total":74,"native_trace_unique_breakpoints":11,"false_positives":0,"runtime_timeout_failures":0,"runtime_title_visual_suppressed_builds":1,"runtime_custom_cover_builds":1,"runtime_simulated_button_presses_total":0},"status":"discard","description":"static found no direct lambda896b enqueue xrefs beyond metadata","timestamp":1782413134967,"segment":0,"confidence":null,"asi":{"hypothesis":"Searching direct xrefs and FuncImpl metadata for lambda_896b construction/enqueue sites would reveal where the CommandSelectDialog title sequence job is built, or prove direct xrefs are only metadata.","rollback_reason":"Primary metric remained 1520, equal to the persisted best, and runtime_proof_failures remains 1. This iteration produced a static negative finding only.","next_action_hint":"Stop using direct xrefs to 0x142b268d0/FUN_1409b1fb0 for enqueue discovery. Inspect/decompile larger title builders around the FUN_1409a78a0/FUN_1409a80d0/FUN_1409a8110 families or surrounding lambdas to find inlined stack construction/selection of lambda_896b.","static_finding_key":"autoload-lambda896b-no-direct-enqueue-xrefs-2026-06-25","evidence":"FindFuncImplCall found lambda_896b vtable/meta and decompiled copy/invoke helpers; XrefCallers for helper/invoke/destructor and 0x142b268d0 show only vtable/pdata/RTTI metadata refs, no normal code enqueue site."}}
{"run":159,"commit":"2100051","metric":1520,"metrics":{"readiness_gate_failures":0,"target_constants_remaining":0,"helpers_missing":0,"fixed_wait_predicates":0,"autoload_static_failures":0,"asset_chain_failures":0,"dll_patch_failures":0,"native_continue_failures":0,"field58_gate_failures":0,"direct_shortcut_failures":0,"input_path_failures":0,"runtime_proof_failures":1,"runtime_mode_failures":0,"eula_popup_failures":0,"save_data_popup_failures":0,"messagebox_dialog_failures":0,"server_status_failures":0,"title_cover_failures":0,"title_cover_penalty":0,"native_trace_blockers":0,"native_trace_hits_total":74,"native_trace_unique_breakpoints":11,"false_positives":0,"runtime_timeout_failures":0,"runtime_title_visual_suppressed_builds":1,"runtime_custom_cover_builds":1,"runtime_simulated_button_presses_total":0},"status":"discard","description":"static traced lambda896b wrappers to terminal title builders","timestamp":1782413451795,"segment":0,"confidence":null,"asi":{"hypothesis":"Inspecting/decompiling larger title builders around FUN_1409a78a0/FUN_1409a80d0/FUN_1409a8110 would reveal inlined stack construction or selection of lambda_896b after direct xrefs failed.","rollback_reason":"Primary metric remained 1520, equal to the persisted best, and runtime_proof_failures remains 1. This iteration produced a static trace finding only.","next_action_hint":"Decode terminal builders FUN_1409a8b50 and FUN_1409a8090, with 0x1409a92a0/94c0/9b90 as comparators, to identify the CommandSelectDialog state/result selecting this family. Do not cold-call wrappers/builders.","static_finding_key":"autoload-lambda896b-wrapper-to-terminal-builders-2026-06-25","evidence":"FUN_1409b0970 -> FUN_1409a7480 -> FUN_1409a7e50 -> FUN_1409a6ec0 -> FUN_1409a8b50; FUN_1409b0fa0 -> FUN_1409a78a0 -> FUN_1409a8090; neighboring wrappers delegate similarly and xrefs remain metadata/wrapper-only."}}
{"run":160,"commit":"2100051","metric":1520,"metrics":{"readiness_gate_failures":0,"target_constants_remaining":0,"helpers_missing":0,"fixed_wait_predicates":0,"autoload_static_failures":0,"asset_chain_failures":0,"dll_patch_failures":0,"native_continue_failures":0,"field58_gate_failures":0,"direct_shortcut_failures":0,"input_path_failures":0,"runtime_proof_failures":1,"runtime_mode_failures":0,"eula_popup_failures":0,"save_data_popup_failures":0,"messagebox_dialog_failures":0,"server_status_failures":0,"title_cover_failures":0,"title_cover_penalty":0,"native_trace_blockers":0,"native_trace_hits_total":74,"native_trace_unique_breakpoints":11,"false_positives":0,"runtime_timeout_failures":0,"runtime_title_visual_suppressed_builds":1,"runtime_custom_cover_builds":1,"runtime_simulated_button_presses_total":0},"status":"discard","description":"static decoded lambda896b terminal builders 9a8b50 and 9a8090","timestamp":1782413590462,"segment":0,"confidence":null,"asi":{"hypothesis":"Decoding terminal builders FUN_1409a8b50 and FUN_1409a8090, with 0x1409a92a0/94c0/9b90 as comparators, would identify the CommandSelectDialog state/result selecting the lambda896b family.","rollback_reason":"Primary metric remained 1520, equal to the persisted best, and runtime_proof_failures remains 1. This iteration produced static trace information only.","next_action_hint":"Decode FUN_1409a7150 as the other lambda896b terminal path and compare it with 9ad9b0/9a92a0; if it is also only a builder, move up to the CommandSelectDialog selection/state table that chooses between terminal wrappers.","static_finding_key":"autoload-terminal-builders-9a8b50-9a8090-decode-2026-06-25","evidence":"FUN_1409a8b50 and FUN_1409a9b90 call FUN_1409ad9b0(*param_1); FUN_1409a8090 calls FUN_1409a7150; FUN_1409a92a0 is TitleTopDialog/titleFlowContext+0x14c result gate; xrefs remain metadata plus wrappers."}}
{"run":161,"commit":"2100051","metric":1520,"metrics":{"readiness_gate_failures":0,"target_constants_remaining":0,"helpers_missing":0,"fixed_wait_predicates":0,"autoload_static_failures":0,"asset_chain_failures":0,"dll_patch_failures":0,"native_continue_failures":0,"field58_gate_failures":0,"direct_shortcut_failures":0,"input_path_failures":0,"runtime_proof_failures":1,"runtime_mode_failures":0,"eula_popup_failures":0,"save_data_popup_failures":0,"messagebox_dialog_failures":0,"server_status_failures":0,"title_cover_failures":0,"title_cover_penalty":0,"native_trace_blockers":0,"native_trace_hits_total":74,"native_trace_unique_breakpoints":11,"false_positives":0,"runtime_timeout_failures":0,"runtime_title_visual_suppressed_builds":1,"runtime_custom_cover_builds":1,"runtime_simulated_button_presses_total":0},"status":"discard","description":"static decoded 9a7150 terminal and 9a9000 TFC branch","timestamp":1782413690277,"segment":0,"confidence":null,"asi":{"hypothesis":"Decoding FUN_1409a7150 as the other lambda896b terminal path and comparing it with 9ad9b0/9a92a0 would reveal whether it is also only a builder or points to the CommandSelectDialog selector.","rollback_reason":"Primary metric remained 1520, equal to the persisted best, and runtime_proof_failures remains 1. This iteration produced static branch mapping only.","next_action_hint":"Decode FUN_1409a9260 and FUN_1409b31c0 side-by-side to determine what result/state advances from selector job into the load branch; do not set TFC+0x14c cold or call 9b31c0/9ac8b0 directly.","static_finding_key":"autoload-9a7150-9a9000-branch-decode-2026-06-25","evidence":"FUN_1409a7150 delegates to FUN_1409a9260; FUN_1409a9000 branches on TitleFlowContext+0x14c, with 0 and 3/5 returning no-op jobs and other nonzero values dispatching FUN_1409b31c0."}}
{"run":162,"commit":"2100051","metric":1520,"metrics":{"readiness_gate_failures":0,"target_constants_remaining":0,"helpers_missing":0,"fixed_wait_predicates":0,"autoload_static_failures":0,"asset_chain_failures":0,"dll_patch_failures":0,"native_continue_failures":0,"field58_gate_failures":0,"direct_shortcut_failures":0,"input_path_failures":0,"runtime_proof_failures":1,"runtime_mode_failures":0,"eula_popup_failures":0,"save_data_popup_failures":0,"messagebox_dialog_failures":0,"server_status_failures":0,"title_cover_failures":0,"title_cover_penalty":0,"native_trace_blockers":0,"native_trace_hits_total":74,"native_trace_unique_breakpoints":11,"false_positives":0,"runtime_timeout_failures":0,"runtime_title_visual_suppressed_builds":1,"runtime_custom_cover_builds":1,"runtime_simulated_button_presses_total":0},"status":"discard","description":"static decoded 9a9260 and 9b31c0 load branch relationship","timestamp":1782413833383,"segment":0,"confidence":null,"asi":{"hypothesis":"Decoding FUN_1409a9260 and FUN_1409b31c0 side-by-side would identify what result/state advances from selector job into the load branch without cold-setting TFC+0x14c or calling load builders directly.","rollback_reason":"Primary metric remained 1520, equal to the persisted best, and runtime_proof_failures remains 1. This iteration produced static branch mapping only.","next_action_hint":"Identify the CommandSelectDialog/menu result transition that chooses lambda_896b slot1/9a9260, likely by decoding the std::function/vtable family around 0x142b268c8/0x142b26900 and MenuJobResult consumers; add passive selector-result hooks only if static proof requires runtime confirmation.","static_finding_key":"autoload-9a9260-9b31c0-load-branch-decode-2026-06-25","evidence":"FUN_1409a9260 calls FUN_1409ac8b0 directly; FUN_1409a9000 dispatches FUN_1409b31c0 only when TFC+0x14c is nonzero and not 3/5; FUN_1409ac8b0 validates profile/saveSlot, builds a Success MenuFunctorJob via FUN_140744b60, and calls FUN_140826600(saveSlot) for LoadGame."}}
{"run":163,"commit":"2100051","metric":1520,"metrics":{"readiness_gate_failures":0,"target_constants_remaining":0,"helpers_missing":0,"fixed_wait_predicates":0,"autoload_static_failures":0,"asset_chain_failures":0,"dll_patch_failures":0,"native_continue_failures":0,"field58_gate_failures":0,"direct_shortcut_failures":0,"input_path_failures":0,"runtime_proof_failures":1,"runtime_mode_failures":0,"eula_popup_failures":0,"save_data_popup_failures":0,"messagebox_dialog_failures":0,"server_status_failures":0,"title_cover_failures":0,"title_cover_penalty":0,"native_trace_blockers":0,"native_trace_hits_total":74,"native_trace_unique_breakpoints":11,"false_positives":0,"runtime_timeout_failures":0,"runtime_title_visual_suppressed_builds":1,"runtime_custom_cover_builds":1,"runtime_simulated_button_presses_total":0},"status":"discard","description":"static corrected CommandSelectDialog vtable alignment for lambda896b family","timestamp":1782414034565,"segment":0,"confidence":null,"asi":{"hypothesis":"Decoding the std::function/vtable family around 0x142b268c8/0x142b26900 and MenuJobResult consumers would identify the CommandSelectDialog/menu result transition that chooses lambda_896b slot1/9a9260.","rollback_reason":"Primary metric remained 1520, equal to the persisted best, and runtime_proof_failures remains 1. This iteration produced a static alignment correction only.","next_action_hint":"Decode lambda_5903 path (9a7720/9a7fd0) and the construction/ordering of adjacent lambdas to identify which CommandSelectDialog result/state selects lambda_896b's direct 9a9260/9ac8b0 path versus lambda_102a's 9ad9b0 sequence path; keep exact vtable-root alignment and do not cold-call either builder.","static_finding_key":"autoload-commandselectdialog-vtable-alignment-correction-2026-06-25","evidence":"Focused VtableDump: lambda_896b root 0x142b268c8 with _Do_call FUN_1409b0fa0; 0x142b26900 is lambda_5903 with _Do_call FUN_1409b0ce0; 0x142b26938 is lambda_102a with _Do_call FUN_1409b0970. FUN_1409b0970 is not lambda_896b slot15 but the adjacent lambda_102a _Do_call."}}
{"run":164,"commit":"2100051","metric":1520,"metrics":{"readiness_gate_failures":0,"target_constants_remaining":0,"helpers_missing":0,"fixed_wait_predicates":0,"autoload_static_failures":0,"asset_chain_failures":0,"dll_patch_failures":0,"native_continue_failures":0,"field58_gate_failures":0,"direct_shortcut_failures":0,"input_path_failures":0,"runtime_proof_failures":1,"runtime_mode_failures":0,"eula_popup_failures":0,"save_data_popup_failures":0,"messagebox_dialog_failures":0,"server_status_failures":0,"title_cover_failures":0,"title_cover_penalty":0,"native_trace_blockers":0,"native_trace_hits_total":74,"native_trace_unique_breakpoints":11,"false_positives":0,"runtime_timeout_failures":0,"runtime_title_visual_suppressed_builds":1,"runtime_custom_cover_builds":1,"runtime_simulated_button_presses_total":0},"status":"discard","description":"static decoded lambda5903 sibling path to 9ad230","timestamp":1782414212777,"segment":0,"confidence":null,"asi":{"hypothesis":"Decoding lambda_5903 path (9a7720/9a7fd0) and adjacent lambda ordering would identify which CommandSelectDialog result/state selects lambda_896b's direct 9a9260/9ac8b0 path versus lambda_102a's 9ad9b0 path.","rollback_reason":"Primary metric remained 1520, equal to the persisted best, and runtime_proof_failures remains 1. This iteration produced static path classification only.","next_action_hint":"Decode FUN_1409ad230 and compare it with FUN_1409ad9b0 and FUN_1409ac8b0 to classify sibling CommandSelectDialog outcomes and reveal which native menu-result transition reaches the direct LoadGame builder. Do not cold-call any builders.","static_finding_key":"autoload-lambda5903-path-to-9ad230-2026-06-25","evidence":"lambda_5903 root 0x142b26900 _Do_call FUN_1409b0ce0 -> FUN_1409a7720 -> FUN_1409a7fd0 -> FUN_1409a7070 -> FUN_1409a9110 -> FUN_1409ad230; adjacent ordering: d076, 896b direct LoadGame, 5903 to 9ad230, 102a to 9ad9b0."}}
{"run":165,"commit":"2100051","metric":1520,"metrics":{"readiness_gate_failures":0,"target_constants_remaining":0,"helpers_missing":0,"fixed_wait_predicates":0,"autoload_static_failures":0,"asset_chain_failures":0,"dll_patch_failures":0,"native_continue_failures":0,"field58_gate_failures":0,"direct_shortcut_failures":0,"input_path_failures":0,"runtime_proof_failures":1,"runtime_mode_failures":0,"eula_popup_failures":0,"save_data_popup_failures":0,"messagebox_dialog_failures":0,"server_status_failures":0,"title_cover_failures":0,"title_cover_penalty":0,"native_trace_blockers":0,"native_trace_hits_total":74,"native_trace_unique_breakpoints":11,"false_positives":0,"runtime_timeout_failures":0,"runtime_title_visual_suppressed_builds":1,"runtime_custom_cover_builds":1,"runtime_simulated_button_presses_total":0},"status":"discard","description":"static classified 9ad230 as sibling sequence builder","timestamp":1782414320973,"segment":0,"confidence":null,"asi":{"hypothesis":"Decoding FUN_1409ad230 and comparing it with FUN_1409ad9b0/FUN_1409ac8b0 would classify sibling CommandSelectDialog outcomes and reveal which native menu-result transition reaches the direct LoadGame builder.","rollback_reason":"Primary metric remained 1520, equal to the persisted best, and runtime_proof_failures remains 1. This iteration produced static classification only.","next_action_hint":"Decode the constructor that installs adjacent lambdas d076/896b/5903/102a into CommandSelectDialog, likely the larger builder/caller around FUN_1409aa070/FUN_1409abd80 or std::function array/vector construction sites. Preserve exact vtable alignment and do not cold-call builders.","static_finding_key":"autoload-9ad230-sibling-sequence-builder-2026-06-25","evidence":"FUN_1409a9110 wraps FUN_1409ad230; FUN_1409ad230 builds a Success MenuFunctorJob and OK/accept job, calls FUN_1409aa630 using TitleFlowContext+0x145, wraps through FUN_14078e1d0/FUN_140792990, and chains jobs. Direct LoadGame remains lambda_896b -> 9a9260 -> 9ac8b0 -> 826600."}}
