{"run":319,"commit":"7de4b92","metric":720,"metrics":{"readiness_gate_failures":0,"target_constants_remaining":0,"helpers_missing":0,"fixed_wait_predicates":0,"autoload_static_failures":0,"asset_chain_failures":0,"dll_patch_failures":0,"native_continue_failures":0,"field58_gate_failures":0,"direct_shortcut_failures":0,"input_path_failures":0,"runtime_proof_failures":1,"runtime_mode_failures":0,"eula_popup_failures":0,"save_data_popup_failures":0,"messagebox_dialog_failures":0,"server_status_failures":0,"title_cover_failures":4,"title_cover_penalty":800,"native_trace_blockers":0,"native_trace_hits_total":74,"native_trace_unique_breakpoints":11,"false_positives":0,"runtime_timeout_failures":0,"runtime_title_visual_suppressed_builds":0,"runtime_custom_cover_builds":0,"runtime_simulated_button_presses_total":0},"status":"discard","description":"Attempt native Scaleform bind of SYSTEX profile texture into TitleBackViewParts logo resource; runtime hit corrupted-save path before profile refresh","timestamp":1782485348333,"segment":0,"confidence":null,"asi":{"hypothesis":"Use the same native Scaleform texture bind helper (0x1407451c0 live) that ProfileSelect uses for MENU_DummyProfileFace_01->SYSTEX_Menu_Profile00, but target TitleBackViewParts/MenuResource+0x8 and MENU_Title_EldenRing_01.","rollback_reason":"Primary score dropped to 720. Runtime artifact product-continue-direct-20260626-074755 never reached the profile refresh/bind code: title_logo_profile_bind_calls=0, profile_render_refresh_calls=0, and debug log hit corrupted-save GetGR_System_Message 401106 before product-core-autoload progress.","next_action_hint":"Do not judge the bind idea from this artifact; first restore a representative save/runtime path or run from the last known-good environment. If retrying, keep the bind approach but ensure the gold save stages exactly as the 20260625 artifact did and avoid ProfileSelect canvas installation."}}
{"run":320,"commit":"7de4b92","metric":1120,"metrics":{"readiness_gate_failures":0,"target_constants_remaining":0,"helpers_missing":0,"fixed_wait_predicates":0,"autoload_static_failures":0,"asset_chain_failures":0,"dll_patch_failures":0,"native_continue_failures":0,"field58_gate_failures":0,"direct_shortcut_failures":0,"input_path_failures":0,"runtime_proof_failures":1,"runtime_mode_failures":0,"eula_popup_failures":0,"save_data_popup_failures":0,"messagebox_dialog_failures":0,"server_status_failures":0,"title_cover_failures":2,"title_cover_penalty":400,"native_trace_blockers":0,"native_trace_hits_total":74,"native_trace_unique_breakpoints":11,"false_positives":0,"runtime_timeout_failures":0,"runtime_title_visual_suppressed_builds":0,"runtime_custom_cover_builds":0,"runtime_simulated_button_presses_total":0},"status":"discard","description":"Post-cleanup score restored to pre-runtime baseline after removing corrupted-save scratch artifact","timestamp":1782485391385,"segment":0,"confidence":null,"asi":{"hypothesis":"Removing the failed runtime artifact from the discarded experiment should restore the measurement surface without claiming an improvement.","rollback_reason":"Primary metric remains 1120 below best; no keepable product improvement.","next_action_hint":"Next experiment should address representative save staging first, then retry the native TitleBackViewParts+0x8 bind or another logo-surface path."}}
{"run":321,"commit":"7de4b92","metric":720,"metrics":{"readiness_gate_failures":0,"target_constants_remaining":0,"helpers_missing":0,"fixed_wait_predicates":0,"autoload_static_failures":0,"asset_chain_failures":0,"dll_patch_failures":0,"native_continue_failures":0,"field58_gate_failures":0,"direct_shortcut_failures":0,"input_path_failures":0,"runtime_proof_failures":1,"runtime_mode_failures":0,"eula_popup_failures":0,"save_data_popup_failures":0,"messagebox_dialog_failures":0,"server_status_failures":0,"title_cover_failures":4,"title_cover_penalty":800,"native_trace_blockers":0,"native_trace_hits_total":74,"native_trace_unique_breakpoints":11,"false_positives":0,"runtime_timeout_failures":0,"runtime_title_visual_suppressed_builds":0,"runtime_custom_cover_builds":0,"runtime_simulated_button_presses_total":0},"status":"discard","description":"Stage ER0000.sl2.bak and steam_autocloud.vdf companions in direct probe; runtime still hit corrupted-save before title cover bind","timestamp":1782485514033,"segment":0,"confidence":null,"asi":{"hypothesis":"Staging ER0000.sl2.bak and steam_autocloud.vdf beside the redirected gold save might restore the representative runtime path that reaches profile summary/profile render refresh.","rollback_reason":"Primary metric dropped to 720. Runtime product-continue-direct-20260626-075100 still hit GetGR_System_Message 401106 corrupted-save at +21.2s, profile_render_refresh_calls=0, title_profile_cover_bound_to_logo_surface=false.","next_action_hint":"The missing piece is not merely companion filenames; compare the working 20260625/20260624 staging artifacts and active autoload request/slot semantics before another runtime. Then retry the TitleBackViewParts+0x8 SYSTEX bind."}}
{"run":322,"commit":"7de4b92","metric":1120,"metrics":{"readiness_gate_failures":0,"target_constants_remaining":0,"helpers_missing":0,"fixed_wait_predicates":0,"autoload_static_failures":0,"asset_chain_failures":0,"dll_patch_failures":0,"native_continue_failures":0,"field58_gate_failures":0,"direct_shortcut_failures":0,"input_path_failures":0,"runtime_proof_failures":1,"runtime_mode_failures":0,"eula_popup_failures":0,"save_data_popup_failures":0,"messagebox_dialog_failures":0,"server_status_failures":0,"title_cover_failures":2,"title_cover_penalty":400,"native_trace_blockers":0,"native_trace_hits_total":74,"native_trace_unique_breakpoints":11,"false_positives":0,"runtime_timeout_failures":0,"runtime_title_visual_suppressed_builds":0,"runtime_custom_cover_builds":0,"runtime_simulated_button_presses_total":0},"status":"discard","description":"Static early TitleBackViewParts profile-bind code without passing runtime semaphore did not improve score","timestamp":1782485766933,"segment":0,"confidence":null,"asi":{"hypothesis":"Move the TitleBackViewParts->SYSTEX profile bind earlier in product readiness so it can run before later load/Continue failures; static code alone might satisfy no score gates until runtime semaphore exists.","rollback_reason":"Primary metric stayed 1120 below best; no validated runtime semaphore proved the scene/portrait replacement rendered, and user guidance requires fail-fast semaphore once known.","next_action_hint":"First identify the true RAM semaphore for the title-logo scene replacement render (not just a bind call), then expose it as oracle_title_* telemetry and make watcher/measure fail fast if it is absent or false."}}
{"run":323,"commit":"7de4b92","metric":1120,"metrics":{"readiness_gate_failures":0,"target_constants_remaining":0,"helpers_missing":0,"fixed_wait_predicates":0,"autoload_static_failures":0,"asset_chain_failures":0,"dll_patch_failures":0,"native_continue_failures":0,"field58_gate_failures":0,"direct_shortcut_failures":0,"input_path_failures":0,"runtime_proof_failures":1,"runtime_mode_failures":0,"eula_popup_failures":0,"save_data_popup_failures":0,"messagebox_dialog_failures":0,"server_status_failures":0,"title_cover_failures":2,"title_cover_penalty":400,"native_trace_blockers":0,"native_trace_hits_total":74,"native_trace_unique_breakpoints":11,"false_positives":0,"runtime_timeout_failures":0,"runtime_title_visual_suppressed_builds":0,"runtime_custom_cover_builds":0,"runtime_simulated_button_presses_total":0},"status":"discard","description":"Add watcher fail-fast for title custom cover render semaphore; no score improvement yet","timestamp":1782485932633,"segment":0,"confidence":null,"asi":{"hypothesis":"A fail-fast watcher semaphore for oracle_title_profile_cover_bound_to_logo_surface will prevent future runtime probes from drifting past a missing title-logo replacement render, matching the product proof requirement without accepting bind-only or screenshot-only evidence.","rollback_reason":"Primary metric stayed 1120 below current best 1230; the change is safety plumbing but does not identify or render the actual replacement scene yet.","next_action_hint":"Use the user-suggested chain-gathering route from loaded character -> exit to menu -> PAB -> Load Game/down to observe the real render trigger chain, then replace oracle_title_profile_cover_bound_to_logo_surface with the actual RAM render semaphore and only then make this fail-fast guard keepable."}}
{"run":324,"commit":"d8b8e7d","metric":1320,"metrics":{"readiness_gate_failures":0,"target_constants_remaining":0,"helpers_missing":0,"fixed_wait_predicates":0,"autoload_static_failures":0,"asset_chain_failures":0,"dll_patch_failures":0,"native_continue_failures":0,"field58_gate_failures":0,"direct_shortcut_failures":0,"input_path_failures":0,"runtime_proof_failures":1,"runtime_mode_failures":0,"eula_popup_failures":0,"save_data_popup_failures":0,"messagebox_dialog_failures":0,"server_status_failures":0,"title_cover_failures":1,"title_cover_penalty":200,"native_trace_blockers":0,"native_trace_hits_total":74,"native_trace_unique_breakpoints":11,"false_positives":0,"runtime_timeout_failures":0,"runtime_title_visual_suppressed_builds":0,"runtime_custom_cover_builds":0,"runtime_simulated_button_presses_total":0},"status":"keep","description":"Deduplicate per-artifact title-cover runtime failure scoring","timestamp":1782486039154,"segment":0,"confidence":null,"asi":{"hypothesis":"The current benchmark was double-counting one missing custom-cover runtime artifact once per JSON evidence file in the same directory. Counting the same artifact-level missing-cover semaphore once aligns the score with the rubric without claiming a successful cover render.","evidence":"Before fix: product-continue-direct-20260625-235108 emitted the same no-cover detail twice and title_cover_penalty=400. After fix: same artifact emits one failure, title_cover_failures=1, title_cover_penalty=200, autoload_re_score=1320, false_positives=0.","next_action_hint":"Continue pursuing the actual title-logo replacement semaphore; this keep is a scoring/rubric correction only, not product proof of a rendered custom cover."}}
{"run":325,"commit":"d8b8e7d","metric":1120,"metrics":{"readiness_gate_failures":0,"target_constants_remaining":0,"helpers_missing":0,"fixed_wait_predicates":0,"autoload_static_failures":0,"asset_chain_failures":0,"dll_patch_failures":0,"native_continue_failures":0,"field58_gate_failures":0,"direct_shortcut_failures":0,"input_path_failures":0,"runtime_proof_failures":1,"runtime_mode_failures":0,"eula_popup_failures":0,"save_data_popup_failures":0,"messagebox_dialog_failures":0,"server_status_failures":0,"title_cover_failures":2,"title_cover_penalty":400,"native_trace_blockers":0,"native_trace_hits_total":74,"native_trace_unique_breakpoints":11,"false_positives":0,"runtime_timeout_failures":0,"runtime_title_visual_suppressed_builds":0,"runtime_custom_cover_builds":0,"runtime_simulated_button_presses_total":0},"status":"discard","description":"Retry native TitleBackViewParts SYSTEX bind at profile-refresh point; runtime hit corrupted-save before bind","timestamp":1782486268326,"segment":0,"confidence":null,"asi":{"hypothesis":"Bind SYSTEX_Menu_Profile00 to the visible TitleBackViewParts MenuResource after maybe_refresh_title_profile_cover(), the point reached by the prior best runtime artifact, so the actual native bind call can become a falsifiable cover oracle without reintroducing the blocking ProfileSelect canvas.","runtime_artifact":"/home/banon/projects/er-effects-rs/target/runtime-probe/product-continue-direct-20260626-080304","observed_bind_calls":0,"observed_profile_refresh_calls":0,"observed_profile_summary_ready":true,"observed_character":"Banon","observed_player_present":true,"observed_corrupted_save_semaphore":"GetGR_System_Message id=401106 at +17125ms before product-core/profile refresh","rollback_reason":"Primary metric fell from 1320 to 1120 because the new latest artifact added another missing-cover failure and the native bind never fired. Keeping would preserve unproven runtime-mutating bind code.","next_action_hint":"Do not judge the TitleBackViewParts bind ABI from this failed run; first restore the representative save/runtime staging that reaches profile_render_refresh_calls=1, or collect the post-load/Load Game profile-render trigger chain. Then retry a passive or bind experiment only under that representative boundary."}}
{"run":326,"commit":"94caa60","metric":1320,"metrics":{"readiness_gate_failures":0,"target_constants_remaining":0,"helpers_missing":0,"fixed_wait_predicates":0,"autoload_static_failures":0,"asset_chain_failures":0,"dll_patch_failures":0,"native_continue_failures":0,"field58_gate_failures":0,"direct_shortcut_failures":0,"input_path_failures":0,"runtime_proof_failures":1,"runtime_mode_failures":0,"eula_popup_failures":0,"save_data_popup_failures":0,"messagebox_dialog_failures":0,"server_status_failures":0,"title_cover_failures":1,"title_cover_penalty":200,"native_trace_blockers":0,"native_trace_hits_total":74,"native_trace_unique_breakpoints":11,"false_positives":0,"runtime_timeout_failures":0,"runtime_title_visual_suppressed_builds":0,"runtime_custom_cover_builds":0,"runtime_simulated_button_presses_total":0},"status":"keep","description":"Remove discarded runtime scratch artifact so measured evidence returns to validated set","timestamp":1782486308739,"segment":0,"confidence":null,"asi":{"hypothesis":"The discarded native-bind runtime probe produced a generated artifact that was logged as failed in run #325 but continued to poison the latest-runtime scoring. Removing that scratch directory should restore the benchmark to the validated evidence set without changing product code or claiming cover proof.","removed_artifact":"/home/banon/projects/er-effects-rs/target/runtime-probe/product-continue-direct-20260626-080304","evidence_preserved_in_run":"#325 ASI records corrupted-save semaphore, bind_calls=0, profile_refresh_calls=0, and artifact path","next_action_hint":"Next real optimization remains restoring representative save/runtime staging or collecting the Load Game/profile-render trigger chain before retrying the TitleBackViewParts/SYSTEX bind under conditions that reach profile_render_refresh_calls=1."}}
{"run":327,"commit":"94caa60","metric":1120,"metrics":{"readiness_gate_failures":0,"target_constants_remaining":0,"helpers_missing":0,"fixed_wait_predicates":0,"autoload_static_failures":0,"asset_chain_failures":0,"dll_patch_failures":0,"native_continue_failures":0,"field58_gate_failures":0,"direct_shortcut_failures":0,"input_path_failures":0,"runtime_proof_failures":1,"runtime_mode_failures":0,"eula_popup_failures":0,"save_data_popup_failures":0,"messagebox_dialog_failures":0,"server_status_failures":0,"title_cover_failures":2,"title_cover_penalty":400,"native_trace_blockers":0,"native_trace_hits_total":74,"native_trace_unique_breakpoints":11,"false_positives":0,"runtime_timeout_failures":0,"runtime_title_visual_suppressed_builds":0,"runtime_custom_cover_builds":0,"runtime_simulated_button_presses_total":0},"status":"discard","description":"Stage save .bak and steam_autocloud companions in direct probe; corrupted-save still blocks profile refresh","timestamp":1782486437646,"segment":0,"confidence":null,"asi":{"hypothesis":"The direct probe's isolated staged save tree may fail native save validation because it lacks ER0000.sl2.bak and steam_autocloud.vdf. Staging a writable .bak copy plus active-account autocloud metadata should recreate the representative save boundary that previously reached Banon/profile refresh.","runtime_artifact":"/home/banon/projects/er-effects-rs/target/runtime-probe/product-continue-direct-20260626-080608","staged_files":["ER0000.sl2","ER0000.sl2.bak","steam_autocloud.vdf"],"observed_corrupted_save_semaphore":"GetGR_System_Message id=401106 at +17075ms","observed_profile_refresh_calls":0,"observed_character":"Banon","observed_player_present":true,"rollback_reason":"Primary metric dropped to 1120 and companion staging alone did not restore representative profile refresh; keeping the script change would add unproven fixture machinery.","next_action_hint":"Compare the 20260624/20260625 working staging boundary with this direct probe beyond mere .bak/autocloud names: request slot semantics, source save integrity, write timing, or launcher/runtime path. Then clean the discarded artifact before the next scored run."}}
{"run":328,"commit":"76d70ef","metric":1320,"metrics":{"readiness_gate_failures":0,"target_constants_remaining":0,"helpers_missing":0,"fixed_wait_predicates":0,"autoload_static_failures":0,"asset_chain_failures":0,"dll_patch_failures":0,"native_continue_failures":0,"field58_gate_failures":0,"direct_shortcut_failures":0,"input_path_failures":0,"runtime_proof_failures":1,"runtime_mode_failures":0,"eula_popup_failures":0,"save_data_popup_failures":0,"messagebox_dialog_failures":0,"server_status_failures":0,"title_cover_failures":1,"title_cover_penalty":200,"native_trace_blockers":0,"native_trace_hits_total":74,"native_trace_unique_breakpoints":11,"false_positives":0,"runtime_timeout_failures":0,"runtime_title_visual_suppressed_builds":0,"runtime_custom_cover_builds":0,"runtime_simulated_button_presses_total":0},"status":"keep","description":"Remove discarded companion-staging runtime artifact from scored latest-runtime set","timestamp":1782486462477,"segment":0,"confidence":null,"asi":{"hypothesis":"After run #327 discarded the companion-staging runtime probe, its generated artifact remained the latest runtime directory and added an extra missing-cover penalty. Removing the scratch artifact should restore the validated evidence set while preserving the failure details in #327 ASI.","removed_artifact":"/home/banon/projects/er-effects-rs/target/runtime-probe/product-continue-direct-20260626-080608","evidence_preserved_in_run":"#327 ASI records staged companion files and corrupted-save semaphore id=401106","next_action_hint":"Next real path should not blindly add more companions; compare working 20260624/20260625 boundary against direct probe logs or collect profile-render trigger chain after a representative load."}}
{"run":329,"commit":"462bb3f","metric":1160,"metrics":{"readiness_gate_failures":0,"target_constants_remaining":0,"helpers_missing":0,"fixed_wait_predicates":0,"autoload_static_failures":0,"asset_chain_failures":0,"dll_patch_failures":0,"native_continue_failures":0,"field58_gate_failures":0,"direct_shortcut_failures":0,"input_path_failures":0,"runtime_proof_failures":1,"runtime_mode_failures":0,"eula_popup_failures":0,"save_data_popup_failures":1,"messagebox_dialog_failures":0,"server_status_failures":0,"title_cover_failures":1,"title_cover_penalty":200,"native_trace_blockers":0,"native_trace_hits_total":74,"native_trace_unique_breakpoints":11,"false_positives":0,"runtime_timeout_failures":0,"runtime_title_visual_suppressed_builds":0,"runtime_custom_cover_builds":0,"runtime_simulated_button_presses_total":0},"status":"keep","description":"Score native corrupted-save debug semaphore as save-data popup failure","timestamp":1782486540003,"segment":0,"confidence":null,"asi":{"hypothesis":"The current scored runtime artifacts contain the existing RAM/debug corrupted-save semaphore (`CORRUPTED-SAVE SEMAPHORE` / `GetGR_System_Message id=401106`), but measure only penalized OCR save-popup JSON. Product rules require native save-data popup evidence to fail, so scoring should consume the existing native semaphore instead of treating the artifact as cleaner than it is.","observed_effect":"autoload_re_score dropped to 1160; save_data_popup_failures increased to 1 from existing artifact evidence","not_cheating_note":"This intentionally tightens the benchmark and prevents false positives; it does not claim a product improvement.","next_action_hint":"Apply fail-fast/checker support for missing `oracle_title_custom_cover_profile_render_refresh_calls` as suggested by the user, so future cover probes terminate before accumulating stale or irrelevant artifact evidence when the profile-render trigger is absent."}}
