{"run":87,"commit":"2100051","metric":0,"metrics":{"readiness_gate_failures":1,"target_constants_remaining":0,"helpers_missing":0,"fixed_wait_predicates":0,"autoload_static_failures":1,"asset_chain_failures":0,"dll_patch_failures":0,"native_continue_failures":0,"field58_gate_failures":0,"direct_shortcut_failures":0,"input_path_failures":0,"runtime_proof_failures":1,"runtime_mode_failures":0,"eula_popup_failures":0,"save_data_popup_failures":0,"messagebox_dialog_failures":0,"server_status_failures":0,"title_cover_failures":0,"title_cover_penalty":0,"native_trace_blockers":0,"native_trace_hits_total":74,"native_trace_unique_breakpoints":11,"false_positives":0,"runtime_timeout_failures":1,"runtime_title_visual_suppressed_builds":0,"runtime_custom_cover_builds":0,"runtime_simulated_button_presses_total":0},"status":"crash","description":"concrete descendant/functor trace conflicted with existing NetworkCheck hook and exited before title owner","timestamp":1782375611851,"segment":0,"confidence":4.833333333333333,"asi":{"hypothesis":"Hook newly decoded concrete descendants TryFinallyJob::Run, TryWhileJob::Run, NetworkCheckJob::Run, and functor do_call bodies 0x140746730/0x1407a6cf0 to determine whether the title chain descends into real Continue action plumbing or only title/network/status jobs.","rollback_reason":"Runtime exited before ready (process_exited_before_ready). The hooks queued, but NetworkCheckJob::Run conflicts with the existing network-check-shortcircuit hook (`MH_ERROR_ALREADY_CREATED`), and no concrete descendant trace hook fired before the game exited/no title owner appeared. This run is not evidence about the descendant chain beyond the hook conflict.","next_action_hint":"Retry without hooking NetworkCheckJob::Run, because that address is already owned by the network-check-shortcircuit hook. Keep or narrow to TryFinallyJob::Run, TryWhileJob::Run, and functor do_call hooks only, or make the existing network-check-shortcircuit hook emit the needed diagnostic instead of installing a second hook. Static finding to preserve: vtable 0x142b264d8 is NetworkCheckJob with Run dump 0x140821400/deobf 0x140821310; it is already hooked elsewhere.","artifact_dir":"/home/banon/projects/er-effects-rs/target/runtime-probe/product-continue-direct-20260625-011851","observed_runtime_oracles":{"reason":"process_exited_before_ready","product_autoload_armed":true,"product_core_ready_blocker":"no_title_owner","product_core_ready_successes":0,"hooks_queued":["title_try_finally_run 0x1407914c0","title_try_while_run 0x140791620","title_network_check_run 0x140821310","title_functor_746730 0x140746730","title_functor_7a6cf0 0x1407a6cf0"],"hook_conflict":"network-check-shortcircuit: MhHook::new failed: MH_ERROR_ALREADY_CREATED","trace_counts":{"try_finally":0,"try_while":0,"network_check":0,"functor_746730":0,"functor_7a6cf0":0},"native_submit_hits":0,"continue_load_fired":false,"oracle_msgbox_total_builds":0,"simulated_button_presses_total":0,"processes_remaining":0},"static_re":{"TryFinallyJob":"vtable 0x142aa2710, Run dump 0x1407915b0/deobf 0x1407914c0","TryWhileJob":"vtable 0x142aa26f0, Run dump 0x140791710/deobf 0x140791620","NetworkCheckJob":"vtable 0x142b264d8, Run dump 0x140821400/deobf 0x140821310, already hooked by network-check-shortcircuit","functor_746730":"std::function lambda_68a vtable 0x142a93d18, do_call dump 0x140746830/deobf 0x140746730","functor_7a6cf0":"std::function lambda_3883 vtable 0x142aa8350, do_call dump 0x1407a6de0/deobf 0x1407a6cf0"},"build":"cargo xwin build --release --target x86_64-pc-windows-msvc succeeded.","cleanup":"No eldenring.exe or start_protected_game.exe processes remained."}}
{"run":88,"commit":"2100051","metric":0,"metrics":{"asset_chain_failures":0,"autoload_static_failures":1,"direct_shortcut_failures":0,"dll_patch_failures":0,"eula_popup_failures":0,"false_positives":0,"field58_gate_failures":0,"fixed_wait_predicates":0,"helpers_missing":0,"input_path_failures":0,"messagebox_dialog_failures":0,"native_continue_failures":0,"native_trace_blockers":0,"native_trace_hits_total":74,"native_trace_unique_breakpoints":11,"readiness_gate_failures":1,"runtime_custom_cover_builds":0,"runtime_mode_failures":0,"runtime_proof_failures":1,"runtime_simulated_button_presses_total":0,"runtime_timeout_failures":1,"runtime_title_visual_suppressed_builds":0,"save_data_popup_failures":0,"server_status_failures":0,"target_constants_remaining":0,"title_cover_failures":0,"title_cover_penalty":0},"status":"crash","description":"attempted runtime concrete title-chain trace without rebuilding DLL; probe timed out at native title","timestamp":1782395663745,"segment":0,"confidence":4.833333333333333,"asi":{"hypothesis":"Add concrete title-chain descendant trace hooks (TryFinally/TryWhile/MenuFunctor/MenuUnion/lambda do_call) while avoiding duplicate NetworkCheck hook ownership, then run a manual no-autoload trace to see whether the native title branch reaches Continue plumbing.","rollback_reason":"run_experiment timed out. The probe artifact stayed at native title screen and telemetry had native_submit_hits=0/continue_phase=0/player_present=false; the expected new TITLE-CHAIN-CONCRETE hook lines were absent because the runtime probe deployed the existing target DLL without rebuilding the edited Rust code.","next_action_hint":"Use a build path before the runtime probe. After rebuild, rerun the same trace and verify er-effects-continue-trace.log contains hook title_chain_* install lines before interpreting runtime behavior.","artifact":"/home/banon/projects/er-effects-rs/target/runtime-probe/product-continue-direct-20260625-065206","teardown_screenshot":"/home/banon/projects/er-effects-rs/target/runtime-probe/product-continue-direct-20260625-065206/teardown-screenshot.jpg","teardown_observation":"fresh read showed native Elden Ring title/press-any-button screen; teardown txt also recorded fail-closed no-window on final cleanup","telemetry_summary":{"oracle_native_submit_hits":0,"oracle_continue_phase":0,"oracle_player_present":false,"oracle_char_name":"","oracle_msgbox_total_builds":0,"oracle_policy_window_total_builds":0}}}
{"run":89,"commit":"2100051","metric":0,"metrics":{"asset_chain_failures":0,"autoload_static_failures":1,"direct_shortcut_failures":0,"dll_patch_failures":0,"eula_popup_failures":0,"false_positives":0,"field58_gate_failures":0,"fixed_wait_predicates":0,"helpers_missing":0,"input_path_failures":0,"messagebox_dialog_failures":0,"native_continue_failures":0,"native_trace_blockers":0,"native_trace_hits_total":74,"native_trace_unique_breakpoints":11,"readiness_gate_failures":1,"runtime_custom_cover_builds":0,"runtime_mode_failures":0,"runtime_proof_failures":1,"runtime_simulated_button_presses_total":0,"runtime_timeout_failures":1,"runtime_title_visual_suppressed_builds":0,"save_data_popup_failures":0,"server_status_failures":0,"target_constants_remaining":0,"title_cover_failures":0,"title_cover_penalty":0},"status":"crash","description":"rebuilt concrete title-chain trace hooks; native branch only hit title/status MenuFunctor lambdas and timed out","timestamp":1782395884080,"segment":0,"confidence":4.833333333333333,"asi":{"hypothesis":"After rebuilding the DLL, the concrete descendant hooks would show whether the native title-open branch descends into real Continue action plumbing or only title/status jobs.","rollback_reason":"Runtime still timed out at the native title screen with no native submit/load; telemetry had oracle_native_submit_hits=0 and continue_phase=0. The new hooks worked but showed only MenuFunctorJob::Run/lambda_68a498 calls, not TryFinally/TryWhile/MenuUnion, and no Continue wrapper/native submit.","next_action_hint":"Static-decode the callable vtables reached by lambda_68a498: dominant 0x142aa8700 plus one-off 0x142b63e70 and 0x142b63ea8. The result raws were mostly Continue(1)/Success(2) plus two state=3 early failures, suggesting title/status checks, not Continue row action. Next trace should decode/callstack-target callable_vt 0x142aa8700 and 0x142b63ea8 rather than adding more outer MenuJob hooks.","artifact":"/home/banon/projects/er-effects-rs/target/runtime-probe/product-continue-direct-20260625-065631","teardown_screenshot":"/home/banon/projects/er-effects-rs/target/runtime-probe/product-continue-direct-20260625-065631/teardown-screenshot.jpg","teardown_observation":"fresh target-window capture showed native title/Press Any Button screen; no popup visible","trace_summary":{"hook_install_lines":5,"concrete_trace_hits":92,"label_counts":{"MenuFunctorJob::Run":79,"lambda_68a498::_Do_call":13},"callable_vt_counts":{"0x142aa8700":11,"0x142b63e70":1,"0x142b63ea8":1},"result_raw_counts":{"1":64,"2":24,"3":4},"native_submit_hits":0},"build_validation":"cargo xwin build --release --target x86_64-pc-windows-msvc succeeded before the probe; cargo fmt applied"}}
{"run":90,"commit":"2100051","metric":0,"metrics":{"asset_chain_failures":0,"autoload_static_failures":1,"direct_shortcut_failures":0,"dll_patch_failures":0,"eula_popup_failures":0,"false_positives":0,"field58_gate_failures":0,"fixed_wait_predicates":0,"helpers_missing":0,"input_path_failures":0,"messagebox_dialog_failures":0,"native_continue_failures":0,"native_trace_blockers":0,"native_trace_hits_total":74,"native_trace_unique_breakpoints":11,"readiness_gate_failures":1,"runtime_custom_cover_builds":0,"runtime_mode_failures":0,"runtime_proof_failures":1,"runtime_simulated_button_presses_total":0,"runtime_timeout_failures":1,"runtime_title_visual_suppressed_builds":0,"save_data_popup_failures":0,"server_status_failures":0,"target_constants_remaining":0,"title_cover_failures":0,"title_cover_penalty":0},"status":"crash","description":"tried native press-start TitleStep transition instead of bare open_menu; product never reached gate and timed out","timestamp":1782396201052,"segment":0,"confidence":4.833333333333333,"asi":{"hypothesis":"Replacing the bare TitleTopDialog::open_menu self-fire with the native press-start lambda's semantic transition (FUN_140b0b7a0, deobf 0x140b0b6b0) might let TitleStep drive the real title/menu chain and preserve Continue semantics without input.","rollback_reason":"Runtime timed out with reason timeout_seconds_budget_exhausted. The product-core gate never reached the edited log path (`product-core-autoload`/press-start transition lines absent); readiness stayed autoload_not_attempted_waiting_title_bootstrap, native_submit_hits=0, continue_phase=0, world_stable_samples=0. Existing native SetState trace showed 10->2->3->10 then stuck with owner_state=10/owner_req=10 and no stream/resource progress.","next_action_hint":"The failure is earlier than the edited open_menu replacement: product_core_autoload_tick did not reach the ready/menu branch. Next iteration should inspect title_boot_ready/product-core blockers and the autoload_not_attempted_waiting_title_bootstrap gate rather than further changing the open_menu action.","artifact":"/home/banon/projects/er-effects-rs/target/runtime-probe/product-continue-direct-20260625-070122","teardown_screenshot_note":"/home/banon/projects/er-effects-rs/target/runtime-probe/product-continue-direct-20260625-070122/teardown-screenshot.txt","readiness_summary":{"reason":"timeout_seconds_budget_exhausted","timeout_seconds":35,"world_stable_samples":0,"autoload_blocker":"autoload_not_attempted_waiting_title_bootstrap","native_submit_hits":0,"oracle_char_name":"","oracle_char_level":9,"policy_window_total_builds":0,"msgbox_total_builds":0},"setstate_trace":["SetState state=0 committed_was=0","SetState state=10 committed_was=0","SetState state=2 committed_was=10","SetState state=3 committed_was=2","SetState state=10 committed_was=3"],"build_validation":"cargo fmt and cargo xwin build --release --target x86_64-pc-windows-msvc succeeded before the probe"}}
{"run":91,"commit":"2100051","metric":0,"metrics":{"asset_chain_failures":0,"autoload_static_failures":1,"direct_shortcut_failures":0,"dll_patch_failures":0,"eula_popup_failures":0,"false_positives":0,"field58_gate_failures":0,"fixed_wait_predicates":0,"helpers_missing":0,"input_path_failures":0,"messagebox_dialog_failures":0,"native_continue_failures":0,"native_trace_blockers":0,"native_trace_hits_total":74,"native_trace_unique_breakpoints":11,"readiness_gate_failures":1,"runtime_custom_cover_builds":0,"runtime_mode_failures":0,"runtime_proof_failures":1,"runtime_simulated_button_presses_total":0,"runtime_timeout_failures":1,"runtime_title_visual_suppressed_builds":0,"save_data_popup_failures":0,"server_status_failures":0,"target_constants_remaining":0,"title_cover_failures":0,"title_cover_penalty":0},"status":"crash","description":"fixed runtime request to arm experimental product core; probe reached product_core readiness but blocked on title dialog/press-start state","timestamp":1782396447840,"segment":0,"confidence":4.833333333333333,"asi":{"hypothesis":"The runtime benchmark was contaminated by a stale autoload file and never armed PRODUCT_AUTOLOAD; make measure write an explicit direct_menu_load request and set ER_EFFECTS_EXPERIMENTAL_DIRECT_MENU_LOAD=1 so the product-core path is actually tested.","rollback_reason":"Runtime still timed out, but the correction worked: autoload_method=direct_menu_load, product_core_ready_blocks=683, game_task_ticks=683, blocker=product_core_title_dialog. It reached product-core readiness diagnostics instead of the old own-load branch, but never fired native submit/load.","next_action_hint":"Keep the measure/request fix as benchmark hygiene if possible. Next code change should address the actual gate: product_core_autoload_ready is too strict for this native title state. Logs show state=10/10, table/session/gm/gdm/profile/iodev/heap all valid, menu_latch=0, but title_loop=false,title_textfadeout=false and press_start_vt=0x7ffe96a46190 with press_start_ctx=0. Need statically validate TitleTopDialog press-start component offsets/vtable or choose a semantic transition that does not require that scene proxy.","artifact":"/home/banon/projects/er-effects-rs/target/runtime-probe/product-continue-direct-20260625-070548","teardown_screenshot_note":"/home/banon/projects/er-effects-rs/target/runtime-probe/product-continue-direct-20260625-070548/teardown-screenshot.txt","request_evidence":"artifact autoload-request.txt and live Game/er-effects-autoload.txt both contained slot=0, method=direct_menu_load, require_title_bootstrap=false","runtime_summary":{"reason":"timeout_seconds_budget_exhausted","autoload_method":"direct_menu_load","blocker":"product_core_title_dialog","product_core_ready_blocks":683,"product_core_ready_successes":0,"game_task_ticks":683,"continue_phase":0,"native_submit_hits":0},"core_readiness_last":{"state":"10/10","table":"0x143d71580","session":"0x7ffe93700220","gm":"0x7fffa082a580","gdm":"0x7fff9eb80160","profile":"0x7fffa0b56c80","iodev":"0x1445893b0","heap":"0x144844020","title_loop":false,"title_textfadeout":false,"menu_latch":0,"press_start_proxy":"0x7ffe96a45c98","press_start_vt":"0x7ffe96a46190","press_start_ctx":0},"build_validation":"rebuilt current HEAD with cargo xwin before runtime"}}
{"run":92,"commit":"2100051","metric":0,"metrics":{"asset_chain_failures":0,"autoload_static_failures":1,"direct_shortcut_failures":0,"dll_patch_failures":0,"eula_popup_failures":0,"false_positives":0,"field58_gate_failures":0,"fixed_wait_predicates":0,"helpers_missing":0,"input_path_failures":0,"messagebox_dialog_failures":0,"native_continue_failures":0,"native_trace_blockers":0,"native_trace_hits_total":74,"native_trace_unique_breakpoints":11,"readiness_gate_failures":1,"runtime_custom_cover_builds":0,"runtime_mode_failures":0,"runtime_proof_failures":1,"runtime_simulated_button_presses_total":0,"runtime_timeout_failures":1,"runtime_title_visual_suppressed_builds":0,"save_data_popup_failures":0,"server_status_failures":0,"target_constants_remaining":0,"title_cover_failures":0,"title_cover_penalty":0},"status":"crash","description":"tried press-start proxy pointer fallback; product core still blocked on title dialog/press-start readiness","timestamp":1782396601440,"segment":0,"confidence":4.833333333333333,"asi":{"hypothesis":"The PressStart object at dialog+0xb78 may be a pointer to a SceneObjProxy rather than an embedded proxy; allow title_press_button_component_ready to follow one pointer before requiring the SceneObjProxy vtable/context.","rollback_reason":"Runtime timed out with the same product_core_title_dialog blocker. Logs stayed at state=10/10 with valid session/gm/gdm/profile/iodev/heap but title_loop=false,title_textfadeout=false, menu_latch=0, press_start_vt=0x7ffe96a45dc0 and press_start_ctx=0. The pointer fallback did not make product_core_autoload_ready succeed and no native submit/load fired.","next_action_hint":"Do not keep probing the PressStart +0xb78 layout blindly. Static RE TitleTopDialog constructor/xrefs around 0x1409a8275 and state-machine readiness first: either the offset/vtable assumption is wrong, or product_core should not require PressStart context/title_loop before firing the native press-start semantic. A vanilla input harness would be valuable for observing the exact native state/object transition.","artifact":"/home/banon/projects/er-effects-rs/target/runtime-probe/product-continue-direct-20260625-070825","runtime_summary":{"reason":"timeout_seconds_budget_exhausted","autoload_method":"direct_menu_load","blocker":"product_core_title_dialog","product_core_ready_blocks":683,"product_core_ready_successes":0,"game_task_ticks":683,"continue_phase":0,"native_submit_hits":0,"menu_continue_candidate_idle_accept_hits":625,"menu_continue_candidate_native_accept_hits":0},"core_readiness_last":{"state":"10/10","table":"0x143d71580","session":"0x7ffe93700220","gm":"0x7fffa082a580","gdm":"0x7fff9eb80160","profile":"0x7fffa0b56c80","iodev":"0x1445893b0","heap":"0x144844020","title_loop":false,"title_textfadeout":false,"menu_latch":0,"press_start_proxy":"0x7ffe96a458c8","press_start_vt":"0x7ffe96a45dc0","press_start_ctx":0},"user_followup_pending":"User suggested making an input harness for vanilla gold-run validations that observes and inputs like a real player instead of arbitrary button presses."}}
{"run":93,"commit":"2100051","metric":1490,"metrics":{"readiness_gate_failures":2,"target_constants_remaining":0,"helpers_missing":0,"fixed_wait_predicates":0,"autoload_static_failures":2,"asset_chain_failures":0,"dll_patch_failures":0,"native_continue_failures":0,"field58_gate_failures":0,"direct_shortcut_failures":0,"input_path_failures":0,"runtime_proof_failures":1,"runtime_mode_failures":0,"eula_popup_failures":0,"save_data_popup_failures":0,"messagebox_dialog_failures":0,"server_status_failures":0,"title_cover_failures":0,"title_cover_penalty":0,"native_trace_blockers":0,"native_trace_hits_total":74,"native_trace_unique_breakpoints":11,"false_positives":0,"runtime_timeout_failures":0,"runtime_title_visual_suppressed_builds":0,"runtime_custom_cover_builds":0,"runtime_simulated_button_presses_total":0},"status":"discard","description":"diagnostics-only semantic XInput harness for vanilla trace collection, gated by trigger file and counted as simulated input","timestamp":1782398371413,"segment":0,"confidence":5.043478260869565,"asi":{"hypothesis":"Add an opt-in diagnostics-only semantic input harness to collect uncontaminated vanilla/gold traces while preserving product zero-input checks via simulated_button_presses_total accounting.","rollback_reason":"Primary score 1490 did not improve over the known kept best 1520; the change only adds diagnostic capability and does not solve the readiness/runtime proof gap.","next_action_hint":"Static RE TitleTopDialog press-start/state readiness and exact native transition offsets instead of adding diagnostic input machinery; focus on why product_core stays blocked on title_dialog/press_start readiness."}}
{"run":94,"commit":"2100051","metric":1490,"metrics":{"readiness_gate_failures":2,"target_constants_remaining":0,"helpers_missing":0,"fixed_wait_predicates":0,"autoload_static_failures":2,"asset_chain_failures":0,"dll_patch_failures":0,"native_continue_failures":0,"field58_gate_failures":0,"direct_shortcut_failures":0,"input_path_failures":0,"runtime_proof_failures":1,"runtime_mode_failures":0,"eula_popup_failures":0,"save_data_popup_failures":0,"messagebox_dialog_failures":0,"server_status_failures":0,"title_cover_failures":0,"title_cover_penalty":0,"native_trace_blockers":0,"native_trace_hits_total":74,"native_trace_unique_breakpoints":11,"false_positives":0,"runtime_timeout_failures":0,"runtime_title_visual_suppressed_builds":0,"runtime_custom_cover_builds":0,"runtime_simulated_button_presses_total":0},"status":"discard","description":"relaxed product_core readiness so PressStart SceneObjProxy context is not a hard pre-open-menu blocker","timestamp":1782398558588,"segment":0,"confidence":4.833333333333333,"asi":{"hypothesis":"Static RE showed TitleTopDialog::open_menu is callable from validated TitleTopDialog/core state without requiring PressStart SceneObjProxy context, so relaxing that readiness gate might unblock product_core from the latest press_start blocker.","rollback_reason":"Primary score stayed 1490 with unchanged readiness_gate_failures/autoload_static_failures and no runtime-proof gain; this static-only gate relaxation did not improve the measured objective.","next_action_hint":"Do not keep blind readiness relaxations. Use static RE or targeted instrumentation to identify why title_state loop/textfadeout/menu_latch are false in the blocked state, or adjust the benchmark/runtime sentinel to actually exercise a rebuilt product_core change."}}
