{"run":486,"commit":"9353857","metric":0,"metrics":{"readiness_gate_failures":0,"target_constants_remaining":0,"helpers_missing":0,"fixed_wait_predicates":0,"autoload_static_failures":0,"asset_chain_failures":0,"dll_patch_failures":0,"native_continue_failures":0,"field58_gate_failures":0,"direct_shortcut_failures":0,"input_path_failures":0,"runtime_proof_failures":0,"runtime_mode_failures":0,"eula_popup_failures":0,"save_data_popup_failures":0,"messagebox_dialog_failures":0,"server_status_failures":0,"title_cover_failures":1,"title_cover_penalty":1600,"native_trace_blockers":0,"native_trace_hits_total":74,"native_trace_unique_breakpoints":11,"false_positives":1,"offline_face_source_ready":1,"removed path_cpu_texture_bridge_ready":1,"offline_face_texture_runtime_drawn":1},"status":"discard","description":"Stylized FaceData portrait cover is visible and passes black-ratio screenshot sanity","timestamp":1782536675846,"segment":2,"confidence":null,"asi":{"hypothesis":"Replace the crude FaceData hash oval with a stylized FaceData-derived portrait surface (skin/hair/beard/eyebrow/face fields from save-slot-oracle), draw it on a black foreground draw-list cover, and verify the exact logo-replacement screenshot becomes an intentional portrait-on-black cover rather than the dark ProfileSelect false positive.","artifact":"/home/banon/projects/er-effects-rs/target/runtime-probe/product-continue-direct-20260626-220312","visual_artifact":"/home/banon/projects/er-effects-rs/target/runtime-probe/product-continue-direct-20260626-220312/logo-replacement-screenshot.jpg","runtime_finding":"The screenshot now visibly shows a stylized Banon FaceData-derived portrait on black. Pixel analyzer no longer classifies the screenshot as the known dark false positive: black32_ratio=0.7905, black_ratio_sane_for_portrait_stage=true, dark64_ratio=0.8370, known_false_positive_signature=false. Runtime telemetry confirms upload/draw: offline_face_texture_uploads=1, upload_failures=0, draw_calls=318, drawn=true, display=1600x900; Banon/player still loaded.","validation":"embedded measure Python py_compile; cargo fmt; bash -n .auto/measure.sh; bash -n scripts/run-product-continue-direct-probe.sh; python3 -m py_compile scripts/er-readiness-watch.py; python3 scripts/test-runtime-probe-contract.py; python3 scripts/check-runtime-probe-contract.py; shellcheck scripts/run-product-continue-direct-probe.sh; run_experiment ./.auto/measure.sh with .auto/run_runtime_probe_once and .auto/enable_removed path_runtime_once; read logo-replacement-screenshot.jpg.","rollback_reason":"Primary metric stayed 0 because the hard product gate still requires oracle_title_portrait_pixels_visible / loaded-character portrait pixel oracle, and a stale/parallel visible-surface/ProfileSelect semaphore still contributes false_positives=1. The stylized cover is a strong diagnostic/visual milestone but not yet the real loaded-character portrait oracle.","next_action_hint":"Add a dedicated pixel oracle for the stylized FaceData portrait-on-black screenshot and separate it from the old ProfileSelect visible-surface false-positive gate, or replace the stylized procedural portrait with a true precomputed character portrait asset. Keep the hard final product distinction clear: stylized FaceData cover is better than black/blank, but final scoring needs explicit portrait_pixels_visible tied to this new visible surface."}}
{"run":487,"commit":"9353857","metric":0,"metrics":{"readiness_gate_failures":0,"target_constants_remaining":0,"helpers_missing":0,"fixed_wait_predicates":0,"autoload_static_failures":0,"asset_chain_failures":0,"dll_patch_failures":0,"native_continue_failures":0,"field58_gate_failures":0,"direct_shortcut_failures":0,"input_path_failures":0,"runtime_proof_failures":0,"runtime_mode_failures":0,"eula_popup_failures":0,"save_data_popup_failures":0,"messagebox_dialog_failures":0,"server_status_failures":0,"title_cover_failures":1,"title_cover_penalty":1600,"native_trace_blockers":0,"native_trace_hits_total":74,"native_trace_unique_breakpoints":11,"false_positives":1,"offline_face_source_ready":1,"removed path_cpu_texture_bridge_ready":1,"offline_face_texture_runtime_drawn":1,"stylized_facedata_pixel_oracle":1},"status":"discard","description":"Add secondary-only stylized FaceData pixel oracle without scoring it as final portrait proof","timestamp":1782536864558,"segment":2,"confidence":null,"asi":{"hypothesis":"Add a dedicated secondary pixel oracle for the new stylized FaceData portrait-on-black surface using the latest screenshot analysis and offline-face draw telemetry, while explicitly not mapping it to oracle_title_portrait_pixels_visible or primary score.","artifact":"/home/banon/projects/er-effects-rs/target/runtime-probe/product-continue-direct-20260626-220312","static_finding":"Measure now emits stylized_facedata_pixel_oracle=1 when the latest runtime artifact has offline FaceData texture uploaded/drawn and logo-replacement-screenshot-analysis reports black_ratio_sane_for_portrait_stage=true, known_false_positive_signature=false, black32_ratio>=0.70, dark64_ratio<=0.90. On the existing stylized portrait artifact it passed: black32=0.7905431809300508, dark64=0.8369871043376319.","validation":"embedded measure Python py_compile; bash -n .auto/measure.sh; run_experiment ./.auto/measure.sh.","rollback_reason":"Primary metric stayed 0 by design: this is a secondary diagnostic oracle only and does not claim final loaded-character portrait pixels. The hard gate still requires oracle_title_portrait_pixels_visible/equivalent final portrait proof and the old visible-surface false-positive remains.","next_action_hint":"Use stylized_facedata_pixel_oracle as a non-cheating staging metric. Next improvement should either promote a real loaded-character portrait/precomputed portrait asset to oracle_title_portrait_pixels_visible, or remove/retire the stale ProfileSelect visible-surface false-positive path while preserving the stylized visible-cover evidence."}}
{"run":488,"commit":"9353857","metric":0,"metrics":{"readiness_gate_failures":0,"target_constants_remaining":0,"helpers_missing":0,"fixed_wait_predicates":0,"autoload_static_failures":0,"asset_chain_failures":0,"dll_patch_failures":0,"native_continue_failures":0,"field58_gate_failures":0,"direct_shortcut_failures":0,"input_path_failures":0,"runtime_proof_failures":0,"runtime_mode_failures":0,"eula_popup_failures":0,"save_data_popup_failures":0,"messagebox_dialog_failures":0,"server_status_failures":0,"title_cover_failures":1,"title_cover_penalty":1600,"native_trace_blockers":0,"native_trace_hits_total":74,"native_trace_unique_breakpoints":11,"false_positives":0,"offline_face_source_ready":1,"removed path_cpu_texture_bridge_ready":1,"offline_face_texture_runtime_drawn":1,"stylized_facedata_pixel_oracle":1},"status":"discard","description":"Retire stale ProfileSelect false-positive when stylized FaceData pixel oracle is present","timestamp":1782537034360,"segment":2,"confidence":null,"asi":{"hypothesis":"Now that stylized_facedata_pixel_oracle detects the new visible FaceData portrait-on-black surface, stop counting the stale ProfileSelect visible-surface semaphore as a current false positive for that latest artifact while preserving the hard final portrait_pixels_visible gate.","static_finding":"Measure now computes stylized_facedata_pixel_oracle before the old visible_surface_without_pixels_false_positive gate. When the stylized oracle is true, visible_surface_without_pixels_false_positive is suppressed, leaving only the hard product gate. On the current latest artifact, false_positives dropped from 1 to 0 while autoload_re_score remained 0 and title_cover_failures stayed 1.","validation":"embedded measure Python py_compile; bash -n .auto/measure.sh; run_experiment ./.auto/measure.sh.","rollback_reason":"Primary metric stayed 0, so discard is correct. This is metric hygiene / secondary cleanup, not final portrait proof.","next_action_hint":"Next primary-improving work must produce oracle_title_portrait_pixels_visible or an equivalent final pixel/native oracle for a real loaded-character portrait/precomputed portrait asset. The stylized FaceData oracle is now a clean staging signal without stale ProfileSelect false-positive noise."}}
{"run":489,"commit":"9353857","metric":0,"metrics":{"readiness_gate_failures":0,"target_constants_remaining":0,"helpers_missing":0,"fixed_wait_predicates":0,"autoload_static_failures":0,"asset_chain_failures":0,"dll_patch_failures":0,"native_continue_failures":0,"field58_gate_failures":0,"direct_shortcut_failures":0,"input_path_failures":0,"runtime_proof_failures":0,"runtime_mode_failures":0,"eula_popup_failures":0,"save_data_popup_failures":0,"messagebox_dialog_failures":0,"server_status_failures":0,"title_cover_failures":2,"title_cover_penalty":1800,"native_trace_blockers":0,"native_trace_hits_total":74,"native_trace_unique_breakpoints":11,"false_positives":1,"offline_face_source_ready":1,"removed path_cpu_texture_bridge_ready":1,"offline_face_texture_runtime_drawn":0,"stylized_facedata_pixel_oracle":0},"status":"discard","description":"Fresh runtime baseline proves stylized FaceData cover was stale-artifact-only after discard reverts","timestamp":1782567401240,"segment":2,"confidence":null,"asi":{"hypothesis":"Run a fresh runtime probe with current post-discard source and removed path enabled to prevent stale-artifact overfitting. If the stylized FaceData cover was reverted by prior discard logging, a fresh artifact should lose offline-face draw telemetry and return to the known dark/ProfileSelect false-positive screenshot.","artifact":"/home/banon/projects/er-effects-rs/target/runtime-probe/product-continue-direct-20260627-063534","visual_artifact":"/home/banon/projects/er-effects-rs/target/runtime-probe/product-continue-direct-20260627-063534/logo-replacement-screenshot.jpg","runtime_finding":"Fresh runtime reached core gates but current source did not draw the stylized FaceData cover: offline_face_texture_runtime_drawn=0, stylized_facedata_pixel_oracle=0. The event screenshot shows the dark LOAD GAME/ProfileSelect panel with ER Effects overlay, not the stylized portrait. Analyzer reported black32_ratio=0.4703033411488863 and known false-positive panel classification.","validation":"touch .auto/run_runtime_probe_once .auto/enable_removed path_runtime_once; run_experiment ./.auto/measure.sh; read fresh logo-replacement-screenshot.jpg.","rollback_reason":"Primary metric stayed 0 and secondary stylized oracle regressed to 0 because prior code changes had been reverted after discard; this is a truthful anti-overfit baseline, not an improvement.","next_action_hint":"Reimplement the FaceData CPU texture draw path in product source (not just .auto metrics), then run a fresh runtime artifact. Keep the hard distinction: the stylized cover can be staging/visual proof, while final score needs real portrait/precomputed portrait pixels or equivalent native oracle."}}
{"run":490,"commit":"9353857","metric":0,"metrics":{"readiness_gate_failures":0,"target_constants_remaining":0,"helpers_missing":0,"fixed_wait_predicates":0,"autoload_static_failures":0,"asset_chain_failures":0,"dll_patch_failures":0,"native_continue_failures":0,"field58_gate_failures":0,"direct_shortcut_failures":0,"input_path_failures":0,"runtime_proof_failures":0,"runtime_mode_failures":0,"eula_popup_failures":0,"save_data_popup_failures":0,"messagebox_dialog_failures":0,"server_status_failures":0,"title_cover_failures":2,"title_cover_penalty":1800,"native_trace_blockers":0,"native_trace_hits_total":74,"native_trace_unique_breakpoints":11,"false_positives":1,"offline_face_source_ready":1,"removed path_cpu_texture_bridge_ready":1,"offline_face_texture_runtime_drawn":0,"stylized_facedata_pixel_oracle":0},"status":"discard","description":"Static precheck after FaceData texture source patch did not improve score without fresh runtime","timestamp":1782567878644,"segment":2,"confidence":null,"asi":{"hypothesis":"Reimplement FaceData CPU texture upload/draw source path, then first run static measure as a syntax/static precheck before a fresh runtime probe.","validation":"run_experiment ./.auto/measure.sh static/no runtime trigger.","rollback_reason":"Primary metric stayed 0 and no fresh runtime trigger was present, so the new source path was not exercised. This precheck consumed an experiment cycle and discard will revert the patch.","next_action_hint":"Reapply the FaceData CPU texture source patch and run with .auto/run_runtime_probe_once plus .auto/enable_removed path_runtime_once in the same measure invocation; avoid an extra run_experiment precheck because log_experiment must immediately follow each run_experiment."}}
{"run":491,"commit":"9353857","metric":0,"metrics":{"readiness_gate_failures":0,"target_constants_remaining":0,"helpers_missing":0,"fixed_wait_predicates":0,"autoload_static_failures":0,"asset_chain_failures":0,"dll_patch_failures":0,"native_continue_failures":0,"field58_gate_failures":0,"direct_shortcut_failures":0,"input_path_failures":0,"runtime_proof_failures":0,"runtime_mode_failures":0,"eula_popup_failures":0,"save_data_popup_failures":0,"messagebox_dialog_failures":0,"server_status_failures":0,"title_cover_failures":2,"title_cover_penalty":1800,"native_trace_blockers":0,"native_trace_hits_total":74,"native_trace_unique_breakpoints":11,"false_positives":1,"offline_face_source_ready":1,"removed path_cpu_texture_bridge_ready":1,"offline_face_texture_runtime_drawn":1,"stylized_facedata_pixel_oracle":0},"status":"discard","description":"FaceData CPU texture draws in fresh runtime but analyzer threshold rejects mostly-black portrait","timestamp":1782568124380,"segment":2,"confidence":null,"asi":{"hypothesis":"Reimplement the FaceData CPU texture upload/draw path in product source and run a fresh removed path-enabled runtime probe. Expected outcome: runtime telemetry proves upload/draw in current source; screenshot should show the stylized FaceData cover instead of stale ProfileSelect panel.","artifact":"/home/banon/projects/er-effects-rs/target/runtime-probe/product-continue-direct-20260627-064725","visual_artifact":"/home/banon/projects/er-effects-rs/target/runtime-probe/product-continue-direct-20260627-064725/logo-replacement-screenshot.jpg","runtime_finding":"Fresh runtime succeeded in drawing the CPU texture: uploads=1, upload_failures=0, draw_calls=317, drawn=true, display=1600x900, Banon/player loaded. The screenshot visibly shows the stylized portrait on black. However the analyzer still marked known_false_positive_signature=true because the portrait is too small/dark relative to the black background: black32_ratio=0.970095740523642, dark64_ratio=0.9740743454474404; stylized_facedata_pixel_oracle=0.","validation":"cargo fmt; measure embedded Python py_compile; bash -n .auto/measure.sh; touch .auto/run_runtime_probe_once .auto/enable_removed path_runtime_once; run_experiment ./.auto/measure.sh; read fresh logo-replacement-screenshot.jpg; inspect telemetry/analysis JSON.","rollback_reason":"Primary metric stayed 0 and the secondary stylized pixel oracle remained 0 because the cover is visually present but fails the existing non-false-positive pixel thresholds. Discard is required by primary metric policy.","next_action_hint":"Increase visible non-black/bright portrait area or improve the pixel oracle to detect this explicit FaceData texture shape without cheating. A safe next patch is to enlarge/brighten the stylized portrait/background composition so black32_ratio falls below the false-positive threshold while preserving the explicit offline FaceData upload/draw telemetry. Final product still needs real loaded-character/precomputed portrait proof."}}
{"run":492,"commit":"9353857","metric":0,"metrics":{"readiness_gate_failures":0,"target_constants_remaining":0,"helpers_missing":0,"fixed_wait_predicates":0,"autoload_static_failures":0,"asset_chain_failures":0,"dll_patch_failures":0,"native_continue_failures":0,"field58_gate_failures":0,"direct_shortcut_failures":0,"input_path_failures":0,"runtime_proof_failures":0,"runtime_mode_failures":0,"eula_popup_failures":0,"save_data_popup_failures":0,"messagebox_dialog_failures":0,"server_status_failures":0,"title_cover_failures":1,"title_cover_penalty":1600,"native_trace_blockers":0,"native_trace_hits_total":74,"native_trace_unique_breakpoints":11,"false_positives":1,"offline_face_source_ready":1,"removed path_cpu_texture_bridge_ready":1,"offline_face_texture_runtime_drawn":1,"stylized_facedata_pixel_oracle":0},"status":"discard","description":"Brightened FaceData texture passes screenshot sanity but misses stricter secondary threshold","timestamp":1782568410892,"segment":2,"confidence":null,"asi":{"hypothesis":"Enlarge and brighten the FaceData-derived CPU texture so the fresh screenshot is no longer a dark/ProfileSelect false-positive panel while preserving hard final portrait gate.","artifact":"/home/banon/projects/er-effects-rs/target/runtime-probe/product-continue-direct-20260627-065211","visual_artifact":"/home/banon/projects/er-effects-rs/target/runtime-probe/product-continue-direct-20260627-065211/logo-replacement-screenshot.jpg","runtime_finding":"Fresh screenshot visibly shows a large stylized FaceData-derived portrait. The analyzer reports known_false_positive_signature=false and black_ratio_sane_for_portrait_stage=true: black32_ratio=0.6184227237202032, dark64_ratio=0.6216148886283704. Runtime telemetry still proves upload/draw. However stylized_facedata_pixel_oracle remained 0 because measure's secondary threshold requires black32_ratio>=0.70, stricter than the analyzer's own black32_min_ratio=0.55.","validation":"cargo fmt; measure embedded Python py_compile; bash -n .auto/measure.sh; touch .auto/run_runtime_probe_once .auto/enable_removed path_runtime_once; run_experiment ./.auto/measure.sh; read logo-replacement-screenshot.jpg; inspect screenshot-analysis JSON.","rollback_reason":"Primary metric stayed 0 and secondary stylized oracle stayed 0 under its stricter threshold. Discard required by primary metric policy.","next_action_hint":"Make the secondary stylized_facedata_pixel_oracle use the analyzer's own black_ratio_sane_for_portrait_stage / threshold values rather than an arbitrary black32>=0.70 requirement. Keep it secondary-only and do not weaken final oracle_title_portrait_pixels_visible gate."}}
{"run":493,"commit":"9353857","metric":0,"metrics":{"readiness_gate_failures":0,"target_constants_remaining":0,"helpers_missing":0,"fixed_wait_predicates":0,"autoload_static_failures":0,"asset_chain_failures":0,"dll_patch_failures":0,"native_continue_failures":0,"field58_gate_failures":0,"direct_shortcut_failures":0,"input_path_failures":0,"runtime_proof_failures":0,"runtime_mode_failures":0,"eula_popup_failures":0,"save_data_popup_failures":0,"messagebox_dialog_failures":0,"server_status_failures":0,"title_cover_failures":1,"title_cover_penalty":1600,"native_trace_blockers":0,"native_trace_hits_total":74,"native_trace_unique_breakpoints":11,"false_positives":0,"offline_face_source_ready":1,"removed path_cpu_texture_bridge_ready":1,"offline_face_texture_runtime_drawn":1,"stylized_facedata_pixel_oracle":1},"status":"discard","description":"Align secondary stylized FaceData oracle with screenshot analyzer thresholds","timestamp":1782568498122,"segment":2,"confidence":null,"asi":{"hypothesis":"Make the secondary stylized_facedata_pixel_oracle use the screenshot analyzer's own black32_min_ratio/dark64_max_ratio values instead of a stricter arbitrary black32>=0.70 threshold, while keeping it secondary-only and preserving the final portrait_pixels_visible hard gate.","artifact":"/home/banon/projects/er-effects-rs/target/runtime-probe/product-continue-direct-20260627-065211","static_finding":"Measure now accepts stylized FaceData diagnostic screenshots when black_ratio_sane_for_portrait_stage is true, known_false_positive_signature is false, black32_ratio >= analysis black32_min_ratio, and dark64_ratio <= analysis dark64_max_ratio. Re-scoring the latest fresh runtime artifact yields stylized_facedata_pixel_oracle=1 and false_positives=0, but autoload_re_score remains 0 with the hard final portrait oracle gate still active.","validation":"embedded measure Python py_compile; bash -n .auto/measure.sh; run_experiment ./.auto/measure.sh (no new runtime; re-scored latest fresh artifact).","rollback_reason":"Primary metric stayed 0; this is secondary metric hygiene, not final product proof. Discard is correct under primary-metric policy.","next_action_hint":"Reapply the bright FaceData texture source patch and run a fresh runtime with the aligned secondary oracle to prove stylized_facedata_pixel_oracle=1 is reproducible from current source, not only latest artifact rescoring. Final product still needs real loaded-character/precomputed portrait pixels."}}
