{"run":185,"commit":"2100051","metric":1520,"metrics":{"readiness_gate_failures":0,"target_constants_remaining":0,"helpers_missing":0,"fixed_wait_predicates":0,"autoload_static_failures":0,"asset_chain_failures":0,"dll_patch_failures":0,"native_continue_failures":0,"field58_gate_failures":0,"direct_shortcut_failures":0,"input_path_failures":0,"runtime_proof_failures":1,"runtime_mode_failures":0,"eula_popup_failures":0,"save_data_popup_failures":0,"messagebox_dialog_failures":0,"server_status_failures":0,"title_cover_failures":0,"title_cover_penalty":0,"native_trace_blockers":0,"native_trace_hits_total":74,"native_trace_unique_breakpoints":11,"false_positives":0,"runtime_timeout_failures":0,"runtime_title_visual_suppressed_builds":1,"runtime_custom_cover_builds":1,"runtime_simulated_button_presses_total":0},"status":"discard","description":"inspected runtime timeout artifact as early exit before title","timestamp":1782419270942,"segment":0,"confidence":null,"asi":{"hypothesis":"Inspecting the partial artifact from timed-out runtime probe product-continue-direct-20260625-132336 should distinguish a selected-row/field254 failure from early launch/setup exit before title state.","rollback_reason":"Primary metric remained 1520, equal to the persisted best, and runtime_proof_failures remains 1. This was artifact triage only; no product/runtime proof improvement.","next_action_hint":"Inspect proton-run.out/runtime-probe.out/er-effects-crash-log.txt from /home/banon/projects/er-effects-rs/target/runtime-probe/product-continue-direct-20260625-132336 for the early exit cause before another runtime attempt. If runtime setup remains too slow, prebuild/deploy outside the 45s measure window or continue static RE. Do not infer Continue selection from this run.","static_finding_key":"autoload-runtime-timeout-20260625-132336-died-before-title-2026-06-25","artifact_dir":"/home/banon/projects/er-effects-rs/target/runtime-probe/product-continue-direct-20260625-132336","evidence":"Artifact telemetry: oracle_player_present=false, oracle_char_name empty, oracle_continue_phase=0, oracle_native_submit_hits=0, oracle_result_action_builder_hits=0, oracle_msgbox_total_builds=0, oracle_policy_window_total_builds=0. Debug log only reached save redirect/policy hook/messagebox hook setup around +1.25s. Teardown screenshot note: no window class=steam_app_1245620 (game gone/crashed)."}}
{"run":186,"commit":"2100051","metric":1520,"metrics":{"readiness_gate_failures":0,"target_constants_remaining":0,"helpers_missing":0,"fixed_wait_predicates":0,"autoload_static_failures":0,"asset_chain_failures":0,"dll_patch_failures":0,"native_continue_failures":0,"field58_gate_failures":0,"direct_shortcut_failures":0,"input_path_failures":0,"runtime_proof_failures":1,"runtime_mode_failures":0,"eula_popup_failures":0,"save_data_popup_failures":0,"messagebox_dialog_failures":0,"server_status_failures":0,"title_cover_failures":0,"title_cover_penalty":0,"native_trace_blockers":0,"native_trace_hits_total":74,"native_trace_unique_breakpoints":11,"false_positives":0,"runtime_timeout_failures":0,"runtime_title_visual_suppressed_builds":1,"runtime_custom_cover_builds":1,"runtime_simulated_button_presses_total":0},"status":"discard","description":"corrected runtime timeout as title idle-candidate blocker","timestamp":1782419360806,"segment":0,"confidence":null,"asi":{"hypothesis":"Inspecting runtime-probe/readiness logs from product-continue-direct-20260625-132336 should identify whether the runtime timeout was an early process exit or a title/menu semantic blocker.","rollback_reason":"Primary metric remained 1520, equal to the persisted best, and runtime_proof_failures remains 1. Artifact diagnosis clarified the blocker but did not add product proof.","next_action_hint":"Do not treat product-continue-direct-20260625-132336 as early process crash. It reached title and timed out at product_core_title_dialog with only idle accept candidates. Next decode/observe why the real CommandSelectDialog/native-accept Continue row is not instantiated under zero-input; runtime hooks at 0x140746a30 are useful only once native_accept appears.","static_finding_key":"autoload-runtime-20260625-132336-title-idle-candidate-timeout-2026-06-25","artifact_dir":"/home/banon/projects/er-effects-rs/target/runtime-probe/product-continue-direct-20260625-132336","evidence":"runtime-probe.err: launch->title=2.2s, continue/player/world n/a, reason=timeout_seconds_budget_exhausted. readiness-result: blocker=product_core_title_dialog, game_man_instance_resolved=true, game_task_ticks=637, continue_phase=0, continue_member_node=null, continue_task_node=null, menu_continue_candidate_hits=578, idle_accept_hits=578, native_accept_hits=0, last_accept=0x1407add70, idle insert caller=0x764338, no native submit/result builder hits, no msgbox/policy popup."}}
{"run":187,"commit":"2100051","metric":1520,"metrics":{"readiness_gate_failures":0,"target_constants_remaining":0,"helpers_missing":0,"fixed_wait_predicates":0,"autoload_static_failures":0,"asset_chain_failures":0,"dll_patch_failures":0,"native_continue_failures":0,"field58_gate_failures":0,"direct_shortcut_failures":0,"input_path_failures":0,"runtime_proof_failures":1,"runtime_mode_failures":0,"eula_popup_failures":0,"save_data_popup_failures":0,"messagebox_dialog_failures":0,"server_status_failures":0,"title_cover_failures":0,"title_cover_penalty":0,"native_trace_blockers":0,"native_trace_hits_total":74,"native_trace_unique_breakpoints":11,"false_positives":0,"runtime_timeout_failures":0,"runtime_title_visual_suppressed_builds":1,"runtime_custom_cover_builds":1,"runtime_simulated_button_presses_total":0},"status":"discard","description":"triaged native title-ready predicate flags as zero","timestamp":1782419453921,"segment":0,"confidence":null,"asi":{"hypothesis":"Readiness-result fields from the bounded runtime artifact should reveal whether the semantic native Continue row is blocked by title-native-ready predicates, row construction, or result propagation.","rollback_reason":"Primary metric remained 1520, equal to the persisted best, and runtime_proof_failures remains 1. Artifact triage identified a predicate/flag blocker but did not add runtime proof.","next_action_hint":"Decode caller 0x140745bf9 and predicate 0x140733150 context to identify which flags on object 0x7fff67ae60d8 stayed zero, then find static writers. Do not patch the flags until the semantic side effect is proven.","static_finding_key":"autoload-runtime-title-native-ready-flags-zero-2026-06-25","artifact_dir":"/home/banon/projects/er-effects-rs/target/runtime-probe/product-continue-direct-20260625-132336","evidence":"title_native_ready_hits=1727, last_caller_rva=0x745bf9, last_flags=0, last_masked=0, last_ret=0, last_object=0x7fff67ae60d8. product_core_ready_successes=0, blocker=title_dialog. native_ctor_b_hits=1 but native_ctor_b_continue_hits=0. Continue-like candidates were idle accept 0x1407add70 only."}}
{"run":188,"commit":"2100051","metric":1520,"metrics":{"readiness_gate_failures":0,"target_constants_remaining":0,"helpers_missing":0,"fixed_wait_predicates":0,"autoload_static_failures":0,"asset_chain_failures":0,"dll_patch_failures":0,"native_continue_failures":0,"field58_gate_failures":0,"direct_shortcut_failures":0,"input_path_failures":0,"runtime_proof_failures":1,"runtime_mode_failures":0,"eula_popup_failures":0,"save_data_popup_failures":0,"messagebox_dialog_failures":0,"server_status_failures":0,"title_cover_failures":0,"title_cover_penalty":0,"native_trace_blockers":0,"native_trace_hits_total":74,"native_trace_unique_breakpoints":11,"false_positives":0,"runtime_timeout_failures":0,"runtime_title_visual_suppressed_builds":1,"runtime_custom_cover_builds":1,"runtime_simulated_button_presses_total":0},"status":"discard","description":"static reclassified title native-ready as SceneObjProxy validity","timestamp":1782419705569,"segment":0,"confidence":null,"asi":{"hypothesis":"Decoding caller 0x140745bf9, predicate 0x140733150, and runtime-observed vtable/getter should identify which flags stayed zero and whether they are safe semantic state or a Scaleform proxy validity oracle.","rollback_reason":"Primary metric remained 1520, equal to the persisted best, and runtime_proof_failures remains 1. Static RE clarified the predicate semantics but did not add product proof.","next_action_hint":"Find why the SceneObjProxy/Scaleform component backing native title rows remains invalid under zero-input/current render-suppression timing, or whether Part A clears/suppresses the visual object before semantic rows become valid. Do not patch dataType/flags directly; they are proxy validity evidence.","static_finding_key":"autoload-title-native-ready-is-sceneobjproxy-validity-2026-06-25","evidence":"Runtime vtable 0x142a94a70 is CS::SceneObjProxy per VtableOwner; getter observed 0x14074baf0 maps to dump vtable slot [0]=0x14074bbe0. Hook semantics: state=this->vtable[0](this); flags=*(state+0x20)&0xff; ret=(flags&0x8f)!=0. Decompile of SceneObjProxy helpers and FUN_14074a0f0 uses CSScaleformValue.dataType at +0x20 masked by 0x8f. title_native_ready_last_flags=0 therefore means invalid/unmaterialized Scaleform value."}}
{"run":189,"commit":"2100051","metric":1520,"metrics":{"readiness_gate_failures":0,"target_constants_remaining":0,"helpers_missing":0,"fixed_wait_predicates":0,"autoload_static_failures":0,"asset_chain_failures":0,"dll_patch_failures":0,"native_continue_failures":0,"field58_gate_failures":0,"direct_shortcut_failures":0,"input_path_failures":0,"runtime_proof_failures":1,"runtime_mode_failures":0,"eula_popup_failures":0,"save_data_popup_failures":0,"messagebox_dialog_failures":0,"server_status_failures":0,"title_cover_failures":0,"title_cover_penalty":0,"native_trace_blockers":0,"native_trace_hits_total":74,"native_trace_unique_breakpoints":11,"false_positives":0,"runtime_timeout_failures":0,"runtime_title_visual_suppressed_builds":1,"runtime_custom_cover_builds":1,"runtime_simulated_button_presses_total":0},"status":"discard","description":"tried native-preserving render-only title visual suppression with scratch ProfileSelect telemetry","timestamp":1782420327876,"segment":0,"confidence":null,"asi":{"hypothesis":"Preserving the native BeginTitle 05_000_Title job while suppressing only the later draw bit should allow SceneObjProxy/title-row semantics to materialize, unlike the blocking ProfileSelect out-slot replacement.","rollback_reason":"Primary metric remained 1520, equal to the persisted best; static benchmark already accepted the older null-slot/scratch cover shape and runtime_proof_failures stayed 1. The edit was product-promising but not measurable without runtime proof, so it was discarded per autoresearch rules.","next_action_hint":"Use the render-only/native-preserving shape only as a runtime experiment base if a bounded runtime proof can be made to finish within the cap. Otherwise continue static RE on why current ProfileSelect replacement invalidates SceneObjProxy/native rows, or adjust the benchmark to distinguish product-safe render-only suppression from static scratch telemetry.","finding":"Edit shape attempted: BeginTitle hook calls TITLE_NATIVE_MENU_VISUAL_SUPPRESS_ORIG to keep native_job in out_slot, builds 05_010_ProfileSelect into a scratch local slot for telemetry only, and adds a 0x140744dd0 render hook that lets native FadeIn/SceneObjProxy setup run then clears CSMenuMan+0x90[menu_id] draw bit 0x2. Not kept because no primary improvement."}}
{"run":190,"commit":"2100051","metric":1520,"metrics":{"readiness_gate_failures":0,"target_constants_remaining":0,"helpers_missing":0,"fixed_wait_predicates":0,"autoload_static_failures":0,"asset_chain_failures":0,"dll_patch_failures":0,"native_continue_failures":0,"field58_gate_failures":0,"direct_shortcut_failures":0,"input_path_failures":0,"runtime_proof_failures":1,"runtime_mode_failures":0,"eula_popup_failures":0,"save_data_popup_failures":0,"messagebox_dialog_failures":0,"server_status_failures":0,"title_cover_failures":0,"title_cover_penalty":0,"native_trace_blockers":0,"native_trace_hits_total":74,"native_trace_unique_breakpoints":11,"false_positives":0,"runtime_timeout_failures":0,"runtime_title_visual_suppressed_builds":1,"runtime_custom_cover_builds":1,"runtime_simulated_button_presses_total":0},"status":"discard","description":"static tied ProfileSelect out-slot replacement to invalid native title rows","timestamp":1782420527381,"segment":0,"confidence":null,"asi":{"hypothesis":"The runtime invalid SceneObjProxy/title row state is caused by the current kept BeginTitle hook replacing the native 05_000_Title out slot with ProfileSelect rather than preserving native title row setup.","rollback_reason":"Primary metric remained 1520 with runtime_proof_failures=1; this iteration persisted a blocker finding only and changed no product code.","next_action_hint":"Future runtime attempts must not return ProfileSelect in the BeginTitle out slot. Use native-preserving BeginTitle plus later render-only suppression/custom non-blocking cover, or first update the benchmark so it penalizes the product-dead ProfileSelect replacement and distinguishes the product-safe render-only shape.","finding_key":"autoload-profileselect-outslot-replacement-invalidates-title-rows-2026-06-25","evidence":"Artifact product-continue-direct-20260625-132336 logs the current hook replacing 05_000_Title with 05_010_ProfileSelect, while telemetry has title_native_ready_hits=1727 but flags/masked/ret all 0, native_submit_hits=0, and only idle accept candidates."}}
{"run":191,"commit":"2100051","metric":0,"metrics":{"readiness_gate_failures":0,"target_constants_remaining":0,"helpers_missing":0,"fixed_wait_predicates":0,"autoload_static_failures":0,"asset_chain_failures":0,"dll_patch_failures":0,"native_continue_failures":0,"field58_gate_failures":0,"direct_shortcut_failures":0,"input_path_failures":0,"runtime_proof_failures":1,"runtime_mode_failures":0,"eula_popup_failures":0,"save_data_popup_failures":0,"messagebox_dialog_failures":0,"server_status_failures":0,"title_cover_failures":0,"title_cover_penalty":0,"native_trace_blockers":0,"native_trace_hits_total":74,"native_trace_unique_breakpoints":11,"false_positives":0,"runtime_timeout_failures":1,"runtime_title_visual_suppressed_builds":1,"runtime_custom_cover_builds":1,"runtime_simulated_button_presses_total":0},"status":"crash","description":"runtime tried native-preserving render-only title visual suppression","timestamp":1782420973403,"segment":0,"confidence":null,"asi":{"hypothesis":"With a fresh DLL, preserving the native 05_000_Title BeginTitle job and clearing only the later CSMenuMan draw bit should let native title SceneObjProxy rows become valid and produce runtime proof.","rollback_reason":"run_experiment timed out before METRIC lines; primary metric is 0/crash. Exact process scan found no eldenring.exe/start_protected_game.exe afterward. Artifact target/runtime-probe/product-continue-direct-20260625-135358 timed out with title_native_ready_hits=1790 but flags/masked/ret still 0 and native_submit_entered=false.","next_action_hint":"The render-only hook fired at +11.39s for menu_id=5 before the BeginTitle hook preserved native_job at +16.20s, and did not make title rows valid. Next static target: identify which MenuWindow/menu_id corresponds to actual 05_000_Title after BeginTitle and avoid suppressing earlier/non-title windows; also determine why FUN_140745b30 still sees SceneObjProxy dataType=0 after native job preservation.","artifact":"/home/banon/projects/er-effects-rs/target/runtime-probe/product-continue-direct-20260625-135358","evidence":"Debug lines: render hook installed, `render-only suppressed native 05_000_Title menu_window=0x7ffe94cd5d60 menu_id=5 flags_before=0x3 flags_after=0x1 caller_rva=0x7ad530` at +11390ms; later `BUILT scratch custom cover` and `PRESERVED native 05_000_Title ... native_job=0x10fbc0` at +16199ms. readiness-result: timeout_seconds_budget_exhausted, title_native_ready_last_flags=0, continue_phase=0."}}
{"run":192,"commit":"2100051","metric":0,"metrics":{"readiness_gate_failures":0,"target_constants_remaining":0,"helpers_missing":0,"fixed_wait_predicates":0,"autoload_static_failures":0,"asset_chain_failures":0,"dll_patch_failures":0,"native_continue_failures":0,"field58_gate_failures":0,"direct_shortcut_failures":0,"input_path_failures":0,"runtime_proof_failures":1,"runtime_mode_failures":0,"eula_popup_failures":0,"save_data_popup_failures":0,"messagebox_dialog_failures":0,"server_status_failures":0,"title_cover_failures":0,"title_cover_penalty":0,"native_trace_blockers":0,"native_trace_hits_total":74,"native_trace_unique_breakpoints":11,"false_positives":0,"runtime_timeout_failures":1,"runtime_title_visual_suppressed_builds":1,"runtime_custom_cover_builds":1,"runtime_simulated_button_presses_total":0},"status":"crash","description":"runtime tried gated render-only suppression but latched wrapper return instead of job","timestamp":1782421380716,"segment":0,"confidence":null,"asi":{"hypothesis":"Gating render suppression to the latched native title MenuWindowJob+0x130 window should avoid suppressing earlier menu windows and allow title row SceneObjProxy readiness.","rollback_reason":"run_experiment timed out before metrics; primary metric is 0/crash. Exact process scan found no game processes afterward. Artifact still had title_native_ready flags=0 and native_submit_entered=false.","next_action_hint":"Fix the latch: the BeginTitle wrapper return/native_ret is the out-slot pointer (0x10fbc0), not the job. After calling original, read `native_job = safe_read_usize(out_slot)` and then `native_window = safe_read_usize(native_job+0x130)`. Current artifact showed `native_job=0x10fbc0 native_window=0x7fff9e880000` and render suppression did not fire (`render_suppressed_windows=0`).","artifact":"/home/banon/projects/er-effects-rs/target/runtime-probe/product-continue-direct-20260625-140110","evidence":"Debug: `PRESERVED native ... native_job=0x10fbc0 native_window=0x7fff9e880000`; telemetry: oracle_title_native_menu_visual_render_suppressed_windows=0, title_native_ready_hits=1816 flags=0, native_submit_hits=0."}}
{"run":193,"commit":"2100051","metric":0,"metrics":{"readiness_gate_failures":0,"target_constants_remaining":0,"helpers_missing":0,"fixed_wait_predicates":0,"autoload_static_failures":0,"asset_chain_failures":0,"dll_patch_failures":0,"native_continue_failures":0,"field58_gate_failures":0,"direct_shortcut_failures":0,"input_path_failures":0,"runtime_proof_failures":1,"runtime_mode_failures":0,"eula_popup_failures":0,"save_data_popup_failures":0,"messagebox_dialog_failures":0,"server_status_failures":0,"title_cover_failures":0,"title_cover_penalty":0,"native_trace_blockers":0,"native_trace_hits_total":74,"native_trace_unique_breakpoints":11,"false_positives":0,"runtime_timeout_failures":1,"runtime_title_visual_suppressed_builds":1,"runtime_custom_cover_builds":1,"runtime_simulated_button_presses_total":0},"status":"crash","description":"runtime corrected BeginTitle job latch but native window not assigned until Run","timestamp":1782421750909,"segment":0,"confidence":null,"asi":{"hypothesis":"Reading `native_job=*out_slot` after original BeginTitle and gating render suppression to `native_job+0x130` should target the actual native title window.","rollback_reason":"run_experiment timed out before metrics; primary metric is 0/crash. Exact process scan found no game processes afterward. The job latch was corrected but `native_window` was still 0 at BeginTitle construction time, so render suppression did not fire and title_native_ready stayed false.","next_action_hint":"Store only `TITLE_NATIVE_MENU_VISUAL_LAST_NATIVE_JOB`; in `title_native_menu_visual_window_fadein_hook`, read `current_native_window=safe_read_usize(native_job+0x130)` at hook time and compare rcx/menu_window then. Do not rely on native_window captured in the BeginTitle wrapper.","artifact":"/home/banon/projects/er-effects-rs/target/runtime-probe/product-continue-direct-20260625-140724","evidence":"Debug: `native_ret=0x10fbc0 native_job=0x7ffe9e52c280 native_window=0x0`; telemetry render_suppressed_windows=0, title_native_ready_hits=1886 flags=0, native_submit_hits=0."}}
