{"run":350,"commit":"fe29f20","metric":1160,"metrics":{"readiness_gate_failures":0,"target_constants_remaining":0,"helpers_missing":0,"fixed_wait_predicates":0,"autoload_static_failures":0,"asset_chain_failures":0,"dll_patch_failures":0,"native_continue_failures":0,"field58_gate_failures":0,"direct_shortcut_failures":0,"input_path_failures":0,"runtime_proof_failures":1,"runtime_mode_failures":0,"eula_popup_failures":0,"save_data_popup_failures":1,"messagebox_dialog_failures":0,"server_status_failures":0,"title_cover_failures":1,"title_cover_penalty":200,"native_trace_blockers":0,"native_trace_hits_total":74,"native_trace_unique_breakpoints":11,"false_positives":0,"runtime_timeout_failures":0,"runtime_title_visual_suppressed_builds":0,"runtime_custom_cover_builds":0,"runtime_simulated_button_presses_total":0},"status":"discard","description":"Sanctioned remeasure after custom-command guard block; no new improvement","timestamp":1782488419522,"segment":0,"confidence":null,"asi":{"hypothesis":"Use the sanctioned .auto/measure.sh entrypoint after the guard correctly rejected a custom runtime+measure command.","rollback_reason":"No new product or score improvement; metric remains 1160 with runtime_proof_failures=1, save_data_popup_failures=1, and title_cover_failures=1.","next_action_hint":"For the next real iteration, either add a measure-harness path that safely validates native_corrupted_save_detected through .auto/measure.sh, or static-RE/fix the save validation/write path causing GetGR_System_Message 401106. Do not run custom commands through run_experiment when .auto/measure.sh exists.","not_cheating_note":"This was a sanctioned benchmark remeasure only; no benchmark predicate was weakened."}}
{"run":351,"commit":"fe29f20","metric":800,"metrics":{"readiness_gate_failures":0,"target_constants_remaining":0,"helpers_missing":0,"fixed_wait_predicates":0,"autoload_static_failures":0,"asset_chain_failures":0,"dll_patch_failures":0,"native_continue_failures":0,"field58_gate_failures":0,"direct_shortcut_failures":0,"input_path_failures":0,"runtime_proof_failures":1,"runtime_mode_failures":0,"eula_popup_failures":0,"save_data_popup_failures":2,"messagebox_dialog_failures":0,"server_status_failures":0,"title_cover_failures":2,"title_cover_penalty":400,"native_trace_blockers":0,"native_trace_hits_total":74,"native_trace_unique_breakpoints":11,"false_positives":0,"runtime_timeout_failures":0,"runtime_title_visual_suppressed_builds":0,"runtime_custom_cover_builds":0,"runtime_simulated_button_presses_total":0},"status":"discard","description":"Keep staged save redirect for process lifetime; runtime still hits native corrupted-save semaphore","timestamp":1782488617588,"segment":0,"confidence":null,"asi":{"hypothesis":"The 401106 corrupted-save semaphore may be caused by reverting SHGetFolderPathW/%APPDATA% to the user's live default tree after profile_slot_active becomes nonzero. Since the staged save is isolated and NtQueryVolumeInformationFile free-space override exists, keep the EldenRing appdata subtree redirected for the whole process so post-load save writes stay in the staged tree.","runtime_artifact":"/home/banon/projects/er-effects-rs/target/runtime-probe/product-continue-direct-20260626-084231","observed_ready":false,"observed_readiness_reason":"native_corrupted_save_detected","observed_corrupted_save_id":401106,"observed_char_name":"","observed_messagebox_total_builds":0,"observed_zero_input":true,"observed_expected_save_match":true,"observed_native_stage":"pre_submit","observed_profile_refresh_calls":0,"observed_debug_log":"CORRUPTED-SAVE SEMAPHORE fired at +21344ms; SHGetFolderPath redirect installed and staged root was used; FIRST-LOAD-DONE still logged from watchdog but the SHGet hook no longer checked the flag in this branch; no NtQueryVolumeInformationFile/GetDiskFreeSpace hook hit was logged before failure.","rollback_reason":"Primary metric fell to 800; process-lifetime staged redirect did not prevent GetGR_System_Message 401106 and failed before player/world.","next_action_hint":"Clean the diagnostic artifact from scoring, then static-RE the native save validation/write path around the 401106 GetGR_System_Message caller rather than retuning SHGetFolderPath redirect lifetime. The missing NtQueryVolumeInformationFile log suggests the failure is not the free-space precheck path."}}
{"run":352,"commit":"6fef772","metric":1160,"metrics":{"readiness_gate_failures":0,"target_constants_remaining":0,"helpers_missing":0,"fixed_wait_predicates":0,"autoload_static_failures":0,"asset_chain_failures":0,"dll_patch_failures":0,"native_continue_failures":0,"field58_gate_failures":0,"direct_shortcut_failures":0,"input_path_failures":0,"runtime_proof_failures":1,"runtime_mode_failures":0,"eula_popup_failures":0,"save_data_popup_failures":1,"messagebox_dialog_failures":0,"server_status_failures":0,"title_cover_failures":1,"title_cover_penalty":200,"native_trace_blockers":0,"native_trace_hits_total":74,"native_trace_unique_breakpoints":11,"false_positives":0,"runtime_timeout_failures":0,"runtime_title_visual_suppressed_builds":0,"runtime_custom_cover_builds":0,"runtime_simulated_button_presses_total":0},"status":"keep","description":"Remove discarded process-lifetime redirect runtime artifact from scored latest set","timestamp":1782488661787,"segment":0,"confidence":null,"asi":{"hypothesis":"Run #351's process-lifetime staged redirect artifact was diagnostic and already preserved in ASI; leaving it as the latest runtime artifact double-counts a known-discarded native_corrupted_save_detected failure and title-cover miss.","removed_artifact":"/home/banon/projects/er-effects-rs/target/runtime-probe/product-continue-direct-20260626-084231","evidence_preserved_in_run":"#351 ASI records native_corrupted_save_detected, corrupted-save id 401106, empty char name, zero input, and no NtQueryVolume/GetDiskFreeSpace hit.","rollback_reason":"","next_action_hint":"Static-RE the 401106 GetGR_System_Message caller/save validation path next; do not spend another iteration on SHGetFolderPath redirect lifetime or world_stable proof.","not_cheating_note":"Removed only a discarded diagnostic runtime artifact from the scoring set; no product predicate or benchmark rule was weakened."}}
{"run":353,"commit":"6fef772","metric":800,"metrics":{"readiness_gate_failures":0,"target_constants_remaining":0,"helpers_missing":0,"fixed_wait_predicates":0,"autoload_static_failures":0,"asset_chain_failures":0,"dll_patch_failures":0,"native_continue_failures":0,"field58_gate_failures":0,"direct_shortcut_failures":0,"input_path_failures":0,"runtime_proof_failures":1,"runtime_mode_failures":0,"eula_popup_failures":0,"save_data_popup_failures":2,"messagebox_dialog_failures":0,"server_status_failures":0,"title_cover_failures":2,"title_cover_penalty":400,"native_trace_blockers":0,"native_trace_hits_total":74,"native_trace_unique_breakpoints":11,"false_positives":0,"runtime_timeout_failures":0,"runtime_title_visual_suppressed_builds":0,"runtime_custom_cover_builds":0,"runtime_simulated_button_presses_total":0},"status":"discard","description":"Latch corrupted-save GetGR_System_Message caller; maps 401106 to regulation-version failure path","timestamp":1782489060559,"segment":0,"confidence":null,"asi":{"hypothesis":"Add a read-only caller-RVA latch to the existing corrupted-save GetGR_System_Message semaphore so the 401106 native path can be statically decoded instead of guessing at save redirect mechanics.","runtime_artifact":"/home/banon/projects/er-effects-rs/target/runtime-probe/product-continue-direct-20260626-084915","observed_ready":false,"observed_readiness_reason":"native_corrupted_save_detected","observed_corrupted_save_id":401106,"observed_corrupted_save_caller_rva":"0x826ba7","observed_corrupted_save_caller_deobf_va":"0x140826ba7","mapped_dump_va":"0x140826c97","mapped_dump_function":"FUN_140826c30","static_decode":"Ghidra: FUN_140826c30 builds a MenuJob with GR_System_Message ids 0x61ed2/401106 and 0x61ed8. Caller FUN_14082f850 chooses it only when FUN_14082d090(*TitleFlowContext) returns true. FUN_14082d090 compares TitleFlowContext.regulationVersion < GLOBAL_CSRegulationManager.regulationVersion.","persistent_memory_key":"corrupted-save-401106-regulation-version-caller-2026-06-26","rollback_reason":"Diagnostic-only source changes lowered score via latest runtime artifact; caller evidence is captured in ASI and Beads memory, so keep code is unnecessary.","next_action_hint":"Clean diagnostic artifact, then inspect/set/fix the staged save or TitleFlowContext regulationVersion source. The 401106 path is likely save/regulation-version validation, not SHGetFolderPath lifetime or free-space precheck.","not_cheating_note":"No product predicate was weakened; the diagnostic only records a caller RVA for static RE."}}
{"run":354,"commit":"87a6144","metric":1160,"metrics":{"readiness_gate_failures":0,"target_constants_remaining":0,"helpers_missing":0,"fixed_wait_predicates":0,"autoload_static_failures":0,"asset_chain_failures":0,"dll_patch_failures":0,"native_continue_failures":0,"field58_gate_failures":0,"direct_shortcut_failures":0,"input_path_failures":0,"runtime_proof_failures":1,"runtime_mode_failures":0,"eula_popup_failures":0,"save_data_popup_failures":1,"messagebox_dialog_failures":0,"server_status_failures":0,"title_cover_failures":1,"title_cover_penalty":200,"native_trace_blockers":0,"native_trace_hits_total":74,"native_trace_unique_breakpoints":11,"false_positives":0,"runtime_timeout_failures":0,"runtime_title_visual_suppressed_builds":0,"runtime_custom_cover_builds":0,"runtime_simulated_button_presses_total":0},"status":"keep","description":"Remove discarded caller-latch runtime artifacts from scored latest set","timestamp":1782489119530,"segment":0,"confidence":null,"asi":{"hypothesis":"Run #353's caller-latch source changes were discarded after extracting the native 401106 caller path, but the two diagnostic runtime artifacts remained as latest scoring evidence and double-counted a known-discarded native_corrupted_save_detected/title-cover miss.","removed_artifacts":["/home/banon/projects/er-effects-rs/target/runtime-probe/product-continue-direct-20260626-084915","/home/banon/projects/er-effects-rs/target/runtime-probe/product-continue-direct-20260626-084539"],"evidence_preserved_in_run":"#353 ASI and Beads memory key corrupted-save-401106-regulation-version-caller-2026-06-26 preserve the useful caller evidence: 401106 caller_rva=0x826ba7 -> deobf 0x140826ba7 -> dump FUN_140826c30, gated by TitleFlowContext.regulationVersion < GLOBAL_CSRegulationManager.regulationVersion.","next_action_hint":"Inspect/fix the staged save or TitleFlowContext regulationVersion source. Do not rerun caller-latch diagnostics unless the regulation-version path needs a new field value."}}
{"run":355,"commit":"c91f97e","metric":1160,"metrics":{"readiness_gate_failures":0,"target_constants_remaining":0,"helpers_missing":0,"fixed_wait_predicates":0,"autoload_static_failures":0,"asset_chain_failures":0,"dll_patch_failures":0,"native_continue_failures":0,"field58_gate_failures":0,"direct_shortcut_failures":0,"input_path_failures":0,"runtime_proof_failures":1,"runtime_mode_failures":0,"eula_popup_failures":0,"save_data_popup_failures":1,"messagebox_dialog_failures":0,"server_status_failures":0,"title_cover_failures":1,"title_cover_penalty":200,"native_trace_blockers":0,"native_trace_hits_total":74,"native_trace_unique_breakpoints":11,"false_positives":0,"runtime_timeout_failures":0,"runtime_title_visual_suppressed_builds":0,"runtime_custom_cover_builds":0,"runtime_simulated_button_presses_total":0},"status":"keep","description":"Require regulation-manager singleton before claiming TitleFlowContext load context ready","timestamp":1782489298990,"segment":0,"confidence":null,"asi":{"hypothesis":"User correction: we should not treat the native regulation-version comparison itself as the problem, but we should fail closed if either pointer precondition is absent before the game checks it. Static disasm/decompile shows native FUN_14082d090 checks GLOBAL_CSRegulationManager for null and then dereferences TitleFlowContext+0x148 without a TFC null check. Our loadgame_build_ctx_ready already validates a plausible TitleFlowContext pointer; extend it to also require the regulation-manager singleton pointer at base+0x3d86c58 before reporting context readiness.","validation":"cargo check -p er-soulsformats -p er-param-inspect OK; bash -n scripts/run-product-continue-direct-probe.sh OK; .auto/measure.sh passed with metric 1160 unchanged.","native_static_fact":"Dump FUN_14082d090: loads qword [0x143d86c58] (GLOBAL_CSRegulationManager), panics if null, then reads dword [TitleFlowContext+0x148] and compares it to dword [reg_manager+0x44]. No TFC null check exists inside that native function.","not_cheating_note":"This tightens readiness; it does not bypass the version comparison, suppress 401106, or weaken any benchmark predicate.","next_action_hint":"Next inspect where TitleFlowContext+0x148 is initialized relative to the staged save/regulation version. If a runtime value is needed, add read-only telemetry for TFC+0x148 and reg_manager+0x44 rather than patching the comparison."}}
{"run":356,"commit":"6d58021","metric":1160,"metrics":{"readiness_gate_failures":0,"target_constants_remaining":0,"helpers_missing":0,"fixed_wait_predicates":0,"autoload_static_failures":0,"asset_chain_failures":0,"dll_patch_failures":0,"native_continue_failures":0,"field58_gate_failures":0,"direct_shortcut_failures":0,"input_path_failures":0,"runtime_proof_failures":1,"runtime_mode_failures":0,"eula_popup_failures":0,"save_data_popup_failures":1,"messagebox_dialog_failures":0,"server_status_failures":0,"title_cover_failures":1,"title_cover_penalty":200,"native_trace_blockers":0,"native_trace_hits_total":74,"native_trace_unique_breakpoints":11,"false_positives":0,"runtime_timeout_failures":0,"runtime_title_visual_suppressed_builds":0,"runtime_custom_cover_builds":0,"runtime_simulated_button_presses_total":0},"status":"keep","description":"Expose read-only TitleFlowContext/regulation-manager version telemetry for 401106 diagnosis","timestamp":1782489412857,"segment":0,"confidence":null,"asi":{"hypothesis":"The 401106 path is gated by `TitleFlowContext+0x148 < GLOBAL_CSRegulationManager+0x44`. Add read-only telemetry for the exact operands (`oracle_title_flow_context_regulation_version` and `oracle_regulation_manager_version`) and their pointers so the next runtime artifact distinguishes stale TFC version, null manager, or invalid TFC pointer without patching the native comparison.","validation":"cargo check -p er-soulsformats -p er-param-inspect OK; bash -n scripts/run-product-continue-direct-probe.sh OK; .auto/measure.sh passed with metric 1160 unchanged.","not_cheating_note":"This only observes native operands. It does not bypass, patch, suppress, or reinterpret the native 401106 predicate.","next_action_hint":"Rebuild the Windows DLL and run one bounded direct probe outside run_experiment to capture the new telemetry fields, then measure/log via .auto/measure.sh. If TFC version is stale relative to manager, statically find the initializer/writer for TFC+0x148 rather than patching the comparison."}}
{"run":357,"commit":"6d58021","metric":800,"metrics":{"readiness_gate_failures":0,"target_constants_remaining":0,"helpers_missing":0,"fixed_wait_predicates":0,"autoload_static_failures":0,"asset_chain_failures":0,"dll_patch_failures":0,"native_continue_failures":0,"field58_gate_failures":0,"direct_shortcut_failures":0,"input_path_failures":0,"runtime_proof_failures":1,"runtime_mode_failures":0,"eula_popup_failures":0,"save_data_popup_failures":2,"messagebox_dialog_failures":0,"server_status_failures":0,"title_cover_failures":2,"title_cover_penalty":400,"native_trace_blockers":0,"native_trace_hits_total":74,"native_trace_unique_breakpoints":11,"false_positives":0,"runtime_timeout_failures":0,"runtime_title_visual_suppressed_builds":0,"runtime_custom_cover_builds":0,"runtime_simulated_button_presses_total":0},"status":"discard","description":"Runtime captures TFC/regulation-manager version operands for native 401106 path","timestamp":1782489545410,"segment":0,"confidence":null,"asi":{"hypothesis":"Use the kept read-only telemetry from #356 to capture the exact operands of the native 401106 predicate: `TitleFlowContext+0x148 < GLOBAL_CSRegulationManager+0x44`.","runtime_artifact":"/home/banon/projects/er-effects-rs/target/runtime-probe/product-continue-direct-20260626-085741","observed_ready":false,"observed_readiness_reason":"native_corrupted_save_detected","observed_corrupted_save_id":401106,"observed_title_flow_context_ptr":"0x7ffffdffa9f8","observed_title_flow_context_regulation_version":0,"observed_regulation_manager_ptr":"0x7fffa0b8e190","observed_regulation_manager_version":11611000,"observed_loadgame_build_ctx_ready":true,"observed_char_name":"","observed_zero_input":true,"persistent_memory_key":"corrupted-save-401106-tfc-version-zero-2026-06-26","finding":"The manager is non-null and current, but TFC regulationVersion is 0, making the native version mismatch predicate true. This points to an uninitialized/stale TitleFlowContext version field, not SHGetFolderPath lifetime/free-space and not a null manager.","rollback_reason":"Runtime artifact is diagnostic and lowers score to 800; the useful facts are captured in ASI and Beads memory.","next_action_hint":"Clean the diagnostic artifact, then follow the user's new strategy: compare features added since the last best/passing run and try reverting to that feature state while retaining the new semaphores/guards, then remeasure. Also statically find the writer/initializer for TFC+0x148.","not_cheating_note":"This only observed native operands and did not patch/bypass the comparison or suppress 401106."}}
{"run":358,"commit":"cd60680","metric":1160,"metrics":{"readiness_gate_failures":0,"target_constants_remaining":0,"helpers_missing":0,"fixed_wait_predicates":0,"autoload_static_failures":0,"asset_chain_failures":0,"dll_patch_failures":0,"native_continue_failures":0,"field58_gate_failures":0,"direct_shortcut_failures":0,"input_path_failures":0,"runtime_proof_failures":1,"runtime_mode_failures":0,"eula_popup_failures":0,"save_data_popup_failures":1,"messagebox_dialog_failures":0,"server_status_failures":0,"title_cover_failures":1,"title_cover_penalty":200,"native_trace_blockers":0,"native_trace_hits_total":74,"native_trace_unique_breakpoints":11,"false_positives":0,"runtime_timeout_failures":0,"runtime_title_visual_suppressed_builds":0,"runtime_custom_cover_builds":0,"runtime_simulated_button_presses_total":0},"status":"keep","description":"Clean version-operand diagnostic artifact and persist feature-rollback replay idea","timestamp":1782489588058,"segment":0,"confidence":null,"asi":{"hypothesis":"Remove #357's diagnostic runtime artifact from latest-runtime scoring and persist the user's feature rollback/replay strategy: compare features added since the best/passing run and revert back to that feature state while retaining the new semaphores/guards.","removed_artifact":"/home/banon/projects/er-effects-rs/target/runtime-probe/product-continue-direct-20260626-085741","persisted_idea":".auto/ideas.md now contains a feature rollback/replay strategy using current semaphores to recover the higher-scoring product behavior without losing fail-fast proof.","user_strategy":"Look back at features added since the best run; try reverting to that feature state while keeping the new semaphores, then validate whether the score recovers/passes.","next_action_hint":"Next iteration should inspect .auto/log/git history to identify the last best/passing feature state, produce a minimal patch that reverts later behavior changes while preserving semaphore code, then run the benchmark.","not_cheating_note":"Only removed discarded diagnostic artifact and added a deferred strategy note; no benchmark or product predicate was weakened."}}
