{"run":557,"commit":"4dc167b","metric":0,"metrics":{"readiness_gate_failures":0,"target_constants_remaining":0,"helpers_missing":0,"fixed_wait_predicates":0,"autoload_static_failures":0,"asset_chain_failures":0,"dll_patch_failures":0,"native_continue_failures":0,"field58_gate_failures":0,"direct_shortcut_failures":0,"input_path_failures":0,"runtime_proof_failures":0,"runtime_mode_failures":0,"eula_popup_failures":0,"save_data_popup_failures":0,"messagebox_dialog_failures":0,"server_status_failures":0,"title_cover_failures":3,"title_cover_penalty":2000,"native_trace_blockers":0,"native_trace_hits_total":74,"native_trace_unique_breakpoints":11,"false_positives":1,"offline_face_source_ready":1,"removed path_cpu_texture_bridge_ready":0,"offline_face_texture_runtime_drawn":0,"stylized_facedata_pixel_oracle":0,"real_portrait_asset_candidates":0,"profile_placeholder_assets_only":1},"status":"discard","description":"Tried native TitleBackViewParts SYSTEX profile bind oracle, but static measure remained blocked by stale falsified runtime artifact.","timestamp":1782626380666,"segment":2,"confidence":null,"asi":{"hypothesis":"Bind SYSTEX_Menu_Profile00 directly onto 05_001_Title_Logo/MENU_Title_EldenRing_01 and accept that native logo-surface binding as the equivalent non-screenshot oracle requested by the measure gate.","rollback_reason":"Current benchmark still scored stale runtime artifacts with oracle_title_portrait_visible_surface_bound true and no pixel/native successor field; primary metric remained 0 with false_positives=1, so the change cannot be kept without a validating runtime artifact.","next_action_hint":"Do not repeat this exact static-only lane. Next either create a fresh runtime artifact using the native-logo bind change, or first change measure selection to ignore stale falsified artifacts only if replaced by a newer run; otherwise investigate a pure static score path that removes the old ProfileSelect visible-surface false positive."}}
{"run":558,"commit":"4dc167b","metric":0,"metrics":{"readiness_gate_failures":0,"target_constants_remaining":0,"helpers_missing":0,"fixed_wait_predicates":0,"autoload_static_failures":0,"asset_chain_failures":0,"dll_patch_failures":0,"native_continue_failures":0,"field58_gate_failures":0,"direct_shortcut_failures":0,"input_path_failures":0,"runtime_proof_failures":1,"runtime_mode_failures":0,"eula_popup_failures":0,"save_data_popup_failures":0,"messagebox_dialog_failures":0,"server_status_failures":0,"title_cover_failures":3,"title_cover_penalty":2000,"native_trace_blockers":0,"native_trace_hits_total":74,"native_trace_unique_breakpoints":11,"false_positives":1,"offline_face_source_ready":1,"removed path_cpu_texture_bridge_ready":0,"offline_face_texture_runtime_drawn":0,"stylized_facedata_pixel_oracle":0,"real_portrait_asset_candidates":0,"profile_placeholder_assets_only":1},"status":"crash","description":"Runtime-probed native TitleBackViewParts SYSTEX bind; probe failed before producing a score.","timestamp":1782626555247,"segment":2,"confidence":null,"asi":{"hypothesis":"A fresh runtime artifact with native logo-surface SYSTEX binding can replace the stale ProfileSelect false-positive artifact and satisfy the equivalent native-surface portrait oracle.","rollback_reason":"./.auto/measure.sh exited 1 during the runtime probe before parsed metrics were emitted, so the runtime result cannot be trusted or kept.","next_action_hint":"Inspect /home/banon/projects/er-effects-rs/target/runtime-probe/product-continue-direct-20260627-230152 artifacts and debug log to classify whether the native bind crashed, timed out, or preflight/teardown failed; do not repeat until the failure is understood."}}
{"run":559,"commit":"4dc167b","metric":0,"metrics":{"readiness_gate_failures":0,"target_constants_remaining":0,"helpers_missing":0,"fixed_wait_predicates":0,"autoload_static_failures":0,"asset_chain_failures":0,"dll_patch_failures":0,"native_continue_failures":0,"field58_gate_failures":0,"direct_shortcut_failures":0,"input_path_failures":0,"runtime_proof_failures":1,"runtime_mode_failures":0,"eula_popup_failures":0,"save_data_popup_failures":0,"messagebox_dialog_failures":0,"server_status_failures":0,"title_cover_failures":3,"title_cover_penalty":2000,"native_trace_blockers":0,"native_trace_hits_total":74,"native_trace_unique_breakpoints":11,"false_positives":1,"offline_face_source_ready":1,"removed path_cpu_texture_bridge_ready":0,"offline_face_texture_runtime_drawn":0,"stylized_facedata_pixel_oracle":0,"real_portrait_asset_candidates":0,"profile_placeholder_assets_only":1},"status":"crash","description":"Runtime-probed direct CSScaleform bind apply for TitleBackViewParts SYSTEX profile cover; probe failed before score.","timestamp":1782626947393,"segment":2,"confidence":null,"asi":{"hypothesis":"Bypass the fixed-vector collector wrapper that crashed on late 05_001_Title_Logo rebinding and call the underlying CSScaleform bind apply helper directly with live TitleBackViewParts resource and SYSTEX_Menu_Profile00.","rollback_reason":"./.auto/measure.sh exited 1 during the runtime probe before parsed metrics were emitted; runtime artifact must be inspected before any retry.","next_action_hint":"Inspect /home/banon/projects/er-effects-rs/target/runtime-probe/product-continue-direct-20260627-230829 crash/readiness logs. If it still faults at 0x140d6ab50/0x140d7be60, the direct bind apply requires a prepared target/source resource object rather than raw strings; pivot to subagent's static plan instead."}}
{"run":560,"commit":"4dc167b","metric":0,"metrics":{"readiness_gate_failures":0,"target_constants_remaining":0,"helpers_missing":0,"fixed_wait_predicates":0,"autoload_static_failures":0,"asset_chain_failures":0,"dll_patch_failures":0,"native_continue_failures":0,"field58_gate_failures":0,"direct_shortcut_failures":0,"input_path_failures":0,"runtime_proof_failures":0,"runtime_mode_failures":0,"eula_popup_failures":0,"save_data_popup_failures":0,"messagebox_dialog_failures":0,"server_status_failures":0,"title_cover_failures":3,"title_cover_penalty":2000,"native_trace_blockers":0,"native_trace_hits_total":74,"native_trace_unique_breakpoints":11,"false_positives":1,"offline_face_source_ready":1,"removed path_cpu_texture_bridge_ready":0,"offline_face_texture_runtime_drawn":0,"stylized_facedata_pixel_oracle":0,"real_portrait_asset_candidates":0,"profile_placeholder_assets_only":1},"status":"discard","description":"Post-crash static remeasure confirmed the title-cover hard gate still scores 0 from stale false-positive artifacts.","timestamp":1782627058429,"segment":2,"confidence":null,"asi":{"hypothesis":"Re-run measure after crash reverts to verify whether the latest non-ProfileSelect crash artifact changes the scoring surface before choosing the next experiment.","rollback_reason":"Primary metric stayed 0 and false_positives stayed 1; no keepable improvement.","next_action_hint":"Follow the subagent recommendation: avoid late TitleBackViewParts rebinding and implement observe-first native CSEzDraw/RendMan telemetry or a custom native surface that consumes CSRuntimeTexResCap."}}
{"run":561,"commit":"4dc167b","metric":0,"metrics":{"readiness_gate_failures":0,"target_constants_remaining":0,"helpers_missing":0,"fixed_wait_predicates":0,"autoload_static_failures":0,"asset_chain_failures":0,"dll_patch_failures":0,"native_continue_failures":0,"field58_gate_failures":0,"direct_shortcut_failures":0,"input_path_failures":0,"runtime_proof_failures":0,"runtime_mode_failures":0,"eula_popup_failures":0,"save_data_popup_failures":0,"messagebox_dialog_failures":0,"server_status_failures":0,"title_cover_failures":3,"title_cover_penalty":2000,"native_trace_blockers":0,"native_trace_hits_total":74,"native_trace_unique_breakpoints":11,"false_positives":1,"offline_face_source_ready":1,"removed path_cpu_texture_bridge_ready":0,"offline_face_texture_runtime_drawn":0,"stylized_facedata_pixel_oracle":0,"real_portrait_asset_candidates":0,"profile_placeholder_assets_only":1},"status":"discard","description":"Removed ProfileSelect replay installation/call in source, but static measure remains pinned at 0 by the portrait hard gate and stale false-positive runtime evidence.","timestamp":1782627165693,"segment":2,"confidence":null,"asi":{"hypothesis":"Remove the known-falsified ProfileSelect cover replay from the product cover path so future native-surface work starts from a cleaner title stack.","rollback_reason":"The primary metric did not improve; .auto/measure.sh still scores stale runtime artifacts and requires a real portrait pixel/native-surface oracle, so this source cleanup alone is not keepable under the loop gates.","next_action_hint":"Reapply this cleanup only together with a real native surface/pixel oracle. Next implement observe-first CSEzDraw/RendMan telemetry, then promote to visible only when it consumes the profile CSRuntimeTexResCap."}}
{"run":562,"commit":"4dc167b","metric":0,"metrics":{"readiness_gate_failures":0,"target_constants_remaining":0,"helpers_missing":0,"fixed_wait_predicates":0,"autoload_static_failures":0,"asset_chain_failures":0,"dll_patch_failures":0,"native_continue_failures":0,"field58_gate_failures":0,"direct_shortcut_failures":0,"input_path_failures":0,"runtime_proof_failures":0,"runtime_mode_failures":0,"eula_popup_failures":0,"save_data_popup_failures":0,"messagebox_dialog_failures":0,"server_status_failures":0,"title_cover_failures":3,"title_cover_penalty":2000,"native_trace_blockers":0,"native_trace_hits_total":74,"native_trace_unique_breakpoints":11,"false_positives":1,"offline_face_source_ready":1,"removed path_cpu_texture_bridge_ready":0,"offline_face_texture_runtime_drawn":0,"stylized_facedata_pixel_oracle":0,"real_portrait_asset_candidates":0,"profile_placeholder_assets_only":1},"status":"discard","description":"Added observe-only CSEzDraw/RendMan portrait-surface telemetry hook; measure stayed at 0 because no runtime native-surface proof artifact exists.","timestamp":1782627426102,"segment":2,"confidence":null,"asi":{"hypothesis":"Install an observe-only hook on native CSEzDraw::Draw (deobf 0x142650040) and telemetry fields that tie draw-phase observation to the existing CSMenuProfModelRend -> CSEzOffscreenRend -> CSRuntimeTexResCap portrait source, avoiding ProfileSelect replay and removed path overlays.","rollback_reason":"Primary metric did not improve; .auto/measure.sh still requires a runtime artifact with a true portrait pixel/native-surface proof, and this static observe-only telemetry produced no such artifact.","next_action_hint":"If pursuing this lane, reapply the observe-only CSEzDraw hook and run a bounded runtime probe to collect whether the profile-ready draw calls appear; only then consider a native draw command or measure acceptance for oracle_title_portrait_native_surface_visible."}}
{"run":563,"commit":"4dc167b","metric":0,"metrics":{"readiness_gate_failures":0,"target_constants_remaining":0,"helpers_missing":0,"fixed_wait_predicates":0,"autoload_static_failures":0,"asset_chain_failures":0,"dll_patch_failures":0,"native_continue_failures":0,"field58_gate_failures":0,"direct_shortcut_failures":0,"input_path_failures":0,"runtime_proof_failures":0,"runtime_mode_failures":0,"eula_popup_failures":0,"save_data_popup_failures":0,"messagebox_dialog_failures":0,"server_status_failures":0,"title_cover_failures":2,"title_cover_penalty":1800,"native_trace_blockers":0,"native_trace_hits_total":74,"native_trace_unique_breakpoints":11,"false_positives":1,"offline_face_source_ready":1,"removed path_cpu_texture_bridge_ready":0,"offline_face_texture_runtime_drawn":0,"stylized_facedata_pixel_oracle":0,"real_portrait_asset_candidates":0,"profile_placeholder_assets_only":1},"status":"discard","description":"Runtime-tested observe-only CSEzDraw/RendMan portrait-source telemetry; reduced title-cover failure count but primary remained 0 due hard portrait false-positive gate.","timestamp":1782627844930,"segment":2,"confidence":null,"asi":{"hypothesis":"Observe native CSEzDraw::Draw at deobf 0x142650040 during a bounded runtime probe and tie its draw-phase calls to the existing CSMenuProfModelRend/CSEzOffscreenRend/CSRuntimeTexResCap portrait source without ProfileSelect replay, removed path overlay, input, or load shortcuts.","rollback_reason":"Primary metric remained 0 and false_positives remained 1; secondary title_cover_failures improved from 3 to 2 but the hard gate still requires real visible portrait pixels or equivalent native visible-surface proof, so the change cannot be kept.","next_action_hint":"Inspect /tmp/pi-experiment-b7319ad10177cced.log and the latest target/runtime-probe artifact for oracle_title_portrait_native_surface_observed / CSEzDraw counters. If profile-ready CSEzDraw calls appeared, next experiment should promote from observe-only to a proven native draw command or stronger visible-surface semaphore; if not, hook an earlier RendMan phase."}}
{"run":564,"commit":"4dc167b","metric":0,"metrics":{"readiness_gate_failures":0,"target_constants_remaining":0,"helpers_missing":0,"fixed_wait_predicates":0,"autoload_static_failures":0,"asset_chain_failures":0,"dll_patch_failures":0,"native_continue_failures":0,"field58_gate_failures":0,"direct_shortcut_failures":0,"input_path_failures":0,"runtime_proof_failures":0,"runtime_mode_failures":0,"eula_popup_failures":0,"save_data_popup_failures":0,"messagebox_dialog_failures":0,"server_status_failures":0,"title_cover_failures":2,"title_cover_penalty":1800,"native_trace_blockers":0,"native_trace_hits_total":74,"native_trace_unique_breakpoints":11,"false_positives":0,"offline_face_source_ready":1,"removed path_cpu_texture_bridge_ready":0,"offline_face_texture_runtime_drawn":0,"stylized_facedata_pixel_oracle":0,"real_portrait_asset_candidates":0,"profile_placeholder_assets_only":1},"status":"discard","description":"Runtime-tested non-ProfileSelect CSEzDraw command-buffer texture scan; cleared false-positive metric but primary stayed 0.","timestamp":1782628199813,"segment":2,"confidence":null,"asi":{"hypothesis":"Remove the known-falsified ProfileSelect replay and hook native CSEzDraw command-buffer execution (deobf 0x14269b500) to scan for the live profile CSRuntimeTexResCap/CSGxTexture/resource pointers before commands are consumed; accept only a command-buffer texture hit as native-surface evidence.","rollback_reason":"Primary metric remained 0 even though false_positives improved to 0; the run still had title_cover_failures=2/title_cover_penalty=1800, so it is not keepable under primary-metric loop gates.","next_action_hint":"Inspect /tmp/pi-experiment-36e615655f33a128.log and latest target/runtime-probe artifact for CSEzDraw exec hit counts. If no profile texture hits appeared, the profile texture is an output/render target rather than a command input; next hook the offscreen render-target bind/resolve path around CSMenuProfModelRend/CSEzOffscreenRend instead of scanning draw commands."}}
{"run":565,"commit":"4dc167b","metric":0,"metrics":{"readiness_gate_failures":0,"target_constants_remaining":0,"helpers_missing":0,"fixed_wait_predicates":0,"autoload_static_failures":0,"asset_chain_failures":0,"dll_patch_failures":0,"native_continue_failures":0,"field58_gate_failures":0,"direct_shortcut_failures":0,"input_path_failures":0,"runtime_proof_failures":0,"runtime_mode_failures":0,"eula_popup_failures":0,"save_data_popup_failures":0,"messagebox_dialog_failures":0,"server_status_failures":0,"title_cover_failures":2,"title_cover_penalty":1800,"native_trace_blockers":0,"native_trace_hits_total":74,"native_trace_unique_breakpoints":11,"false_positives":0,"offline_face_source_ready":1,"removed path_cpu_texture_bridge_ready":0,"offline_face_texture_runtime_drawn":0,"stylized_facedata_pixel_oracle":0,"real_portrait_asset_candidates":0,"profile_placeholder_assets_only":1},"status":"discard","description":"Runtime-tested CSMenuProfModelRend texture-index setter observer without ProfileSelect replay; primary remained 0.","timestamp":1782628513608,"segment":2,"confidence":null,"asi":{"hypothesis":"Hook the real deobf CSMenuProfModelRend texture-index setter at 0x140bb8c00 (mov [rcx+0x9a8], edx; ret) to observe when the profile renderer maps slot0 to SYSTEX_Menu_Profile00, while removing the known-falsified ProfileSelect replay so the evidence stays native source-side only.","rollback_reason":"Primary metric remained 0; false_positives stayed 0 and title_cover_failures stayed 2, but the hook only proves profile-renderer source mapping, not visible title-safe portrait pixels/native surface consumption.","next_action_hint":"Inspect /tmp/pi-experiment-1f78363c3fc67e1f.log and latest runtime artifact for oracle_title_profile_tex_index_setter_* values. If slot0 setter fires with tex_rescap, next hook the CSEzOffscreenRend render-target bind/resolve path that turns that renderer output into CSRuntimeTexResCap+0x78, not the title cover or draw command consumer."}}
{"run":566,"commit":"4dc167b","metric":0,"metrics":{"readiness_gate_failures":0,"target_constants_remaining":0,"helpers_missing":0,"fixed_wait_predicates":0,"autoload_static_failures":0,"asset_chain_failures":0,"dll_patch_failures":0,"native_continue_failures":0,"field58_gate_failures":0,"direct_shortcut_failures":0,"input_path_failures":0,"runtime_proof_failures":0,"runtime_mode_failures":0,"eula_popup_failures":0,"save_data_popup_failures":0,"messagebox_dialog_failures":0,"server_status_failures":0,"title_cover_failures":2,"title_cover_penalty":1800,"native_trace_blockers":0,"native_trace_hits_total":74,"native_trace_unique_breakpoints":11,"false_positives":0,"offline_face_source_ready":1,"removed path_cpu_texture_bridge_ready":0,"offline_face_texture_runtime_drawn":0,"stylized_facedata_pixel_oracle":0,"real_portrait_asset_candidates":0,"profile_placeholder_assets_only":1},"status":"discard","description":"Runtime-tested CSMenuAsmModelRend update observer for profile offscreen texture source; primary remained 0.","timestamp":1782628831160,"segment":2,"confidence":null,"asi":{"hypothesis":"Hook CSMenuAsmModelRend update at deobf 0x140bba730 observe-only to prove the profile renderer task actually ticks after the post-SL2 refresh and records CSEzOffscreenRend -> CSRuntimeTexResCap source, while removing the known-falsified ProfileSelect replay.","observed_evidence":"Runtime artifact target/runtime-probe/product-continue-direct-20260627-233936 had oracle_title_profile_renderer_update_profile_source_calls=1010 and last tex_rescap=0x7fffa18fcbe0; hook observed all ten profile renderer offscreen texture sources around +15.07s and world_stable still passed.","rollback_reason":"Primary metric remained 0; this proves active profile renderer/offscreen source ticks but still does not prove a title-safe visible cover surface consumes the loaded-character portrait pixels.","next_action_hint":"Use the observed CSMenuAsmModelRend update/offscreen source as the producer. Next hook the downstream CSEzOffscreenRend/scene draw or TexRepository/SYSTEX consumer that exposes CSRuntimeTexResCap 0x7fffa18fcbe0 to a visible Scaleform/native surface; do not rescan generic CSEzDraw commands or ProfileSelect replay."}}
{"run":567,"commit":"4dc167b","metric":0,"metrics":{"readiness_gate_failures":0,"target_constants_remaining":0,"helpers_missing":0,"fixed_wait_predicates":0,"autoload_static_failures":0,"asset_chain_failures":0,"dll_patch_failures":0,"native_continue_failures":0,"field58_gate_failures":0,"direct_shortcut_failures":0,"input_path_failures":0,"runtime_proof_failures":0,"runtime_mode_failures":0,"eula_popup_failures":0,"save_data_popup_failures":0,"messagebox_dialog_failures":0,"server_status_failures":0,"title_cover_failures":2,"title_cover_penalty":1800,"native_trace_blockers":0,"native_trace_hits_total":74,"native_trace_unique_breakpoints":11,"false_positives":0,"offline_face_source_ready":1,"removed path_cpu_texture_bridge_ready":0,"offline_face_texture_runtime_drawn":0,"stylized_facedata_pixel_oracle":0,"real_portrait_asset_candidates":0,"profile_placeholder_assets_only":1},"status":"discard","description":"Runtime-tested CSMenuProfModelRend scene-submit observer; downstream submit helper did not fire.","timestamp":1782629051423,"segment":2,"confidence":null,"asi":{"hypothesis":"Hook CSMenuAsmModelRend scene/model submit helper at deobf 0x140bba6e0 observe-only to determine whether the profile renderer output is submitted downstream after the post-SL2 refresh, while removing the known-falsified ProfileSelect replay.","observed_evidence":"Runtime artifact target/runtime-probe/product-continue-direct-20260627-234319 installed the hook but telemetry showed oracle_title_profile_renderer_scene_submit_calls=0 and profile_source_calls=0; world_stable still passed and false_positives remained 0.","rollback_reason":"Primary metric remained 0; the downstream submit helper did not fire in this path, so it cannot currently serve as the visible portrait surface/consumption oracle.","next_action_hint":"Do not keep chasing 0x140bba6e0 as the active draw edge. Return to the CSMenuProfModelRend update hook evidence from #566, then statically decode which vtable entries +0xc0/+0xc8 actually run inside update for the profile renderer and hook those concrete functions instead of the inactive direct helper."}}
