{"run":523,"commit":"4dc167b","metric":0,"metrics":{"readiness_gate_failures":0,"target_constants_remaining":0,"helpers_missing":0,"fixed_wait_predicates":0,"autoload_static_failures":0,"asset_chain_failures":0,"dll_patch_failures":0,"native_continue_failures":0,"field58_gate_failures":0,"direct_shortcut_failures":0,"input_path_failures":0,"runtime_proof_failures":0,"runtime_mode_failures":0,"eula_popup_failures":0,"save_data_popup_failures":0,"messagebox_dialog_failures":0,"server_status_failures":0,"title_cover_failures":2,"title_cover_penalty":1800,"native_trace_blockers":0,"native_trace_hits_total":74,"native_trace_unique_breakpoints":11,"false_positives":0,"offline_face_source_ready":1,"removed path_cpu_texture_bridge_ready":0,"offline_face_texture_runtime_drawn":0,"stylized_facedata_pixel_oracle":0,"real_portrait_asset_candidates":0,"profile_placeholder_assets_only":1},"status":"discard","description":"Static RE classifies ProfileSelect MenuWindowJob helper side effects","timestamp":1782613441104,"segment":2,"confidence":null,"asi":{"hypothesis":"Classify the specific helper side effects executed by MenuWindowJob::Run for the ProfileSelect one-tick run so a future cleanup can replace the required semantic side effect instead of replaying a false-positive ProfileSelect panel.","static_finding":"Ghidra decompiles: FUN_140814fc0 consumes a result tuple and dispatches to FUN_1408156a0/FUN_140815380 or caches globals at 0x143b355e0. FUN_140744ed0 is window/visibility activation: constructs SceneObjProxy from MenuWindow+0x188, sets Scaleform visible=true, gotoAndPlay FadeIn on value+0x18, invokes a MenuWindow callback at +0xd8 if present, and ORs CSMenuMan field90[window_id] with 3. FUN_140733ff0 appends a pointer into a fixed vector at param_1+0x48 through FUN_1407340e0. FUN_140766430 writes a CSMenuMan field90 table word. Likely ProfileSelect survival side effect is window activation/CSMenuMan marking or vector registration, not portrait rendering.","memory_recorded":"bd remember menuwindowjob-run-side-effect-helpers-2026-06-27","validation":"Ghidra decompile helper dump addresses 0x140814fc0, 0x140744ed0, 0x140733ff0, 0x140766430 plus nested 0x1407340e0/0x140747a80/0x140733440/0x140815380/0x1408156a0; run_experiment ./.auto/measure.sh without runtime trigger.","rollback_reason":"Primary metric stayed 0; this was static RE triage only, not a visible portrait-cover implementation.","next_action_hint":"Next iteration should instrument or selectively bypass one helper at a time around the existing ProfileSelect one-tick run: first test whether skipping the visual/visibility work in FUN_140744ed0 while preserving CSMenuMan/vector side effects keeps world_stable and reduces visual false-positive risk. Do not remove the whole MenuWindowJob run hook again."}}
{"run":524,"commit":"4dc167b","metric":0,"metrics":{"readiness_gate_failures":0,"target_constants_remaining":0,"helpers_missing":0,"fixed_wait_predicates":0,"autoload_static_failures":0,"asset_chain_failures":0,"dll_patch_failures":0,"native_continue_failures":0,"field58_gate_failures":0,"direct_shortcut_failures":0,"input_path_failures":0,"runtime_proof_failures":0,"runtime_mode_failures":0,"eula_popup_failures":0,"save_data_popup_failures":0,"messagebox_dialog_failures":0,"server_status_failures":0,"title_cover_failures":2,"title_cover_penalty":1800,"native_trace_blockers":0,"native_trace_hits_total":74,"native_trace_unique_breakpoints":11,"false_positives":1,"offline_face_source_ready":1,"removed path_cpu_texture_bridge_ready":0,"offline_face_texture_runtime_drawn":0,"stylized_facedata_pixel_oracle":0,"real_portrait_asset_candidates":0,"profile_placeholder_assets_only":1},"status":"discard","description":"ProfileSelect window-activation bypass hook collided before runtime test","timestamp":1782613700064,"segment":2,"confidence":null,"asi":{"hypothesis":"Hook the live helper corresponding to dump FUN_140744ed0 only while the ProfileSelect one-tick run is active, skip its visible/FadeIn activation, and reproduce only its CSMenuMan field90 mark. This tests whether product survival depends on semantic MenuWindow/CSMenuMan marking rather than visible ProfileSelect rendering.","implementation":"Added TITLE_PROFILE_SELECT_WINDOW_ACTIVATE_RVA=0x744dd0 and a MinHook detour that would bypass only during TITLE_CUSTOM_COVER_RUN_RECURSION, OR CSMenuMan+0x90[menu_id] with 3, and return without visible/FadeIn work. Wired installer before the ProfileSelect run hook.","artifact":"/home/banon/projects/er-effects-rs/target/runtime-probe/product-continue-direct-20260627-192726","finding":"Runtime reached world_stable with Banon, but the intended bypass did not install: debug log reported `MhHook::new ProfileSelect window-activate bypass failed: MH_ERROR_ALREADY_CREATED` at +153ms. The normal ProfileSelect one-tick run still occurred; telemetry still had profile_face_transform_applied=true and portrait_visible_surface_bound=true without portrait_pixels_visible, so false_positives=1. This run does not falsify or validate the bypass hypothesis; it only shows the chosen target address/hook collides with an existing hook or maps to an already-hooked function.","validation":"cargo fmt; bash -n .auto/measure.sh; cargo xwin build --release --target x86_64-pc-windows-msvc; Steam preflight; run_experiment ./.auto/measure.sh with .auto/run_runtime_probe_once.","rollback_reason":"Primary metric stayed 0 and the intended hook did not install, so the implementation is not useful to keep.","next_action_hint":"Before retrying the bypass, identify the existing hook at/near live 0x140744dd0 or pick the correct already-hooked path to extend. Do not infer that skipping FUN_140744ed0 is unsafe from this run; it never executed the bypass."}}
{"run":525,"commit":"4dc167b","metric":0,"metrics":{"readiness_gate_failures":0,"target_constants_remaining":0,"helpers_missing":0,"fixed_wait_predicates":0,"autoload_static_failures":0,"asset_chain_failures":0,"dll_patch_failures":0,"native_continue_failures":0,"field58_gate_failures":0,"direct_shortcut_failures":0,"input_path_failures":0,"runtime_proof_failures":0,"runtime_mode_failures":0,"eula_popup_failures":0,"save_data_popup_failures":0,"messagebox_dialog_failures":0,"server_status_failures":0,"title_cover_failures":2,"title_cover_penalty":1800,"native_trace_blockers":0,"native_trace_hits_total":74,"native_trace_unique_breakpoints":11,"false_positives":1,"offline_face_source_ready":1,"removed path_cpu_texture_bridge_ready":0,"offline_face_texture_runtime_drawn":0,"stylized_facedata_pixel_oracle":0,"real_portrait_asset_candidates":0,"profile_placeholder_assets_only":1},"status":"discard","description":"Bypass ProfileSelect FadeIn helper via existing hook; world-stable survives but bind false-positive remains","timestamp":1782613939251,"segment":2,"confidence":null,"asi":{"hypothesis":"The existing Part-A title_native_menu_visual_window_fadein_hook already owns live 0x140744dd0/FUN_140744ed0. Extend that hook so, during TITLE_CUSTOM_COVER_RUN_RECURSION for the ProfileSelect cover window, it returns before calling the original visual/FadeIn helper and preserves only the CSMenuMan visible flag mark when possible. This tests whether ProfileSelect FadeIn/visible activation is required for product survival.","implementation":"Inserted a recursion/cover-window branch at the top of title_native_menu_visual_window_fadein_hook. If window matches cover_job+0x130 during the one-tick replay, it optionally ORs CSMenuMan+0x90[menu_id] with TITLE_NATIVE_MENU_VISUAL_VISIBLE_FLAGS_MASK and returns without calling original FUN_140744ed0. No duplicate MinHook was installed.","artifact":"/home/banon/projects/er-effects-rs/target/runtime-probe/product-continue-direct-20260627-193027","finding":"Runtime reached world_stable with Banon/player_present. Debug log showed the bypass fired: skipped ProfileSelect FadeIn/visible helper during one-tick replay, then ran post-accept custom cover. menu_id was 0xffff, so the CSMenuMan mark did not apply, yet survival still held. Remaining false_positive=1 came from separate bind/transform telemetry: profile_face_transform_applied=true, portrait_visible_surface_bound=true, no portrait_pixels_visible. Therefore FUN_140744ed0 visual/FadeIn activation is not the required survival side effect; the remaining false-positive source is the ProfileSelect bind/transform lane.","memory_recorded":"bd remember profileselect-fadein-bypass-survives-2026-06-27","validation":"cargo fmt; bash -n .auto/measure.sh; cargo xwin build --release --target x86_64-pc-windows-msvc; Steam preflight; run_experiment ./.auto/measure.sh with .auto/run_runtime_probe_once.","rollback_reason":"Primary metric stayed 0 and false_positives remained 1, so discard follows policy despite useful falsification.","next_action_hint":"Combine this existing-hook bypass with disabling the ProfileSelect bind rewrite/SetPosition transform lane, or directly remove that false-positive mutation while preserving the one-tick run. Do not keep treating FUN_140744ed0 visibility as necessary."}}
{"run":526,"commit":"4dc167b","metric":0,"metrics":{"readiness_gate_failures":0,"target_constants_remaining":0,"helpers_missing":0,"fixed_wait_predicates":0,"autoload_static_failures":0,"asset_chain_failures":0,"dll_patch_failures":0,"native_continue_failures":0,"field58_gate_failures":0,"direct_shortcut_failures":0,"input_path_failures":0,"runtime_proof_failures":0,"runtime_mode_failures":0,"eula_popup_failures":0,"save_data_popup_failures":0,"messagebox_dialog_failures":0,"server_status_failures":0,"title_cover_failures":2,"title_cover_penalty":1800,"native_trace_blockers":0,"native_trace_hits_total":74,"native_trace_unique_breakpoints":11,"false_positives":0,"offline_face_source_ready":1,"removed path_cpu_texture_bridge_ready":0,"offline_face_texture_runtime_drawn":0,"stylized_facedata_pixel_oracle":0,"real_portrait_asset_candidates":0,"profile_placeholder_assets_only":1},"status":"discard","description":"Disable ProfileSelect false-positive mutations while preserving one-tick run","timestamp":1782614186127,"segment":2,"confidence":null,"asi":{"hypothesis":"Combine prior falsifications: keep the one-tick ProfileSelect MenuWindowJob run side effect, but use the existing FadeIn-helper hook to skip ProfileSelect visual activation and disable the ProfileSelect dummy-profile bind rewrite plus SetPosition/SetScale transform. This should preserve world load while removing the known false-positive ProfileSelect visual semaphores.","implementation":"Added a recursion/cover-window branch at the top of title_native_menu_visual_window_fadein_hook that returns before original FUN_140744ed0 for the ProfileSelect cover window; changed title_scaleform_bind_observer_hook to observe but not rewrite MENU_DummyProfileFace_01 -> SYSTEX_Menu_Profile00; changed title_custom_cover_menu_window_run_hook to log but not transform TITLE_PROFILE_FACE_LAST_VALUE.","artifact":"/home/banon/projects/er-effects-rs/target/runtime-probe/product-continue-direct-20260627-193453","finding":"Runtime reached world_stable with Banon/player_present and false_positives=0. Telemetry: oracle_title_custom_cover_run_calls=1, profile_face_transform_applied=false, portrait_visible_surface_bound=false, portrait_pixels_visible absent, profile_cover_bound_to_logo_surface=false. Debug log confirmed dummy-profile bind was left unmodified, FadeIn/visible helper was skipped during one-tick replay, ProfileSelect value was observed with transform disabled, and post-accept custom cover still ran. The false-positive ProfileSelect visual mutations are not needed for world load, but this still provides no real portrait pixels/native surface.","memory_recorded":"bd remember profileselect-false-positive-mutations-disabled-survives-2026-06-27","validation":"cargo fmt; bash -n .auto/measure.sh; cargo xwin build --release --target x86_64-pc-windows-msvc; Steam preflight; run_experiment ./.auto/measure.sh with .auto/run_runtime_probe_once.","rollback_reason":"Primary metric stayed 0; although false_positives improved to 0, no final portrait-cover oracle was added. Discard follows primary-metric policy.","next_action_hint":"Reapply this cleanup as a base only when implementing the next native/non-removed path portrait surface. The next primary-scoring path must add a real portrait surface/oracle rather than further tuning ProfileSelect semaphores."}}
{"run":527,"commit":"4dc167b","metric":0,"metrics":{"readiness_gate_failures":0,"target_constants_remaining":0,"helpers_missing":0,"fixed_wait_predicates":0,"autoload_static_failures":0,"asset_chain_failures":0,"dll_patch_failures":0,"native_continue_failures":0,"field58_gate_failures":0,"direct_shortcut_failures":0,"input_path_failures":0,"runtime_proof_failures":0,"runtime_mode_failures":0,"eula_popup_failures":0,"save_data_popup_failures":0,"messagebox_dialog_failures":0,"server_status_failures":0,"title_cover_failures":2,"title_cover_penalty":1800,"native_trace_blockers":0,"native_trace_hits_total":74,"native_trace_unique_breakpoints":11,"false_positives":0,"offline_face_source_ready":1,"removed path_cpu_texture_bridge_ready":0,"offline_face_texture_runtime_drawn":0,"stylized_facedata_pixel_oracle":0,"real_portrait_asset_candidates":0,"profile_placeholder_assets_only":1},"status":"discard","description":"Static RE confirms MenuResource resolver is constructor-time, not runtime portrait bridge","timestamp":1782614351952,"segment":2,"confidence":null,"asi":{"hypothesis":"Inspect the prompt's suggested MenuResource->SceneObjProxy resolver path to determine whether it can be used as a native/non-removed path runtime portrait display bridge for TitleBackViewParts or whether it is constructor-only plumbing.","static_finding":"Ghidra decompile: FUN_140749290 checks MenuResource+0x60, derives a name from MenuResource+0x48, constructs a Scaleform object from MenuResource+8, optionally assignComponentWithName(name), then copies the resulting SceneObjProxy into param_2. TitleBackViewParts ctor FUN_1409a62d0 constructs a MenuResource at this+0x8 and immediately calls FUN_140749290(this+0x8,this+0x70). Other xrefs are similar view-part constructors/helpers. FUN_1407acbf0 builds MenuWindowJob objects from CSScaleformLoadInfo and callbacks. This reinforces that late rebinding an already-live 05_001_Title_Logo SceneObjProxy through FUN_140749290 is the wrong layer; a custom native surface must be constructed as its own MenuWindow/Scaleform target or via engine draw surface.","memory_recorded":"bd remember menuresource-resolver-constructor-only-static-2026-06-27","validation":"Ghidra decompile 0x140749290, 0x1409a62d0, 0x1407acbf0, and resolver callers 0x140749400/0x1409a1ec0/0x140997310; run_experiment ./.auto/measure.sh without runtime trigger.","rollback_reason":"Primary metric stayed 0; this was static RE triage, not a visible portrait-cover implementation.","next_action_hint":"Stop treating FUN_140749290 as a late update/rebind bridge. Next primary path should either construct a separate custom MenuWindow/Scaleform surface that already contains a dummy-profile/SYSTEX symbol and consumes profile renderer output, or pivot to an engine draw-surface command; do not keep fighting the live TitleBackViewParts resolver."}}
{"run":528,"commit":"4dc167b","metric":0,"metrics":{"readiness_gate_failures":0,"target_constants_remaining":0,"helpers_missing":0,"fixed_wait_predicates":0,"autoload_static_failures":0,"asset_chain_failures":0,"dll_patch_failures":0,"native_continue_failures":0,"field58_gate_failures":0,"direct_shortcut_failures":0,"input_path_failures":0,"runtime_proof_failures":0,"runtime_mode_failures":0,"eula_popup_failures":0,"save_data_popup_failures":0,"messagebox_dialog_failures":0,"server_status_failures":0,"title_cover_failures":2,"title_cover_penalty":1800,"native_trace_blockers":0,"native_trace_hits_total":74,"native_trace_unique_breakpoints":11,"false_positives":0,"offline_face_source_ready":1,"removed path_cpu_texture_bridge_ready":0,"offline_face_texture_runtime_drawn":0,"stylized_facedata_pixel_oracle":0,"real_portrait_asset_candidates":0,"profile_placeholder_assets_only":1},"status":"discard","description":"Static RE maps RendMan/CSEzDraw path and rules out simple portrait blit bridge","timestamp":1782614505563,"segment":2,"confidence":null,"asi":{"hypothesis":"After MenuResource resolver proved constructor-only and removed path/title-overlay routes are off-limits, inspect native RendMan/CSEzDraw/CSEzOffscreenRend draw path for a simple non-removed path portrait display bridge or blit/readback point.","static_finding":"Ghidra: CSDrawStep FUN_140b14520 drives RendMan phases. FUN_140cc7200 sets g_GxDrawContext state, binds viewport/render-target helpers FUN_1419e0820/FUN_141aca7d0, constructs FD4HkDrawSceneContext, executes existing CSEzDraw queues at RendMan+0x28/+0x30 through FUN_142650030, and closes with FUN_141aca560/FUN_1419e1570. FUN_140cc7140 executes RendMan+0x38 queue. FUN_142650030 is only CSEzDraw::Draw: lock commandQueueMutex and run the alternate drawCommandBuffer via FUN_14269b4f0. CSEzOffscreenRend ctor FUN_140bb6c50 creates an offscreen target and registers CSRuntimeTexResCap in TexRepository; setup FUN_140bb7440 builds cameras, GXSgSceneFactory scene/layer/drawable/model display plumbing. No obvious one-call late portrait blit/readback/update bridge appears in these functions.","memory_recorded":"bd remember native-rendman-csezdraw-path-static-2026-06-27","validation":"Ghidra decompile 0x140b14520, 0x140cc7200, 0x140cc7140, 0x140bb7440, 0x140bb6c50, 0x142650030; run_experiment ./.auto/measure.sh without runtime trigger.","rollback_reason":"Primary metric stayed 0; this was static RE triage, not a visible portrait-cover implementation.","next_action_hint":"Do not chase a nonexistent simple blit/readback helper here. Next primary path should either identify the CSEzDraw command buffer format and inject a valid textured quad command into an existing RendMan queue, or construct a real Scaleform/MenuWindow consumer for the existing CSRuntimeTexResCap/SYSTEX profile resource."}}
{"run":529,"commit":"4dc167b","metric":0,"metrics":{"readiness_gate_failures":0,"target_constants_remaining":0,"helpers_missing":0,"fixed_wait_predicates":0,"autoload_static_failures":0,"asset_chain_failures":0,"dll_patch_failures":0,"native_continue_failures":0,"field58_gate_failures":0,"direct_shortcut_failures":0,"input_path_failures":0,"runtime_proof_failures":0,"runtime_mode_failures":0,"eula_popup_failures":0,"save_data_popup_failures":0,"messagebox_dialog_failures":0,"server_status_failures":0,"title_cover_failures":2,"title_cover_penalty":1800,"native_trace_blockers":0,"native_trace_hits_total":74,"native_trace_unique_breakpoints":11,"false_positives":0,"offline_face_source_ready":1,"removed path_cpu_texture_bridge_ready":0,"offline_face_texture_runtime_drawn":0,"stylized_facedata_pixel_oracle":0,"real_portrait_asset_candidates":0,"profile_placeholder_assets_only":1},"status":"discard","description":"Verify Scaleform asset/loader path for full-screen portrait+stats custom view","timestamp":1782614804211,"segment":2,"confidence":null,"asi":{"hypothesis":"Given the user clarification that the ideal product is a full-screen custom character portrait with stats below, verify the actual Scaleform assets and loader path instead of trusting memories or assuming we must fight an existing title/ProfileSelect layout. Look for existing profile+stats symbols, local authoring tools, and an in-memory Scaleform load API.","static_finding":"Local extracted GFX scan: only 05_010_ProfileSelect contains MENU_DummyProfileFace_* plus PlayerName/XLevel/StatusBar profile-list symbols; 02_070_Status contains MENU_DummyStatus_Face/PlayerName/Status_page/Status_ and stats symbols but not SYSTEX_Menu_Profile; 01_000_FE is HUD-heavy. Local tooling inventory found FFDEC/export artifacts and scripts/gfx-abc-dump.py, but no obvious Scaleform GFx compiler/authoring binary like gfxexport/gfxfont/gfxmedia. Ghidra loader path FUN_140d6a990 -> FUN_140d786e0 -> FUN_140d7a6e0/FUN_140d7ac70 copies CSScaleformLoadInfo jobResult+filename, resolves/caches by filename/resource, and creates movie objects; no obvious arbitrary in-memory GFX bytes API surfaced in this pass. A clean custom full-screen view likely requires either authoring/modifying a GFX-compatible asset and registering/injecting it by name, or deeper RE of ScaleformSystem resource/file-opener interfaces for memory-backed bytes.","memory_recorded":"bd remember scaleform-custom-view-asset-loader-static-2026-06-27","ideas_updated":".auto/ideas.md appended with Scaleform full-screen portrait+stats path","validation":"Read-only local GFX symbol scan under /home/banon/er-extract/nuxe-menu-20260619-170932/menu; local tooling inventory; Ghidra decompile 0x140d6a990, 0x140d786e0, 0x140d7a6e0, 0x140d7ac70; run_experiment ./.auto/measure.sh without runtime trigger.","rollback_reason":"Primary metric stayed 0; this was verified static/tooling triage, not a visible portrait-cover implementation.","next_action_hint":"Continue RE below FUN_140d7ac70 into the Scaleform file/resource opener to see whether a DLL can supply memory-backed GFX bytes by filename. If not, the practical path is an offline-authored/modified GFX-compatible asset registered into the existing cache path, not remapping existing title/ProfileSelect views."}}
