{"run":145,"commit":"2100051","metric":0,"metrics":{"readiness_gate_failures":0,"target_constants_remaining":0,"helpers_missing":0,"fixed_wait_predicates":0,"autoload_static_failures":0,"asset_chain_failures":0,"dll_patch_failures":0,"native_continue_failures":0,"field58_gate_failures":0,"direct_shortcut_failures":0,"input_path_failures":0,"runtime_proof_failures":1,"runtime_mode_failures":0,"eula_popup_failures":0,"save_data_popup_failures":0,"messagebox_dialog_failures":0,"server_status_failures":0,"title_cover_failures":0,"title_cover_penalty":0,"native_trace_blockers":0,"native_trace_hits_total":74,"native_trace_unique_breakpoints":11,"false_positives":0,"runtime_timeout_failures":0,"runtime_title_visual_suppressed_builds":0,"runtime_custom_cover_builds":0,"runtime_simulated_button_presses_total":0},"status":"crash","description":"attempted one-shot runtime proof but run_experiment guard rejected custom command","timestamp":1782410316875,"segment":0,"confidence":null,"asi":{"hypothesis":"Arm .auto/run_runtime_probe_once and run .auto/measure.sh so the built-in one-shot runtime path can try to close runtime_proof_failures without custom benchmark logic.","rollback_reason":"run_experiment guard rejected the combined command `touch .auto/run_runtime_probe_once && ./.auto/measure.sh`; it requires running .auto/measure.sh directly. No Elden Ring launch occurred.","next_action_hint":"Arm .auto/run_runtime_probe_once with a separate shell command, then call run_experiment with exactly `./.auto/measure.sh`. This follows the guard and still uses the benchmark's built-in runtime path."}}
{"run":146,"commit":"2100051","metric":0,"metrics":{"readiness_gate_failures":0,"target_constants_remaining":0,"helpers_missing":0,"fixed_wait_predicates":0,"autoload_static_failures":0,"asset_chain_failures":0,"dll_patch_failures":0,"native_continue_failures":0,"field58_gate_failures":0,"direct_shortcut_failures":0,"input_path_failures":0,"runtime_proof_failures":1,"runtime_mode_failures":0,"eula_popup_failures":0,"save_data_popup_failures":0,"messagebox_dialog_failures":0,"server_status_failures":0,"title_cover_failures":0,"title_cover_penalty":0,"native_trace_blockers":0,"native_trace_hits_total":74,"native_trace_unique_breakpoints":11,"false_positives":0,"runtime_timeout_failures":1,"runtime_title_visual_suppressed_builds":0,"runtime_custom_cover_builds":0,"runtime_simulated_button_presses_total":0},"status":"crash","description":"one-shot runtime proof timed out during measure launch/setup path","timestamp":1782410431932,"segment":0,"confidence":null,"asi":{"hypothesis":"The built-in one-shot runtime path in .auto/measure.sh may produce a fresh product-core artifact and close runtime_proof_failures without custom benchmark logic.","rollback_reason":"run_experiment timed out after launch/setup output before METRIC lines. Exact post-timeout scan found no eldenring.exe/start_protected_game.exe process remaining.","next_action_hint":"Inspect target/runtime-probe/product-continue-direct-20260625-105851 for partial evidence and whether cleanup/teardown completed; if useful, shorten the runtime setup path or prebuild/deploy outside run_experiment before trying another one-shot runtime proof.","artifact_dir":"/home/banon/projects/er-effects-rs/target/runtime-probe/product-continue-direct-20260625-105851"}}
{"run":147,"commit":"2100051","metric":0,"metrics":{"readiness_gate_failures":0,"target_constants_remaining":0,"helpers_missing":0,"fixed_wait_predicates":0,"autoload_static_failures":0,"asset_chain_failures":0,"dll_patch_failures":0,"native_continue_failures":0,"field58_gate_failures":0,"direct_shortcut_failures":0,"input_path_failures":0,"runtime_proof_failures":1,"runtime_mode_failures":0,"eula_popup_failures":0,"save_data_popup_failures":0,"messagebox_dialog_failures":0,"server_status_failures":0,"title_cover_failures":0,"title_cover_penalty":0,"native_trace_blockers":0,"native_trace_hits_total":74,"native_trace_unique_breakpoints":11,"false_positives":0,"runtime_timeout_failures":1,"runtime_title_visual_suppressed_builds":1,"runtime_custom_cover_builds":1,"runtime_simulated_button_presses_total":0},"status":"crash","description":"passive sequence iterator lambda_fcab diagnostic timed out without runtime proof","timestamp":1782410900085,"segment":0,"confidence":null,"asi":{"hypothesis":"A capped read-only scan in the existing Sequence iterator can fingerprint native children containing the lambda_fcab std::function vtable root (base+0x2b26c80), giving a passive oracle for whether the preserved title sequence reaches the appended Continue-arm functor without cold-calling it.","rollback_reason":"Runtime harness timed out before METRIC lines, so the primary metric is 0/crash. Artifact contained no SEQ-ITER-LAMBDA-FCAB trace hit before timeout; product remained on idle false-accept MenuWindowJob candidates and never submitted native Continue.","next_action_hint":"Do not keep the reverted diagnostic as-is. The artifact suggests either the Sequence iterator path did not walk the lambda_fcab child under current title timing or append_continue_trace was not emitted in this runtime mode. Next static target should identify the actual MenuFunctorJob::Run/vtable body for lambda_fcab and add a direct passive run-hook or telemetry counter, rather than relying only on child-array scanning.","artifact_dir":"/home/banon/projects/er-effects-rs/target/runtime-probe/product-continue-direct-20260625-110607","guard_event":"Cupcake correctly blocked a compound Bash preflight/arm command using &&; subsequent calls were split into single-purpose pgrep and touch commands. Future iterations should avoid compound Bash when arming runtime markers."}}
{"run":148,"commit":"2100051","metric":0,"metrics":{"readiness_gate_failures":0,"target_constants_remaining":0,"helpers_missing":0,"fixed_wait_predicates":0,"autoload_static_failures":0,"asset_chain_failures":0,"dll_patch_failures":0,"native_continue_failures":0,"field58_gate_failures":0,"direct_shortcut_failures":0,"input_path_failures":0,"runtime_proof_failures":1,"runtime_mode_failures":0,"eula_popup_failures":0,"save_data_popup_failures":0,"messagebox_dialog_failures":0,"server_status_failures":0,"title_cover_failures":0,"title_cover_penalty":0,"native_trace_blockers":0,"native_trace_hits_total":74,"native_trace_unique_breakpoints":11,"false_positives":0,"runtime_timeout_failures":1,"runtime_title_visual_suppressed_builds":1,"runtime_custom_cover_builds":1,"runtime_simulated_button_presses_total":0},"status":"crash","description":"passive lambda_fcab invoke hook saw no native Continue-arm execution before timeout","timestamp":1782411301299,"segment":0,"confidence":null,"asi":{"hypothesis":"Hooking the known lambda_fcab invoke wrapper at deobf 0x1409b10a0 as a passive pass-through counter should reveal whether the preserved native title sequence actually reaches the native Continue-arm functor; this does not cold-call or promote the functor.","rollback_reason":"Runtime harness timed out before METRIC lines. Artifact telemetry shows oracle_title_continue_lambda_fcab_invoke_hits=0, native_submit_hits=0, and the run remained on idle false-accept MenuWindowJob candidates. The diagnostic did not improve the primary metric and should not be kept as product behavior.","next_action_hint":"Static RE should now move one level earlier: identify why the native sequence never reaches the lambda_fcab node under current title state. Decode the prerequisite sibling job appended before lambda_fcab in FUN_1409ad9b0 (vtable 0x142b26c48 / builder at the second FUN_140744b60 call) or the chain condition that prevents R14 from running, rather than adding more hooks to lambda_fcab itself.","artifact_dir":"/home/banon/projects/er-effects-rs/target/runtime-probe/product-continue-direct-20260625-111258","evidence":"readiness-result.json: oracle_title_continue_lambda_fcab_invoke_hits=0; oracle_menu_continue_candidate_idle_accept_hits=586; oracle_title_native_menu_visual_suppressed_builds=1; oracle_title_custom_cover_profile_select_builds=1; simulated_button_presses_total=0","build_note":"Initial build failed because TraceSampleLimit::Value16 does not exist; fixed to Value12 before the runtime experiment."}}
{"run":149,"commit":"2100051","metric":1520,"metrics":{"readiness_gate_failures":0,"target_constants_remaining":0,"helpers_missing":0,"fixed_wait_predicates":0,"autoload_static_failures":0,"asset_chain_failures":0,"dll_patch_failures":0,"native_continue_failures":0,"field58_gate_failures":0,"direct_shortcut_failures":0,"input_path_failures":0,"runtime_proof_failures":1,"runtime_mode_failures":0,"eula_popup_failures":0,"save_data_popup_failures":0,"messagebox_dialog_failures":0,"server_status_failures":0,"title_cover_failures":0,"title_cover_penalty":0,"native_trace_blockers":0,"native_trace_hits_total":74,"native_trace_unique_breakpoints":11,"false_positives":0,"runtime_timeout_failures":0,"runtime_title_visual_suppressed_builds":1,"runtime_custom_cover_builds":1,"runtime_simulated_button_presses_total":0},"status":"discard","description":"static corrected lambda_fcab sequence ordering and remeasured current oracle","timestamp":1782411462234,"segment":0,"confidence":null,"asi":{"hypothesis":"Static Ghidra decompile of FUN_1409ad9b0 would test the prior next-action assumption that a sibling job before lambda_fcab blocks execution, without adding another runtime hook or cold-calling native functions.","rollback_reason":"Primary metric remained 1520, equal to the persisted best, and runtime_proof_failures remains 1. This iteration produced a durable RE correction but no product proof improvement.","next_action_hint":"Do not chase a sibling job immediately before lambda_fcab as the blocker. The decompile shows lambda_fcab is followed by lambda_8a48 and then the OK/ProfileSelect/dialog chain; since both Sequence-child and direct invoke hooks saw zero hits, next target is the earlier condition/path that prevents FUN_1409ad9b0's composed sequence from being entered/ticked under current title timing.","static_finding_key":"autoload-9ad9b0-lambda-fcab-order-correction-2026-06-25","evidence":"Ghidra DecompAddr on dump 0x1409ad9b0: lambda_fcab sStack_c48 is built via FUN_140744b60, cloned, then sibling lambda_8a48 sStack_c08 is built, followed by OK/ProfileSelect/dialog jobs and sequence composition. Runtime artifacts #147/#148 had zero lambda_fcab sequence/invoke hits."}}
{"run":150,"commit":"2100051","metric":1520,"metrics":{"readiness_gate_failures":0,"target_constants_remaining":0,"helpers_missing":0,"fixed_wait_predicates":0,"autoload_static_failures":0,"asset_chain_failures":0,"dll_patch_failures":0,"native_continue_failures":0,"field58_gate_failures":0,"direct_shortcut_failures":0,"input_path_failures":0,"runtime_proof_failures":1,"runtime_mode_failures":0,"eula_popup_failures":0,"save_data_popup_failures":0,"messagebox_dialog_failures":0,"server_status_failures":0,"title_cover_failures":0,"title_cover_penalty":0,"native_trace_blockers":0,"native_trace_hits_total":74,"native_trace_unique_breakpoints":11,"false_positives":0,"runtime_timeout_failures":0,"runtime_title_visual_suppressed_builds":1,"runtime_custom_cover_builds":1,"runtime_simulated_button_presses_total":0},"status":"discard","description":"static traced 9ad9b0 wrapper chain and remeasured current oracle","timestamp":1782411695937,"segment":0,"confidence":null,"asi":{"hypothesis":"Static Ghidra xrefs/decompilation of FUN_1409ad9b0 callers would reveal whether a wrapper-level condition prevents the composed title sequence/lambda_fcab path from being entered.","rollback_reason":"Primary metric remained 1520, equal to the persisted best, and runtime_proof_failures remains 1. The iteration produced a static RE finding only, not a product proof improvement.","next_action_hint":"Add a passive runtime counter at FUN_1409ad9b0 or its wrapper parents 0x1409a7e50/0x1409a8150 to distinguish builder-never-entered from builder-entered-but-sequence-not-ticked. Do not cold-call those wrappers or ChainMenuJobs.","static_finding_key":"autoload-9ad9b0-wrapper-chain-no-condition-2026-06-25","evidence":"Ghidra XrefCallers/DecompAddr: FUN_1409ad9b0 has code callers FUN_1409a8b50 and FUN_1409a9b90; those are reached by FUN_1409a6ec0/FUN_1409a7230 and then FUN_1409a7e50/FUN_1409a8150. The wrapper bodies only forward arguments; no semantic condition appears there."}}
{"run":151,"commit":"2100051","metric":0,"metrics":{"readiness_gate_failures":0,"target_constants_remaining":0,"helpers_missing":0,"fixed_wait_predicates":0,"autoload_static_failures":0,"asset_chain_failures":0,"dll_patch_failures":0,"native_continue_failures":0,"field58_gate_failures":0,"direct_shortcut_failures":0,"input_path_failures":0,"runtime_proof_failures":1,"runtime_mode_failures":0,"eula_popup_failures":0,"save_data_popup_failures":0,"messagebox_dialog_failures":0,"server_status_failures":0,"title_cover_failures":0,"title_cover_penalty":0,"native_trace_blockers":0,"native_trace_hits_total":74,"native_trace_unique_breakpoints":11,"false_positives":0,"runtime_timeout_failures":1,"runtime_title_visual_suppressed_builds":1,"runtime_custom_cover_builds":1,"runtime_simulated_button_presses_total":0},"status":"crash","description":"passive title sequence builder counters showed builder chain never entered before timeout","timestamp":1782412071317,"segment":0,"confidence":null,"asi":{"hypothesis":"Passive counters at FUN_1409ad9b0 and parent wrappers 0x1409a7e50/0x1409a8150 should distinguish builder-never-entered from builder-entered-but-sequence-not-ticked without cold-calling native code.","rollback_reason":"Runtime harness timed out before METRIC lines. Artifact telemetry shows all three new title sequence counters stayed zero, native_submit_hits=0, and the run remained on idle false-accept MenuWindowJob candidates. The diagnostic did not improve the primary metric and should be reverted.","next_action_hint":"Static target is now the native job/table/state that selects or schedules the 9a7e50/9a8150 wrapper chain. Do not keep chasing lambda_fcab, FUN_1409ad9b0 internals, or ChainMenuJobs execution until that selector/scheduler is identified.","artifact_dir":"/home/banon/projects/er-effects-rs/target/runtime-probe/product-continue-direct-20260625-112530","static_finding_key":"autoload-title-seq-builder-chain-never-entered-2026-06-25","evidence":"readiness-result.json: oracle_title_seq_builder_9ad9b0_hits=0, oracle_title_seq_parent_9a7e50_hits=0, oracle_title_seq_parent_9a8150_hits=0, oracle_menu_continue_candidate_idle_accept_hits=555, oracle_title_native_menu_visual_suppressed_builds=1, oracle_title_custom_cover_profile_select_builds=1, simulated_button_presses_total=0"}}
{"run":152,"commit":"2100051","metric":1520,"metrics":{"readiness_gate_failures":0,"target_constants_remaining":0,"helpers_missing":0,"fixed_wait_predicates":0,"autoload_static_failures":0,"asset_chain_failures":0,"dll_patch_failures":0,"native_continue_failures":0,"field58_gate_failures":0,"direct_shortcut_failures":0,"input_path_failures":0,"runtime_proof_failures":1,"runtime_mode_failures":0,"eula_popup_failures":0,"save_data_popup_failures":0,"messagebox_dialog_failures":0,"server_status_failures":0,"title_cover_failures":0,"title_cover_penalty":0,"native_trace_blockers":0,"native_trace_hits_total":74,"native_trace_unique_breakpoints":11,"false_positives":0,"runtime_timeout_failures":0,"runtime_title_visual_suppressed_builds":1,"runtime_custom_cover_builds":1,"runtime_simulated_button_presses_total":0},"status":"discard","description":"static traced title sequence top wrappers to data-only vtable refs","timestamp":1782412255029,"segment":0,"confidence":null,"asi":{"hypothesis":"Static xrefs/decompilation of the selector/scheduler chain above 9a7e50/9a8150 would identify whether there are more code-level conditions or whether dispatch becomes data/vtable-owned.","rollback_reason":"Primary metric remained 1520, equal to the persisted best, and runtime_proof_failures remains 1. This iteration produced a static RE finding only.","next_action_hint":"Identify constructors or typed owners of the data/vtable region around 0x142b26860..0x142b26950 (refs to top wrappers 0x1409b11f0 and 0x1409b0970). Determine how native title state chooses those vtable slots; do not treat .pdata/unwind refs as gameplay dispatch and do not cold-call wrapper functions.","static_finding_key":"autoload-title-seq-top-wrappers-data-only-2026-06-25","evidence":"Ghidra XrefCallers/DecompAddr: 9a7e50<-9a7480<-9b0970 and 9a8150<-9a7a20<-9b11f0; xrefs to 9b0970/9b11f0 are data-only at 0x142b26948/0x142b268a0 plus metadata, no normal code callers."}}
{"run":153,"commit":"2100051","metric":1520,"metrics":{"readiness_gate_failures":0,"target_constants_remaining":0,"helpers_missing":0,"fixed_wait_predicates":0,"autoload_static_failures":0,"asset_chain_failures":0,"dll_patch_failures":0,"native_continue_failures":0,"field58_gate_failures":0,"direct_shortcut_failures":0,"input_path_failures":0,"runtime_proof_failures":1,"runtime_mode_failures":0,"eula_popup_failures":0,"save_data_popup_failures":0,"messagebox_dialog_failures":0,"server_status_failures":0,"title_cover_failures":0,"title_cover_penalty":0,"native_trace_blockers":0,"native_trace_hits_total":74,"native_trace_unique_breakpoints":11,"false_positives":0,"runtime_timeout_failures":0,"runtime_title_visual_suppressed_builds":1,"runtime_custom_cover_builds":1,"runtime_simulated_button_presses_total":0},"status":"discard","description":"static identified CommandSelectDialog owner for title sequence vtable region","timestamp":1782412409326,"segment":0,"confidence":null,"asi":{"hypothesis":"Identifying constructors/typed owners for data/vtable region 0x142b26860..0x142b26950 would reveal the scheduler above the never-entered title sequence wrapper chain without adding runtime hooks or cold-calling native code.","rollback_reason":"Primary metric remained 1520, equal to the persisted best, and runtime_proof_failures remains 1. The iteration produced a static RE finding only.","next_action_hint":"Static xrefs/callers of FUN_1409aa070 and the CommandSelectDialog state/table should identify what decides to instantiate the composed job. Do not cold-call FUN_1409abd80/FUN_1409aa070/ChainMenuJobs.","static_finding_key":"autoload-title-seq-commandselectdialog-owner-2026-06-25","evidence":"Ghidra: vtable root 0x142b26900 belongs to std::_Func_impl<lambda_5903..., DLReferencePointer<CS::MenuJob>, CS::CommandSelectDialog&>; helpers 0x1409b1cb0/0x1409aff80/0x1409ab400 write/copy/destroy it; FUN_1409aa070 calls FUN_1409abd80 then ChainMenuJobs with lambda_4f61."}}
{"run":154,"commit":"2100051","metric":1520,"metrics":{"readiness_gate_failures":0,"target_constants_remaining":0,"helpers_missing":0,"fixed_wait_predicates":0,"autoload_static_failures":0,"asset_chain_failures":0,"dll_patch_failures":0,"native_continue_failures":0,"field58_gate_failures":0,"direct_shortcut_failures":0,"input_path_failures":0,"runtime_proof_failures":1,"runtime_mode_failures":0,"eula_popup_failures":0,"save_data_popup_failures":0,"messagebox_dialog_failures":0,"server_status_failures":0,"title_cover_failures":0,"title_cover_penalty":0,"native_trace_blockers":0,"native_trace_hits_total":74,"native_trace_unique_breakpoints":11,"false_positives":0,"runtime_timeout_failures":0,"runtime_title_visual_suppressed_builds":1,"runtime_custom_cover_builds":1,"runtime_simulated_button_presses_total":0},"status":"discard","description":"static traced CommandSelectDialog factory wrappers through 9a8250","timestamp":1782412561059,"segment":0,"confidence":null,"asi":{"hypothesis":"Static xrefs/callers of FUN_1409aa070 and CommandSelectDialog factory context would reveal the selector path above the composed job without runtime hooks or cold-calling native code.","rollback_reason":"Primary metric remained 1520, equal to the persisted best, and runtime_proof_failures remains 1. This iteration produced a static RE finding only.","next_action_hint":"Decode FUN_1409a7c40 and its data/vtable owner; the 9aa070/9a7360/9a8250 bodies are thin wrappers with no semantic condition. Continue avoiding cold calls to FUN_1409aa070/FUN_1409abd80/ChainMenuJobs or wrappers.","static_finding_key":"autoload-commandselectdialog-factory-wrapper-chain-2026-06-25","evidence":"Ghidra XrefCallers/DecompAddr: FUN_1409aa070 <- FUN_1409a7360 <- FUN_1409a8250 <- FUN_1409a7c40; FUN_1409aa070 builds lambda_4f61 + lambda_5903/CommandSelectDialog via FUN_1409abd80 and ChainMenuJobs."}}
