{"run":309,"commit":"04f75f1","metric":720,"metrics":{"readiness_gate_failures":0,"target_constants_remaining":0,"helpers_missing":0,"fixed_wait_predicates":0,"autoload_static_failures":0,"asset_chain_failures":0,"dll_patch_failures":0,"native_continue_failures":0,"field58_gate_failures":0,"direct_shortcut_failures":0,"input_path_failures":0,"runtime_proof_failures":1,"runtime_mode_failures":0,"eula_popup_failures":0,"save_data_popup_failures":0,"messagebox_dialog_failures":0,"server_status_failures":0,"title_cover_failures":4,"title_cover_penalty":800,"native_trace_blockers":0,"native_trace_hits_total":74,"native_trace_unique_breakpoints":11,"false_positives":0,"runtime_timeout_failures":0,"runtime_title_visual_suppressed_builds":0,"runtime_custom_cover_builds":0,"runtime_simulated_button_presses_total":0},"status":"keep","description":"remove unsafe loading-layer vtable deref and add static guard","timestamp":1782455725687,"segment":0,"confidence":null,"asi":{"hypothesis":"The vtable-latch crash branch remained in source despite the crash log. Remove runtime child-vtable dereferences, restore the validated pointer/mask-only RenderMan loading-layer telemetry, and add an executable guard so future iterations cannot reintroduce unsafe loading-screen layer derefs.","evidence":"Source no longer contains VISIBLE_LAST_SLOT_28_VTABLE/oracle_render_loading_visible_slot_28_vtable/read_vtable closure in constants.rs or telemetry.rs. check-autoload-happy-path.py now defines loading_layer_runtime_deref_guarded() and fails if telemetry/constants contain render-loading child vtable fields or safe_read_usize(rend_slot_*)/safe_read_usize(csgraphics_field68). Direct checker still reports the known title-cover missing failures, but the new guard does not fire. Measure dropped to 720 because the stale crash artifact product-continue-direct-20260625-232857 is still included as no-cover/no-product proof; this is not an optimization gain.","next_action_hint":"Run a marker-gated runtime on the restored pointer/mask-only branch. It should avoid the vtable-deref crash, refresh the runtime proof, and keep using static Ghidra mapping for CSEzDraw/CSScreenCapture class identity. Do not discard this safety patch because discard would restore the unsafe vtable-deref branch."}}
{"run":310,"commit":"04f75f1","metric":0,"metrics":{"readiness_gate_failures":0,"target_constants_remaining":0,"helpers_missing":0,"fixed_wait_predicates":0,"autoload_static_failures":0,"asset_chain_failures":0,"dll_patch_failures":0,"native_continue_failures":0,"field58_gate_failures":0,"direct_shortcut_failures":0,"input_path_failures":0,"runtime_proof_failures":1,"runtime_mode_failures":0,"eula_popup_failures":0,"save_data_popup_failures":0,"messagebox_dialog_failures":0,"server_status_failures":0,"title_cover_failures":4,"title_cover_penalty":800,"native_trace_blockers":0,"native_trace_hits_total":74,"native_trace_unique_breakpoints":11,"false_positives":0,"runtime_timeout_failures":0,"runtime_title_visual_suppressed_builds":0,"runtime_custom_cover_builds":0,"runtime_simulated_button_presses_total":0},"status":"crash","description":"pointer-only loading-layer runtime still exits before submit","timestamp":1782455862799,"segment":0,"confidence":null,"asi":{"hypothesis":"After removing unsafe loading-layer vtable dereferences, a marker-gated runtime should avoid the post-loading exit and refresh runtime proof for the restored pointer/mask-only RenderMan telemetry branch.","evidence":"Runtime artifact /home/banon/projects/er-effects-rs/target/runtime-probe/product-continue-direct-20260625-233647 failed with process_exited_before_ready. It reached the black/loading interval and pointer-only telemetry remained valid: fake_loading_visible_samples=17, render_visible_slots_mask=127, nonnull_samples=17, RendMan slots +0x28/+0x30/+0x38/+0x40/+0x78 and CSGraphics+0x68 all non-null. No vtable child deref fields existed in telemetry. oracle_char_name=Banon, expected_save_match=true, saved_map_c30=0xe000000, zero input, zero MessageBox, but player_present=false and native_continue_chain_stage=pre_submit. Debug log repeatedly rejected MenuWindowJob item 0x7ffe9e52c000 with accept_predicate=0x1407add70 constant false idle predicate.","rollback_reason":"Runtime still failed; the crash is not fixed by removing loading-layer vtable deref. Do not blame RenderMan pointer-only telemetry alone. The active blocker is the title/Continue semantic job readiness path reverting to idle predicate/pre_submit before world-stable.","next_action_hint":"Static-first decode why current branch only sees idle accept predicate 0x1407add70 after black/loading and does not reach the semantic native Continue submit. Compare recent working artifact product-continue-direct-20260625-232519/log against failed 233647 for title accept/submit events; do not add more render-layer runtime derefs."}}
{"run":311,"commit":"04f75f1","metric":0,"metrics":{"readiness_gate_failures":0,"target_constants_remaining":0,"helpers_missing":0,"fixed_wait_predicates":0,"autoload_static_failures":0,"asset_chain_failures":0,"dll_patch_failures":0,"native_continue_failures":0,"field58_gate_failures":0,"direct_shortcut_failures":0,"input_path_failures":0,"runtime_proof_failures":1,"runtime_mode_failures":0,"eula_popup_failures":0,"save_data_popup_failures":0,"messagebox_dialog_failures":0,"server_status_failures":0,"title_cover_failures":4,"title_cover_penalty":800,"native_trace_blockers":0,"native_trace_hits_total":74,"native_trace_unique_breakpoints":11,"false_positives":0,"runtime_timeout_failures":0,"runtime_title_visual_suppressed_builds":0,"runtime_custom_cover_builds":0,"runtime_simulated_button_presses_total":0},"status":"crash","description":"diagnostic-only profile summary still only finds idle Continue predicate","timestamp":1782456009519,"segment":0,"confidence":null,"asi":{"hypothesis":"The early profile-summary empty-like check was too conservative: the runtime save oracle can later report Banon, so the check should be diagnostic-only while the real native Continue MenuWindowJob/action gate remains mandatory.","evidence":"Runtime artifact /home/banon/projects/er-effects-rs/target/runtime-probe/product-continue-direct-20260625-233922 failed with process_exited_before_ready. The edited diagnostic path fired repeatedly: 'Continue slot profile is currently empty-like ... treating as diagnostic only', so the earlier veto was removed. However the native action gate still never found a semantic Continue item; it repeatedly rejected item 0x7ffe9e52c000 with accept_predicate=0x1407add70 constant false idle predicate. No native submit, no input, zero MessageBox; expected_save_match remained true but player/world proof did not complete.","rollback_reason":"The change did not fix the runtime failure and risks weakening a useful fail-closed diagnostic without reaching the native Continue semantic item. Revert and focus on why MENU_CONTINUE_ITEM/CANDIDATE points at the idle MenuWindowJob instead of the real row/action after title accept.","next_action_hint":"Static/diff the producers of MENU_CONTINUE_ITEM, MENU_CONTINUE_CANDIDATE_ITEM, and record_continue_candidate. The next promising fix is to stop promoting or polling the idle 0x1407add70 MenuWindowJob candidate and instead locate the semantic title Continue row/action producer after open_menu."}}
{"run":312,"commit":"cc82aa1","metric":720,"metrics":{"readiness_gate_failures":0,"target_constants_remaining":0,"helpers_missing":0,"fixed_wait_predicates":0,"autoload_static_failures":0,"asset_chain_failures":0,"dll_patch_failures":0,"native_continue_failures":0,"field58_gate_failures":0,"direct_shortcut_failures":0,"input_path_failures":0,"runtime_proof_failures":1,"runtime_mode_failures":0,"eula_popup_failures":0,"save_data_popup_failures":0,"messagebox_dialog_failures":0,"server_status_failures":0,"title_cover_failures":4,"title_cover_penalty":800,"native_trace_blockers":0,"native_trace_hits_total":74,"native_trace_unique_breakpoints":11,"false_positives":0,"runtime_timeout_failures":0,"runtime_title_visual_suppressed_builds":0,"runtime_custom_cover_builds":0,"runtime_simulated_button_presses_total":0},"status":"keep","description":"make Continue candidate diagnostic-only in product submit path","timestamp":1782456111410,"segment":0,"confidence":null,"asi":{"hypothesis":"product_continue_item_action() falls back from MENU_CONTINUE_ITEM to MENU_CONTINUE_CANDIDATE_ITEM. Prior memory and runtime #310/#311 show the candidate can be the disabled/idle 0x1407add70 MenuWindowJob, so the product submit path can chase a diagnostic dead-end instead of waiting for the semantic native-accept Continue item.","evidence":"Changed product_continue_item_action to load only MENU_CONTINUE_ITEM. If it is unset, it logs and ignores MENU_CONTINUE_CANDIDATE_ITEM as diagnostic-only. Existing constructor hooks already promote MENU_CONTINUE_ITEM only when do_call is Continue and accept_predicate is native 0x1407ad810. Added check-autoload-happy-path guard continue_candidate_is_diagnostic_only() that fails if product_continue_item_action falls back to MENU_CONTINUE_CANDIDATE_ITEM. py_compile passed; direct checker reports only known title-cover failures; measure remains 720 because stale failed runtime artifacts dominate.","next_action_hint":"Next marker-gated runtime should no longer repeatedly reject/submit-check the idle 0x1407add70 diagnostic candidate. If it still times out, instrument/RE producers of semantic native-accept row construction rather than polling MENU_CONTINUE_CANDIDATE_ITEM."}}
{"run":313,"commit":"168bc31","metric":1120,"metrics":{"readiness_gate_failures":0,"target_constants_remaining":0,"helpers_missing":0,"fixed_wait_predicates":0,"autoload_static_failures":0,"asset_chain_failures":0,"dll_patch_failures":0,"native_continue_failures":0,"field58_gate_failures":0,"direct_shortcut_failures":0,"input_path_failures":0,"runtime_proof_failures":1,"runtime_mode_failures":0,"eula_popup_failures":0,"save_data_popup_failures":0,"messagebox_dialog_failures":0,"server_status_failures":0,"title_cover_failures":2,"title_cover_penalty":400,"native_trace_blockers":0,"native_trace_hits_total":74,"native_trace_unique_breakpoints":11,"false_positives":0,"runtime_timeout_failures":0,"runtime_title_visual_suppressed_builds":0,"runtime_custom_cover_builds":0,"runtime_simulated_button_presses_total":0},"status":"keep","description":"runtime validates Continue candidate is diagnostic-only","timestamp":1782456195477,"segment":0,"confidence":null,"asi":{"hypothesis":"After removing the product submit fallback to MENU_CONTINUE_CANDIDATE_ITEM, marker-gated runtime should no longer repeatedly reject/submit-check the idle 0x1407add70 MenuWindowJob as if it were a product candidate; it should either wait cleanly for semantic native-accept or preserve world proof.","evidence":"Runtime artifact /home/banon/projects/er-effects-rs/target/runtime-probe/product-continue-direct-20260625-234218 passed with readiness ready=true reason=world_stable. Banon loaded, expected_save_match=true, zero input, zero MessageBox. Debug log now says 'ignoring diagnostic Continue candidate=0x7ffe9e52c000; waiting for semantic native-accept MENU_CONTINUE_ITEM instead' rather than treating idle 0x1407add70 as product submit candidate. Pointer-only RenderMan telemetry remained safe: fake_loading_visible_samples and visible_slots_mask present; profile cover still missing.","next_action_hint":"The remaining score blocker is visual Part B, not candidate poisoning. Continue static RE from the confirmed render-layer/class facts: CSEzDraw layer slots and CSScreenCapture/CSScaleform path; build a non-MenuWindow/custom root-reachable cover surface without dereferencing active draw-layer objects at runtime."}}
{"run":314,"commit":"168bc31","metric":1120,"metrics":{"readiness_gate_failures":0,"target_constants_remaining":0,"helpers_missing":0,"fixed_wait_predicates":0,"autoload_static_failures":0,"asset_chain_failures":0,"dll_patch_failures":0,"native_continue_failures":0,"field58_gate_failures":0,"direct_shortcut_failures":0,"input_path_failures":0,"runtime_proof_failures":1,"runtime_mode_failures":0,"eula_popup_failures":0,"save_data_popup_failures":0,"messagebox_dialog_failures":0,"server_status_failures":0,"title_cover_failures":2,"title_cover_penalty":400,"native_trace_blockers":0,"native_trace_hits_total":74,"native_trace_unique_breakpoints":11,"false_positives":0,"runtime_timeout_failures":0,"runtime_title_visual_suppressed_builds":0,"runtime_custom_cover_builds":0,"runtime_simulated_button_presses_total":0},"status":"discard","description":"static-class labels for RenderMan loading layers did not improve score","timestamp":1782456391545,"segment":0,"confidence":null,"asi":{"hypothesis":"Static class identities for the validated pointer-only RenderMan loading-layer telemetry can be exposed without runtime child derefs: RendMan slots are CS::CSEzDraw and CSGraphics+0x68 is CS::CSScreenCapture. This may guide Part B toward a safe CSEzDraw/CSScaleform insertion point.","evidence":"Ghidra xrefs/decompilation mapped 0x142b7e410 to CS::CSEzDraw::vftable and RendManImp::RendManImp allocation of slots +0x28/+0x30/+0x38/+0x40/+0x78 as CSEzDraw. Ghidra mapped 0x142b81050 to CS::CSScreenCapture constructors/destructor for CSGraphics+0x68. Cargo xwin build passed; direct checker reported only known title-cover failures; measure stayed at 1120 with title_cover_failures=2. Finding persisted in bd memory loading-render-layer-static-class-map-2026-06-25.","rollback_reason":"Primary metric unchanged and source changes only added static labels/checker expectations, not a real cover binding or score improvement. Keeping would add nonessential code without advancing the measured objective.","next_action_hint":"Use the persisted static class map for the next real implementation: inspect CSEzDraw/CSScaleform draw enqueue APIs statically, then add a non-MenuWindow/custom-root cover surface or safe append path. Do not runtime-deref active loading-layer child pointers."}}
{"run":315,"commit":"7de4b92","metric":1120,"metrics":{"readiness_gate_failures":0,"target_constants_remaining":0,"helpers_missing":0,"fixed_wait_predicates":0,"autoload_static_failures":0,"asset_chain_failures":0,"dll_patch_failures":0,"native_continue_failures":0,"field58_gate_failures":0,"direct_shortcut_failures":0,"input_path_failures":0,"runtime_proof_failures":1,"runtime_mode_failures":0,"eula_popup_failures":0,"save_data_popup_failures":0,"messagebox_dialog_failures":0,"server_status_failures":0,"title_cover_failures":2,"title_cover_penalty":400,"native_trace_blockers":0,"native_trace_hits_total":74,"native_trace_unique_breakpoints":11,"false_positives":0,"runtime_timeout_failures":0,"runtime_title_visual_suppressed_builds":0,"runtime_custom_cover_builds":0,"runtime_simulated_button_presses_total":0},"status":"keep","description":"add real DLL removed UI fullscreen title/loading overlay cover","timestamp":1782456658150,"segment":0,"confidence":null,"asi":{"hypothesis":"A real DLL-owned fullscreen cover can be rendered through the existing the removed path render path during product autoload while no player exists, avoiding unsafe native CSEzDraw/CSScaleform child-object mutation. Telemetry should count actual render calls, so runtime proof can fail honestly if the render loop does not run during title/loading.","evidence":"Added draw_title_overlay_cover(ui) in src/overlay.rs. It draws a full-screen dark panel and text through ui.get_background_draw_list() whenever product_autoload_enabled() and PlayerIns::local_player_mut() is unavailable. Added TITLE_OVERLAY_COVER_RENDER_CALLS/display-size counters and telemetry fields oracle_title_overlay_cover_rendered/oracle_title_overlay_cover_last_display_size. Updated measure runtime cover failure logic to accept overlay only when telemetry reports oracle_title_overlay_cover_rendered=true. cargo xwin build passed; static measure remains 1120 because existing runtime artifacts predate the overlay and still lack overlay telemetry.","next_action_hint":"Run marker-gated runtime next. If oracle_title_overlay_cover_rendered=true while Banon/world-stable/zero-input remain true, this is a real custom cover path. If false, removed path render loop does not cover the boot/loading window and the path should be discarded."}}
{"run":316,"commit":"7de4b92","metric":1120,"metrics":{"readiness_gate_failures":0,"target_constants_remaining":0,"helpers_missing":0,"fixed_wait_predicates":0,"autoload_static_failures":0,"asset_chain_failures":0,"dll_patch_failures":0,"native_continue_failures":0,"field58_gate_failures":0,"direct_shortcut_failures":0,"input_path_failures":0,"runtime_proof_failures":1,"runtime_mode_failures":0,"eula_popup_failures":0,"save_data_popup_failures":0,"messagebox_dialog_failures":0,"server_status_failures":0,"title_cover_failures":2,"title_cover_penalty":400,"native_trace_blockers":0,"native_trace_hits_total":74,"native_trace_unique_breakpoints":11,"false_positives":0,"runtime_timeout_failures":0,"runtime_title_visual_suppressed_builds":0,"runtime_custom_cover_builds":0,"runtime_simulated_button_presses_total":0},"status":"discard","description":"removed UI overlay cover did not render during boot/loading","timestamp":1782456732123,"segment":0,"confidence":null,"asi":{"hypothesis":"A real DLL-owned fullscreen cover rendered through the existing the removed path overlay path could cover title/loading without touching native CSEzDraw/CSScaleform objects.","evidence":"Runtime artifact /home/banon/projects/er-effects-rs/target/runtime-probe/product-continue-direct-20260625-235108 passed world_stable/Banon/zero-input/zero-MessageBox, but screenshot still showed native 'Updating save data...' black screen. Telemetry falsified the path: oracle_title_overlay_cover_render_calls=0, oracle_title_overlay_cover_rendered=false, display_size=[0,0], while fake_loading_visible_samples=16 and render_loading_visible_slots_mask=127. Therefore removed path/removed UI render loop is not active during the boot/loading interval that needs cover.","rollback_reason":"No primary metric improvement and the implementation did not render in the target interval. Keeping would add dead cover code and a benchmark-only measure exception. Revert it.","next_action_hint":"Do not use the removed path overlay for boot/loading cover. Continue static RE toward native render-layer/CSScaleform/CSEzDraw enqueue path or a custom root-reachable Scaleform surface that is actually drawn before world load."}}
{"run":317,"commit":"7de4b92","metric":1120,"metrics":{"readiness_gate_failures":0,"target_constants_remaining":0,"helpers_missing":0,"fixed_wait_predicates":0,"autoload_static_failures":0,"asset_chain_failures":0,"dll_patch_failures":0,"native_continue_failures":0,"field58_gate_failures":0,"direct_shortcut_failures":0,"input_path_failures":0,"runtime_proof_failures":1,"runtime_mode_failures":0,"eula_popup_failures":0,"save_data_popup_failures":0,"messagebox_dialog_failures":0,"server_status_failures":0,"title_cover_failures":2,"title_cover_penalty":400,"native_trace_blockers":0,"native_trace_hits_total":74,"native_trace_unique_breakpoints":11,"false_positives":0,"runtime_timeout_failures":0,"runtime_title_visual_suppressed_builds":0,"runtime_custom_cover_builds":0,"runtime_simulated_button_presses_total":0},"status":"discard","description":"Measured inherited dirty title-cover/proof changes; score below current best due title-cover/runtime proof penalties","timestamp":1782484727417,"segment":0,"confidence":null,"asi":{"hypothesis":"Inherited uncommitted changes might already improve title-cover score; running measure establishes whether to keep them before further edits.","rollback_reason":"Primary metric 1120 was below current best 1230; title_cover_failures=2 and runtime_proof_failures=1 remain.","next_action_hint":"Inspect .auto/measure.sh title-cover predicates and current clean baseline; target the two title_cover_failures without weakening runtime proof or path constraints."}}
{"run":318,"commit":"7de4b92","metric":1120,"metrics":{"readiness_gate_failures":0,"target_constants_remaining":0,"helpers_missing":0,"fixed_wait_predicates":0,"autoload_static_failures":0,"asset_chain_failures":0,"dll_patch_failures":0,"native_continue_failures":0,"field58_gate_failures":0,"direct_shortcut_failures":0,"input_path_failures":0,"runtime_proof_failures":1,"runtime_mode_failures":0,"eula_popup_failures":0,"save_data_popup_failures":0,"messagebox_dialog_failures":0,"server_status_failures":0,"title_cover_failures":2,"title_cover_penalty":400,"native_trace_blockers":0,"native_trace_hits_total":74,"native_trace_unique_breakpoints":11,"false_positives":0,"runtime_timeout_failures":0,"runtime_title_visual_suppressed_builds":0,"runtime_custom_cover_builds":0,"runtime_simulated_button_presses_total":0},"status":"discard","description":"Clean post-discard baseline remeasure under current title-cover rubric; still below best","timestamp":1782484911972,"segment":0,"confidence":null,"asi":{"hypothesis":"Confirm the clean current branch score after reverting the inherited dirty experiment before choosing the next title-logo/profile-render path.","rollback_reason":"No improvement over current best; same title cover and runtime proof penalties remain.","next_action_hint":"Focus on replacing the hardcoded false oracle_title_profile_cover_bound_to_logo_surface with real evidence from a live/profile-render binding path, not on ProfileSelect canvas telemetry."}}
