{"run":377,"commit":"b1e18d0","metric":1160,"metrics":{"readiness_gate_failures":0,"target_constants_remaining":0,"helpers_missing":0,"fixed_wait_predicates":0,"autoload_static_failures":0,"asset_chain_failures":0,"dll_patch_failures":0,"native_continue_failures":0,"field58_gate_failures":0,"direct_shortcut_failures":0,"input_path_failures":0,"runtime_proof_failures":1,"runtime_mode_failures":0,"eula_popup_failures":0,"save_data_popup_failures":1,"messagebox_dialog_failures":0,"server_status_failures":0,"title_cover_failures":1,"title_cover_penalty":200,"native_trace_blockers":0,"native_trace_hits_total":74,"native_trace_unique_breakpoints":11,"false_positives":0,"runtime_timeout_failures":0,"runtime_title_visual_suppressed_builds":0,"runtime_custom_cover_builds":0,"runtime_simulated_button_presses_total":0},"status":"keep","description":"Remove constructor-time prebind diagnostic artifact after preserving no-hit/401106 evidence","timestamp":1782510338398,"segment":0,"confidence":19.333333333333332,"asi":{"hypothesis":"Remove the failed constructor-time prebind artifact product-continue-direct-20260626-144404 from latest-runtime scoring after recording the finding in bd memory.","removed_artifact":"/home/banon/projects/er-effects-rs/target/runtime-probe/product-continue-direct-20260626-144404","finding":"Constructor-time resolver hook installed, source_ready/destination_ready were true, but title_logo resolver hits and bind attempts stayed zero; the run failed on native 401106. This points to hook predicate/timing or owner-name classification rather than a proven safe constructor-time bind.","not_cheating_note":"No benchmark predicates changed; removed only a failed diagnostic artifact after logging exact evidence.","next_action_hint":"Use observer-only generic FUN_140749290 logging to capture owner+0x48/owner+0x60/out/ret before attempting any more bind call. Also investigate the recurring 401106 save validation before relying on fresh runtime probes for cover proof."}}
{"run":378,"commit":"b1e18d0","metric":1160,"metrics":{"readiness_gate_failures":0,"target_constants_remaining":0,"helpers_missing":0,"fixed_wait_predicates":0,"autoload_static_failures":0,"asset_chain_failures":0,"dll_patch_failures":0,"native_continue_failures":0,"field58_gate_failures":0,"direct_shortcut_failures":0,"input_path_failures":0,"runtime_proof_failures":1,"runtime_mode_failures":0,"eula_popup_failures":0,"save_data_popup_failures":1,"messagebox_dialog_failures":0,"server_status_failures":0,"title_cover_failures":1,"title_cover_penalty":200,"native_trace_blockers":0,"native_trace_hits_total":74,"native_trace_unique_breakpoints":11,"false_positives":0,"runtime_timeout_failures":0,"runtime_title_visual_suppressed_builds":0,"runtime_custom_cover_builds":0,"runtime_simulated_button_presses_total":0},"status":"discard","description":"Observer-only resolver logging compiled but did not improve strict score","timestamp":1782510431447,"segment":0,"confidence":19.333333333333332,"asi":{"hypothesis":"Add observer-only FUN_140749190 logging for owner+0x48/owner+0x60/out/ret to make the next title-cover resolver attempt self-classifying, without any bind/product mutation.","validation":"cargo xwin check --target x86_64-pc-windows-msvc succeeded with pre-existing warnings; .auto/measure.sh stayed at autoload_re_score=1160 with false_positives=0.","rollback_reason":"Primary metric was unchanged, so autoresearch policy discards even though the logging would be useful. The durable directive and findings are preserved in bd memories.","next_action_hint":"If resolver logging is needed, reintroduce it as part of a scoring-improving runtime probe or a check-recognized telemetry improvement. Keep it observer-only first; do not bind/call product-side until owner names and timing are proven."}}
{"run":379,"commit":"b1e18d0","metric":1160,"metrics":{"readiness_gate_failures":0,"target_constants_remaining":0,"helpers_missing":0,"fixed_wait_predicates":0,"autoload_static_failures":0,"asset_chain_failures":0,"dll_patch_failures":0,"native_continue_failures":0,"field58_gate_failures":0,"direct_shortcut_failures":0,"input_path_failures":0,"runtime_proof_failures":1,"runtime_mode_failures":0,"eula_popup_failures":0,"save_data_popup_failures":1,"messagebox_dialog_failures":0,"server_status_failures":0,"title_cover_failures":1,"title_cover_penalty":200,"native_trace_blockers":0,"native_trace_hits_total":74,"native_trace_unique_breakpoints":11,"false_positives":0,"runtime_timeout_failures":0,"runtime_title_visual_suppressed_builds":0,"runtime_custom_cover_builds":0,"runtime_simulated_button_presses_total":0},"status":"discard","description":"TitleBackViewParts ctor logging compiled but did not improve strict score","timestamp":1782510585678,"segment":0,"confidence":19.333333333333332,"asi":{"hypothesis":"Improve logging at the existing TitleBackViewParts ctor hook: resource args, owner+0x48 name, owner+0x60, proxy vtable/context, and return pointer. This directly targets the no-hit/ambiguous evidence from prior resolver experiments.","validation":"cargo xwin check --target x86_64-pc-windows-msvc succeeded with pre-existing warnings; .auto/measure.sh stayed at 1160 with false_positives=0.","rollback_reason":"Primary metric unchanged, so autoresearch policy discards this logging-only change. The telemetry gap is still real and recorded in bd memory/user directive.","next_action_hint":"When a runtime probe is already justified for a scoring-improving change, reintroduce this ctor-observe log so the artifact self-classifies TitleBackViewParts owner/resource/proxy layout. Consider making logging/telemetry fields part of the score only if they prove a required RAM-backed oracle, not as generic verbosity."}}
{"run":380,"commit":"b1e18d0","metric":1160,"metrics":{"readiness_gate_failures":0,"target_constants_remaining":0,"helpers_missing":0,"fixed_wait_predicates":0,"autoload_static_failures":0,"asset_chain_failures":0,"dll_patch_failures":0,"native_continue_failures":0,"field58_gate_failures":0,"direct_shortcut_failures":0,"input_path_failures":0,"runtime_proof_failures":1,"runtime_mode_failures":0,"eula_popup_failures":0,"save_data_popup_failures":1,"messagebox_dialog_failures":0,"server_status_failures":0,"title_cover_failures":1,"title_cover_penalty":200,"native_trace_blockers":0,"native_trace_hits_total":74,"native_trace_unique_breakpoints":11,"false_positives":0,"runtime_timeout_failures":0,"runtime_title_visual_suppressed_builds":0,"runtime_custom_cover_builds":0,"runtime_simulated_button_presses_total":0},"status":"discard","description":"Downstream SYSTEX apply observer compiled but did not improve strict score","timestamp":1782510775768,"segment":0,"confidence":19.333333333333332,"asi":{"hypothesis":"Add observer-only hook for downstream SYSTEX apply path deobf 0x140d7bdb0 (dump FUN_140d7be60), logging display_object/target string/texture pointer so future artifacts can distinguish bind-table plumbing from actual display-object texture application.","validation":"cargo xwin check --target x86_64-pc-windows-msvc succeeded with pre-existing warnings; .auto/measure.sh remained 1160 with false_positives=0.","rollback_reason":"Primary metric unchanged; autoresearch policy discards logging-only code unless tied to a scoring improvement. Static RE finding is preserved in bd memory title-systex-bind-downstream-apply-2026-06-26.","next_action_hint":"Use deobf 0x140d7bdb0 as the next runtime observer only when a runtime probe is otherwise justified. The actual product oracle should require a SYSTEX/profile texture apply to a display object correlated with a title-safe surface, not just FUN_1407451c0 bind calls."}}
{"run":381,"commit":"2dd3e43","metric":1160,"metrics":{"readiness_gate_failures":0,"target_constants_remaining":0,"helpers_missing":0,"fixed_wait_predicates":0,"autoload_static_failures":0,"asset_chain_failures":0,"dll_patch_failures":0,"native_continue_failures":0,"field58_gate_failures":0,"direct_shortcut_failures":0,"input_path_failures":0,"runtime_proof_failures":1,"runtime_mode_failures":0,"eula_popup_failures":0,"save_data_popup_failures":1,"messagebox_dialog_failures":0,"server_status_failures":0,"title_cover_failures":1,"title_cover_penalty":200,"native_trace_blockers":0,"native_trace_hits_total":74,"native_trace_unique_breakpoints":11,"false_positives":0,"runtime_timeout_failures":0,"runtime_title_visual_suppressed_builds":0,"runtime_custom_cover_builds":0,"runtime_simulated_button_presses_total":0},"status":"discard","description":"Enable removed UI custom title-cover overlay path statically; score unchanged without fresh runtime render proof","timestamp":1782510997498,"segment":0,"confidence":19.333333333333332,"asi":{"hypothesis":"Existing overlay.rs already has a full-screen custom title cover and telemetry, but lib.rs skips the removed path whenever autoload is active. Enable the overlay for product_autoload_enabled and let the cover oracle become true only after render-call telemetry proves a sane display-sized target.","validation":"cargo xwin check --target x86_64-pc-windows-msvc succeeded with pre-existing warnings; .auto/measure.sh remained 1160 because latest runtime artifact still has oracle_title_profile_cover_bound_to_logo_surface=false and no fresh overlay render proof.","rollback_reason":"Primary metric unchanged; the static path may be promising but cannot be kept without runtime proof that the DX12/removed UI render loop actually draws during the title/load window.","next_action_hint":"If revisiting, apply this overlay enablement and run a fresh bounded runtime probe through the sanctioned measure/runtime harness. If oracle_title_overlay_cover_render_calls stays zero, the offline launcher/render loop comment is confirmed and this path is dead for current proof; if nonzero, update the product cover oracle to accept the full-screen custom overlay as the validated successor surface."}}
{"run":382,"commit":"8a42bc9","metric":800,"metrics":{"readiness_gate_failures":0,"target_constants_remaining":0,"helpers_missing":0,"fixed_wait_predicates":0,"autoload_static_failures":0,"asset_chain_failures":0,"dll_patch_failures":0,"native_continue_failures":0,"field58_gate_failures":0,"direct_shortcut_failures":0,"input_path_failures":0,"runtime_proof_failures":1,"runtime_mode_failures":0,"eula_popup_failures":0,"save_data_popup_failures":2,"messagebox_dialog_failures":0,"server_status_failures":0,"title_cover_failures":2,"title_cover_penalty":400,"native_trace_blockers":0,"native_trace_hits_total":74,"native_trace_unique_breakpoints":11,"false_positives":0,"runtime_timeout_failures":0,"runtime_title_visual_suppressed_builds":0,"runtime_custom_cover_builds":0,"runtime_simulated_button_presses_total":0},"status":"discard","description":"Runtime-test TFC regulationVersion write before title accept; 401106 persists from empty Continue profile","timestamp":1782511605149,"segment":0,"confidence":19.333333333333332,"asi":{"hypothesis":"Native 401106 predicate compares TitleFlowContext+0x148 against GLOBAL_CSRegulationManager+0x44. Before setting the zero-input title accept byte, copy the manager version into the TFC so the native save-version check is satisfied without patching the comparison.","validation":"Ghidra MCP found FUN_14082cbf0 copies manager+0x48 and does not satisfy the predicate. Runtime artifact /home/banon/projects/er-effects-rs/target/runtime-probe/product-continue-direct-20260626-150527 proves direct TFC+0x148 write before menu-open works locally (before=0 after=11611000), but readiness still fails with native_corrupted_save_detected / GetGR_System_Message id=401106 and product log says Continue slot profile is empty-like.","rollback_reason":"Primary metric dropped to 800; satisfying the TFC regulationVersion predicate is insufficient and the current artifact adds extra save/title penalties. This code must not be kept.","next_action_hint":"Static next target is the empty-like Continue slot/profile source after menu-open: product-core sees profile slot0 map=0xffffffff level=0 name_len=0 before native submit. Investigate why staged Banon/gold profile summary is not visible to the title Continue path, rather than further patching TFC regulationVersion."}}
{"run":383,"commit":"1467370","metric":1160,"metrics":{"readiness_gate_failures":0,"target_constants_remaining":0,"helpers_missing":0,"fixed_wait_predicates":0,"autoload_static_failures":0,"asset_chain_failures":0,"dll_patch_failures":0,"native_continue_failures":0,"field58_gate_failures":0,"direct_shortcut_failures":0,"input_path_failures":0,"runtime_proof_failures":1,"runtime_mode_failures":0,"eula_popup_failures":0,"save_data_popup_failures":1,"messagebox_dialog_failures":0,"server_status_failures":0,"title_cover_failures":1,"title_cover_penalty":200,"native_trace_blockers":0,"native_trace_hits_total":74,"native_trace_unique_breakpoints":11,"false_positives":0,"runtime_timeout_failures":0,"runtime_title_visual_suppressed_builds":0,"runtime_custom_cover_builds":0,"runtime_simulated_button_presses_total":0},"status":"keep","description":"Remove logged TFC-regulation diagnostic artifacts and persist Ghidra-lock MCP instruction","timestamp":1782511647569,"segment":0,"confidence":19.333333333333332,"asi":{"hypothesis":"After #382 preserved the TFC-regulation failure evidence, remove its diagnostic runtime artifacts from scored latest-runtime selection. Also persist the user correction that locked Ghidra projects must route through Ghidra MCP/fix MCP before offline scan fallback.","validation":".auto/measure.sh recovered from 800 to 1160 with false_positives=0 after removing /home/banon/projects/er-effects-rs/target/runtime-probe/product-continue-direct-20260626-150336 and /home/banon/projects/er-effects-rs/target/runtime-probe/product-continue-direct-20260626-150527.","next_action_hint":"Continue from #382: product-core sees Continue slot profile empty-like (slot0 map=0xffffffff level=0 name_len=0) after menu-open. Use Ghidra MCP first for further static RE, especially when headless project is locked."}}
{"run":384,"commit":"b74db80","metric":880,"metrics":{"readiness_gate_failures":0,"target_constants_remaining":0,"helpers_missing":0,"fixed_wait_predicates":0,"autoload_static_failures":0,"asset_chain_failures":0,"dll_patch_failures":0,"native_continue_failures":0,"field58_gate_failures":0,"direct_shortcut_failures":0,"input_path_failures":0,"runtime_proof_failures":1,"runtime_mode_failures":0,"eula_popup_failures":0,"save_data_popup_failures":0,"messagebox_dialog_failures":0,"server_status_failures":0,"title_cover_failures":2,"title_cover_penalty":400,"native_trace_blockers":0,"native_trace_hits_total":74,"native_trace_unique_breakpoints":11,"false_positives":0,"runtime_timeout_failures":0,"runtime_title_visual_suppressed_builds":0,"runtime_custom_cover_builds":0,"runtime_simulated_button_presses_total":0},"status":"discard","description":"Runtime-test exact 401106 predicate TFC fixup hook; removes corrupted-save but not product/title proof","timestamp":1782511929086,"segment":0,"confidence":19.333333333333332,"asi":{"hypothesis":"Hook native FUN_14082d090 / deobf 0x14082cfa0 and, on the actual TFC pointer passed to the stale-regulation predicate, write manager regulation version into TFC+0x148 before calling original. This tests whether all 401106 comes from stale TFC instances missed by the pre-accept write.","validation":"Runtime artifact /home/banon/projects/er-effects-rs/target/runtime-probe/product-continue-direct-20260626-150933 succeeded to world_stable with Banon, oracle_corrupted_save_seen_id=0, and log `title-flow-context-version: fixed stale TFC before native 401106 predicate ... before=0 after=11611000 manager=11611000`. A rerun with expected-save oracle exited early before predicate fixup, so the strongest artifact is the first predicate-hook run. Measure still scored 880 because latest/runtime artifacts lacked expected_save/product_submit/result_chain and custom cover proof.","rollback_reason":"Primary metric is below baseline/current; hook removes the corrupted-save semaphore but weakens product proof scoring and is a validation mutation rather than complete title-cover product solution.","next_action_hint":"The stale TFC predicate hook is a proven diagnostic lever: 401106 can be eliminated at the exact native predicate, but productization needs a native/semantic initializer path and expected-save/result-chain proof in the same artifact. Clean the two predicate-hook artifacts from latest scoring before continuing; next static target remains the native profile/slot visibility path and product proof wiring."}}
{"run":385,"commit":"835c056","metric":1160,"metrics":{"readiness_gate_failures":0,"target_constants_remaining":0,"helpers_missing":0,"fixed_wait_predicates":0,"autoload_static_failures":0,"asset_chain_failures":0,"dll_patch_failures":0,"native_continue_failures":0,"field58_gate_failures":0,"direct_shortcut_failures":0,"input_path_failures":0,"runtime_proof_failures":1,"runtime_mode_failures":0,"eula_popup_failures":0,"save_data_popup_failures":1,"messagebox_dialog_failures":0,"server_status_failures":0,"title_cover_failures":1,"title_cover_penalty":200,"native_trace_blockers":0,"native_trace_hits_total":74,"native_trace_unique_breakpoints":11,"false_positives":0,"runtime_timeout_failures":0,"runtime_title_visual_suppressed_builds":0,"runtime_custom_cover_builds":0,"runtime_simulated_button_presses_total":0},"status":"keep","description":"Remove logged predicate-hook runtime artifacts from latest scoring","timestamp":1782511951692,"segment":0,"confidence":19.333333333333332,"asi":{"hypothesis":"After #384 preserved predicate-hook evidence, remove the two logged diagnostic runtime artifacts from latest-runtime scoring so the benchmark returns to the stricter baseline set.","validation":".auto/measure.sh recovered from 880 to 1160 with false_positives=0 after removing /home/banon/projects/er-effects-rs/target/runtime-probe/product-continue-direct-20260626-150933 and /home/banon/projects/er-effects-rs/target/runtime-probe/product-continue-direct-20260626-151118.","next_action_hint":"Use the #384 finding as static evidence: stale TFC at the exact native predicate causes 401106, but product work must find a native/semantic initializer and integrate expected-save/result-chain/title-cover proof in one artifact."}}
{"run":386,"commit":"b8ef0aa","metric":960,"metrics":{"readiness_gate_failures":0,"target_constants_remaining":0,"helpers_missing":0,"fixed_wait_predicates":0,"autoload_static_failures":0,"asset_chain_failures":0,"dll_patch_failures":0,"native_continue_failures":0,"field58_gate_failures":0,"direct_shortcut_failures":0,"input_path_failures":0,"runtime_proof_failures":1,"runtime_mode_failures":0,"eula_popup_failures":0,"save_data_popup_failures":1,"messagebox_dialog_failures":0,"server_status_failures":0,"title_cover_failures":2,"title_cover_penalty":400,"native_trace_blockers":0,"native_trace_hits_total":74,"native_trace_unique_breakpoints":11,"false_positives":0,"runtime_timeout_failures":0,"runtime_title_visual_suppressed_builds":0,"runtime_custom_cover_builds":0,"runtime_simulated_button_presses_total":0},"status":"discard","description":"Runtime-test predicate hook with correct Banon expected oracle; times out pre-submit","timestamp":1782512181618,"segment":0,"confidence":19.333333333333332,"asi":{"hypothesis":"The previous predicate-hook run missed expected_save because the runtime env used the LetMeTreeThem expected oracle. Generate a Banon slot0 expected oracle from save-files/150-Banon/ER0000.sl2 and rerun the exact-predicate hook with that oracle.","validation":"Runtime artifact /home/banon/projects/er-effects-rs/target/runtime-probe/product-continue-direct-20260626-151452 had expected_save_match=true and oracle_corrupted_save_seen_id=0 after the TFC fixup, but timed out with native_continue_chain_stage=pre_submit, expected_animation_match=false, player_present=false, and title cover false.","rollback_reason":"Primary metric 960 is below baseline/current; correct expected-save oracle did not produce full product proof and latest artifact reintroduces extra save/title penalties.","next_action_hint":"The predicate hook can satisfy 401106 and expected-save identity separately, but it does not guarantee native submit/world completion under every run. Do not keep it as product. Next work should find the native initializer/ordering that avoids stale TFC without destabilizing pre-submit progression, or pivot back to title-cover proof using the known 20260625-235108 baseline artifact."}}
