{"run":586,"commit":"4dc167b","metric":0,"metrics":{"readiness_gate_failures":0,"target_constants_remaining":0,"helpers_missing":0,"fixed_wait_predicates":0,"autoload_static_failures":0,"asset_chain_failures":0,"dll_patch_failures":0,"native_continue_failures":0,"field58_gate_failures":0,"direct_shortcut_failures":0,"input_path_failures":0,"runtime_proof_failures":0,"runtime_mode_failures":0,"eula_popup_failures":0,"save_data_popup_failures":0,"messagebox_dialog_failures":0,"server_status_failures":0,"title_cover_failures":2,"title_cover_penalty":1800,"native_trace_blockers":0,"native_trace_hits_total":74,"native_trace_unique_breakpoints":11,"false_positives":0,"offline_face_source_ready":1,"removed path_cpu_texture_bridge_ready":0,"offline_face_texture_runtime_drawn":0,"stylized_facedata_pixel_oracle":0,"real_portrait_asset_candidates":0,"profile_placeholder_assets_only":1},"status":"discard","description":"Validated existing TitleBack ctor hook as safest site for owned custom-surface diagnostic.","timestamp":1782657228085,"segment":2,"confidence":null,"asi":{"hypothesis":"Validate the best code hook site for the owned TitleBackViewParts diagnostic before implementing it, using existing source and static RE rather than adding a new hook path blindly.","observed_evidence":"Existing install_title_logo_force_hidden_hooks already hooks TITLE_LOGO_BACK_VIEW_PARTS_CTOR_RVA and stores TITLE_LOGO_CTOR_ORIG. title_logo_ctor_force_hidden_hook receives (logo, load_info_ptr, param_3, param_4), calls the original TitleBackViewParts ctor, then hides native logo. That hook has the same construction context needed to build a separate owned 0xd0 custom TitleBackViewParts with synthetic load_info. The start-login hide hook is later and lacks the original constructor context. Finding saved to bd memory owned-titleback-hook-site-static-2026-06-28.","rollback_reason":"Primary metric stayed 0; this was hook-site/static validation only and no custom surface or portrait oracle was implemented.","next_action_hint":"Implement the owned custom surface inside title_logo_ctor_force_hidden_hook after the original native ctor succeeds, explicit-gated, using same param_3/param_4, stable UTF-16 synthetic resource load_info, and no native out-slot/MenuWindow job replacement."}}
{"run":587,"commit":"4dc167b","metric":0,"metrics":{"readiness_gate_failures":0,"target_constants_remaining":0,"helpers_missing":0,"fixed_wait_predicates":0,"autoload_static_failures":0,"asset_chain_failures":0,"dll_patch_failures":0,"native_continue_failures":0,"field58_gate_failures":0,"direct_shortcut_failures":0,"input_path_failures":0,"runtime_proof_failures":0,"runtime_mode_failures":0,"eula_popup_failures":0,"save_data_popup_failures":0,"messagebox_dialog_failures":0,"server_status_failures":0,"title_cover_failures":2,"title_cover_penalty":1800,"native_trace_blockers":0,"native_trace_hits_total":74,"native_trace_unique_breakpoints":11,"false_positives":0,"offline_face_source_ready":1,"removed path_cpu_texture_bridge_ready":0,"offline_face_texture_runtime_drawn":0,"stylized_facedata_pixel_oracle":0,"real_portrait_asset_candidates":0,"profile_placeholder_assets_only":1},"status":"discard","description":"Scaffolded explicit-gated owned TitleBack diagnostic in ctor hook; measure stayed fail-closed.","timestamp":1782657406225,"segment":2,"confidence":null,"asi":{"hypothesis":"Implement the next owned/custom TitleBack diagnostic scaffold inside title_logo_ctor_force_hidden_hook after the original native ctor succeeds, explicit-gated, using same param_3/param_4 and stable UTF-16 synthetic resource load_info without replacing native out-slot/MenuWindow jobs.","observed_evidence":"Added constants/static storage/counters and a gated maybe_build_owned_titleback_diagnostic() shape: ER_EFFECTS_SCALEFORM_SYNTHETIC_TITLEBACK=1, stable UTF-16 er_effects_portrait_cover, load_info {0x0000000100000005, name_ptr}, second call to original TitleBackViewParts ctor trampoline on owned 0xd0 storage, telemetry object/ret/load_info counters, native logo hide unchanged. Saved exact scaffold shape to bd memory owned-titleback-diagnostic-scaffold-shape-2026-06-28. .auto/measure.sh passed and stayed fail-closed with title_cover_failures=2, false_positives=0.","rollback_reason":"Primary metric stayed 0; this scaffold is route plumbing only and produced no runtime synthetic URL/MemoryFile hit, no visible custom surface, and no portrait oracle.","next_action_hint":"Next iteration should either run a bounded runtime diagnostic with ER_EFFECTS_SCALEFORM_SYNTHETIC_TITLEBACK=1 and the synthetic FileOpener/MemoryFile hook enabled, or first wire the FileOpener hook install path to this gate if discard removed it; score only after synthetic URL hits plus visible loaded-character portrait proof."}}
{"run":588,"commit":"4dc167b","metric":0,"metrics":{"readiness_gate_failures":0,"target_constants_remaining":0,"helpers_missing":0,"fixed_wait_predicates":0,"autoload_static_failures":0,"asset_chain_failures":0,"dll_patch_failures":0,"native_continue_failures":0,"field58_gate_failures":0,"direct_shortcut_failures":0,"input_path_failures":0,"runtime_proof_failures":0,"runtime_mode_failures":0,"eula_popup_failures":0,"save_data_popup_failures":0,"messagebox_dialog_failures":0,"server_status_failures":0,"title_cover_failures":2,"title_cover_penalty":1800,"native_trace_blockers":0,"native_trace_hits_total":74,"native_trace_unique_breakpoints":11,"false_positives":0,"offline_face_source_ready":1,"removed path_cpu_texture_bridge_ready":0,"offline_face_texture_runtime_drawn":0,"stylized_facedata_pixel_oracle":0,"real_portrait_asset_candidates":0,"profile_placeholder_assets_only":1},"status":"discard","description":"Preflighted current source for synthetic FileOpener/TitleBack route; confirmed reverted gap.","timestamp":1782657492203,"segment":2,"confidence":null,"asi":{"hypothesis":"Before attempting a runtime diagnostic, verify whether current HEAD still contains the synthetic FileOpener/MemoryFile hook and owned TitleBack diagnostic needed by #587, because log_experiment discard reverts non-kept code.","observed_evidence":"Current-source scan of src/**/*.rs for FileOpener, MemoryFile, SCALEFORM_SYNTHETIC, SYNTHETIC_TITLEBACK, and er_effects_portrait_cover returned no references. .auto/measure.sh passed with title_cover_failures=2 and false_positives=0. Finding saved to bd memory synthetic-fileopener-current-source-gap-2026-06-28.","rollback_reason":"Primary metric stayed 0; this iteration was preflight/static gap validation and introduced no product or diagnostic code.","next_action_hint":"Reintroduce synthetic FileOpener/MemoryFile hook and owned TitleBack diagnostic scaffold together under ER_EFFECTS_SCALEFORM_SYNTHETIC_TITLEBACK=1 before creating .auto/run_runtime_probe_once. A runtime probe without those source pieces cannot request or return the synthetic URL."}}
{"run":589,"commit":"4dc167b","metric":0,"metrics":{"readiness_gate_failures":0,"target_constants_remaining":0,"helpers_missing":0,"fixed_wait_predicates":0,"autoload_static_failures":0,"asset_chain_failures":0,"dll_patch_failures":0,"native_continue_failures":0,"field58_gate_failures":0,"direct_shortcut_failures":0,"input_path_failures":0,"runtime_proof_failures":0,"runtime_mode_failures":0,"eula_popup_failures":0,"save_data_popup_failures":0,"messagebox_dialog_failures":0,"server_status_failures":0,"title_cover_failures":2,"title_cover_penalty":1800,"native_trace_blockers":0,"native_trace_hits_total":74,"native_trace_unique_breakpoints":11,"false_positives":0,"offline_face_source_ready":1,"removed path_cpu_texture_bridge_ready":0,"offline_face_texture_runtime_drawn":0,"stylized_facedata_pixel_oracle":0,"real_portrait_asset_candidates":0,"profile_placeholder_assets_only":1},"status":"discard","description":"Static RE regrounded FileOpener/MemoryFile ABI for synthetic TitleBack route.","timestamp":1782657602433,"segment":2,"confidence":null,"asi":{"hypothesis":"Before reintroducing the synthetic FileOpener hook, ground the exact wrapper/MemoryFile ABI from Ghidra so the implementation substitutes only the synthetic URL and returns a valid Scaleform::MemoryFile rather than a fake object.","observed_evidence":"Ghidra decompile: FUN_1411ceda0(loader, filename, flags) reads installed FileOpener at *(loader+0x10)+0x10 and calls vfunc +0x18 as (fileOpener, filename, logger_or_0, 0x21, 0x1b6). MemoryFile ctor is dump 0x140ce7c90 / deobf 0x140ce7bb0 with args (out_file, name_ref, bytes_ptr, len_i32), initializes Scaleform::MemoryFile and marks valid only if name nonempty, bytes nonzero, len>0. Scaleform string helper is dump 0x1411413b0 / deobf 0x141141390 with args (out_ref, char_ptr). Finding saved to bd memory scaleform-fileopener-memoryfile-abi-2026-06-28.","rollback_reason":"Primary metric stayed 0; this was static ABI grounding only and no source hook/custom surface/portrait oracle was implemented.","next_action_hint":"Implement a guarded hook on FUN_1411ceda0 or the FileOpener vfunc+0x18 that matches menu:/er_effects_portrait_cover.gfx and menu:/Win/er_effects_portrait_cover.gfx, builds name_ref via 0x141141390, constructs a MemoryFile via 0x140ce7bb0 over embedded known-good GFX bytes, and returns it only under ER_EFFECTS_SCALEFORM_SYNTHETIC_TITLEBACK=1."}}
{"run":590,"commit":"4dc167b","metric":0,"metrics":{"readiness_gate_failures":0,"target_constants_remaining":0,"helpers_missing":0,"fixed_wait_predicates":0,"autoload_static_failures":0,"asset_chain_failures":0,"dll_patch_failures":0,"native_continue_failures":0,"field58_gate_failures":0,"direct_shortcut_failures":0,"input_path_failures":0,"runtime_proof_failures":0,"runtime_mode_failures":0,"eula_popup_failures":0,"save_data_popup_failures":0,"messagebox_dialog_failures":0,"server_status_failures":0,"title_cover_failures":2,"title_cover_penalty":1800,"native_trace_blockers":0,"native_trace_hits_total":74,"native_trace_unique_breakpoints":11,"false_positives":0,"offline_face_source_ready":1,"removed path_cpu_texture_bridge_ready":0,"offline_face_texture_runtime_drawn":0,"stylized_facedata_pixel_oracle":0,"real_portrait_asset_candidates":0,"profile_placeholder_assets_only":1},"status":"discard","description":"Scaffolded guarded synthetic Scaleform FileOpener/MemoryFile hook; measure stayed fail-closed.","timestamp":1782657788205,"segment":2,"confidence":null,"asi":{"hypothesis":"Reintroduce the synthetic FileOpener/MemoryFile hook scaffold under ER_EFFECTS_SCALEFORM_SYNTHETIC_TITLEBACK=1, using the grounded ABI from #589, so the next runtime diagnostic can return embedded known-good GFX bytes for er_effects_portrait_cover.gfx without touching native title job/result paths.","observed_evidence":"Added constants/counters/storage for loader open RVA 0x11ced80, string-ref ctor 0x1141390, MemoryFile ctor 0xce7bb0, synthetic basename er_effects_portrait_cover.gfx, and telemetry. Added guarded loader detour that suffix-matches filename via CStr, tail-calls original for all non-matches/gate-off, and for synthetic hits builds name_ref via 0x141141390 then MemoryFile via 0x140ce7bb0 over embedded /home/banon/er-extract/.../05_000_title.gfx bytes. Hook install is gated inside install_title_logo_force_hidden_hooks. Saved scaffold details to bd memory synthetic-fileopener-hook-scaffold-2026-06-28. .auto/measure.sh passed and remained fail-closed: score=0, title_cover_failures=2, false_positives=0.","rollback_reason":"Primary metric stayed 0; this is hook route plumbing only and no runtime synthetic URL request, MemoryFile return artifact, visible custom surface, or portrait oracle was produced.","next_action_hint":"Reapply this FileOpener hook together with the owned TitleBack diagnostic scaffold, then run a bounded runtime diagnostic with ER_EFFECTS_SCALEFORM_SYNTHETIC_TITLEBACK=1 and .auto/run_runtime_probe_once. Keep scoring disabled until telemetry proves synthetic URL hits/MemoryFile returns and a real visible loaded-character portrait surface."}}
{"run":591,"commit":"4dc167b","metric":0,"metrics":{"readiness_gate_failures":0,"target_constants_remaining":0,"helpers_missing":0,"fixed_wait_predicates":0,"autoload_static_failures":0,"asset_chain_failures":0,"dll_patch_failures":0,"native_continue_failures":0,"field58_gate_failures":0,"direct_shortcut_failures":0,"input_path_failures":0,"runtime_proof_failures":0,"runtime_mode_failures":0,"eula_popup_failures":0,"save_data_popup_failures":0,"messagebox_dialog_failures":0,"server_status_failures":0,"title_cover_failures":2,"title_cover_penalty":1800,"native_trace_blockers":0,"native_trace_hits_total":74,"native_trace_unique_breakpoints":11,"false_positives":0,"offline_face_source_ready":1,"removed path_cpu_texture_bridge_ready":0,"offline_face_texture_runtime_drawn":0,"stylized_facedata_pixel_oracle":0,"real_portrait_asset_candidates":0,"profile_placeholder_assets_only":1},"status":"discard","description":"Combined synthetic FileOpener hook with owned TitleBack diagnostic scaffold; measure stayed fail-closed.","timestamp":1782657942350,"segment":2,"confidence":null,"asi":{"hypothesis":"Reapply the guarded synthetic FileOpener/MemoryFile hook together with the owned TitleBack diagnostic scaffold under one explicit gate so a later bounded runtime can request er_effects_portrait_cover.gfx and receive a native MemoryFile-backed GFX without replacing native title/MenuWindow jobs.","observed_evidence":"Added combined constants/storage/counters for FileOpener hook and owned TitleBack object. install_title_logo_force_hidden_hooks installs loader hook only when ER_EFFECTS_SCALEFORM_SYNTHETIC_TITLEBACK=1. Loader hook suffix-matches er_effects_portrait_cover.gfx, tail-calls original for all other names, and synthetic hits construct name_ref via 0x141141390 then MemoryFile via 0x140ce7bb0 over embedded 05_000_title.gfx bytes. title_logo_ctor_force_hidden_hook now calls maybe_build_owned_titleback_diagnostic after native ctor; diagnostic calls original ctor trampoline on static 0xd0 storage with load_info {0x0000000100000005, stable UTF-16 er_effects_portrait_cover} and same param_3/param_4. Saved memory combined-synthetic-titleback-fileopener-scaffold-2026-06-28. .auto/measure.sh passed and stayed fail-closed with title_cover_failures=2, false_positives=0.","rollback_reason":"Primary metric stayed 0; this combined scaffold produced no runtime synthetic URL hit, MemoryFile return artifact, visible custom surface, or loaded-character portrait oracle.","next_action_hint":"Reapply the combined scaffold, then run bounded runtime diagnostic with ER_EFFECTS_SCALEFORM_SYNTHETIC_TITLEBACK=1 and .auto/run_runtime_probe_once. Keep scoring disabled unless telemetry proves synthetic loader hits, MemoryFile returns, and a real visible loaded-character portrait/native-surface oracle."}}
{"run":592,"commit":"4dc167b","metric":0,"metrics":{"readiness_gate_failures":0,"target_constants_remaining":0,"helpers_missing":0,"fixed_wait_predicates":0,"autoload_static_failures":0,"asset_chain_failures":0,"dll_patch_failures":0,"native_continue_failures":0,"field58_gate_failures":0,"direct_shortcut_failures":0,"input_path_failures":0,"runtime_proof_failures":1,"runtime_mode_failures":0,"eula_popup_failures":0,"save_data_popup_failures":0,"messagebox_dialog_failures":0,"server_status_failures":0,"title_cover_failures":2,"title_cover_penalty":1800,"native_trace_blockers":0,"native_trace_hits_total":74,"native_trace_unique_breakpoints":11,"false_positives":0,"offline_face_source_ready":1,"removed path_cpu_texture_bridge_ready":0,"offline_face_texture_runtime_drawn":0,"stylized_facedata_pixel_oracle":0,"real_portrait_asset_candidates":0,"profile_placeholder_assets_only":1},"status":"crash","description":"Runtime-tested combined synthetic FileOpener + owned TitleBack diagnostic; MemoryFile route hit then process exited before ready.","timestamp":1782658166157,"segment":2,"confidence":null,"asi":{"hypothesis":"Reapply the combined synthetic FileOpener/MemoryFile hook plus owned TitleBack diagnostic, enable ER_EFFECTS_SCALEFORM_SYNTHETIC_TITLEBACK=1, and run one bounded runtime probe to validate whether the synthetic er_effects_portrait_cover.gfx request reaches FileOpener and returns a native MemoryFile without claiming portrait proof.","observed_evidence":"Runtime artifact /home/banon/projects/er-effects-rs/target/runtime-probe/product-continue-direct-20260628-074809. Debug log shows hook install at +76ms: synthetic Scaleform loader 0x1411ced80 waiting for er_effects_portrait_cover.gfx. It later hit at +14732ms: synthetic Scaleform MemoryFile returned for er_effects_portrait_cover.gfx file=0x6ffffc41b798 bytes=12174 flags=0x0. Readiness failed with reason process_exited_before_ready; timing summary launch->title=1.9s, no continue/player/world. Crash log only records VEH installed; no explicit VEH crash entry. Exported telemetry did not yet include synthetic/owned-titleback counters, so debug log is the route proof.","rollback_reason":"Runtime proof failed before ready; no visible custom surface or portrait oracle, and process exited after synthetic MemoryFile return. Keeping would risk a route that destabilizes startup.","next_action_hint":"Do not repeat unchanged. Add exported telemetry for synthetic loader hits/MemoryFile returns/owned TitleBack build, and make the next runtime diagnostic avoid returning the MemoryFile until the owned TitleBack construction is confirmed and/or use a byte-identical override of an existing native 05_000_Title request first. Investigate why owned TitleBack build log was absent while the synthetic URL was requested."}}
{"run":593,"commit":"4dc167b","metric":0,"metrics":{"readiness_gate_failures":0,"target_constants_remaining":0,"helpers_missing":0,"fixed_wait_predicates":0,"autoload_static_failures":0,"asset_chain_failures":0,"dll_patch_failures":0,"native_continue_failures":0,"field58_gate_failures":0,"direct_shortcut_failures":0,"input_path_failures":0,"runtime_proof_failures":0,"runtime_mode_failures":0,"eula_popup_failures":0,"save_data_popup_failures":0,"messagebox_dialog_failures":0,"server_status_failures":0,"title_cover_failures":3,"title_cover_penalty":2000,"native_trace_blockers":0,"native_trace_hits_total":74,"native_trace_unique_breakpoints":11,"false_positives":0,"offline_face_source_ready":1,"removed path_cpu_texture_bridge_ready":0,"offline_face_texture_runtime_drawn":0,"stylized_facedata_pixel_oracle":0,"real_portrait_asset_candidates":0,"profile_placeholder_assets_only":1},"status":"discard","description":"Added synthetic TitleBack route telemetry export scaffold; static gate worsened so discarded.","timestamp":1782658399673,"segment":2,"confidence":null,"asi":{"hypothesis":"Add exported telemetry for synthetic loader hits, MemoryFile returns, and owned TitleBack construction so the next runtime diagnostic can classify whether synthetic FileOpener and owned-surface stages fired, rather than relying only on debug-log strings.","observed_evidence":"Added constants for TITLE_SCALEFORM_SYNTHETIC_LOADER_HITS, TITLE_SCALEFORM_SYNTHETIC_MEMORYFILE_RETURNS, last filename/file, TITLE_CUSTOM_COVER_TITLEBACK_BUILDS, last object/ret/load_info, and exported JSON oracle fields in telemetry.rs. .auto/measure.sh passed but primary stayed 0 and title_cover_failures worsened from 2 to 3 with title_cover_penalty 2000. Saved finding to bd memory synthetic-titleback-telemetry-export-scaffold-2026-06-28.","rollback_reason":"Primary metric did not improve and static title-cover gate worsened; telemetry-only scaffold without the matching hook/checker context creates an extra failure surface and no portrait proof.","next_action_hint":"Do not keep telemetry-only. Reintroduce telemetry only together with the synthetic FileOpener/owned TitleBack hook and adjust checks so these fields are diagnostic plumbing, not product portrait acceptance. Next investigate #592 process_exited_before_ready by adding route telemetry in the same patch as a safer byte-identical existing-GFX override or by proving owned TitleBack build before returning MemoryFile."}}
