{"run":133,"commit":"2100051","metric":1520,"metrics":{"readiness_gate_failures":0,"target_constants_remaining":0,"helpers_missing":0,"fixed_wait_predicates":0,"autoload_static_failures":0,"asset_chain_failures":0,"dll_patch_failures":0,"native_continue_failures":0,"field58_gate_failures":0,"direct_shortcut_failures":0,"input_path_failures":0,"runtime_proof_failures":1,"runtime_mode_failures":0,"eula_popup_failures":0,"save_data_popup_failures":0,"messagebox_dialog_failures":0,"server_status_failures":0,"title_cover_failures":0,"title_cover_penalty":0,"native_trace_blockers":0,"native_trace_hits_total":74,"native_trace_unique_breakpoints":11,"false_positives":0,"runtime_timeout_failures":0,"runtime_title_visual_suppressed_builds":0,"runtime_custom_cover_builds":0,"runtime_simulated_button_presses_total":0},"status":"discard","description":"corrected 14490266c as pdata unwind metadata and retargeted to real 142b26cc8 data ref","timestamp":1782406728933,"segment":0,"confidence":null,"asi":{"hypothesis":"The 0x14490266c table-slot interpretation might be wrong; validating whether it is actual gameplay dispatch metadata or PE unwind/runtime metadata should prevent chasing a false dispatcher and reveal the real non-pdata owner of FUN_1409b10a0.","rollback_reason":"Primary metric 1520 matched but did not exceed the persisted best; iteration only recorded static RE correction and no runtime proof improvement.","next_action_hint":"Map the actual non-pdata data reference 0x142b26cc8 to FUN_1409b10a0: identify its table/vtable region, constructors/class, and whether preserved 05_000_Title creates or activates that wrapper. Do not use 0x14490266c/.pdata xrefs as semantic evidence.","tooling_note":"Temporary scripts/ghidra/FindRefsToValues.java and DumpRefsInRange.java were created for static inspection; discard should revert them."}}
{"run":134,"commit":"2100051","metric":1520,"metrics":{"readiness_gate_failures":0,"target_constants_remaining":0,"helpers_missing":0,"fixed_wait_predicates":0,"autoload_static_failures":0,"asset_chain_failures":0,"dll_patch_failures":0,"native_continue_failures":0,"field58_gate_failures":0,"direct_shortcut_failures":0,"input_path_failures":0,"runtime_proof_failures":1,"runtime_mode_failures":0,"eula_popup_failures":0,"save_data_popup_failures":0,"messagebox_dialog_failures":0,"server_status_failures":0,"title_cover_failures":0,"title_cover_penalty":0,"native_trace_blockers":0,"native_trace_hits_total":74,"native_trace_unique_breakpoints":11,"false_positives":0,"runtime_timeout_failures":0,"runtime_title_visual_suppressed_builds":0,"runtime_custom_cover_builds":0,"runtime_simulated_button_presses_total":0},"status":"discard","description":"mapped 142b26cc8 as vtable/metadata-region ref needing RTTI clarification","timestamp":1782407022129,"segment":0,"confidence":null,"asi":{"hypothesis":"Mapping the actual non-pdata data reference at 0x142b26cc8 should identify the vtable/class/constructor path for the wrapper that calls FUN_1409b10a0, or reveal that the Ghidra data ref requires additional RTTI clarification before runtime hooks.","rollback_reason":"Primary metric 1520 matched but did not exceed the persisted best; iteration only recorded static RE guidance and no runtime proof improvement.","next_action_hint":"Use Ghidra type/vtable/RTTI lookup or a small exact data-reference script to identify the class/slot name for 0x142b26cc8 and the constructor path that creates that wrapper under native title. Do not infer semantic activation from the metadata ref alone."}}
{"run":135,"commit":"2100051","metric":1520,"metrics":{"readiness_gate_failures":0,"target_constants_remaining":0,"helpers_missing":0,"fixed_wait_predicates":0,"autoload_static_failures":0,"asset_chain_failures":0,"dll_patch_failures":0,"native_continue_failures":0,"field58_gate_failures":0,"direct_shortcut_failures":0,"input_path_failures":0,"runtime_proof_failures":1,"runtime_mode_failures":0,"eula_popup_failures":0,"save_data_popup_failures":0,"messagebox_dialog_failures":0,"server_status_failures":0,"title_cover_failures":0,"title_cover_penalty":0,"native_trace_blockers":0,"native_trace_hits_total":74,"native_trace_unique_breakpoints":11,"false_positives":0,"runtime_timeout_failures":0,"runtime_title_visual_suppressed_builds":0,"runtime_custom_cover_builds":0,"runtime_simulated_button_presses_total":0},"status":"discard","description":"resolved 142b26cc8 to lambda_fcab std::function vtable invoke slot","timestamp":1782407368453,"segment":0,"confidence":null,"asi":{"hypothesis":"Ghidra type/vtable lookup for 0x142b26cc8 should identify the class/slot name for the function that reaches FUN_1409b10a0 and distinguish native enqueue evidence from cold function invocation.","rollback_reason":"Primary metric 1520 matched but did not exceed the persisted best; static RE finding only, no product proof improvement.","next_action_hint":"Find where lambda_fcab std::function is constructed/enqueued under native title through the builders/constructors referencing root 0x142b26c80 (0x1409b25f0, 0x1409b08c0, 0x1409ad9b0, 0x1409abd40). Do not invoke 0x1409b10a0/0x1409a93a0 cold; preserve/enqueue the native job path."}}
{"run":136,"commit":"2100051","metric":1520,"metrics":{"readiness_gate_failures":0,"target_constants_remaining":0,"helpers_missing":0,"fixed_wait_predicates":0,"autoload_static_failures":0,"asset_chain_failures":0,"dll_patch_failures":0,"native_continue_failures":0,"field58_gate_failures":0,"direct_shortcut_failures":0,"input_path_failures":0,"runtime_proof_failures":1,"runtime_mode_failures":0,"eula_popup_failures":0,"save_data_popup_failures":0,"messagebox_dialog_failures":0,"server_status_failures":0,"title_cover_failures":0,"title_cover_penalty":0,"native_trace_blockers":0,"native_trace_hits_total":74,"native_trace_unique_breakpoints":11,"false_positives":0,"runtime_timeout_failures":0,"runtime_title_visual_suppressed_builds":0,"runtime_custom_cover_builds":0,"runtime_simulated_button_presses_total":0},"status":"discard","description":"classified lambda_fcab copy helpers and 9ad9b0 as title MenuJob sequence builder","timestamp":1782407623011,"segment":0,"confidence":null,"asi":{"hypothesis":"Decoding the builders/constructors referencing lambda_fcab's vtable root should show where the native title path constructs or enqueues the Continue-arm std::function without invoking the arm cold.","rollback_reason":"Primary metric 1520 matched but did not exceed the persisted best; static classification only, no product proof improvement.","next_action_hint":"Map callers/refs of copy helpers 0x1409abd40 and 0x1409b25f0 plus the exact stack/object slot in 0x1409ad9b0 where lambda_fcab is copied into a MenuJob. Verify whether preserving native 05_000_Title lets that sequence reach the node; do not cold-call 0x1409b10a0/0x1409a93a0."}}
{"run":137,"commit":"2100051","metric":1520,"metrics":{"readiness_gate_failures":0,"target_constants_remaining":0,"helpers_missing":0,"fixed_wait_predicates":0,"autoload_static_failures":0,"asset_chain_failures":0,"dll_patch_failures":0,"native_continue_failures":0,"field58_gate_failures":0,"direct_shortcut_failures":0,"input_path_failures":0,"runtime_proof_failures":1,"runtime_mode_failures":0,"eula_popup_failures":0,"save_data_popup_failures":0,"messagebox_dialog_failures":0,"server_status_failures":0,"title_cover_failures":0,"title_cover_penalty":0,"native_trace_blockers":0,"native_trace_hits_total":74,"native_trace_unique_breakpoints":11,"false_positives":0,"runtime_timeout_failures":0,"runtime_title_visual_suppressed_builds":0,"runtime_custom_cover_builds":0,"runtime_simulated_button_presses_total":0},"status":"discard","description":"classified lambda_fcab helper xrefs as vtable/unwind metadata not enqueue sites","timestamp":1782408334779,"segment":0,"confidence":null,"asi":{"hypothesis":"Mapping callers/refs of lambda_fcab copy helpers 0x1409abd40 and 0x1409b25f0 should reveal whether there is a normal native enqueue callsite or only vtable/metadata references.","rollback_reason":"Primary metric 1520 matched but did not exceed the persisted best; iteration only recorded static RE correction and no runtime/product proof improvement.","next_action_hint":"Do not chase XrefCallers of lambda_fcab helper functions as enqueue sites. Instead locate writes/copies of vtable root 0x142b26c80 into stack/object storage inside 0x1409ad9b0 and follow the subsequent FUN_140744b60/ChainMenuJobs consumer. Use Ghidra instruction-level refs in dump address space, not raw deobf windows at the same VA without shift verification."}}
{"run":138,"commit":"2100051","metric":1520,"metrics":{"readiness_gate_failures":0,"target_constants_remaining":0,"helpers_missing":0,"fixed_wait_predicates":0,"autoload_static_failures":0,"asset_chain_failures":0,"dll_patch_failures":0,"native_continue_failures":0,"field58_gate_failures":0,"direct_shortcut_failures":0,"input_path_failures":0,"runtime_proof_failures":1,"runtime_mode_failures":0,"eula_popup_failures":0,"save_data_popup_failures":0,"messagebox_dialog_failures":0,"server_status_failures":0,"title_cover_failures":0,"title_cover_penalty":0,"native_trace_blockers":0,"native_trace_hits_total":74,"native_trace_unique_breakpoints":11,"false_positives":0,"runtime_timeout_failures":0,"runtime_title_visual_suppressed_builds":0,"runtime_custom_cover_builds":0,"runtime_simulated_button_presses_total":0},"status":"discard","description":"mapped lambda_fcab stack construction and MenuFunctorJob builder in 9ad9b0","timestamp":1782408557060,"segment":0,"confidence":null,"asi":{"hypothesis":"Locating writes/copies of vtable root 0x142b26c80 inside FUN_1409ad9b0 should reveal the exact stack/object std::function site and immediate MenuJob consumer for lambda_fcab without cold-invoking the Continue arm.","rollback_reason":"Primary metric 1520 matched but did not exceed the persisted best; static RE finding only, no runtime/product proof improvement.","next_action_hint":"Classify the lambda_fcab-produced MenuFunctorJob placement in the chain returned by FUN_1409ad9b0: which state/result runs it, whether preserved native 05_000_Title reaches it, and whether a render-only suppression can preserve that path. Do not cold-call lambda_fcab/FUN_1409b10a0/FUN_1409a93a0."}}
{"run":139,"commit":"2100051","metric":1520,"metrics":{"readiness_gate_failures":0,"target_constants_remaining":0,"helpers_missing":0,"fixed_wait_predicates":0,"autoload_static_failures":0,"asset_chain_failures":0,"dll_patch_failures":0,"native_continue_failures":0,"field58_gate_failures":0,"direct_shortcut_failures":0,"input_path_failures":0,"runtime_proof_failures":1,"runtime_mode_failures":0,"eula_popup_failures":0,"save_data_popup_failures":0,"messagebox_dialog_failures":0,"server_status_failures":0,"title_cover_failures":0,"title_cover_penalty":0,"native_trace_blockers":0,"native_trace_hits_total":74,"native_trace_unique_breakpoints":11,"false_positives":0,"runtime_timeout_failures":0,"runtime_title_visual_suppressed_builds":0,"runtime_custom_cover_builds":0,"runtime_simulated_button_presses_total":0},"status":"discard","description":"mapped lambda_fcab MenuFunctorJob late append placement in 9ad9b0 title sequence","timestamp":1782408785371,"segment":0,"confidence":null,"asi":{"hypothesis":"Classifying the lambda_fcab-produced MenuFunctorJob placement in FUN_1409ad9b0 should reveal whether it is first-run, conditional, or appended late in the native title job sequence before any product hook or runtime instrumentation.","rollback_reason":"Primary metric 1520 matched but did not exceed the persisted best; static RE finding only, no runtime/product proof improvement.","next_action_hint":"Decode 0x1407a7ca0/composite job semantics or instrument preserved-native title job to see whether execution reaches the R14 appended lambda_fcab MenuFunctorJob. Do not call R14/lambda_fcab/FUN_1409b10a0/FUN_1409a93a0 cold."}}
{"run":140,"commit":"2100051","metric":1520,"metrics":{"readiness_gate_failures":0,"target_constants_remaining":0,"helpers_missing":0,"fixed_wait_predicates":0,"autoload_static_failures":0,"asset_chain_failures":0,"dll_patch_failures":0,"native_continue_failures":0,"field58_gate_failures":0,"direct_shortcut_failures":0,"input_path_failures":0,"runtime_proof_failures":1,"runtime_mode_failures":0,"eula_popup_failures":0,"save_data_popup_failures":0,"messagebox_dialog_failures":0,"server_status_failures":0,"title_cover_failures":0,"title_cover_penalty":0,"native_trace_blockers":0,"native_trace_hits_total":74,"native_trace_unique_breakpoints":11,"false_positives":0,"runtime_timeout_failures":0,"runtime_title_visual_suppressed_builds":0,"runtime_custom_cover_builds":0,"runtime_simulated_button_presses_total":0},"status":"discard","description":"confirmed 1407a7ca0 as ChainMenuJobs append primitive for late lambda_fcab job","timestamp":1782408988288,"segment":0,"confidence":null,"asi":{"hypothesis":"Decoding 0x1407a7ca0/composite job semantics should prove whether the late R14 lambda_fcab job is directly invoked, conditionally selected, or appended into a native FixOrderJobSequence.","rollback_reason":"Primary metric 1520 matched but did not exceed the persisted best; static RE finding only, no runtime/product proof improvement.","next_action_hint":"Runtime instrumentation should be passive and preserved-native: hook/decode FixOrderJobSequence::Run or MenuFunctorJob::Run to prove whether the title sequence executes the appended R14 lambda_fcab under preserved 05_000_Title. Product hook must preserve this sequence while suppressing render; do not cold-call ChainMenuJobs, R14, lambda_fcab, or FUN_1409a93a0."}}
{"run":141,"commit":"2100051","metric":1520,"metrics":{"readiness_gate_failures":0,"target_constants_remaining":0,"helpers_missing":0,"fixed_wait_predicates":0,"autoload_static_failures":0,"asset_chain_failures":0,"dll_patch_failures":0,"native_continue_failures":0,"field58_gate_failures":0,"direct_shortcut_failures":0,"input_path_failures":0,"runtime_proof_failures":1,"runtime_mode_failures":0,"eula_popup_failures":0,"save_data_popup_failures":0,"messagebox_dialog_failures":0,"server_status_failures":0,"title_cover_failures":0,"title_cover_penalty":0,"native_trace_blockers":0,"native_trace_hits_total":74,"native_trace_unique_breakpoints":11,"false_positives":0,"runtime_timeout_failures":0,"runtime_title_visual_suppressed_builds":0,"runtime_custom_cover_builds":0,"runtime_simulated_button_presses_total":0},"status":"discard","description":"identified Sequence iterator as safer passive oracle for appended lambda_fcab than blind FixOrder hook","timestamp":1782409359945,"segment":0,"confidence":null,"asi":{"hypothesis":"Classifying passive hook points for the appended R14 lambda_fcab job should identify the least invasive runtime oracle. Existing source notes may already point to a better FD4 Sequence child iterator than blind FixOrderJobSequence::Run hooks.","rollback_reason":"Primary metric 1520 matched but did not exceed the persisted best; static instrumentation guidance only, no runtime/product proof improvement.","next_action_hint":"Implement/passively enable Sequence iterator or MenuFunctor diagnostics under preserved-native title to fingerprint children whose std::function impl/vtable is lambda_fcab (0x142b26c80, invoke slot 0x142b26cc8 -> FUN_1409b10a0). Report whether appended R14 child is present/ticked. Do not invoke FixOrderJobSequence, ChainMenuJobs, or lambda_fcab directly."}}
{"run":142,"commit":"2100051","metric":1520,"metrics":{"readiness_gate_failures":0,"target_constants_remaining":0,"helpers_missing":0,"fixed_wait_predicates":0,"autoload_static_failures":0,"asset_chain_failures":0,"dll_patch_failures":0,"native_continue_failures":0,"field58_gate_failures":0,"direct_shortcut_failures":0,"input_path_failures":0,"runtime_proof_failures":1,"runtime_mode_failures":0,"eula_popup_failures":0,"save_data_popup_failures":0,"messagebox_dialog_failures":0,"server_status_failures":0,"title_cover_failures":0,"title_cover_penalty":0,"native_trace_blockers":0,"native_trace_hits_total":74,"native_trace_unique_breakpoints":11,"false_positives":0,"runtime_timeout_failures":0,"runtime_title_visual_suppressed_builds":0,"runtime_custom_cover_builds":0,"runtime_simulated_button_presses_total":0},"status":"discard","description":"added passive Sequence iterator scan for lambda_fcab child vtable fingerprint","timestamp":1782409656268,"segment":0,"confidence":null,"asi":{"hypothesis":"A capped read-only scan in the existing Sequence iterator can fingerprint native children containing the lambda_fcab std::function vtable root (base+0x2b26c80), giving a passive oracle for whether the preserved title sequence reaches the appended Continue-arm functor.","rollback_reason":"Primary metric 1520 matched but did not exceed the persisted best; diagnostic-only mutation did not add product/runtime proof to the benchmark.","next_action_hint":"If continuing this path, make the runtime probe actually enable preserved-native title plus Sequence iterator logging and inspect SEQ-ITER-LAMBDA-FCAB trace lines. Otherwise keep the static finding and pursue render-only Part A suppression that preserves the title sequence.","validation":"./.auto/measure.sh passed; false_positives=0; runtime_proof_failures remains 1."}}
{"run":143,"commit":"2100051","metric":1470,"metrics":{"readiness_gate_failures":0,"target_constants_remaining":0,"helpers_missing":0,"fixed_wait_predicates":0,"autoload_static_failures":0,"asset_chain_failures":0,"dll_patch_failures":0,"native_continue_failures":0,"field58_gate_failures":0,"direct_shortcut_failures":0,"input_path_failures":0,"runtime_proof_failures":1,"runtime_mode_failures":0,"eula_popup_failures":0,"save_data_popup_failures":0,"messagebox_dialog_failures":0,"server_status_failures":0,"title_cover_failures":1,"title_cover_penalty":50,"native_trace_blockers":0,"native_trace_hits_total":74,"native_trace_unique_breakpoints":11,"false_positives":0,"runtime_timeout_failures":0,"runtime_title_visual_suppressed_builds":0,"runtime_custom_cover_builds":0,"runtime_simulated_button_presses_total":0},"status":"discard","description":"tried native-preserving BeginTitle suppression without returning blocking ProfileSelect cover","timestamp":1782409883652,"segment":0,"confidence":null,"asi":{"hypothesis":"Calling the native BeginTitle wrapper first to preserve title/FixOrder/native Continue side effects, then clearing the visual out slot and not returning ProfileSelect, should align Part A with product safety even if Part B remains unresolved.","rollback_reason":"Primary metric regressed from 1520 to 1470 because title_cover_failures=1/title_cover_penalty=50: removing the ProfileSelect build removed the benchmark's observable Part B cover path. This is product-safer but incomplete without a non-blocking custom cover surface.","next_action_hint":"Do not reintroduce ProfileSelect in the BeginTitle out slot just to satisfy Part B; instead implement a non-blocking/custom cover path or separate telemetry that proves custom cover rendering while preserving the native job sequence. The native-preserving suppression shape is a useful base only after Part B is non-blocking.","validation":"./.auto/measure.sh passed; false_positives=0; title_cover_failures=1."}}
{"run":144,"commit":"2100051","metric":1520,"metrics":{"readiness_gate_failures":0,"target_constants_remaining":0,"helpers_missing":0,"fixed_wait_predicates":0,"autoload_static_failures":0,"asset_chain_failures":0,"dll_patch_failures":0,"native_continue_failures":0,"field58_gate_failures":0,"direct_shortcut_failures":0,"input_path_failures":0,"runtime_proof_failures":1,"runtime_mode_failures":0,"eula_popup_failures":0,"save_data_popup_failures":0,"messagebox_dialog_failures":0,"server_status_failures":0,"title_cover_failures":0,"title_cover_penalty":0,"native_trace_blockers":0,"native_trace_hits_total":74,"native_trace_unique_breakpoints":11,"false_positives":0,"runtime_timeout_failures":0,"runtime_title_visual_suppressed_builds":0,"runtime_custom_cover_builds":0,"runtime_simulated_button_presses_total":0},"status":"discard","description":"tested native-preserving BeginTitle with scratch-only ProfileSelect cover telemetry","timestamp":1782410096920,"segment":0,"confidence":null,"asi":{"hypothesis":"Native-preserving BeginTitle suppression can keep title/FixOrder side effects while a scratch-only ProfileSelect build maintains observable Part B telemetry without occupying the BeginTitle out slot.","rollback_reason":"Primary metric only matched best (1520) and the scratch ProfileSelect job is not real visible/rendered Part B proof; keeping it would risk overfitting the static oracle. Need a true non-blocking cover render path.","next_action_hint":"Pursue a real non-blocking cover surface/render hook instead of scratch-only telemetry. The safe shape remains: call native BeginTitle wrapper, suppress native title render/out slot, and render custom cover outside the BeginTitle job sequence.","validation":"./.auto/measure.sh passed; false_positives=0; title_cover_failures=0 but runtime_proof_failures remains 1."}}
