{"run":299,"commit":"4942b6b","metric":1120,"metrics":{"readiness_gate_failures":0,"target_constants_remaining":0,"helpers_missing":0,"fixed_wait_predicates":0,"autoload_static_failures":0,"asset_chain_failures":0,"dll_patch_failures":0,"native_continue_failures":0,"field58_gate_failures":0,"direct_shortcut_failures":0,"input_path_failures":0,"runtime_proof_failures":1,"runtime_mode_failures":0,"eula_popup_failures":0,"save_data_popup_failures":0,"messagebox_dialog_failures":0,"server_status_failures":0,"title_cover_failures":2,"title_cover_penalty":400,"native_trace_blockers":0,"native_trace_hits_total":74,"native_trace_unique_breakpoints":11,"false_positives":0,"runtime_timeout_failures":0,"runtime_title_visual_suppressed_builds":0,"runtime_custom_cover_builds":0,"runtime_simulated_button_presses_total":0},"status":"keep","description":"delayed CSNowLoadingHelper observer passes but never observes helper","timestamp":1782454437950,"segment":0,"confidence":null,"asi":{"hypothesis":"Delaying CSNowLoadingHelper observer installation until TITLE_ACCEPT_BYTE_GATE_FIRED should avoid the attach-time crash and reveal the native black/progress loading surface state.","evidence":"Runtime artifact target/runtime-probe/product-continue-direct-20260625-231258 passed: ready=true reason=world_stable, Banon loaded, expected_save_match=true, no_postload_popup=true, simulated_button_presses_total=0, msgboxes=0. The delayed hook installed at +15654ms after title-accept-byte, but final telemetry had ctor_hits=0/update_hits=0/last_this=0, while oracle_now_loading=1 and the user screenshot still showed only native Updating save data/progress UI. This hook is safe delayed, but not useful on this path.","next_action_hint":"Do not use CSNowLoadingHelper as the cover insertion point for this proof path unless static RE finds the real draw owner. Next target should be CSDrawStep/CSFakeLoadingScreenImp or a custom root-reachable GFX/surface; the current visual remains absent."}}
{"run":300,"commit":"4942b6b","metric":1120,"metrics":{"readiness_gate_failures":0,"target_constants_remaining":0,"helpers_missing":0,"fixed_wait_predicates":0,"autoload_static_failures":0,"asset_chain_failures":0,"dll_patch_failures":0,"native_continue_failures":0,"field58_gate_failures":0,"direct_shortcut_failures":0,"input_path_failures":0,"runtime_proof_failures":1,"runtime_mode_failures":0,"eula_popup_failures":0,"save_data_popup_failures":0,"messagebox_dialog_failures":0,"server_status_failures":0,"title_cover_failures":2,"title_cover_penalty":400,"native_trace_blockers":0,"native_trace_hits_total":74,"native_trace_unique_breakpoints":11,"false_positives":0,"runtime_timeout_failures":0,"runtime_title_visual_suppressed_builds":0,"runtime_custom_cover_builds":0,"runtime_simulated_button_presses_total":0},"status":"discard","description":"read CSFakeLoadingScreen singleton telemetry without hooks","timestamp":1782454673365,"segment":0,"confidence":null,"asi":{"hypothesis":"The visible black/progress UI is controlled by the CSDrawStep-created CSFakeLoadingScreen singleton at live base+0x3d74868. Reading its fields directly (no hooks) should safely identify whether this singleton can host a custom loading/masquerade surface.","evidence":"Runtime artifact target/runtime-probe/product-continue-direct-20260625-231647 passed: ready=true world_stable, Banon loaded, expected_save_match=true, no_postload_popup=true, zero simulated input, zero MessageBox. Telemetry read oracle_fake_loading_screen=0x7fff9fe01140, oracle_fake_loading_visible=0, fields +0xc/+0x10=0, while oracle_now_loading=1. No now-loading hooks were installed. Finding appended to .auto/ideas.md for sampling during loading instead of final world-stable telemetry.","rollback_reason":"Primary metric stayed 1120 and no custom/masquerade scene was added; final fake-loading visible byte was 0, so this did not improve product score.","next_action_hint":"Next iteration should sample CSFakeLoadingScreen during the loading window or statically decode CSDrawStep/FUN_140bbf1c0 draw ownership; do not count the black native UI as the desired cover."}}
{"run":301,"commit":"5e84d47","metric":1120,"metrics":{"readiness_gate_failures":0,"target_constants_remaining":0,"helpers_missing":0,"fixed_wait_predicates":0,"autoload_static_failures":0,"asset_chain_failures":0,"dll_patch_failures":0,"native_continue_failures":0,"field58_gate_failures":0,"direct_shortcut_failures":0,"input_path_failures":0,"runtime_proof_failures":1,"runtime_mode_failures":0,"eula_popup_failures":0,"save_data_popup_failures":0,"messagebox_dialog_failures":0,"server_status_failures":0,"title_cover_failures":2,"title_cover_penalty":400,"native_trace_blockers":0,"native_trace_hits_total":74,"native_trace_unique_breakpoints":11,"false_positives":0,"runtime_timeout_failures":0,"runtime_title_visual_suppressed_builds":0,"runtime_custom_cover_builds":0,"runtime_simulated_button_presses_total":0},"status":"keep","description":"sample CSFakeLoadingScreen visibility across telemetry window","timestamp":1782454798268,"segment":0,"confidence":null,"asi":{"hypothesis":"The prior read-only CSFakeLoadingScreen singleton sample only captured final world-stable state. Latching sample_count/visible_samples over every telemetry write should show whether the native black/save-update UI is represented by CSFakeLoadingScreen during the loading window, without hooks or native calls.","evidence":"Added RuntimeGlobalRva::FakeLoadingScreenSingleton=0x3d74868 and read-only telemetry fields oracle_fake_loading_screen/visible/field_c/field_10 plus latched sample_count/visible_samples/any_visible. No hooks or writes added. cargo fmt/cargo xwin build passed; static measure remains 1120 because no cover scene exists yet.","next_action_hint":"Run marker-gated runtime. If oracle_fake_loading_visible_samples>0, statically decode CSDrawStep/FUN_140bbf1c0 draw ownership for a custom cover insertion point. If samples stay 0 while screenshot shows the black UI, this singleton is only a toggle, not the drawable surface."}}
{"run":302,"commit":"5e84d47","metric":1120,"metrics":{"readiness_gate_failures":0,"target_constants_remaining":0,"helpers_missing":0,"fixed_wait_predicates":0,"autoload_static_failures":0,"asset_chain_failures":0,"dll_patch_failures":0,"native_continue_failures":0,"field58_gate_failures":0,"direct_shortcut_failures":0,"input_path_failures":0,"runtime_proof_failures":1,"runtime_mode_failures":0,"eula_popup_failures":0,"save_data_popup_failures":0,"messagebox_dialog_failures":0,"server_status_failures":0,"title_cover_failures":2,"title_cover_penalty":400,"native_trace_blockers":0,"native_trace_hits_total":74,"native_trace_unique_breakpoints":11,"false_positives":0,"runtime_timeout_failures":0,"runtime_title_visual_suppressed_builds":0,"runtime_custom_cover_builds":0,"runtime_simulated_button_presses_total":0},"status":"discard","description":"latch CSFakeLoadingScreen visible samples during loading","timestamp":1782454866685,"segment":0,"confidence":null,"asi":{"hypothesis":"Latching CSFakeLoadingScreen samples over every telemetry write should prove whether the native black/loading UI is represented by the singleton during the loading window, not just at final world-stable state.","evidence":"Runtime artifact target/runtime-probe/product-continue-direct-20260625-232005 passed: Banon loaded, world_stable, expected_save_match=true, zero input, zero MessageBox. Telemetry showed oracle_fake_loading_screen=0x7fff9fe01140, sample_count=62, visible_samples=17, any_visible=true; final visible=0. User observation matched: only black native screen, no custom/character scene.","rollback_reason":"Primary metric stayed 1120 and no custom cover was added. The finding is useful evidence, but keeping code would only add telemetry and not improve the objective.","next_action_hint":"Static-decode FUN_140bbf1c0/CSDrawStep fake-loading draw ownership and the fields around CSFakeLoadingScreen+0x8/+0xc/+0x10. The singleton is confirmed active during the black screen; next mutation must replace/draw over that surface with a real custom scene, not merely observe it."}}
{"run":303,"commit":"4942b6b","metric":1120,"metrics":{"readiness_gate_failures":0,"target_constants_remaining":0,"helpers_missing":0,"fixed_wait_predicates":0,"autoload_static_failures":0,"asset_chain_failures":0,"dll_patch_failures":0,"native_continue_failures":0,"field58_gate_failures":0,"direct_shortcut_failures":0,"input_path_failures":0,"runtime_proof_failures":1,"runtime_mode_failures":0,"eula_popup_failures":0,"save_data_popup_failures":0,"messagebox_dialog_failures":0,"server_status_failures":0,"title_cover_failures":2,"title_cover_penalty":400,"native_trace_blockers":0,"native_trace_hits_total":74,"native_trace_unique_breakpoints":11,"false_positives":0,"runtime_timeout_failures":0,"runtime_title_visual_suppressed_builds":0,"runtime_custom_cover_builds":0,"runtime_simulated_button_presses_total":0},"status":"discard","description":"classify CSFakeLoadingScreen draw calls as no-op dead end","timestamp":1782454949364,"segment":0,"confidence":null,"asi":{"hypothesis":"Since CSFakeLoadingScreen was visible during the black/loading window, its render callbacks might be the custom-cover insertion point.","evidence":"Static Ghidra decompile/disassembly of FUN_140bbf1d0 and FUN_140bbf130 shows both are RET-only no-ops. CSDrawStep/FUN_140b14520 calls them around GLOBAL_CSFakeLoadingScreen, but they do not own drawing. The real drawable path is likely the surrounding RenderMan/CSGraphics calls in FUN_140b14520 or a separate custom Scaleform/GFX surface. Finding appended to .auto/ideas.md.","rollback_reason":"No code/product change and primary metric unchanged at 1120; this is a dead-end classification, not a keepable improvement.","next_action_hint":"Pivot to RenderMan/CSGraphics calls in FUN_140b14520 (0x140cc7200/7140/6cf0/7040/6a10/6e50/7650), or build a separate custom root-reachable Scaleform/GFX surface. Do not mutate CSFakeLoadingScreen+0x8 or hook its no-op callbacks as a cover path."}}
{"run":304,"commit":"28584cd","metric":1120,"metrics":{"readiness_gate_failures":0,"target_constants_remaining":0,"helpers_missing":0,"fixed_wait_predicates":0,"autoload_static_failures":0,"asset_chain_failures":0,"dll_patch_failures":0,"native_continue_failures":0,"field58_gate_failures":0,"direct_shortcut_failures":0,"input_path_failures":0,"runtime_proof_failures":1,"runtime_mode_failures":0,"eula_popup_failures":0,"save_data_popup_failures":0,"messagebox_dialog_failures":0,"server_status_failures":0,"title_cover_failures":2,"title_cover_penalty":400,"native_trace_blockers":0,"native_trace_hits_total":74,"native_trace_unique_breakpoints":11,"false_positives":0,"runtime_timeout_failures":0,"runtime_title_visual_suppressed_builds":0,"runtime_custom_cover_builds":0,"runtime_simulated_button_presses_total":0},"status":"keep","description":"add read-only RenderMan loading-layer telemetry","timestamp":1782455111750,"segment":0,"confidence":null,"asi":{"hypothesis":"Static RE of FUN_140b14520 shows the actual drawable layers around the black/loading interval are RenderMan/CSGraphics/CSScaleform CSEzDraw slots, not CSFakeLoadingScreen's no-op callbacks. Read-only telemetry of RendMan slots during fake-loading-visible samples should identify the non-null layer candidates for a custom cover insertion point without hooks or mutations.","evidence":"Decoded live/dump addresses: FUN_140b14520 -> deobf 0x140b14430; calls RenderMan slots via 0x140cc7110/7050/6c00/6f50/6920/6d60/7560. Added RuntimeGlobalRva::CsGraphicsSingleton=0x3d71c48, RendManSingleton=0x3d7b0c0, CsScaleformSingleton=0x3d83148 and telemetry for RendMan slots +0x28/+0x30/+0x38/+0x40/+0x78, CSGraphics+0x68, CSScaleform, and visible-slot masks sampled only while CSFakeLoadingScreen+0x8 is visible. cargo fmt/cargo xwin build passed; static measure unchanged at 1120 until runtime proof samples fields.","next_action_hint":"Run marker-gated runtime. If visible_slots_mask identifies non-null layers during fake-loading-visible samples, statically decode that slot's constructor/owner and target it for a real custom cover. If zero, pivot to custom root-reachable Scaleform/GFX asset."}}
{"run":305,"commit":"eed1a79","metric":1120,"metrics":{"readiness_gate_failures":0,"target_constants_remaining":0,"helpers_missing":0,"fixed_wait_predicates":0,"autoload_static_failures":0,"asset_chain_failures":0,"dll_patch_failures":0,"native_continue_failures":0,"field58_gate_failures":0,"direct_shortcut_failures":0,"input_path_failures":0,"runtime_proof_failures":1,"runtime_mode_failures":0,"eula_popup_failures":0,"save_data_popup_failures":0,"messagebox_dialog_failures":0,"server_status_failures":0,"title_cover_failures":2,"title_cover_penalty":400,"native_trace_blockers":0,"native_trace_hits_total":74,"native_trace_unique_breakpoints":11,"false_positives":0,"runtime_timeout_failures":0,"runtime_title_visual_suppressed_builds":0,"runtime_custom_cover_builds":0,"runtime_simulated_button_presses_total":0},"status":"keep","description":"runtime maps active RenderMan layers during fake-loading black screen","timestamp":1782455179158,"segment":0,"confidence":null,"asi":{"hypothesis":"Read-only telemetry of RenderMan/CSGraphics/CSScaleform CSEzDraw slots while CSFakeLoadingScreen is visible should identify the actual drawable layer candidates for the black/checking-save-data screen, without hooks or mutations.","evidence":"Runtime artifact target/runtime-probe/product-continue-direct-20260625-232519 passed: Banon loaded, world_stable, expected_save_match=true, zero input, zero MessageBox. Screenshot showed native 'Checking save data...' black UI. Telemetry during fake_loading_visible samples: visible_samples=17, rendman=0x7fff9e5e00f0, csgraphics=0x7fff9ea80130, csscaleform=0x7ffe9e5ec000, csgraphics+0x68=0x7fff9e51e100, RendMan slots +0x28/+0x30/+0x38/+0x40/+0x78 all non-null, last_slots_mask=visible_slots_mask=127, nonnull_samples=17.","next_action_hint":"Decode the CSEzDraw layers behind RendMan slots +0x28/+0x30/+0x38/+0x40/+0x78 and CSScaleform draw path. The likely cover insertion point is one of these render-layer slots or a custom root-reachable Scaleform/GFX surface, not CSFakeLoadingScreen itself."}}
{"run":306,"commit":"7cc5948","metric":1120,"metrics":{"readiness_gate_failures":0,"target_constants_remaining":0,"helpers_missing":0,"fixed_wait_predicates":0,"autoload_static_failures":0,"asset_chain_failures":0,"dll_patch_failures":0,"native_continue_failures":0,"field58_gate_failures":0,"direct_shortcut_failures":0,"input_path_failures":0,"runtime_proof_failures":1,"runtime_mode_failures":0,"eula_popup_failures":0,"save_data_popup_failures":0,"messagebox_dialog_failures":0,"server_status_failures":0,"title_cover_failures":2,"title_cover_penalty":400,"native_trace_blockers":0,"native_trace_hits_total":74,"native_trace_unique_breakpoints":11,"false_positives":0,"runtime_timeout_failures":0,"runtime_title_visual_suppressed_builds":0,"runtime_custom_cover_builds":0,"runtime_simulated_button_presses_total":0},"status":"keep","description":"add vtable latches for loading render layers","timestamp":1782455330923,"segment":0,"confidence":null,"asi":{"hypothesis":"The active RendMan/CSGraphics/CSScaleform layer objects during CSFakeLoadingScreen visibility can be classified by latching their vtables only during visible samples. This should reveal which class/layer is the real custom-cover insertion candidate without hooks or product mutation.","evidence":"Added read-only vtable fields for RendMan, CSGraphics, CSScaleform, RendMan slots +0x28/+0x30/+0x38/+0x40/+0x78, and CSGraphics+0x68. Visible-window vtables are stored only when fake_loading_visible > 0 to avoid final/world-stable pointer churn contaminating the classification. cargo fmt and cargo xwin build passed; static measure unchanged at 1120 because no cover is added yet.","next_action_hint":"Run marker-gated runtime and inspect oracle_render_loading_visible_*_vtable fields. Then map those vtables through Ghidra/type names before mutating any render layer."}}
{"run":307,"commit":"7cc5948","metric":0,"metrics":{"readiness_gate_failures":0,"target_constants_remaining":0,"helpers_missing":0,"fixed_wait_predicates":0,"autoload_static_failures":0,"asset_chain_failures":0,"dll_patch_failures":0,"native_continue_failures":0,"field58_gate_failures":0,"direct_shortcut_failures":0,"input_path_failures":0,"runtime_proof_failures":1,"runtime_mode_failures":0,"eula_popup_failures":0,"save_data_popup_failures":0,"messagebox_dialog_failures":0,"server_status_failures":0,"title_cover_failures":2,"title_cover_penalty":400,"native_trace_blockers":0,"native_trace_hits_total":74,"native_trace_unique_breakpoints":11,"false_positives":0,"runtime_timeout_failures":0,"runtime_title_visual_suppressed_builds":0,"runtime_custom_cover_builds":0,"runtime_simulated_button_presses_total":0},"status":"crash","description":"runtime vtable latch classified layers but exited before world stable","timestamp":1782455389553,"segment":0,"confidence":null,"asi":{"hypothesis":"Latch vtables for active RendMan/CSGraphics/CSScaleform objects during CSFakeLoadingScreen visibility to classify the black/loading draw layers without hooks or native calls.","evidence":"Runtime artifact /home/banon/projects/er-effects-rs/target/runtime-probe/product-continue-direct-20260625-232857 failed after the black/loading window: readiness reason process_exited_before_ready, native_continue_chain_stage=pre_submit, oracle_char_name=Banon, expected_save_match=true, player_present=false, zero input, zero MessageBox. The diagnostic succeeded before exit: fake_loading_visible_samples=18, visible_slots_mask=127, all RendMan slot vtables at visible time were 0x142b7e410 and CSGraphics+0x68 vtable was 0x142b81050.","rollback_reason":"Even read-only vtable dereference/latching correlated with a runtime exit before world stable in this run. Do not keep this branch as runtime-safe proof; preserve the observed vtable identities in ASI and continue with static Ghidra mapping instead.","next_action_hint":"Static-map vtable 0x142b7e410 and 0x142b81050 in Ghidra. If more runtime classification is needed, reduce telemetry to sampling only slot pointers/masks (already validated in #305) and do not dereference child vtables during the loading window."}}
{"run":308,"commit":"7cc5948","metric":0,"metrics":{"readiness_gate_failures":0,"target_constants_remaining":0,"helpers_missing":0,"fixed_wait_predicates":0,"autoload_static_failures":0,"asset_chain_failures":0,"dll_patch_failures":0,"native_continue_failures":0,"field58_gate_failures":0,"direct_shortcut_failures":0,"input_path_failures":0,"runtime_proof_failures":1,"runtime_mode_failures":0,"eula_popup_failures":0,"save_data_popup_failures":0,"messagebox_dialog_failures":0,"server_status_failures":0,"title_cover_failures":2,"title_cover_penalty":400,"native_trace_blockers":0,"native_trace_hits_total":74,"native_trace_unique_breakpoints":11,"false_positives":0,"runtime_timeout_failures":0,"runtime_title_visual_suppressed_builds":0,"runtime_custom_cover_builds":0,"runtime_simulated_button_presses_total":0},"status":"crash","description":"runtime vtable latch dereferenced loading-layer objects and exited before world stable","timestamp":1782455450790,"segment":0,"confidence":null,"asi":{"hypothesis":"Latch vtables for active RendMan/CSGraphics/CSScaleform objects during CSFakeLoadingScreen visibility to classify the black/loading draw layers without hooks or native calls.","evidence":"Runtime artifact /home/banon/projects/er-effects-rs/target/runtime-probe/product-continue-direct-20260625-232857 failed after loading started: readiness reason process_exited_before_ready, native_continue_chain_stage=pre_submit, oracle_char_name=Banon, expected_save_match=true, player_present=false, zero input, zero MessageBox. Diagnostic values before exit: fake_loading_visible_samples=18, visible_slots_mask=127, all RendMan slot vtables at visible time were 0x142b7e410 and CSGraphics+0x68 vtable was 0x142b81050.","rollback_reason":"The user correctly identified that the layer objects are dereferenced by the loading screen. Our telemetry also dereferenced their vtables during that active draw window, making the read-only assumption unsafe/racy. Revert this branch; keep only prior pointer/mask sampling from #305 as runtime-safe.","next_action_hint":"Static-map vtable 0x142b7e410 and 0x142b81050 in Ghidra using the captured ASI. If more runtime classification is needed, sample only singleton/slot pointer values already validated in #305, not child vtables, while the loading screen may be dereferencing them."}}
