{"run":107,"commit":"2100051","metric":1520,"metrics":{"readiness_gate_failures":0,"target_constants_remaining":0,"helpers_missing":0,"fixed_wait_predicates":0,"autoload_static_failures":0,"asset_chain_failures":0,"dll_patch_failures":0,"native_continue_failures":0,"field58_gate_failures":0,"direct_shortcut_failures":0,"input_path_failures":0,"runtime_proof_failures":1,"runtime_mode_failures":0,"eula_popup_failures":0,"save_data_popup_failures":0,"messagebox_dialog_failures":0,"server_status_failures":0,"title_cover_failures":0,"title_cover_penalty":0,"native_trace_blockers":0,"native_trace_hits_total":74,"native_trace_unique_breakpoints":11,"false_positives":0,"runtime_timeout_failures":0,"runtime_title_visual_suppressed_builds":0,"runtime_custom_cover_builds":0,"runtime_simulated_button_presses_total":0},"status":"discard","description":"recorded static RE lead for title/open-menu construction path through FUN_1407669e0/FUN_140767270","timestamp":1782400737011,"segment":0,"confidence":9.666666666666666,"asi":{"hypothesis":"Static RE of TitleTopDialog/open-menu construction before lambda_606 is chosen may reveal why product sees disabled idle rows instead of semantic title actions.","rollback_reason":"Primary metric 1520 matched but did not exceed the persisted best; iteration only recorded a static RE lead.","next_action_hint":"Decode FUN_1407669e0/FUN_140767270 and their CSMenuMan/FE menu-view-model state predicates. Do not patch CSMenuMan+0x21, but determine whether that state chooses disabled idle rows versus semantic title actions."}}
{"run":108,"commit":"2100051","metric":1520,"metrics":{"readiness_gate_failures":0,"target_constants_remaining":0,"helpers_missing":0,"fixed_wait_predicates":0,"autoload_static_failures":0,"asset_chain_failures":0,"dll_patch_failures":0,"native_continue_failures":0,"field58_gate_failures":0,"direct_shortcut_failures":0,"input_path_failures":0,"runtime_proof_failures":1,"runtime_mode_failures":0,"eula_popup_failures":0,"save_data_popup_failures":0,"messagebox_dialog_failures":0,"server_status_failures":0,"title_cover_failures":0,"title_cover_penalty":0,"native_trace_blockers":0,"native_trace_hits_total":74,"native_trace_unique_breakpoints":11,"false_positives":0,"runtime_timeout_failures":0,"runtime_title_visual_suppressed_builds":0,"runtime_custom_cover_builds":0,"runtime_simulated_button_presses_total":0},"status":"discard","description":"recorded static RE lead for CSMenuMan back-screen/disabled-row state predicates","timestamp":1782400862026,"segment":0,"confidence":9.666666666666666,"asi":{"hypothesis":"Decoding FUN_1407669e0/FUN_140767270 would identify whether product sees disabled idle rows because it is in a CSMenuMan back-screen branch rather than the semantic title-action branch.","rollback_reason":"Primary metric 1520 matched but did not exceed the persisted best; iteration only recorded static RE guidance.","next_action_hint":"Decode writers/predicates for CSMenuMan field_0x6b0, field_0x6b1, field_0x708, and field_0x798. Product likely sees idle d180 because the back-screen/disabled-row branch builds field_0x708 via FUN_140764380; do not patch these fields without proving the semantic side effect."}}
{"run":109,"commit":"2100051","metric":1520,"metrics":{"readiness_gate_failures":0,"target_constants_remaining":0,"helpers_missing":0,"fixed_wait_predicates":0,"autoload_static_failures":0,"asset_chain_failures":0,"dll_patch_failures":0,"native_continue_failures":0,"field58_gate_failures":0,"direct_shortcut_failures":0,"input_path_failures":0,"runtime_proof_failures":1,"runtime_mode_failures":0,"eula_popup_failures":0,"save_data_popup_failures":0,"messagebox_dialog_failures":0,"server_status_failures":0,"title_cover_failures":0,"title_cover_penalty":0,"native_trace_blockers":0,"native_trace_hits_total":74,"native_trace_unique_breakpoints":11,"false_positives":0,"runtime_timeout_failures":0,"runtime_title_visual_suppressed_builds":0,"runtime_custom_cover_builds":0,"runtime_simulated_button_presses_total":0},"status":"discard","description":"recorded verified CSMenuMan back-screen branch predicate and scanner-usage caveat","timestamp":1782401042245,"segment":0,"confidence":9.666666666666666,"asi":{"hypothesis":"The CSMenuMan disabled-row branch is controlled by fields 0x6b0/0x6b1/0x708/0x798, so recording the exact decompiled predicate helps select the next product-safe RE target.","rollback_reason":"Primary metric 1520 matched but did not exceed the persisted best; iteration only added a deferred RE note.","next_action_hint":"Use a correct displacement scanner invocation or focused xrefs/decompile to find writers of CSMenuMan 0x6b0/0x6b1/0x708/0x798. Verified current predicate: if 0x6b0==0 or 0x6b1!=0, backScreenData.field_0x8=0; otherwise field_0x708 is built via FUN_140764380. loadingScreenData.field_0x10 builds field_0x798 via FUN_140764710."}}
{"run":110,"commit":"2100051","metric":1520,"metrics":{"readiness_gate_failures":0,"target_constants_remaining":0,"helpers_missing":0,"fixed_wait_predicates":0,"autoload_static_failures":0,"asset_chain_failures":0,"dll_patch_failures":0,"native_continue_failures":0,"field58_gate_failures":0,"direct_shortcut_failures":0,"input_path_failures":0,"runtime_proof_failures":1,"runtime_mode_failures":0,"eula_popup_failures":0,"save_data_popup_failures":0,"messagebox_dialog_failures":0,"server_status_failures":0,"title_cover_failures":0,"title_cover_penalty":0,"native_trace_blockers":0,"native_trace_hits_total":74,"native_trace_unique_breakpoints":11,"false_positives":0,"runtime_timeout_failures":0,"runtime_title_visual_suppressed_builds":0,"runtime_custom_cover_builds":0,"runtime_simulated_button_presses_total":0},"status":"discard","description":"recorded corrected ScanDispWrite field-access findings for CSMenuMan back-screen state","timestamp":1782401220214,"segment":0,"confidence":12.88888888888889,"asi":{"hypothesis":"Correctly invoking ScanDispWrite over title/menu code would identify writers and branch points for CSMenuMan 0x6b0/0x6b1/0x708/0x798, clarifying why product lands in the disabled/back-screen row path.","rollback_reason":"Primary metric 1520 matched but did not exceed the persisted best; iteration only recorded static RE guidance.","next_action_hint":"Decompile CSMenuManImp::Update around 0x140766ec1..0x140766fa5: TitleStep states set 0x6b0=1, but Update clears word 0x6b0/0x6b1 at 0x140766f63 and manages 0x708 via 0x140766f0f/0x140766fa5. Understand that clear/rebuild cycle before changing product behavior."}}
{"run":111,"commit":"2100051","metric":1520,"metrics":{"readiness_gate_failures":0,"target_constants_remaining":0,"helpers_missing":0,"fixed_wait_predicates":0,"autoload_static_failures":0,"asset_chain_failures":0,"dll_patch_failures":0,"native_continue_failures":0,"field58_gate_failures":0,"direct_shortcut_failures":0,"input_path_failures":0,"runtime_proof_failures":1,"runtime_mode_failures":0,"eula_popup_failures":0,"save_data_popup_failures":0,"messagebox_dialog_failures":0,"server_status_failures":0,"title_cover_failures":0,"title_cover_penalty":0,"native_trace_blockers":0,"native_trace_hits_total":74,"native_trace_unique_breakpoints":11,"false_positives":0,"runtime_timeout_failures":0,"runtime_title_visual_suppressed_builds":0,"runtime_custom_cover_builds":0,"runtime_simulated_button_presses_total":0},"status":"discard","description":"recorded CSMenuManImp::Update one-frame request flag interpretation","timestamp":1782401328158,"segment":0,"confidence":19.333333333333332,"asi":{"hypothesis":"CSMenuManImp::Update may show that 0x6b0/0x6b1 are consumed request flags for the disabled/back-screen row path, explaining the observed idle d180 candidate.","rollback_reason":"Primary metric 1520 matched but did not exceed the persisted best; iteration only recorded static RE guidance.","next_action_hint":"Treat observed idle d180 as a back-screen/request-flag job, not Continue. Search for the semantic title row/action path outside CSMenuMan backScreenData/loadingScreenData, likely in TitleTopDialog + CSMenu controller row construction."}}
{"run":112,"commit":"2100051","metric":1520,"metrics":{"readiness_gate_failures":0,"target_constants_remaining":0,"helpers_missing":0,"fixed_wait_predicates":0,"autoload_static_failures":0,"asset_chain_failures":0,"dll_patch_failures":0,"native_continue_failures":0,"field58_gate_failures":0,"direct_shortcut_failures":0,"input_path_failures":0,"runtime_proof_failures":1,"runtime_mode_failures":0,"eula_popup_failures":0,"save_data_popup_failures":0,"messagebox_dialog_failures":0,"server_status_failures":0,"title_cover_failures":0,"title_cover_penalty":0,"native_trace_blockers":0,"native_trace_hits_total":74,"native_trace_unique_breakpoints":11,"false_positives":0,"runtime_timeout_failures":0,"runtime_title_visual_suppressed_builds":0,"runtime_custom_cover_builds":0,"runtime_simulated_button_presses_total":0},"status":"discard","description":"recorded semantic title CSMenu controller row-owner path","timestamp":1782401492638,"segment":0,"confidence":38.666666666666664,"asi":{"hypothesis":"The semantic title Continue/Load row path is owned by the Title CSMenu controller rather than CSMenuMan backScreenData/loadingScreenData; decoding the controller constructor should identify better row/action targets.","rollback_reason":"Primary metric 1520 matched but did not exceed the persisted best; iteration only recorded static RE guidance.","next_action_hint":"Decode 0x140745ba0/0x140745b70 and the controller +0x1290/+0x1300 row vectors. Map the Continue row/action functor from the CSMenu controller path without touching FD4 idle d180 or CSMenuMan 0x708."}}
{"run":113,"commit":"2100051","metric":1520,"metrics":{"readiness_gate_failures":0,"target_constants_remaining":0,"helpers_missing":0,"fixed_wait_predicates":0,"autoload_static_failures":0,"asset_chain_failures":0,"dll_patch_failures":0,"native_continue_failures":0,"field58_gate_failures":0,"direct_shortcut_failures":0,"input_path_failures":0,"runtime_proof_failures":1,"runtime_mode_failures":0,"eula_popup_failures":0,"save_data_popup_failures":0,"messagebox_dialog_failures":0,"server_status_failures":0,"title_cover_failures":0,"title_cover_penalty":0,"native_trace_blockers":0,"native_trace_hits_total":74,"native_trace_unique_breakpoints":11,"false_positives":0,"runtime_timeout_failures":0,"runtime_title_visual_suppressed_builds":0,"runtime_custom_cover_builds":0,"runtime_simulated_button_presses_total":0},"status":"discard","description":"recorded CSMenu row attach helper as presentation path, not Continue action","timestamp":1782401603541,"segment":0,"confidence":null,"asi":{"hypothesis":"Decoding 0x140745ba0/0x140745b70 and the controller row vectors would map semantic CSMenu rows and distinguish presentation/text attachment from the actual Continue action functor.","rollback_reason":"Primary metric 1520 matched but did not exceed the persisted best; iteration only recorded static RE guidance.","next_action_hint":"Find the constructor or writer that fills CSMenu row +0xf8 action functor and correlate title menu text ids for Continue/Load/NewGame. Do not invoke FUN_140745b30 or FD4 idle d180 as product action."}}
{"run":114,"commit":"2100051","metric":1520,"metrics":{"readiness_gate_failures":0,"target_constants_remaining":0,"helpers_missing":0,"fixed_wait_predicates":0,"autoload_static_failures":0,"asset_chain_failures":0,"dll_patch_failures":0,"native_continue_failures":0,"field58_gate_failures":0,"direct_shortcut_failures":0,"input_path_failures":0,"runtime_proof_failures":1,"runtime_mode_failures":0,"eula_popup_failures":0,"save_data_popup_failures":0,"messagebox_dialog_failures":0,"server_status_failures":0,"title_cover_failures":0,"title_cover_penalty":0,"native_trace_blockers":0,"native_trace_hits_total":74,"native_trace_unique_breakpoints":11,"false_positives":0,"runtime_timeout_failures":0,"runtime_title_visual_suppressed_builds":0,"runtime_custom_cover_builds":0,"runtime_simulated_button_presses_total":0},"status":"discard","description":"recorded slot-aware title MenuJob construction path via FUN_1409ac8b0/FUN_140826600","timestamp":1782401792486,"segment":0,"confidence":null,"asi":{"hypothesis":"Finding the CSMenu row +0xf8 action writer may reveal the semantic title Continue action; static RowBuildXref should distinguish actual slot-aware MenuJob construction from presentation attachment and FD4 idle d180.","rollback_reason":"Primary metric 1520 matched but did not exceed the persisted best; iteration only recorded static RE guidance.","next_action_hint":"Decode FUN_140821ce0 / FUN_140826600 callback object and compare its callback/vtable to Continue wrapper 0x14082bac0 versus Load/Profile paths before any runtime invocation."}}
{"run":115,"commit":"2100051","metric":1520,"metrics":{"readiness_gate_failures":0,"target_constants_remaining":0,"helpers_missing":0,"fixed_wait_predicates":0,"autoload_static_failures":0,"asset_chain_failures":0,"dll_patch_failures":0,"native_continue_failures":0,"field58_gate_failures":0,"direct_shortcut_failures":0,"input_path_failures":0,"runtime_proof_failures":1,"runtime_mode_failures":0,"eula_popup_failures":0,"save_data_popup_failures":0,"messagebox_dialog_failures":0,"server_status_failures":0,"title_cover_failures":0,"title_cover_penalty":0,"native_trace_blockers":0,"native_trace_hits_total":74,"native_trace_unique_breakpoints":11,"false_positives":0,"runtime_timeout_failures":0,"runtime_title_visual_suppressed_builds":0,"runtime_custom_cover_builds":0,"runtime_simulated_button_presses_total":0},"status":"discard","description":"recorded FUN_140826600/FUN_140821ce0 as distinct from ContinueWrapper job chain","timestamp":1782401934316,"segment":0,"confidence":null,"asi":{"hypothesis":"Decoding FUN_140821ce0 / FUN_140826600 callback object should determine whether the slot-aware title job path is the native Continue action or a different Load/Profile menu construction path.","rollback_reason":"Primary metric 1520 matched but did not exceed the persisted best; iteration only recorded static RE guidance.","next_action_hint":"Decode vtables/types allocated inside FUN_140821ce0 and FUN_14082b8f0, and find where TitleTopDialog.super_MenuWindow.field254_0x1e8 is set before using either path as product submit semantics."}}
{"run":116,"commit":"2100051","metric":1520,"metrics":{"readiness_gate_failures":0,"target_constants_remaining":0,"helpers_missing":0,"fixed_wait_predicates":0,"autoload_static_failures":0,"asset_chain_failures":0,"dll_patch_failures":0,"native_continue_failures":0,"field58_gate_failures":0,"direct_shortcut_failures":0,"input_path_failures":0,"runtime_proof_failures":1,"runtime_mode_failures":0,"eula_popup_failures":0,"save_data_popup_failures":0,"messagebox_dialog_failures":0,"server_status_failures":0,"title_cover_failures":0,"title_cover_penalty":0,"native_trace_blockers":0,"native_trace_hits_total":74,"native_trace_unique_breakpoints":11,"false_positives":0,"runtime_timeout_failures":0,"runtime_title_visual_suppressed_builds":0,"runtime_custom_cover_builds":0,"runtime_simulated_button_presses_total":0},"status":"discard","description":"recorded LoadJobContext vtable classification versus ContinueWrapper chain","timestamp":1782402770325,"segment":0,"confidence":null,"asi":{"hypothesis":"Decoding vtables/types allocated inside FUN_140821ce0 and FUN_14082b8f0, plus noisy 0x1e8 result-field writers, should distinguish the LoadJobContext path from the actual native ContinueWrapper chain without runtime invocation.","rollback_reason":"Primary metric 1520 matched but did not exceed the persisted best; iteration only recorded static RE guidance.","next_action_hint":"Decode the vtable/run function for LoadJobContext and the ContinueWrapper chain pieces FUN_14082bcb0, FUN_1408292b0, FUN_1407b74c0 to identify semantic selected Continue path. Do not treat LoadJobContext as product Continue proof by name alone."}}
{"run":117,"commit":"2100051","metric":1520,"metrics":{"readiness_gate_failures":0,"target_constants_remaining":0,"helpers_missing":0,"fixed_wait_predicates":0,"autoload_static_failures":0,"asset_chain_failures":0,"dll_patch_failures":0,"native_continue_failures":0,"field58_gate_failures":0,"direct_shortcut_failures":0,"input_path_failures":0,"runtime_proof_failures":1,"runtime_mode_failures":0,"eula_popup_failures":0,"save_data_popup_failures":0,"messagebox_dialog_failures":0,"server_status_failures":0,"title_cover_failures":0,"title_cover_penalty":0,"native_trace_blockers":0,"native_trace_hits_total":74,"native_trace_unique_breakpoints":11,"false_positives":0,"runtime_timeout_failures":0,"runtime_title_visual_suppressed_builds":0,"runtime_custom_cover_builds":0,"runtime_simulated_button_presses_total":0},"status":"discard","description":"recorded ContinueWrapper three-job system-message chain versus LoadJobContext","timestamp":1782402873226,"segment":0,"confidence":null,"asi":{"hypothesis":"Decoding the ContinueWrapper chain pieces should distinguish the selected Continue confirmation/message chain from LoadJobContext and avoid mistaking a load slot job for product Continue proof.","rollback_reason":"Primary metric 1520 matched but did not exceed the persisted best; iteration only recorded static RE guidance.","next_action_hint":"Decode FUN_14082bcb0/FUN_1408278c0 and FUN_1408292b0 to identify native condition/message semantics and whether the ContinueWrapper chain is a Continue confirmation gate or pre-load warning. Do not shortcut by calling continue_load or LoadJobContext directly."}}
{"run":118,"commit":"2100051","metric":1520,"metrics":{"readiness_gate_failures":0,"target_constants_remaining":0,"helpers_missing":0,"fixed_wait_predicates":0,"autoload_static_failures":0,"asset_chain_failures":0,"dll_patch_failures":0,"native_continue_failures":0,"field58_gate_failures":0,"direct_shortcut_failures":0,"input_path_failures":0,"runtime_proof_failures":1,"runtime_mode_failures":0,"eula_popup_failures":0,"save_data_popup_failures":0,"messagebox_dialog_failures":0,"server_status_failures":0,"title_cover_failures":0,"title_cover_penalty":0,"native_trace_blockers":0,"native_trace_hits_total":74,"native_trace_unique_breakpoints":11,"false_positives":0,"runtime_timeout_failures":0,"runtime_title_visual_suppressed_builds":0,"runtime_custom_cover_builds":0,"runtime_simulated_button_presses_total":0},"status":"discard","description":"recorded ContinueWrapper subchain as native system-message confirmation job path","timestamp":1782403019278,"segment":0,"confidence":null,"asi":{"hypothesis":"Decoding FUN_14082bcb0/FUN_1408278c0 and FUN_1408292b0 should identify whether ContinueWrapper is a confirmation/message chain versus pre-load warning, without invoking chain pieces or shortcutting continue_load.","rollback_reason":"Primary metric 1520 matched but did not exceed the persisted best; iteration only recorded static RE guidance.","next_action_hint":"Identify FMG text for GR_System_Message ids 0x61ece/0x61ed3/0x61ed7 and determine whether the confirmation chain returns a MenuJobResult that triggers Continue load. Prefer observing/result-propagation hooks over invoking chain pieces directly."}}
{"run":119,"commit":"2100051","metric":1520,"metrics":{"readiness_gate_failures":0,"target_constants_remaining":0,"helpers_missing":0,"fixed_wait_predicates":0,"autoload_static_failures":0,"asset_chain_failures":0,"dll_patch_failures":0,"native_continue_failures":0,"field58_gate_failures":0,"direct_shortcut_failures":0,"input_path_failures":0,"runtime_proof_failures":1,"runtime_mode_failures":0,"eula_popup_failures":0,"save_data_popup_failures":0,"messagebox_dialog_failures":0,"server_status_failures":0,"title_cover_failures":0,"title_cover_penalty":0,"native_trace_blockers":0,"native_trace_hits_total":74,"native_trace_unique_breakpoints":11,"false_positives":0,"runtime_timeout_failures":0,"runtime_title_visual_suppressed_builds":0,"runtime_custom_cover_builds":0,"runtime_simulated_button_presses_total":0},"status":"discard","description":"resolved ContinueWrapper message IDs as save-corruption/create-save path","timestamp":1782403167648,"segment":0,"confidence":null,"asi":{"hypothesis":"Resolving FMG text for GR_System_Message ids 0x61ece/0x61ed3/0x61ed7 will classify whether the ContinueWrapper system-message chain is a valid Continue confirmation gate or a save-error/corruption path.","rollback_reason":"Primary metric 1520 matched but did not exceed the persisted best; iteration only recorded static RE guidance.","next_action_hint":"Stop treating the 0x14082bac0/FUN_14082b8f0 chain as normal selected Continue: it uses save-error/create-save messages. Find the normal continue_load trigger/result path that avoids GR_System_Message save-error ids, and add guards so these ids fail product proof if observed."}}
