{"run":502,"commit":"9353857","metric":0,"metrics":{"readiness_gate_failures":0,"target_constants_remaining":0,"helpers_missing":0,"fixed_wait_predicates":0,"autoload_static_failures":0,"asset_chain_failures":0,"dll_patch_failures":0,"native_continue_failures":0,"field58_gate_failures":0,"direct_shortcut_failures":0,"input_path_failures":0,"runtime_proof_failures":0,"runtime_mode_failures":0,"eula_popup_failures":0,"save_data_popup_failures":0,"messagebox_dialog_failures":0,"server_status_failures":0,"title_cover_failures":2,"title_cover_penalty":1800,"native_trace_blockers":0,"native_trace_hits_total":74,"native_trace_unique_breakpoints":11,"false_positives":1,"offline_face_source_ready":1,"removed path_cpu_texture_bridge_ready":1,"offline_face_texture_runtime_drawn":0,"stylized_facedata_pixel_oracle":0,"real_portrait_asset_candidates":0,"profile_placeholder_assets_only":1},"status":"discard","description":"Static RE identifies profile renderer offscreen scene layer beyond the wrong texture wrappers","timestamp":1782570574893,"segment":2,"confidence":null,"asi":{"hypothesis":"Use persisted gx_inner_18 finding to stop following fixed CSGxTexture internals and statically inspect CSMenuProfModelRend/CSEzOffscreenRend writer/fill paths to locate the actual profile render target object layer.","static_re_finding":"Ghidra dump decompilation: CSMenuProfModelRend ctor 0x140bbe010 calls CSMenuAsmModelRend ctor 0x140bb8110. CSMenuAsmModelRend stores CSEzOffscreenRend* at renderer+0xa8 (param_1[0x15]), then CSEzOffscreenRend ctor 0x140bb6c50 creates field1_0x8 as a CSOffscreenGxTexture wrapper and stores CSRuntimeTexResCap at offscreen+0x10 via TexRepositoryImp::InsertCSRuntimeTexResCapIfNotExists. The important fill/setup function is FUN_140bb7440(offscreen,...): it creates camera/scene/drawable objects, stores a GXSgScene-like object at offscreen+0x48 via FUN_140289160(&field9_0x48,...), configures it through vtable calls +0x8/+0x18/+0x28/+0x30 and attaches field20_0x68 drawable to field8_0x40. The renderer update functions 0x140bba820/0x140bba7d0 update model instances at renderer+0xef/0xee and field 0x948/0x778. This suggests the drawable scene/offscreen graph at offscreen+0x48/+0x68 and renderer model instances are closer to the real portrait render source than the TexResCap->CSGxTexture wrapper internals.","validation":"Read .auto/prompt.md/.auto/ideas.md focused lines; recalled Beads memories; Ghidra decompile/xrefs for 0x1409af4f0, 0x1409aa7d0, 0x140bbe010, 0x140bb8110, 0x140bb6c50, 0x140bb7440, 0x140bba820, 0x140bba7d0; run_experiment ./.auto/measure.sh no runtime trigger.","rollback_reason":"Primary metric stayed 0. This was static RE triage and did not implement final portrait pixel/native cover proof.","next_action_hint":"Next implementation should add read-only runtime telemetry for the offscreen scene/drawable layer instead of CSGxTexture internals: sample renderer+0xa8 offscreen fields +0x48 (scene), +0x68 (drawable), +0x40/+0x50 as configured by FUN_140bb7440, and renderer model-instance fields +0xee/+0xef/+0x778/+0x948. Classify vtables and look for a bridge to draw/readback or removed path registration."}}
{"run":503,"commit":"9353857","metric":0,"metrics":{"readiness_gate_failures":0,"target_constants_remaining":0,"helpers_missing":0,"fixed_wait_predicates":0,"autoload_static_failures":0,"asset_chain_failures":0,"dll_patch_failures":0,"native_continue_failures":0,"field58_gate_failures":0,"direct_shortcut_failures":0,"input_path_failures":0,"runtime_proof_failures":0,"runtime_mode_failures":0,"eula_popup_failures":0,"save_data_popup_failures":0,"messagebox_dialog_failures":0,"server_status_failures":0,"title_cover_failures":2,"title_cover_penalty":1800,"native_trace_blockers":0,"native_trace_hits_total":74,"native_trace_unique_breakpoints":11,"false_positives":1,"offline_face_source_ready":1,"removed path_cpu_texture_bridge_ready":1,"offline_face_texture_runtime_drawn":0,"stylized_facedata_pixel_oracle":0,"real_portrait_asset_candidates":0,"profile_placeholder_assets_only":1},"status":"discard","description":"Runtime offscreen scene telemetry identifies GXSgCompositeScene, GXSgLayerFlat, and CSSgEzDraw layer","timestamp":1782570930160,"segment":2,"confidence":null,"asi":{"hypothesis":"Add read-only runtime telemetry for CSMenuProfModelRend/CSEzOffscreenRend scene/drawable fields identified by static RE, then classify their vtables as a better next bridge than fixed CSGxTexture internals.","artifact":"/home/banon/projects/er-effects-rs/target/runtime-probe/product-continue-direct-20260627-073330","runtime_finding":"Fresh runtime sampled offscreen graph fields from the profile renderer: offscreen+0x48=0x7fff9712e800 vtable 0x142f0b6e0; offscreen+0x40=0x7fff96eb1180 vtable 0x142f21918; offscreen+0x68=0x7fff96e50ea0 vtable 0x142b7e4b0; offscreen+0x50=0x7ffef691aee0 with first qword pointing at offscreen+0x40; renderer+0x770/+0x778 are null at sample time and renderer+0x948 is small value 1. Ghidra xrefs classify 0x142f0b6e0 as GXSR::GXSgCompositeScene, 0x142f21918 as GXSG::GXSgLayerFlat, and 0x142b7e4b0 as CS::CSSgEzDraw (constructor FUN_140bb6970 embeds a CSEzDraw). This confirms the relevant path is a scene/layer/draw item graph, not a raw GPU texture pointer.","validation":"cargo fmt; measure embedded Python py_compile; bash -n .auto/measure.sh; touch .auto/run_runtime_probe_once .auto/enable_removed path_runtime_once; run_experiment ./.auto/measure.sh; inspect er-effects-telemetry.json; Ghidra xrefs/decompile for vtables 0x142f0b6e0, 0x142f21918, 0x142b7e4b0 and constructors/destructors 0x141a0a880/0x141a0aad0/0x141ad9e50/0x140bb6970.","rollback_reason":"Primary metric stayed 0. This was read-only runtime/static classification and did not implement a visible portrait cover or final portrait pixel/native oracle.","next_action_hint":"Follow the confirmed CS::CSSgEzDraw/CSEzDraw branch: statically inspect CS::CSEzDraw::CSEzDraw and its draw/update methods from the CSSgEzDraw object at offscreen+0x68 to find whether it owns a draw command buffer, render target, or texture registration path that can be bridged or observed for portrait pixels."}}
{"run":504,"commit":"9353857","metric":0,"metrics":{"readiness_gate_failures":0,"target_constants_remaining":0,"helpers_missing":0,"fixed_wait_predicates":0,"autoload_static_failures":0,"asset_chain_failures":0,"dll_patch_failures":0,"native_continue_failures":0,"field58_gate_failures":0,"direct_shortcut_failures":0,"input_path_failures":0,"runtime_proof_failures":0,"runtime_mode_failures":0,"eula_popup_failures":0,"save_data_popup_failures":0,"messagebox_dialog_failures":0,"server_status_failures":0,"title_cover_failures":2,"title_cover_penalty":1800,"native_trace_blockers":0,"native_trace_hits_total":74,"native_trace_unique_breakpoints":11,"false_positives":1,"offline_face_source_ready":1,"removed path_cpu_texture_bridge_ready":1,"offline_face_texture_runtime_drawn":0,"stylized_facedata_pixel_oracle":0,"real_portrait_asset_candidates":0,"profile_placeholder_assets_only":1},"status":"discard","description":"Static RE shows CSEzDraw is an EzDraw command queue, not a portrait texture bridge","timestamp":1782571152314,"segment":2,"confidence":null,"asi":{"hypothesis":"Follow the confirmed CS::CSSgEzDraw/CSEzDraw branch from offscreen+0x68 and statically inspect whether it owns a draw command buffer, render target, texture registration, or observable pixel bridge path.","static_re_finding":"Ghidra: CS::CSEzDraw constructors at 0x140bb35f0/0x140bb3660 call InitBuffers 0x14264ee80. InitBuffers allocates a draw context and two FD4HkEzDrawCommandBuffer objects through vtable CreateDrawContext/CreateDrawCommandBuffer and AllocateCommandBuffers. Draw entry FUN_142650030 locks commandQueuemutex, selects the inactive/current double buffer, and calls FUN_14269b4f0, which replays queued commands from bufferStart..writePtr by reading a dword opcode and function pointer. Command producers (e.g. 0x14264f050, 0x14264f3d0, DrawLine/DrawSphere/QueueText) push function-pointer commands such as 0x142699970/0x142699cc0 that render lines/primitives/text through FD4HkEzDrawContext. CSSgEzDraw render entry 0x140bb6c10 simply calls CSEzDraw::Draw on the embedded CSEzDraw at +8. RendMan phases 0x140cc6be0/6e50/7040/7140/7200 call CSEzDraw::Draw for global debug/easy-draw queues. This branch is an immediate-mode/debug EzDraw command queue, not the model portrait render target or a direct texture/SRV bridge.","validation":"Recalled Beads memories; Ghidra search/decompile xrefs for CSEzDraw, CS::CSEzDraw::CSEzDraw 0x140bb35f0/0x140bb3660, InitBuffers 0x14264ee80, Draw 0x142650030, command replay 0x14269b4f0, SwapBuffer 0x1426500b0, CSSgEzDraw render 0x140bb6c10, RendMan phase calls 0x140cc6be0/6e50/7040/7140/7200, and sample command producers/handlers 0x14264f050/0x14264f3d0/0x142699970/0x142699cc0. run_experiment ./.auto/measure.sh without runtime trigger.","rollback_reason":"Primary metric stayed 0. Static RE falsified this branch as a portrait texture bridge; no product code or final portrait oracle was implemented.","next_action_hint":"Do not pursue CSSgEzDraw/CSEzDraw as the portrait bridge except as optional overlay debug primitives. The real portrait model path is likely in CSMenuAsmModelRend update/model instance fields and the GXSgCompositeScene/GXSgLayerFlat rendering graph, not the EzDraw debug queue. Next static target: inspect FUN_1409ecad0/FUN_1409ecb60/FUN_1409e9ac0/model-instance update calls from renderer+0xee/+0xef/+0x778/+0x948, or the GXSgCompositeScene traversal/draw calls that render the model into the offscreen target."}}
{"run":505,"commit":"9353857","metric":0,"metrics":{"readiness_gate_failures":0,"target_constants_remaining":0,"helpers_missing":0,"fixed_wait_predicates":0,"autoload_static_failures":0,"asset_chain_failures":0,"dll_patch_failures":0,"native_continue_failures":0,"field58_gate_failures":0,"direct_shortcut_failures":0,"input_path_failures":0,"runtime_proof_failures":0,"runtime_mode_failures":0,"eula_popup_failures":0,"save_data_popup_failures":0,"messagebox_dialog_failures":0,"server_status_failures":0,"title_cover_failures":2,"title_cover_penalty":1800,"native_trace_blockers":0,"native_trace_hits_total":74,"native_trace_unique_breakpoints":11,"false_positives":1,"offline_face_source_ready":1,"removed path_cpu_texture_bridge_ready":1,"offline_face_texture_runtime_drawn":0,"stylized_facedata_pixel_oracle":0,"real_portrait_asset_candidates":0,"profile_placeholder_assets_only":1},"status":"discard","description":"Static RE maps profile model update to FaceGen/model-display entity path","timestamp":1782571366054,"segment":2,"confidence":null,"asi":{"hypothesis":"After falsifying CSEzDraw as a portrait bridge, inspect CSMenuAsmModelRend/CSChrAsmModelIns/CSModelIns update calls and renderer model fields to find whether the portrait model path exposes a model-display entity or texture/readback bridge.","static_re_finding":"Ghidra: FUN_1409ecad0 iterates CSChrAsmModelIns parts at +0x28.. and calls FUN_1409f52e0, then clears a face/update byte under a nested object. FUN_1409f52e0 uses GLOBAL_FaceGenMan on nested objects at part+0x190/+0x198 to refresh face generation. FUN_1409ecb60 iterates parts, tests visibility/update state via FUN_1409f0a10, and calls FUN_1409f10e0. FUN_1409e9ac0 iterates CSModelIns part pointers and calls FUN_1409f4cf0, which updates bones/pose and then calls FUN_1409f0820/FUN_1409f1580/FUN_142670190 when model display data exists. FUN_1409f1580 writes a matrix into CSModelIns->locationEntity or field12_0x28, then calls FUN_140b30a00(modelDispEntity, bounds) and FUN_140b31220(modelDispEntity,...). FUN_140b30a00 propagates bounds over child entities and writes the GXSgEntity bounding box. This maps the loaded profile portrait source to a FaceGen + CSModelIns/CSModelDispEntity/GXSgEntity scene path, not a raw texture/SRV pointer and not the EzDraw command queue.","validation":"Recalled Beads memories; Ghidra decompile/xrefs for FUN_1409ecad0, FUN_1409ecb60, FUN_1409e9ac0, FUN_1409ebb40, FUN_1409eca00, FUN_1409f0820, FUN_1409f1580, FUN_1409eb8d0, FUN_1401ad580, FUN_1409f4cf0, FUN_1409f52e0, FUN_140b30a00, FUN_140b31220. run_experiment ./.auto/measure.sh without runtime trigger.","rollback_reason":"Primary metric stayed 0. This was static RE triage and did not implement a visible portrait cover or final oracle.","next_action_hint":"Follow CSModelDispEntity/GXSgEntity rendering or scene traversal rather than texture wrappers: inspect vtables/xrefs for the runtime modelDispEntity and GXSgCompositeScene/GXSgLayerFlat traversal into the offscreen render target; a useful next runtime telemetry spike should sample CSModelIns pointers/CSModelDispEntity vtables when renderer+0x778 becomes non-null, or hook FUN_1409f1580/FUN_142670190 to capture the model display entity when the profile renderer actually updates."}}
{"run":506,"commit":"9353857","metric":0,"metrics":{"readiness_gate_failures":0,"target_constants_remaining":0,"helpers_missing":0,"fixed_wait_predicates":0,"autoload_static_failures":0,"asset_chain_failures":0,"dll_patch_failures":0,"native_continue_failures":0,"field58_gate_failures":0,"direct_shortcut_failures":0,"input_path_failures":0,"runtime_proof_failures":0,"runtime_mode_failures":0,"eula_popup_failures":0,"save_data_popup_failures":0,"messagebox_dialog_failures":0,"server_status_failures":0,"title_cover_failures":2,"title_cover_penalty":1800,"native_trace_blockers":0,"native_trace_hits_total":74,"native_trace_unique_breakpoints":11,"false_positives":1,"offline_face_source_ready":1,"removed path_cpu_texture_bridge_ready":1,"offline_face_texture_runtime_drawn":0,"stylized_facedata_pixel_oracle":0,"real_portrait_asset_candidates":0,"profile_placeholder_assets_only":1},"status":"discard","description":"Runtime model-transform hook captures CSModelDispEntity vtable but no final portrait bridge","timestamp":1782571835569,"segment":2,"confidence":null,"asi":{"hypothesis":"Add a read-only MinHook observer at deobf 0x1409f1450 (dump 0x1409f1580) to capture CSModelIns/modelDispEntity/location/field28 telemetry when the profile model transform function actually runs, then classify the model display entity vtable.","artifact":"/home/banon/projects/er-effects-rs/target/runtime-probe/product-continue-direct-20260627-074836","runtime_finding":"Fresh runtime hook fired 1519 times. Last sampled model=0x7fffb82da250, modelDispEntity=0x7fff57ca0be0, modelDispEntity_vtable=0x142b69218, field28=0x7fff96a85dc0, field28 first qword=0x7fffb919ae10, locationEntity was null in the last sample. Ghidra classifies vtable 0x142b69218 as CS::CSModelDispEntity::vftable; constructor/destructor refs at 0x140b2f48b/0x140b2f9a0. The location vtable default observed in telemetry corresponds to CSFD4LocationMtx44Entity when present. This confirms the profile renderer eventually owns real CSModelDispEntity scene objects, but this iteration only observed them and did not find a texture/SRV/readback bridge yet.","static_classification":"CSModelDispEntity destructor/setup 0x140b2f9a0 references GLOBAL_RendMan->stageRend and LOD/global scene resources; vtable slot 0x142b69218+0x28 points to 0x140b30600 (empty), and destructor path manages child entity vectors around +0xa8/+0xf0 and location entity at +0x210. The next useful static target is CSModelDispEntity constructor 0x140b2f480/related non-decompiled body and traversal/render vtable slots, or GXSgCompositeScene traversal that consumes these model entities into the offscreen render target.","validation":"python3 scripts/dump-deobf-shift.py 0x1409f1580 -> deobf 0x1409f1450; er_disasm deobf 0x1409f1450 pinned CSModelIns offsets +0x18 modelDispEntity, +0x20 locationEntity, +0x28 field28; cargo fmt; measure embedded Python py_compile; bash -n .auto/measure.sh; touch .auto/run_runtime_probe_once .auto/enable_removed path_runtime_once; run_experiment ./.auto/measure.sh; inspect telemetry JSON; Ghidra xrefs/decompile for vtables 0x142b69218 and 0x142b6bcc8.","rollback_reason":"Primary metric stayed 0. This was read-only runtime/static classification and did not implement visible portrait cover or final portrait oracle.","next_action_hint":"Follow CSModelDispEntity/GXSgEntity traversal/render vtable slots rather than model transform sampling. Static target: decompile/inspect the full CSModelDispEntity constructor/body around 0x140b2f480 and vtable slots from 0x142b69218, plus GXSgCompositeScene/GXSgLayerFlat traversal that draws these entities into the offscreen target."}}
{"run":507,"commit":"9353857","metric":0,"metrics":{"readiness_gate_failures":0,"target_constants_remaining":0,"helpers_missing":0,"fixed_wait_predicates":0,"autoload_static_failures":0,"asset_chain_failures":0,"dll_patch_failures":0,"native_continue_failures":0,"field58_gate_failures":0,"direct_shortcut_failures":0,"input_path_failures":0,"runtime_proof_failures":0,"runtime_mode_failures":0,"eula_popup_failures":0,"save_data_popup_failures":0,"messagebox_dialog_failures":0,"server_status_failures":0,"title_cover_failures":2,"title_cover_penalty":1800,"native_trace_blockers":0,"native_trace_hits_total":74,"native_trace_unique_breakpoints":11,"false_positives":1,"offline_face_source_ready":1,"removed path_cpu_texture_bridge_ready":1,"offline_face_texture_runtime_drawn":0,"stylized_facedata_pixel_oracle":0,"real_portrait_asset_candidates":0,"profile_placeholder_assets_only":1},"status":"discard","description":"Static RE maps CSModelDispEntity vtable/constructor but finds no direct texture bridge","timestamp":1782572026352,"segment":2,"confidence":null,"asi":{"hypothesis":"Statically inspect full CSModelDispEntity constructor/body and vtable slots from runtime-captured vtable 0x142b69218 to see whether model display traversal exposes a texture/render-target bridge for portrait pixels.","static_re_finding":"Ghidra identifies constructor start 0x140b2f450 (runtime vtable writes at 0x140b2f48b/0x140b2f492). Constructor sets CS::CSModelDispEntity::vftable, copies PaintRenderTargetInfo, initializes unkTextureX, creates locationAabbExporter via CSFD4LocationModelDispEntityAabbExporter when param_3==0, binds LOD resource via GLOBAL_CSLod and draw param data, and stores render-range fields through +0x29a..+0x2a2. Vtable slots from 0x142b69218: +0x00 destructor 0x140b2fcc0, +0x08 0x140b2ff30, +0x10 0x140b2fd00, +0x18 returns this+0x40 (0x140b2efc0), +0x20 no-op 0x140b30610, +0x28 no-op 0x140b30600, +0x30 0x140b30630 returns first child name via child vtable+0x40 or SprjNoName, +0x38 0x140b31480 and +0x40 0x140b31570 iterate child entities at +0xa8..+0xf0 for ray-tracing registration/unregistration through FUN_140b710d0/140b710e0, +0x50 goes through GXSg traversal helper 0x141a83340 which calls param2 vtable+0x50. This maps CSModelDispEntity as a scene-entity container with child GXSgEntities and stage/LOD integration; no direct texture/SRV/readback bridge appears in the constructor/vtable slots inspected.","validation":"Recalled Beads memories; Ghidra get_function_by_address 0x140b2f48b; decompile constructor 0x140b2f450 and vtable functions 0x140b2efc0, 0x140b30610, 0x140b30630, 0x140b31480, 0x140b31570, 0x141a83340; xrefs_from vtable slots 0x142b69218..0x142b69268; run_experiment ./.auto/measure.sh without runtime trigger.","rollback_reason":"Primary metric stayed 0. Static RE did not implement visible portrait cover or final oracle, and this path still lacks a texture/SRV bridge.","next_action_hint":"Pivot from CSModelDispEntity object internals to the scene traversal/offscreen render target itself: inspect GXSgCompositeScene/GXSgLayerFlat traversal functions and CSEzOffscreenRend draw/capture path to find where the profile scene is rendered into TexResCap/offscreen texture. Candidate next static targets: GXSgCompositeScene vtable 0x142f0b6e0 slots, GXSgLayerFlat vtable 0x142f21918 slots, and CSEzOffscreenRend methods around 0x140bb6c50/0x140bb7440/0x140bb6c10."}}
