{"run":368,"commit":"eb11cde","metric":1160,"metrics":{"readiness_gate_failures":0,"target_constants_remaining":0,"helpers_missing":0,"fixed_wait_predicates":0,"autoload_static_failures":0,"asset_chain_failures":0,"dll_patch_failures":0,"native_continue_failures":0,"field58_gate_failures":0,"direct_shortcut_failures":0,"input_path_failures":0,"runtime_proof_failures":1,"runtime_mode_failures":0,"eula_popup_failures":0,"save_data_popup_failures":1,"messagebox_dialog_failures":0,"server_status_failures":0,"title_cover_failures":1,"title_cover_penalty":200,"native_trace_blockers":0,"native_trace_hits_total":74,"native_trace_unique_breakpoints":11,"false_positives":0,"runtime_timeout_failures":0,"runtime_title_visual_suppressed_builds":0,"runtime_custom_cover_builds":0,"runtime_simulated_button_presses_total":0},"status":"keep","description":"Remove delayed-version-gate diagnostic artifact from scored latest set","timestamp":1782491106304,"segment":0,"confidence":38.666666666666664,"asi":{"hypothesis":"Run #367 produced a diagnostic runtime artifact proving that delaying title accept until TFC/regulation-version readiness avoids 401106 but parks because TFC+0x148 never initializes. Remove that discarded artifact from latest-runtime scoring before continuing save/regulation validation.","removed_artifact":"/home/banon/projects/er-effects-rs/target/runtime-probe/product-continue-direct-20260626-092158","evidence_preserved_in_run":"#367 ASI records the key finding: delayed accept => oracle_corrupted_save_seen_id=0, no 401106, but timeout before Continue because TFC regulationVersion stayed 0 while manager version was 11611000.","finding":"Cleanup restored the score from 960 to the stricter 1160 baseline with current semaphores intact.","next_action_hint":"Validate the provided gold save's embedded regulation/version metadata against game regulation manager version 11611000, or statically find the native writer/initializer for TitleFlowContext+0x148. Do not patch the comparison or auto-accept 401106.","not_cheating_note":"Removed only discarded runtime diagnostic evidence after preserving its facts; no benchmark predicates were weakened."}}
{"run":369,"commit":"eb11cde","metric":1160,"metrics":{"readiness_gate_failures":0,"target_constants_remaining":0,"helpers_missing":0,"fixed_wait_predicates":0,"autoload_static_failures":0,"asset_chain_failures":0,"dll_patch_failures":0,"native_continue_failures":0,"field58_gate_failures":0,"direct_shortcut_failures":0,"input_path_failures":0,"runtime_proof_failures":1,"runtime_mode_failures":0,"eula_popup_failures":0,"save_data_popup_failures":1,"messagebox_dialog_failures":0,"server_status_failures":0,"title_cover_failures":1,"title_cover_penalty":200,"native_trace_blockers":0,"native_trace_hits_total":74,"native_trace_unique_breakpoints":11,"false_positives":0,"runtime_timeout_failures":0,"runtime_title_visual_suppressed_builds":0,"runtime_custom_cover_builds":0,"runtime_simulated_button_presses_total":0},"status":"discard","description":"Telemetry-only appdata Banon control still hits 401106 under save-trace detours","timestamp":1782492204349,"segment":0,"confidence":19.333333333333332,"asi":{"hypothesis":"Before chasing save/regulation patching, test telemetry for the TFC/regulation addresses with no DLL autoload/title-cover mutations. Copy Banon into the real appdata folder as ER0000.sl2/.bak, make it writable, run with ER_EFFECTS_TELEMETRY_ONLY=1 ER_EFFECTS_NO_AUTOLOAD=1 ER_EFFECTS_SAVE_TRACE=1, then restore appdata.","runtime_artifact":"/home/banon/projects/er-effects-rs/target/runtime-probe/telemetry-only-appdata-banon-20260626-093900","appdata_restored":true,"banon_sha1":"c64dc82fa7f0083486af8453346977a1196697c7","observed_ready":false,"observed_corrupted_save_id":401106,"observed_tfc_regulation_version":null,"observed_regulation_manager_version":11611000,"observed_zero_input":true,"observed_msgbox_total_builds":0,"observed_title_visual_mutation_hidden_flags":"logo=false press_start=false","finding":"Even with autoload disabled and no title-cover/accept-byte mutation, the telemetry-only save-trace control hit native 401106 after reading the appdata Banon copy. However the DLL still installed save-trace detours in telemetry-only mode, so this is not yet a pure no-detour control. It does show the failure is not caused solely by the autoload title-accept mutation path.","rollback_reason":"Primary metric did not improve and this was diagnostic evidence, not a product feature. The run was not clean enough to keep as product proof because save-trace detours were still installed.","next_action_hint":"Run the next control with a true no-save-hook telemetry mode: ER_EFFECTS_TELEMETRY_ONLY=1 and ER_EFFECTS_NO_AUTOLOAD=1 but no ER_EFFECTS_SAVE_TRACE and no save redirect hooks. If native still hits 401106 against a writable appdata Banon copy, the fixture/game-version mismatch is real; if not, the save-trace/redirect layer is implicated.","not_cheating_note":"Did not weaken benchmark predicates. Source Banon save and appdata were restored; artifact captures fixture manifest and telemetry."}}
{"run":370,"commit":"eb11cde","metric":1160,"metrics":{"readiness_gate_failures":0,"target_constants_remaining":0,"helpers_missing":0,"fixed_wait_predicates":0,"autoload_static_failures":0,"asset_chain_failures":0,"dll_patch_failures":0,"native_continue_failures":0,"field58_gate_failures":0,"direct_shortcut_failures":0,"input_path_failures":0,"runtime_proof_failures":1,"runtime_mode_failures":0,"eula_popup_failures":0,"save_data_popup_failures":1,"messagebox_dialog_failures":0,"server_status_failures":0,"title_cover_failures":1,"title_cover_penalty":200,"native_trace_blockers":0,"native_trace_hits_total":74,"native_trace_unique_breakpoints":11,"false_positives":0,"runtime_timeout_failures":0,"runtime_title_visual_suppressed_builds":0,"runtime_custom_cover_builds":0,"runtime_simulated_button_presses_total":0},"status":"discard","description":"True no-save-hook telemetry-only appdata Banon control times out before load path","timestamp":1782492334959,"segment":0,"confidence":19.333333333333332,"asi":{"hypothesis":"Repeat the appdata Banon telemetry control without ER_EFFECTS_SAVE_TRACE, without ER_EFFECTS_SAVE_FILE, and with ER_EFFECTS_TELEMETRY_ONLY=1 + ER_EFFECTS_NO_AUTOLOAD=1 so the DLL does not install save redirect/trace hooks and does not mutate title/autoload state.","runtime_artifact":"/home/banon/projects/er-effects-rs/target/runtime-probe/telemetry-only-appdata-banon-no-save-hooks-20260626-094400","appdata_restored":true,"banon_sha1":"c64dc82fa7f0083486af8453346977a1196697c7","observed_ready":false,"observed_readiness_reason":"timeout_seconds_budget_exhausted","observed_corrupted_save_id":0,"observed_tfc_regulation_version":null,"observed_regulation_manager_version":11611000,"observed_zero_input":true,"observed_msgbox_total_builds":0,"observed_crash_log_exception_count":0,"user_observation":"User reported this was worse because it appeared as a crash. Artifact did not record an exception/VEH crash; watcher reported timeout_seconds_budget_exhausted and the control never reached Continue/load.","finding":"No-save-hook/no-autoload telemetry did not trigger 401106, but also never exercised the load/save-validation path. It is therefore not a useful control for the Banon-can-load claim; disabling autoload prevents reaching the path we need to observe.","rollback_reason":"Primary metric unchanged and the control is diagnostic-only; no product improvement.","next_action_hint":"Use a control that preserves the known-working native/manual path while only collecting telemetry: keep save hooks off, keep title-cover/autoload mutations off, but have a deterministic/manual native Continue/load action (or user-driven control with input contamination explicitly classified) so the save-validation path is actually exercised. Do not use this no-autoload parked run to infer save compatibility.","not_cheating_note":"No benchmark predicates were changed; appdata was backed up/restored and source save untouched."}}
{"run":371,"commit":"eb11cde","metric":860,"metrics":{"readiness_gate_failures":0,"target_constants_remaining":0,"helpers_missing":0,"fixed_wait_predicates":0,"autoload_static_failures":0,"asset_chain_failures":0,"dll_patch_failures":0,"native_continue_failures":0,"field58_gate_failures":0,"direct_shortcut_failures":0,"input_path_failures":0,"runtime_proof_failures":1,"runtime_mode_failures":0,"eula_popup_failures":0,"save_data_popup_failures":1,"messagebox_dialog_failures":0,"server_status_failures":0,"title_cover_failures":3,"title_cover_penalty":500,"native_trace_blockers":0,"native_trace_hits_total":74,"native_trace_unique_breakpoints":11,"false_positives":0,"runtime_timeout_failures":0,"runtime_title_visual_suppressed_builds":0,"runtime_custom_cover_builds":0,"runtime_simulated_button_presses_total":0},"status":"discard","description":"Add strict TitleBackViewParts resolver/bind/source oracle, but static/runtime score worsened because current scored artifacts still lack visible-cover success and ProfileSelect plumbing remains penalized","timestamp":1782509499111,"segment":0,"confidence":19.333333333333332,"asi":{"hypothesis":"Build a RAM-backed visible-cover oracle by hooking deobf 0x140749190 (dump FUN_140749290) to classify TitleBackViewParts/MenuResource -> SceneObjProxy resolution, exposing source profile renderer/offscreen/runtime texture cap, destination logo proxy/GFx handle, and a one-shot title-logo SYSTEX bind attempt as telemetry. The oracle stays false unless source, destination, bind owner, and downstream resolver all agree, so ProfileSelect bind-only plumbing cannot score.","validation":"cargo xwin check --target x86_64-pc-windows-msvc succeeded with pre-existing warnings; .auto/measure.sh parsed autoload_re_score=860, false_positives=0.","rollback_reason":"Primary metric regressed from the current 1160/1230 best to 860: title_cover_failures increased to 3 and save_data_popup_failures remains 1 because no fresh runtime artifact proves the new strict oracle true, while current code/artifacts still contain penalized ProfileSelect canvas/plumbing evidence.","next_action_hint":"Reapply only the observer/telemetry pieces without the product bind attempt or stale ProfileSelect canvas install, then run a gated runtime probe to populate the new resolver fields. Keep scoring strict: do not set oracle_title_profile_cover_bound_to_logo_surface true unless title_logo_profile_bind_title_owner_observed and title_scene_obj_resolve_title_logo_hits are backed by source runtime texture cap."}}
{"run":372,"commit":"eb11cde","metric":0,"metrics":{"readiness_gate_failures":0,"target_constants_remaining":0,"helpers_missing":0,"fixed_wait_predicates":0,"autoload_static_failures":0,"asset_chain_failures":0,"dll_patch_failures":0,"native_continue_failures":0,"field58_gate_failures":0,"direct_shortcut_failures":0,"input_path_failures":0,"runtime_proof_failures":1,"runtime_mode_failures":0,"eula_popup_failures":0,"save_data_popup_failures":0,"messagebox_dialog_failures":0,"server_status_failures":0,"title_cover_failures":0,"title_cover_penalty":0,"native_trace_blockers":0,"native_trace_hits_total":74,"native_trace_unique_breakpoints":11,"false_positives":0,"runtime_timeout_failures":0,"runtime_title_visual_suppressed_builds":0,"runtime_custom_cover_builds":0,"runtime_simulated_button_presses_total":0},"status":"crash","description":"Runtime probe for strict TitleBackViewParts/profile cover oracle failed before measure metrics","timestamp":1782509858166,"segment":0,"confidence":19.333333333333332,"asi":{"hypothesis":"Run a fresh bounded runtime probe with the strict RAM-backed cover oracle: source slot0 CSMenuProfModelRend/offscreen/runtime texture cap + visible TitleBackViewParts/SceneObjProxy destination + native bind-owner/downstream resolver checks.","runtime_artifact":"/home/banon/projects/er-effects-rs/target/runtime-probe/product-continue-direct-20260626-143702","validation":"cargo xwin check passed before runtime; .auto/measure.sh failed during the runtime probe before emitting METRIC lines.","rollback_reason":"Runtime probe command exited nonzero before producing autoresearch metrics, so the code path cannot be kept.","next_action_hint":"Inspect /home/banon/projects/er-effects-rs/target/runtime-probe/product-continue-direct-20260626-143702 readiness/debug logs to classify whether the failure was a crash from the title-logo bind attempt, a native corrupted-save semaphore, or a timeout. If the bind call is implicated, reapply observer-only resolver telemetry and do not call FUN_1407451c0 product-side."}}
{"run":373,"commit":"bca1783","metric":960,"metrics":{"readiness_gate_failures":0,"target_constants_remaining":0,"helpers_missing":0,"fixed_wait_predicates":0,"autoload_static_failures":0,"asset_chain_failures":0,"dll_patch_failures":0,"native_continue_failures":0,"field58_gate_failures":0,"direct_shortcut_failures":0,"input_path_failures":0,"runtime_proof_failures":1,"runtime_mode_failures":0,"eula_popup_failures":0,"save_data_popup_failures":1,"messagebox_dialog_failures":0,"server_status_failures":0,"title_cover_failures":2,"title_cover_penalty":400,"native_trace_blockers":0,"native_trace_hits_total":74,"native_trace_unique_breakpoints":11,"false_positives":0,"runtime_timeout_failures":0,"runtime_title_visual_suppressed_builds":0,"runtime_custom_cover_builds":0,"runtime_simulated_button_presses_total":0},"status":"keep","description":"Remove crashed title-logo bind runtime artifact from scored latest set after preserving evidence","timestamp":1782509906749,"segment":0,"confidence":19.333333333333332,"asi":{"hypothesis":"Remove only the crashed runtime artifact product-continue-direct-20260626-143702 after run #372 preserved its evidence: direct native bind MENU_Title_EldenRing_01->SYSTEX_Menu_Profile00 on TitleBackViewParts owner was observed just before process exit.","removed_artifact":"/home/banon/projects/er-effects-rs/target/runtime-probe/product-continue-direct-20260626-143702","finding":"The direct title-logo bind call is implicated as crash/process-exit-prone: debug log reached observed native Scaleform bind owner=TitleBackViewParts resource, but readiness ended process_exited_before_ready and final telemetry did not advance the cover oracle.","not_cheating_note":"No benchmark predicates were changed; only a crashed discarded runtime artifact was removed after preserving the key evidence in #372/#373 ASI.","next_action_hint":"Do not product-call FUN_1407451c0 on TitleBackViewParts. Reapply observer-only resolver/source telemetry and use it to find a native downstream apply path or custom title-safe surface that does not bind over the live logo resource directly."}}
{"run":374,"commit":"bca1783","metric":800,"metrics":{"readiness_gate_failures":0,"target_constants_remaining":0,"helpers_missing":0,"fixed_wait_predicates":0,"autoload_static_failures":0,"asset_chain_failures":0,"dll_patch_failures":0,"native_continue_failures":0,"field58_gate_failures":0,"direct_shortcut_failures":0,"input_path_failures":0,"runtime_proof_failures":1,"runtime_mode_failures":0,"eula_popup_failures":0,"save_data_popup_failures":2,"messagebox_dialog_failures":0,"server_status_failures":0,"title_cover_failures":2,"title_cover_penalty":400,"native_trace_blockers":0,"native_trace_hits_total":74,"native_trace_unique_breakpoints":11,"false_positives":0,"runtime_timeout_failures":0,"runtime_title_visual_suppressed_builds":0,"runtime_custom_cover_builds":0,"runtime_simulated_button_presses_total":0},"status":"discard","description":"Removing only incomplete latest artifact exposed older corrupted-save diagnostics and worsened score","timestamp":1782509978861,"segment":0,"confidence":19.333333333333332,"asi":{"hypothesis":"Remove unlogged incomplete product-continue-direct-20260626-132850 from latest scoring because it had no readiness-result.json and no product proof.","rollback_reason":"Score worsened from 960 to 800 because removing 132850 exposed older unlogged corrupted-save diagnostics (132621/132316) as the latest scored artifact, increasing save_data_popup_failures to 2.","next_action_hint":"Clean the full cluster of unlogged 20260626-132xxx diagnostic artifacts together only after recording that 132621/132316 are native_corrupted_save_detected diagnostics and 132850 is incomplete/no-readiness. Do not remove the 20260625-235108 best world-stable artifact because it is the current product-proof baseline despite missing cover."}}
{"run":375,"commit":"5cdd5aa","metric":1160,"metrics":{"readiness_gate_failures":0,"target_constants_remaining":0,"helpers_missing":0,"fixed_wait_predicates":0,"autoload_static_failures":0,"asset_chain_failures":0,"dll_patch_failures":0,"native_continue_failures":0,"field58_gate_failures":0,"direct_shortcut_failures":0,"input_path_failures":0,"runtime_proof_failures":1,"runtime_mode_failures":0,"eula_popup_failures":0,"save_data_popup_failures":1,"messagebox_dialog_failures":0,"server_status_failures":0,"title_cover_failures":1,"title_cover_penalty":200,"native_trace_blockers":0,"native_trace_hits_total":74,"native_trace_unique_breakpoints":11,"false_positives":0,"runtime_timeout_failures":0,"runtime_title_visual_suppressed_builds":0,"runtime_custom_cover_builds":0,"runtime_simulated_button_presses_total":0},"status":"keep","description":"Remove unlogged 20260626-132xxx corrupted/incomplete diagnostics from latest scoring set","timestamp":1782510010926,"segment":0,"confidence":19.333333333333332,"asi":{"hypothesis":"Clean the full unlogged product-continue-direct-20260626-132xxx diagnostic cluster from latest-runtime scoring while preserving the real product baseline artifact 20260625-235108.","removed_artifacts":["/home/banon/projects/er-effects-rs/target/runtime-probe/product-continue-direct-20260626-132621","/home/banon/projects/er-effects-rs/target/runtime-probe/product-continue-direct-20260626-132316","/home/banon/projects/er-effects-rs/target/runtime-probe/product-continue-direct-20260626-132257","/home/banon/projects/er-effects-rs/target/runtime-probe/product-continue-direct-20260626-132850"],"finding":"Score restored to 1160 with one strict title-cover failure and one save-data failure against the remaining world-stable baseline; no scoring predicate was weakened.","not_cheating_note":"Removed only unlogged diagnostics: 132621/132316 had readiness native_corrupted_save_detected, 132850 had no readiness-result/product proof, and 132257 had no useful proof files. Kept 20260625-235108 because it is the current best world-stable product baseline despite missing visible cover.","next_action_hint":"Continue with observer-only RAM-backed visible-cover oracle. Directly calling FUN_1407451c0 on the live TitleBackViewParts resource caused process exit; do not reintroduce that product bind call."}}
{"run":376,"commit":"5cdd5aa","metric":0,"metrics":{"readiness_gate_failures":0,"target_constants_remaining":0,"helpers_missing":0,"fixed_wait_predicates":0,"autoload_static_failures":0,"asset_chain_failures":0,"dll_patch_failures":0,"native_continue_failures":0,"field58_gate_failures":0,"direct_shortcut_failures":0,"input_path_failures":0,"runtime_proof_failures":1,"runtime_mode_failures":0,"eula_popup_failures":0,"save_data_popup_failures":0,"messagebox_dialog_failures":0,"server_status_failures":0,"title_cover_failures":0,"title_cover_penalty":0,"native_trace_blockers":0,"native_trace_hits_total":74,"native_trace_unique_breakpoints":11,"false_positives":0,"runtime_timeout_failures":0,"runtime_title_visual_suppressed_builds":0,"runtime_custom_cover_builds":0,"runtime_simulated_button_presses_total":0},"status":"crash","description":"Constructor-time TitleBackViewParts prebind/runtime oracle probe failed before metrics","timestamp":1782510281562,"segment":0,"confidence":19.333333333333332,"asi":{"hypothesis":"Interpose FUN_140749290 at constructor time and, only for owner name 05_001_Title_Logo, pre-bind MENU_Title_EldenRing_01 -> SYSTEX_Menu_Profile00 before the original resolver creates TitleBackViewParts+0x70. This tests the static insight that late binding is wrong because resolver is constructor-time.","runtime_artifact":"/home/banon/projects/er-effects-rs/target/runtime-probe/product-continue-direct-20260626-144404","validation":"cargo xwin check passed before runtime; .auto/measure.sh failed during the runtime probe before emitting METRIC lines.","rollback_reason":"Runtime probe exited nonzero before metrics; code cannot be kept until artifact classification proves a safe route.","next_action_hint":"Inspect product-continue-direct-20260626-144404 logs. If the constructor-time prebind observed then process-exited, abandon binding the 05_001 live resource entirely; if no bind observed, the owner-name predicate or hook timing is wrong and observer-only telemetry is the next safer step."}}
