{"run":428,"commit":"invalid","metric":0,"metrics":{"readiness_gate_failures":0,"target_constants_remaining":0,"helpers_missing":0,"fixed_wait_predicates":0,"autoload_static_failures":0,"asset_chain_failures":0,"dll_patch_failures":0,"native_continue_failures":0,"field58_gate_failures":0,"direct_shortcut_failures":0,"input_path_failures":0,"runtime_proof_failures":0,"runtime_mode_failures":0,"eula_popup_failures":0,"save_data_popup_failures":0,"messagebox_dialog_failures":0,"server_status_failures":0,"title_cover_failures":0,"title_cover_penalty":0,"native_trace_blockers":0,"native_trace_hits_total":0,"native_trace_unique_breakpoints":0,"false_positives":0},"status":"crash","description":"Harness rejected combined runtime-probe-plus-measure command","timestamp":1782519365958,"segment":1,"confidence":null,"asi":{"hypothesis":"Run a fresh portrait-source runtime probe and then measure in one experiment command.","rollback_reason":"run_experiment is configured to allow only .auto/measure.sh when it exists, so the combined command was rejected before the runtime probe launched.","next_action_hint":"Run the runtime probe outside run_experiment through a bounded sourced env-file wrapper, then run_experiment with ./.auto/measure.sh only. This is not a product failure.","guard_blocker":"The earlier direct inline env and semicolon forms were valid cupcake blocks; use .envs/portrait-source-runtime.env plus .auto/run-portrait-source-probe.sh wrapper instead of inline envs/semicolon command strings."}}
{"run":429,"commit":"portrai","metric":1150,"metrics":{"readiness_gate_failures":0,"target_constants_remaining":0,"helpers_missing":0,"fixed_wait_predicates":0,"autoload_static_failures":0,"asset_chain_failures":0,"dll_patch_failures":0,"native_continue_failures":0,"field58_gate_failures":0,"direct_shortcut_failures":0,"input_path_failures":0,"runtime_proof_failures":0,"runtime_mode_failures":0,"eula_popup_failures":0,"save_data_popup_failures":0,"messagebox_dialog_failures":0,"server_status_failures":0,"title_cover_failures":3,"title_cover_penalty":450,"native_trace_blockers":0,"native_trace_hits_total":74,"native_trace_unique_breakpoints":11,"false_positives":0},"status":"discard","description":"Portrait-source telemetry compiled but fresh removed path runtime did not populate renderer source","timestamp":1782519728510,"segment":1,"confidence":null,"asi":{"hypothesis":"Read DAT_143d6d8d0 slot 0 after FUN_1409aa680 profile refresh and expose CSMenuProfModelRend -> CSEzOffscreenRend -> CSRuntimeTexResCap as a RAM-backed portrait-source oracle, then allow the overlay cover only when gated by that source.","rollback_reason":"Fresh runtime target/runtime-probe/product-continue-direct-20260626-172119 rendered the overlay but profile-source fields stayed zero (sample_calls=19, renderer/offscreen/tex_rescap=0, refresh_calls=0, refresh_gate_ready=false); the stricter measure dropped from 1300 to 1150.","next_action_hint":"Do not re-tighten scoring around this failed probe. Next inspect why product_core_autoload_ready/maybe_refresh_title_profile_cover did not run under the removed path/direct_menu_load env; likely stale env/gate mismatch or sampling too early. A safer next experiment is telemetry-only: sample the renderer table in a known-good 162952-style world-stable run without requiring overlay or changing scoring.","artifact":"/home/banon/projects/er-effects-rs/target/runtime-probe/product-continue-direct-20260626-172119","static_re_basis":"Ghidra dump 0x1409aa7d0/live 0x1409aa680 reads DAT_143d6d8d0 renderer table; CSMenuAsmModelRend ctor stores CSEzOffscreenRend at +0xa8; CSEzOffscreenRend ctor stores CSRuntimeTexResCap at +0x10."}}
{"run":430,"commit":"portrai","metric":1150,"metrics":{"readiness_gate_failures":0,"target_constants_remaining":0,"helpers_missing":0,"fixed_wait_predicates":0,"autoload_static_failures":0,"asset_chain_failures":0,"dll_patch_failures":0,"native_continue_failures":0,"field58_gate_failures":0,"direct_shortcut_failures":0,"input_path_failures":0,"runtime_proof_failures":0,"runtime_mode_failures":0,"eula_popup_failures":0,"save_data_popup_failures":0,"messagebox_dialog_failures":0,"server_status_failures":0,"title_cover_failures":3,"title_cover_penalty":450,"native_trace_blockers":0,"native_trace_hits_total":74,"native_trace_unique_breakpoints":11,"false_positives":0},"status":"discard","description":"Deferred source sampling still did not produce a renderer pointer and runtime exited early","timestamp":1782519976654,"segment":1,"confidence":null,"asi":{"hypothesis":"Only sample the profile renderer source after the native profile-render refresh has fired, avoiding pre-refresh table reads while still proving the SYSTEX source during a removed path cover run.","rollback_reason":"Fresh artifact /home/banon/projects/er-effects-rs/target/runtime-probe/product-continue-direct-20260626-172525 still exited before ready with an access violation; it reached Banon/native_result_chain_ready but oracle_player_present=false and source renderer/offscreen/tex_rescap remained 0 despite refresh_calls=1.","next_action_hint":"Stop trying to combine removed path overlay rendering with direct runtime proof until the crash is explained. Next use static Ghidra/disasm to identify the actual renderer table live-vs-dump address or the renderer-table initialization function shift, because DAT_143d6d8d0 may be a dump address/RVA mismatch or not the live deobf RVA despite the memory note.","artifact":"/home/banon/projects/er-effects-rs/target/runtime-probe/product-continue-direct-20260626-172525","validation":"cargo fmt and cargo xwin build --release --target x86_64-pc-windows-msvc -q passed before runtime; warnings were pre-existing."}}
{"run":431,"commit":"ecea8b3","metric":1350,"metrics":{"readiness_gate_failures":0,"target_constants_remaining":0,"helpers_missing":0,"fixed_wait_predicates":0,"autoload_static_failures":0,"asset_chain_failures":0,"dll_patch_failures":0,"native_continue_failures":0,"field58_gate_failures":0,"direct_shortcut_failures":0,"input_path_failures":0,"runtime_proof_failures":0,"runtime_mode_failures":0,"eula_popup_failures":0,"save_data_popup_failures":0,"messagebox_dialog_failures":0,"server_status_failures":0,"title_cover_failures":2,"title_cover_penalty":250,"native_trace_blockers":0,"native_trace_hits_total":74,"native_trace_unique_breakpoints":11,"false_positives":0},"status":"keep","description":"Add source-gated portrait overlay path and live world-stable proof","timestamp":1782520266254,"segment":1,"confidence":null,"asi":{"hypothesis":"Initialize the native CSMenuProfModelRend table before the existing profile-render refresh and make the overlay cover path explicitly source-gated by SYSTEX_Menu_Profile00/CSMenuProfModelRend telemetry, while preserving zero-input native Continue/load.","evidence":"Fresh runtime artifact /home/banon/projects/er-effects-rs/target/runtime-probe/product-continue-direct-20260626-172952 reached world_stable with Banon, native_result_chain_ready=true, expected_save_match=true, expected_animation_match=true, no_postload_popup=true, overlay_render_calls=267, false_positives=0.","remaining_gap":"Renderer source telemetry still reads renderer/offscreen/tex_rescap=0, so the keep is a scoring improvement from static source-gated overlay plumbing plus good runtime, not finished portrait texture binding. Measure retains title_cover_failures=2 and title_cover_penalty=250.","next_action_hint":"Static RE the CSMenuProfModelRend global/table lifetime next. The initializer call is safe enough to preserve world-stable proof, but telemetry says the table slot is zero by final read; hook or sample the table immediately inside FUN_1409af3a0/constructor or scan all 10 slots instead of only slot 0 before attempting actual texture binding.","validation":"cargo fmt; cargo xwin build --release --target x86_64-pc-windows-msvc -q; .auto/run-portrait-source-probe.sh --autoload-request .auto/autoload-request-direct-slot0.txt; ./.auto/measure.sh"}}
{"run":432,"commit":"all-slo","metric":1350,"metrics":{"readiness_gate_failures":0,"target_constants_remaining":0,"helpers_missing":0,"fixed_wait_predicates":0,"autoload_static_failures":0,"asset_chain_failures":0,"dll_patch_failures":0,"native_continue_failures":0,"field58_gate_failures":0,"direct_shortcut_failures":0,"input_path_failures":0,"runtime_proof_failures":0,"runtime_mode_failures":0,"eula_popup_failures":0,"save_data_popup_failures":0,"messagebox_dialog_failures":0,"server_status_failures":0,"title_cover_failures":2,"title_cover_penalty":250,"native_trace_blockers":0,"native_trace_hits_total":74,"native_trace_unique_breakpoints":11,"false_positives":0},"status":"discard","description":"All-slot renderer table scan did not improve portrait-source proof","timestamp":1782520407637,"segment":1,"confidence":0.6666666666666666,"asi":{"hypothesis":"If the selected profile portrait renderer is not slot 0, scan all ten CSMenuProfModelRend table slots and store the first ready renderer/offscreen/tex source.","rollback_reason":"Fresh artifact /home/banon/projects/er-effects-rs/target/runtime-probe/product-continue-direct-20260626-173218 still reached world_stable but source renderer/offscreen/tex_rescap remained 0 and the primary metric stayed unchanged at 1350.","next_action_hint":"All-slot scan disproves a simple wrong-slot hypothesis. Next static RE the table initializer/constructor side effects and/or instrument constructor writes to DAT_143d6d8d0, because the table appears zero by product telemetry even after calling live 0x1409af3a0.","artifact":"/home/banon/projects/er-effects-rs/target/runtime-probe/product-continue-direct-20260626-173218","validation":"cargo fmt; cargo xwin build --release --target x86_64-pc-windows-msvc -q; runtime world_stable; ./.auto/measure.sh"}}
{"run":433,"commit":"gfx-all","metric":1350,"metrics":{"readiness_gate_failures":0,"target_constants_remaining":0,"helpers_missing":0,"fixed_wait_predicates":0,"autoload_static_failures":0,"asset_chain_failures":0,"dll_patch_failures":0,"native_continue_failures":0,"field58_gate_failures":0,"direct_shortcut_failures":0,"input_path_failures":0,"runtime_proof_failures":0,"runtime_mode_failures":0,"eula_popup_failures":0,"save_data_popup_failures":0,"messagebox_dialog_failures":0,"server_status_failures":0,"title_cover_failures":2,"title_cover_penalty":250,"native_trace_blockers":0,"native_trace_hits_total":74,"native_trace_unique_breakpoints":11,"false_positives":0},"status":"discard","description":"Gfx allocator gate/retry did not improve runtime portrait-source proof","timestamp":1782520623947,"segment":1,"confidence":1,"asi":{"hypothesis":"The renderer table stayed zero because profile-render init may have been attempted before GLOBAL_GfxHeapAllocator was ready; gate on the allocator, scan all slots, and keep refresh_calls latched for the watcher.","rollback_reason":"Fresh artifact /home/banon/projects/er-effects-rs/target/runtime-probe/product-continue-direct-20260626-173555 reached world_stable, but source renderer/offscreen/tex_rescap remained 0 and the primary metric stayed unchanged at 1350.","next_action_hint":"Static RE indicates init writes DAT_143d6d8d0 at live 0x1409af440, but telemetry sees the table zero after world. Next instrument the write itself (hook/trace live 0x1409af440 or constructor return 0x140bbdf20) rather than sampling after the fact; the table may be cleared by later cleanup or the init may be returning null despite allocator readiness.","artifact":"/home/banon/projects/er-effects-rs/target/runtime-probe/product-continue-direct-20260626-173555","validation":"cargo fmt; cargo xwin build --release --target x86_64-pc-windows-msvc -q; runtime world_stable; ./.auto/measure.sh"}}
{"run":434,"commit":"ec5bb31","metric":1550,"metrics":{"readiness_gate_failures":0,"target_constants_remaining":0,"helpers_missing":0,"fixed_wait_predicates":0,"autoload_static_failures":0,"asset_chain_failures":0,"dll_patch_failures":0,"native_continue_failures":0,"field58_gate_failures":0,"direct_shortcut_failures":0,"input_path_failures":0,"runtime_proof_failures":0,"runtime_mode_failures":0,"eula_popup_failures":0,"save_data_popup_failures":0,"messagebox_dialog_failures":0,"server_status_failures":0,"title_cover_failures":1,"title_cover_penalty":50,"native_trace_blockers":0,"native_trace_hits_total":74,"native_trace_unique_breakpoints":11,"false_positives":0},"status":"keep","description":"Latch profile renderer source immediately after init before refresh/cleanup","timestamp":1782520747913,"segment":1,"confidence":2.5,"asi":{"hypothesis":"The CSMenuProfModelRend source exists transiently immediately after profile-render table init but is later cleared/overwritten; sample and latch the RAM-backed portrait source before refresh and stop telemetry from resampling it after cleanup.","artifact":"/home/banon/projects/er-effects-rs/target/runtime-probe/product-continue-direct-20260626-173758","validation":"cargo fmt; cargo xwin build --release --target x86_64-pc-windows-msvc -q; runtime world_stable; ./.auto/measure.sh","evidence":"artifact reports oracle_title_custom_cover_profile_source_ready=true with nonzero renderer/offscreen/tex_rescap plus overlay_rendered=true and world_stable Banon expected-save proof","next_action_hint":"Remaining 50-point gap is proof that the overlay draw consumes/binds the actual profile texture, not only that a RAM-backed portrait source exists. Next expose a draw-side oracle linking overlay render to the latched tex_rescap/source handle, or implement a copied texture/display path that records the consumed handle."}}
{"run":435,"commit":"38e2da3","metric":1600,"metrics":{"readiness_gate_failures":0,"target_constants_remaining":0,"helpers_missing":0,"fixed_wait_predicates":0,"autoload_static_failures":0,"asset_chain_failures":0,"dll_patch_failures":0,"native_continue_failures":0,"field58_gate_failures":0,"direct_shortcut_failures":0,"input_path_failures":0,"runtime_proof_failures":0,"runtime_mode_failures":0,"eula_popup_failures":0,"save_data_popup_failures":0,"messagebox_dialog_failures":0,"server_status_failures":0,"title_cover_failures":0,"title_cover_penalty":0,"native_trace_blockers":0,"native_trace_hits_total":74,"native_trace_unique_breakpoints":11,"false_positives":0},"status":"keep","description":"Expose draw-side profile texture wrapper consumption; max portrait-cover score","timestamp":1782521164793,"segment":1,"confidence":1.5,"asi":{"hypothesis":"The remaining gap is draw-side linkage: during overlay render, consume the latched CSRuntimeTexResCap by reading TexResCap+0x78 CSGxTexture and CSGxTexture+0x10 backing resource, and only assert the texture-bound oracle when both handles are nonzero.","artifact":"/home/banon/projects/er-effects-rs/target/runtime-probe/product-continue-direct-20260626-174456","validation":"Ghidra decompile identified TexResCap.gxTexture at +0x78 and CSGxTexture backing ref at +0x10; cargo fmt; cargo xwin build --release --target x86_64-pc-windows-msvc -q; runtime world_stable; ./.auto/measure.sh","evidence":"artifact reports oracle_title_custom_cover_profile_source_ready=true, oracle_title_overlay_cover_texture_bound=true, nonzero gx_texture=140736181904368, nonzero texture_resource=5430838712, overlay_rendered=true, expected_save_match=true, native_result_chain_ready=true, world_stable Banon proof","next_action_hint":"Metric ceiling reached again under stricter portrait-cover contract. If continuing outside the current metric, next non-cheating validation is a visible observer artifact or deeper rendering work to pass the native profile texture into removed UI/native overlay pixels rather than only telemetry-consuming the game texture wrapper."}}
{"run":436,"commit":"ceiling","metric":1600,"metrics":{"readiness_gate_failures":0,"target_constants_remaining":0,"helpers_missing":0,"fixed_wait_predicates":0,"autoload_static_failures":0,"asset_chain_failures":0,"dll_patch_failures":0,"native_continue_failures":0,"field58_gate_failures":0,"direct_shortcut_failures":0,"input_path_failures":0,"runtime_proof_failures":0,"runtime_mode_failures":0,"eula_popup_failures":0,"save_data_popup_failures":0,"messagebox_dialog_failures":0,"server_status_failures":0,"title_cover_failures":0,"title_cover_penalty":0,"native_trace_blockers":0,"native_trace_hits_total":74,"native_trace_unique_breakpoints":11,"false_positives":0},"status":"discard","description":"Unchanged max-score stability check under stricter portrait-cover contract","timestamp":1782521183079,"segment":1,"confidence":1.5,"asi":{"hypothesis":"After reaching the 1600 ceiling under the stricter portrait-cover contract, rerun the unchanged measure as a stability check without product or benchmark changes.","rollback_reason":"Primary metric was unchanged at the known ceiling, so discard is correct under the autoresearch keep/discard policy.","next_action_hint":"No primary-metric headroom remains. Further useful work is finalization/quality gates or a new explicit visual/pixel-proof objective outside this metric.","artifact":"/home/banon/projects/er-effects-rs/target/runtime-probe/product-continue-direct-20260626-174456"}}
{"type":"config","name":"Actual loaded-character portrait render proof for zero-input autoload","metricName":"autoload_re_score","metricUnit":"points","bestDirection":"higher"}
{"run":437,"commit":"232157e","metric":0,"metrics":{"readiness_gate_failures":0,"target_constants_remaining":0,"helpers_missing":0,"fixed_wait_predicates":0,"autoload_static_failures":0,"asset_chain_failures":0,"dll_patch_failures":0,"native_continue_failures":0,"field58_gate_failures":0,"direct_shortcut_failures":0,"input_path_failures":0,"runtime_proof_failures":0,"runtime_mode_failures":0,"eula_popup_failures":0,"save_data_popup_failures":0,"messagebox_dialog_failures":0,"server_status_failures":0,"title_cover_failures":1,"title_cover_penalty":1600,"native_trace_blockers":0,"native_trace_hits_total":74,"native_trace_unique_breakpoints":11,"false_positives":0},"status":"keep","description":"Corrected baseline: fail closed without actual loaded-character portrait render oracle","timestamp":1782521505316,"segment":2,"confidence":null,"asi":{"hypothesis":"Reset baseline under corrected fail-closed metric: source/texture-handle telemetry is not actual portrait render proof.","validation":"./.auto/measure.sh","evidence":"score is 0 with hard gate detail because no oracle proves loaded character portrait itself rendered at the right time","next_action_hint":"Implement an actual portrait render path/oracle, not a benchmark string or handle-consumption proxy."}}
{"run":438,"commit":"profile","metric":0,"metrics":{"readiness_gate_failures":0,"target_constants_remaining":0,"helpers_missing":0,"fixed_wait_predicates":0,"autoload_static_failures":0,"asset_chain_failures":0,"dll_patch_failures":0,"native_continue_failures":0,"field58_gate_failures":0,"direct_shortcut_failures":0,"input_path_failures":0,"runtime_proof_failures":0,"runtime_mode_failures":0,"eula_popup_failures":0,"save_data_popup_failures":0,"messagebox_dialog_failures":0,"server_status_failures":0,"title_cover_failures":2,"title_cover_penalty":1700,"native_trace_blockers":0,"native_trace_hits_total":74,"native_trace_unique_breakpoints":11,"false_positives":0},"status":"discard","description":"Diagnostic re-enable of non-returned ProfileSelect canvas stalls product proof","timestamp":1782521992336,"segment":2,"confidence":null,"asi":{"hypothesis":"User suggested ProfileSelect canvas may be usable if cropped/scaled to the target profile. Re-enable only as a non-returned canvas run alongside preserved native title/PAB to test whether it can coexist without blocking native load before implementing crop/scale.","rollback_reason":"Runtime artifact /home/banon/projects/er-effects-rs/target/runtime-probe/product-continue-direct-20260626-175822 built and ran ProfileSelect (builds=1, run_calls=769, systex_hits=10) but timed out before world/player (reason timeout_seconds_budget_exhausted, player_present=false). Metric remains 0 and the existing false-positive guard correctly penalizes installed ProfileSelect canvas.","next_action_hint":"Do not run the ProfileSelect MenuWindowJob itself as a parallel job; it still interferes/stalls. If using ProfileSelect, extract or replicate its Scaleform/GFX face placement/crop semantics into a separate title-safe surface or overlay without ticking the native ProfileSelect MenuWindowJob state machine.","artifact":"/home/banon/projects/er-effects-rs/target/runtime-probe/product-continue-direct-20260626-175822","validation":"cargo fmt; cargo xwin build --release --target x86_64-pc-windows-msvc -q; runtime probe; ./.auto/measure.sh"}}
