{"run":470,"commit":"3b7f999","metric":0,"metrics":{"readiness_gate_failures":0,"target_constants_remaining":0,"helpers_missing":0,"fixed_wait_predicates":0,"autoload_static_failures":0,"asset_chain_failures":0,"dll_patch_failures":0,"native_continue_failures":0,"field58_gate_failures":0,"direct_shortcut_failures":0,"input_path_failures":0,"runtime_proof_failures":0,"runtime_mode_failures":0,"eula_popup_failures":0,"save_data_popup_failures":0,"messagebox_dialog_failures":0,"server_status_failures":0,"title_cover_failures":2,"title_cover_penalty":1800,"native_trace_blockers":0,"native_trace_hits_total":74,"native_trace_unique_breakpoints":11,"false_positives":1},"status":"keep","description":"Add black-pixel logo screenshot oracle for known false-positive panel","timestamp":1782531228946,"segment":2,"confidence":null,"asi":{"hypothesis":"A lean visual oracle can catch the current false-positive panel by measuring pure-black pixel ratio in logo-replacement-screenshot.jpg. The desired portrait-on-black stage should have substantially more pure-black surround than the known bad dark LOAD GAME/ProfileSelect panel, which measured black32_ratio around 0.46-0.48.","artifact":"/home/banon/projects/er-effects-rs/target/runtime-probe/product-continue-direct-20260626-203234","visual_evidence":"I read /home/banon/projects/er-effects-rs/target/runtime-probe/product-continue-direct-20260626-203234/logo-replacement-screenshot.jpg. It still shows a dark LOAD GAME/ProfileSelect-style panel, not a portrait.","analysis_evidence":"logo-replacement-screenshot-analysis.json reports black32_ratio=0.48055636967565457, dark48_ratio=0.6606560179757718, dark64_ratio=0.916024325908558, black_ratio_sane_for_portrait_stage=false, known_false_positive_signature=true. measure.sh reports the new DETAIL for this artifact and keeps autoload_re_score=0, title_cover_failures=2, title_cover_penalty=1800, false_positives=1.","validation":"py_compile scripts/analyze-logo-replacement-screenshot.py scripts/er-readiness-watch.py scripts/check-runtime-probe-contract.py scripts/test-runtime-probe-contract.py; bash -n .auto/measure.sh; bash -n scripts/run-product-continue-direct-probe.sh; python3 scripts/test-runtime-probe-contract.py; python3 scripts/check-runtime-probe-contract.py; shellcheck scripts/run-product-continue-direct-probe.sh; run_experiment ./.auto/measure.sh with .auto/run_runtime_probe_once produced fresh screenshot analysis artifact.","next_action_hint":"Use black32_ratio as a cheap early false-positive filter, but do not treat it as product success. The next actual improvement must change the rendered surface so logo-replacement-screenshot.jpg shows a visible character portrait and then add oracle_title_portrait_pixels_visible or equivalent native/pixel proof."}}
{"run":471,"commit":"3b7f999","metric":0,"metrics":{"readiness_gate_failures":0,"target_constants_remaining":0,"helpers_missing":0,"fixed_wait_predicates":0,"autoload_static_failures":0,"asset_chain_failures":0,"dll_patch_failures":0,"native_continue_failures":0,"field58_gate_failures":0,"direct_shortcut_failures":0,"input_path_failures":0,"runtime_proof_failures":0,"runtime_mode_failures":0,"eula_popup_failures":0,"save_data_popup_failures":0,"messagebox_dialog_failures":0,"server_status_failures":0,"title_cover_failures":2,"title_cover_penalty":1800,"native_trace_blockers":0,"native_trace_hits_total":74,"native_trace_unique_breakpoints":11,"false_positives":1},"status":"discard","description":"Broad ProfileSelect panel bind target stays black and fails portrait visual oracle","timestamp":1782531452348,"segment":2,"confidence":null,"asi":{"hypothesis":"Retarget the SYSTEX_Menu_Profile00 bind from MENU_FL_40135_Profile to a broader root-reachable ProfileSelect panel texture, MENU_BaseMain_01, because the previous row-chrome target stayed visually dark. If native binding can replace a broad visible panel texture, the logo-replacement screenshot should show a visible portrait or at least a non-false-positive pixel signature.","artifact":"/home/banon/projects/er-effects-rs/target/runtime-probe/product-continue-direct-20260626-203612","visual_evidence":"I read /home/banon/projects/er-effects-rs/target/runtime-probe/product-continue-direct-20260626-203612/logo-replacement-screenshot.jpg. It shows a mostly black LOAD GAME/ProfileSelect panel with no loaded-character portrait. The change made the panel darker, not correct.","analysis_evidence":"logo-replacement-screenshot-analysis.json reports black32_ratio=0.9920403477921063, dark48_ratio=0.9952154161781946, dark64_ratio=0.9963340171942164, black_ratio_sane_for_portrait_stage=false, known_false_positive_signature=true.","validation":"cargo fmt; bash -n .auto/measure.sh; bash -n scripts/run-product-continue-direct-probe.sh; python3 scripts/test-runtime-probe-contract.py; python3 scripts/check-runtime-probe-contract.py; shellcheck scripts/run-product-continue-direct-probe.sh; run_experiment ./.auto/measure.sh with .auto/run_runtime_probe_once.","rollback_reason":"Primary metric stayed 0 and visual evidence showed no portrait; MENU_BaseMain_01 bind target is a dead end.","next_action_hint":"Do not keep trying arbitrary ProfileSelect chrome texture names. Static RE the native Scaleform/texture binding/render path or create a real custom surface that places the portrait texture; success needs visible portrait pixels plus oracle_title_portrait_pixels_visible or equivalent native/pixel evidence."}}
{"run":472,"commit":"9353857","metric":0,"metrics":{"readiness_gate_failures":0,"target_constants_remaining":0,"helpers_missing":0,"fixed_wait_predicates":0,"autoload_static_failures":0,"asset_chain_failures":0,"dll_patch_failures":0,"native_continue_failures":0,"field58_gate_failures":0,"direct_shortcut_failures":0,"input_path_failures":0,"runtime_proof_failures":0,"runtime_mode_failures":0,"eula_popup_failures":0,"save_data_popup_failures":0,"messagebox_dialog_failures":0,"server_status_failures":0,"title_cover_failures":2,"title_cover_penalty":1800,"native_trace_blockers":0,"native_trace_hits_total":74,"native_trace_unique_breakpoints":11,"false_positives":1},"status":"keep","description":"Record exact-moment logo-replacement screenshot requirement","timestamp":1782531711773,"segment":2,"confidence":null,"asi":{"hypothesis":"The screenshot timing should not be delayed; it must capture the exact logo-replacement moment where the user/agent can see the feature failing, because that failure view is the evidence that drives the stricter semaphore. Persist this requirement so future runs do not hide the failure by taking a later friendlier screenshot.","evidence":"Updated AGENTS.md and .auto/prompt.md to state the logo-replacement screenshot must capture the exact failure moment and must not be delayed to a later/friendlier frame. Existing latest artifact remains target/runtime-probe/product-continue-direct-20260626-203612 with no portrait and known_false_positive_signature=true.","validation":"py_compile scripts/analyze-logo-replacement-screenshot.py scripts/er-readiness-watch.py scripts/check-runtime-probe-contract.py scripts/test-runtime-probe-contract.py scripts/capture-er-window.py; bash -n .auto/measure.sh; bash -n scripts/run-product-continue-direct-probe.sh; python3 scripts/test-runtime-probe-contract.py; python3 scripts/check-runtime-probe-contract.py; shellcheck scripts/run-product-continue-direct-probe.sh; run_experiment ./.auto/measure.sh => autoload_re_score=0, title_cover_failures=2, title_cover_penalty=1800, false_positives=1.","next_action_hint":"Next implementation work should not adjust capture timing. It must change the rendering path itself or add a real native/pixel portrait semaphore."}}
{"run":473,"commit":"9353857","metric":0,"metrics":{"readiness_gate_failures":0,"target_constants_remaining":0,"helpers_missing":0,"fixed_wait_predicates":0,"autoload_static_failures":0,"asset_chain_failures":0,"dll_patch_failures":0,"native_continue_failures":0,"field58_gate_failures":0,"direct_shortcut_failures":0,"input_path_failures":0,"runtime_proof_failures":0,"runtime_mode_failures":0,"eula_popup_failures":0,"save_data_popup_failures":0,"messagebox_dialog_failures":0,"server_status_failures":0,"title_cover_failures":1,"title_cover_penalty":1600,"native_trace_blockers":0,"native_trace_hits_total":74,"native_trace_unique_breakpoints":11,"false_positives":1},"status":"discard","description":"Static-derived Icon_0 face target observed too late for deferred transform","timestamp":1782532340805,"segment":2,"confidence":null,"asi":{"hypothesis":"Static FFDEC/XML inspection of 05_010_ProfileSelect shows the slot0 portrait bitmap path is MENU_DummyProfileFace_01 -> shape 56 -> sprite 66 -> named child Icon_0. Transform Icon_0 instead of the visually falsified outer ProfileList/ItemList container or arbitrary chrome texture names.","artifact":"/home/banon/projects/er-effects-rs/target/runtime-probe/product-continue-direct-20260626-205030","static_re":"FFDEC XML path: MENU_DummyProfileFace_01 image char 23 -> shape 56 -> sprite 66 -> named child Icon_0 -> sprite 76 item chain -> ProfileList/ItemList hierarchy. This is a real face clip, not an arbitrary ProfileSelect chrome texture.","runtime_finding":"Artifact reached world-stable with oracle_title_custom_cover_run_calls=1 and oracle_title_profile_face_bind_hits=1, but oracle_title_profile_face_transform_applied=false. Debug timing shows the one-tick custom cover run completed at +15614ms, while Icon_0 was bound/recorded later at +17548ms, so the existing deferred transform point had already passed.","validation":"cargo fmt passed; host cargo check was not applicable for this Windows DLL crate and failed in from-singleton/pelite because the host target is non-Windows; bash -n .auto/measure.sh; bash -n scripts/run-product-continue-direct-probe.sh; python3 scripts/test-runtime-probe-contract.py; python3 scripts/check-runtime-probe-contract.py; shellcheck scripts/run-product-continue-direct-probe.sh; run_experiment ./.auto/measure.sh with .auto/run_runtime_probe_once passed.","rollback_reason":"Primary metric stayed 0 and no portrait-pixel oracle was produced; the transform target was identified but not transformed because it appeared after the current deferred transform timing.","next_action_hint":"Reapply the Icon_0 target, but apply SetPosition/SetScale immediately in the named-child bind hook after the original returns when TITLE_CUSTOM_COVER_RUN_CALLS>=1, instead of waiting for the cover run hook. That targets the real face clip at the time it becomes available."}}
{"run":474,"commit":"9353857","metric":0,"metrics":{"readiness_gate_failures":0,"target_constants_remaining":0,"helpers_missing":0,"fixed_wait_predicates":0,"autoload_static_failures":0,"asset_chain_failures":0,"dll_patch_failures":0,"native_continue_failures":0,"field58_gate_failures":0,"direct_shortcut_failures":0,"input_path_failures":0,"runtime_proof_failures":0,"runtime_mode_failures":0,"eula_popup_failures":0,"save_data_popup_failures":0,"messagebox_dialog_failures":0,"server_status_failures":0,"title_cover_failures":2,"title_cover_penalty":1800,"native_trace_blockers":0,"native_trace_hits_total":74,"native_trace_unique_breakpoints":11,"false_positives":1},"status":"discard","description":"Icon_0 bind-time transform fires but still fails portrait-pixel proof","timestamp":1782532672013,"segment":2,"confidence":null,"asi":{"hypothesis":"Reapply the static-derived Icon_0 target and apply SetPosition/SetScale immediately in the named-child bind hook after the one-tick ProfileSelect cover has run, because the prior run proved Icon_0 binds after the cover-run hook transform point had already passed.","artifact":"/home/banon/projects/er-effects-rs/target/runtime-probe/product-continue-direct-20260626-205546","runtime_finding":"The transform now fired: debug log shows recorded Icon_0 and `applying ProfileSelect face transform via Icon_0 bind` at +16899ms with calls=1; telemetry reports oracle_title_profile_face_transform_applied=true, profile_face_bind_hits=1, and world/loading proof continued.","visual_evidence":"I read /home/banon/projects/er-effects-rs/target/runtime-probe/product-continue-direct-20260626-205546/logo-replacement-screenshot.jpg. It shows the native loading-screen art/tip, not a loaded-character portrait cover. The analysis reports black32_ratio=0.9978360687768659, dark64_ratio=0.9998900937866354, known_false_positive_signature=true.","validation":"cargo fmt; bash -n .auto/measure.sh; bash -n scripts/run-product-continue-direct-probe.sh; python3 scripts/test-runtime-probe-contract.py; python3 scripts/check-runtime-probe-contract.py; shellcheck scripts/run-product-continue-direct-probe.sh; run_experiment ./.auto/measure.sh with .auto/run_runtime_probe_once.","rollback_reason":"Primary metric stayed 0 and false_positives stayed 1; even though the real Icon_0 transform fired, no portrait-pixel oracle or visible portrait screenshot was produced.","next_action_hint":"The target/timing is now proven enough. Next need a stricter visual/native semaphore at the actual transform window: either capture/analyze immediately when Icon_0 transform fires before native now-loading takeover, or hook/read the Scaleform/texture surface after SetPosition/SetScale to prove whether MENU_DummyProfileFace_01 pixels are actually in the visible buffer. Do not score transform_applied alone."}}
{"run":475,"commit":"9353857","metric":0,"metrics":{"readiness_gate_failures":0,"target_constants_remaining":0,"helpers_missing":0,"fixed_wait_predicates":0,"autoload_static_failures":0,"asset_chain_failures":0,"dll_patch_failures":0,"native_continue_failures":0,"field58_gate_failures":0,"direct_shortcut_failures":0,"input_path_failures":0,"runtime_proof_failures":0,"runtime_mode_failures":0,"eula_popup_failures":0,"save_data_popup_failures":0,"messagebox_dialog_failures":0,"server_status_failures":0,"title_cover_failures":2,"title_cover_penalty":1800,"native_trace_blockers":0,"native_trace_hits_total":74,"native_trace_unique_breakpoints":11,"false_positives":1},"status":"discard","description":"Transform-edge capture still shows native loading art, not portrait cover","timestamp":1782532962363,"segment":2,"confidence":null,"asi":{"hypothesis":"Capture the diagnostic screenshot at the first Icon_0/visible-surface transform edge instead of waiting for held-until-loading telemetry; if the feature is only hidden by late capture timing, the screenshot should move earlier and show the portrait cover or a different failure frame.","artifact":"/home/banon/projects/er-effects-rs/target/runtime-probe/product-continue-direct-20260626-210110","runtime_finding":"The Icon_0 transform still fired at +17124ms (`applying ProfileSelect face transform via Icon_0 bind value=0x10ed88 calls=1`). The watcher event captured with oracle_now_loading=0 but render-loading slots already visible (visible_slots_mask=127), so the visually active surface was already native loading art.","visual_evidence":"I read /home/banon/projects/er-effects-rs/target/runtime-probe/product-continue-direct-20260626-210110/logo-replacement-screenshot.jpg. It shows native loading-screen art/tip (`Charge and Jump Attacks`), not the loaded-character portrait. Analysis black32_ratio=0.9935839194998046 and known_false_positive_signature=true.","validation":"cargo fmt; bash -n .auto/measure.sh; bash -n scripts/run-product-continue-direct-probe.sh; python3 -m py_compile scripts/er-readiness-watch.py; python3 scripts/test-runtime-probe-contract.py; python3 scripts/check-runtime-probe-contract.py; shellcheck scripts/run-product-continue-direct-probe.sh; run_experiment ./.auto/measure.sh with .auto/run_runtime_probe_once.","rollback_reason":"Primary metric stayed 0 and false_positives stayed 1; changing diagnostic capture timing did not produce visible portrait pixels and the transform happens after render-loading takeover is already visible.","next_action_hint":"Do not keep retiming screenshots around Icon_0 transform. The ProfileSelect face path is arriving too late for the boot-gap cover. Next pivot to an earlier/custom surface that consumes the RAM-backed portrait source before render-loading slots become visible, or hook the native profile renderer output directly rather than replaying ProfileSelect."}}
{"run":476,"commit":"9353857","metric":0,"metrics":{"readiness_gate_failures":0,"target_constants_remaining":0,"helpers_missing":0,"fixed_wait_predicates":0,"autoload_static_failures":0,"asset_chain_failures":0,"dll_patch_failures":0,"native_continue_failures":0,"field58_gate_failures":0,"direct_shortcut_failures":0,"input_path_failures":0,"runtime_proof_failures":0,"runtime_mode_failures":0,"eula_popup_failures":0,"save_data_popup_failures":0,"messagebox_dialog_failures":0,"server_status_failures":0,"title_cover_failures":2,"title_cover_penalty":1800,"native_trace_blockers":0,"native_trace_hits_total":74,"native_trace_unique_breakpoints":11,"false_positives":0},"status":"discard","description":"Disable late ProfileSelect replay removes false-positive semaphore but leaves no cover","timestamp":1782533150937,"segment":2,"confidence":null,"asi":{"hypothesis":"Since ProfileSelect/Icon_0 replay is proven to arrive after native loading-screen takeover, disable the late non-returned ProfileSelect cover build entirely. This should remove the false-positive visible-surface/ProfileSelect semaphore path while preserving native zero-input load, confirming the next path must be an earlier/custom portrait surface rather than another ProfileSelect retiming.","artifact":"/home/banon/projects/er-effects-rs/target/runtime-probe/product-continue-direct-20260626-210433","runtime_finding":"Runtime reached product proof with false_positives=0 and no logo-replacement screenshot, because no false-positive visible-surface/ProfileSelect predicate asserted. The failure is now honest: no custom/profile cover bound to visible logo/title surface or RAM-backed rendered overlay successor cover, and no portrait-pixel oracle.","validation":"cargo fmt; bash -n .auto/measure.sh; bash -n scripts/run-product-continue-direct-probe.sh; python3 -m py_compile scripts/er-readiness-watch.py; python3 scripts/test-runtime-probe-contract.py; python3 scripts/check-runtime-probe-contract.py; shellcheck scripts/run-product-continue-direct-probe.sh; run_experiment ./.auto/measure.sh with .auto/run_runtime_probe_once.","rollback_reason":"Primary metric stayed 0. The secondary false_positives improvement confirms the cleanup direction, but it does not satisfy the portrait-cover objective or improve the primary score.","next_action_hint":"If cleanup is desired later, reapply disabling late ProfileSelect replay as hygiene. For metric improvement, implement an earlier/custom portrait surface that consumes the latched CSMenuProfModelRend/CSEzOffscreenRend/CSRuntimeTexResCap source before render-loading takeover; do not rely on ProfileSelect replay."}}
{"run":477,"commit":"9353857","metric":0,"metrics":{"readiness_gate_failures":0,"target_constants_remaining":0,"helpers_missing":0,"fixed_wait_predicates":0,"autoload_static_failures":0,"asset_chain_failures":0,"dll_patch_failures":0,"native_continue_failures":0,"field58_gate_failures":0,"direct_shortcut_failures":0,"input_path_failures":0,"runtime_proof_failures":0,"runtime_mode_failures":0,"eula_popup_failures":0,"save_data_popup_failures":0,"messagebox_dialog_failures":0,"server_status_failures":0,"title_cover_failures":2,"title_cover_penalty":1800,"native_trace_blockers":0,"native_trace_hits_total":74,"native_trace_unique_breakpoints":11,"false_positives":0},"status":"discard","description":"Static RE pivot plan for earlier custom portrait surface","timestamp":1782533493888,"segment":2,"confidence":null,"asi":{"hypothesis":"After proving ProfileSelect/Icon_0 replay arrives too late, use static RE to identify the next implementable earlier/custom surface path rather than running another live retiming probe. Candidate surfaces are the native RendMan/CSEzDraw phases or a removed path backend texture-registration bridge for the latched CSRuntimeTexResCap/CSGxTexture portrait source.","static_re_evidence":"Ghidra decompile: CSDrawStep dump 0x140b14520 calls RendMan phases 0x140cc7200/0x140cc7140/0x140cc6cf0/0x140cc7040/...; 0x140cc7200 draws CSEzDraw queues at RendMan+0x28/+0x30 through CSEzDraw::Draw 0x142650030; 0x140cc7140 draws queue at RendMan+0x38; 0x142650030 executes command buffers via 0x14269b4f0. Deleted path source inspection: invalidated-ui TextureId is an internal texture_heap index; dx11 backend binds ID3D11ShaderResourceView from removed path-owned heap, dx12 similarly uses owned descriptor heaps, so raw CSGxTexture pointers cannot be handed to add_image without a backend extension/registration path.","changed_files":"Appended the concrete RE pivot note to .auto/ideas.md so the next implementation does not resume ProfileSelect symbol/transform retiming.","validation":"bash -n .auto/measure.sh; python3 -m py_compile scripts/er-readiness-watch.py; run_experiment ./.auto/measure.sh => autoload_re_score=0, false_positives=0.","rollback_reason":"Primary metric stayed 0; this iteration produced a static plan, not a portrait-render implementation.","next_action_hint":"Implement one of the two earlier-surface routes: (1) patch/localize removed path RenderContext/backend to register an existing native D3D resource/SRV/descriptor from CSGxTexture+0x10/+0x18 into the removed path texture heap and draw it via add_image before render-loading takeover, or (2) build/inject a native CSEzDraw/custom-surface command into the RendMan phase using the latched CSRuntimeTexResCap source."}}
