{"run":594,"commit":"4dc167b","metric":0,"metrics":{"readiness_gate_failures":0,"target_constants_remaining":0,"helpers_missing":0,"fixed_wait_predicates":0,"autoload_static_failures":0,"asset_chain_failures":0,"dll_patch_failures":0,"native_continue_failures":0,"field58_gate_failures":0,"direct_shortcut_failures":0,"input_path_failures":0,"runtime_proof_failures":0,"runtime_mode_failures":0,"eula_popup_failures":0,"save_data_popup_failures":0,"messagebox_dialog_failures":0,"server_status_failures":0,"title_cover_failures":3,"title_cover_penalty":2000,"native_trace_blockers":0,"native_trace_hits_total":74,"native_trace_unique_breakpoints":11,"false_positives":0,"offline_face_source_ready":1,"removed path_cpu_texture_bridge_ready":0,"offline_face_texture_runtime_drawn":0,"stylized_facedata_pixel_oracle":0,"real_portrait_asset_candidates":0,"profile_placeholder_assets_only":1},"status":"discard","description":"Static RE explains owned TitleBack ctor-hook timing race after synthetic MemoryFile route hit.","timestamp":1782658526723,"segment":2,"confidence":null,"asi":{"hypothesis":"Use static Ghidra xrefs/decompilation to explain why #592 showed a synthetic FileOpener/MemoryFile hit but no owned TitleBack build log, before trying another runtime probe.","observed_evidence":"Ghidra xrefs show TitleBackViewParts ctor dump 0x1409a62d0 (deobf 0x1409a6180) is called inside CS::TitleTopDialog::TitleTopDialog at dump 0x1409a83b8 when constructing dialog+0xaa8 with L'05_001_Title_Logo'. TitleTopDialog start-login dump 0x1409b3050 later only calls SceneObjProxy visible setter and TitleBackViewParts::SetVisible on existing dialog+0xaa8; it does not construct the logo. This makes a thread-installed TitleBack ctor hook timing-sensitive and can explain missing owned-titleback post-ctor log if the ctor ran before MinHook applied. Finding saved to bd memory titleback-ctor-hook-timing-static-2026-06-28. Guard note saved to guard-valid-rtk-git-status-2026-06-28 after a valid rtk git-status policy block.","rollback_reason":"Primary metric stayed 0 and title_cover_failures stayed at 3 because this was static diagnosis only; no safer hook site or portrait surface was implemented.","next_action_hint":"Move the diagnostic away from the asynchronously installed TitleBack ctor hook. Prefer a TitleTopDialog ctor hook installed earlier, or use a later guaranteed dialog pointer from start-login/dialog+0xaa8 with a separately grounded context path. Do not repeat #592 unchanged."}}
{"run":595,"commit":"4dc167b","metric":0,"metrics":{"readiness_gate_failures":0,"target_constants_remaining":0,"helpers_missing":0,"fixed_wait_predicates":0,"autoload_static_failures":0,"asset_chain_failures":0,"dll_patch_failures":0,"native_continue_failures":0,"field58_gate_failures":0,"direct_shortcut_failures":0,"input_path_failures":0,"runtime_proof_failures":0,"runtime_mode_failures":0,"eula_popup_failures":0,"save_data_popup_failures":0,"messagebox_dialog_failures":0,"server_status_failures":0,"title_cover_failures":3,"title_cover_penalty":2000,"native_trace_blockers":0,"native_trace_hits_total":74,"native_trace_unique_breakpoints":11,"false_positives":0,"offline_face_source_ready":1,"removed path_cpu_texture_bridge_ready":0,"offline_face_texture_runtime_drawn":0,"stylized_facedata_pixel_oracle":0,"real_portrait_asset_candidates":0,"profile_placeholder_assets_only":1},"status":"discard","description":"Static RE grounds start-login as safer owned TitleBack build point than missed ctor hook.","timestamp":1782658637508,"segment":2,"confidence":null,"asi":{"hypothesis":"After #592/#594 showed synthetic FileOpener hit but missing owned-titleback ctor log, statically validate whether the guaranteed TitleTopDialog start-login hook can be used as a later owned TitleBack construction point rather than relying on catching the initial TitleBack ctor.","observed_evidence":"Deobf disasm of TitleBackViewParts ctor 0x1409a6180 shows it uses RCX=this and RDX=load_info: vtable store, copy 16-byte load_info, MenuResource ctor at this+0x8, resolver 0x140749190 with this+0x8/this+0x70. Ghidra decomp of dump 0x1409a62d0 labels four formals and forwards param3/param4 to MenuResource, so extra context still needs grounding. Deobf start-login 0x1409b2f00 has guaranteed dialog pointer and only sets visibility on dialog+0xa48 and dialog+0xaa8, no construction. Finding saved to bd memory titleback-start-login-build-route-2026-06-28.","rollback_reason":"Primary metric stayed 0 and title_cover_failures stayed at 3; this was static route grounding only, no implementation or runtime proof.","next_action_hint":"Before runtime, ground MenuResource ctor/context requirements for calling TitleBackViewParts ctor from start-login. If safe, build owned synthetic TitleBack from start-login using game_rva(0x9a6180) and stable load_info; otherwise reuse context fields from existing dialog+0xaa8/MenuResource."}}
{"run":596,"commit":"4dc167b","metric":0,"metrics":{"readiness_gate_failures":0,"target_constants_remaining":0,"helpers_missing":0,"fixed_wait_predicates":0,"autoload_static_failures":0,"asset_chain_failures":0,"dll_patch_failures":0,"native_continue_failures":0,"field58_gate_failures":0,"direct_shortcut_failures":0,"input_path_failures":0,"runtime_proof_failures":0,"runtime_mode_failures":0,"eula_popup_failures":0,"save_data_popup_failures":0,"messagebox_dialog_failures":0,"server_status_failures":0,"title_cover_failures":3,"title_cover_penalty":2000,"native_trace_blockers":0,"native_trace_hits_total":74,"native_trace_unique_breakpoints":11,"false_positives":0,"offline_face_source_ready":1,"removed path_cpu_texture_bridge_ready":0,"offline_face_texture_runtime_drawn":0,"stylized_facedata_pixel_oracle":0,"real_portrait_asset_candidates":0,"profile_placeholder_assets_only":1},"status":"discard","description":"Static RE falsified extra-arg concern for MenuResource/TitleBack construction context.","timestamp":1782658750668,"segment":2,"confidence":null,"asi":{"hypothesis":"Ground whether TitleBackViewParts/MenuResource construction from start-login needs preserved param3/param4 context, or whether the deobf call only needs RCX=this and RDX=16-byte load_info.","observed_evidence":"TitleTopDialog callsite deobf 0x1409a8268 sets only RCX=dialog+0xaa8 and RDX=&load_info before calling TitleBackViewParts ctor; no deliberate R8/R9 setup exists. MenuResource ctor deobf 0x140748a30 calls helper 0x140d6a3b0; disassembly of 0x140d6a3b0 shows it takes RCX/RDX, sets R8 itself to 0x142a8fd68 before calling 0x140d6a2a0, and ignores incoming R8/R9. Thus Ghidra's four-formal prototype is misleading for this wrapper route. Finding saved to bd memory menuresource-ctor-extra-args-falsified-2026-06-28.","rollback_reason":"Primary metric stayed 0 and title_cover_failures stayed at 3; this was static ABI/context grounding only, no implementation or runtime proof.","next_action_hint":"Implement the owned synthetic TitleBack diagnostic from the guaranteed start-login hook using game_rva(0x9a6180)(owned_object, load_info) semantics and the synthetic FileOpener hook. Keep it explicit-gated and non-scoring until runtime proves synthetic URL/MemoryFile hit and visible portrait/native-surface oracle."}}
{"run":597,"commit":"978974d","metric":0,"metrics":{"readiness_gate_failures":0,"target_constants_remaining":0,"helpers_missing":0,"fixed_wait_predicates":0,"autoload_static_failures":0,"asset_chain_failures":0,"dll_patch_failures":0,"native_continue_failures":0,"field58_gate_failures":0,"direct_shortcut_failures":0,"input_path_failures":0,"runtime_proof_failures":0,"runtime_mode_failures":0,"eula_popup_failures":0,"save_data_popup_failures":0,"messagebox_dialog_failures":0,"server_status_failures":0,"title_cover_failures":2,"title_cover_penalty":1800,"native_trace_blockers":0,"native_trace_hits_total":74,"native_trace_unique_breakpoints":11,"false_positives":1,"offline_face_source_ready":1,"removed path_cpu_texture_bridge_ready":0,"offline_face_texture_runtime_drawn":0,"stylized_facedata_pixel_oracle":0,"real_portrait_asset_candidates":0,"profile_placeholder_assets_only":1},"status":"discard","description":"Runtime-tested start-login owned TitleBack diagnostic; old ProfileSelect false-positive still dominated.","timestamp":1782659094685,"segment":2,"confidence":null,"asi":{"hypothesis":"Build owned synthetic TitleBack from the guaranteed start-login hook using grounded two-arg TitleBack ctor semantics, while also enabling the synthetic FileOpener hook, then run a bounded runtime diagnostic to see whether the synthetic er_effects_portrait_cover surface is requested without relying on the missed initial ctor hook.","observed_evidence":"Runtime artifact /home/banon/projects/er-effects-rs/target/runtime-probe/product-continue-direct-20260628-080324 reached world_stable, but false_positives=1. Debug log shows synthetic loader hook installed at +69ms but no synthetic MemoryFile return and no 'built start-login owned TitleBack diagnostic' line. Old ProfileSelect path still fired: built 05_010_ProfileSelect at +15534ms, native SYSTEX/ProfileSelect binds, deferred transform, and ran post-accept custom cover. Logo screenshot read from /home/banon/projects/er-effects-rs/target/runtime-probe/product-continue-direct-20260628-080324/logo-replacement-screenshot.jpg shows blank/cursed LOAD GAME/ProfileSelect panel; analysis black32_ratio=0.4603 and known_false_positive_signature=true. Finding saved to bd memory start-login-owned-titleback-runtime-falsepositive-2026-06-28.","rollback_reason":"Primary metric stayed 0 and false_positives=1. The synthetic TitleBack route did not request the synthetic GFX/MemoryFile and did not displace the old ProfileSelect false-positive path.","next_action_hint":"Do not mix synthetic TitleBack testing with the old ProfileSelect replay/custom-cover run hook. Disable/remove ProfileSelect replay path for the next diagnostic and add explicit debug before/after maybe_build_owned_titleback_from_start_login to prove whether the start-login gate/function is entered."}}
{"run":598,"commit":"978974d","metric":0,"metrics":{"readiness_gate_failures":0,"target_constants_remaining":0,"helpers_missing":0,"fixed_wait_predicates":0,"autoload_static_failures":0,"asset_chain_failures":0,"dll_patch_failures":0,"native_continue_failures":0,"field58_gate_failures":0,"direct_shortcut_failures":0,"input_path_failures":0,"runtime_proof_failures":0,"runtime_mode_failures":0,"eula_popup_failures":0,"save_data_popup_failures":0,"messagebox_dialog_failures":0,"server_status_failures":0,"title_cover_failures":2,"title_cover_penalty":1800,"native_trace_blockers":0,"native_trace_hits_total":74,"native_trace_unique_breakpoints":11,"false_positives":0,"offline_face_source_ready":1,"removed path_cpu_texture_bridge_ready":0,"offline_face_texture_runtime_drawn":0,"stylized_facedata_pixel_oracle":0,"real_portrait_asset_candidates":0,"profile_placeholder_assets_only":1},"status":"discard","description":"Disabled legacy ProfileSelect replay during synthetic TitleBack diagnostic; false-positive cleared but no synthetic surface requested.","timestamp":1782659334387,"segment":2,"confidence":null,"asi":{"hypothesis":"Under ER_EFFECTS_SCALEFORM_SYNTHETIC_TITLEBACK=1, disable the old ProfileSelect replay/custom-cover hook and add explicit start-login owned-TitleBack debug so the diagnostic tests only the synthetic TitleBack/FileOpener route, not the known false-positive ProfileSelect panel.","observed_evidence":"Runtime artifact /home/banon/projects/er-effects-rs/target/runtime-probe/product-continue-direct-20260628-080729 reached world_stable. Debug log: synthetic loader hook installed at +79ms; legacy ProfileSelect MenuWindowJob::Run hook skipped at +36ms; legacy ProfileSelect cover build skipped at +15284ms; no post-accept custom cover run. No 'start-login owned TitleBack diagnostic gate enter', no 'built start-login owned TitleBack', no er_effects_portrait_cover.gfx request, and no synthetic MemoryFile return. User-visible runtime image showed black/checking-save-data screen, not portrait. Finding saved as bd memory synthetic-titleback-profile-replay-disabled-no-startlogin-2026-06-28.","rollback_reason":"Primary metric stayed 0. Secondary false_positives improved to 0, but the route still produced no synthetic surface request and no portrait/native-surface oracle, so it is not keepable under primary-metric loop gates.","next_action_hint":"Do not re-enable ProfileSelect replay. Find a guaranteed later dialog-owned hook point after native title/accept where dialog+0xaa8 exists, or instrument the existing TitleBack ctor/SetVisible hook itself to build/request the synthetic object; then require synthetic URL hits and MemoryFile returns before any visual scoring."}}
{"run":599,"commit":"978974d","metric":0,"metrics":{"readiness_gate_failures":0,"target_constants_remaining":0,"helpers_missing":0,"fixed_wait_predicates":0,"autoload_static_failures":0,"asset_chain_failures":0,"dll_patch_failures":0,"native_continue_failures":0,"field58_gate_failures":0,"direct_shortcut_failures":0,"input_path_failures":0,"runtime_proof_failures":1,"runtime_mode_failures":0,"eula_popup_failures":0,"save_data_popup_failures":0,"messagebox_dialog_failures":0,"server_status_failures":0,"title_cover_failures":2,"title_cover_penalty":1800,"native_trace_blockers":0,"native_trace_hits_total":74,"native_trace_unique_breakpoints":11,"false_positives":0,"offline_face_source_ready":1,"removed path_cpu_texture_bridge_ready":0,"offline_face_texture_runtime_drawn":0,"stylized_facedata_pixel_oracle":0,"real_portrait_asset_candidates":0,"profile_placeholder_assets_only":1},"status":"crash","description":"Ctor-owned synthetic TitleBack requested MemoryFile then crashed before ready.","timestamp":1782659558848,"segment":2,"confidence":null,"asi":{"hypothesis":"Build/request the synthetic TitleBack from the guaranteed TitleBack ctor hook instead of the start-login hook, disable legacy ProfileSelect replay, and exempt the synthetic object from broad native-logo hiding so a synthetic surface can request er_effects_portrait_cover.gfx.","observed_evidence":"Artifact /home/banon/projects/er-effects-rs/target/runtime-probe/product-continue-direct-20260628-081113 failed process_exited_before_ready. Debug log shows ProfileSelect replay skipped, synthetic loader installed, BeginTitle native wrapper preserved, and synthetic Scaleform MemoryFile returned for er_effects_portrait_cover.gfx at +15460ms (file=0x6ffffc41b798, bytes=12174). Crash log /home/banon/projects/er-effects-rs/target/runtime-probe/product-continue-direct-20260628-081113/er-effects-crash-log.txt reports access violation rva=0xe1a2a9 immediately afterward with callers including 0x1124673, 0xce8062, 0x11642ff. Finding saved as bd memory ctor-owned-synthetic-titleback-memoryfile-crash-2026-06-28.","rollback_reason":"Runtime crashed before readiness; no visible custom surface or portrait oracle. Returning a MemoryFile to the ctor-owned synthetic TitleBack path is not safe as implemented.","next_action_hint":"Do not repeat the ctor-owned MemoryFile route unchanged. Statically decode 0x140e1a2a9 and call chain 0x141124673/0x140ce8062/0x1411642ff to identify invalid MemoryFile lifetime/name_ref/file-interface assumptions, or test a byte-identical override of an existing native request rather than a new owned TitleBack."}}
{"run":600,"commit":"978974d","metric":0,"metrics":{"readiness_gate_failures":0,"target_constants_remaining":0,"helpers_missing":0,"fixed_wait_predicates":0,"autoload_static_failures":0,"asset_chain_failures":0,"dll_patch_failures":0,"native_continue_failures":0,"field58_gate_failures":0,"direct_shortcut_failures":0,"input_path_failures":0,"runtime_proof_failures":0,"runtime_mode_failures":0,"eula_popup_failures":0,"save_data_popup_failures":0,"messagebox_dialog_failures":0,"server_status_failures":0,"title_cover_failures":3,"title_cover_penalty":2000,"native_trace_blockers":0,"native_trace_hits_total":74,"native_trace_unique_breakpoints":11,"false_positives":0,"offline_face_source_ready":1,"removed path_cpu_texture_bridge_ready":0,"offline_face_texture_runtime_drawn":0,"stylized_facedata_pixel_oracle":0,"real_portrait_asset_candidates":0,"profile_placeholder_assets_only":1},"status":"discard","description":"Static RE classified synthetic MemoryFile crash as invalid static-storage free; measurement gate stayed at baseline.","timestamp":1782659740472,"segment":2,"confidence":null,"asi":{"hypothesis":"Use static RE of the #599 crash chain before another runtime probe. If the crash is from returning a static DLL-owned Scaleform::MemoryFile, the next safe route should avoid synthetic File returns until the object is allocated with the correct Scaleform heap/allocator.","observed_evidence":"Mapped deobf crash 0x140e1a2a9 to dump 0x140e1a359 in DLKR::DLRobustHeap::Free wrapper FUN_140e1a300. Mapped caller 0x140ce8062 to dump FUN_140ce80d0, a Scaleform RefCount/File destructor path that deallocates via PTR_PTR_144593250. Mapped MemoryFile ctor live 0x140ce7bb0 to dump 0x140ce7c90; it constructs a 0x30-byte Scaleform::MemoryFile at caller-provided storage. Therefore returning a static DLL-owned MemoryFile object was invalid because Scaleform later releases/frees it as heap memory. Finding saved as bd memory memoryfile-static-storage-free-crash-2026-06-28. Measurement gate passed without runtime trigger: /tmp/pi-experiment-c2176cb1aa8c382c.log.","rollback_reason":"Primary metric stayed 0. This iteration produced a useful crash-cause finding but no product-visible portrait surface/oracle and no score improvement.","next_action_hint":"Next implementation should either allocate MemoryFile/File through the same Scaleform heap/allocator before returning it, or avoid synthetic File returns and use an existing native request/owned surface path that does not hand Scaleform a static freeable object. Do not repeat static-storage MemoryFile returns."}}
{"run":601,"commit":"978974d","metric":0,"metrics":{"readiness_gate_failures":0,"target_constants_remaining":0,"helpers_missing":0,"fixed_wait_predicates":0,"autoload_static_failures":0,"asset_chain_failures":0,"dll_patch_failures":0,"native_continue_failures":0,"field58_gate_failures":0,"direct_shortcut_failures":0,"input_path_failures":0,"runtime_proof_failures":1,"runtime_mode_failures":0,"eula_popup_failures":0,"save_data_popup_failures":0,"messagebox_dialog_failures":0,"server_status_failures":0,"title_cover_failures":2,"title_cover_penalty":1800,"native_trace_blockers":0,"native_trace_hits_total":74,"native_trace_unique_breakpoints":11,"false_positives":0,"offline_face_source_ready":1,"removed path_cpu_texture_bridge_ready":0,"offline_face_texture_runtime_drawn":0,"stylized_facedata_pixel_oracle":0,"real_portrait_asset_candidates":0,"profile_placeholder_assets_only":1},"status":"crash","description":"Tried Scaleform-heap MemoryFile allocation; crashed before return log.","timestamp":1782659985741,"segment":2,"confidence":null,"asi":{"hypothesis":"Allocate the synthetic Scaleform::MemoryFile through the same global Scaleform allocator object at PTR_PTR_144593250/vtable+0x50 before calling the MemoryFile ctor, avoiding the previous invalid static-storage free crash. Keep ProfileSelect replay disabled and preserve native Continue/title flow.","observed_evidence":"Artifact /home/banon/projects/er-effects-rs/target/runtime-probe/product-continue-direct-20260628-081850 failed process_exited_before_ready. Debug log shows synthetic loader installed, ProfileSelect hook/build skipped, and BeginTitle native wrapper preserved; it does not show the heap-allocated MemoryFile return log. Crash log reports access violation addr=0x4000 outside game module at +16354ms, suggesting the guessed allocator object/vfunc/call signature was wrong. Finding saved as bd memory scaleform-allocator-vfunc-call-crash-2026-06-28.","rollback_reason":"Runtime crashed before readiness and before returning a MemoryFile; no custom surface or portrait oracle was produced.","next_action_hint":"Do not retry allocator vtable+0x50 blindly. Statically identify a concrete native MemoryFile/File allocation callsite or a real FileOpener allocation/open path, or substitute bytes at a lower layer after original File allocation rather than constructing File objects manually."}}
