{"run":602,"commit":"978974d","metric":0,"metrics":{"readiness_gate_failures":0,"target_constants_remaining":0,"helpers_missing":0,"fixed_wait_predicates":0,"autoload_static_failures":0,"asset_chain_failures":0,"dll_patch_failures":0,"native_continue_failures":0,"field58_gate_failures":0,"direct_shortcut_failures":0,"input_path_failures":0,"runtime_proof_failures":1,"runtime_mode_failures":0,"eula_popup_failures":0,"save_data_popup_failures":0,"messagebox_dialog_failures":0,"server_status_failures":0,"title_cover_failures":2,"title_cover_penalty":1800,"native_trace_blockers":0,"native_trace_hits_total":74,"native_trace_unique_breakpoints":11,"false_positives":0,"offline_face_source_ready":1,"removed path_cpu_texture_bridge_ready":0,"offline_face_texture_runtime_drawn":0,"stylized_facedata_pixel_oracle":0,"real_portrait_asset_candidates":0,"profile_placeholder_assets_only":1},"status":"crash","description":"Corrected allocator arg count for synthetic MemoryFile; same addr=0x4000 crash before return.","timestamp":1782660180230,"segment":2,"confidence":null,"asi":{"hypothesis":"Use the exact native MemoryFile allocation call shape from dump FUN_140ce8320: allocator vfunc+0x50 with six args (allocator, 0x30, 0, 0, 0, -2) before constructing the synthetic MemoryFile, while keeping ProfileSelect replay disabled and native title flow preserved.","observed_evidence":"Artifact /home/banon/projects/er-effects-rs/target/runtime-probe/product-continue-direct-20260628-082210 failed process_exited_before_ready. Debug log shows synthetic loader installed, ProfileSelect hook/build skipped, and BeginTitle native wrapper preserved, but no six-arg allocator MemoryFile return log. Crash log reports access violation addr=0x4000 outside game module at +16026ms. Finding saved as bd memory scaleform-allocator-six-arg-still-crashes-2026-06-28.","rollback_reason":"Runtime crashed before readiness and before returning a MemoryFile; no custom surface or portrait oracle was produced.","next_action_hint":"Do not retry manual allocator+MemoryFile construction. Statically identify the concrete native object layout expected by FUN_140ce8320 and call that wrapper with a native-shaped object, or abandon synthetic File objects for a lower-layer byte substitution path."}}
{"run":603,"commit":"978974d","metric":0,"metrics":{"readiness_gate_failures":0,"target_constants_remaining":0,"helpers_missing":0,"fixed_wait_predicates":0,"autoload_static_failures":0,"asset_chain_failures":0,"dll_patch_failures":0,"native_continue_failures":0,"field58_gate_failures":0,"direct_shortcut_failures":0,"input_path_failures":0,"runtime_proof_failures":0,"runtime_mode_failures":0,"eula_popup_failures":0,"save_data_popup_failures":0,"messagebox_dialog_failures":0,"server_status_failures":0,"title_cover_failures":3,"title_cover_penalty":2000,"native_trace_blockers":0,"native_trace_hits_total":74,"native_trace_unique_breakpoints":11,"false_positives":0,"offline_face_source_ready":1,"removed path_cpu_texture_bridge_ready":0,"offline_face_texture_runtime_drawn":0,"stylized_facedata_pixel_oracle":0,"real_portrait_asset_candidates":0,"profile_placeholder_assets_only":1},"status":"discard","description":"Static RE grounded native MemoryFile wrapper as GfxRepository rescap consumer, not general File factory.","timestamp":1782660255597,"segment":2,"confidence":null,"asi":{"hypothesis":"Decode native FUN_140ce8320 and caller FUN_140d6b580 to determine whether the correct route is to call a wrapper with a native-shaped object rather than manually allocating/constructing Scaleform::MemoryFile.","observed_evidence":"Ghidra decompile shows FUN_140d6b580 looks up the requested filename in GLOBAL_GfxRepository via FUN_140ce7810(GLOBAL_GfxRepository, wide_name), which calls FD4ResCapHolder::GetResCap<T>(GLOBAL_GfxRepository+0x78,...). Only a nonzero returned resource-cap object is passed to FUN_140ce8320. FUN_140ce8320 expects param_1 to have name/string fields at +0x18/+0x30 and payload pointer/size at +0x78/+0x80; it is a native GFX resource-cap to MemoryFile wrapper, not a general File factory. Finding saved as bd memory native-memoryfile-wrapper-expects-gfx-rescap-2026-06-28. Static measurement gate passed without runtime trigger: /tmp/pi-experiment-1ea3e13788bafe4c.log.","rollback_reason":"Primary metric stayed 0; the iteration produced a route-correction finding but no implemented visible portrait surface/oracle.","next_action_hint":"Stop returning ad-hoc File objects from FileOpener. Next route is either register/insert a native GfxRepository resource cap for custom GFX, or hook/substitute an existing native GFX request/resource-cap payload after repository lookup."}}
{"run":604,"commit":"978974d","metric":0,"metrics":{"readiness_gate_failures":0,"target_constants_remaining":0,"helpers_missing":0,"fixed_wait_predicates":0,"autoload_static_failures":0,"asset_chain_failures":0,"dll_patch_failures":0,"native_continue_failures":0,"field58_gate_failures":0,"direct_shortcut_failures":0,"input_path_failures":0,"runtime_proof_failures":0,"runtime_mode_failures":0,"eula_popup_failures":0,"save_data_popup_failures":0,"messagebox_dialog_failures":0,"server_status_failures":0,"title_cover_failures":2,"title_cover_penalty":1800,"native_trace_blockers":0,"native_trace_hits_total":74,"native_trace_unique_breakpoints":11,"false_positives":0,"offline_face_source_ready":1,"removed path_cpu_texture_bridge_ready":0,"offline_face_texture_runtime_drawn":0,"stylized_facedata_pixel_oracle":0,"real_portrait_asset_candidates":0,"profile_placeholder_assets_only":1},"status":"discard","description":"Repository alias synthetic TitleBack preserved runtime but graphic did not resolve or appear.","timestamp":1782660606129,"segment":2,"confidence":null,"asi":{"hypothesis":"Avoid ad-hoc File/MemoryFile objects by hooking the native Scaleform/GfxRepository load helper and aliasing the synthetic er_effects_portrait_cover request to an existing native 05_000_Title resource. Keep ProfileSelect replay disabled and preserve native Continue/load.","observed_evidence":"Artifact /home/banon/projects/er-effects-rs/target/runtime-probe/product-continue-direct-20260628-082715 reached world_stable with false_positives=0 and no crash. Debug log shows repository load alias hook installed at 0x140d6b4d0, legacy ProfileSelect hook/build skipped, synthetic er_effects_portrait_cover request aliased to 05_000_Title at +15247ms, and owned synthetic TitleBack object built at +15248ms. Alias returned 0x0, no logo-replacement screenshot/event was produced, and user observed the actual screen was the title-logo screen with the title logo hidden rather than our graphic. Finding saved as bd memory repository-alias-titleback-safe-but-ret0-and-hide-risk-2026-06-28.","rollback_reason":"Primary metric stayed 0. The route is safer than ad-hoc File objects but still did not resolve/render the synthetic graphic and did not produce a portrait/native-surface oracle.","next_action_hint":"Address both blockers: find the exact repository key/canonical path that makes 05_000_Title lookup return nonzero or hook after FUN_140ce7810 to inspect real lookup keys/rescap pointers; also exempt the owned TitleBack object/range before construction or disable broad SetVisible hiding under the synthetic diagnostic gate, because current Part-A hiding can hide synthetic surfaces too."}}
{"run":605,"commit":"978974d","metric":0,"metrics":{"readiness_gate_failures":0,"target_constants_remaining":0,"helpers_missing":0,"fixed_wait_predicates":0,"autoload_static_failures":0,"asset_chain_failures":0,"dll_patch_failures":0,"native_continue_failures":0,"field58_gate_failures":0,"direct_shortcut_failures":0,"input_path_failures":0,"runtime_proof_failures":0,"runtime_mode_failures":0,"eula_popup_failures":0,"save_data_popup_failures":0,"messagebox_dialog_failures":0,"server_status_failures":0,"title_cover_failures":2,"title_cover_penalty":1800,"native_trace_blockers":0,"native_trace_hits_total":74,"native_trace_unique_breakpoints":11,"false_positives":1,"offline_face_source_ready":1,"removed path_cpu_texture_bridge_ready":0,"offline_face_texture_runtime_drawn":0,"stylized_facedata_pixel_oracle":0,"real_portrait_asset_candidates":0,"profile_placeholder_assets_only":1},"status":"discard","description":"Observe-only GfxRepository hook captured canonical menu keys; legacy ProfileSelect false-positive remained.","timestamp":1782660768170,"segment":2,"confidence":null,"asi":{"hypothesis":"Install an observe-only hook on the native Scaleform/GfxRepository load helper at deobf 0x140d6b4d0 to capture real canonical GFX keys and return values, without synthetic File objects or aliasing.","observed_evidence":"Artifact /home/banon/projects/er-effects-rs/target/runtime-probe/product-continue-direct-20260628-083136 reached world_stable but false_positives=1 because legacy ProfileSelect replay remained active. Observer logs show canonical repository keys are full paths with extension, e.g. data0:/menu/05_010_profileselect.gfx returned nonzero 0x7ffe957d9150 with p3=0x21 p4=0x1b6. This explains raw alias 05_000_Title ret=0 in #604. Screenshot analysis showed known false positive black32_ratio=0.4637. Finding saved as bd memory gfxrepository-observer-canonical-keys-2026-06-28.","rollback_reason":"Primary metric stayed 0 and false_positives=1. The observer finding is useful, but this run did not implement a visible portrait surface or avoid the legacy false-positive path.","next_action_hint":"Next alias test should use canonical key data0:/menu/05_000_title.gfx, disable legacy ProfileSelect replay, and exempt/disable broad SetVisible hiding for the synthetic TitleBack before construction."}}
{"run":606,"commit":"978974d","metric":0,"metrics":{"readiness_gate_failures":0,"target_constants_remaining":0,"helpers_missing":0,"fixed_wait_predicates":0,"autoload_static_failures":0,"asset_chain_failures":0,"dll_patch_failures":0,"native_continue_failures":0,"field58_gate_failures":0,"direct_shortcut_failures":0,"input_path_failures":0,"runtime_proof_failures":1,"runtime_mode_failures":0,"eula_popup_failures":0,"save_data_popup_failures":0,"messagebox_dialog_failures":0,"server_status_failures":0,"title_cover_failures":2,"title_cover_penalty":1800,"native_trace_blockers":0,"native_trace_hits_total":74,"native_trace_unique_breakpoints":11,"false_positives":0,"offline_face_source_ready":1,"removed path_cpu_texture_bridge_ready":0,"offline_face_texture_runtime_drawn":0,"stylized_facedata_pixel_oracle":0,"real_portrait_asset_candidates":0,"profile_placeholder_assets_only":1},"status":"crash","description":"Canonical repository alias resolved existing title GFX but duplicate TitleBack object crashed later.","timestamp":1782660949758,"segment":2,"confidence":null,"asi":{"hypothesis":"Use canonical repository key data0:/menu/05_000_title.gfx for the synthetic TitleBack alias, disable legacy ProfileSelect replay, and pre-exempt the synthetic object from the broad SetVisible hide by storing the object address before ctor.","observed_evidence":"Artifact /home/banon/projects/er-effects-rs/target/runtime-probe/product-continue-direct-20260628-083445 failed process_exited_before_ready. Alias succeeded: debug log shows repository-alias synthetic er_effects_portrait_cover -> data0:/menu/05_000_title.gfx returned nonzero 0x7ffe90476eb0 at +15110ms, and built repository-alias synthetic TitleBack object at +15113ms. User observed distorted title menu/black screen, not portrait. Crash log reports access violation rva=0x7ffd503d71b0 addr=0x7ffe903d71b0 at +17278ms. ProfileSelect replay was disabled. Finding saved as bd memory canonical-repository-alias-resolves-but-titleback-crashes-2026-06-28.","rollback_reason":"Runtime crashed before readiness, and even before crash the visible result was a duplicated/distorted title surface, not a portrait cover. Duplicate TitleBackViewParts construction with existing title GFX is not lifecycle-safe as implemented.","next_action_hint":"Do not duplicate TitleBackViewParts with existing title GFX. Use the existing native TitleBackViewParts/logo object and substitute its rescap/payload at repository lookup/bind time with careful SetVisible exemption, or statically decode a truly safe separate owner/lifecycle before constructing another surface."}}
{"run":607,"commit":"978974d","metric":0,"metrics":{"readiness_gate_failures":0,"target_constants_remaining":0,"helpers_missing":0,"fixed_wait_predicates":0,"autoload_static_failures":0,"asset_chain_failures":0,"dll_patch_failures":0,"native_continue_failures":0,"field58_gate_failures":0,"direct_shortcut_failures":0,"input_path_failures":0,"runtime_proof_failures":0,"runtime_mode_failures":0,"eula_popup_failures":0,"save_data_popup_failures":0,"messagebox_dialog_failures":0,"server_status_failures":0,"title_cover_failures":3,"title_cover_penalty":2000,"native_trace_blockers":0,"native_trace_hits_total":74,"native_trace_unique_breakpoints":11,"false_positives":1,"offline_face_source_ready":1,"removed path_cpu_texture_bridge_ready":0,"offline_face_texture_runtime_drawn":0,"stylized_facedata_pixel_oracle":0,"real_portrait_asset_candidates":0,"profile_placeholder_assets_only":1},"status":"discard","description":"Static RE confirmed duplicate TitleBackViewParts lacks safe native lifecycle; use existing dialog object.","timestamp":1782661070461,"segment":2,"confidence":null,"asi":{"hypothesis":"Statically decode TitleBackViewParts ctor/dtor/SetVisible and the TitleTopDialog start-login usage to confirm whether #606 crashed because a duplicate DLL-static TitleBackViewParts lacks native dialog ownership/lifetime.","observed_evidence":"Ghidra: TitleBackViewParts ctor dump 0x1409a62d0/live 0x1409a6180 sets vtable, constructs embedded MenuResource at this+0x8, then calls FUN_140749290(this+0x8, this+0x70) to build SceneObjProxy. Non-deleting dtor dump 0x1409a6330 destroys CSScaleformValue at this+0x98 and MenuResource at this+0x8. SetVisible dump 0x1409a6410 forwards to SceneObjProxy at this+0x70. TitleTopDialog start-login dump 0x1409b3050 uses dialog+0xaa8 and calls SetVisible(1). Finding saved as bd memory titleback-existing-object-lifecycle-static-2026-06-28. Static measurement gate passed without runtime trigger: /tmp/pi-experiment-e0475180567e17ce.log.","rollback_reason":"Primary metric stayed 0. This produced a static direction finding but no implemented visible portrait surface/oracle.","next_action_hint":"Next implementation should reuse the existing dialog+0xaa8 TitleBackViewParts/MenuResource/SceneObjProxy or substitute its repository payload/bind path, not construct a duplicate TitleBackViewParts. Scope SetVisible hiding to the native logo object or explicitly exempt replacement surfaces."}}
{"run":608,"commit":"978974d","metric":0,"metrics":{"readiness_gate_failures":0,"target_constants_remaining":0,"helpers_missing":0,"fixed_wait_predicates":0,"autoload_static_failures":0,"asset_chain_failures":0,"dll_patch_failures":0,"native_continue_failures":0,"field58_gate_failures":0,"direct_shortcut_failures":0,"input_path_failures":0,"runtime_proof_failures":0,"runtime_mode_failures":0,"eula_popup_failures":0,"save_data_popup_failures":0,"messagebox_dialog_failures":0,"server_status_failures":0,"title_cover_failures":2,"title_cover_penalty":1800,"native_trace_blockers":0,"native_trace_hits_total":74,"native_trace_unique_breakpoints":11,"false_positives":0,"offline_face_source_ready":1,"removed path_cpu_texture_bridge_ready":0,"offline_face_texture_runtime_drawn":0,"stylized_facedata_pixel_oracle":0,"real_portrait_asset_candidates":0,"profile_placeholder_assets_only":1},"status":"discard","description":"Runtime-tested existing TitleBack repository alias to ProfileSelect; stable but placeholder-only.","timestamp":1782661306863,"segment":2,"confidence":null,"asi":{"hypothesis":"Reuse the existing dialog-owned TitleBackViewParts/05_001_Title_Logo object and alias its repository request to data0:/menu/05_010_profileselect.gfx under an explicit gate, avoiding duplicate TitleBack construction and legacy ProfileSelect job replay.","observed_evidence":"Runtime artifact /home/banon/projects/er-effects-rs/target/runtime-probe/product-continue-direct-20260628-084029 passed measure without crash. Debug: repository hook installed at 0x140d6b4d0; alias hit at +15374ms from 05_001_Title_Logo to data0:/menu/05_010_profileselect.gfx with ret=0x7ffe94ed4650; legacy ProfileSelect replay and MenuWindowJob::Run hook skipped; SetVisible hide bypassed under alias gate. User-visible screenshot showed a ProfileSelect-like list on the title surface with gray placeholder face blocks, dummy text/Level 999, and Press Any Button overlay—not the loaded-character portrait. Product still failed because Continue slot profile was empty-like (slot=0 map=0xffffffff level=0 name_len=0), no native submit/load, title_cover_failures=2. Finding saved as bd memory existing-titleback-profileselect-alias-stable-but-placeholder-2026-06-28.","rollback_reason":"Primary metric stayed 0. The route is stable and clears the duplicate-object crash/false-positive issue, but it displays placeholder ProfileSelect UI rather than a real loaded-character portrait and does not satisfy product load proof.","next_action_hint":"Keep the existing dialog+0xaa8 alias route, but do not use full ProfileSelect payload as product. Next bind/refresh SYSTEX_Menu_Profile00 through the existing surface's valid owner/resource or use a smaller/custom GFX with only the dummy face symbol; do not replay ProfileSelect jobs or construct duplicate TitleBackViewParts."}}
{"run":609,"commit":"978974d","metric":0,"metrics":{"readiness_gate_failures":0,"target_constants_remaining":0,"helpers_missing":0,"fixed_wait_predicates":0,"autoload_static_failures":0,"asset_chain_failures":0,"dll_patch_failures":0,"native_continue_failures":0,"field58_gate_failures":0,"direct_shortcut_failures":0,"input_path_failures":0,"runtime_proof_failures":0,"runtime_mode_failures":0,"eula_popup_failures":0,"save_data_popup_failures":0,"messagebox_dialog_failures":0,"server_status_failures":0,"title_cover_failures":2,"title_cover_penalty":1800,"native_trace_blockers":0,"native_trace_hits_total":74,"native_trace_unique_breakpoints":11,"false_positives":0,"offline_face_source_ready":1,"removed path_cpu_texture_bridge_ready":0,"offline_face_texture_runtime_drawn":0,"stylized_facedata_pixel_oracle":0,"real_portrait_asset_candidates":0,"profile_placeholder_assets_only":1},"status":"discard","description":"Static RE confirmed existing TitleBack alias needs ProfileSelect binding constructor.","timestamp":1782661399154,"segment":2,"confidence":null,"asi":{"hypothesis":"Static RE the missing bind/refresh layer after #608: the existing TitleBack ProfileSelect alias displays placeholder list UI because the GFX load does not execute the native SYSTEX_Menu_Profile00 binding pass.","observed_evidence":"Runtime #608 telemetry had oracle_title_scaleform_bind_observer_hits=0 and systex_hits=0, while oracle_native_profile_source_ready=true and SYSTEX_Menu_Profile00 source existed. Ghidra decompile of FUN_1407452c0 shows it validates pair strings, touches owner+0x60 via FUN_140748700, then calls FUN_140d6ac00(GLOBAL_CSScaleform, owner, target, symbol). Xrefs/decompile of ProfileSelectDialog ctor FUN_1409a5310 show it constructs MENU_DummyProfileFace_01..10 / SYSTEX_Menu_Profile00..09 pairs and calls FUN_1407452c0 on &(param_1->super_MenuWindow).field553_0x3b8, a MenuWindow/ProfileSelect owner field. Finding saved as bd memory existing-titleback-alias-needs-profile-binding-constructor-2026-06-28. Measure gate passed at /tmp/pi-experiment-7cb152052dfa5df4.log.","rollback_reason":"Primary metric stayed 0. This static iteration produced direction only; no visible loaded-character portrait binding/oracle was implemented.","next_action_hint":"Do not merely alias GFX and do not raw-call FUN_1407452c0 against TitleBackViewParts+0x8. Next prove whether TitleBackViewParts/MenuResource can host FUN_1407452c0 after construction, or build/reuse a minimal valid MenuWindow/ProfileSelect-like bind owner (+0x3b8 with owner+0x60 initialized) without replaying modal list behavior."}}
